"companyid","keydevid","transcriptid","headline","mostimportantdateutc","keydeveventtypename","companyname","speakertypename","componenttextpreview","word_count","componenttext"
281407,84286553,49160,"International Flavors & Fragrances Inc., Q4 2009 Earnings Call, Feb-09-2010",2010-02-09,"Earnings Calls","International Flavors & Fragrances Inc.","Operator","With that there are no other questions in the roster. I will turn things back over to our speakers for additional or closing remarks.",24,"With that there are no other questions in the roster. I will turn things back over to our speakers for additional or closing remarks.
"
281407,84286553,49160,"International Flavors & Fragrances Inc., Q4 2009 Earnings Call, Feb-09-2010",2010-02-09,"Earnings Calls","International Flavors & Fragrances Inc.","Executives","Thank you all for your attendance today, and there was a follow-up question which comes through Michael DeVeau which we'll happily answer, and I will look forward to talk to you the quarter. Thank you.",35,"Thank you all for your attendance today, and there was a follow-up question which comes through Michael DeVeau which we'll happily answer, and I will look forward to talk to you the quarter. Thank you.
"
281407,84286553,49160,"International Flavors & Fragrances Inc., Q4 2009 Earnings Call, Feb-09-2010",2010-02-09,"Earnings Calls","International Flavors & Fragrances Inc.","Operator","Thanks once more for joining us everyone. That will conclude today’s call. Again, thank you for joining us.",18,"Thanks once more for joining us everyone. That will conclude today’s call. Again, thank you for joining us.

"
281407,100068579,59982,"International Flavors & Fragrances Inc., Q1 2010 Earnings Call, May-06-2010",2010-05-06,"Earnings Calls","International Flavors & Fragrances Inc.","Operator","At this time, I'd like to welcome you to the International Flavors & Fragrances first quarter 2010 earnings conference call. All participants will be on a listen-only mode until the formal question and answer portion of the call. Participants will be anno",83,"At this time, I'd like to welcome you to the International Flavors & Fragrances first quarter 2010 earnings conference call. All participants will be on a listen-only mode until the formal question and answer portion of the call. Participants will be announced by their name and company and in order to give all participants an opportunity to ask a question, we request a limit of one question per person.
I would now like to introduce Michael DeVeau, Investor Relations Manager. You may begin.
"
281407,100068579,59982,"International Flavors & Fragrances Inc., Q1 2010 Earnings Call, May-06-2010",2010-05-06,"Earnings Calls","International Flavors & Fragrances Inc.","Executives","Thank you, operator, and thanks everyone for joining us this morning. With me on the call is our Chairman and CEO, Doug Tough, our Group President, Flavors, Hernan Vaisman, our Group President of Fragrances, Nicolas Mirzayantz and our Executive Vice Presi",175,"Thank you, operator, and thanks everyone for joining us this morning. With me on the call is our Chairman and CEO, Doug Tough, our Group President, Flavors, Hernan Vaisman, our Group President of Fragrances, Nicolas Mirzayantz and our Executive Vice President and CFO, Kevin Berryman.
This call is being recorded and will be available for playback on our website. Please keep in mind that during this call, we may make forward-looking statements about the company's performance. These statements are based on how we see things today and may contain elements of uncertainty. For additional information concerning risk factors that can cause actual results to differ materially from forward-looking statements, I ask you to refer to the cautionary statements and risk factors contained in today's earnings release and IFF's filing with the FCC. Some of today's prepared remarks will exclude those items that affect comparability. These items are laid out in our non-GAAP reconciliation, which is also available under the Investor Relations section of our website.
With that, I'll like to turn the call to Doug.
"
281407,100068579,59982,"International Flavors & Fragrances Inc., Q1 2010 Earnings Call, May-06-2010",2010-05-06,"Earnings Calls","International Flavors & Fragrances Inc.","Executives","Thank you, Michael. Good morning, good afternoon to everyone. Before moving on to discuss our very strong Q1 results, I'd like to make a few introductory comments. As you know, effective March 1st of this year, I officially joined IFF full time as Chairma",985,"Thank you, Michael. Good morning, good afternoon to everyone. Before moving on to discuss our very strong Q1 results, I'd like to make a few introductory comments. As you know, effective March 1st of this year, I officially joined IFF full time as Chairman and Chief Executive Officer. While it's still premature for me to make comments regarding any actions we might take on any possible changes to the strategic focus for IFF, I'd like to elaborate on some key items on which I will be focused.
Priority number one is to pressure test our current strategies and our business model to ensure we are operating to the best of our ability. While it is early in our review, I will say that my initial expectations of the organization I had prior to joining are no different after my first 60 days. I continue to believe that the IFF team has tremendous people and capabilities that provide our customers with winning products which translate into profitable growth for IFF.
Second, as I begin my new journey, it'll be imperative to ensure we continue to accelerate our short-term performance. The executive team as well as all IFF employees have done a very nice job delivering strong results in the back half of 2009 and in the first quarter of 2010. Capitalizing on this success, I expect we will continue to deliver on current commitments while reviewing options regarding our long-term strategies.
Finally, at the very heart of our organization, our most important asset are people as a critical priority. I believe that this organization has incredible talent as my objective to nurture and align that talent in such a way that I can ensure our future leaders of tomorrow are being developed from within the organization today.
I have taken a considerable amount of time to meet with many IFF employees and functions throughout various parts of the world to learn the issues and to provide a sense of my priorities and expectations. I will continue this process over the upcoming few months until I have reached all of our major constituents.
While I am focused on the long-term objectives, our organization remains committed to furthering our partnerships with key stakeholders. Starting with our customers, we continue to be an innovator of technological advancements versus a mere component of the supply chain.
Utilizing our capabilities and consumer insight in R&D and in creative insight, we partner with our key customers to create unique scent and taste experiences that our consumers love. This in turn helps bolster our customer's market share and helps grow the equity of their brands. If we continue to do this while providing overall superior customer satisfaction, we believe it will lead to increased customer loyalty that in turn drive our future business.
In order to continue to create shareholder value, we must ensure we are capable of driving consistent and sustainable long-term growth. Our recent results are an example of our financial potential. Our priorities going forward must focus on growing our top line, accelerating our productivity and investing in future growth in order to ensure that we are maximizing shareholder returns.
We also understand that our responsibility extends to being strong partners in the communities where we work and live and vigilance around our commitment to sustainability, through IFF charitable giving, we are proud to be able to provide financial support and countless hours of employee volunteerism to many community-based organizations.
And last, but not least, we will continue to support our valued employees. As our people represent a large component of our success as well as a competitive advantage, the people of IFF are a critical focus for me. As such, some additional comments are appropriate.
Our business comes to light through the 5,400 or so employees who create our unique scent and taste experiences. Without their passion, their dedication and creativity, we would not be who we are today. Our executive leadership team is seasoned and talented. As I stated earlier, these individuals have done a terrific job during the period of recent transition.
I am very confident that they will achieve even greater success as we work collectively to elevate IFF's performance to new heights in the new decade. We think our global teams including our creative and our R&D employees are the best in the industry. Their leadership from South Brunswick to Sao Paulo from Moscow to Manoa gives us local marketplace knowledge, great continuity and the ability to connect with communities and customers where we do business.
We will dedicate resources to ensure they continue to excel in their area of expertise. And I'm committed to giving them opportunities that will help them succeed in their careers. These offices interface with our customers to deliver superior solutions. I have seen firsthand results of this labor by attending numerous meetings with many of our customers, both global and regional. These customers fully respect IFF's creativity, ability to understand their needs and IFF's pension for providing winning solutions.
Now before turning over to the rest of the team, I'd like to make a few comments on our Q1 performance. The improved trends in the second half of 2009 continued through the first quarter of this year. Our strong new business performance combined with some elements of customer restocking and favorable comparisons resulted in accelerated levels of growth.
Our worldwide local currency sales grew 13% year-over-year as the commercial environment continued to show improvement versus the full year of 2009. This growth in our top line, when combined with continued discipline in cost management, supported a substantial improvement in margin as operating profit margin improved 220 basis points year-on-year. The end result was extremely positive, as adjusted earnings per share increased 42% year-on-year.
With that, I'm now pleased to introduce our Global President of Flavors, Hernan Vaisman who will provide further context surrounding our strong Q1 results in Flavors.
"
281407,100068579,59982,"International Flavors & Fragrances Inc., Q1 2010 Earnings Call, May-06-2010",2010-05-06,"Earnings Calls","International Flavors & Fragrances Inc.","Executives","Thank you, Doug. Good morning, everyone. I'm pleased to say that local currency sales in the first quarter increased 8% over the comparable 2009 period, marking the 19th consecutive quarter of local currency growth. Our strong performance was led by doubl",580,"Thank you, Doug. Good morning, everyone. I'm pleased to say that local currency sales in the first quarter increased 8% over the comparable 2009 period, marking the 19th consecutive quarter of local currency growth. Our strong performance was led by double-digit growth in Europe, Africa, Middle East and Greater Asia regions, as increased volumes and new business dropped results. In North America, local currency sales declined 1% due to the overall drop in volume which was not upset by new successes.
While we hope for better results, we are prepared to put this one quarter performance with the overall context of the strong growth we have seen in North America over the last years and especially versus our most difficult comparison of 2009 of flat 6% growth. We continue to feel good about our long-term share growth opportunities in these regions as we work with our customers and new business opportunities.
In EAME, local currency sales increased 12% year-over-year, as both categories were positive. In particular, the Flavors category continues to perform very well as new wins and stronger volumes are giving results. This marks the second consecutive quarter of double-digit growth in these categories. Regionally, it was high single-digit growth in developed countries while developing European markets grew at double-digit growth.
Africa, our Middle East market posted high double-digit growth into new wins and higher volumes across all categories. Sales in Latin America have reversed recent trends, growing 6% as new business and volume recovering Savory, Confectionary and Dairy offset the loss of non-strategic business that began in third quarter of 2009. We finished extremely positive above these results and we expect an accelerating growth base in the second semester due to critical wins in key categories.
Lastly, in Greater Asia, local currency sales were up 14%, as every category recorded impressive double-digit growth. The great momentum of our business in India, China and most Asian countries contributed substantially to the double-digit growth in this important part of the world. This was fueled by higher volumes and new wins across all categories and strategic customers.
While our track record of local currency sales growth is impressive, the level reported in the first quarter of 2010 marks one of the highest achievements. The Flavors teams continued to do an excellent job capitalizing on new business opportunities to drive above-market growth.
Further, our outstanding consumer understanding, unique product portfolio and differentiating test solutions help us to fully support our customers from positioning, making the effect the unique department in the creation of winning consumer products.
Turning to profit, Flavors operating profit in the quarter was very strong, increasing 17%, or $9 million to $62 million. This increase can be attributed to accelerated sales growth, improving input cost dynamic and our continuous success in improving our efficiencies.
As a result, operating profit margin continued to improve, increasing 60 basis points to 20.5% versus 19.9% in the prior year period. While we are very early in Q1 - in Q2, sorry, we have started the quarter with good momentum.
While it remains difficult to predict some element of our performance due to the volatility in our customer ordering patterns. We do expect to see solid local currencies - solid local currencies sales growth, that when combined with our continued focus on improving efficiency to result in continued margin improvement.
Now I would like to turn the call over to Global President of Fragrances Mirzayantz, who will provide an update on the Fragrance business.
"
281407,100068579,59982,"International Flavors & Fragrances Inc., Q1 2010 Earnings Call, May-06-2010",2010-05-06,"Earnings Calls","International Flavors & Fragrances Inc.","Executives","Thank you, Hernan, and good morning and good afternoon, everyone. In Q1, local currency sales grew 18% year-over-year marking the third consecutive quarter of growth. Overall growth can be attributed to the (inaudible) strong base of new wins, some elemen",600,"Thank you, Hernan, and good morning and good afternoon, everyone. In Q1, local currency sales grew 18% year-over-year marking the third consecutive quarter of growth. Overall growth can be attributed to the (inaudible) strong base of new wins, some elements of customer and retailer restocking, improvement in underlying demand and favorable comparisons versus a year-ago period. In terms of performance, we grew double-digit in all regions, as well as every category.
In the Fine Fragrance and Beauty Care category, local currency sales grew 28%. Fine Fragrance has reversed its recent trends, growing very strong double-digits. The success can be accredited to the team's constant commitment to win new business and grow market share position.
In 2009, our Fine Fragrance team was successful in maintaining our market share and showed the ability to win new business by securing many of the key launches of 2010. This combination has proven to be beneficial in Q1.
When new business gains has helped support the strong Fine Fragrance results, I believe it is important to note that a portion of this improvement can be attributed to favorable comparisons as well as elements of customer and retailer restocking. While the elements of restocking are difficult to predict, I am confident that our team will continue to perform well, driven by our strong new business performance.
Turning to Beauty Care, the momentum we experienced in the second half of 2009 continued in 2010. For the fifth consecutive quarter, we have seen accelerated growth in the Beauty Care category as both Hair Care and Toiletries increased double digits. The strong performance can be attributed to successful introductions within key regions.
Functional Fragrance once again performed very well growing 10%, as Fabric Care performance remains strong. Our success continues to be accredited to a long standing expertise and continued investment in consumer insight within the key emerging market as well as Europe. This investment in category expertise are the primary drivers behind our consistent above-market growth. In addition, Home Care and Personal Wash also exhibited solid growth.
Finally, Fragrance Ingredient sales also improved. Local currency sales increased 21%, reflecting an underlying improvement in demand, some elements of customer's restocking and a favorable comparison versus a year-ago period.
Continuing on the trends since last year, the emerging markets of Brazil, Russia, India and China drove strong results. In this market, Hair Care, Fabric Care and Personal Wash continue to drive strong double-digit results. While this trend is impressive, I'd like to note that the developed markets of Europe and North America have also grown strong double-digits. I'm very proud of all Fragrance employees around the world as they accomplished great success in the first quarter.
From a profitability standpoint, adjusted operating profit grew an impressive 66% or $24 million to $61 million, excluding a $5 million expense related to a previously announced European facilities rationalization. As a result, adjusted operating profit margin for the quarter increased 470 basis points to 17.2% as higher volumes, moderating input cost and benefits from previous cost reductions initiatives drove the impressive performance.
As we look toward Q2 and beyond, we do note that our underlying business trends remain strong. While these trends have helped support our strong business results, it is important to note that a portion of this improvement can be attributed to customer and retailer restocking. While it's difficult to predict the effort of restocking for the balance of the year, we do not expect that these benefits will continue as our customers reach their targeted inventory levels going forward.
With that, I'd like to turn the call over to Kevin.
"
