"companyid","keydevid","transcriptid","headline","mostimportantdateutc","keydeveventtypename","companyname","speakertypename","componenttextpreview","word_count","componenttext"
281407,109383082,74013,"International Flavors & Fragrances Inc., Q2 2010 Earnings Call, Aug-05-2010",2010-08-05,"Earnings Calls","International Flavors & Fragrances Inc.","Executives","With four children, I have to be very good with that.",11,"With four children, I have to be very good with that.
"
281407,109383082,74013,"International Flavors & Fragrances Inc., Q2 2010 Earnings Call, Aug-05-2010",2010-08-05,"Earnings Calls","International Flavors & Fragrances Inc.","Analysts","Okay, thanks.",2,"Okay, thanks.
"
281407,109383082,74013,"International Flavors & Fragrances Inc., Q2 2010 Earnings Call, Aug-05-2010",2010-08-05,"Earnings Calls","International Flavors & Fragrances Inc.","Operator","You have a follow-up from the line of Mimi Noel with Sidoti & Company",15,"You have a follow-up from the line of Mimi Noel with Sidoti & Company
"
281407,109383082,74013,"International Flavors & Fragrances Inc., Q2 2010 Earnings Call, Aug-05-2010",2010-08-05,"Earnings Calls","International Flavors & Fragrances Inc.","Analysts","Thank you. Just one more quick question, Kevin and Doug. If you wouldn’t mind expanding a little bit on your thoughts on your supply chain right now, clearly your staff rose to the occasion, but what sort of constraints do you see beyond just IFF’s in",46,"Thank you. Just one more quick question, Kevin and Doug. If you wouldn’t mind expanding a little bit on your thoughts on your supply chain right now, clearly your staff rose to the occasion, but what sort of constraints do you see beyond just IFF’s internals?

"
281407,109383082,74013,"International Flavors & Fragrances Inc., Q2 2010 Earnings Call, Aug-05-2010",2010-08-05,"Earnings Calls","International Flavors & Fragrances Inc.","Executives","Help me understand the last part of that question a little bit more please.",14,"Help me understand the last part of that question a little bit more please.
"
281407,109383082,74013,"International Flavors & Fragrances Inc., Q2 2010 Earnings Call, Aug-05-2010",2010-08-05,"Earnings Calls","International Flavors & Fragrances Inc.","Analysts","Sure, sure. What sort of constraints do you see beyond, in looking at your supply chain, what are some external pressures that you’ve had to offset?",26,"Sure, sure. What sort of constraints do you see beyond, in looking at your supply chain, what are some external pressures that you’ve had to offset?
"
281407,109383082,74013,"International Flavors & Fragrances Inc., Q2 2010 Earnings Call, Aug-05-2010",2010-08-05,"Earnings Calls","International Flavors & Fragrances Inc.","Executives","I think one thing that certainly has been a challenge in the first half is access to materials. When you are growing at the kind of levels that we’ve had, the supply chain organization did a really great job in ensuring that we had access to materials,",130,"I think one thing that certainly has been a challenge in the first half is access to materials. When you are growing at the kind of levels that we’ve had, the supply chain organization did a really great job in ensuring that we had access to materials, and I think that that’s a tribute to the flexibility and dynamic nature of this company to be able to react very quickly to ensure that we were able to continue to provide the service levels to our customers.
So, I think that that’s been one element. I think longer term we have to make sure that we have the capacities and the ability to satisfy what we consider to be some growth opportunities, and certainly those growth opportunities in the emerging markets.
"
281407,109383082,74013,"International Flavors & Fragrances Inc., Q2 2010 Earnings Call, Aug-05-2010",2010-08-05,"Earnings Calls","International Flavors & Fragrances Inc.","Analysts","Are you seeing any areas of cost inflation in your supply chain? I mean, I know you mentioned oil by way of examples, but do you have anything more concrete?",30,"Are you seeing any areas of cost inflation in your supply chain? I mean, I know you mentioned oil by way of examples, but do you have anything more concrete?
"
281407,109383082,74013,"International Flavors & Fragrances Inc., Q2 2010 Earnings Call, Aug-05-2010",2010-08-05,"Earnings Calls","International Flavors & Fragrances Inc.","Executives","No, we’ll not talk any more details on that. As you know, Mimi we have a very, very dispersed set of materials that we use in the manufacturing of our portfolio products to the customers. So, there is always pluses and minuses within that, but because i",119,"No, we’ll not talk any more details on that. As you know, Mimi we have a very, very dispersed set of materials that we use in the manufacturing of our portfolio products to the customers. So, there is always pluses and minuses within that, but because it is so disperse, it really is, I wouldn’t’ be able to tell you specifically we are focused on this and that, gives you an indication. 
I would say that in general as suggested, we continue to believe that we will see some reductions over the balance of the year, not at the rate that we’ve seen in the first half perhaps but we’ll end up still down for the year in 2010.
"
281407,109383082,74013,"International Flavors & Fragrances Inc., Q2 2010 Earnings Call, Aug-05-2010",2010-08-05,"Earnings Calls","International Flavors & Fragrances Inc.","Analysts","Sure, and I do have one or two more residual questions. When you look at that18% operating margin target, is the timeframe given the progress that you’ve made henceforth, is that timeframe condensed at all given the first half progress or what is the le",51,"Sure, and I do have one or two more residual questions. When you look at that18% operating margin target, is the timeframe given the progress that you’ve made henceforth, is that timeframe condensed at all given the first half progress or what is the legacy time horizon for that 18% target?
"
281407,109383082,74013,"International Flavors & Fragrances Inc., Q2 2010 Earnings Call, Aug-05-2010",2010-08-05,"Earnings Calls","International Flavors & Fragrances Inc.","Executives","I would say, Mimi that a lot of that is dependent upon the work that we are doing right now as it relates to our strategies. I do believe that we have the ability to enhance our margins longer term and the timing associated with that will be determined to",100,"I would say, Mimi that a lot of that is dependent upon the work that we are doing right now as it relates to our strategies. I do believe that we have the ability to enhance our margins longer term and the timing associated with that will be determined to some extent by any investments that we want to consider. So, clearly as Doug suggested, that business is usual as right now and will continue to drive some margin enhancements and then more to come as it relates to any new insights that will begin relative to our strategic review.
"
281407,109383082,74013,"International Flavors & Fragrances Inc., Q2 2010 Earnings Call, Aug-05-2010",2010-08-05,"Earnings Calls","International Flavors & Fragrances Inc.","Analysts","And the result of this strategic review would be available to investors at year-end or early 2011? When do you think we might have the insight on that?",29,"And the result of this strategic review would be available to investors at year-end or early 2011? When do you think we might have the insight on that?

"
281407,109383082,74013,"International Flavors & Fragrances Inc., Q2 2010 Earnings Call, Aug-05-2010",2010-08-05,"Earnings Calls","International Flavors & Fragrances Inc.","Executives","Well, I think the perspectives that we would be prepared to share will be available towards the end of the year, but I would just reiterate that we’ll be prepared to share. It’s a very significant undertaking with the board which well we are part way",146,"Well, I think the perspectives that we would be prepared to share will be available towards the end of the year, but I would just reiterate that we’ll be prepared to share. It’s a very significant undertaking with the board which well we are part way into the process, there are a number of what if scenarios that could emerge to build on something that Kevin just said about the margin enhancements, that will be after good discussions with the Board about the propensity to invest significantly in future growth.,
While we may know that internally, we wouldn’t feel, nor would we want to telegraph that externally. So, I expect there will be parts that we will be able to share with you of things, hopefully the clever things that we’ve uncovered and can do, but I think I’m foreshadowing that it won’t be full disclosure.
"
281407,109383082,74013,"International Flavors & Fragrances Inc., Q2 2010 Earnings Call, Aug-05-2010",2010-08-05,"Earnings Calls","International Flavors & Fragrances Inc.","Analysts","Sure, okay. And can you say right now you are comfortable with the assumption of sales growth in the second half of the year, organic, excuse me local currency sales growth in the second half, that’s an achievable objective?",39,"Sure, okay. And can you say right now you are comfortable with the assumption of sales growth in the second half of the year, organic, excuse me local currency sales growth in the second half, that’s an achievable objective?
"
281407,109383082,74013,"International Flavors & Fragrances Inc., Q2 2010 Earnings Call, Aug-05-2010",2010-08-05,"Earnings Calls","International Flavors & Fragrances Inc.","Executives","Well, the forecast that we have internally, I think that is a fair assumption. Its looking towards the extreme tail end of the year, it gets a little murkier. We said the quarter has started well and to the degree that’s part of the foundation for our f",55,"Well, the forecast that we have internally, I think that is a fair assumption. Its looking towards the extreme tail end of the year, it gets a little murkier. We said the quarter has started well and to the degree that’s part of the foundation for our forecast, we fell good about what we do.
"
281407,109383082,74013,"International Flavors & Fragrances Inc., Q2 2010 Earnings Call, Aug-05-2010",2010-08-05,"Earnings Calls","International Flavors & Fragrances Inc.","Analysts","Okay, I followed. Thank you very much for the extra information.",11,"Okay, I followed. Thank you very much for the extra information.
"
281407,109383082,74013,"International Flavors & Fragrances Inc., Q2 2010 Earnings Call, Aug-05-2010",2010-08-05,"Earnings Calls","International Flavors & Fragrances Inc.","Operator","There are no further questions at this time.",8,"There are no further questions at this time.
"
281407,109383082,74013,"International Flavors & Fragrances Inc., Q2 2010 Earnings Call, Aug-05-2010",2010-08-05,"Earnings Calls","International Flavors & Fragrances Inc.","Executives","Well, thank you all very much for participating today.",9,"Well, thank you all very much for participating today.
"
281407,109383082,74013,"International Flavors & Fragrances Inc., Q2 2010 Earnings Call, Aug-05-2010",2010-08-05,"Earnings Calls","International Flavors & Fragrances Inc.","Operator","Thank you all for joining today’s conference call. You may now disconnect.",13,"Thank you all for joining today’s conference call. You may now disconnect.

"
281407,114222869,85346,"International Flavors & Fragrances Inc., Q3 2010 Earnings Call, Nov 04, 2010",2010-11-04,"Earnings Calls","International Flavors & Fragrances Inc.","Operator","At this time I would like to welcome everyone to the International Flavors & Fragrances third quarter 2010 earnings conference call. All lines will be on a listen-only mode until the formal question-and-answer portion of the call.I would now like to int",50,"At this time I would like to welcome everyone to the International Flavors & Fragrances third quarter 2010 earnings conference call. All lines will be on a listen-only mode until the formal question-and-answer portion of the call.
I would now like to introduce Michael DeVeau, Investor Relations Manager. You may begin.
"
281407,114222869,85346,"International Flavors & Fragrances Inc., Q3 2010 Earnings Call, Nov 04, 2010",2010-11-04,"Earnings Calls","International Flavors & Fragrances Inc.","Executives","Thank you, Operator, and good morning everyone. With me on the call today in New York is our Chairman and CEO, Doug Tough; our Group President of Fragrances, Nicolas Mirzayantz and our Executive Vice President and CFO, Kevin Berryman. Hernan Vaisman, our",203,"Thank you, Operator, and good morning everyone. With me on the call today in New York is our Chairman and CEO, Doug Tough; our Group President of Fragrances, Nicolas Mirzayantz and our Executive Vice President and CFO, Kevin Berryman. Hernan Vaisman, our Group President of Flavors is also joining us. However, he will be participating from Asia. This call is being recorded and will be available for playback on our Web site.
Please keep in mind that during this call we will be making forward-looking statements about the company’s performance, particularly with respect to the fourth quarter of 2010. These statements are based on how we see things today and contain some elements of uncertainty.
For additional information concerning factors that can cause actual results to differ materially from forward-looking statements, I ask you to refer to the cautionary statements and risk factors contained in today’s earnings release and on IFF’s filing with the SEC.
Some of today’s prepared remarks will (inaudible) non-GAAP financial information which excludes those items that affect comparability. These items are laid out in our reconciliation to comparable GAAP measures, which is also available on our Web site.
With that, I’d like to turn the call over to Doug.
"
281407,114222869,85346,"International Flavors & Fragrances Inc., Q3 2010 Earnings Call, Nov 04, 2010",2010-11-04,"Earnings Calls","International Flavors & Fragrances Inc.","Executives","Thank you, Mike. Good morning and good afternoon and good evening to everyone. Before reviewing our recent results I would like to briefly update you on the progress of our strategic review.Historically, at IFF we have evaluated all of our business sect",897,"Thank you, Mike. Good morning and good afternoon and good evening to everyone. Before reviewing our recent results I would like to briefly update you on the progress of our strategic review.
Historically, at IFF we have evaluated all of our business sectors, whether customers, regions and categories, by subtracting our operating cost and taxes from our sales to determine profits. This approach, however, did not take into consideration the other costs that went in the sale, such as capital investments.
As part of our strategic review, we now have incorporated all costs to create a more robust fact base across our entire business portfolio. During the evaluation process we reconfirmed that both our Flavor and Fragrances businesses are sound.
Like most businesses, however, it appears there are areas where we have the potential to accelerate our top line growth by placing greater emphasis on the right categories, regions and customers, and improve our overall profitability by implementing margin enhancing solutions such as cost reduction or changes to our pricing on parts of the portfolio that are underperforming.
Now, I know many of you are eager to hear the full specifics of our review, but you can appreciate that we do not wish to divulge specifics for obvious competitive reasons.
In our next phase, which will take us through the balance of this year, I have asked our company leaders to develop solutions in those areas where we think we have the opportunity to improve. We will begin to incorporate these solutions into our 2011 plan.
Now, we won’t specify all parts of our strategic work. There are a few areas that I can cover. First, innovation remains a very important aspect of our business, both to date and into the future.
During our third quarter, we created a new position of Senior Vice President, Research and Development to which we promoted Dr. Ahmet Baydar to fill the role. Ahmet Baydar will be responsible for leading IFF’s efforts in innovation, technological development, and external collaborations, all of which are vital to our ability to serve our customers well and generate innovative solutions and new products to drive our future growth. Dr. Baydar has an extensive background in, both Flavor and Fragrance R&D, making him well suited for this key leadership position. Reporting directly to me, he has joined our senior leadership team and has the full support of the company and our Board in pursuit of his goals. So within R&D the trends in health and wellness are very attractive.
As we all try to live a healthier lifestyle, we are in search of foods that have less sugar, less salt, less fat but still taste great. Starting from a position of strength, we already invest substantial resources in the discovery and the development of molecules, natural ingredients, and delivery systems.
I am pleased to report and Hernan will go into greater detail that our health and wellness tools such as sugar and salt reduction solutions have led to a very high success rate with our customers in this quarter. My expectation is that as we reemphasize our investments in this area, we will continue to capitalize on this dynamic trend.
From a geographic perspective, the emerging markets will continue to be a critical component of our company’s long-term global strategy. IFF already has a large percentage of sales in the emerging markets as well as a high market share position relative to our overall portfolio. Year-to-date through September sales to emerging markets accounted for 44% of our total global sales. Looking ahead, we will continue to focus on these markets due to their attractive growth rates.
Turning to our recent performance in Q3, I would like to provide a brief overview of our results. Our third quarter performance marks the continuation of excellent results. Our worldwide local currency sales once again grew double digits as all categories performed at or above expectations.
Both the Flavor and Fragrance teams continue to be successful in winning key new business that supported our strong growth. This outstanding top line performance combined with our continued focus on cost discipline enable us to deliver a margin profile of 18.3% that has not been achieved in over five years. The end result was extremely positive as adjusted Q3 earnings per share grew 20% to $0.98, an all time company high.
Now before passing on to Nicolas Mirzayantz, I would like to highlight two areas where IFF as an organization has excelled. First, as we completed the closure of (inaudible) manufacturing facility, which was part of our European restructuring announced last September, I would like to acknowledge all the employees for their hard work and their dedication and their professionalism, because of their efforts our customers continued to enjoy the outstanding service they had to come to expect even while this difficult change was underway.
Second, in early October we were recognized as one of the top performing global suppliers by Proctor & Gamble. For the second consecutive year our expertise in innovation, relationship management, commercial proactiveness and supply chain integration were acknowledged. My hat is off to the entire organization for this excellent achievement.
Once the team has concluded their prepared remarks, I plan to follow up with some perspectives on our fourth quarter outlook and the full year.
With that, I will like to introduce our Group President, Fragrances, Nicolas Mirzayantz.
"
281407,114222869,85346,"International Flavors & Fragrances Inc., Q3 2010 Earnings Call, Nov 04, 2010",2010-11-04,"Earnings Calls","International Flavors & Fragrances Inc.","Executives","Thank you, Doug, and good morning everyone. I am happy to report that local currency sales in the third quarter increased 15% as all regions reported double-digit growth. Our strong performance was once again driven by our ability to win important new bus",583,"Thank you, Doug, and good morning everyone. I am happy to report that local currency sales in the third quarter increased 15% as all regions reported double-digit growth. Our strong performance was once again driven by our ability to win important new business.
As our customers are searching for new and unique experiences for their brands, the demand for innovation and product superiority is high. Our in-depth consumer insight and superior creativity, combined with our cutting edge delivery systems, such as encapsulation are helping us satisfy their demand. This has driven our year-to-date results as we are now onto the fifth consecutive quarter of local currency growth.
In the fine fragrance and beauty care category, local currency sales grew 24%. Fine fragrance results continued to grow double-digit as key new wins drove the largest portion of our growth, highlighted by an exceptional performance in Europe and Latin America.
Some of our global key new launches included Armani Acqua di Gioia, Calvin Klein Beauty and (inaudible). The balance can be accredited to volume gains including some portion of restocking.
It is worth noting that in one of the most dynamic fragrance market in the world, Brazil, we are growing more than twice the market. Achievements similar to these are being realized worldwide, which helped drove growth absolute sales dollar above our previous record, higher than 2007 result.
In beauty care, hair care and toiletries once again achieved excellent results, marking the fourth consecutive quarter of double-digit growth. Our continued success can be credited to a long-standing presence and consumer insight investment within the emerging markets. In these markets growth in excess of 40% was achieved.
Our functional fragrance business continues to perform well, increasing 6% in local currency sales, despite a most challenging 9% year-over-year comparable in 2009.
Fabric care performance remained solid as new wins in Europe aided results. In Home care we grew double-digit as we continue to benefit access to new business. In personal wash, success in Greater Asia continued as reported strong results in this region.
Finally, Fragrance Ingredients local currency sales increased 18% as continued improvement in underlying demand drove results. While I am extremely pleased with our double-digit growth across all regions, I must say that our performance in the emerging market was outstanding.
So a strong trend seeing over the previous five quarters have continued as sales in our emerging markets grew 19% in the quarter. Brazil, Russia, India and China combined grew double digits 20% plus driven by new win performance and increased volume.
The fine fragrance and beauty care categories are exhibiting the strongest results in these regions with Latin America contributing approximately one-third of total Fragrance dollar growth. Our longstanding presence among with key investment like our March 2009 opening of our São Paulo Creative Center are strengthening our consumer understanding and leading to a broad market growth.
From a profitability standpoint, excluding a $2 million charge related to ongoing restructuring efforts in Europe this quarter and $11 million related to restructuring cost in the prior year period, adjusted operating profit grew a very strong 23% or $13 million to $71 million.
Our strong sales, favorable input cost and ongoing profit improvement initiatives drove 190 basis point improvements in adjusted operating margin to 19%. As we progressed to the fourth quarter, we are optimistic about our stock. As the benefits of restocking are subsiding, new win performance continued to be strong.
I am now happy to introduce Hernan Vaisman, our Group President of Flavors.
"
