"companyid","keydevid","transcriptid","headline","mostimportantdateutc","keydeveventtypename","companyname","speakertypename","componenttextpreview","word_count","componenttext"
281407,100068579,59982,"International Flavors & Fragrances Inc., Q1 2010 Earnings Call, May-06-2010",2010-05-06,"Earnings Calls","International Flavors & Fragrances Inc.","Executives","I would only add, certainly on the Flavors side of the business, the opportunities to influence consumer trends of health, wellness, nutrition and so on, which are very much at the forefront of our customers agendas equally are on the forefront of ours. O",131,"I would only add, certainly on the Flavors side of the business, the opportunities to influence consumer trends of health, wellness, nutrition and so on, which are very much at the forefront of our customers agendas equally are on the forefront of ours. Obviously, we're not positioned nor would we divulge any intellectual property issues, with some of the technological opportunities that Kevin referenced. We'll be right up the alley of the health, wellness, nutrition and so on. And the willingness, I think, to sell those at better margins is both within our ambit and frankly, right up the alley of what the customer wants to do also. I'm optimistic we can achieve some of that and it would always be our goal to improve margin with innovation and new products.
"
281407,100068579,59982,"International Flavors & Fragrances Inc., Q1 2010 Earnings Call, May-06-2010",2010-05-06,"Earnings Calls","International Flavors & Fragrances Inc.","Operator","At this time, there are no other questions.",8,"At this time, there are no other questions.
"
281407,100068579,59982,"International Flavors & Fragrances Inc., Q1 2010 Earnings Call, May-06-2010",2010-05-06,"Earnings Calls","International Flavors & Fragrances Inc.","Executives","Thank you all for your attendance and participation today. Look forward to talking to you in three months. Thank you.",20,"Thank you all for your attendance and participation today. Look forward to talking to you in three months. Thank you.
"
281407,100068579,59982,"International Flavors & Fragrances Inc., Q1 2010 Earnings Call, May-06-2010",2010-05-06,"Earnings Calls","International Flavors & Fragrances Inc.","Operator","This concludes today's International Flavors and Fragrances first quarter 2010 earnings call. You may now disconnect.",17,"This concludes today's International Flavors and Fragrances first quarter 2010 earnings call. You may now disconnect.

"
281407,109383082,74013,"International Flavors & Fragrances Inc., Q2 2010 Earnings Call, Aug-05-2010",2010-08-05,"Earnings Calls","International Flavors & Fragrances Inc.","Operator","At this time, I would like to welcome everyone to the International Flavors & Fragrances’ second quarter 2010 earnings conference call. All participants will be on a listen-only mode until the formal question-and-answer portion of the call. Participants",81,"At this time, I would like to welcome everyone to the International Flavors & Fragrances’ second quarter 2010 earnings conference call. All participants will be on a listen-only mode until the formal question-and-answer portion of the call. Participants will be announced by their name and company. In order to give all participants an opportunity to ask their question, we request and limit of one question per person.
I would now like to introduce Michael DeVeau, Investor Relations Manager. You may begin.
"
281407,109383082,74013,"International Flavors & Fragrances Inc., Q2 2010 Earnings Call, Aug-05-2010",2010-08-05,"Earnings Calls","International Flavors & Fragrances Inc.","Executives","Thank you, operator, and thanks everyone for joining us this morning. With me on the call today is our Chairman and CEO, Doug Tough; our Group President of Fragrances, Nicolas Mirzayantz; our Group President of Flavors, Hernan Vaisman; and our Executive V",185,"Thank you, operator, and thanks everyone for joining us this morning. With me on the call today is our Chairman and CEO, Doug Tough; our Group President of Fragrances, Nicolas Mirzayantz; our Group President of Flavors, Hernan Vaisman; and our Executive Vice President and CFO, Kevin Berryman.
Please note that this call will be recorded and will be available for playback on our website. Please keep in mind that during this call, we may make some forward-looking statements about the company’s performance, particularly with respect to the second half of 2010. These statements are based on how we see things today and may contain some elements of uncertainty. 
For additional information concerning factors that can cause actual results to differ materially from forward-looking statements, I ask you to refer to the cautionary statements and risk factors contained in today’s earnings release and on IFF’s website. 
Some of today's prepared remarks will exclude those items that affect comparability. These items are laid out in our non-GAAP reconciliation, which is also available under the Investor Relations section of our website.
With that, I’d like to choose, Doug.
"
281407,109383082,74013,"International Flavors & Fragrances Inc., Q2 2010 Earnings Call, Aug-05-2010",2010-08-05,"Earnings Calls","International Flavors & Fragrances Inc.","Executives","Thank you, Michael. Good morning and good afternoon to everyone. Before moving on to discuss our Q2 results, I would like to update you on one of the priorities we discussed on our Q1 conference call. Since joining IFF full time back in early March, we’",797,"Thank you, Michael. Good morning and good afternoon to everyone. Before moving on to discuss our Q2 results, I would like to update you on one of the priorities we discussed on our Q1 conference call. Since joining IFF full time back in early March, we’ve begun to pressure test our current strategies and our business model to ensure we are operating to the best of our ability.
As a part of this review, we have engaged a strategic consultant to aid us with the process. While we are still in the initial phases, gathering data and understanding the complex dynamics, we believe we are working towards an optimum path that will lead to greater shareholder value. We are thoroughly examining our regions, our categories and our customers relative to the drivers of our current and future levels of profitability. 
Specifically, we are looking to optimize our resources to ensure we are putting emphasis where we will get the best overall return. We are evaluating the relative levels of human and capital resources that are required to deliver our current results.
Perhaps, but not surprisingly, we have discovered very different performance results whereas some categories, some customers and regions are creating much better returns than others. Please note, however that much work still needs to be done. My expectation is this project will continue throughout the balance of this year. We will do our best to keep you informed of our progress and how these results will lead to even greater financial performance that in turn will drive further shareholder value.
I can assure you this is the highest internal initiative at IFF and I am pleased with the efforts and the progress made thus far by the entire organization. 
Returning to our second quarter results, I would like to note some key non-financial accomplishments that I believe will position us well in the future. First, in Flavors, I’m happy to report that we have been selected as a global core supplier for a multinational flavor customer making us one of only three suppliers on that coveted list. 
This is great news for IFF and speaks volumes about its customers trust and our ability to deliver quality; innovative products that help them differentiate their brands in the marketplace.
Adding to our portfolio of health and wellness solutions is our newly signed licensing agreement with Redpoint Bio, developers of an all-natural sweetness enhancer derived from stevia that will be exclusively ours for five years. The addition of this product will enable us to offer our customers more natural solutions to reduce sugar products. 
We also like to mention that the Fragrance team once again showed that IFF is a stock leader in looking to the future of Fragrance as they demonstrated in their well-received Headspace symposium presented earlier this year in concert with Museum of Modern Art and the Parsons School of Design. 
For those of you who do not know the Headspace symposium gathers leading thinkers, designers, scientists, artists and established perfumers to challenge the conception, impact and potential applications of scent by exploring new territory for design. Opportunities such as these are great ways to think outside the box leading to the key innovations so necessary to our business. 
While the rest of the IFF senior team will take you through the full details of our Q2 performance, I’ll provide a few high-level comments. It is clear that the strong momentum we experienced in the beginning of the year continued into the second quarter. 
While we have benefited from restocking and favorable comparisons against the soft-based period, the team was successful in winning key new business that helped drive this record top-line performance. This growth in the top line alongside our continued focus on cost and productivity supported a strong improvement in the operating profit margin.
The end result was very positive. Adjusted EPF increased 31% year-over-year. Finally before passing on to Nicolas, who will provide further context surrounding fragrances Q2 results, I would like to acknowledge our global supply chain and manufacturing team. With so much activity in both Flavors and Fragrances, you might deduce that the strong volume would cause a strain on our supply chain and you would be correct. We experienced unanticipated demand, which was taxing our manufacturing plants and material sourcing. 
Despite that substantial increase in demand, I’m happy to report we kept up our service levels to our customers. The supply chain and manufacturing team have risen to the challenge and upheld our excellent customer service levels. 
Once Nicolas, Hernan and Kevin conclude their prepared remarks, I will come back to provide some perspectives on the future and our outlook for the balance of this year. With that, I would like to introduce our Group President of Fragrances, Nicolas Mirzayantz. 
"
281407,109383082,74013,"International Flavors & Fragrances Inc., Q2 2010 Earnings Call, Aug-05-2010",2010-08-05,"Earnings Calls","International Flavors & Fragrances Inc.","Executives","Thank you, Doug, and good morning and good afternoon everyone. I’m happy to report that local currency sales in the second quarter increased 23%, one of our highest achievements in company history. As all categories, all regions and all customer segment",681,"Thank you, Doug, and good morning and good afternoon everyone. I’m happy to report that local currency sales in the second quarter increased 23%, one of our highest achievements in company history. As all categories, all regions and all customer segments on a concreted basis, we reported double digit growth. 
Our very strong performance was driven by the team’s ability to execute against the key strategic initiatives developed two years ago, as well as their ability to win important new business. 
In the Fine Fragrance and Beauty Care category, local currency sales grew 37%. Robust trends in Fine Fragrance continued growing at a strong double-digit rate as their ability to secure many of the key 2010 launches drove results. 
While new business gains did help support a very strong Fine Fragrance results, it is important to note that a portion of this improvement can be attributed to weak prior-year comparables as well as some elements of restocking. Despite these benefits, I am confident that we should continue to perform well as strong new business wins should provide a solid foundation for future growth. 
In Beauty Care, Hair Care and Toiletries continued to perform very well, both increasing at a strong double-digit rate. We continued to win important new business that has strengthened our leadership position across all our global and regional customers and I believe many solid opportunities still exist.
Our Functional Fragrance business continued to grow double digits increasing 12% despite a more challenging year-over-year comparable. Fabric Care performance remains strong as key new wins in Europe, Greater Asia and Latin America aided results. In Home Care, we have a seen a return to growth following a challenging 2009 as we continue to benefit from the addition of an important [core lease] two years ago.
In Personal Wash, solid growth was achieved despite a strong 2009 comparable. Our excellent performance in Functional Fragrance continues to reflect our strategic investment in innovation, in particular with our microencapsulation technology. In the second quarter, this technology represented large component of our growth and was one of the driving force of all those market growth levels.
Finally, Fragrance Ingredient’s local currency sales increased 24%, driven by a favorable comparison versus a year-ago period as well as improvements in underlying demand. Looking at the geographic breakdown of our sales, I am very pleased with our performance across all regions. 
In the developed markets of Europe and North America, we experienced very strong double-digit growth of 29% and 19% respectively driven by new wins and volume growth. Complementing the success, the strong trends seen in the emerging market of the previous four quarters have continued. 
Brazil, Russia, India and China all continue to show double-digit growth driven by new win performance and increased demand from both global and regional customers. As a result, we enjoyed a growth of 19% in Asia and 18% in Latin America.
Operating profit increased by $28 million to $65 million, including approximately $2 million related to ongoing restructuring efforts in Europe as compared to $5 million related to restructuring charges in the prior-year period. Excluding these items, adjusted operating profit grew nearly 60% or $25 million to $67 million as higher volumes, improving input cost and benefits from previous cost reduction initiatives drove results. 
Adjusted operating profit margin for the quarter increased 430 basis points to 18.6%, a level we have not seen in nearly five years. As we enter the second half, we have started the quarter with good momentum. It is important to know, however that we expect the benefits of restructuring to slow. 
In addition, as we face stronger prior-year comparisons, we do expect local currency sales in the second half to be lower than the first half as a strong performance in both Q1 and Q2 is not sustainable. Nevertheless, we believe our strong pipeline of new business should continue to position us well as we advance in the third quarter.
I would now like to turn the call over to our Group President of Flavors, Hernan Vaisman, who will provide an update on the flavor business.
"
281407,109383082,74013,"International Flavors & Fragrances Inc., Q2 2010 Earnings Call, Aug-05-2010",2010-08-05,"Earnings Calls","International Flavors & Fragrances Inc.","Executives","Thank you, Nicolas. We are pleased to say that local currency sales in the second quarter increased 7% over the comparative 2009 period marking the 20th consecutive quarter of local currency flow. Strong trends [Inaudible] continued as increased volume an",449,"Thank you, Nicolas. We are pleased to say that local currency sales in the second quarter increased 7% over the comparative 2009 period marking the 20th consecutive quarter of local currency flow. Strong trends [Inaudible] continued as increased volume and new business win once again led to double-digit growth.
In North America, local currency sales returned to positive growth increasing 7% as our team did an excellent job working with our customers to win new business. Specifically a double-digit performance in both confectionary and beverage were impressive and gave us confidence that we look to increase market share opportunity. 
In EAME, local currency sales increased 18% over the prior-year quarter as Flavors categories reported double-digit growth. The beverage category continues to be a standout as new win and stronger volume are driving results.
This month, the third consecutive quarter of double-digit growth of this category returning emerging market of Eastern Europe and the Middle East grew 25% plus while the developed market of Western Europe grew in the high teens. 
States in Latin America were once again positive growing 4% as new business and volume recovery in savory, confectionary and dairy offset the loss of non-strategic business that began in the third quarter of 2009. Please note it is our final comparison that includes the loss of non-strategic business. So we expect growth to accelerate in the second half as a result of critical wins in key categories.
Lastly, in Greater Asia, local currency sales were up 12% as all category reported positive results. Recent momentum of our business in most Asian countries contributed substantially to the double-digit growth in this important part of the world. This was fueled by higher volumes and new wins across all categories. 
The Flavors team continues to do an excellent job capitalizing on new business opportunities to drive above market growth. While I am happy to report our highest sales growth in company history, what I am most proud of is our performance across all regions and all categories.
Turning to profit, Flavors operating profit increased 18% or $10 million to $60 million in the second quarter. This increase was driven by accelerated sales growth, improved input cost and our continued margin improvement initiatives. 
As a result, operating profit margin improved 100 basis points to 21.2% versus 20.2% in the prior-year period. While we are early in Q3, we have started the quarter with solid momentum. Our project pipeline remains very healthy and I believe we are in a good shape to continue our track record of local currency sales growth as we move into the second half of the year.
With that, I would like to turn the call over to Kevin.
"
281407,109383082,74013,"International Flavors & Fragrances Inc., Q2 2010 Earnings Call, Aug-05-2010",2010-08-05,"Earnings Calls","International Flavors & Fragrances Inc.","Executives","Thanks Hernan. On our Q1 conference call, I highlighted four key trends that we expect to see in 2010. I would like to update you on how we are progressing in these areas.First, we communicated that we expect local currency sales to trend above our long",1057,"Thanks Hernan. On our Q1 conference call, I highlighted four key trends that we expect to see in 2010. I would like to update you on how we are progressing in these areas.
First, we communicated that we expect local currency sales to trend above our long-term growth targets, with relative strength in the second quarter driven by favorable prior-year comparison. This indeed has happened with each of the business that we are able to realize substantial improvement in Q2.
Second, we highlighted that we would see an improving input cost structure. Specifically, slower input cost combined with our accelerated sales performance allowed us to improve gross margin by 270 basis points, over the prior-year period to 42.8%.
Our continued focus on cost discipline helped mitigate some higher than normal RSA cost, most notably incremental incentive compensation provisions, as we delivered 90 basis points of adjusted operating margin improvement finishing the quarter at 16.5%. As a result, adjusted EPS for the second quarter increased 31% year-over-year to $0.85 per share.
Looking at our local currency sales trends over the past five quarters, I’d like to note that all categories in Q2 are showing double-digit growth. However, restocking and favorable comparison in Fine Fragrance and Ingredients certainly aided results.
As we enter the second half, it is important to note that the benefits of restocking appeared to be subsiding. When combined with stronger prior-year comparisons, the continued economic volatility, we expect local currency sales growth in the second half to grow on more normalized levels with relative strength in Q3 versus Q4.
Turning to input cost, we continued to see period-over-period decreases in the P&L driven by a reduction of higher cost inventory. As expected, input cost represented a 7% decrease in the second quarter. Looking ahead, we believe input cost should remain favorable for the full year, although the selective pressure in the second half may reduce the rate of favorability for the full year. Specifically, fluctuations in oil prices could place pressure on some oil-related materials and freight surcharges.
While we are experiencing benefits in 2010, I would like to remind you all that our overall input cost position remain above historical level.
From an overhead cost standpoint, RSA has a percentage of sales increased 160 basis points to 26.3%. The $35 million increase is mainly attributable to additional incentive compensation provisions of $18 million, plus litigation-related costs, investments and spending to support the higher level of business activity, reduction of R&D credits, unfavorable foreign currency movements and lower prior-period based spending. 
It should be noted that included in our RSA expense this quarter is roughly 250 basis point of expense versus what we consider more normalized levels. This increase can be attributed to additional incentive compensational provisions above normalized levels, obviously driven by a very strong performance in Q2 as well as additional litigation-related cost.
As our top-line performance returns to more normalized levels, we believe our cost structure will fall. Within RSA, R&D expense, as a percentage of sales, increased 60 basis points to 8.4% driven by incremental incentive compensation provisions, a reduction in R&D credits and incremental investments in support of our strategic growth initiatives.
Looking towards the second half, we will continue to maintain strict discipline in the management of our fixed cost structure. If our performance is similar to the performance experienced in the first half, we would expect, however additional cost associated with compensation provisions.
Moving to currency, while the Euro devalued against the U.S. dollar during Q2, the negative impact on our P&L was largely offset by the strengthening of other currencies. In the past, we have said that for every 1.1% strengthening or weakening of the US dollar we expect a plus or minus $0.02 impact on our EPS on an annual basis.
Please note that this can vary depending upon the mix of currencies and balance sheet impacts that are driven by point and time translation factors. The exact impact depends upon the consistency of the change across the major currencies in which we operate.
Looking ahead, the currency rates stay where they are today including the Euro at 132. We expect to face modest pressure on the second half of 2010. As we have communicated on our Q1 conference call, the evaluated cost provision strategy that provide for decreased volatility in this area. We have begun to implement these strategies and we believe that volatility should be reduced as we begin to enter the fourth quarter. Nevertheless, at current rates, we still believe that the above-mentioned currency role should be directionally accurate in Q3 and Q4 of 2010.
Turning to our EPS reconciliation that’s highlighted on the slide, we continue to see improved performance, including the abnormally high levels of incentive compensation provisions on legal-related cost previously noted, adjusted EPS still improved $0.20 or 31% versus the year-ago period. 
As we move from our adjusted EPS to our reported EPS, I would like to note that the $0.02 difference is entirely related to our previously announced European rationalization. As a reminder, to date we have recorded $20 million provision of which $2 million was recorded in this quarter.
We now expect our total cost for this initiative to be approximately $31 million to $34 million with targeted annual cost savings of $17 million to $20 million annually, beginning in 2011.
From a cash flow perspective, we continue to make improvements in working capital efficiency. As a result, a large component of our success in the second quarter came from our ability to better manage our receivables and payables. This improved efficiency combined with the relative business strength in the quarter drove $40 million increase year-over-year in cash flow from operation. 
As a result of the cash flow dynamic and the confidence in our long-term outlook, our board of directors authorized an increase in the company’s quarterly cash dividend raising it 8% from $0.25 to $0.27. This marks the fifth increase in six years that the board has raised the dividend and reports our continued commitment to return cash to shareholders. One point regarding our capital expenditures, we are, we believe on track with our goal, we are approximately spending 4% of sales for the year.
With that, I would like to turn it back over to Doug for a perspective on the balance of the year.
"
