"companyid","keydevid","transcriptid","headline","mostimportantdateutc","keydeveventtypename","companyname","speakertypename","componenttextpreview","word_count","componenttext"
4180255,114406691,81379,"Lorillard, Inc., Q3 2010 Earnings Call, Oct 25, 2010",2010-10-25,"Earnings Calls","Lorillard, LLC","Analysts","So I wanted to just quickly go back to Newport Non-Menthol. Since that launched before you were there and as you try to gauge how aggressive the objectives there are, do you view that as a very sizable market share opportunity? Or should we also view that",74,"So I wanted to just quickly go back to Newport Non-Menthol. Since that launched before you were there and as you try to gauge how aggressive the objectives there are, do you view that as a very sizable market share opportunity? Or should we also view that as sort of a contingency product if there is, in fact, some kind of regulatory action on menthol a few, a year out from now, say?"
4180255,114406691,81379,"Lorillard, Inc., Q3 2010 Earnings Call, Oct 25, 2010",2010-10-25,"Earnings Calls","Lorillard, LLC","Executives","I guess we'll get some learning from a contingency standpoint. But that's not -- if we were in a real mode of having to deal with much stricter menthol environment, this isn't how I'd do it. I'm not saying there won't be some learning, but I think you sho",115,"I guess we'll get some learning from a contingency standpoint. But that's not -- if we were in a real mode of having to deal with much stricter menthol environment, this isn't how I'd do it. I'm not saying there won't be some learning, but I think you should view this as the company sees that there's 70% of the category, there's sort of 65% of the category that we currently don't compete in. And that we see a very strong Newport brand, and we're trying to penetrate that market and establish a foothold with our great brands. And I think you've seen examples of that in all throughout the tobacco industry and reverse."
4180255,114406691,81379,"Lorillard, Inc., Q3 2010 Earnings Call, Oct 25, 2010",2010-10-25,"Earnings Calls","Lorillard, LLC","Analysts","Is there any early signs of the reception that's getting with the distributors and retailers? I know it's very early in the process, but any measure, maybe percentage of the Newport outlets that you're getting placements for that product?",40,"Is there any early signs of the reception that's getting with the distributors and retailers? I know it's very early in the process, but any measure, maybe percentage of the Newport outlets that you're getting placements for that product?"
4180255,114406691,81379,"Lorillard, Inc., Q3 2010 Earnings Call, Oct 25, 2010",2010-10-25,"Earnings Calls","Lorillard, LLC","Executives","Yes, and I want to temper this comment, it's been received extremely well. We are getting distribution easily, and there is a lot of enthusiasm. It was quite the buzz at the NAC show from both wholesalers and from retailers, but we have a fabulous sales f",67,"Yes, and I want to temper this comment, it's been received extremely well. We are getting distribution easily, and there is a lot of enthusiasm. It was quite the buzz at the NAC show from both wholesalers and from retailers, but we have a fabulous sales force and I would expect nothing less, but we will get very good distribution and placement right out of the shoe."
4180255,114406691,81379,"Lorillard, Inc., Q3 2010 Earnings Call, Oct 25, 2010",2010-10-25,"Earnings Calls","Lorillard, LLC","Analysts","And again I know it's early in the strategic review, but are you happy with Maverick's role in the portfolio? And I guess how much of a priority is it for you to grow that brand versus the opportunity to monetize it to a greater degree at some point?",50,"And again I know it's early in the strategic review, but are you happy with Maverick's role in the portfolio? And I guess how much of a priority is it for you to grow that brand versus the opportunity to monetize it to a greater degree at some point?"
4180255,114406691,81379,"Lorillard, Inc., Q3 2010 Earnings Call, Oct 25, 2010",2010-10-25,"Earnings Calls","Lorillard, LLC","Executives","Well, I think the answer is both. Am I happy with the incremental piece of business that's growing and absorbing overheads and becoming more profitable? Absolutely. And I think I had my own personal experience as any other industry that if you can do that",111,"Well, I think the answer is both. Am I happy with the incremental piece of business that's growing and absorbing overheads and becoming more profitable? Absolutely. And I think I had my own personal experience as any other industry that if you can do that profitably and incrementally grow it, it's to your company's advantage. Maverick's a strong brand, but we also don't mistake the fact that Newport is the one that generates and pays the bills. That's our top priority and we make sure we don't take our eye of that ball. I wouldn't expect Murray Kessler to do anything to back off of Maverick. It's not going to happen."
4180255,114406691,81379,"Lorillard, Inc., Q3 2010 Earnings Call, Oct 25, 2010",2010-10-25,"Earnings Calls","Lorillard, LLC","Analysts","And then just finally, on the TPSAC issue, I just wanted to understand as you went through the process and decided to take the CEO job, how did you gain comfort with the risk of that process? And do you think the company's done an effective job handling t",71,"And then just finally, on the TPSAC issue, I just wanted to understand as you went through the process and decided to take the CEO job, how did you gain comfort with the risk of that process? And do you think the company's done an effective job handling the process so far? Where do you think there might be opportunity to make changes in the approach in working with the committee?"
4180255,114406691,81379,"Lorillard, Inc., Q3 2010 Earnings Call, Oct 25, 2010",2010-10-25,"Earnings Calls","Lorillard, LLC","Executives","Well, I think the company has very much done an effective job, and I think we can even do more. Remember that sort of, the key industry representative is Dr. Heck who works for this company. By all standards, I believe everyone recognizes him as the leadi",273,"Well, I think the company has very much done an effective job, and I think we can even do more. Remember that sort of, the key industry representative is Dr. Heck who works for this company. By all standards, I believe everyone recognizes him as the leading expert in the world on menthol. So that's a starting point. We're involved. Dr. True [ph] has testified and I think that every, or almost every TPSAC meeting and continues to be engaged and we will continue to engage at a higher level. But the company has been active. As it relates to me, I think it's a great question. And as I went through an exercise of looking to join those company, I had to go through the same exercise an investor would go through. And I read through the epidemiology, read through sort of the logic relative to the intended and unintended consequences. And no matter how I cut it, if this FDA is to go through a true scientific review, there is no difference on causation. There is not a case to be made for banning menthol. No matter how you cut this thing, there is not a case to be made for. Now some of the TPSAC -- I looked at it and said, ""Boy, this TPSAC group has got some members of the committee that at the very least are conflicted. And how do I feel about whether they'll truly follow science, we'll see. I'm optimistic, I'm hopeful. But I really believe that once they get into the hands of the FDA though, they'll do the right thing and follow science."
4180255,114406691,81379,"Lorillard, Inc., Q3 2010 Earnings Call, Oct 25, 2010",2010-10-25,"Earnings Calls","Lorillard, LLC","Operator","Your  next question comes from the line of Chris Growe with Stifel, Nicolaus.",13,"Your  next question comes from the line of Chris Growe with Stifel, Nicolaus."
4180255,114406691,81379,"Lorillard, Inc., Q3 2010 Earnings Call, Oct 25, 2010",2010-10-25,"Earnings Calls","Lorillard, LLC","Analysts","I have two questions for you on Newport Red. The first one I want to ask you just, there are parts of the country where menthol is not a large component of the sales, I think or really present at all. Are there expenses or costs for you to try and get int",106,"I have two questions for you on Newport Red. The first one I want to ask you just, there are parts of the country where menthol is not a large component of the sales, I think or really present at all. Are there expenses or costs for you to try and get into those markets via people or just expenses to launch the product there? And my other question related to Red was, what can you do to minimize any kind of shelf space allocation or basically taken away from current Newport Menthol? I mean the retailers are going to make an incremental space for you."
4180255,114406691,81379,"Lorillard, Inc., Q3 2010 Earnings Call, Oct 25, 2010",2010-10-25,"Earnings Calls","Lorillard, LLC","Executives","That's not the way the cigarette space works, in general. The way that cigarette category is allocated, you have 12%, 13% of the space that roughly goes to Newport. It depends on sort of where you are in the country. And if you look at us with our narrow",214,"That's not the way the cigarette space works, in general. The way that cigarette category is allocated, you have 12%, 13% of the space that roughly goes to Newport. It depends on sort of where you are in the country. And if you look at us with our narrow product line, you've many, many many spacings [ph] of Newport more than you might need to stay in sight. It's not a difficult challenge for us to be able to slot this item in within our space if you compare that to the number of SKUs, the number one and number two players now trying to get into their space, and they constantly bring out new products you'll see will fare quite well. As it relates to expense, we're not adding people in different parts of the country and it would be my greatest joy that it sells so well in different parts of the country that I do have to add people in those parts of the country. But there will be some disproportional investment in markets where it's weak, but we'll see. We'll learn a lot from this launch and we'll learn it early on, how that performs where Newport's strong versus where Newport's not strong, and we'll measure all of those."
4180255,114406691,81379,"Lorillard, Inc., Q3 2010 Earnings Call, Oct 25, 2010",2010-10-25,"Earnings Calls","Lorillard, LLC","Analysts","And I had a question for you, a bit of a follow-up on menthol. Just curious within menthol, if you've seen price gaps narrow of late? I mean, just in relation to a lot of competitive activity. Has that changed at all for you the last quarter or so, a quar",53,"And I had a question for you, a bit of a follow-up on menthol. Just curious within menthol, if you've seen price gaps narrow of late? I mean, just in relation to a lot of competitive activity. Has that changed at all for you the last quarter or so, a quarter or two?"
4180255,114406691,81379,"Lorillard, Inc., Q3 2010 Earnings Call, Oct 25, 2010",2010-10-25,"Earnings Calls","Lorillard, LLC","Executives","I don't think so. I think if anything, from my observation, you saw it in our earnings release, if we don't get [ph] it, we're not very specific with it. But we talk about consumer promotion spending being reduced in the third quarter this year. And I thi",115,"I don't think so. I think if anything, from my observation, you saw it in our earnings release, if we don't get [ph] it, we're not very specific with it. But we talk about consumer promotion spending being reduced in the third quarter this year. And I think that was talked about it and by others as well. So we don't see price gaps as a way to grow our business. We see price gaps keeping us competitive. We tend to be the most expensive products on the market, but again, we view the product and the brand and long-term trend and that, that promotion just make sure we don't get out of line."
4180255,114406691,81379,"Lorillard, Inc., Q3 2010 Earnings Call, Oct 25, 2010",2010-10-25,"Earnings Calls","Lorillard, LLC","Analysts","And my last question for you, perhaps a question for David. In the fourth quarter, are there any inventory variances perhaps levels as you enter the quarter or year-over-year comparison factors for your volume in the upcoming fourth quarter?",39,"And my last question for you, perhaps a question for David. In the fourth quarter, are there any inventory variances perhaps levels as you enter the quarter or year-over-year comparison factors for your volume in the upcoming fourth quarter?"
4180255,114406691,81379,"Lorillard, Inc., Q3 2010 Earnings Call, Oct 25, 2010",2010-10-25,"Earnings Calls","Lorillard, LLC","Executives","Well, we don't know how the fourth quarter's going to finish, but I did say that we saw a little bit of a build in wholesale inventory in the third quarter. And so therefore, if and when that build turns back around, that might be a drag in fourth quarter",56,"Well, we don't know how the fourth quarter's going to finish, but I did say that we saw a little bit of a build in wholesale inventory in the third quarter. And so therefore, if and when that build turns back around, that might be a drag in fourth quarter, if it happens in fourth quarter."
4180255,114406691,81379,"Lorillard, Inc., Q3 2010 Earnings Call, Oct 25, 2010",2010-10-25,"Earnings Calls","Lorillard, LLC","Analysts","So that was not related to the prior year? That was an incremental build, is that right?",17,"So that was not related to the prior year? That was an incremental build, is that right?"
4180255,114406691,81379,"Lorillard, Inc., Q3 2010 Earnings Call, Oct 25, 2010",2010-10-25,"Earnings Calls","Lorillard, LLC","Executives","Yes, that's correct. The two dynamics, what happened in the third quarter last year and what happened in the third quarter this year combined to impact that comparison roughly 2%. While I've got the floor here, Christine, depreciation, amortization in our",55,"Yes, that's correct. The two dynamics, what happened in the third quarter last year and what happened in the third quarter this year combined to impact that comparison roughly 2%. While I've got the floor here, Christine, depreciation, amortization in our business is really pretty low. It's just like $8.5 million in the third quarter."
4180255,114406691,81379,"Lorillard, Inc., Q3 2010 Earnings Call, Oct 25, 2010",2010-10-25,"Earnings Calls","Lorillard, LLC","Operator","Your next question comes from the line of Ann Gurkin with Davenport.",12,"Your next question comes from the line of Ann Gurkin with Davenport."
4180255,114406691,81379,"Lorillard, Inc., Q3 2010 Earnings Call, Oct 25, 2010",2010-10-25,"Earnings Calls","Lorillard, LLC","Analysts","I just wanted to ask, you made a comment that you're going to review the business and maybe share some of your thoughts. I was wondering the timeline of that? Will we hear some of those strategies, thoughts before the final TPSAC ruling? Or do you think y",58,"I just wanted to ask, you made a comment that you're going to review the business and maybe share some of your thoughts. I was wondering the timeline of that? Will we hear some of those strategies, thoughts before the final TPSAC ruling? Or do you think you might wait until after that timeline? Can you share that?"
4180255,114406691,81379,"Lorillard, Inc., Q3 2010 Earnings Call, Oct 25, 2010",2010-10-25,"Earnings Calls","Lorillard, LLC","Executives","I'm being more driven by the process itself. So it'll take a few months to go to through the process with the board as you'd expect. So some time early next year, first quarter next year, I would say. And I'll wait for whatever presents itself is the righ",158,"I'm being more driven by the process itself. So it'll take a few months to go to through the process with the board as you'd expect. So some time early next year, first quarter next year, I would say. And I'll wait for whatever presents itself is the right opportunity. I'm not sure, sitting here right now, whether that will be in a conference or our own Investor Day. We'll figure that out. I just want to re-emphasize, I don't want to set expectations too far. The end of this strategy process might be that the best thing for this company to do is do exactly what it's doing, where it might be some of these expanded opportunities and it maybe building out some of what is already strengthened, but strengthening even further some of our process capabilities. But as always, you can expect me to be very transparent to show where I think the future lies."
4180255,114406691,81379,"Lorillard, Inc., Q3 2010 Earnings Call, Oct 25, 2010",2010-10-25,"Earnings Calls","Lorillard, LLC","Operator","If there are no further questions, I would like to turn the call back over to Mr. Kessler for any concluding remarks.",22,"If there are no further questions, I would like to turn the call back over to Mr. Kessler for any concluding remarks."
4180255,114406691,81379,"Lorillard, Inc., Q3 2010 Earnings Call, Oct 25, 2010",2010-10-25,"Earnings Calls","Lorillard, LLC","Executives","Well once again, I'm delighted to be back in the saddle here at Lorillard. I'm walking in the door that has, by far, exceeded my expectations and that is driven by what I believe is a real and long-term organic volume growth trend. We believe that Lorilla",66,"Well once again, I'm delighted to be back in the saddle here at Lorillard. I'm walking in the door that has, by far, exceeded my expectations and that is driven by what I believe is a real and long-term organic volume growth trend. We believe that Lorillard, because of that, remains and is a compelling investment. And we thank you for your interest in the company."
4180255,114406691,81379,"Lorillard, Inc., Q3 2010 Earnings Call, Oct 25, 2010",2010-10-25,"Earnings Calls","Lorillard, LLC","Operator","This concludes the Lorillard, Inc. Third Quarter 2010 Earnings Conference Call. For a replay of this call, please Dial 1 (800) 642-1687 and enter the conference ID 15224371. You may now disconnect.",32,"This concludes the Lorillard, Inc. Third Quarter 2010 Earnings Conference Call. For a replay of this call, please Dial 1 (800) 642-1687 and enter the conference ID 15224371. You may now disconnect."
4180255,114406691,81387,"Lorillard, Inc., Q3 2010 Earnings Call, Oct 25, 2010",2010-10-25,"Earnings Calls","Lorillard, LLC","Operator","Good day, ladies and gentlemen, and welcome to the Lorillard, Inc. Third Quarter 2010 Earnings Conference Call. My name is Sarah, and I will be your operator for today's call. [Operator Instructions] At this time, I would like to turn the conference over",56,"Good day, ladies and gentlemen, and welcome to the Lorillard, Inc. Third Quarter 2010 Earnings Conference Call. My name is Sarah, and I will be your operator for today's call. [Operator Instructions] At this time, I would like to turn the conference over to your host for today's call, Mr. Bob Bannon. You may begin, sir."
4180255,114406691,81387,"Lorillard, Inc., Q3 2010 Earnings Call, Oct 25, 2010",2010-10-25,"Earnings Calls","Lorillard, LLC","Executives","Thank you, Sarah, and good morning, everyone. I'm Bob Bannon, Lorillard's Director of Investor Relations, and joining me on today's call is Murray Kessler, Lorillard President and Chief Executive Officer; and David Taylor, its Chief Financial Officer. By",127,"Thank you, Sarah, and good morning, everyone. I'm Bob Bannon, Lorillard's Director of Investor Relations, and joining me on today's call is Murray Kessler, Lorillard President and Chief Executive Officer; and David Taylor, its Chief Financial Officer. By now you should have received a copy of our third quarter 2010 earnings release. It can be found on the company's website, lorillard.com, under News Releases.
But before we begin, I'd like to remind you that some of the comments on today's call and some of the responses to your questions may contain forward-looking statements. These statements are subject to the risks and uncertainties as described in the company's earnings release and in other filings with the SEC. I'd now like to turn the call over to Murray Kessler."
