"companyid","keydevid","transcriptid","headline","mostimportantdateutc","keydeveventtypename","companyname","speakertypename","componenttextpreview","word_count","componenttext"
362220,531177046,1271480,"Ralph Lauren Corporation, Q1 2018 Earnings Call, Aug 08, 2017",2017-08-08,"Earnings Calls","Ralph Lauren Corporation","Operator","Ladies and gentlemen, thank you for standing by. Welcome to the Ralph Lauren First Quarter Fiscal 2018 Earnings Call. [Operator Instructions] As a reminder, this conference is being recorded. I would now like to turn the conference over to our host, Mrs",47,"Ladies and gentlemen, thank you for standing by. Welcome to the Ralph Lauren First Quarter Fiscal 2018 Earnings Call. [Operator Instructions] As a reminder, this conference is being recorded. 
I would now like to turn the conference over to our host, Mrs. Evren Kopelman. Please go ahead."
362220,531177046,1271480,"Ralph Lauren Corporation, Q1 2018 Earnings Call, Aug 08, 2017",2017-08-08,"Earnings Calls","Ralph Lauren Corporation","Executives","Good morning, and thank you for joining Ralph Lauren's First Quarter Fiscal 2018 Conference Call. With me today are Patrice Louvet, the company's President and Chief Executive Officer; and Jane Nielsen, Chief Financial Officer. [Operator Instructions]",156,"Good morning, and thank you for joining Ralph Lauren's First Quarter Fiscal 2018 Conference Call. 
With me today are Patrice Louvet, the company's President and Chief Executive Officer; and Jane Nielsen, Chief Financial Officer. [Operator Instructions] 
During today's call, we will be making some forward-looking statements within the meaning of the federal securities laws, including our financial outlook. Forward-looking statements are not guarantees and our actual results may differ materially from those expressed or implied in the forward-looking statements.  Our expectations contain many risks and uncertainties. Principal risks and uncertainties that could cause our results to differ materially from our current expectations are detailed in our SEC filings.
To find disclosures and reconciliations of non-GAAP measures that we use when discussing our financial results, you should refer to this morning's earnings release and to our SEC filings that can be found on our Investor Relations website.
And now I will turn the call over to Patrice."
362220,531177046,1271480,"Ralph Lauren Corporation, Q1 2018 Earnings Call, Aug 08, 2017",2017-08-08,"Earnings Calls","Ralph Lauren Corporation","Executives","Thank you, Evren. Good morning, everyone, and thank you for joining today's call. It's great to be at the company and partner with Ralph and the entire team. The last few weeks have been exciting for me as I spent time in the marketplace and had the chanc",1034,"Thank you, Evren. Good morning, everyone, and thank you for joining today's call. It's great to be at the company and partner with Ralph and the entire team. The last few weeks have been exciting for me as I spent time in the marketplace and had the chance to meet with many of our team members as well as our consumers, wholesale partners and key industry opinion leaders. 
What is clear to me is that we have an iconic brand, a passionate team and a lot of opportunity ahead. Seizing our opportunity requires us to evolve how our iconic brand is experienced and expressed to win the hearts and minds of consumers globally. It's something Ralph and I are deeply committed to. 
As you can see in this quarter's results, we're making good progress with setting a strong foundation for future growth. The team continues to deliver on our commitments to improve quality of sales and distribution with increased efficiency. On my first call with you, I thought it would be valuable to share what motivated me to join the company, my observations to date and our areas of focus to get back to growth and value creation. Then I'll turn it over to Jane to walk through the details of the quarter and our guidance. At the end, we'll take your questions together. 
To start, I've long admired Ralph and I am honored to partner with him. We are both committed to preserving the essence of our brand while actively evolving it to renew long-term growth, profitability and returns. To achieve that, Ralph and I are clear on how we will partner together. Ralph is the Chief Creative Officer in charge of the creative brand aesthetic decisions. As CEO, I will lead the company's strategy, execution and business results. 
Ralph has already been a great partner, and I could not be more enthusiastic about our collaboration. I appreciate the confidence and latitude he has given me in leading this company forward. 
During this time of transformation for our industry in our business, I am confident we will accomplish a great deal together. Our opportunity is to take an iconic brand and advance it in ways that drive new growth and value in an industry that is undergoing unprecedented change. Our experiences and expertise will be a powerful and winning combination. 
People who know me well describe me as a builder of both brands and teams. Building up people and teams to accomplish amazing things motivates me. I believe this is one reason Ralph and I click. He was looking for somebody to come in, understand what makes this place so unique and special and build boldly from that point.
I am also committed to objectively evaluating the business and identifying both the strengths on which we can build and the areas that need focused attention and improvement. I am passionate about building brands that consumers love. To do that, we must understand the target consumer, his or her interests and motivations, clearly define what the brand stands for in today's world, and then most importantly, connected to in a way in which the brand becomes irresistible. 
To say the retail industry is at an inflection point would be an understatement. Technology has transformed the way consumers shop and connect with retail brands. Retail store closures are near 20-year high as the fundamental shift to e-commerce continues. To stand out and compete in this environment, consumers expect an omnichannel shopping experience that's unlike anything they've seen before. While not easy, I see it as our job to redefine the shopping experience of the future. 
All of these changes are creating challenges, but they're also creating opportunity. The Ralph Lauren brand was built on a belief that we all dream of living a fulfilling life, a life that makes you feel good. I think that is a universally aspirational idea. It's an idea that transcends boundaries and generations. And it is relevant today as it has ever been. Our role is to make it feel vivid and exciting today for consumers everywhere, from Boston to Barcelona to Beijing.
We are starting with a great foundation. Our brand is iconic and the underlying fundamentals of our business are solid. I am focused on continuing to execute on the operational improvements that were part of the Way Forward Plan, and the team is making good progress in driving efficiencies and improving the quality of our sales by reducing excess discounts, excess inventory, supply chain lead times, unproductive distribution and SKUs as well as aligning our creative more closely with the consumer. Further, I've been incredibly impressed by the caliber and dedication of the people here at Ralph Lauren. We have a team of talented and hard-working employees who are eager to get back to winning. And with their enthusiastic support, we will push ahead to create more value for our shareholders. 
It is too early to talk about the evolution of our strategy. However, as I start to work with the team, we have a strong focus on growth that creates value. We are focused on exploring our opportunities in becoming more digital and more global, as well as how we evolve and elevate the offerings and experiences we provide to consumers in order to drive growth.
It is important to note that we will balance driving growth with improving efficiencies. We aim to increase our productivity by continuing to simplify and streamline our operations company-wide so we can invest in growth. With the consumer as our touchstone, we're also going to focus on how we work as an organization so our employees are more empowered, more connected and more energized. 
Getting culture right is critical for us. 
In closing, as I shared earlier, we are eager to evolve how the brand is experienced and expressed to win the hearts and minds of consumers globally. While our transformation is in its early days, we are progressively strengthening our position to create new value and renew long-term growth. 
With that, I'll turn it over to Jane to walk you through the details of the quarter, and I'll join her at the end to answer your questions. Thank you."
362220,531177046,1271480,"Ralph Lauren Corporation, Q1 2018 Earnings Call, Aug 08, 2017",2017-08-08,"Earnings Calls","Ralph Lauren Corporation","Executives","Thank you, Patrice, and good morning, everyone. I'd like to start by saying that our entire team is thrilled to welcome Patrice to the company. He joins at a critical moment when we are executing on initiatives to strengthen the foundation of our busine",2546,"Thank you, Patrice, and good morning, everyone. 
I'd like to start by saying that our entire team is thrilled to welcome Patrice to the company. He joins at a critical moment when we are executing on initiatives to strengthen the foundation of our business that will allow us to position for future growth. 
Our first quarter results demonstrate the strong and continued progress we are making in this area. As you know, last year, we started the important work of enhancing our operational efficiencies by improving our cost structure, evolving towards a demand driven sell-through culture and improving our quality of sales and distribution. As we started this fiscal year, we are encouraged by the progress in the first quarter and are confident that our efforts are the right ones to lay the groundwork for our future growth initiatives.
Let me take you through the key strategic and financial highlights of the first quarter. This quarter, we continue to deliver against our strategy to drive quality of sales and elevate our brand. Key areas of operational focus were: aligning receipts to underlying demand, reducing promotion frequency and depth, optimizing our distribution and improving our inventory position with increased productivity. 
Our financial results were consistent with this focused execution. As you saw in our press release, revenues declined 13%, in line with guidance. Adjusted operating margin was 10.2%, 200 basis points above last year and above our guidance of 9.5% to 10% in constant currency.
Gross margin also reflected this work and was up 210 basis points to last year. Excluding the impact of foreign currency, the gross margin was 260 basis points better than last year. Importantly, we are delivering both average unit retail increases and discount rate reductions. Across our global retail network, discount rates were down and AUR was up almost 4%.
Gross margin also benefited from favorable geographic and channel mix as our high gross margin international and retail businesses represented a large percentage of sales compared to last year. We expect these factors to drive gross margin expansion for the remainder of the year. 
This work has come in conjunction with continued progress on rightsizing our cost structure. Operating expenses were down 13% to last year in the first quarter. This was driven by: one, streamlining the organization to reduce headcount; two, closing unprofitable stores; and three, changing product development processes through SKU optimization. We are on track with our expense savings targets for the year, and this will allow us to invest some of the savings into product, marketing and distribution renovations to drive future sales growth and improve the customer experience. 
Our current and upcoming product marketing initiatives highlight our iconic core products, emphasize the core values of the brand while adding interest and newness. As an example, last month, we launched our new limited-edition Polo shirt collection. We are releasing a new shirt every month through November, each inspired by one of our signature design motifs. The launch is supported by social media as we collaborate with influencers on Instagram. Our goal for this program is to position our Polo shirt as an item to covet, reach a new consumer and garner fashion editorial coverage of our icon.
We also recently introduced our new fragrance, Ralph Lauren Woman. The face of this new fragrance is two-time Oscar-nominated actress, Jessica Chastain. Digital and social media support for the launch started in July and the product is available this month. 
In September, we will launch our new global family marketing campaign with strong outdoor and digital component. This, too, highlights Ralph Lauren's core values that our brand is built on. 
Moving on to our segment highlights. As you know, we are now reporting under our new segments: North America, Europe and Asia. This offers increased visibility into our sales and profitability by region and increased transparency into the development of our business and the progress of our initiatives around the globe.
In North America, we continue to execute our plan to come back to profitable growth. Revenue was down 17% in the first quarter and reflected important progress across our quality-of-sales initiatives. As a result, we expanded gross margin and prudently reduce expenses, delivering 110 basis points of expansion in adjusted operating margin. 
In North America wholesale, we continued our work to right size our business for the long-term health of the brand. We strategically reduced shipments to better align with underlying demand, exited brands, lowered our sales to the off-price channel and closed underperforming doors. We are on track to close 20% to 25% of our U.S. department store points of distribution by the second half of FY '18. We are about halfway through these closures as of the end of the first quarter.
These deliberate actions accounted for almost 20 points of the 27% decline in U.S. wholesale in the quarter. Consumer demand and channel dynamics remained a challenge as well. To address this and improve the positioning of our brand, we are investing in refreshing our wholesale store environments to improve the consumer experience, and we are evolving our product and marketing to turn around this trend. 
The sweet spot of U.S. wholesale is their growing digital business. Our retail sales on our U.S. department store customer's websites continue to post positive growth versus last year and as a percentage of our total department store business. We will continue to drive growth to our online partners in FY '18 and evolve our digital strategy to move with the consumer where, how and when they choose to shop.
Moving on to our directly operated e-commerce business in North America. We are aggressively addressing our high level of promotion activity to both ensure price coherency across our channels and to enhance the overall brand and shopping experience in this our most important door. These actions in North America drove strong gross margin expansion of 220 basis points to last year. However, they put significant pressure on revenue. North America e-commerce comps were down 22% in the first quarter, reflecting lower levels of promotion activity. 
To improve the consumer experience online and move beyond promotion-lead sales, one of our key digital initiatives is the transition of our platform to a cloud-based solution. With our new consumer interface, we will continue to directly operate and fulfill our e-commerce business with reduced transaction friction for our consumers, improve the ability to execute dynamic changes and enhance omnichannel capabilities. We are on track to launch by the second half of fiscal 2018. This solution will deliver a more brand enhancing and consistent experience for customers and provide a more flexible and nimble solution for us. 
Moving on to our international regions. In Europe, in constant currency, revenue was down 10% in the first quarter. However, adjusted operating margin was up 90 basis points. Wholesale revenue in Europe was down 28% in the first quarter. About half of this decline was due to a shift in timing of shipments to bring delivery closer to demand. Brand exits and reduced off-price sales accounted for the remainder of the decline.  Excluding these factors, the underlying trend of the Europe wholesale business is flattish. In Europe, retail sales were flat to last year in constant currency with comps down 8% as we continued our work with quality-of-sales initiatives.  While this ongoing work impacted comp growth negatively in the first quarter, it drove an 8% increase in AUR, 500 basis point decline in discount rate and 500 basis points of gross margin improvement across our retail network. This contributed to the improvement in operating margin for Europe, and we will continue this strategy for the remainder of the year. 
In Asia, in constant currency, revenue was up 1% in the first quarter and adjusted operating margin was up 610 basis points. As we mentioned on previous calls, we have been focused on improving quality of sales in Asia over the past 12 to 18 months. We are beginning to see comp stabilize in the region. And in the first quarter, they were up 2% in constant currency, driven by increased traffic.  Quality of sales metrics continued to be strong as well. Average unit retails were up, discount rates were down and gross margin was up significantly in Asia. We expect continued comp growth as we upgrade our distribution network and continue our marketing initiatives to amplify the brand, specifically by increasing engagement with celebrities and influencers in Asia.
Turning to our store fleet. We continued to improve our retail network in the first quarter through a closure of underperforming locations and opening new stores with improved adjacencies. We opened 6 and closed 5 stand-alone stores. And in concessions, we opened 9 and closed 4 doors, ending the quarter with 467 stand-alone stores and 624 concessions on a global basis.  At year-end, we expect our stand-alone network of doors to be about flat to last year and have a net increase of 35 to 40 concessions, primarily in Asia. 
Moving on to the balance sheet. Our progress with our plan is reflected in our strength in inventory and cash positions. At the end of the first quarter, inventory declined 31% to $860 million versus last year. This inventory reduction is driven by prior year restructuring actions and more effective buying processes, including a proactive pullback in receipts. We will continue to focus on inventory productivity and matching inventory flows with demand.  We ended the first quarter with approximately $1.7 billion in cash and short and long-term investments, up from $1.2 billion at the end of last year's first quarter. Total debt at the end of the first quarter was $590 million. 
Now I'd like to turn to guidance for the full year and the second quarter of fiscal '18.  As a reminder, this guidance excludes restructuring and other charges. We are reiterating our guidance for fiscal '18. We continue to expect revenues to decline 8% to 9% for the year, excluding the impact of foreign currency. Brand and distribution exits in both wholesale and retail account for approximately half the decline with quality-of-sales initiatives and challenging traffic trends representing the remainder. We expect the sales trend to improve as we move through the year.
Based on current exchange rates, foreign currency is now expected to have minimal impact on revenue growth in fiscal 2018. This is more favorable than our previous guidance of 150 basis points of negative impact. As you know, over the last several months, the euro has strengthened against the U.S. dollar. While clearly volatile, we are now assuming a euro/U.S. dollar exchange rate to be $1.14 versus our previous assumption of $1.06. The change in our euro/U.S. dollar exchange rate assumptions is much more impactful on our sales growth than on our gross and operating margins. This is a result of our approach to hedging. 
We hedge our transaction risk, but not our translation risk. Our hedging programs for our inventory purchases enables us to have less volatility for our margin from exchange rate movements. We continue to expect operating margin for fiscal 2018 to be 9% to 10.5%, excluding the impact of foreign currency. Based on current exchange rates, foreign currency is now expected to pressure operating margin for fiscal 2018 by approximately 40 to 50 basis points, less than the 50 to 75 basis points we guided to in May.
For the second quarter, we expect revenues to be down 9% to 10%, excluding the impact of foreign currency. Based on current exchange rates, the foreign currency is expected to pressure revenue growth by about 40 basis points in the second quarter. 
Operating margin for the second quarter of fiscal 2018 is expected to be up 40 to 60 basis points, excluding currency impacts. Foreign currency is estimated to pressure operating margin by approximately 40 basis points. 
As we move through FY '18, we expect SG&A declines to moderate as we begin to lap last year's reductions and start to invest in growth initiatives around products, marketing and store concepts that demonstrate high potential for returns. We believe this is the right decision for the long term as we balance near-term margin pressure with setting up the company to return to growth.
In addition, our SG&A rate is affected by sales mix shifts. Similar to gross margin, as retail becomes a larger percentage of our mix, it pressures our SG&A rate because retail has a much higher SG&A rate than wholesale. As a reminder, we record all our store occupancy and payroll expenses in our SG&A line. It is also worth noting that FX is becoming less of a tailwind and in fact, is turning into a headwind for SG&A.
In terms of restructuring and other charges, we continue to expect approximately $200 million for the year. We recognize $47 million of the charges in the first quarter. Regarding tax rates. As a reminder, the adoption of the new accounting standard, ASU 2016-09 for the accounting of employees share-based payments affects our effective tax rate and increases its variability, with one of the key variables being the price of our stock. 
Our tax rate guidance assumes a stock price of $78 per share for the remainder of the year. We expect our effective tax rate for fiscal '18 to be approximately 24% to 25% and for the second quarter to be approximately 24%, including ASU.
The guidance for fiscal '18 tax rate is lower than previously forecasted. This is due to recent favorable movements in foreign exchange rates as we now expect to generate a larger portion of our earnings from jurisdictions where our earnings are taxed at a lower rate than the U.S. In addition, there was some modest favorable adjustments to our tax reserves that resulted in a net benefit to full year forecasted effective tax rate.
Let's me finish by reviewing our priorities for cash and capital structure. In times of dynamic change, a strong balance sheet is a strategic asset. We are committed to maintaining our strong balance sheet and investment-grade credit rating to provide strategic flexibility, liquidity and access to capital markets. Within that context, our first priority for cash is to invest in our business and lay the foundation for future profitable growth. Our second priority is to return capital to shareholders with a commitment to maintaining our dividend. Excess cash flow beyond current and future investment and dividend needs will be considered for future potential share repurchases.  We are not planning share repurchases for fiscal 2018. We make this determination based on the cash needs of our business, sector dynamics and with consideration for the uncertain environment around U.S. tax reform. We continue to expect capital expenditures for fiscal '18 to be approximately $300 million, driven by select new store openings, renovation of our retail environment and infrastructure investment. 
In closing, we are moving in the right direction, and I am incredibly proud of our team of 23,000 committed, passionate and dedicated Ralph Lauren employees around the globe. Together, we are committed to creating a strong foundation to evolve this iconic brand consistent with Ralph's enduring vision. With Patrice's leadership, we will continue to intensely focus on execution as we, together, create a pathway towards sustainable growth. 
With that, let's open up the call for your questions."
362220,531177046,1271480,"Ralph Lauren Corporation, Q1 2018 Earnings Call, Aug 08, 2017",2017-08-08,"Earnings Calls","Ralph Lauren Corporation","Operator","[Operator Instructions] The first question comes from Ike Boruchow with Wells Fargo.",12,"[Operator Instructions] The first question comes from Ike Boruchow with Wells Fargo."
