"companyid","keydevid","transcriptid","headline","mostimportantdateutc","keydeveventtypename","companyname","speakertypename","componenttextpreview","word_count","componenttext"
362220,416154290,1122216,"Ralph Lauren Corporation, Q3 2017 Earnings Call, Feb 02, 2017",2017-02-02,"Earnings Calls","Ralph Lauren Corporation","Operator","Ladies and gentlemen, thank you for standing by. Welcome to the Ralph Lauren Third Quarter Fiscal Year 2017 Earnings Call [Operator Instructions] As a reminder, this conference is being recorded. I would now like to turn the conference over to our host, M",48,"Ladies and gentlemen, thank you for standing by. Welcome to the Ralph Lauren Third Quarter Fiscal Year 2017 Earnings Call [Operator Instructions] As a reminder, this conference is being recorded. I would now like to turn the conference over to our host, Mrs. Evren Kopelman. Please go ahead."
362220,416154290,1122216,"Ralph Lauren Corporation, Q3 2017 Earnings Call, Feb 02, 2017",2017-02-02,"Earnings Calls","Ralph Lauren Corporation","Executives","Good morning, and thank you for joining Ralph Lauren's Third Quarter Fiscal 2017 Conference Call. With me today are Stefan Larsson, the company's President and Chief Executive Officer; and Jane Nielsen, Chief Financial Officer. After prepared remarks, we",168,"Good morning, and thank you for joining Ralph Lauren's Third Quarter Fiscal 2017 Conference Call. With me today are Stefan Larsson, the company's President and Chief Executive Officer; and Jane Nielsen, Chief Financial Officer. After prepared remarks, we will open up the call for your questions. [Operator Instructions] During today's call, we will be making some forward-looking statements within the meaning of the federal securities laws, including our financial outlook. Forward-looking statements are not guarantees, and our actual results may differ materially from those expressed or implied in the forward-looking statements. Our expectations contain many risks and uncertainties. Principal risks and uncertainties that could cause our results to differ materially from our current expectations are detailed in our SEC filings. To find disclosures and reconciliations of non-GAAP measures that we use when discussing our financial results, you should refer to this morning's earnings release and to our SEC filings that can be found on our Investor Relations website. And now I will turn the call over to Stefan."
362220,416154290,1122216,"Ralph Lauren Corporation, Q3 2017 Earnings Call, Feb 02, 2017",2017-02-02,"Earnings Calls","Ralph Lauren Corporation","Executives","Thank you, Evren, and good morning, everyone. As you saw in the release this morning, the company and I mutually agreed to part ways. And I want to take a brief moment to give you some context. Ralph and I both love and respect the DNA of this great brand",481,"Thank you, Evren, and good morning, everyone. As you saw in the release this morning, the company and I mutually agreed to part ways. And I want to take a brief moment to give you some context. Ralph and I both love and respect the DNA of this great brand and we recognize the need to evolve. However, we have found that we have different views on how to evolve the creative and consumer-facing parts of the business. I want everyone on the call, shareholders and analysts, to know that the board, Ralph and I, have over the last months, worked very hard to find common ground. After many serious conversations with one another, we mutually agreed to part ways. None of this changes how proud I am of all the progress we made against the goals we laid out in our Way Forward Plan in June. As I've shared then, the Way Forward Plan is about refocusing on the core of what made us iconic and evolving that core for today, to strengthen the brand and return the company to long-term profitable growth. Both Ralph and the board are committed to continued execution of our plan. We are on track to deliver on our commitments. A key driver to this is our strengthened management team and their ability to drive high-quality execution. Together, we have already created a strong foundation, one that puts us in a position to continue to deliver. Our progress includes the strengthening of the leadership team, refocusing on our core brands, starting to evolve our iconic products and marketing, matching inventory to demand, drastically reducing lead times, creating a more nimble organizational structure, beginning to rightsize the store fleet, achieving the initial cost reductions and as we learned from our recent global employee survey, we have substantially improved the employee engagement and understanding of the strategy. 
When Jane later in this call will speak about the progress we made in the third quarter, you will hear how these initiatives are starting to show up in the company's P&L. I remain very confident that the Way Forward framework has the ability to drive the company back to high performance. And I will stay on until May 1 to ensure the uninterrupted execution. Before I turn it over to Jane for her to review the progress we have made on the Way Forward Plan in the quarter, I want to say a few words about her. As I begin my transition, she will take charge of the execution of our plan. Jane and I have been copilots since she joined, and we will work closely together to make this transition successful. She has the credibility, the experience and the trust from Ralph and the board. I could not be more confident in her ability to deliver. With that, I would like to turn the call over to Jane."
362220,416154290,1122216,"Ralph Lauren Corporation, Q3 2017 Earnings Call, Feb 02, 2017",2017-02-02,"Earnings Calls","Ralph Lauren Corporation","Executives","Thank you, Stefan, and good morning, everyone. Before I review our performance and future outlook, I want to reiterate that our foundation is strong. As Stefan said, we worked very closely since I joined and we will continue that partnership through his e",1977,"Thank you, Stefan, and good morning, everyone. Before I review our performance and future outlook, I want to reiterate that our foundation is strong. As Stefan said, we worked very closely since I joined and we will continue that partnership through his extended transition period to ensure that our progress is uninterrupted. 
With the support of Ralph, the board and together with our leadership team, I am committed to leading our continued execution. We are as focused as we have ever been on delivering the Way Forward Plan, to strengthen the brand and drive sustainable profitable growth over the long term. 
Now on to our performance. First, let's review the progress we made this quarter in executing the Way Forward Plan, starting with products for Fall 2017. First, we refocused and evolved our iconic core product offering. We updated our color palettes, materials and fits, incorporating more consumer insights and marketplace intelligence into our decision making. 
Second, we improved our discipline in applying a systematic, repeatable way of building a stronger assortment. This means being very clear on what we are testing, what we are growing and what icons we are reinventing. This has enabled us to cut the long tail of unproductive styles, delivering a double-digit reduction in the number of SKUs we have designed for Fall 2017, resulting in a much more focused, productive assortment and lower development cost. 
Third, our improved discipline in the assortment creation is enabling us to buy closer to market and reduce early commitments. Our premarket commitment for next fall is down significantly to last year. For Polo, we committed to only 15% of our buys premarket before our wholesale customers placed their orders. Last year, this figure was 60%. As a result, we are buying much more informed, which will significantly improve our ability to match inventory to demand. The initial feedback from our wholesale customers that have seen our fall product had been very positive. 
Fourth, we are well under way to build a best-in-class sourcing capability and the demand-driven supply chain. We remain on track to reach our goal of a 9-month lead time. We continue to expect to get halfway there by the end of this fiscal year and 90% there by the end of next fiscal year. This quarter, we achieved our goal of having all our core fabrics platformed for the upcoming Fall 2017 season, which enables us to make further progress in cutting our lead times. 
Moving on to marketing. We are making good progress in our search for a Chief Marketing Officer. In the meantime, we are preparing for our first cut through [ph] Polo marketing campaign for summer. For this past fall holiday season, we launched the Ralph Lauren Icons marketing campaign, which was built on our goal to refocus on and evolve our core iconic products in [ph] luxury. The campaign was very well received, and we will be launching the second part of the campaign later this month. 
Moving on to our financials for the quarter. We continued to deliver against our commitments. We increased our quality of sales by moderating discount levels, lowering our inventory to align supply with demand and reducing our lead times. As you saw in our press release, revenues declined 12%, in line with guidance. Adjusted operating margin was 12.8%. On a constant currency basis, adjusted operating margin was up about 40 basis points to last year. Additionally, non-GAAP operating margin expanded in constant currency in both the retail and wholesale segments. The adjusted operating margin performance was better than the outlook we provided in November, largely driven by gross margin and proactive expense management. Adjusted gross margin expanded by 140 basis points versus last year, driven by favorable geographic and channel mix and initiatives to improve quality of sales, including reduced promotional activity across our businesses. This was partially offset by unfavorable foreign currency effects of approximately 100 basis points. 
Operating expenses, excluding restructuring and other related charges, were down 7% compared to last year as a result of expense initiatives under the Way Forward Plan, including streamlining the organization to reduce headcount, process changes in product development to reduce costs and closing unprofitable stores to improve the profitability of our fleet. 
In North America, across our businesses, the team started to execute against the plan we shared last quarter to come back to high performance. North America continues to be our most challenged market. Revenue declined 15% in the quarter, led by a planned [ph] decline in wholesale. We strengthened our foundation by strategically reducing shipments to better align with underlying demand and rightsize our inventory levels. In addition, we started to rebalance our distribution in our off-price wholesale business. We also executed these important quality of sales initiatives in our direct-to-consumer e-commerce business. These actions will continue to impact our results in the fourth quarter on our e-commerce site. E-commerce has been our most over promoted channel, and we are moving to harmonize pricing across channels and reduce promotion depth. These are the first steps in the execution of our plan to come back to high performance in North America. They are difficult but necessary actions to build a healthy base to grow from. We expect these actions to continue through the first half of fiscal 2018. 
In Europe, store comps improved in the third quarter despite lower markdowns as we continue to deliver on our quality of sales initiatives. Our Europe team continued to drive substantial improvement in both gross margin and operating margin in constant currency. Revenue was down 6% in constant currency and 12% on a reported basis. As expected, we shifted $18 million of wholesale shipments to the fourth quarter to better align with demand in our wholesale doors. Excluding this shift, revenue would have been close to flat in constant currency. 
In our retail business in Europe, we reduced promotion, drove up AURs and expanded gross margin significantly on a year-over-year basis in constant currency. Our team continues to focus on tighter inventory management and strengthening the assortment going forward. 
Similarly, in Asia, we drove significantly lower markdown rates in each channel and expanded margins. Revenue was down 1% in constant currency and up 4% on a reported basis. Comp growth was positive in Asia in the third quarter. Going forward, we are focused on returning to revenue growth in Asia as new distribution growth offsets closures. 
Moving to comparable store sales. On a global basis, comps decreased 4% in constant currency. As a reminder, the high volume week after Christmas was included in the company's third quarter this year versus the fourth quarter last year with a positive impact of approximately 2.5 percentage points, which will pressure comps in the fourth quarter. Additionally, Easter will shift into the first quarter of FY '18. The combined effect of these 2 calendar shifts will pressure fourth quarter comps approximately 3 percentage points. 
Moving to global e-commerce. Revenues declined 9% in constant currency. The e-commerce decline is driven by our initiatives in the U.S. that I just took you through. The impact of these actions will accelerate in the fourth quarter and continue to pressure the first half of fiscal 2018. 
Turning to our store fleet. We are on track to close approximately 50 stores this year. We closed 12 stores in the third quarter and 27 year-to-date. This puts us on track to achieve the savings that we identified from store closures of approximately $70 million. Importantly, we are also on track with our total savings target. At this time, restructuring charges are forecasted to be about $400 million and inventory charges about $150 million associated with the company's Way Forward Plan. 
In this quarter, we recorded $91 million in restructuring-related impairments and inventory charges. 
Moving on to the balance sheet. Our progress with the Way Forward Plan is reflected in our inventory position. At the end of the third quarter, inventory declined 23% to $984 million versus last year. This inventory reduction is driven by both restructuring actions and our operating process initiatives, including a proactive pullback in receipts and moving towards a demand-driven supply chain. We ended the third quarter with approximately $1.5 billion in cash and investments and $589 million of total debt. 
Now I'd like to turn to guidance for fiscal '17. As a reminder, this guidance excludes restructuring and other related charges in connection with the company's Way Forward Plan and severance-related payments associated with the CEO departure announced today. 
For fiscal '17, we are maintaining our guidance. We continue to expect revenues to decrease at a low double-digit rate as we execute the Way Forward Plan. Based on our current exchange rates, foreign currency is expected to have minimal impact on revenue growth in fiscal '17. We also continue to expect operating margin for fiscal '17 to be approximately 10%, as cost savings are expected to be offset by growth in new store expenses, unfavorable foreign currency impacts, infrastructure investments and fixed cost deleverage. The fiscal 2017 tax rate is estimated to be approximately 29%. 
For the fourth quarter, we expect revenues to be down mid teens on a reported basis. This compares 13 weeks this year to 14 weeks last year. The 53rd week last year contributed approximately $72 million of net revenue, including $10 million in the wholesale segment and $62 million in the retail segment as well as $12 million of operating income. Based on current exchange rates, foreign currency is expected to pressure revenue growth by about 100 basis points in the fourth quarter and will pressure gross margin by approximately 70 basis points. 
Operating margin for the fourth quarter is expected to be approximately 6% to 6.5%. Foreign currency is estimated to pressure operating margin by about 100 basis points. The fourth quarter tax rate is estimated at 30%. We now expect capital expenditures for fiscal '17 to be approximately $325 million, down $50 million from our previous guidance of $375 million as we increased our rigor and focus on return on investment. 
Regarding share repurchases. Year-to-date, we have repurchased $100 million of our stock and we plan to execute another $100 million in the fourth quarter to reach $200 million for the full year, consistent with our communication in June. Our expectations for fiscal '18 are consistent with the outlook we provided at our Investor Day in June. We continue to expect the magnitude of revenue decline to stabilize and be less than the declines in fiscal '17. Currently, we are forecasting revenue in fiscal '18 to decline high single digits in constant currency. This includes 200 basis points of pressure from our actions in rightsizing our distribution in both wholesale and retail, and another 200 basis points from the previously announced closure of Denim & Supply. These actions will be taken in conjunction with our quality of sales and price harmonization initiatives. We expect our trend to improve in the second half of the year as we move forward in the execution of the Way Forward Plan. 
We expect operating margin to expand in fiscal '18 in constant currency, driven by both gross margin and operating cost improvement. We plan to provide more specific guidance for fiscal '18 on our fourth quarter call in May, as is our practice. 
In summary, we have created a strong foundation and we are delivering our Way Forward Plan commitments. As I look ahead, with the support of Ralph, the board and together with our leadership team, we have the key elements in place to ensure our continued progress. With the passion and commitment of over 25,000 Ralph Lauren employees around the globe, we will intensify our execution of the plan, which will strengthen our brand and return us to long-term profitable growth. With that, I want to turn the call back to Stefan for some closing remarks."
362220,416154290,1122216,"Ralph Lauren Corporation, Q3 2017 Earnings Call, Feb 02, 2017",2017-02-02,"Earnings Calls","Ralph Lauren Corporation","Executives","Thank you, Jane. In closing, while I'm disappointed that I will not be here to see the Way Forward Plan completely implemented, I'm confident that we have built a strong foundation and have the right team in place to continue to deliver on what we set out",118,"Thank you, Jane. In closing, while I'm disappointed that I will not be here to see the Way Forward Plan completely implemented, I'm confident that we have built a strong foundation and have the right team in place to continue to deliver on what we set out in June. I truly believe that this brand and this team have the potential to do amazing things, and I expect them to take the Way Forward Plan and make it even stronger. This has been a great opportunity for me. I'm glad I made the decision to join the company. I've learned a lot and I look forward to what's next. Now let's open up the call for your questions."
362220,416154290,1122216,"Ralph Lauren Corporation, Q3 2017 Earnings Call, Feb 02, 2017",2017-02-02,"Earnings Calls","Ralph Lauren Corporation","Operator","[Operator Instructions] The first question comes from Omar Saad with Evercore ISI.",12,"[Operator Instructions] The first question comes from Omar Saad with Evercore ISI."
362220,416154290,1122216,"Ralph Lauren Corporation, Q3 2017 Earnings Call, Feb 02, 2017",2017-02-02,"Earnings Calls","Ralph Lauren Corporation","Analysts","Stefan, are you willing to discuss in more detail about some granular-level insight about how yours and Ralph's views differed? I know I'm asking you to talk about kind of some disagreements you may have had with this American icon and how to improve the",88,"Stefan, are you willing to discuss in more detail about some granular-level insight about how yours and Ralph's views differed? I know I'm asking you to talk about kind of some disagreements you may have had with this American icon and how to improve the company that he founded. But you both have really successful track records in the industry. It's really important, I think, for investors to have some insight into what you wanted to do that he didn't, especially since we don't have access to Ralph."
362220,416154290,1122216,"Ralph Lauren Corporation, Q3 2017 Earnings Call, Feb 02, 2017",2017-02-02,"Earnings Calls","Ralph Lauren Corporation","Executives","Okay. Thanks, Omar, and I understand the question. First, I just want to say that I have deep respect for Ralph and the board. And let's start with what we agree on. We both share a deep respect and love for the DNA of the brand. We both agree that we nee",161,"Okay. Thanks, Omar, and I understand the question. First, I just want to say that I have deep respect for Ralph and the board. And let's start with what we agree on. We both share a deep respect and love for the DNA of the brand. We both agree that we need to evolve, and that's why we set out on the Way Forward Plan, which both Ralph and the board supports. What it came down to, Omar, was that we have different views on how to evolve the creative and consumer-facing parts of the company. And the most detailed I can be is to just say it comes down to decisions relating to how to evolve those areas: product, marketing, shopping experience. And we really worked hard. And I spent my whole career, 20 years, in family-controlled businesses. So we worked hard to find common ground. We didn't, and that's what led to this mutual decision that we communicated today."
362220,416154290,1122216,"Ralph Lauren Corporation, Q3 2017 Earnings Call, Feb 02, 2017",2017-02-02,"Earnings Calls","Ralph Lauren Corporation","Operator","The next question comes from Rick Patel with CLSA.",9,"The next question comes from Rick Patel with CLSA."
362220,416154290,1122216,"Ralph Lauren Corporation, Q3 2017 Earnings Call, Feb 02, 2017",2017-02-02,"Earnings Calls","Ralph Lauren Corporation","Analysts","As you look at -- as we think about what you've accomplished so far and what's left to do, can you talk about the potential for longer-term margin recovery? I know there's a lot of changes going on in the business right now and you have an updated outlook",87,"As you look at -- as we think about what you've accomplished so far and what's left to do, can you talk about the potential for longer-term margin recovery? I know there's a lot of changes going on in the business right now and you have an updated outlook for fiscal '18, so as we think about all these moving pieces, do you still think you can get to mid-teen margins over the long run as you execute this plan? Or does that remain to be seen?"
362220,416154290,1122216,"Ralph Lauren Corporation, Q3 2017 Earnings Call, Feb 02, 2017",2017-02-02,"Earnings Calls","Ralph Lauren Corporation","Executives","Rick, I think we have confidence in the guidance that we laid out in the Way Forward Plan in June, both for '18 and beyond in '19 and '20. Our commitment is to get to profitable growth. It will be a combination of top line growth, and in the near term, gr",202,"Rick, I think we have confidence in the guidance that we laid out in the Way Forward Plan in June, both for '18 and beyond in '19 and '20. Our commitment is to get to profitable growth. It will be a combination of top line growth, and in the near term, gross margin expansion and leveraging a better and more efficient cost structure. So we do see gross margin expansion. You've seen, over the past several quarters, that we've had favorable trends in gross margin in this quarter. If you look at it on a constant currency basis, we expanded gross margin by 240 basis points. Obviously, we had 100 points of pressure from foreign currency, but we got a benefit from -- about half of the 140 points was a benefit from channel and geographic mix. I expect that to continue. And then importantly, a little less than half of our gross margin expansion came directly from our quality of sales initiatives where, across our businesses, we reduced promotions and discount levels, and we're able to pull that through in terms of gross margin. So I do see that as a durable tailwind for us as we move into the future."
362220,416154290,1122216,"Ralph Lauren Corporation, Q3 2017 Earnings Call, Feb 02, 2017",2017-02-02,"Earnings Calls","Ralph Lauren Corporation","Operator","The next question comes from Michael Binetti with UBS.",9,"The next question comes from Michael Binetti with UBS."
