"companyid","keydevid","transcriptid","headline","mostimportantdateutc","keydeveventtypename","companyname","speakertypename","componenttextpreview","word_count","componenttext"
377837,532067638,1260378,"Solvay SA, Q2 2017 Earnings Call, Aug 01, 2017",2017-08-01,"Earnings Calls","Solvay SA","Executives","Thank you very much for your introduction. Hello, everyone, I'm here in Brussels with Karim Hajjar and Kimberly. And we are very pleased to have this opportunity to share with you the highlights of our second quarter results. We'll use the usual structure",810,"Thank you very much for your introduction. Hello, everyone, I'm here in Brussels with Karim Hajjar and Kimberly. And we are very pleased to have this opportunity to share with you the highlights of our second quarter results. We'll use the usual structure. I will make an introduction. Karim will come with a bit more detail. We'll try to keep it relatively short, so that we can have as much time as necessary for the Q&A session.
Clearly, a strong momentum continuing into Q2. Volume growth is indeed a record driver for our EBITDA growth. And we are very pleased to see that all 4 segments contributing to sales and profit growth in the quarter. 
Sales increased, as you've seen, by 11%. And again, the key driver is volume growth, which is what we were expecting, but we are pleased to see that this is indeed materializing, and that's something which demonstrate that, indeed, our strategy is paying off.
18% EBITDA growth. We have a one-time event which is linked to Cytec integration synergies. We underline the benefit of the Cytec teams to the policy of Solvay. This generated a EUR 38 million one-off impact, a positive impact on our EBITDA, and we'll see the consequences materializing in cash over the next few years. Once again, the key driver was higher volume. And this took place in businesses which have been growing for quite some number of quarters, but we've seen also the situation of a couple of businesses, which shut off last year, turning that is the case for oil and gas in North America, and this was also the case for our smart device position. 
Our costs grew with our capacity expansion, but of course, through our excellence measures that we have put in place helped offset the inflation. Overall, new record operating margin at 23%, which puts us probably in the leading seat within the European headquarter diversified chemical companies. 
And as you've seen in our presentation, we wanted to present on financial, but there are also extract financial metrics, and [indiscernible] CapEx reduction is probably the one which is the most important for us, and you see that we continue also to improve on this metric, and we are very much in line with the strategic commitments that we have shared with you when we had our Capital Market Day in London almost a year ago.
Maybe just a word on Cytec, Karim will comment the various clusters. But on Cytec, cost synergies are now at a run rate, which is approximately EUR 115 million, which is really at the top end of the expectations that we've shared with you. The focus now is on generating revenue synergies, and we have several project underway, and we are already seeing some actual impact on some market. The fact that we are becoming, I would say, more global in this business, Cytec tend to be a little bit U.S. focused, and now we are really -- our ambition is really to be a global player in this market, which is already bringing some new revenues. And we have some technology development, the most promising one being around the thermoplastic composite.
Talking of composite, we are starting to see a turnaround in composite for aerospace. We've seen some growth this quarter. June was the strongest sales month since we have owned the business. And this is very much linked to one of the improvement in production of singular aircraft, both at Boeing and at Airbus. These very large players have experienced over the past year a number of difficulties in their manufacturing operations, so they are improving, as you might have seen, and we are benefiting from that. In the context where we don't see much inventory movement in the supply chain, there was some inventory reduction last year that have impacted us, but now we've seen the supply chain is quite lean in terms of inventory, and we are benefiting directly from what's happening in the beginning of a chain. And on top of that, a couple of very successful program, the F-45 and relief engine, which are in a -- which are at a very aggressive stroke in terms of increasing in production rate, and we are benefiting from that.
I guess I'm very pleased, and I have to admit it, with our performance in the first half. I think the strategy that we've put in place over the past years is indeed delivering. And the fact that we see a strong growth as being a strong volume growth as being the driver of our EBITDA growth is something which gives us assurance that we've built indeed a strong and solid growth engines within Solvay's portfolio. 
With that, I would like to turn to Karim to go into a bit more detail insights on our financial performance."
377837,532067638,1260378,"Solvay SA, Q2 2017 Earnings Call, Aug 01, 2017",2017-08-01,"Earnings Calls","Solvay SA","Executives","Thank you, Jean-Pierre. As usual, the numbers I'm going to discuss are on an underlying basis, and I will refer to a few slides that are available on our website. I'll start with our top line growth, our systems growth development percent, and I'm on",1065,"Thank you, Jean-Pierre. 
As usual, the numbers I'm going to discuss are on an underlying basis, and I will refer to a few slides that are available on our website. 
I'll start with our top line growth, our systems growth development percent, and I'm on page -- on Slide 10, you will see the facts and the figures there. 
Maybe just highlight the fact that this is the third consecutive quarter where we've now seen sales growth. And that dynamic is very, very encouraging as far as we're concerned. Volumes, as Jean-Pierre alluded to, contributes the vast majority of that with 8% of that growth, but it's also good to know the contribution that pricing has contributed as well in terms of the 2.8%, mainly in the Polyamide business. 
 
But it's EBITDA where I'd like to focus the most of our time today, and perhaps invite you to turn to Slide #11. 
And beyond the facts of EBITDA being up 11%, we like to highlight is the volumes I referred to contributed to EUR 96 million to the growth in EBITDA, and that was partially offset by fixed cost increases. Now clearly, as we drive volume growth, we have also been investing in new capacity. So for example, if I look at the 3 most notable capacity increases in in the peak plant in Georgia in the states, which actually serves our smart devices market, the carbon fiber expansion within South Carolina, all of that comes at a cost, and that's why you see a cost increase there as well.
Pricing did contribute a positive impact of 5%. Again, that has helped not the least by our excellence programs, as well as successful price increase initiatives. 
I do want to draw your attention to one item on the profit bridge, which is the EUR 27 million positive Other. And that includes the EUR 38 million of one-time synergies in the U.S. whereas in Q2 last year, you may recall that we had a one-time gain of EUR 11 million, resulting from the sale of surplus assets in soda ash. 
That's the overall picture. 
If I turn to the individual segments. 
Advanced Materials. EBITDA up 22%, a record EBITDA margin, 31%. So where does that come from? Specialty Polymers has sustained its broad-based growth in a number of markets, again, led by a strong demand in the automotive sector, but we also saw some acceleration of growth in smart devices. Remembering, however, that the first half of last year was somewhat subdued, not least because of the destocking impacts that you will no doubt recall. 
Jean-Pierre has already mentioned the positive momentum in the composite business. And he is explained to you how the production increases we're seeing in singular leap and the joint strike fighter are really beginning to show themselves and to our bottom line.
But there's more. Advance formulations grew 5.2%, and EBITDA margin was sequentially flat at 17%. As we explained last quarter, the activity levels in the oil and gas markets are improving. And this is positively impacting our Novecare business, driving sales up 24% in the quarter. We also benefited from increased demand in the agricultural market.
Turning to technology solutions. 
Customer specific issues in mining were offset with new business developments in that business. Performance Chemicals had a decent quarter, with 1% EBITDA growth, whilst sustaining a very strong margin of 29%. Where is it coming from? Peroxides was a significant contributor in the quarter with the startup of the operation for HPPO in Saudi. Soda ash remains steady, and in fact, we saw slight volume increases, mainly in the seaborne market, whereas bicarbonate continues to grow supported by the investment that we made in the new Thailand plant. Also, you remember that soda ash benefited this time last year from that one-time gain on the sale of surplus assets of EUR 11 million. Functional Polymers, very superb result in this quarter, driven by -- well, it had a 57% EBITDA increase, driven by 2 factors: strong demand in auto and price increases that passed through the cost increases that we experienced earlier in the year.
But there is more to our delivery this quarter than just EBITDA. If you turn to Page 12, Slide 12, you notice that our net income is up 38%. Now not that does reflect the EBITDA increase, but also 2 other things: one, a drop in financial charges; and 2, a reduction in our underlying tax rate from 30% last year to 26% this year. And this is driven largely by the evolution in the geographic mix of our pretax earnings.
Cash. On Page 12, you will see the picture on debt and cash. And there's a few things I'd like to highlight here. One is the fact that our free cash flow in the first half of this year from our continuing businesses doubled from EUR 123 million to EUR 245 million. It's coming from a number of factors: higher profit clearly, but also, a very strong discipline on working capital. Our working capital intensity is remaining flat compared to last year, despite an 11% increase in revenues. Now that takes some doing, and so we're really pleased with that continuing discipline. Clearly, we also have the reduction in capital expenditures, but that shouldn't be a surprise, that's exactly where we thought we would be at this stage. 
So all in all, we're very pleased with the operational and cash flow performance of the quarter. 
Debt is down materially. At [ this half year ] You may recall that the seasonal nature, the profile of our cash generation is very much back ended. And we see a much stronger profile in this first half, but M&A has contributed just under EUR 1 billion of net proceeds, that obviously helps to reduce our debt by EUR 800 million when compared to 31 of December 2016.
Now finally, and before I forget, I just want to highlight the fact that you may have picked up already that in May, S&P upgraded our credit rating to BBB flat from BBB-. I really welcome this as an independent indication and validation of the portfolio progress, and fundamentally, of the real improvement, and the strength of our cash generation and our resilience of the balance sheet. 
And with that, I hand the floor back over to Jean-Pierre."
377837,532067638,1260378,"Solvay SA, Q2 2017 Earnings Call, Aug 01, 2017",2017-08-01,"Earnings Calls","Solvay SA","Executives","Thank you very much, Karim. So just a couple of comments before opening the Q&A. First one, on project priorities, and I think that it, indeed, besides what we've presented in terms of numbers for our Q2 results, we are continuing to make progress, wh",429,"Thank you very much, Karim. 
So just a couple of comments before opening the Q&A. 
First one, on project priorities, and I think that it, indeed, besides what we've presented in terms of numbers for our Q2 results, we are continuing to make progress, which are worth noting. We are at the midpoint of our 2016-2018 strategic roadmap, the one we have commented in our last Capital Market Day at this point. So we are on track to deliver on our midterm objective, and I feel confident that the company will indeed be able to achieve or exceed the objectives that we shared with you almost a year ago. 
I would really like to take this opportunity to thank all our employees, and I appreciate the fact that our customer indeed are putting us. We are more and more focused on a large program, which are absolutely key to the success of our customers, being smart devices, being airplanes, being automotives, and the ability to deliver new solutions to our customer is key, and we can do that only if they trust us, and this is the case.
Regarding portfolio upgrade, we have taken some significant actions, and you've seen that we've been very focused on closing the transactions that we have announced at the end of last year or early this year. We remain focused on remaining opportunities, that makes it all, but the portfolio movement expected in '17 would be more in the direction of divestitures, so we are looking at opportunities. We are not yet at the point of time where we can share with you any actual news, but be confident that we are indeed continuing to work on these opportunities.
2017 outlook, how do we see the rest of the year? Well, we continue to -- expect to continue to see a sequential improvement which will be linked to volume growth, especially from core growth engines in Advanced Material and advanced formulation. We have to be aware of what was the profile for 2017 -- 2016, sorry. 2016 is a  year in which we had adverse slow first half and a more dynamic second half, so the comparison will be a little bit different in the first and the second half. Taking our performance and expectations into account, we have decided to raise our full year EBITDA estimate to grow by high single-digit [indiscernible] taking into account the current situation in various core parameters, including exchange rates.
And with that, we are ready, Karim and myself, to take your question. Thank you very much."
377837,532067638,1260378,"Solvay SA, Q2 2017 Earnings Call, Aug 01, 2017",2017-08-01,"Earnings Calls","Solvay SA","Operator","[Operator Instructions]  We have a question from Peter Mackey from Exane BNP Paribas.",13,"[Operator Instructions]  We have a question from Peter Mackey from Exane BNP Paribas."
377837,532067638,1260378,"Solvay SA, Q2 2017 Earnings Call, Aug 01, 2017",2017-08-01,"Earnings Calls","Solvay SA","Analysts","And A few questions, if I can, please. First, in the advanced formulations business, if we strip out the Cytec pension gain, you did see some margin pressure there. We've seen that a number of your peers in sort of in the surfactants formulations area. Ca",255,"And A few questions, if I can, please. First, in the advanced formulations business, if we strip out the Cytec pension gain, you did see some margin pressure there. We've seen that a number of your peers in sort of in the surfactants formulations area. Can you talk about what you're doing and the confidence you have in regaining lost margin from input costs, please? And perhaps, give us some point as to on the mining side, when you think tech solutions is going to start to recover. That's still lagging, I think, some of your longer-term growth expectations. Secondly, in Performance Chemicals, obviously, a very focused on what's going on in soda ash. Accepting that the annual contract situation, you're still enjoying a pretty strong volumes on the market and spot markets. Are you seeing that the initial Turkish volumes, the expansion at soda, are you seeing any evidence of those volumes in the spot markets? And are you feeling any or seeing any signs of pre-marketing from the signer capacity, please? And then perhaps just a final question on the guidance. You indicated that the first quarter stage that you hope -- you expected to meet or exceed your mid-single-digit guidance. So you're already pointing towards a high-single digit. You've just got the -- this EUR 38 million one-off, which adds close to 2 percentage points. I mean Is it a simple case of, in your mind, adding that EUR 38 million? Or are you more confident in the underlying performance as well?"
377837,532067638,1260378,"Solvay SA, Q2 2017 Earnings Call, Aug 01, 2017",2017-08-01,"Earnings Calls","Solvay SA","Executives","Okay. Let's start with your last question, because the answer is already, in fact, we knew that the EUR 38 million would take place this year. We didn't know at which quarter because there were some accounting complexity there. So for us, it's not somethi",534,"Okay. Let's start with your last question, because the answer is already, in fact, we knew that the EUR 38 million would take place this year. We didn't know at which quarter because there were some accounting complexity there. So for us, it's not something new. It's new for you, but it's not for us. So indeed, the increase, a sequential increase in guidance for mid-single to over mid-single and now to high single is really -- demonstrate our the fact that we've gained confidence in the volume growth. And yes, today, we feel very confident to share our this high single digit guidance with you. On the advanced Formulation business, we've seen a bit of margin pressure. There is 2 element, one which is linked to Novecare, and this is very much the [Audio Gap] price situations, so we've suffered, as we said in the Q1 call, we suffered from chemical, not only increase, but volatility, the chemical prices which put pressure on margin, delayed, in some cases, our customer orders. What we've done, and it's something that we started, in fact, a year ago. We have renegotiated 2 very large contract for chemical access, which will give us extra competitiveness, so we feel reasonably confident that, indeed, over the course of the second half, we'll see margin increasing. On mining, we have also -- on technology solution, I should say, we have seen also a bit of a pressure on margin, which was mostly linked, in fact, to some difficulties, operational difficulties that our customers were facing strikes or various technical difficulties and which impacted our ability to deliver, and that's an impact on margin. are normalizing fair, so yes, I would expect the Advanced Formulation, first of all, to improve its margin over the course of the next couple of quarter. Regarding soda ash, to try to be specific as possible, you might know that our Turkish competitors are working on 2 different project. There was a first extension of 0.5 million [ turn a year ] which is done and in the markets, so it was in the market already for Q1. And then there is a second project which will come online in the remaining part of '17 and mostly in 2018. This project has been expected for quite some time. And for the last 3 or 4 years, we've been discussing about this. We have prepared ourselves as much as we could. And indeed, I think other good delivery of soda ash, I can probably take the rather, a good delivery of soda ash for the first half of the year, sure, that we are, indeed, well prepared and able to do the most out of the current market condition, taking into account a bit more competitive pressure. So very much what we've said. There will be an impact when all these Turkish capacity will go in the market, but we think that we'll be able to weather this impact with some pressure on our margins, but not for such a long period of time. And again, our confidence on our ability to manage this situation is probably a bit better today than it was 6 months ago."
377837,532067638,1260378,"Solvay SA, Q2 2017 Earnings Call, Aug 01, 2017",2017-08-01,"Earnings Calls","Solvay SA","Operator","The next question is from Nathalie Debruyne from Petercam.",9,"The next question is from Nathalie Debruyne from Petercam."
377837,532067638,1260378,"Solvay SA, Q2 2017 Earnings Call, Aug 01, 2017",2017-08-01,"Earnings Calls","Solvay SA","Analysts","I have 2 question. The first one would be on working capital. Karim, I know that you flagged that, actually, working capital was more or less flattish in the first half of the year, but it tended to spike from what I see in Q2. So can you elaborate a bit",253,"I have 2 question. The first one would be on working capital. Karim, I know that you flagged that, actually, working capital was more or less flattish in the first half of the year, but it tended to spike from what I see in Q2. So can you elaborate a bit what it was driven by? Because I do not have the impression when I look at your balance sheet that it was driven by an inventory buildup. So does the payment terms change when a supplier like that, I would like to understand this a bit. And then the second one, well, actually perhaps I have 3, I'm sorry. The second one would be on automotive. We see a lot of players was somewhere in the supply chain actually being a bit more cautious on the second part of the year. So what is your stand on that one? And what does that mean for your businesses in both Specialty Polymers and Polyamide? And then a third one, perhaps, you'll start to feel that I'm obsessed with that, but it's oil and gas. We have seen the rig counts, well, actually increasing since May last year, but it seems to be slowing down as from June, somewhere like that. And I was wondering how you feel for the second half for oil and gas. And should we expect that, well, less support, I would say, is not to say a negative price mix to persist in the second part of the year?"
377837,532067638,1260378,"Solvay SA, Q2 2017 Earnings Call, Aug 01, 2017",2017-08-01,"Earnings Calls","Solvay SA","Executives","Karim, working capital, without the spike, coming from ...",9,"Karim, working capital, without the spike, coming from ..."
377837,532067638,1260378,"Solvay SA, Q2 2017 Earnings Call, Aug 01, 2017",2017-08-01,"Earnings Calls","Solvay SA","Executives","I'm looking for it to, but I can't see it, so let me [indiscernible] [ twice ] that, Nathalie. Inventories, 1.7 billion this quarter, and the same point last year. Receivables, 1.7 against 1.7. Payables, 1.323 this year compared to 1.25 last year. So thes",258,"I'm looking for it to, but I can't see it, so let me [indiscernible] [ twice ] that, Nathalie. Inventories, 1.7 billion this quarter, and the same point last year. Receivables, 1.7 against 1.7. Payables, 1.323 this year compared to 1.25 last year. So these are the facts. If you look at working capital intensity, so taking total working capital to sales, we're about 3%, in fact, 2.9% better than last year. Last year, I did flag the fact that we had an exceptional receivable in respect of INOVYN and our accelerated exit. So on a like-for-like basis, it's very, very similar. If I look at the internal metrics, and we look at this every month. I look at day sales outstanding, I look at overdues. This time last year, I did say, too, that we'd set a new record. You know what? I wish I hadn't said it because I'm going to say that this year is a new record. So all the key operational KPIs and indicators are flashing green in that respect. And finally, to give you an order of magnitude. If you look at our working capital and add up all the gross sums, you're talking EUR 4.7 billion of gross working capital. To try and predict the manage driven, 1% of accuracy is EUR 15 million-ish. So I look at this performance, I look at it not just in a monthly basis, on a quarterly basis, but at the real strength. So despite that you mentioned how we see it, I don't."
