"companyid","keydevid","transcriptid","headline","mostimportantdateutc","keydeveventtypename","companyname","speakertypename","componenttextpreview","word_count","componenttext"
377837,532067638,1262654,"Solvay SA, Q2 2017 Earnings Call, Aug 01, 2017",2017-08-01,"Earnings Calls","Solvay SA","Analysts","2018, when we do all our forecast tonight, do we all add or take out EUR 0.10 times EUR 12 million for EBITDA? And I'm just wondering if we should just play the sensitivity or if we should also think about the volumes impact as you may have to lose volume",61,"2018, when we do all our forecast tonight, do we all add or take out EUR 0.10 times EUR 12 million for EBITDA? And I'm just wondering if we should just play the sensitivity or if we should also think about the volumes impact as you may have to lose volumes because your competitors will just be able to gain share."
377837,532067638,1262654,"Solvay SA, Q2 2017 Earnings Call, Aug 01, 2017",2017-08-01,"Earnings Calls","Solvay SA","Executives","Yes, I think it's difficult to, let's say, try and really give an indication of how foreign exchange movements can impact demand dynamics. What I can tell you is the sensitivities, you indicated EUR 0.10. For the whole of Solvay's, about EUR 120 million a",102,"Yes, I think it's difficult to, let's say, try and really give an indication of how foreign exchange movements can impact demand dynamics. What I can tell you is the sensitivities, you indicated EUR 0.10. For the whole of Solvay's, about EUR 120 million a year on an annualized basis, roughly half conversion, half transaction if you ignore the hedging. So to give you an order of magnitude, EUR 0.10 does give you roughly EUR 10 million a month. Hopefully that helps you make your assumptions. But I don't think that anybody can give you a reliable indication between FX and volumes."
377837,532067638,1262654,"Solvay SA, Q2 2017 Earnings Call, Aug 01, 2017",2017-08-01,"Earnings Calls","Solvay SA","Executives","And maybe just to complement what Karim was saying on Functional Polymer, clearly the units are holding very close to full capacity, so I don't see much transfer of product from one region to the other. And we all have in mind the overall competitiveness",340,"And maybe just to complement what Karim was saying on Functional Polymer, clearly the units are holding very close to full capacity, so I don't see much transfer of product from one region to the other. And we all have in mind the overall competitiveness of our chain. So I don't expect much disruption coming from the volatility of foreign exchange. On M&A, I think if I understood well your question, in fact, there was a bit of static on the line when you talked, but our view is that we have currently a portfolio which fits very well with our expectation. I think we have built a very strong growth engine in Advanced Materials. We have a very good position in surface chemistry/Advanced Formulations. The real challenge for us is to make sure that we work, one, on generating growth. We have a number of innovation project or top line synergy project that we want to bring to fruition. And we need the resources to do that, one. Second, I think that there is a need for Solvay at this point of time to look at all the business support part of the organization and look at how we can align them very well with the current portfolio, the current business model and the current set of customers. This also is taking a bit of time and resources, starting with [ COMAC ]. And it's the reason why I'm telling you don't expect big movement in terms of acquisition. I think the priority is really to increase or improve our position in the 2 growth engines that we have today. I could see very specific opportunities to bring in new technologies, I don't know, a new polymer, for example, or buying a company which gives us specific access to some difficult-to-access market. But this would be rather small opportunities. And yes, I think we need to get ready for maybe the next stage. But the next stage is, as I've said, a little bit distant in terms of timing."
377837,532067638,1262654,"Solvay SA, Q2 2017 Earnings Call, Aug 01, 2017",2017-08-01,"Earnings Calls","Solvay SA","Operator","The next question is from Patrick Lambert from Raymond James.",10,"The next question is from Patrick Lambert from Raymond James."
377837,532067638,1262654,"Solvay SA, Q2 2017 Earnings Call, Aug 01, 2017",2017-08-01,"Earnings Calls","Solvay SA","Analysts","A few questions left, I think, and mostly still overlapping with the others. Regarding again Cytec, I think if I remember correctly, you were -- at the end of last year, you were talking about stabilization in H2 and return to growth more in '18. We are c",151,"A few questions left, I think, and mostly still overlapping with the others. Regarding again Cytec, I think if I remember correctly, you were -- at the end of last year, you were talking about stabilization in H2 and return to growth more in '18. We are close to. Would you venture though in terms of growth rates going into H2 and next year give us an update on where you see the platform? And I know it's complex. There's still a lot of industrial versus commercial aircraft. But if you could help us out in terms of the ramp-up of the overall platform. That would be one. And second, on Functional Polymers again, I think is there a risk of an inventory devaluation in Q3? Or what we saw in Q2 already reflects that risk or it's mostly a Q3 story? And if you could quantify the impact, if any."
377837,532067638,1262654,"Solvay SA, Q2 2017 Earnings Call, Aug 01, 2017",2017-08-01,"Earnings Calls","Solvay SA","Executives","Well, I won't quantify the impact. But there will be some slight impact due to inventory devaluation. In this case, I mentioned that we had some inventory revaluation during Q2. But again, broadly speaking, the business will continue to perform well becau",291,"Well, I won't quantify the impact. But there will be some slight impact due to inventory devaluation. In this case, I mentioned that we had some inventory revaluation during Q2. But again, broadly speaking, the business will continue to perform well because the fundamentals are strong. But on composite, I would refrain from giving you a number in terms of expected growth rate. I think the inventory movement that we've seen last year are behind us. Now what we see are the real impact of what's happening in the programs. I think the equation conceptually is rather simple, strong growth in F-35, strong growth in LEAP, significant growth in A320neo and the Boeing 737 MAX and some moderation in A380 and Boeing 777 until the 777X is launched. And then still some work to do, a part on the industrial material composite business with non-aerospace where we had a bit of a, I would say, mediocre performance for the first half of the year. And it's an area where we need to fix things, I mean, either by improving the commercial performance or by adjusting our cost base. So we are working on that. So I will ask you probably to be a bit patient before we give you a bit more visibility on what it means in terms of growth rate. But clearly, we are going out of the difficult zone in which we were a year ago. When I say difficult, I don't want to overemphasize that, but I would say the challenging situation where inventory reduction was playing against us. We think that this is behind us now and we are back to growth rate which are close to what we were expecting when we've made this acquisition."
377837,532067638,1262654,"Solvay SA, Q2 2017 Earnings Call, Aug 01, 2017",2017-08-01,"Earnings Calls","Solvay SA","Operator","And our last question is from Chetan Udeshi from JPMorgan.",10,"And our last question is from Chetan Udeshi from JPMorgan."
377837,532067638,1262654,"Solvay SA, Q2 2017 Earnings Call, Aug 01, 2017",2017-08-01,"Earnings Calls","Solvay SA","Analysts","Maybe one question on free cash flow as you define it. So how should we consider in terms of second half dynamics? Would you say it will be broadly similar to last year that we see working capital improvement being the key driver of improving cash flow? B",120,"Maybe one question on free cash flow as you define it. So how should we consider in terms of second half dynamics? Would you say it will be broadly similar to last year that we see working capital improvement being the key driver of improving cash flow? Because based on your full year guidance, CapEx will be up versus first half, so number one question, on the free cash flow generation dynamics for second half. And second question, just a clarification on butadiene new entry revaluation effect. Did you say you had some positive impact also in Q2? Because butadiene prices actually started coming down in second quarter. So why was there an incremental positive impact in Q2 over Q1?"
377837,532067638,1262654,"Solvay SA, Q2 2017 Earnings Call, Aug 01, 2017",2017-08-01,"Earnings Calls","Solvay SA","Executives","On free cash flow, Chetan, the best I can describe it is this, all levers that have contributed to our cash will continue to be deployed. So high profits, less CapEx, very clear focus and discipline on working capital. That's what I expect as being call i",159,"On free cash flow, Chetan, the best I can describe it is this, all levers that have contributed to our cash will continue to be deployed. So high profits, less CapEx, very clear focus and discipline on working capital. That's what I expect as being call it the recipe. It's nothing dramatic, nothing new, just more of what we've done in the past. There is almost an automatic outcome, let's say, the seasonal nature of our business or patterns results in that. And what we've done is confirm the guidance on a continuing business basis to eliminate the distortions of selling businesses, like Acetow, Vinythai, et cetera. So we're looking at a clean like-for-like comparable basis, let's say, that's going to be more than EUR 800 million. And that is almost double digit, higher than the equivalent figure last year, that from memory was EUR 735 million. So we reconfirm that. And that's exactly what we intend to deliver."
377837,532067638,1262654,"Solvay SA, Q2 2017 Earnings Call, Aug 01, 2017",2017-08-01,"Earnings Calls","Solvay SA","Executives","Okay. Now Chetan, on butadiene, in fact, there was a bit of an inventory revaluation, but this was an H1, mostly Q1 event. But again, not something major, it just supported a bit the performance of the business. And we expect again to see the other moveme",186,"Okay. Now Chetan, on butadiene, in fact, there was a bit of an inventory revaluation, but this was an H1, mostly Q1 event. But again, not something major, it just supported a bit the performance of the business. And we expect again to see the other movement in the second half. But again, probably more importantly, good fundamental in this business, both in terms of ability to price but also in terms of demand and volume. So maybe just a couple of words to close this call. I think these results demonstrate or confirm the momentum that we've seen in Q1, so strong volume growth, ability to control margins and costs. And this is again a performance we are quite pleased with. The challenge is to continue. But the upgrade that we have done of our full year guidance show that we are confident that we'll continue to deliver in the same direction. So thanks a lot for having shared this time with us. And we'll be back for the Q3 results in 3 months. So thank you very much, and have a very good day."
377837,532067638,1262654,"Solvay SA, Q2 2017 Earnings Call, Aug 01, 2017",2017-08-01,"Earnings Calls","Solvay SA","Operator","Thank you, Mr. Jean-Pierre Clamadieu, and thank you, Mr. Karim Hajjar. Ladies and gentlemen, this concludes the conference call. Thank you all for your participation. You may now disconnect.",29,"Thank you, Mr. Jean-Pierre Clamadieu, and thank you, Mr. Karim Hajjar. Ladies and gentlemen, this concludes the conference call. Thank you all for your participation. You may now disconnect."
377837,540867839,1337201,"Solvay SA, Q3 2017 Earnings Call, Nov 08, 2017",2017-11-08,"Earnings Calls","Solvay SA","Operator","Ladies and gentlemen, welcome to the Solvay Third Quarter 2017 Earnings Conference Call for the investment community. I am pleased to present Mr. Jean-Pierre Clamadieu, CEO; and Mr. Karim Hajjar, CFO. [Operator Instructions] I now hand over to you, Mr. Je",46,"Ladies and gentlemen, welcome to the Solvay Third Quarter 2017 Earnings Conference Call for the investment community. I am pleased to present Mr. Jean-Pierre Clamadieu, CEO; and Mr. Karim Hajjar, CFO. [Operator Instructions] I now hand over to you, Mr. Jean-Pierre Clamadieu. Sir, please go ahead."
377837,540867839,1337201,"Solvay SA, Q3 2017 Earnings Call, Nov 08, 2017",2017-11-08,"Earnings Calls","Solvay SA","Executives","Thank you very much. Thanks, everyone, for -- and thank you for joining our call today. As usual, I'm here with Karim Hajjar, our CFO; and Kimberly. And together, we'll try to provide another view of our Q3 results, before going into your questions. No si",448,"Thank you very much. Thanks, everyone, for -- and thank you for joining our call today. As usual, I'm here with Karim Hajjar, our CFO; and Kimberly. And together, we'll try to provide another view of our Q3 results, before going into your questions. No significant surprises in these results, so we should be able to move relatively quickly in the introduction and leave enough time for your question. 
It is before going to for Q3 performance, just a word on the announced sale of Polyamide. I think this is a very important transaction. It's clearly, in my view, the last major milestone in the portfolio transformation that we started 4 years ago. This transformation has indeed strengthened our business model and allow us to increase our ability to generate long-term growth and value for our shareholder.
Our portfolio looks very different from what it was 4 years ago. Today, we are a company which is both Advanced Material and chemical. 50% of our business indeed today is in Advanced Material. And when I say Advanced Material, it's really the top of the pyramid of the most sophisticated nonmetallic materials. 25% in what we should probably call chemistries with enough technology solution, our positions on surfactants, polymers, phosphorus and industry -- which gives us the ability to serve our customers, and the remaining 25% being businesses where we have long-term sustainable positions like soda ash and peroxide.
This allow us -- this is reflected in our EBITDA margin, which has been constantly above 20% since 2016, well above our additional peer group. 50% of our portfolio today are for sustainable solutions for our customers, so very much in line with our sustainability policy. And we've seen over the years, as I have commented several time, a dramatic shift in the quality of our customer base to one that provides major global blue-chip companies with unique solutions that are critical to their own programs. Overall, I think our strategy to turn into a multispecialty company, material and chemical, is indeed bearing fruits.
Looking at our Q3 results. I think the highlight of the period would be: first, a 9% volume growth, clearly significant, driven by the increase across our 3 segments, EBITDA of EUR 553 million, up only 1%, despite a strong organic growth of 5.5%, but most of this was offset by foreign exchange, particularly the dollar, euro and . EBITDA margins remain robust at 22%. Cash flow generation for the first 9 months demonstrate indeed our ability to focus and generate cash. 
And with that, I will turn to Karim to provide more specific insights into our financial performance, and I'll come back with some concluding comments."
377837,540867839,1337201,"Solvay SA, Q3 2017 Earnings Call, Nov 08, 2017",2017-11-08,"Earnings Calls","Solvay SA","Executives","Thank you, Jean-Pierre. Good afternoon. As usual, I'm going to refer to some slides that you can access on our website. And I will be talking about figures on an underlying basis, because that is more helpful and comparable with our past, remembering as",939,"Thank you, Jean-Pierre. Good afternoon. 
As usual, I'm going to refer to some slides that you can access on our website. And I will be talking about figures on an underlying basis, because that is more helpful and comparable with our past, remembering as well, that the P&L figures that I'll be referring to are those that reflect the discontinuation of the divestments the Polyamide activities.
And I'll start with sales. On Slide #8, you will see the factors that our net sales increased by 4%, but that doesn't tell the full story because, as Jean-Pierre mentioned, volumes are up very significantly 9% across, all of our operating segments, in fact. 
So I'll start with Advanced Materials. They were up 5%, mainly in automotive and smart devices. You will take note as well of the fact that composite sales in aeronautics were stable, as we see, the production ramp up of the F 35 program continuation of the growth of the LEAP engine compensate for the continuing decline in widebodied platforms, particularly older Generation ones, such as the A380 and the 777. And thus for composites, sales did decrease, mainly because of the end of a supercar program, the Ferrari F-150, that was anticipated, but we did see some softness across a couple of industrial markets, such as wind and rail.
Turning to Advanced Formulations, and seeing volume growth of 15%, with a strong recovery in oil and gas. This is something that we see also helped by improving in mix, which is visible in the improved EBITDA margins as compared to the second quarter of this year. 
Technology Solutions did increase its volumes as well, especially in non-mining activities. And so far as mining is concerned, we remain very well-positioned for anticipated new mines that will come on stream in the foreseeable future, next year and beyond.
Performance Chemicals. Volumes up 7%. Strong volumes in soda ash continued, particularly in the seaborne market, but also in the specialty bicarbonate applications, and of course, as you would expect, the contribution from the new HPPO peroxide plants in Saudi Arabia. These are all contributing to the growth and obviously helped to offset the foreign exchange headwinds, which, as you'd expect, the appreciation of the euro, particularly against the dollar, but also the Chinese renminbi, the Japanese yen, which together gave us a 3% -- negative 3% conversion effects.
But there is more to it than sales clearly. If we turn to Slide #9 and look at EBITDA, you will see the fact is that our headline growth of 1% has essentially moved forward off a very strong comp last year if you remember. So that 1% also [ below ] the fact that we've overcome some headwinds on foreign exchange and a modest impact on scope. 
Now on an organic basis, excluding foreign exchange and scope, EBITDA grew by 5%. The key points I'd like to highlight is: one, the full impact of the volume growth helped to overcome higher energy costs, particularly coal and soda ash, but also an increase in our fixed costs, that results from 2 main factors, additional capacity at good costs, in many ways, but also the variable remuneration as we recognize and reward our teams for delivering on strong objectives.
It's also important to note that what you don't see is the weather-related disruptions in the U.S. such as hurricane Harvey that haven't impacted as much at all in Q3, but we do anticipate a modest adverse supply chain logistical impact of up to EUR 10 million in Q4 as well. We've obviously taken that into account in our forecast that Jean-Pierre will talk to you in a moment.
Moving beyond EBITDA, and turning to other important financial elements on Page 11 -- Slide 11, you'll see 2 points in particular. Financial charges are lower, as we maintain our focus on cash generation, as we deleverage our balance sheet. That has an impact on reducing our financial charges. The other element is our underlying tax rate is down from 28% to 27%. Again, it's a good improvement that does create value and will be sustainable at this stage as we see it.
Cash is a very positive indicator, and we had to look at it beyond one quarter. 
If we turn to Page 12, you will see that the free cash flow from our continuing businesses was EUR 195 million. But on a cumulative basis, 9 months, to try and take out some of those modest seasonality impacts, we are 33% higher than last year for the first 9 months. That's EUR 111 million better than last year. And that comes from 2 main factors: continued attention to CapEx, no surprise there, and hopefully, no surprise from the continued discipline in working capital, where we're very attentive to our day sales outstanding. This is really part of the regime that we have in place here.
Now for those who are particularly attentive to our debt levels, pretty high, let's say 18, 24 month ago, you will have taken note of the reduction in those debt levels. Our leverage ratio currency of 2.3x is down from 2.6x at the beginning of the year. And you will take note of the fact that the polyamide investment -- divestment will further improve that to around 2x on a pro forma basis.
The fact that the cash is there, the profit growth is there. It's clearly acknowledged independently by S&P, and we're pleased to see that acknowledgment in the upgrade to our credit rating to BBB+  in early August.
And with that, I  hand you back to Jean-Pierre."
377837,540867839,1337201,"Solvay SA, Q3 2017 Earnings Call, Nov 08, 2017",2017-11-08,"Earnings Calls","Solvay SA","Executives","Thank you, Karim. This brings me to the outlook for the remaining months of the year. As we've said in our press release, we remain well on track to deliver a strong financial performance. Our underlying EBITDA growth is estimated between 6% and 8% fo",378,"Thank you, Karim. 
This brings me to the outlook for the remaining months of the year. 
As we've said in our press release, we remain well on track to deliver a strong financial performance. Our underlying EBITDA growth is estimated between 6% and 8% for the full year, based on the strong year-to-date growth of 9%. This imply, as you can easily figure, for Q4, an EBITDA largely in line with last year, with taking into account all the elements that Karim has mentioned, foreign exchange and some of the disruption coming from -- in our supply chain coming from harvey and other weather-related events in the U.S. 
On the free cash flow side, EUR 484 million delivered in the first 9 months. This puts us in a very good position to deliver more than the EUR 800 million that we have mentioned at the beginning of this year. And indeed, the fact that we have a much more regular cash flow profile year-over-year is something that we are aiming at, and I think it's a very good achievement from our team. We have confirmed an interim dividend payment of EUR 138 per share.
Looking at our priority today. As I've said, leaving aside the completion of the Polyamide divestiture, which is, indeed, a very important project, I think the focus now is very much to make sure that we will continue to drive in delivering on our midterm financial objectives. We want also to make good progress, and I think we are indeed making good progress on extra financial objectives, including our commitment to sustainable development. We will continue to drive organic growth with innovation being at the center of our plans. We have a unique portfolio to be able to support a very demanding customers, but customers which certainly has a need for the solution that Solvay is in the position to deliver.
We are now -- as we have finalized our portfolio transformation, we are now in the process of reviewing our corporate and functional structure to simplify and better align the structure with our new group profile, and we are planning to share more of this with you at the beginning of 2018.
With that, Karim and myself are ready to take your questions."
377837,540867839,1337201,"Solvay SA, Q3 2017 Earnings Call, Nov 08, 2017",2017-11-08,"Earnings Calls","Solvay SA","Operator","[Operator Instructions]  So the first question is from Thomas Wrigglesworth from Citi.",12,"[Operator Instructions]  So the first question is from Thomas Wrigglesworth from Citi."
377837,540867839,1337201,"Solvay SA, Q3 2017 Earnings Call, Nov 08, 2017",2017-11-08,"Earnings Calls","Solvay SA","Analysts","3 questions, if I may. The first one, Advanced Materials. Just looking at the composite growth year-on-year. Could you unpack that a little bit for us and talk about how much of that explicit in composites was FX, the leap engine positive versus the kind",162,"3 questions, if I may. The first one, Advanced Materials. Just looking at the composite growth year-on-year. Could you unpack that a little bit for us and talk about how much of that explicit in composites was FX, the leap engine positive versus the kind of the slowdown factors? That would be very interesting. And my second and third questions are focused on Performance Chemicals. And in particular, in soda ash. Is this 26% EBITDA margin now the kind of the new run rate for soda ash, noting that you're absorbing these heavy, these higher energy costs? And secondly, obviously, there is a significant ramp up in Turkish material due literally now in the coming months. Do you -- is your sense that these materials already been priced by the market, i.e. it's already been signed off? This is just a function of delivering it. What do you think the negative price impact is yet to come for the soda ash market?"
