"companyid","keydevid","transcriptid","headline","mostimportantdateutc","keydeveventtypename","companyname","speakertypename","componenttextpreview","word_count","componenttext"
377837,426703213,1186885,"Solvay SA, Q1 2017 Earnings Call, May 03, 2017",2017-05-03,"Earnings Calls","Solvay SA","Executives","On Cytec, as Karim said, I think we will update you with our Q2 results, but we ended the year at EUR 100 million as far as synergies are concerned, and we are continuing to make progress within, something which is going well. Pricing power, it's good tha",282,"On Cytec, as Karim said, I think we will update you with our Q2 results, but we ended the year at EUR 100 million as far as synergies are concerned, and we are continuing to make progress within, something which is going well. Pricing power, it's good that you are surprised, but I think it shows the quality of our portfolio. It shows also the fact that we are more and more moving into businesses where, indeed, the input costs are less important component than they used to be in some of the commodity businesses that we have divested. As I've mentioned, the segment where we've seen some impact is clearly Advanced Formulation. We expect the situation to improve over the year, over the next quarters. I will be cautious and probably I'm not ready to make a forecast on what will be the overall yearly pricing power impact. But I don't have any sign, but it should be degrading in the next quarter or 2, to try to help you get a feeling on where we are. So probably for the full year, something close to neutral would be a reasonable hypothesis made today. I mean we'll see how things will develop. By the way, something I've not mentioned when I was answering your previous question on input cost, is the fact as far as synergy is concerned, probably the area where we had the most pressure was coal for our soda ash business. It's clearly an area where we've suffered a bit from some unexpected spike in the price of coal. But overall, again, a situation where we've been able to manage for pricing. I just met with our customers."
377837,426703213,1186885,"Solvay SA, Q1 2017 Earnings Call, May 03, 2017",2017-05-03,"Earnings Calls","Solvay SA","Analysts","All right. And second, maybe a follow-up on oil and gas. I understood actually from your IR team that what you see today in oil and gas in the U.S. is that a lot rigs that are being added are basically dregs but not simulated, which more or less has a neg",98,"All right. And second, maybe a follow-up on oil and gas. I understood actually from your IR team that what you see today in oil and gas in the U.S. is that a lot rigs that are being added are basically dregs but not simulated, which more or less has a negative mix impacts on Chemlogics activity or Solvay activities. How do you see the mix evolving in the coming quarters? Did you already see some switch or some kind of change in your customers behavior? Or can we expect the negative mix to persist in the medium-term?"
377837,426703213,1186885,"Solvay SA, Q1 2017 Earnings Call, May 03, 2017",2017-05-03,"Earnings Calls","Solvay SA","Executives","Yes. I will just correct a little bit what you said. We are seeing rigs being made, but without the associated stimulation. It's not the majority of them. But some, yes. We are seeing today some slight improvement of the trends. Let me put that in a diffe",141,"Yes. I will just correct a little bit what you said. We are seeing rigs being made, but without the associated stimulation. It's not the majority of them. But some, yes. We are seeing today some slight improvement of the trends. Let me put that in a different way. The trends are positive as far as mix is concerned, which means that we are seeing people interested in -- people getting more and more interested in a higher cost formulation. We are starting to see interest again around based formulation. But it's more a trend than an actual fact. So trends positive, but I won't quantify our visual. But what's clear is that since Q4, we've seen a very positive trends regarding volume, negative mix effect. Expectation would be to see this negative mix effect slowing down in the next quarters."
377837,426703213,1186885,"Solvay SA, Q1 2017 Earnings Call, May 03, 2017",2017-05-03,"Earnings Calls","Solvay SA","Operator","Our next question is from Peter Clark from Socit Gnrale.",10,"Our next question is from Peter Clark from Socit Gnrale."
377837,426703213,1186885,"Solvay SA, Q1 2017 Earnings Call, May 03, 2017",2017-05-03,"Earnings Calls","Solvay SA","Analysts","I've still got a few left, actually. You're obviously more confident on where the macros coming through with some of these businesses. But on 2 areas where you saw pretty much double-digit volume growth, soda ash and you mentioned the Asian seaborne marke",123,"I've still got a few left, actually. You're obviously more confident on where the macros coming through with some of these businesses. But on 2 areas where you saw pretty much double-digit volume growth, soda ash and you mentioned the Asian seaborne market and the poly market. Just wondering how you see the progression there. They were again it's pretty soft comps year-on-year, I think, but just how you see that business progressing in those 2 areas? And then the inventory revaluation you saw in poly, how much that contributes to the EBITDA? And then just finally for Karim, actually, just a quick clarification on the guidance for full year tax charge, if you can remind me where we at the moment?"
377837,426703213,1186885,"Solvay SA, Q1 2017 Earnings Call, May 03, 2017",2017-05-03,"Earnings Calls","Solvay SA","Executives","So maybe 2 comments on the first 2 points. And I will let Karim answer the last 2 question. Soda ash, we see indeed a good situation, volume at the beginning of the year. Export markets have been quite active, and that's clearly a positive. We all know th",258,"So maybe 2 comments on the first 2 points. And I will let Karim answer the last 2 question. Soda ash, we see indeed a good situation, volume at the beginning of the year. Export markets have been quite active, and that's clearly a positive. We all know that the second part of the year will be a bit more difficult for soda ash because we'll start to see volumes, new volumes coming from our Turkish competition going into some of the markets that we serve. But once again, we've probably, as well prepared as you can for the situation. And what we've seen in the beginning of the year gives us a good feeling regarding the development. On functional polymer, dynamic is pretty positive. There is some inventory effect, and Karim will quantify that, but not major. What we see is a level of demand which is good linked to the automotive industry. And the fact that, as usual, some of our competitors are adding some production issues here and there. And as our plant turns to operate in a very reliable and efficient way, we have the ability to benefit from that. But again, a reasonably good development expected in front of us. I remind you that for this business, specially Polyamide, raw material and energy inflation usually turns to create a positive environment for us. I mean if you look back at history, we've always been able to manage reasonably well prices in certain environment. Karim, inventory, what does it mean? What does it represent?"
377837,426703213,1186885,"Solvay SA, Q1 2017 Earnings Call, May 03, 2017",2017-05-03,"Earnings Calls","Solvay SA","Executives","Sure. It's favorable, but it's single-digit millions, with asset pricing power and functional polymers would still be positive, probably the best I can describe it. So yes, it's normal business, you get ups and downs, but fundamentally, the pricing power",48,"Sure. It's favorable, but it's single-digit millions, with asset pricing power and functional polymers would still be positive, probably the best I can describe it. So yes, it's normal business, you get ups and downs, but fundamentally, the pricing power remains strong without that. Does that help, Peter?"
377837,426703213,1186885,"Solvay SA, Q1 2017 Earnings Call, May 03, 2017",2017-05-03,"Earnings Calls","Solvay SA","Analysts","Yes, that helps. And sorry, the tax charge for the full year?",12,"Yes, that helps. And sorry, the tax charge for the full year?"
377837,426703213,1186885,"Solvay SA, Q1 2017 Earnings Call, May 03, 2017",2017-05-03,"Earnings Calls","Solvay SA","Executives","I'd say that the previous -- the guidance we have of around 30% holds strategically. Clearly, there are a lot of pluses and minus if I look at, for example, the startup and the impact of our HPPO plant in Saudi Arabia, that doesn't have the same tax charg",96,"I'd say that the previous -- the guidance we have of around 30% holds strategically. Clearly, there are a lot of pluses and minus if I look at, for example, the startup and the impact of our HPPO plant in Saudi Arabia, that doesn't have the same tax charge as a a business in Europe. As the evolution develops further, let's see, but around 30% still makes sense, and that's something we'll update you with clearly when we speak again. But clearly, it's a good start, and we like to see low tax rates, obviously."
377837,426703213,1186885,"Solvay SA, Q1 2017 Earnings Call, May 03, 2017",2017-05-03,"Earnings Calls","Solvay SA","Executives","Peter, going back to your first comments regarding growth coming from the nongrowth engine businesses. Let me just give you the -- let me just go back to this. We are expecting significant growth coming indeed from our growth engines in the remaining part",146,"Peter, going back to your first comments regarding growth coming from the nongrowth engine businesses. Let me just give you the -- let me just go back to this. We are expecting significant growth coming indeed from our growth engines in the remaining part of the year. You should be reminded that there is a number of significant plant, new plants, new capacity which will start up, especially for specialty polymer. I already mentioned the PDDF facility and China that will start up during the summer. We have also our peak facility in Augustine in the U.S. which is currently starting up. All in all, 5 new plants in Advanced Materials, which will start up in the next months, so we really expect the growth to be indeed coming -- the coating volumes coming from all of our businesses with a focus on the growth engines."
377837,426703213,1186885,"Solvay SA, Q1 2017 Earnings Call, May 03, 2017",2017-05-03,"Earnings Calls","Solvay SA","Executives","Yes.",1,"Yes."
377837,426703213,1186885,"Solvay SA, Q1 2017 Earnings Call, May 03, 2017",2017-05-03,"Earnings Calls","Solvay SA","Operator","Our next question is from Mutlu Gundogan from ABN Amro.",10,"Our next question is from Mutlu Gundogan from ABN Amro."
377837,426703213,1186885,"Solvay SA, Q1 2017 Earnings Call, May 03, 2017",2017-05-03,"Earnings Calls","Solvay SA","Analysts","A couple of questions. First is on the Novecare. Can you tell us how your actual oil and gas fields are developing compared to the recovery that we see in the U.S. rig count? And the second question is on peroxides or on forced chemicals, if you may. Can",103,"A couple of questions. First is on the Novecare. Can you tell us how your actual oil and gas fields are developing compared to the recovery that we see in the U.S. rig count? And the second question is on peroxides or on forced chemicals, if you may. Can you quantify the contribution to sales and EBITDA of the new HPPO plant in the quarter? And then thirdly, linked to that, the fixed costs [ at least ] went up by EUR 35 million in the quarter. How much of that was linked to new capacities? And was that mainly the HPPO plant?"
377837,426703213,1186885,"Solvay SA, Q1 2017 Earnings Call, May 03, 2017",2017-05-03,"Earnings Calls","Solvay SA","Executives","For oil and gas, overall volume is moving very much in line with what we see in the -- what we see when you look at activity. And again, rig count is not the only metric of activity. We have increased vary significantly our market share over the past coup",165,"For oil and gas, overall volume is moving very much in line with what we see in the -- what we see when you look at activity. And again, rig count is not the only metric of activity. We have increased vary significantly our market share over the past couple of years during the crisis because a number of the small players have disappeared and the supply chains are much more tightly managed, which clearly gives a plus for the largest players. Second phenomenon, mix, as I've mentioned, are doing very well. In the past months, we've seen a very few formulation using for cost reasons. Expectation is that this could change, at least in terms of trends in the next quarters, because we see operators gaining confidence and willing to make a high-quality fracking. So with that, clearly, opportunity in front of us, with still some uncertainties on how significant this improvement will be. For peroxide and fixed cost, I come to you, Karim."
377837,426703213,1186885,"Solvay SA, Q1 2017 Earnings Call, May 03, 2017",2017-05-03,"Earnings Calls","Solvay SA","Executives","Sure. On peroxide, you may recall Jean-Pierre's indication back in February that the run rate we expect from the new capacity peroxide both in China and Saudi was of the order of EUR 50 million a year. We are on track. Q1 reflected fair share of that. Tha",127,"Sure. On peroxide, you may recall Jean-Pierre's indication back in February that the run rate we expect from the new capacity peroxide both in China and Saudi was of the order of EUR 50 million a year. We are on track. Q1 reflected fair share of that. That's probably the most precise guidance I can give you, confirming what we said previously. On fixed costs, our excellence and our strategies offset largely inflation, so the majority of the increase is related to new capacity to grow, as well as changes in personnel provisions and cost, think that bonuses, et cetera. So clearly, we share the successes of the strong performance with our stock, but the majority of that is absolutely related to our growth, Sadara amongst others."
377837,426703213,1186885,"Solvay SA, Q1 2017 Earnings Call, May 03, 2017",2017-05-03,"Earnings Calls","Solvay SA","Operator","Our next question is from Patrick Lambert from Raymond James.",10,"Our next question is from Patrick Lambert from Raymond James."
377837,426703213,1186885,"Solvay SA, Q1 2017 Earnings Call, May 03, 2017",2017-05-03,"Earnings Calls","Solvay SA","Analysts","A few questions. First one, I think, again, on returns formulation margin. I think comments from Karim saying that the Cytec business, the mining/additives was mixed, but in particular on mining. Was it -- can you quantify the impact on margins from that",234,"A few questions. First one, I think, again, on returns formulation margin. I think comments from Karim saying that the Cytec business, the mining/additives was mixed, but in particular on mining. Was it -- can you quantify the impact on margins from that lead the problems in mining? Was that significant? And most importantly, how it looks over the next few quarters? Do you think -- because I know that was a pretty high margin business. So if you could get the outlook on the strikes on the copper mining business will be good. That's the first question. The second question, I was coming back to, again, Cytec, sorry. Good performance and minus 3 if I put some effects on it, it would be minus, I don't know, 4 or 5 maybe be in terms of volumes. Again, could you comment a bit on the order backlog or the order book? Overall, it seems to have picked up from the Capital Markets Day, especially on the narrowbody planes, if you could comment on that. And how you see your confidence into H2 going back to positive growth? How the S-35 seems to be helping that. That's, I think -- and the last one, a very quick for Karim. On the 21 million of others, are these number basically split around divisions? Or is there one that we should put more into it? That's it."
377837,426703213,1186885,"Solvay SA, Q1 2017 Earnings Call, May 03, 2017",2017-05-03,"Earnings Calls","Solvay SA","Executives","So a lot of detailed question. Advanced Formulation, yes, technology solution was impacted by what we strikes and some. It stays a very good business in terms of margins, they're significantly above the group average and very significantly above the clust",479,"So a lot of detailed question. Advanced Formulation, yes, technology solution was impacted by what we strikes and some. It stays a very good business in terms of margins, they're significantly above the group average and very significantly above the cluster average, but we've lost a few percentage point in this situation. Frankly speaking, in our view, no reason to worry. We are very optimistic on the ability of this business to generate very, very solid margins for the remaining part of the year. And if I add once again to name one segment where we've suffered a bit which explained this pressure on margin, it's probably the home and personal care segment of Novecare, a little bit also on the Aroma Performance. well, the situation is relatively clear, if I may say so. Narrowbody, our single aisle planes, order books are filled for both for Boeing and Airbus. I mean Airbus, they are not able to deliver on any new -- they are not able to take orders for delivery before 2022. Boeing is in a similar situation, so the challenge is really production. There, we are seeing a very steep increase in the number of planes produced. And indeed, they are both Boeing had some production issues. I mean some of them who have made the headline, so I don't -- there's no need to comment which are slowing down production, actual productions. We are seeing the situation improving, but our understanding is that we are not yet at the level of production, that heights that these OEMs would expect. So there are still opportunities in front of us. A little bit differently from our competitor XL. We tend to think that the inventories in the supply chain has been taken care of, so we set up from that last year some adjustment along those, in some cases, complex supply chain. We think that this is a 2016 phenomena. On wide-body, it's where the market is a bit soft, waiting for new planes coming online, the 777X is a good -- from Boeing is a good example. So there, we are seeing a little bit of reduced activities, compensated by a good development on the military side and the S-45 ramp up rate, which is improving. But clearly, the area where we suffered still in Q1 is the non-aerospace segments, which is a number of very different markets, from wind energy to automotive. And there, we continued to work to make sure that we can improve the performance of these non-aerospace segment within our composite material. But overall, very optimistic about the development of composite overall for the year, but we are still in a period where our supply chains are just seeing and people are planning to understand how they can increase their rates, which will mean more business in front of us, but challenges short-term."
377837,426703213,1186885,"Solvay SA, Q1 2017 Earnings Call, May 03, 2017",2017-05-03,"Earnings Calls","Solvay SA","Analysts","The non-aerospace, how big is it now if I look at '16?",13,"The non-aerospace, how big is it now if I look at '16?"
377837,426703213,1186885,"Solvay SA, Q1 2017 Earnings Call, May 03, 2017",2017-05-03,"Earnings Calls","Solvay SA","Executives","It's about 1/4 of our composite material position, a bit more than 1/4.",14,"It's about 1/4 of our composite material position, a bit more than 1/4."
377837,426703213,1186885,"Solvay SA, Q1 2017 Earnings Call, May 03, 2017",2017-05-03,"Earnings Calls","Solvay SA","Executives","So far as your other question, Patrick, around what impact, you find it mainly in Advance Formulations and in Functional Polymers. That's where you see the majority of the impact.",30,"So far as your other question, Patrick, around what impact, you find it mainly in Advance Formulations and in Functional Polymers. That's where you see the majority of the impact."
377837,426703213,1186885,"Solvay SA, Q1 2017 Earnings Call, May 03, 2017",2017-05-03,"Earnings Calls","Solvay SA","Operator","Our next question is from Laurent Favre from Evercore.",9,"Our next question is from Laurent Favre from Evercore."
377837,426703213,1186885,"Solvay SA, Q1 2017 Earnings Call, May 03, 2017",2017-05-03,"Earnings Calls","Solvay SA","Analysts","I have 3 questions. First one on just a clarification on what you just said, Jean-Pierre. Have you seen any destocking impact on top of what you were expecting in terms of lower production rates in wide-body on the aerospace side, which clearly was mentio",213,"I have 3 questions. First one on just a clarification on what you just said, Jean-Pierre. Have you seen any destocking impact on top of what you were expecting in terms of lower production rates in wide-body on the aerospace side, which clearly was mentioned by one of your peers? Or is it just what you were -- or what we've seen, the decline we've seen is just what you were, I guess, forecasting or expecting internally? Second question is on silica pricing, which is still down quite a bit. And can you talk about the competitive pressure there? Obviously, we've seen more capacity additions from you and your competitors. But I'm just wondering if there is -- if there should be even more pressure as the cycle starts to turn or whether you think that we've seen the worse in terms of pricing. And the third question is a more general one. On the auto side given that you're somewhat exposed to other different parts of the auto value chains. It looks like your volumes in autos have been broadly up 10% or 11%. Obviously, car sales in Q1 were up only 3%. Are you not worried about an inventory stocking cycle which will bite us in the rest of the year?"
377837,426703213,1186885,"Solvay SA, Q1 2017 Earnings Call, May 03, 2017",2017-05-03,"Earnings Calls","Solvay SA","Executives","Okay. Well, just to clarify, just to clarify on aerospace. We've seen in 2016 some inventory reduction in the supply chain, which kind of increased the impact of some of the production delays. We think that this is behind us. And as we entered into 2017,",320,"Okay. Well, just to clarify, just to clarify on aerospace. We've seen in 2016 some inventory reduction in the supply chain, which kind of increased the impact of some of the production delays. We think that this is behind us. And as we entered into 2017, we think that inventories in the supply chain that we serve are at a very normal level. So we don't expect any more impact linked to inventory. Silica pricing, it's a business where we have some -- in most of our contracts, some price inflators which are linked to energy costs, so there is a bit of a delay in the -- as far as the impact of this price inflators or deflators, inflator in this case, so we are suffering from this delay, but we expect the situation to improve in terms of pricing in Q2. We are indeed start seeing some changes in this market, but in the segment where we focus ourselves, which are really the technology, the more technology advanced silica formulation, we continue to enjoy a very strong position, very good relationship with key customers, and we have the ability that we can continue to enjoy a very solid opportunities in these segments. Auto, we are reasonably confident. I mean what we understand is that there has been a bit of another production or a bit of another stocking, mostly in China, by the way, linked to the expectation that some new government incentives will be put in place, but we think that the growth in automotive industry is solid. And I remind you that the difference between the overall automotive industry growth and what we see at Solvay is linked to the fact that we are gaining market shares and continue to gain market share. New cars have more polymer than the older ones, and this explain why. We continue indeed to enjoy the growth in this segment."
377837,426703213,1186885,"Solvay SA, Q1 2017 Earnings Call, May 03, 2017",2017-05-03,"Earnings Calls","Solvay SA","Analysts","Is this a trend you would say is also supportive of polymer? So is it mostly specialty plastics?",18,"Is this a trend you would say is also supportive of polymer? So is it mostly specialty plastics?"
377837,426703213,1186885,"Solvay SA, Q1 2017 Earnings Call, May 03, 2017",2017-05-03,"Earnings Calls","Solvay SA","Executives","I think it's both. I mean in polyamide, we continued to see that, but probably, the churn is stronger on the specialty polymer side of the business.",28,"I think it's both. I mean in polyamide, we continued to see that, but probably, the churn is stronger on the specialty polymer side of the business."
377837,426703213,1186885,"Solvay SA, Q1 2017 Earnings Call, May 03, 2017",2017-05-03,"Earnings Calls","Solvay SA","Operator","Our next question is from Paul Walsh from Morgan Stanley.",10,"Our next question is from Paul Walsh from Morgan Stanley."
