"companyid","keydevid","transcriptid","headline","mostimportantdateutc","keydeveventtypename","companyname","speakertypename","componenttextpreview","word_count","componenttext"
24689,414976316,1127323,"Time Warner Inc., Q4 2016 Earnings Call, Feb 08, 2017",2017-02-08,"Earnings Calls","Warner Media, LLC","Analysts","I want to throw my head in the ring for tickets as well. So, Kevin, is there a meaningful incremental revenue opportunity for in-season stacking rights, or is that have been captured already? And since it's new year, any evolution that we should expect in",178,"I want to throw my head in the ring for tickets as well. So, Kevin, is there a meaningful incremental revenue opportunity for in-season stacking rights, or is that have been captured already? And since it's new year, any evolution that we should expect in SVOD licensing strategy, especially since Time Warner obviously last year joined Hulu as a minority shareholder? And for Jeff, there's been a lot of discussion on over the top and direct-to-consumer on this call and others, in media. I was curious, the look at the TV network business as ultimately continuing to be original business or developing into a global network business? And the reason I asked is there's an argument that TV networks are going global and direct-to-consumer, those economics will be superior more sustainable and Netflix and Amazon and FOX are headed there quickly. You gets in and globally but many of your other networks from regional. So just curious how do you see the market place is evolving? What it might mean if anything, for Time Warner in that regard?"
24689,414976316,1127323,"Time Warner Inc., Q4 2016 Earnings Call, Feb 08, 2017",2017-02-08,"Earnings Calls","Warner Media, LLC","Executives","The product sales ...",4,"The product sales ..."
24689,414976316,1127323,"Time Warner Inc., Q4 2016 Earnings Call, Feb 08, 2017",2017-02-08,"Earnings Calls","Warner Media, LLC","Executives","On the stock award, we think we're confident that we've been able to stocking rates agreement with everyone. And all the networks that we do business with will have capability to be able to offer a range of product with stacking rights because we think it",143,"On the stock award, we think we're confident that we've been able to stocking rates agreement with everyone. And all the networks that we do business with will have capability to be able to offer a range of product with stacking rights because we think it's great for the consumer, and you're looking at what the viewing trends are might be to be able to do that. As it relates to any change in the way that we kind of view SVOD and licensing strategy, I think that we continue to look at it on a product-by-product basis, and we continue to evaluate it, and we're going to continue doing that. But the marketplace is evolving, both domestically and internationally. And I think that you're going to continue to see everyone kind of look at and evaluate each piece of content going forward."
24689,414976316,1127323,"Time Warner Inc., Q4 2016 Earnings Call, Feb 08, 2017",2017-02-08,"Earnings Calls","Warner Media, LLC","Analysts","Is the new season stacking rights pulling forward syndication revenue, or do you think it's a net increase in the monetization of your TV products?",25,"Is the new season stacking rights pulling forward syndication revenue, or do you think it's a net increase in the monetization of your TV products?"
24689,414976316,1127323,"Time Warner Inc., Q4 2016 Earnings Call, Feb 08, 2017",2017-02-08,"Earnings Calls","Warner Media, LLC","Executives","It's a net increase of the licensing fee -- the existing license fee for that run.  It's not seen as a syndication piece.",24,"It's a net increase of the licensing fee -- the existing license fee for that run.  It's not seen as a syndication piece."
24689,414976316,1127323,"Time Warner Inc., Q4 2016 Earnings Call, Feb 08, 2017",2017-02-08,"Earnings Calls","Warner Media, LLC","Executives","Well, or you can do it both way.",8,"Well, or you can do it both way."
24689,414976316,1127323,"Time Warner Inc., Q4 2016 Earnings Call, Feb 08, 2017",2017-02-08,"Earnings Calls","Warner Media, LLC","Executives","You could, but [indiscernible] given that one.",7,"You could, but [indiscernible] given that one."
24689,414976316,1127323,"Time Warner Inc., Q4 2016 Earnings Call, Feb 08, 2017",2017-02-08,"Earnings Calls","Warner Media, LLC","Executives","So I think you're asking about national networks and SVOD services across the United States versus global, across 7 billion people, was that what you're asking?",27,"So I think you're asking about national networks and SVOD services across the United States versus global, across 7 billion people, was that what you're asking?"
24689,414976316,1127323,"Time Warner Inc., Q4 2016 Earnings Call, Feb 08, 2017",2017-02-08,"Earnings Calls","Warner Media, LLC","Analysts","Yes, I was asking if you think the world is headed that way and if there is any implication for Time Warner?",22,"Yes, I was asking if you think the world is headed that way and if there is any implication for Time Warner?"
24689,414976316,1127323,"Time Warner Inc., Q4 2016 Earnings Call, Feb 08, 2017",2017-02-08,"Earnings Calls","Warner Media, LLC","Executives","Okay, well, yes. The world is heading -- as we all know, towards more global access by people to a rate at a given show or a given network. And as you see the development of that, I know you are referencing some brands that started in the tech world. If y",346,"Okay, well, yes. The world is heading -- as we all know, towards more global access by people to a rate at a given show or a given network. And as you see the development of that, I know you are referencing some brands that started in the tech world. If you think of something like either CNN or HBO, and then you are going to expand that half to other networks, both things like CNN or HBO are global brands that got global distribution now. What we've been doing over the years is we've essentially try to capitalize on these SVOD and linear network opportunities going global in terms of territory. And going digital in terms of VOD across platforms and not just TV, but mobile devices. The bulk of people in India or Brazil are watching differently in different device setups than say those in Western Europe or the United States. So we've been pursuing essentially that strategy of distribution for our networks that optimizes the reach of whatever distribution is in place. If you look at -- is orders of combination, HBO is an easy way to describe it because it started VOD, and it started more global distribution as did CNN. So we've got places where HBO is over the top direct as a network. We just launched a few in Western Europe, Spain, we are launching in Latin America, we have things in Eastern Europe like that. We also have HBO in Western Europe licensed into other SVOD like Sky and other sorts of platforms if they have superior reach and can therefore, get our programming, which is usually branded as HBO neighborhood programming. and if then creates a choice as time goes on of whether we decide to move to direct network full schedule or whether we continue to license to optimize value of that network name and the programming associated with it. You've got examples of Turner doing that at FilmStruck. You've got examples of Warner doing it in China, where we're the second largest SVOD service in China?"
24689,414976316,1127323,"Time Warner Inc., Q4 2016 Earnings Call, Feb 08, 2017",2017-02-08,"Earnings Calls","Warner Media, LLC","Executives","Yes.",1,"Yes."
24689,414976316,1127323,"Time Warner Inc., Q4 2016 Earnings Call, Feb 08, 2017",2017-02-08,"Earnings Calls","Warner Media, LLC","Executives","And HBO is right along side of that, licensed into the service. So yes, it's, of course, everybody did have programming and that can support a network. We'll try to create optimal reach either for the shows of the network and to the extent you can fill it",89,"And HBO is right along side of that, licensed into the service. So yes, it's, of course, everybody did have programming and that can support a network. We'll try to create optimal reach either for the shows of the network and to the extent you can fill it out to a full network, that's a valuable asset. And we're moving in that direction where we can, and we're moving to supply those networks that have the reach and can collect the money for us where those conditions don't apply."
24689,414976316,1127323,"Time Warner Inc., Q4 2016 Earnings Call, Feb 08, 2017",2017-02-08,"Earnings Calls","Warner Media, LLC","Executives","Great. Thanks to. So thanks, everyone, for joining. That concludes the earnings call, so thank you.",16,"Great. Thanks to. So thanks, everyone, for joining. That concludes the earnings call, so thank you."
24689,414976316,1127323,"Time Warner Inc., Q4 2016 Earnings Call, Feb 08, 2017",2017-02-08,"Earnings Calls","Warner Media, LLC","Operator","Thank you. You may now disconnect your lines at this time. Thank you for your participation.",16,"Thank you. You may now disconnect your lines at this time. Thank you for your participation."
24689,414976316,1127325,"Time Warner Inc., Q4 2016 Earnings Call, Feb 08, 2017",2017-02-08,"Earnings Calls","Warner Media, LLC","Operator","Welcome to the Time Warner Inc. Fourth Quarter and Full Year 2016 Earnings Call. My name is Rob, and I will be your operator for today's call. [Operator Instructions] Please note that this conference is being recorded. I will now turn the call over to",59,"Welcome to the Time Warner Inc. Fourth Quarter and Full Year 2016 Earnings Call. My name is Rob, and I will be your operator for today's call. [Operator Instructions] 
Please note that this conference is being recorded. 
I will now turn the call over to Jessica Holscott, Senior Vice President of Investor Relations. Ms. Holscott, you may now begin."
24689,414976316,1127325,"Time Warner Inc., Q4 2016 Earnings Call, Feb 08, 2017",2017-02-08,"Earnings Calls","Warner Media, LLC","Executives","Great. Thanks, Rob, and good morning, everyone. Welcome to Time Warner's Fourth Quarter and Full Year Earnings Call. First, we refer to certain non-GAAP financial measures. The reconciliations of these non-GAAP financial measures to the most directly co",158,"Great. Thanks, Rob, and good morning, everyone. Welcome to Time Warner's Fourth Quarter and Full Year Earnings Call. 
First, we refer to certain non-GAAP financial measures. The reconciliations of these non-GAAP financial measures to the most directly comparable GAAP financial measures are included in our earnings release and trending schedules. These reconciliations are available in the Investor Relations section of our website.
Second, today's announcement includes certain forward-looking statements which are based on management's current expectations. Actual results may vary materially from those expressed or those implied by these statements. Please see our 10-K and 10-Q for items that could affect future results or performance. 
I'll now turn the call over to Jeff Bewkes, Time Warner's Chairman and CEO, who will be followed by Howard Averill, Time Warner's CFO. And after their prepared remarks, our divisional CEOs, John Martin, Richard Plepler and Kevin Tsujihara, and our General Counsel, Paul Cappuccio, will join us for our Q&A session. Jeff?"
24689,414976316,1127325,"Time Warner Inc., Q4 2016 Earnings Call, Feb 08, 2017",2017-02-08,"Earnings Calls","Warner Media, LLC","Executives","Thanks, Jessica, and thanks, everybody, for listening in this morning. We had an outstanding fourth quarter, capping off a very successful year in 2016. And for the year, our revenues increased 4% to $29.3 billion and adjusted operating income grew 10%",1975,"Thanks, Jessica, and thanks, everybody, for listening in this morning. 
We had an outstanding fourth quarter, capping off a very successful year in 2016. And for the year, our revenues increased 4% to $29.3 billion and adjusted operating income grew 10% to $7.6 billion with record results in each of our divisions. 
Adjusted EPS was up 23% to $5.86 per share. That's our eighth consecutive year of double-digit growth in adjusted EPS. 
Now looking at the fourth quarter. Revenues grew 11% to $7.9 billion with increases in each of our divisions and adjusted operating income increased 25% to $1.8 billion. 
We generated a record $4.4 billion in free cash flow, and we returned close to $3.6 billion to shareholders in share repurchases and dividends over the course of the year. 
What's driving these results is the same combination of strong execution, continued investment in our businesses and disciplined capital allocation that's enabled us to provide superior long-term returns to our shareholders. 
Our strategy starts, as you'll know, with investing in creating the world's most compelling video content. We then ensure that it can be accessed and enjoyed by consumers wherever, whenever and on whatever device they want it all around the world. And increasingly, that means working with both our distribution partners and on our own to ensure great experiences that connect consumers with our content and our brands. You can see the success of this strategy across each of our businesses last year. Let me share a few highlights to start at the networks. 
In 2016, Turner made terrific progress on its goal of transforming its leading portfolio of entertainment, news, sports and kids brands, investing in each of its businesses to make them ever more powerful and engaging for audiences. 
For the year, among adults 18 to 49 in prime time, we held 3 of the top 5 slots among ad-supported cable networks with TBS, TNT and Adult Swim. And in fact, TBS was the #1 entertainment network in prime for the fourth consecutive year, showcasing a great mix of fresh originals, sports and acquired content. 
Early last year, we began introducing a lineup of bold, new comedies that includes Angie Tribeca, The Detour and Wrecked. We've also had a breakout success in Full Frontal with Samantha Bee, which, during the summer, began outpacing The Daily Show and continued to do so in the fourth quarter. We also added 2 new comedies in People of Earth and Search Party, which debuted to strong critical reviews. All of the freshman shows have been renewed. And if you haven't seen them, we've made the entire seasons available on demand to binge view, as all the latest Turner original series, all on demand. 
Now if 2016 was TBS's year, we expect 2017 to belong to TNT. It's just on under way in its refresh process, but it's already off to an encouraging start with newcomers Animal Kingdom produced by Warner Bros. and Good Behavior, both of which have also been renewed. 
And this year, we're rolling out a slate that includes exciting, new series like The Alienist, Will [ph] and Klaus [ph], adding compelling franchise movies, which include those from the DC Universe and the entire Star Wars library and recent Marvel movies and you can see why we're very confident in TNT's future as the home for great [indiscernible]. 
Another part of Turner's success, a critical part and, well, basically a vital part, is our success in sports. And our rights to the NCAA tournament, the NBA and Major League Baseball. Last year, we had the NCAA Men's Basketball Championship game for the first time ever, and we generated record revenues across our March Madness properties. This is such a strong relationship for us that we, along with CBS, renewed our deal with the NCAA through 2032. Our NBA package also continues to deliver tremendous results, and that was highlighted by Game 7 of last year's -- last season's Western Conference Finals, which became the most watched telecast ever in the history of TNT. We also launched our ELEAGUE gaming network in partnership with WME | IMG, and that's off to a promising start and it's already bringing new, younger viewers to TBS. 
Speaking of younger viewers, I have to mention Adult Swim again and its leading position with millennial audiences. In 2016, it was the #1 network among 18- to 34-year-olds for the 12th year in a row. 
Now what a year for CNN, the #1 news network among adults 18 to 49 in prime time. Let's just say that again, the #1 news network among adults 18 to 49 at prime time and the #1 digital news destination in 2016. CNN capped off its most watched year ever with a record-setting election night to rank #1 in prime at evening across all cable and broadcast networks. 
With the historic U.S. Presidential election behind us and the new administration in place, we have every confidence that CNN will continue to reinforce its reputation as not only the source of the world x2 for trusted news coverage but also as the destination for compelling original series and documentaries. 
And international, Turner launched a dozen new networks while holding its position as the #1 portfolio of pay TV networks across Latin America. 
Whether it's content, advertising or distribution, Turner is making important progress evolving its business in ways that recognize changing media habits and that put the consumer first. 
Last year, Turner continued to build on the successful 2015 launches of short-form news site, Great Big Story, and digital studio, Super Deluxe. And in November, Turner Classic Movies launched FilmStruck, a new over-the-top service for lovers of art house movies. 
And in distribution, Turner has demonstrated the value of its portfolio by being an anchor tenant on each of the new virtual MVPD services that have launched as well as on Hulu's upcoming new service. 
Now let's move to the gold standard in premium video, Home Box Office. HBO had another great year while making investments for an even stronger original programming lineup. 
Once again, 2016 brought more Primetime Emmy Awards to HBO than any other network, and that's for the 15th straight year. Game of Thrones' sixth season hit record viewership of 26 million people per episode. That's about a 50 rating on HBO, actually more than that on the subbase. And we also had the biggest launch of a new series in HBO history with Westworld. It's produced by Warner Bros. and it's surpassed even the Game of Thrones' first season. I want to pause on that and say that even with the explosion of new outlets and choices in this golden age of video, HBO remains singular in its ability to attract artists  who push the boundaries of what's creatively possible. And that's the case whether it's on an epic scale of a show like Westworld or on a human scale with a show like Girls, which begins its sixth and final season this weekend. You'll also see that in our upcoming limited series, Big Little Lies, with a stellar cast including Nicole Kidman and Reese Witherspoon, which follows last year's acclaimed series, The Night Of. 
In 2016 at HBO, we also premiered the well-received fresh from seasons of Insecure, Divorce, Vice Principals and High Maintenance. And those ran alongside returning comedy powerhouses Veep, Silicon Valley and Ballers. 
Of course, HBO offers much more than its original programming. It's got the best lineup of recent Hollywood films, hit bounds available anywhere. And they account for a significant amount of HBO's viewership. 
When you add in great documentaries, sports and late-night powerhouses like Last Week Tonight with John Oliver or Real Time with Bill Maher, both of which experienced record viewership last year, as well as our new nightly series, VICE News Tonight, you can see why HBO stands out from the pack and why we're very confident about the growth opportunities ahead. 
HBO has also been blazing the trail and connecting with consumers through its streaming product, which added distribution on Microsoft's Xbox, on Samsung's smart TVs, Sony's PlayStation and Amazon Prime Channels in 2016. 
In total, HBO recently surpassed 2 million domestic over-the-top subscribers. So we're really pleased with the progress. 
And HBO is just as focused on reaching consumers abroad with over-the-top launches in Spain, Brazil and Argentina in 2016. 
Finally, let's turn to Warner Bros., the global entertainment leader. Warner has had another record year with strong results in television and film and a growing consumer products business that ties into its focus on franchise properties. 
In movies, we reached nearly $5 billion in global box office. That's the second best year in our history. And it was driven across a range of hits led by our franchise releases: Batman v Superman, Suicide Squad and Fantastic Beasts and Where to Find Them. But the depth and diversity of our slate was also on display with strong performances from movies like Central Intelligence, Lights Out, The Conjuring 2 and Sully.  We are just as excited about 2017 with a lineup that starts with the LEGO Batman Movie, which opened, by the way, this weekend, and we also have the highly anticipated next installments in our DC slate with Wonder Woman in June and Justice League in November. 
In television at Warner's, we were the #1 supplier to broadcast networks again. This is now for the eighth year in a row with at least 4 shows on each network this season. And that includes the #1 overall series on television, The Big Bang Theory, and the #1 non-scripted series on television, The Voice, as well as newcomers like Lethal Weapon and Riverdale. 
We've mentioned before that our DC franchise has been one of our most important priorities at Warner's, and you can see the results not just at the box office but also in the 10 DC-based shows we have on TV; in the 4.5 billion consumer spend on DC merchandise last year, contributing to our record performance in consumer products; and finally in our hit video game franchises, including Injustice 2, which will release this coming May. 
Similar to Turner and HBO, Warner Bros. also continues to make strides in developing direct-to-consumer capabilities to serve its fans in today's evolving environment. We created the Warner Bros. Digital Networks division and we closed deals to buy Machinima, giving us a platform to connect to coveted and hard-to-reach young gamers,  and DramaFever, which gives us the capability to launch and operate new over-the-top broadband VOD services. 
Across our company, we had a very active and successful year, and we're  inspired by the future of media that we're helping to shape. As we've said many times before, connecting more directly with consumers as our businesses evolve, both within and outside the existing ecosystem, is one of our most important strategic priorities, and we're making a lot of progress. 
We believe our deal to be acquired by AT&T, which we announced on October 22, will further enhance our ability to innovate and thrive. A special meeting of shareholders to vote on the transaction will be held a week from today. The regulatory review process is under way, and we remain confident that the deal will be approved later this year. Once that happens, we're very excited about the potential of combining AT&T's great strength in mobile and video distribution and its fantastic customer relationships with the world's greatest storytelling and the value we can create together by accelerating the evolution of our company and our industries for the benefit of consumers. In the meantime, we remain very confident in our ability to continue to lead the industry both creatively and financially not just for 2017 but for many years to come. 
Thanks again for listening. And with that, let me turn it over to Howard."
