"companyid","keydevid","transcriptid","headline","mostimportantdateutc","keydeveventtypename","companyname","speakertypename","componenttextpreview","word_count","componenttext"
24689,424207541,1187656,"Time Warner Inc., Q1 2017 Earnings Call, May 03, 2017",2017-05-03,"Earnings Calls","Warner Media, LLC","Executives","Thanks, Jessica, and thanks, everybody, for joining us this morning. We continued our momentum into 2017 and delivered a strong first quarter that sets us up very well to achieve our goals for the year. Our results highlight not just our focus on being",1786,"Thanks, Jessica, and thanks, everybody, for joining us this morning. 
We continued our momentum into 2017 and delivered a strong first quarter that sets us up very well to achieve our goals for the year. Our results highlight not just our focus on being home to the world's best video content, but also on delivering that content to consumers in new ways and developing new revenue streams that will drive continued growth. 
For the quarter, revenues grew 6% to $7.7 billion. Adjusted operating income increased 7% to $2.2 billion and adjusted earnings per share was up 11% to $1.66 a share. These results reflect the successful execution of the strategy we've discussed with you before, and which has served us and our shareholders very well. 
It starts with investing in great content, whether it's drama like Big Little Lies on HBO; action films like Warner Bros.' Kong: Skull Island; comedy such as The Big Bang Theory and The Detour; sports like March Madness and the NBA on Turner; news on CNN; or kids with properties like The LEGO Batman Movie and Powerpuff Girls on Cartoon Network. 
Another core part of our strategy is broadly distributing our content as we move decisively to connect more directly with consumers and to give them new and better ways to experience our content and brands. As you know, this consumer focus is an important strategic priority for us, and it's one of the key underpinnings of our merger with AT&T, which we remain on track to close by year-end. 
As we get closer to joining forces with AT&T, we're increasingly excited about the potential of our organizations to accelerate innovation together, and to do it across the entire media and entertainment industry in ways that will excite and benefit consumers in an area where video consumption is increasingly happening on demand and on multiple platforms. 
At the same time, we're focused on executing our business plans and doing what we do best. So let me share some recent highlights starting with Turner, where the tremendous value of our premium high-quality sports has been on display in the first part of the year. 
As I mentioned, we had another very successful presentation of the NCAA Division I Men's Basketball Tournament across platforms, and that's in partnership with CBS, as you know. We posted record revenue, strong ratings growth and record digital performance. This year was the second most-watched NCAA Tournament in 23 years and viewership was up 16% over last year. 
And we've transitioned from March Madness right into the NBA playoffs on TNT, which kicked off a few weeks ago. 
We're already off to a great start with viewership through the first round of the playoffs, that are up 9%. And we're very excited to be the exclusive home to the Eastern Conference Finals later this month. 
Our commitment to high-quality sports also extends overseas. Turner, in conjunction with Fox, recently announced its acquisition of the rights to First Division soccer in Argentina, further strengthening our leading position in Latin America. And so we're really pleased with our portfolio and the genre that resonates so passionately with both viewers and advertisers. 
Sports are what makes or part of what makes TNT and TBS attractive to audience, but so is Turner's increasing focus on old exciting original series. At TBS, we continue to see the benefits of the content refresh we began about a year ago, reinforcing TBS as a preeminent comedy brand. Our returning shows are building on last year's momentum. The new seasons of Angie Tribeca and The Detour have each grown audiences by double digits from last season, and we've already green lit The Detour for season 3. 
The Full Frontal with Samantha Bee has built tremendous followings, almost doubling its audience since the debut early last year. And with that growth, Samantha Bee ranked as the #1 late-night show across all networks among adults 18 to 34 in the first quarter. 
We're earlier on in the content refresh at TNT, where in coming months we'll be rolling out new originals, including Will, that's a show about a young William Shakespeare, as well as 2 Warner Bros. production, the premiere of Claus and the return of Animal Kingdom for its second season.
We also saw Adult Swim maintain its stronghold on millennial audiences. It's the #1 ad-supported cable network among adults 18 to 34 for the 36th consecutive quarter, that's 9 years. And there's already tremendous buzz for the return of one of Adult Swim's most popular shows, Rick and Morty later this year. Last month, we unveiled a new virtual reality experience based on the show that lets each of you live the adventures of Rick and Morty. That's a great example, and now we're focused on leveraging technology and building experience around our brands in ways that allow consumers to reach across platforms in a variety of devices and ways. 
CNN continues to build on its strength as a trusted source for news and analysis in a complex world, growing its total day ratings among adults 25 to 54 by 21% in the quarter and posting its most-watched first quarter since 2003. And CNN remains the undisputed leader in digital news, continuing to grow its multiplatform uniques and its video starts by solid double digits. 
Turner is also one of the founding partners in OpenAP, that's a new platform announced last month that will make it easier and more efficient for advertisers to target audiences in a consistent way across TV networks and offer our partners important third-party verification. This is further evidence of Turner's innovation in the ad space, and advanced advertising is an important area where combining with AT&T can accelerate our progress and improve our chance for success. 
Now moving over to Home Box Office. We continue to define what premium television means for the digital age with a mix of groundbreaking originals, Hollywood hits and a broad range of other distinctive program. 
Our limited series, Big Little Lies with a stellar cast including Reese Witherspoon and Nicole Kidman, was both a critical and a cultural breakout, averaging over 8 million viewers per episode. And the final season of The Leftovers, produced by Warner Bros., has also received tremendous critical acclaim and viewership for its premier episode grew 26% from last season. 
Other standouts in the quarter at HBO were Last Week Tonight with John Oliver, which is having its most-watched season to date and Real Time with Bill Maher, where our viewership is up 22% this season. 
Last month, we also had much-anticipated returns of new seasons of comedies Veep and Silicon Valley, while Girls wrapped up its run with its most-watched season finale since Season 1. And we're already in development on 2 new projects with Lena Dunham, so we're excited building on the great success of Girls. 
We're now putting the finishing touches on Season 7 of Game of Thrones, which returns in July. 
And later this year, we'll also premier The Deuce, a new drama from David Simon, creator of The Wire, and that's set in the gritty streets of New York in the 1970s and '80s, and it stars James Franco. 
As I've mentioned before, HBO's originals are so good they can overshadow the powerful lineup of hit Hollywood movies that rounds out HBO's programming lineup. Thanks to our output deals with top studios like Warner Bros. 
In fact, Batman v Superman, The Legend of Tarzan and Suicide Squad, all three from Warner's, were the most viewed Saturday-night film premieres on HBO over the past 6 months. 
And we continue to see big Hollywood hit films like Batman v Superman gross over 20 million viewers did -- during their initial run on HBO. 
So we're really pleased with the value that HBO bring to its subscribers and the exciting lineup that it has planned for the rest of 2017 and the years beyond. 
Now let's turn to our studio, Warner Bros., which remains the #1 supplier of broadcast television for the current season, which includes the strong results of our lineup on the CW, where total viewing is up 16% this season across all CW platforms. 
On the film side at Warner's, the first quarter was highlighted by the strong global performance of Kong: Skull Island and The LEGO Batman Movie. And we're also very excited about Warner's slate for the rest of the year, which includes Dunkirk from legendary director Christopher Nolan. And the next 2 installments in our DC franchise: Wonder Woman comes to theaters June 2, and Justice League will hit theaters in the fall. 
As we did highlight before, our focus on franchises like DC Entertainment encompasses not just film and TV, but also consumer products and video games. And a great example of that is Injustice 2, which is set for release on May 16, and we anticipate it will be one of the cornerstones of a very strong year for our games business. 
Finally, I want to update you on some of our efforts to furnace technology to directly reach audiences. Last month, Turner and Warner Bros. jointly launched a new kid's subscription VOD service under the Boomerang brand that features our company's deep library of iconic animated content as well as fresh, new originated animated fair that will debut weekly. 
And last week, Warner's announced its developing 2 series for a DC-branded over-the-top service we plan to launch next year. 
These are great examples of how we're investing in both high-quality content as well as in the technology and new capabilities to make sure we get that content to consumers wherever and whenever they want. 
The Boomerang subscription VOD service and the upcoming DC digital products are both powered by DramaFever, which Warner's acquired last year. 
Similarly, we've been increasingly leveraging the capabilities of iStreamPlanet, which Turner acquired in 2015, across a range of live sports properties including March Madness Live and NBA League Pass. 
Among our over-the-top offerings, the Boomerang service joins FilmStruck, our arthouse film service that Turner launched last year, Warner Archive and DramaFever, both at Warner Bros. and of course, HBO's over-the-top products, which continue to grow subscribers at a very healthy pace in the quarter. These all reflect our growing recognition of the importance of delivering great experiences to consumers alongside our great content and doing it across distribution channels. 
And so joining with AT&T will expand our capabilities in this area, allowing us to significantly accelerate our efforts to deliver consumers more innovative products. 
As you can see, we had a very active quarter, and we have a lot of momentum across our businesses. Thanks, again, for listening, and I'll turn it over to Howard."
24689,424207541,1187656,"Time Warner Inc., Q1 2017 Earnings Call, May 03, 2017",2017-05-03,"Earnings Calls","Warner Media, LLC","Executives","Thank you, Jeff, and good morning. I'll begin by referring to the first slide of our presentation, which is now available on our website. We are off to a terrific start to 2017, posting our highest quarterly adjusted operating income ever as we continue",1725,"Thank you, Jeff, and good morning. I'll begin by referring to the first slide of our presentation, which is now available on our website. 
We are off to a terrific start to 2017, posting our highest quarterly adjusted operating income ever as we continue to benefit of growing global demand for our high-quality content. Revenues grew 6% and adjusted operating income was up 7%. Total expenses increased 5% as we continue to make significant investments in content across our businesses, and that was partly balanced by our ongoing focus on constraining overhead cost. 
Adjusted EPS grew slightly faster at 11% and included an approximately $0.07 benefit from the adoption of new guidance on a tax accounting of equity-based compensation. So we've carried our operating momentum into 2017 and remain focused on executing our strategy, and we remain on track to deliver on the outlook for high single-digit growth and adjusted operating income that we laid out at the start of the year, which I'll touch on more throughout my presentation. 
Now turning to the segment highlights. I'll start at Turner, where we continue to benefit from strong subscription revenue trends as we invest in great content, new capabilities and innovative business models to position the business for long-term success. 
Subscription revenues increased 12% in the quarter, domestic affiliate revenue were up a robust 13%, marking our fifth consecutive quarter of domestic growth in the teens, and we remain on track for domestic subscription revenue growth to be solidly in the double digits for the remainder of the year. 
International subscription revenue grew in the mid-single digits, with particular strength in Latin America. 
Total advertising decreased 2% and domestic advertising was down a similar amount, both below our expectations. That was in part because of some rating softness. 
In addition, during the NCAA Tournament, CBS aired games with more favorable matchups calling higher viewership than we initially projected. And because of how we account for the NCAA deal, that resulted in Turner recognizing less ad revenue than anticipated related to the NCAA Tournament in the first quarter. But keep in mind, based on the structure of the collaborative arrangement with CBS, the shift in revenue recognition does not impact our bottom line. So this year's tournament was again very successful, with strong ratings growth and record revenues across both linear and digital, further reinforcing the value of our premium sports portfolio. 
Moving on. International advertising was up in the mid-single digits and was also led by healthy growth in Latin America as well as in Europe. 
Turning to the second quarter, we've seen overall market demand moderate a bit relative to the strength we saw over the past year, although scatter pricing remains healthy. 
Looking specifically at Turner, we expect total advertising revenue to be down this quarter since we have an approximately 700 basis point negative impact from the shift of the NCAA Final Four and championship games from Turner to CBS. And excluding the NCAA shift, we expect total advertising revenue to be about flat in the quarter. 
Adjusted operating income was down 4%. That's a reflection of significantly higher programming costs, investments in new digital initiatives and higher marketing spend. 
Programming expenses grew 17% due to the increased costs associated with the first year of our new NBA deal and higher original programming expenses. 
And as we've discussed, we expect the new NBA deal will also have a material impact on programming costs in the second quarter. Turner is set up to have another good year, and we're confident that the investments we're making across the business, combined with continued strong execution, leave Turner well positioned to sustain healthy growth trend long-term. 
Turning now to HBO, where the strength of the brand and the global demand for its premium content translated into record quarterly profit and is contributing to solid subscriber growth year-to-date, setting HBO up for accelerating subscription revenue growth. 
Total subscription revenues increased 5% in the quarter, right in line with our expectations. Domestics sub revenues were also up in the mid-single digits, similar to recent quarters. 
International subscription revenue increased in the double-digit as we benefited from healthy demand for our OTT products in Europe. 
Looking ahead, we're seeing better subscriber performance at our traditional distributors as we begin to benefit from our new affiliate deals, and we expect that to continue improving throughout the year. 
When combined with continuous healthy growth for our OTT products and solid international trends, we expect subscription revenue growth to accelerate into the high single digits in the second quarter and to remain strong throughout the year. So we're very confident in delivering the high single-digit growth for the year that we previously discussed. 
Content and other revenues were down slightly in the quarter due to the timing of home entertainment releases. That was largely offset by healthy growth in international licensing revenues as demand for HBO's original content around the world remains robust. 
Adjusted operating income was up a very strong 22% in the quarter as total expenses declined 5%. That was related to lower distribution costs associated with the decline in home video revenue and lower programming expenses. Programming cost declined 2% as a result of the timing of the reduction in amortization, which was recognized in the second quarter of 2016. Excluding the lower amortization, programming expenses would have been up high single digits as we continue to invest in new original content like Big Little Lies and The Young Pope as well as higher acquired programming expenses tied to the delivery of major theatrical titles. 
Overall, HBO was off to a great start to the year. And with a strong pipeline of content and accelerating subscription revenue trends, HBO is set up for a very healthy growth in adjusted operating income in 2017. 
Moving on to Warner Bros., where we also had a tremendous first quarter with revenues up 8% and adjusted operating income increasing 20%, led by our TV and theatrical businesses. 
Revenues and associated profits in our TV business grew well into the double digits as we benefited from strong growth in licensing revenue related to a few catalog titles, including Friends, and continuous healthy demand internationally. This reinforces the staying power and value of the biggest hits, which bodes well for Warner Bros. going forward as the leading producer of TV shows. 
The strong performance and the global demand for hit contents is also evident at the theatrical business. In the first quarter, we benefited from the box office releases of The LEGO Batman Movie and Kong: Skull Island. We also posted strong home entertainment results, with revenues up 15% including over 40% growth in ESP. That was led by last year's franchise films with the Home Entertainment release of Fantastic Beasts and Where to Find Them as well as carryover revenues from Suicide Squad. 
We expect to maintain the momentum in our theatrical business as our franchise release slate continues with Wonder Woman next month and Justice League later this year, and we should continue to see the benefit in Home Entertainment and TV licensing as these films move through those windows. 
Turning to games. We faced difficult comparisons in the quarter and we did not release any major console games. So as expected, revenues declined. But with 2 franchise console releases on this year's slate, starting with Injustice 2 later this month, we expect significant growth in our games business in 2017. 
So Warner Bros. has great momentum and is executing at a very high level. And with its strong franchise-led theatrical and games slates combined with healthy trends in the TV business, Warner is positioned to deliver another year of strong adjusted operating income growth. 
Turning to the next slide. Free cash flow in the quarter almost doubled compared to last year, totaling close to $1.4 billion. In addition to the growth in adjusted operating income, working capital was a significantly lower use of cash in the quarter. Working capital benefited from the positive impact to accounts receivable from the strong performance of Warner Bros. theatrical and Home Entertainment slate in the fourth quarter as well as the timing of production spend. So we had a strong first quarter of cash generation, and we expect another year of healthy free cash flow. 
Looking at our balance sheet. We ended the first quarter with approximately $21.8 billion of net debt, down about $1 billion compared to the end of 2016. That's primarily result of our strong free cash flow generation. 
As a result, our leverage ratio at the end of the quarter was 2.6x, below our target leverage ratio of 2.75x, and we expect our leverage ratio will continue to fall through the year as a result of discontinuing share repurchases in connection with entering into the merger agreement with AT&T. 
So overall, we're very pleased with our strong financial results in the first quarter, and that keeps us on pace for the outlook we laid out in February for full year adjusted operating income growth in the high single digits based on current exchange rates. We continue to expect growth for the remainder of 2017 to be weighted to the second half of the year due to the timing of expenses at Turner. 
Looking specifically at the second quarter. As we plan for, Turner will see the biggest impact related to its new contract with the NBA, and we expect that to contribute to total programming cost growth of approximately 20%. 
We also plan to continue investing in new digital initiatives, including the Boomerang-branded SVOD service we recently launched, and in marketing to support upcoming original programming like Season 2 of Animal Kingdom and the debuts of Claws and Will on TNT. 
So as a result of these factors, we expect adjusted operating income to decline in the second quarter for both Turner and the total company, with both returning to very healthy growth in the second half of the year. 
Overall, we continue to make great progress on our key strategic initiatives across the company, and we are confident that with our continued investments in high-quality content and new digital initiatives in business models, we're well positioned to sustain our momentum and deliver strong financial results in 2017 and for many years to come. 
Now I'll turn it back to Jessica for Q&A."
24689,424207541,1187656,"Time Warner Inc., Q1 2017 Earnings Call, May 03, 2017",2017-05-03,"Earnings Calls","Warner Media, LLC","Executives","Great. Thanks, Howard. Rob, we'll take our first question.",9,"Great. Thanks, Howard. Rob, we'll take our first question."
24689,424207541,1187656,"Time Warner Inc., Q1 2017 Earnings Call, May 03, 2017",2017-05-03,"Earnings Calls","Warner Media, LLC","Operator","Our first question is from the line of Alexia Quadrani with JPMorgan.",12,"Our first question is from the line of Alexia Quadrani with JPMorgan."
24689,424207541,1187656,"Time Warner Inc., Q1 2017 Earnings Call, May 03, 2017",2017-05-03,"Earnings Calls","Warner Media, LLC","Analysts","Could you provide a bit more color on the overall ad market? How it is trending in general, I guess, and how the current environment might influence the [indiscernible] this year. I know you gave a lot of color on through the ratings and what you're seein",81,"Could you provide a bit more color on the overall ad market? How it is trending in general, I guess, and how the current environment might influence the [indiscernible] this year. I know you gave a lot of color on through the ratings and what you're seeing specifically there into Q2. I think you might have said you're seeing some moderation of raw spend. I guess, if I heard it correctly, what -- sort of any color of what's driving that?"
24689,424207541,1187656,"Time Warner Inc., Q1 2017 Earnings Call, May 03, 2017",2017-05-03,"Earnings Calls","Warner Media, LLC","Executives","John, why don't you take that?",6,"John, why don't you take that?"
