"companyid","keydevid","transcriptid","headline","mostimportantdateutc","keydeveventtypename","companyname","speakertypename","componenttextpreview","word_count","componenttext"
100231,311894007,880350,"AT&T, Inc., Q3 2015 Earnings Call, Oct 22, 2015",2015-10-22,"Earnings Calls","AT&T Inc.","Executives","Right. Let me take that quickly. First of all, the first revenue synergy that we've really gone after, and we're seeing good success, and quite frankly, we're very excited about the results. It's in the cross-selling of DIRECTV or the satellite products i",305,"Right. Let me take that quickly. First of all, the first revenue synergy that we've really gone after, and we're seeing good success, and quite frankly, we're very excited about the results. It's in the cross-selling of DIRECTV or the satellite products in our company-owned stores. We have about 2,300 company-owned stores, and virtually all of them are actively selling DIRECTV now. And some of them never sold a video product before. So it was -- we had to do some training and some learning. But what we found is we came through the quarter, we were able to sell more and more out of those stores and we got very optimistic
[Audio Gap] 
service those customers integrated basis and we're moving forward. We're starting to sell that based on the really great news we saw from the retail chain. We're really optimistic about single sales results unfold in the fourth quarter and next year. Last thing is, our service technicians have been installing broadband for us, for U-verse for us, but they ended installing DIRECTV. So we've been putting them to through a training program and we expect the rollout in the fully trained on installing satellite in the home in probably November or so, the early part of November, such that we will then be able to sell a single truck roll installation for broadband and video. We're very excited about that. It'll be a measured approach. We're going to have -- we will have everybody trained on the first day, but we're excited about what that will bring. I think that will bring, not only good performance in the fourth quarter, but quite frankly, really look forward to that kind of performance positive performance and impact next year. So that's kind of the way we're thinking about some of those things, Amir."
100231,311894007,880350,"AT&T, Inc., Q3 2015 Earnings Call, Oct 22, 2015",2015-10-22,"Earnings Calls","AT&T Inc.","Operator","Our next question is from John Hodulik from UBS.",9,"Our next question is from John Hodulik from UBS."
100231,311894007,880350,"AT&T, Inc., Q3 2015 Earnings Call, Oct 22, 2015",2015-10-22,"Earnings Calls","AT&T Inc.","Analysts","Pretty focus on the guidance. First of all, John, is it possible for you to give us sort of where we are on a year-to-date basis in terms of the 2 68 to 2 74? And then maybe what's driving the change in terms of -- is it just wireless margins that they we",76,"Pretty focus on the guidance. First of all, John, is it possible for you to give us sort of where we are on a year-to-date basis in terms of the 2 68 to 2 74? And then maybe what's driving the change in terms of -- is it just wireless margins that they were definitely ahead of where we were? Or are you realizing synergies faster? Or is there any other moving parts will be great."
100231,311894007,880350,"AT&T, Inc., Q3 2015 Earnings Call, Oct 22, 2015",2015-10-22,"Earnings Calls","AT&T Inc.","Executives","Yes, so we're at the 2 09 mark today. And so that was ahead of our prior plans. As you know, the $0.74 was ahead -- was ahead of our most recent plans. That has really been driven by cost efficiency. And it's driven by, I think, savings across the board,",251,"Yes, so we're at the 2 09 mark today. And so that was ahead of our prior plans. As you know, the $0.74 was ahead -- was ahead of our most recent plans. That has really been driven by cost efficiency. And it's driven by, I think, savings across the board, whether it's a lower number of calls into the call centers, whether it's really top-notch performance of our digital first initiatives, whether it's the streamlining of our installation process through our -- what we call Project Halo or high automation low overhead process, whether the Software Defined Networks. All of those things just blocking and tackling and taking calls into the call centers and getting answers right the first time. All of those things, all of those things are driving cost savings. And we have seen some better performance. as I mentioned, and our business solutions, our business solutions team is really doing well in a tough economy, particularly in the enterprise and the public sector space, but really well in the small business space, and that gives us optimism. So we mentioned with wireless, you are seeing growth in those -- in that area, but we are seeing the acceptance of our Network on Demand, our NetBond, our Software Defined Networks all moving customers in a positive direction. So it's all of those things giving us optimism for the fourth quarter. With that being said, certainly, wireless and it's performance goes without question that is helping drive earnings performance."
100231,311894007,880350,"AT&T, Inc., Q3 2015 Earnings Call, Oct 22, 2015",2015-10-22,"Earnings Calls","AT&T Inc.","Operator","Our next question comes from Mike McCormack from Jefferies.",9,"Our next question comes from Mike McCormack from Jefferies."
100231,311894007,880350,"AT&T, Inc., Q3 2015 Earnings Call, Oct 22, 2015",2015-10-22,"Earnings Calls","AT&T Inc.","Analysts","John, maybe just dig a little bit on the churn commentary. Your thoughts on whether or not we're seeing a spike in involuntary. And then how does that sort of pace out if you look at the future phone subs, are those the ones I'm assuming mostly at risk th",90,"John, maybe just dig a little bit on the churn commentary. Your thoughts on whether or not we're seeing a spike in involuntary. And then how does that sort of pace out if you look at the future phone subs, are those the ones I'm assuming mostly at risk there? And then secondly, just on the ARPU side, I know last quarter you benefited from year-over-year easy comps. I'm assuming that as we go into the fourth quarter, we should sort of restart that trajectory and year-over-year declines getting better."
100231,311894007,880350,"AT&T, Inc., Q3 2015 Earnings Call, Oct 22, 2015",2015-10-22,"Earnings Calls","AT&T Inc.","Executives","Let me take that, Mike. On the churn, first and foremost, yes, the feature phone churn is hitting us and having an impact on us, and those are decisions we made not to chase those customers. [indiscernible] work on not only the pricing for those customers",178,"Let me take that, Mike. On the churn, first and foremost, yes, the feature phone churn is hitting us and having an impact on us, and those are decisions we made not to chase those customers. [indiscernible] work on not only the pricing for those customers, but both the impact throughout our base. But secondly, we believe that we're picking that up and showing tremendous improvement in the prepaid space with Cricket. So we are seeing total churn come down, which I think is really important. With regards to ARPUs, we did have easier comparison in the second quarter of '15 to second quarter of '14 because of some promotional activities that took place in the second quarter of '14, but we've seen stabilization in our ARPUs and we feel -- and in our total revenues. So we feel optimistic about the business going forward. But once again, we're going to be focus on profitable growth, not just chasing customer accounts or specific targets. We're going to be really focused on just getting most props of the business."
100231,311894007,880350,"AT&T, Inc., Q3 2015 Earnings Call, Oct 22, 2015",2015-10-22,"Earnings Calls","AT&T Inc.","Analysts","Just a quick follow-up on the churn commentary. Is there anything happening on the involuntary side you're seeing there?",20,"Just a quick follow-up on the churn commentary. Is there anything happening on the involuntary side you're seeing there?"
100231,311894007,880350,"AT&T, Inc., Q3 2015 Earnings Call, Oct 22, 2015",2015-10-22,"Earnings Calls","AT&T Inc.","Executives","No, Mike, I wouldn't turn into that. We haven't seen a significant change. In fact, I'd like to point to your, first off, I wouldn't point that our customer base was, quite frankly, we're very lucky to have the quality customer base we have. We're very fo",47,"No, Mike, I wouldn't turn into that. We haven't seen a significant change. In fact, I'd like to point to your, first off, I wouldn't point that our customer base was, quite frankly, we're very lucky to have the quality customer base we have. We're very fortunate."
100231,311894007,880350,"AT&T, Inc., Q3 2015 Earnings Call, Oct 22, 2015",2015-10-22,"Earnings Calls","AT&T Inc.","Operator","We'll now go to Phil Cusick with JPMorgan.",9,"We'll now go to Phil Cusick with JPMorgan."
100231,311894007,880350,"AT&T, Inc., Q3 2015 Earnings Call, Oct 22, 2015",2015-10-22,"Earnings Calls","AT&T Inc.","Analysts","So first on EPS, should we be thinking for '16 of the mid-single-digit or better off of the 2 71 midpoint? Or should we be thinking about different way given the DTV deal?",33,"So first on EPS, should we be thinking for '16 of the mid-single-digit or better off of the 2 71 midpoint? Or should we be thinking about different way given the DTV deal?"
100231,311894007,880350,"AT&T, Inc., Q3 2015 Earnings Call, Oct 22, 2015",2015-10-22,"Earnings Calls","AT&T Inc.","Executives","Yes, Phil, let's have it this way. We're not changing our guidance for '16 going forward. So the mid-single-digit growth rate is still good. [indiscernible] I'm not going to refer to -- it's still good even with this adjusted guidance.",40,"Yes, Phil, let's have it this way. We're not changing our guidance for '16 going forward. So the mid-single-digit growth rate is still good. [indiscernible] I'm not going to refer to -- it's still good even with this adjusted guidance."
100231,311894007,880350,"AT&T, Inc., Q3 2015 Earnings Call, Oct 22, 2015",2015-10-22,"Earnings Calls","AT&T Inc.","Analysts","So the 2 71 is the right starting point. Thanks. And that on Project Agile, can you give us an update on what sort of an overall cost cutting level is here and how we should think about that pacing in the next few years?",45,"So the 2 71 is the right starting point. Thanks. And that on Project Agile, can you give us an update on what sort of an overall cost cutting level is here and how we should think about that pacing in the next few years?"
100231,311894007,880350,"AT&T, Inc., Q3 2015 Earnings Call, Oct 22, 2015",2015-10-22,"Earnings Calls","AT&T Inc.","Executives","Well, I'd say this. We're going to expect it to continue growing over the next few years. What we had said originally was that we were going -- we were shooting for $3 billion of cost savings. I would suggest to you that we're probably somewhere between a",176,"Well, I'd say this. We're going to expect it to continue growing over the next few years. What we had said originally was that we were going -- we were shooting for $3 billion of cost savings. I would suggest to you that we're probably somewhere between a third and a half of the way there and that we plan to at least get there, get to that total target or exceed it. And then I'd point to the $2.5 billion of targeted DTV merger synergies. And certainly, based on what we know now, we expect to see us get there or exceed those. So those would be the 2 points. I would hope that we could exceed the Project Agile targets based on the progress we've made so far. These efforts do take them and investment. We've been spending that time investment in last couple of years to get here. We are seeing the results payoff. We're going to keep our focus in this direction, but we would hope to be able to exceed it."
100231,311894007,880350,"AT&T, Inc., Q3 2015 Earnings Call, Oct 22, 2015",2015-10-22,"Earnings Calls","AT&T Inc.","Operator","We have a question from Simon Flannery with Morgan Stanley.",10,"We have a question from Simon Flannery with Morgan Stanley."
100231,311894007,880350,"AT&T, Inc., Q3 2015 Earnings Call, Oct 22, 2015",2015-10-22,"Earnings Calls","AT&T Inc.","Analysts","John, can you talk a little bit about the video momentum and you sort of went through some of the channel changes here. You had, on a net basis, you did have subscriber losses, but I think you said before that you're hoping to grow your video subscribers",89,"John, can you talk a little bit about the video momentum and you sort of went through some of the channel changes here. You had, on a net basis, you did have subscriber losses, but I think you said before that you're hoping to grow your video subscribers over time. So perhaps you could just take us through the quarter and showed us some good growth ads on the DTV side, what's going on there with the churn and when do you expect to return to positive video adds."
100231,311894007,880350,"AT&T, Inc., Q3 2015 Earnings Call, Oct 22, 2015",2015-10-22,"Earnings Calls","AT&T Inc.","Executives","Yes, Simon, good question. I think we had a slide on this, but the chart can kind of tell you what's going on. Prior to the deal, there were some real pressure in the video satellite video area. There were some -- performance was less than it had been las",224,"Yes, Simon, good question. I think we had a slide on this, but the chart can kind of tell you what's going on. Prior to the deal, there were some real pressure in the video satellite video area. There were some -- performance was less than it had been last year. And as you see coming out, after the merger, after we start rolling out sales on the stores, you could see that we really picked up the trend and we expect that to continue. Secondly, with the rollout this quarter of the, if you will, one truck roll or single service experience where we can install TV and broadband at the same time, we not only expect the satellite-TV to pick up, but we also expect the broadband, IP broadband, to pick up because people buy those things together. And so we're hopeful that we're going to see -- we'll be able to show you some improvements and trend improvements -- continuing off of the third quarter into fourth quarter. We'll make any predictions about specific levels, but we are optimistic of what we've seen so far. We think the trends are headed in the right direction and we think the slide that we put together that shows that differentiation between '14 and '15, that will give you a good insight into that."
100231,311894007,880350,"AT&T, Inc., Q3 2015 Earnings Call, Oct 22, 2015",2015-10-22,"Earnings Calls","AT&T Inc.","Analysts","I guess U-verse decline, is that sort of run rate or is that all the gross adds shift into the other, DIRECTV or is that churn issue as well?",30,"I guess U-verse decline, is that sort of run rate or is that all the gross adds shift into the other, DIRECTV or is that churn issue as well?"
100231,311894007,880350,"AT&T, Inc., Q3 2015 Earnings Call, Oct 22, 2015",2015-10-22,"Earnings Calls","AT&T Inc.","Executives","U-verse is a couple of things. One, certainly, the low-cost -- the lower-cost platform has been our first choice for net adds. Two, we did -- because of focus on profitability, we really got away from promotional pricing and those customers who were cost",140,"U-verse is a couple of things. One, certainly, the low-cost -- the lower-cost platform has been our first choice for net adds. Two, we did -- because of focus on profitability, we really got away from promotional pricing and those customers who were cost sensitive just had a propensity to churn. When you first put those steps in place, we saw a little bit of higher churn in the second quarter. We're seeing a little bit higher in the third quarter because of that disciplined approach. But I would tell you that if -- we still have a solid, very good, very high-quality customer base in U-verse, and we're certainly looking to continue to service -- serve those customers with the best products and services. So I think we're focused on lowering churn and keeping those customers quite satisfied."
100231,311894007,880350,"AT&T, Inc., Q3 2015 Earnings Call, Oct 22, 2015",2015-10-22,"Earnings Calls","AT&T Inc.","Operator","And our next question is from Brett Feldman with Goldman Sachs.",11,"And our next question is from Brett Feldman with Goldman Sachs."
100231,311894007,880350,"AT&T, Inc., Q3 2015 Earnings Call, Oct 22, 2015",2015-10-22,"Earnings Calls","AT&T Inc.","Analysts","Just a quick point of clarification and then a question. You talked about the film -- fulfillment accounting methodologies in the slide. Is that your previous methodology change from August or is it something new?",35,"Just a quick point of clarification and then a question. You talked about the film -- fulfillment accounting methodologies in the slide. Is that your previous methodology change from August or is it something new?"
100231,311894007,880350,"AT&T, Inc., Q3 2015 Earnings Call, Oct 22, 2015",2015-10-22,"Earnings Calls","AT&T Inc.","Executives","Brett, that's the same change. If I could, before you ask your question, let me give you insight on it. On a year-over-year basis, in this quarter, the fulfillment accounting had about a $0.02 impact. That is the differential between applying it to DIRECT",241,"Brett, that's the same change. If I could, before you ask your question, let me give you insight on it. On a year-over-year basis, in this quarter, the fulfillment accounting had about a $0.02 impact. That is the differential between applying it to DIRECTV and U-verse this quarter as opposed to just applying it to the U-verse product last third quarter '14. And so that could give us some help. Additionally, in this quarter, I want to point out we had about $0.01 of help from the cap [ph] funding activity that went on and what we applied for. By the same token, we had about $0.01 [indiscernible] pressure from the Mexico operations that we had last year. And when we look at our income tax expense, but for the -- setting aside anything that we traded otherwise, there's about $0.02 of income tax pressure, EPS pressure from income taxes. So when you look at the fulfillment accounting and the other kind of unique items that occurred, they kind of balance off with the [indiscernible] funding and fulfillment accounting generating about $0.03 of benefit in Mexico and the income tax is generating about $0.03 of pressure. So we treated those all as going -- because they're going to be going for, because they were to be continuing, we want to make sure I pointed that out. With that being said, Brett, interrupted you before you got ask your question. I apologize."
100231,311894007,880350,"AT&T, Inc., Q3 2015 Earnings Call, Oct 22, 2015",2015-10-22,"Earnings Calls","AT&T Inc.","Analysts","And was able to the question yes, we have a lot data points disclosures we have found Mylan today. One of the things we see here video ARPU in we have IP broadband ARPU. Our trends in your new entertainment segment and, I guess, as you think about your st",92,"And was able to the question yes, we have a lot data points disclosures we have found Mylan today. One of the things we see here video ARPU in we have IP broadband ARPU. Our trends in your new entertainment segment and, I guess, as you think about your strategy going forward, your bundling strategy, I mean, do you have any guidance you can offer to think about the right way to think of the trajectory of those second quarter items because there's a critical to the revenue outlook of that segment."
100231,311894007,880350,"AT&T, Inc., Q3 2015 Earnings Call, Oct 22, 2015",2015-10-22,"Earnings Calls","AT&T Inc.","Executives","Yes, think were going to be looking to continuing to protect and improve on the trends that we are seeing, some growing those ARPUs. But likewise, with these assets that we have in place, I would suggest to you that our ability to capture the market, but",128,"Yes, think were going to be looking to continuing to protect and improve on the trends that we are seeing, some growing those ARPUs. But likewise, with these assets that we have in place, I would suggest to you that our ability to capture the market, but we're in a very good position to capture the market. Now that we have video where we have broadband without any video, and now that we have broadband, where DIRECTV had video, but didn't have broadband before. So I want to suggest to you that we're going to look for profitable growth and focus on that, but I do -- but we are excited. We are positive about the fact that in some of those cases, we have some growing ARPUs."
100231,311894007,880350,"AT&T, Inc., Q3 2015 Earnings Call, Oct 22, 2015",2015-10-22,"Earnings Calls","AT&T Inc.","Analysts","Just to be clear, it sound like you're really excited about the opportunity to add more customer and more generating units. That's going to be a big piece of how we think about shaping revenue growth through that segment?",39,"Just to be clear, it sound like you're really excited about the opportunity to add more customer and more generating units. That's going to be a big piece of how we think about shaping revenue growth through that segment?"
100231,311894007,880350,"AT&T, Inc., Q3 2015 Earnings Call, Oct 22, 2015",2015-10-22,"Earnings Calls","AT&T Inc.","Executives","We are very much -- we're very excited about the ability to add customers, absolutely. And I want to suggest that were not going to focus on profitable customers materially our, but we are very excited about the opportunities. I want to go back to the cro",98,"We are very much -- we're very excited about the ability to add customers, absolutely. And I want to suggest that were not going to focus on profitable customers materially our, but we are very excited about the opportunities. I want to go back to the cross-selling opportunities. I go back to -- we've got high-quality video products and we've got high quality Wireless network and high-quality broadband capabilities and they have capacity in all of them. And so it's a great way to expand your profits and by expanding customers in those investments that you've already completed."
100231,311894007,880350,"AT&T, Inc., Q3 2015 Earnings Call, Oct 22, 2015",2015-10-22,"Earnings Calls","AT&T Inc.","Operator","Our next question is from David Barden with Bank of America.",11,"Our next question is from David Barden with Bank of America."
100231,311894007,880350,"AT&T, Inc., Q3 2015 Earnings Call, Oct 22, 2015",2015-10-22,"Earnings Calls","AT&T Inc.","Analysts","I guess, 2 if I could. Just first, John, a little bit following up on that question. Just in terms of the kind of looking at the new way that AT&T is presenting itself to the marketplace, should we be looking at modeling the wireless business separately i",146,"I guess, 2 if I could. Just first, John, a little bit following up on that question. Just in terms of the kind of looking at the new way that AT&T is presenting itself to the marketplace, should we be looking at modeling the wireless business separately in consumers business is giving us kind of 2 very unique pictures of 2 very unique businesses? Or is this really just AT&T Wireless the way it's always been run and we really should be just thinking about dividing it between the 2 pieces? Maybe the first one. The second one is on CapEx. Could you -- so many now new parts of the discontinue kind of give us our CapEx is not being allocated between kind of the Latin America, the Mexico, and then domestic business units and how we should think about all those different pieces trending?"
