"companyid","keydevid","transcriptid","headline","mostimportantdateutc","keydeveventtypename","companyname","speakertypename","componenttextpreview","word_count","componenttext"
100231,306718929,837471,"AT&T, Inc., Q2 2015 Earnings Call, Jul 23, 2015",2015-07-23,"Earnings Calls","AT&T Inc.","Executives","So on the Wholesale business, first thing is we exited our mobile housing business. We really turned that down after seeing anymore. That's having a significant impact on the global -- on the Wholesale business. That's the first point. The second point we",324,"So on the Wholesale business, first thing is we exited our mobile housing business. We really turned that down after seeing anymore. That's having a significant impact on the global -- on the Wholesale business. That's the first point. The second point we're saying is a continued -- not only pressure on the legacy analog sources, but a movement towards for efficient IP strategic services. So when the customers move up, sometimes they have more services in place. But even after they drop the legacy services, the strategic services oftentimes have more efficiency. And so until the volumes grow to absorb that, there's a disconnect between those revenue sources. But with that being said, we still feel very good about the -- our win percentages and our ability to hold onto that business and our ability to grow going forward. The biggest first issue with regard to wholesale, though, is the fact that we decided to get ourselves. And then the second piece is they've transitioned to strategic services, to ethernet and other things. But we will continue to be positive. We'll continue to be able to compete well in that wholesale space. With regard to GigaPower, just we're not giving out cost per unit price this time. And let me give you some insights into why that would be challenging at this point. There is a difference between whether you do it on an aerial basis or very capable basis. This multi dwelling units were they do it today single home and a single residence. So all of those factors, at this stage, could mislead folks with any factual numbers. So we've chosen not to do that. But we are just getting started with the fiber to the prem activity. We're pleased with it. I can suggest if there we're probably still in the early stages of it, but the take rates, the satisfaction rates continue to outperform our expectations with our customers."
100231,306718929,837471,"AT&T, Inc., Q2 2015 Earnings Call, Jul 23, 2015",2015-07-23,"Earnings Calls","AT&T Inc.","Operator","That is from James Ratcliffe with Buckingham Research.",8,"That is from James Ratcliffe with Buckingham Research."
100231,306718929,837471,"AT&T, Inc., Q2 2015 Earnings Call, Jul 23, 2015",2015-07-23,"Earnings Calls","AT&T Inc.","Analysts","Two on the wireless side, if I could. First of all, can you give a little color about what's driving the improvement you're seeing in prepaid churn? Just improving credit quality or better retention shared, something else going on there? And second, given",70,"Two on the wireless side, if I could. First of all, can you give a little color about what's driving the improvement you're seeing in prepaid churn? Just improving credit quality or better retention shared, something else going on there? And second, given the continued growth in Connected Car, any insight you can provide around the economics around those with running and has very nascent sees a revenue shares involve?"
100231,306718929,837471,"AT&T, Inc., Q2 2015 Earnings Call, Jul 23, 2015",2015-07-23,"Earnings Calls","AT&T Inc.","Executives","So on the prepaid business, there's a couple of things. One, great plans, great attention to our customers. But quite frankly, they're right now a great network. So they're getting great service with cost efficient plans. We're able to do it because they'",529,"So on the prepaid business, there's a couple of things. One, great plans, great attention to our customers. But quite frankly, they're right now a great network. So they're getting great service with cost efficient plans. We're able to do it because they're paying for their own phones. So it's really just a lot of hard work by our network team and getting these customers converted from the network that they were on, the CDMA network they're on onto our OTA networks. So they're having a great experience, that's one. Two, we're giving the pricing. We can do that because they're paying their own phones essentially. So they are still assuming our operations team is working very hard to integrate the quality of our networks, our backbone in our cost structure. All of those things was driving the trend there is really I'm sure has a lot to do with these great networks that they're ready. So I would suggest to that. On the Connected Car, there's kind of 3 relationships I think of when I think of that connected side. There's one of the wholesale relationship with manufacturer pressure/dealers that's the ability to deliver on-time information, real-time information to the particularly from the cars for our letter with the designed, marketing activities, announces, upgrades to mapping and so on and so forth. And that's a wholesale relationship we have with the auto manufacturers. As we continue to develop applications and they continue to develop applications and information inside out of that process, we'll continue to -- where helpful to continue to grow that revenue. The key to that is much of that activity can be done enough. And then hours. And so we -- the automotive [indiscernible] and get to that time in debt in that data in times when it's very cost efficient for us to do that. So we can utilize our networks when they are somewhat under utilized and they can still a really good quality data. There's that's ability to put it into a long-term value plan and part of our Mobile Share Value plans is had on service. We're just getting started with that. We're very optimistic about the opportunities there. But quite frankly, the cars first are just rolling off. And secondly, there's some promotional time and promotional activities with that capabilities available before we sign them up to the retail package. So that process is just getting started. We feel very good about it. And I think it fits within the overall connected life strategy that our mobility team is running. And then lastly, there's the prepaid opportunity for somebody with us and on the car, but wants to utilize of that connectivity in that car. And we are seeing some utilization of that today and we'll continue to see that develop. We're optimistic and very jazzed up, so to speak about the opportunities of the Connected Car I would suggest the company that's our scale insights. We look to this to being not only a success in the today's that as in today's relationships with our business customers, but a success going forward in revenue generation and margin generation improvement."
100231,306718929,837471,"AT&T, Inc., Q2 2015 Earnings Call, Jul 23, 2015",2015-07-23,"Earnings Calls","AT&T Inc.","Operator","That will be from Tim Moran with Oppenheimer.",8,"That will be from Tim Moran with Oppenheimer."
100231,306718929,837471,"AT&T, Inc., Q2 2015 Earnings Call, Jul 23, 2015",2015-07-23,"Earnings Calls","AT&T Inc.","Analysts","So John, great job in the financial discipline. So you think the wireless expenses is a good run rate he. There's a lot of moving parts. Do you think maybe a little light on the marketing this quarter or that was an impact then? Can you also just less giv",54,"So John, great job in the financial discipline. So you think the wireless expenses is a good run rate he. There's a lot of moving parts. Do you think maybe a little light on the marketing this quarter or that was an impact then? Can you also just less give us some data statistics."
100231,306718929,837471,"AT&T, Inc., Q2 2015 Earnings Call, Jul 23, 2015",2015-07-23,"Earnings Calls","AT&T Inc.","Executives","Yes, sure, Tim. Well, let me say this. On the margins. There's always going to be seasonality and we're always going to have the challenges there in our business. We're going to have a much smoother seasonality we may have because of the way we've shifted",128,"Yes, sure, Tim. Well, let me say this. On the margins. There's always going to be seasonality and we're always going to have the challenges there in our business. We're going to have a much smoother seasonality we may have because of the way we've shifted the business, flip some of the pressure quarters and the hiring quarters around. We'll have more smoother. But we will have additional activities as we get to the holiday season with more units and more activities with regards to that. Secondly, while we are going to be discipline that all cause including marketing, I would suggest we will continue to market and believe we've been effective with our marketing but have not shut it down. With what it was your last question?"
100231,306718929,837471,"AT&T, Inc., Q2 2015 Earnings Call, Jul 23, 2015",2015-07-23,"Earnings Calls","AT&T Inc.","Analysts","Yes, wireless usage and where maybe customers are in terms of utilization of their existing capacity of.",17,"Yes, wireless usage and where maybe customers are in terms of utilization of their existing capacity of."
100231,306718929,837471,"AT&T, Inc., Q2 2015 Earnings Call, Jul 23, 2015",2015-07-23,"Earnings Calls","AT&T Inc.","Executives","Yes, we continue to see data growth per handset to be significant. And it's been running at end of the 50% year-over-year increase for a while. With regard to the data plans, we are seeing customers a couple of things. We continue to see customers go to b",301,"Yes, we continue to see data growth per handset to be significant. And it's been running at end of the 50% year-over-year increase for a while. With regard to the data plans, we are seeing customers a couple of things. We continue to see customers go to bigger data plan, some of the 20 gig and bigger plans. And has helped our service revenues this quarter was we continue to see people do some more even when we gave -- we gave her over out to our customers to help them manage their plans, they took advantage of it. We continue to see some over usage. So we view that opportunity to get customers to buy some big buckets and move themselves out of that stress opportunity. But usage continues to be a positive for our revenue opportunities continues to be something our that were guys, which very closely. So we keep this high-quality service.
Thank you. Thanks, Lori. For everyone on the call, I want to thank you for being with us today. In closing, let me say this. For the last 3 years, we have laid a plan that deploy next generation networks, that develops some innovative products and services and that has been focused on repositioning our customer base. And at the same time, we've been focused on cost management. Second quarter results show that this strategy is working. We now stand ready to continue this process with our strategic investments, in spectrum, in Leap and Mexico, as well as our pending transaction with DIRECTV. We are ready to take advantage of our new opportunities as we transform our business and our industry. Thanks, again for being on the call. And as always, thank you for your interest in AT&T. Have a good evening. Thank you very much."
100231,306718929,837471,"AT&T, Inc., Q2 2015 Earnings Call, Jul 23, 2015",2015-07-23,"Earnings Calls","AT&T Inc.","Operator","Ladies and gentlemen, that will conclude our conference call for today. Thank you for your participation and for using AT&T Executive TeleConference service. And you may now disconnect.",28,"Ladies and gentlemen, that will conclude our conference call for today. Thank you for your participation and for using AT&T Executive TeleConference service. And you may now disconnect."
100231,306718929,837862,"AT&T, Inc., Q2 2015 Earnings Call, Jul 23, 2015",2015-07-23,"Earnings Calls","AT&T Inc.","Operator","Ladies and gentlemen, thank you for standing by. Welcome to the AT&T Second Quarter 2015 Earnings Conference Call. [Operator Instructions] I'd now like to turn the conference over to our host, Senior Vice President, Investor Relations for AT&T, Mr. Mike V",45,"Ladies and gentlemen, thank you for standing by. Welcome to the AT&T Second Quarter 2015 Earnings Conference Call. [Operator Instructions] I'd now like to turn the conference over to our host, Senior Vice President, Investor Relations for AT&T, Mr. Mike Viola. Please go ahead, sir."
100231,306718929,837862,"AT&T, Inc., Q2 2015 Earnings Call, Jul 23, 2015",2015-07-23,"Earnings Calls","AT&T Inc.","Executives","Okay. Thank you, Lori. Good afternoon, everybody. Welcome to our Second Quarter Conference Call. Thank you for joining us today. As Lori said, I'm Mike Viola, Head of Investor Relations for AT&T. Joining me on the call today is John Stephens, AT&T's Chief",367,"Okay. Thank you, Lori. Good afternoon, everybody. Welcome to our Second Quarter Conference Call. Thank you for joining us today. As Lori said, I'm Mike Viola, Head of Investor Relations for AT&T. Joining me on the call today is John Stephens, AT&T's Chief Financial Officer. John will provide an update with perspective on the quarter and then we'll follow that with a Q&A session.
Let me remind you that our earnings material is available on the Investor Relations page of the AT&T website, and that's att.com/investor.relations.
I need to call your attention on Page 2 to our safe harbor statement. Before we begin, the safe harbor statement says that some of our comments today may be forward-looking, and as such, they are subject to risks and uncertainties. Results may differ materially. And additional information is available on the Investor Relations page of AT&T's website.
Before I turn it over to John, let me cover Slide 3, cover our consolidated financial summary. Adjusted EPS for the quarter was $0.69. That's up more than 11% over last year's second quarter. This includes adjustments for a noncash charge related to Leap's network decommissioning and other merger-related costs, which include DIRECTV in Mexico. This strong year-over-year growth comes even with earnings pressure from our Mexican wireless operations as well as the impact from our divested Connecticut wireline business and our equity investment in América Móvil.
Consolidated revenues grew to $33 billion. It's up more than 2% when you adjust for the sale of our Connecticut wireline property. This growth was driven by continued solid performance in wireless, as we reposition our smartphone base. We had impressive gains in strategic business services and strong wireline consumer revenue growth.
Cash flows also grew significantly in the quarter. Cash from ops for the quarter totaled more than $9 billion, up more than 13% over last year's second quarter. And free cash flow was $4.5 billion and more than $7 billion on a year-to-date basis. And that brought our free cash flow dividend payout to 67% on a year-to-date basis.
And so with that overview, I'll now turn the call over to AT&T's Chief Financial Officer, John Stephens, and he'll discuss our operational highlights. John?"
