"companyid","keydevid","transcriptid","headline","mostimportantdateutc","keydeveventtypename","companyname","speakertypename","componenttextpreview","word_count","componenttext"
297018,281148425,752912,"Pitney Bowes Inc., Q4 2014 Earnings Call, Feb 02, 2015",2015-02-02,"Earnings Calls","Pitney Bowes Inc.","Operator","Good morning, and welcome to the Pitney Bowes Fourth Quarter Full Year 2014 Results Conference Call. [Operator Instructions]Today's call is also being recorded. If you have any objections, please disconnect your lines at this time.I would now like to",85,"Good morning, and welcome to the Pitney Bowes Fourth Quarter Full Year 2014 Results Conference Call. [Operator Instructions]
Today's call is also being recorded. If you have any objections, please disconnect your lines at this time.
I would now like to introduce your speakers for today's call: Mr. Marc Lautenbach, President and Chief Executive Officer; Mr. Michael Monahan, Executive Vice President and Chief Financial Officer; and Mr. Charles McBride, Vice President, Investor Relations.
Mr. McBride will now begin the call with the safe harbor overview."
297018,281148425,752912,"Pitney Bowes Inc., Q4 2014 Earnings Call, Feb 02, 2015",2015-02-02,"Earnings Calls","Pitney Bowes Inc.","Executives","About our expected future business and financial performance. Forward-looking statements involve risks and uncertainties that could cause actual results to be materially different from our projections.More information about these risks and uncertainties",171,"About our expected future business and financial performance. Forward-looking statements involve risks and uncertainties that could cause actual results to be materially different from our projections.
More information about these risks and uncertainties can be found in our 2013 Form 10-K annual report and other reports filed with the SEC that are located on our website at www.pb.com and by clicking on Investor Relations. Please keep in mind that we do not undertake any obligation to update any forward-looking statements as a result of new information or developments.
Also for non-GAAP measures used in the press release or discussed in this presentation, you can find reconciliations to the appropriate GAAP measures in the tables attached to our press release and also on our Investor Relations website. Additionally, we have provided slides that summarize most of the points we will discuss during the call. These slides can also be found in our Investor Relations website.
Now our President and Chief Executive Officer, Marc Lautenbach, will start with a few opening remarks. Marc?"
297018,281148425,752912,"Pitney Bowes Inc., Q4 2014 Earnings Call, Feb 02, 2015",2015-02-02,"Earnings Calls","Pitney Bowes Inc.","Executives","Good morning, and thank you for joining us. By now, I hope you had a chance to review the press release announcing our full year and fourth quarter financial results and our guidance for 2015. We are very pleased with our results for all of 2014, includ",722,"Good morning, and thank you for joining us. By now, I hope you had a chance to review the press release announcing our full year and fourth quarter financial results and our guidance for 2015. 
We are very pleased with our results for all of 2014, including our fourth quarter performance. We did a good job navigating a fairly turbulent macroeconomic environment. The fourth quarter clearly demonstrated the resilience and strength of our business model, our strong market position and our strong offerings. Mike will provide an overview of our fourth quarter, full year and our 2015 guidance. I'm going to provide perspective on our overall transformation. 
Bottom line, we've made tremendous progress against our 3 strategic initiatives to transform our company and unlock shareholder value. Just to remind everyone, our 3 strategic initiatives are: number one, stabilize our mail businesses; number two, drive operational excellence; and finally, growing our business through expansion in Digital Commerce. 
Let me take you to those initiatives in order. First, stabilizing the Mail business. Over the last 2 years, we have taken steps to reengineer our go-to-market model moving to sales techniques, which are much more scalable, including telesales and the web. These initiatives are providing the benefits of providing better client service and are substantially more efficient. This transition is complete in North America and underway in Europe. 
In the second quarter, we pointed to some disruption in our North American business as we changed our coverage model. We continue to have some descriptions in the third quarter. In the fourth quarter, however, we saw improvements from the trends in the second and third quarter, and we continue to expect improvement going forward. 
We're in the process of executing these go-to-market changes in Europe, and we expect to continue to execute these changes on a country-by-country basis throughout Europe. Again, we are confident that these go-to-market changes will provide better client service and be dramatically more efficient. 
Second, operational excellence. In May of 2013, we committed to reduce our going rate expense as we entered into 2015 by $100 million to $125 million. We've done that, and we did that while we have made substantial investments in our future, investments in our systems, our brand and importantly, our products. 
We've made substantial progress reducing our DSO and our inventory levels. Our inventory levels are about half what they were only 2 years ago. 
We committed to investment-grade ratios. To that end, we have both retired and refinanced debt. We have fine-tuned our geographic footprint and our product portfolio, focusing on specific markets and partnering in other geographic markets where we have competitive advantage and importantly, make good returns. 
And finally, in January this year, we relaunched our brand supported by a new website. This was much more than putting a fresh coat of paint on an old car. The brand reflects our company's unique position in the physical and digital world. The net impact of all these changes is an increase in our EBIT margins, a strong balance sheet and a company well positioned for the future. 
Finally, our last initiative, growing our business through expansion in Digital Commerce. In May of 2013, we identified a series of digital markets that, in aggregate, represented close to $30 billion of opportunity growing at a double-digit rate. We said it was our objective to lead in those markets and grow at double-digits rates. 
To many of you, it probably seems as an aspiration, given that businesses have not grown in several years. In 2014, those businesses grew over 20% and now represent more than 20% of our portfolio. Good progress from a standing start 2 years ago, but we've just scratching the surface. 
Bottom line, Pitney Bowes is a different company today than it was 2 years ago. We committed to a strategic plan, laid out markers, and we have executed. That said, quarter-to-quarter, there may be factors like changes in go-to-market or currency fluctuations that affect results, but our strategy is aimed at delivering shareholder value over the long term. Much more to do, and we're in the middle of a multiyear transformation, but we have created substantial value, and we have more in our site. 
Let me now turn it over to Mike to give you the specifics on the fourth quarter and the year."
