"companyid","keydevid","transcriptid","headline","mostimportantdateutc","keydeveventtypename","companyname","speakertypename","componenttextpreview","word_count","componenttext"
297018,303573341,843412,"Pitney Bowes Inc., Q2 2015 Earnings Call, Jul 30, 2015",2015-07-30,"Earnings Calls","Pitney Bowes Inc.","Executives","Thank you, Marc, and good morning. As we've said when we originally provided guidance, 2015 is a transition year in the company's major transformation to unlock additional value for shareholders and clients. As Marc noted, we are now at an inflection poin",2968,"Thank you, Marc, and good morning. As we've said when we originally provided guidance, 2015 is a transition year in the company's major transformation to unlock additional value for shareholders and clients. As Marc noted, we are now at an inflection point in the business.
During the quarter, we completed 2 significant transactions, closed a number of open items, continued to streamline operations, and we saw our North American mailing revenue further stabilize as a result of our go-to-market changes. Accordingly, I'll spend a little more time this quarter delayering our results to clarify our operational progress and how we are positioned for an improving outlook beginning in the second half of the year.
During the first half of this year, we remain focused on 3 key objectives: to stabilize mail, grow Digital Commerce and improve operational excellence. In North American mailing, we experienced a slowing rate of decline in revenue, which was the lowest rate of decline in the last 5 quarters. Because of this trend and as the sales force becomes more productive, we have higher confidence of continued improvement in revenue trends for this segment going forward. Globally, the go-to-market transition is complete in most of our major markets. We are now implementing our transition in France. We expect these markets to improve in line with our North American experience. 
Additionally, we've completed several changes in our geographic footprint to exit low-margin countries, the impacts of which will annualize in the second half of this year. We will continue to evaluate the best markets to maintain a direct business presence. As result of these and several other actions we have taken, we have significantly reduced our cost structure throughout the business, which has improved the company's overall margins while at the same time helping us to operate more efficiently. We have yet to recognize the full benefits of some of these initiatives.
While we are seeing SG&A benefits of go-to-market changes across the portfolio, we intend to leverage these new selling capabilities with the new value propositions. Over the past several weeks and months, we have brought to market several new products and services across our businesses that allow us to bring our technologies and platforms to different segments of our client base. As Marc mentioned, we recently launched a SaaS-based SMB relay communications hub, which leverages our Production Mail document security capabilities and also introduced our personal interactive video solutions for high-volume mailers. We'll discuss these and other product plans further at our Analyst Day on September 16.
We've also taken significant actions to reposition our portfolio, focusing on high-growth opportunities in the global digital commerce markets. We exited our marketing services business, to which we got good value, and reinvested the proceeds in Borderfree, which significantly enhances our capabilities and positioning in cross-border ecommerce. 
In addition to our operational progress, we resolved a couple of open items. We sold our former World Headquarters building, freeing up approximately $40 million of capital and reached the settlement and principal to resolve a previously disclosed outstanding matter with the Department of Justice.
We have also made substantial progress on our ERP program and are preparing for an initial pilot. We accomplished a lot in the second quarter. Our path forward is clear on how we will improve our operational performance. Additionally, we have a stable capital structure that gives us flexibility in our capital allocation decisions.
So with that, let me break down our second quarter results for you. Once again, currency and the businesses we divested in Europe last year had a meaningful impact on the comparison of our reported results for the quarter. 
During the quarter, currency translation adversely impacted our revenue comparisons by $36 million or 4%, and our earnings per share by nearly $0.02. Year-to-date, currency reduced revenue by $71 million and earnings per share by $0.03. These impacts are a result of the rapid strengthening of the U.S. dollar over the last year. Beyond the translation effects, currency also continued to impact the volume of U.S. outbound cross-border purchases in our ecommerce business. 
Additionally, the divested revenues related to the strategic actions in Europe from last year adversely impacted our revenue comparisons by more than $12 million or about 1%. Adjusting for currency and the businesses we divested in Europe last year, revenue would have declined about 3%. These headwinds will annualize in the second half of the year.
Let me now take you through the details of our income statement and then I'll review our business segment results. As a reminder, the company's second quarter earnings-related documents, which include our press release, financial statements and slides, can be found on our Investor Relations website. Also note, we revised our segment reporting to reflect how we are now operating the company. 
The Digital Commerce Solutions segment group is now comprised of our software solutions and global ecommerce segments. The global ecommerce segment results include our cross-border and shipping businesses. A new segment called other, includes the results of our recently divested marketing services business. All other segments remain unchanged. This will enhance investors ability to follow the performance of our key Digital Commerce growth initiatives going forward. The reclassified segment reporting on a historical basis can also be found on our Investor Relations website.
Turning to the income statement. Revenue for the quarter totaled $881 million, which was a decline of 4% on a constant-currency basis and 8% on a reported basis. Total revenue declined 3% compared to the prior year when adjusted for currency in the businesses we divested in Europe last year. On a constant-currency basis and adjusted for the divested revenues in Europe, revenue declined 4% in SMB solutions and 2% in Enterprise Business Solutions. Revenue grew 4% in Digital Commerce Solution, driven by growth in global ecommerce. Revenue declined 26% in the other segment as a result of the sale of marketing services during the quarter. Reported revenue, including the significant impact of currency during the quarter, declined 11% in SMB solutions, 5% in Enterprise Business Solutions and was flat in the Digital Commerce Solutions and declined 26% in other. 
SG&A this quarter includes a onetime stock-based compensation charge of $10 million directly associated with the Borderfree acquisition. SG&A also includes 1 month's worth of amortization of Borderfree-related intangibles of about $1 million. Adjusting for these items, SG&A declined $34 million from the prior year, and as a percent of revenue, improved by about 80 basis points. 
Net interest expense, which includes financing interest was $39 million, which was a decline of more than $3 million when compared to the prior year. Adjusted EBIT was $180 million and adjusted EBIT margin improved to 20.4% or a 70-basis-point improvement over prior year despite the inclusion of currency impacts, loss of 1 month of Imagitas income and amortization of Borderfree-related intangibles.
Adding back depreciation and amortization, adjusted EBITDA was $223 million. The effective tax rate on adjusted earnings was 32.5% compared to 33.4% in the prior year. The lower tax rate this quarter is mostly due to the mix of earnings.
Turning to earnings per share. Despite the lower revenue, we were still able to deliver adjusted EBIT margin improvement and earnings per share in line with our expectations. GAAP earnings per share was $0.75 for the quarter. Adjusted earnings per diluted share were $0.45. Included in adjusted EPS is $0.02 per share of negative impact from currency. Adjusted EPS excludes $0.44 per share of other income due to the net gain from the sale of Imagitas, $0.05 per share of other expense for transaction costs and fees related to the Borderfree and Imagitas transactions and the settlement in principal to resolve a previously disclosed outstanding matter with the Department of Justice, $0.04 per share of compensation expense related to the vesting of options associated with the Borderfree acquisition, and $0.04 per share of restructuring and asset impairment charges, including the sale of our former World Headquarters building. A reconciliation of our GAAP EPS to adjusted EPS can be found in our earnings press release and earnings slide.
Looking at free cash flow in the balance sheet. Free cash flow during the quarter was $84 million and $96 million on a GAAP-basis. In comparison to the prior year, second quarter free cash flow was lower primarily due to timing of working capital requirements, lower reserve account deposits and less of a decline in finance receivables. At the end of the quarter, we had $3 billion of debt, which was about $245 million lower than the prior year, and we had $800 million of cash and short-term investments on the balance sheet. Average outstanding borrowings during the quarter were about $319 million lower than the prior year. The average interest rate this quarter was 5.27%, which was flat to the prior year.
During the quarter, we returned $47 million of cash to our shareholders in the form of dividends, made $9 million in restructuring payments and received approximately $40 million of cash related to the sale of our former World Headquarters building. 
Also, we have $100 million of share repurchase authorization remaining. As share repurchases have become a higher priority in our capital allocation strategy, we expect to begin utilizing this authorization in the third quarter and intend to complete the share repurchases that are currently authorized by the end of the year. Also at the end of the quarter, we continue to have $100 million in commercial paper outstanding.
Turning to our business segment results. In North American mailing, revenue for the quarter was $357 million, and EBIT was $159 million. Revenue declined 3% on a constant-currency basis and 4% on a reported basis while EBIT increased 2%. The decline in revenue was the lowest rate of decline in 5 quarters, reflecting a continuation of the stabilization and results. Equipment sales declined at a low single digit rate as the disruption from the change in go-to-market subsides and as the sales organization becomes more productive. 
Recurring revenue streams trends were in line with prior quarters. EBIT margin was 44.7% and improved 250 basis points versus the prior year due to continued benefits from the mix of business, organizational streamlining and other ongoing cost-reduction initiatives.
In International Mailing, revenue for the quarter was $111 million and EBIT was $14 million. Revenue declined 15% on a constant-currency basis and 28% on a reported basis. Revenue declined 8%, excluding currency and the divested revenues I mentioned earlier. During the quarter, results continue to be impacted by the implementation of the go-to-market initiative, with most of our major markets now complete. France is out of consultation and is now implementing its go-to-market transition.
Revenue comparison was also adversely impacted by the timing of postal rate changes in a number of countries. EBIT margin was 12.8%, which was a decline of 450 basis points versus the prior year due primarily to lower mail finishing equipment sales, the impact of currency on some supply chain costs and the timing of postal rate changes.
Turning to the Enterprise Business Solutions group. In Production Mail, revenue for the quarter was $98 million and EBIT was $10 million. Revenue declined 7% on a constant-currency basis and 13% on a reported basis. Revenue would have declined 6%, excluding currency and the divested revenues in Europe related to this segment. The decline this quarter was due to lower support services revenue and fewer equipment sales in Europe and Asia. U.S. equipment sales grew as a result of an increase in the number of inserting equipment installations. EBIT margin was 10.3%, which was an improvement of 90 basis points versus the prior year due to favorable geographic mix and higher margin equipment sales as well as ongoing cost-reduction initiatives.
In Presort Services, revenue for the quarter was $114 million and EBIT was $24 million. Revenue grew 2% on both a constant-currency and reported basis. Revenue benefited from higher volume of first-class mail processed versus the prior year. EBIT margin was 20.7%, which was an improvement of 60 basis points versus the prior year due to revenue growth and ongoing operational productivity initiatives.
Turning to the Digital Commerce Solutions group. For the software services segment, revenue was $99 million and EBIT was $16 million. Revenue declined 4% on a constant-currency basis and 9% on a reported basis. Revenue was impacted by lower licensing and services sales in Europe and Asia-Pacific, which offset growth in licensing revenue in the Americas. However, as a result of go-to-market initiatives as well as new product introductions, the business is signing on a larger number of quality midsized deals, which will reduce dependency on onetime large deals and drive new client acquisitions. 
We are seeing this consistency and efficiencies in the business model playing out in substantially improved profitability in the software business. This, along with focused cost-reduction initiatives to streamline the operation, resulted in an EBIT margin of 16.3%, which was an improvement of 720 basis points versus the prior year.
For the global ecommerce segment, revenue was $78 million and EBIT was $3 million. Revenue grew 15% on a constant-currency basis and 14% on a reported basis. Revenue includes the Borderfree acquisition late in the quarter and expansion of the eBay U.K. outbound cross-border service. However, outbound package shipments from the U.S. continued to be pressured by the strong U.S. dollar. Shipping solutions revenue continued to strengthen as a result of additional new clients. The shipping business is also benefiting directly from sales improvements in the SMB channel that markets its solutions to small and mid-sized companies. EBIT margin was 3.9%, which was a decline of 160 basis points from the prior year as a result of ongoing operational costs and integration investments related to the Borderfree acquisition as well as continued investment in the company's cross-border platforms.
Within the other segment. Revenue was $25 million and EBIT was $6 million. Revenue declined 26% on a constant currency and reported basis. As a result of the sale of the marketing services business in May, we recognized only 2 months of reported revenue this quarter versus the full quarter of revenue in the prior year.
That concludes my comments on our financial performance for the quarter. Now I'd like to discuss our annual guidance and provide some insights on our outlook as we continue to drive the transformation of the company.
As I mentioned in my opening remarks, our accomplishment from the second quarter are expected to help drive improved results in the second half of the year. We expect the consolidated revenue growth on a constant-currency basis will improve in the third quarter from the current trend, with more significant growth in the fourth quarter, both driven by further stabilization of our mail-related businesses, benefits of new products and services and increased growth in our global ecommerce solutions. The fourth quarter is also expected to benefit from growth in software solutions, and the annualization of the impacts of the European market exits in 2014. Based on year-to-date results and our expectations of constant-currency growth of 1% to 5% in the second half of the year, we are adjusting our annual revenue guidance to a decline of 1% to growth of 1% when compared to 2014 on a constant-currency basis.
We are increasing annual GAAP EPS guidance to be in the range of $2.06 to $2.21. This guidance includes the following: $0.44 per share of other income related to the net gain from the sale of Imagitas, $0.05 per share of other expense for the settlement in principle of an outstanding matter with the Department of Justice, and transaction costs and fees related to the Borderfree and Imagitas transactions, and $0.04 per share of restructuring and asset impairment charges, $0.04 per share of compensation expense related to the vesting of options associated with the Borderfree acquisition, $0.06 per share reduced earnings as a result of the sale of Imagitas, and $0.04 per share of reduced earnings related to Borderfree, which principally includes amortization of intangibles and integration investments, net of early savings from expected synergies.
We are also updating annual adjusted EPS and free cash flow guidance solely to reflect the impacts of the Borderfree acquisition and Imagitas sale. Adjusted earnings per share is now expected to be in the range of $1.75 to $1.90. Included in adjusted earnings per share is the assumption that currency will have a $0.05 per share negative impact for the full year.
Free cash flow is now expected to be in the range of $450 million to $525 million. This adjustment of $25 million simply reflects the impacts of the Borderfree acquisition and the Imagitas sale. Bottom line, our adjusted earnings outlook remains unchanged except for the direct impact of the 2 transactions. While we have included a modest level of synergies this year related to the Borderfree integration as well as the investments to realize benefits, we are focused in the near term on driving a successful holiday season. 
That said, we see leverage across these highly complementary ecommerce businesses. And we are targeting a run rate synergy benefit of $25 million to $30 million in 18 months through the elimination of public company costs, logistics leverage and the consolidation of infrastructure. We'll provide greater details regarding our ecommerce growth strategy and related growth prospects at our Analyst Day in September.
Again, as Marc and I both noted, we view this quarter as an inflection point. We've taken a number of actions and made decisions that we believe will keep us on track to increase the long-term value of our company. We're confident that our performance, our products and our portfolio action will deliver on the strategic initiatives we laid out more than 2 years ago.
That concludes my remarks. Operator, can you please open the line for questions."
297018,303573341,843412,"Pitney Bowes Inc., Q2 2015 Earnings Call, Jul 30, 2015",2015-07-30,"Earnings Calls","Pitney Bowes Inc.","Operator","[Operator Instructions] And our first question in queue will come from Ananda Baruah with Brean Capital.",16,"[Operator Instructions] And our first question in queue will come from Ananda Baruah with Brean Capital."
297018,303573341,843412,"Pitney Bowes Inc., Q2 2015 Earnings Call, Jul 30, 2015",2015-07-30,"Earnings Calls","Pitney Bowes Inc.","Analysts","I guess a few if I could. The first is, Mike, could you just sort of walk us through the components of the adjusted EPS guide down? There's a number of things in the GAAP adjustments and just trying to make sure we understand the components to the adjuste",58,"I guess a few if I could. The first is, Mike, could you just sort of walk us through the components of the adjusted EPS guide down? There's a number of things in the GAAP adjustments and just trying to make sure we understand the components to the adjusted EPS change in guidance. And I have some follow-ups."
297018,303573341,843412,"Pitney Bowes Inc., Q2 2015 Earnings Call, Jul 30, 2015",2015-07-30,"Earnings Calls","Pitney Bowes Inc.","Executives","Sure. In terms of the adjusted EPS guidance forward, there are really simply 2 items that are adjustments to our prior guidance. One is $0.06 related to the Imagitas business sale. That would be the earnings of that business in the second half of the year",167,"Sure. In terms of the adjusted EPS guidance forward, there are really simply 2 items that are adjustments to our prior guidance. One is $0.06 related to the Imagitas business sale. That would be the earnings of that business in the second half of the year. And you would note that in that business, typically, there are big [Audio Gap] third quarter because of the move season around the summertime, but that's -- specifically relates to their earnings. The second is related to the Borderfree acquisition of $0.04 adjustment. That really reflects principally the amortization of the intangibles that are related to the acquisition. The amortization for this -- basically for the 7 months of the year that we would own the business, there's net about an additional $0.01 related to investments associated with integration of the business, offset by some early synergies associated with the business. So the net change is $0.10 in the adjusted earnings EPS range, and that's specifically related to those 2 items."
297018,303573341,843412,"Pitney Bowes Inc., Q2 2015 Earnings Call, Jul 30, 2015",2015-07-30,"Earnings Calls","Pitney Bowes Inc.","Analysts","Got it, just as a housekeeping question in that context. I believe last quarter, you had talked about an incremental -- baked into the old guidance, incremental expense for ongoing ERP and marketing program. Has that changed at all? Or is that still -- it",64,"Got it, just as a housekeeping question in that context. I believe last quarter, you had talked about an incremental -- baked into the old guidance, incremental expense for ongoing ERP and marketing program. Has that changed at all? Or is that still -- it wasn't called out this quarter. But I just want to make sure that nothing has changed there and it's..."
297018,303573341,843412,"Pitney Bowes Inc., Q2 2015 Earnings Call, Jul 30, 2015",2015-07-30,"Earnings Calls","Pitney Bowes Inc.","Executives","Yes, it continues to be in our base. Some of the, obviously, components are varied from quarter-over-quarter. We continue on track with both of those initiatives. And we'll continue to incur costs related to those in the second half, but those are in our",46,"Yes, it continues to be in our base. Some of the, obviously, components are varied from quarter-over-quarter. We continue on track with both of those initiatives. And we'll continue to incur costs related to those in the second half, but those are in our guidance assumptions."
297018,303573341,843412,"Pitney Bowes Inc., Q2 2015 Earnings Call, Jul 30, 2015",2015-07-30,"Earnings Calls","Pitney Bowes Inc.","Analysts","Okay, got it. And then the 1% to 5% constant-currency growth for the second half of the year is pretty strong. I realized there's -- some of the video stuff ramping and there's some kind of easy compare stuff in there as well. But generally speaking, do y",113,"Okay, got it. And then the 1% to 5% constant-currency growth for the second half of the year is pretty strong. I realized there's -- some of the video stuff ramping and there's some kind of easy compare stuff in there as well. But generally speaking, do you have more confidence now based on what you see in the pipeline that -- what has been your constant-currency guidance, which I believe is in kind of 1% to 3%, is a reasonable way to think about the normalized run rate of the business once you get through sort of all the -- sort of normalized model like kind of comping this and transacting that."
