"companyid","keydevid","transcriptid","headline","mostimportantdateutc","keydeveventtypename","companyname","speakertypename","componenttextpreview","word_count","componenttext"
289194,708649137,2259563,"3M Company, Q1 2021 Earnings Call, Apr 27, 2021",2021-04-27,"Earnings Calls","3M Company","Executives","Yes, Julian, thanks for the question. We talked about Q1. We saw continue to see strong demand. That's 630 million respirators delivered in Q1. And still in the quarter, 90% going to health care workers and I would say, first responders and increasingly e",250,"Yes, Julian, thanks for the question. We talked about Q1. We saw continue to see strong demand. That's 630 million respirators delivered in Q1. And still in the quarter, 90% going to health care workers and I would say, first responders and increasingly essential industries. The demand as we move forward, it's going to depend on a few factors. The first is what's going to be the demand in health care. And that's going to depend on how the pandemic plays out. And I would say how governments respond to dynamics in the pandemic. And there's been changing in protocol of use of respirators, for example, is one of those dynamics. 
As Monish said, this is one of the areas where we're working through the uncertainties as there's -- that demand, there's also governments, and we're working with governments around the world on stockpile strategies and continue to supply into those. 
And then there is consumer demand and increasing demand in industrial as economies recover. So we see some shifting as we go forward over time from the high priority, more than 90% into health care, shifting more into industrial and consumer. And then the demand overall, how much is it going to be relative to the impact on the overall enterprise relative to SIBG, that's going to depend on how each of those play out. But we're expecting to continue to see demand as we -- in Industrial and Consumer and Health Care as we go through the year."
289194,708649137,2259563,"3M Company, Q1 2021 Earnings Call, Apr 27, 2021",2021-04-27,"Earnings Calls","3M Company","Executives","To answer specifically your other question, Julian, I'm sorry, on why is the growth rate slowing down, we are starting to lap. So if my memory is right, Q1 of 2020, there was $100 million of disposable respirator that the company had disclosed even before",83,"To answer specifically your other question, Julian, I'm sorry, on why is the growth rate slowing down, we are starting to lap. So if my memory is right, Q1 of 2020, there was $100 million of disposable respirator that the company had disclosed even before my time. So you're going to see actually the amount. If you're looking at the percent, it's going to slow down, as I've said in my prepared remarks, because you're starting to lap the pandemic-related respirator demand year-on-year."
289194,708649137,2259563,"3M Company, Q1 2021 Earnings Call, Apr 27, 2021",2021-04-27,"Earnings Calls","3M Company","Executives","Yes, Julian. We disclosed all that last year as we went through the year. So Q2, it's a $225 million year-on-year comp. So we stepped from $100 million to $2.25 million, then $235 million in Q3 and I think in Q4, we are around $280 million.",46,"Yes, Julian. We disclosed all that last year as we went through the year. So Q2, it's a $225 million year-on-year comp. So we stepped from $100 million to $2.25 million, then $235 million in Q3 and I think in Q4, we are around $280 million."
289194,708649137,2259563,"3M Company, Q1 2021 Earnings Call, Apr 27, 2021",2021-04-27,"Earnings Calls","3M Company","Executives","Last year.",2,"Last year."
289194,708649137,2259563,"3M Company, Q1 2021 Earnings Call, Apr 27, 2021",2021-04-27,"Earnings Calls","3M Company","Executives","Last year. So the year-on-year contribution to growth is going to decline.",12,"Last year. So the year-on-year contribution to growth is going to decline."
289194,708649137,2259563,"3M Company, Q1 2021 Earnings Call, Apr 27, 2021",2021-04-27,"Earnings Calls","3M Company","Analysts","Yes, understood. And maybe just my second question around the capital deployment aspect. The cash flow has been very, very good yet again. Leverage, I think, is now around 1.4 or so times. Any updated thoughts around the balance sheet usage? Or do we thin",65,"Yes, understood. And maybe just my second question around the capital deployment aspect. The cash flow has been very, very good yet again. Leverage, I think, is now around 1.4 or so times. Any updated thoughts around the balance sheet usage? Or do we think that just given sort of the background, leverage is likely to remain fairly low through the rest of the year?"
289194,708649137,2259563,"3M Company, Q1 2021 Earnings Call, Apr 27, 2021",2021-04-27,"Earnings Calls","3M Company","Executives","Yes. It's a great question, Julian. I would go back again to just our capital priorities. The prioritization hasn't changed. Our first priority is always invest in R&D. Mike mentioned the areas that we have as we think about just a few and even John talke",227,"Yes. It's a great question, Julian. I would go back again to just our capital priorities. The prioritization hasn't changed. Our first priority is always invest in R&D. Mike mentioned the areas that we have as we think about just a few and even John talked about whether it's biopharma, home improvement, personal safety, digital, semiconductor, health care. There are tremendous opportunities that we believe we can keep investing in. So that's our first priority. I think, in the long run, that will give us the best return. 
The second priority is dividend. We did increase dividend 1% this year. It's the 63rd year of consecutive dividend increase. Our third priority is M&A. As you know, we are busy integrating Acelity. It's doing very well and integrating well into 3M. We don't see another acquisition in the size of Acelity in the near future, but we are always looking for opportunities where we believe that it's complementary to 3M's strengths as well as 3M can add value and synergies. 
And then our last priority is share repurchase. And as I said in my prepared remarks, we did have $231 million of share repurchases. 
I think the strength that we have right now, Julian, 1.4 net leverage gives us a lot of flexibility to go either way as well as gives us strategic opportunities to deploy when needed."
289194,708649137,2259563,"3M Company, Q1 2021 Earnings Call, Apr 27, 2021",2021-04-27,"Earnings Calls","3M Company","Operator","Our next question comes from the line of Andrew Kaplowitz with Citi.",12,"Our next question comes from the line of Andrew Kaplowitz with Citi."
289194,708649137,2259563,"3M Company, Q1 2021 Earnings Call, Apr 27, 2021",2021-04-27,"Earnings Calls","3M Company","Analysts","So Transportation and Electronics, as you know, had a very high range of outcomes for the year, low to high single digits and obviously, starting at the high end of the range. Is there any reason at this point why you wouldn't see the high end of the rang",106,"So Transportation and Electronics, as you know, had a very high range of outcomes for the year, low to high single digits and obviously, starting at the high end of the range. Is there any reason at this point why you wouldn't see the high end of the range in that particular segment, given the comps, do get a fair amount easier for the next couple of quarters. Maybe just could give us more color on how electronics and auto OE perform versus your expectations? I know you said, absolutely, but it seems like they continue to be strong or even improved despite supply chain concerns."
289194,708649137,2259563,"3M Company, Q1 2021 Earnings Call, Apr 27, 2021",2021-04-27,"Earnings Calls","3M Company","Executives","Yes. It's an important question for us, too, Andy. We had that wider range at the beginning of the year, which really reflected the dynamics in those end markets, the uncertainty that we were looking at as we came into the year. And we certainly had a goo",268,"Yes. It's an important question for us, too, Andy. We had that wider range at the beginning of the year, which really reflected the dynamics in those end markets, the uncertainty that we were looking at as we came into the year. And we certainly had a good start to the year. Transportation and Electronics off to a strong start, much like the rest of the company. They're still facing some considerable uncertainties in that marketplace. And we've talked about the chip shortage and its impact on both electronics and automotive. 
I think you see kind of changing dynamics in the build rates, much of it reflecting that dynamic. Electronics, I would say, consumer electronics is off to a strong start. Tablets and TVs really driving a lot of that. So it's how are these trends going to play out through the year, and it still reflects, I would say, a wider range of outcomes. And it also is going to depend on how the pandemic plays out. Some of these are dynamics being driven by the pandemic and its impact on the economy in general. 
So I would say that wide range that we came into the year, we still have a wide range view of how the uncertainties will impact these key market segments. But again, off to a strong start, automotive above the build rates, our growth in consumer electronics, above the build rates there. So we are -- we're winning in the marketplace with our solutions, and we're well positioned. We'll see how the market dynamics take us as we go through the year."
289194,708649137,2259563,"3M Company, Q1 2021 Earnings Call, Apr 27, 2021",2021-04-27,"Earnings Calls","3M Company","Analysts","And Mike, I wanted to ask you about your priority growth platforms in the context of -- obviously, there strong growth in the quarter, I think, 10%. There's a lot of money out there, whether it's the new Biden American jobs plan, focus on automotive elect",88,"And Mike, I wanted to ask you about your priority growth platforms in the context of -- obviously, there strong growth in the quarter, I think, 10%. There's a lot of money out there, whether it's the new Biden American jobs plan, focus on automotive electrification continues to increase. So how do you sort of change your focus, if at all, on some of these platforms? Do you shift more money into something like automotive electrification? Do you see more growth in certain areas like that moving forward?"
289194,708649137,2259563,"3M Company, Q1 2021 Earnings Call, Apr 27, 2021",2021-04-27,"Earnings Calls","3M Company","Executives","Yes, Andy, we talked about it all year last year about what we were doing to invest in the future, while we were managing through the big challenges that the pandemic threw at us in 2020. And we're accelerating, I would say, investments not only in our pr",227,"Yes, Andy, we talked about it all year last year about what we were doing to invest in the future, while we were managing through the big challenges that the pandemic threw at us in 2020. And we're accelerating, I would say, investments not only in our priority growth platforms, but other market trends that we were seeing that were opportunities for us. And when we talked about things that were going on, obviously, in personal safety, but also home improvement and other areas that the trends were strong. 
So that's how we're prioritizing growth based on the market trends, where we can create unique and differentiated value. Priority growth platforms tend to represent both of those strong markets. As John mentioned earlier, these are higher growth market segments. And then we have the investments that we make in the trends coming out of the pandemic, and we're stepping those up as we see the opportunity. So we're really driving those based on the growth opportunity that we see in front of us as we go through 2021, not locked in on a plan that we put together for our priority growth platforms before the year started. So I -- it is what we see as an opportunity to drive the growth and the growth outlook that we had for the year as we came into 2021."
289194,708649137,2259563,"3M Company, Q1 2021 Earnings Call, Apr 27, 2021",2021-04-27,"Earnings Calls","3M Company","Operator","Our next question comes from the line of Andrew Obin with Bank of America.",14,"Our next question comes from the line of Andrew Obin with Bank of America."
289194,708649137,2259563,"3M Company, Q1 2021 Earnings Call, Apr 27, 2021",2021-04-27,"Earnings Calls","3M Company","Analysts","Yes. I can reassure you that this will be one consumer stocking up on 3M masks because we have to do with inferior Kimberly-Clark products. So I just want to tell you that.",33,"Yes. I can reassure you that this will be one consumer stocking up on 3M masks because we have to do with inferior Kimberly-Clark products. So I just want to tell you that."
289194,708649137,2259563,"3M Company, Q1 2021 Earnings Call, Apr 27, 2021",2021-04-27,"Earnings Calls","3M Company","Executives","Thank you, Andrew.",3,"Thank you, Andrew."
289194,708649137,2259563,"3M Company, Q1 2021 Earnings Call, Apr 27, 2021",2021-04-27,"Earnings Calls","3M Company","Analysts","Having said that, just the dynamic in the Americas on safety and industrial and Transportation and Electronics, in the quarter, I think you guys gave very useful breakdown, just a broader dynamic by sub-end markets. But in America, Safety and Industrial i",89,"Having said that, just the dynamic in the Americas on safety and industrial and Transportation and Electronics, in the quarter, I think you guys gave very useful breakdown, just a broader dynamic by sub-end markets. But in America, Safety and Industrial is up 12%, I assume it's because of safety, but Transportation and Electronics down 4%. One is more OE, one is more channel. Can you just talk about this dynamic, what's happening? I think it does sound there some pre-stocking OE, but what's happening in the distribution channel?"
289194,708649137,2259563,"3M Company, Q1 2021 Earnings Call, Apr 27, 2021",2021-04-27,"Earnings Calls","3M Company","Executives","Yes, Andrew, you're right. Safety and Industrial Business Group and the performance in Americas has driven -- a big portion of that is driven by personal safety. It's been a strong growth driver. We talked about it. Monish highlighted some of the other in",286,"Yes, Andrew, you're right. Safety and Industrial Business Group and the performance in Americas has driven -- a big portion of that is driven by personal safety. It's been a strong growth driver. We talked about it. Monish highlighted some of the other industrial businesses. We're seeing recovery in the industrial markets. In general, we're seeing increasing demand in industrial adhesives and tapes. And industrial mineral products in the U.S. with a strong residential housing growth. All of those are driving what's going on in the Americas and across the Safety and Industrial business group. 
Transportation and Electronics, it's driven globally the strong growth that you saw by semiconductor fabrication, data centers, what I talked about earlier, in consumer electronics. Those are not the big drivers, obviously, in the U.S. at this point. The automotive is the driver in the U.S. and we're seeing -- I would say we're seeing good performance on our spec ins. We're winning additional spec ins in the OEMs and as that -- as the build rates pick up in the U.S., we'll see TEBG, the transportation business from the automotive side, get a strong contribution. 
We are -- Monish talked about some of the areas of uncertainties and things that we're looking at, commercial solutions and the demand for graphics that are part of that, the transportation safety products, those are still flat year-over-year growth even in decline in key end-market segments. And that's one of the things that is an uncertainty as we look at the year, how are those markets going to recover as economies recover? So that will be part of the answer to Transportation and Electronics picking up as we go in the Americas, in particular."
289194,708649137,2259563,"3M Company, Q1 2021 Earnings Call, Apr 27, 2021",2021-04-27,"Earnings Calls","3M Company","Analysts","Got you. And just a follow-up question. I think Andy touched a little bit on it, but it seems that we have plenty of visibility on semiconductor CapEx going up in the U.S. over the next several years. Given that semi capacity on the margin over the past d",105,"Got you. And just a follow-up question. I think Andy touched a little bit on it, but it seems that we have plenty of visibility on semiconductor CapEx going up in the U.S. over the next several years. Given that semi capacity on the margin over the past decade has been added outside of North America, do you need to make any adjustments to your manufacturing footprint in North America to sort of play this growth? Or is it just nature of your process and fungible capacity and just applies better overall capacity utilization in North America given the assets you already have in place?"
289194,708649137,2259563,"3M Company, Q1 2021 Earnings Call, Apr 27, 2021",2021-04-27,"Earnings Calls","3M Company","Executives","Yes. Andrew, as you know, we -- our strategy is to be close to customers, invest in capacity to meet the demands regionally around the world. And that's true broadly across the enterprise. There are some key product and market segments where we have more",220,"Yes. Andrew, as you know, we -- our strategy is to be close to customers, invest in capacity to meet the demands regionally around the world. And that's true broadly across the enterprise. There are some key product and market segments where we have more of a critical center in key areas of the world. U.S. is one of those areas where we are -- in the end, we're a net exporter of goods out of the United States because we have a stronger footprint here. 
And that's also true in much of the portfolio that we serve semiconductor fabrication with. We build that out close to -- the end users close to the customers. So we have significant resources in Asia, for example. We also supply a significant portion of it from capacity in the U.S. and even some capacity in Europe. So it is -- I think we're well positioned if we see that shift, and that's -- it's going to take time to play out. And as has been the case for us throughout history, as we see market dynamics change and shift around the world, we'll invest to build up that capacity where it's needed. So we'll have time to adjust and add capacity, but we start in a good place relative to that market segment."
289194,708649137,2259563,"3M Company, Q1 2021 Earnings Call, Apr 27, 2021",2021-04-27,"Earnings Calls","3M Company","Operator","Our next question comes from the line of John Walsh with Credit Suisse.",13,"Our next question comes from the line of John Walsh with Credit Suisse."
289194,708649137,2259563,"3M Company, Q1 2021 Earnings Call, Apr 27, 2021",2021-04-27,"Earnings Calls","3M Company","Analysts","So a lot of details already around the logistics and the supply chain as it relates to EPS and margin. But curious if there's any sales impact, your ability to kind of get raw, feedstock, et cetera, that you want to call out just because if you look at --",83,"So a lot of details already around the logistics and the supply chain as it relates to EPS and margin. But curious if there's any sales impact, your ability to kind of get raw, feedstock, et cetera, that you want to call out just because if you look at -- I mean even the midpoint of your guidance for the full year, just having a little trouble reconciling the 2-year and the 3-year kind of growth stack deceleration from what you just printed?"
289194,708649137,2259563,"3M Company, Q1 2021 Earnings Call, Apr 27, 2021",2021-04-27,"Earnings Calls","3M Company","Executives","So John, I would just say back to the point on Q2, there is a lot of uncertainty in the supply chain markets, other than, of course, the raw material and logistics costs we've talked about. It's just making sure that the product is flowing, making sure ou",235,"So John, I would just say back to the point on Q2, there is a lot of uncertainty in the supply chain markets, other than, of course, the raw material and logistics costs we've talked about. It's just making sure that the product is flowing, making sure our suppliers can make the product. As of right now, as I said, it's a very dynamic situation that's changing every day. So that is why that's one of the uncertainties that we have called out in the second quarter and the total year that we got to navigate through this. And hopefully, as we get through the second quarter, we'll be in a better state to see where we are for the year. So hopefully, that answers your question. 
Since you're talking about the second quarter and my memory failed me earlier, sorry. So Steve's question earlier also on -- if you're looking at Q1 versus Q2, just another point is FX, which is $0.13 benefit in Q1. For the year, we still see that to be $0.15. Again, we'll see where currencies move as the world plays itself out. And then from a tax rate perspective, we were at 16.4% for the first quarter, and our plan is 20% to 21% for the year. So those are the other items I would talk about, John, as I talk about the second quarter and its overall impact."
289194,708649137,2259563,"3M Company, Q1 2021 Earnings Call, Apr 27, 2021",2021-04-27,"Earnings Calls","3M Company","Analysts","Great. And then maybe a broader question here. You talked a little bit earlier about kind of new product vitality. You're talking about a lot of interesting technologies around enabling your sustainability commitments. Is there a way for 3M to actually co",82,"Great. And then maybe a broader question here. You talked a little bit earlier about kind of new product vitality. You're talking about a lot of interesting technologies around enabling your sustainability commitments. Is there a way for 3M to actually commercialize some of the stuff that you're doing to your own operations, some of the -- either the technology or the material science? Or can you take what you're doing and actually bring that out to other customers and monetize that?"
289194,708649137,2259563,"3M Company, Q1 2021 Earnings Call, Apr 27, 2021",2021-04-27,"Earnings Calls","3M Company","Executives","Yes. And John, I would say, for us, being a leader in sustainability is also about helping our customers. And making a difference for them. And you see that in our expectations and our requirement that every one of our new products has an improvement and",200,"Yes. And John, I would say, for us, being a leader in sustainability is also about helping our customers. And making a difference for them. And you see that in our expectations and our requirement that every one of our new products has an improvement and advantage in sustainability. So that's one of the ways we can leverage our technology and our technology platforms to make a difference for customers. 
Now we're also investing a lot of innovation in our operations. And it's always been -- you look at our fundamental strengths of the company, our manufacturing capabilities is foundational there. And about 1/3 of our intellectual property sits in our manufacturing operations, process technologies. And we leverage that for our own performance and our own product quality as a competitive advantage. 
There are opportunities as we think about ways that we can really lead forward in sustainability solutions that we can expand and our impact. And we certainly expect to be able to be a good example for manufacturing companies and leading sustainability. We'll look at, as we have all along, look at innovation opportunities where we can commercialize those as part of our offerings to customers as well."
289194,708649137,2259563,"3M Company, Q1 2021 Earnings Call, Apr 27, 2021",2021-04-27,"Earnings Calls","3M Company","Operator","And our next question comes from the line of Joe Ritchie with Goldman Sachs.",14,"And our next question comes from the line of Joe Ritchie with Goldman Sachs."
289194,708649137,2259563,"3M Company, Q1 2021 Earnings Call, Apr 27, 2021",2021-04-27,"Earnings Calls","3M Company","Analysts","So my first question, maybe just going back to 2Q for a moment, and I fully recognize that, that things are fluid right now. But can you talk a little bit about maybe it's the trends that you're seeing so far in Q2, you've got very easy comps this quarter",75,"So my first question, maybe just going back to 2Q for a moment, and I fully recognize that, that things are fluid right now. But can you talk a little bit about maybe it's the trends that you're seeing so far in Q2, you've got very easy comps this quarter. So is the expectation that you'll see at least an acceleration in growth versus what you saw in 1Q based on what you're seeing today?"
289194,708649137,2259563,"3M Company, Q1 2021 Earnings Call, Apr 27, 2021",2021-04-27,"Earnings Calls","3M Company","Executives","Yes, Joe. So no major surprises in Q2 so far. So we have started April pretty strong, similar to what we thought it would be. The team continues to execute well. We're working through some of the challenges we've talked about, whether it's on the cost of",94,"Yes, Joe. So no major surprises in Q2 so far. So we have started April pretty strong, similar to what we thought it would be. The team continues to execute well. We're working through some of the challenges we've talked about, whether it's on the cost of the product availability side. But as you currently pointed out, from a comp basis on a year-over-year basis, we will get into the first major quarter of the pandemic. And therefore, on a year-over-year basis, you should see a higher growth than what you saw in Q1."
