"companyid","keydevid","transcriptid","headline","mostimportantdateutc","keydeveventtypename","companyname","speakertypename","componenttextpreview","word_count","componenttext"
289194,693511107,2181489,"3M Company, Q4 2020 Earnings Call, Jan 26, 2021",2021-01-26,"Earnings Calls","3M Company","Operator","Ladies and gentlemen, thank you for standing by. Welcome to the 3M fourth quarter earnings conference call. [Operator Instructions] As a reminder, this conference is being recorded, Tuesday, January 26, 2021. I would now like to turn the call over to Br",50,"Ladies and gentlemen, thank you for standing by. Welcome to the 3M fourth quarter earnings conference call. [Operator Instructions] As a reminder, this conference is being recorded, Tuesday, January 26, 2021. 
I would now like to turn the call over to Bruce Jermeland, Vice President of Investor Relations at 3M."
289194,693511107,2181489,"3M Company, Q4 2020 Earnings Call, Jan 26, 2021",2021-01-26,"Earnings Calls","3M Company","Executives","Thank you, and good morning, everyone, and welcome to our fourth quarter earnings conference call. Let me begin today by expressing our sincere hope that you and your families continue to be safe and are doing well. With me today are Mike Roman, 3M's Chai",277,"Thank you, and good morning, everyone, and welcome to our fourth quarter earnings conference call. Let me begin today by expressing our sincere hope that you and your families continue to be safe and are doing well. With me today are Mike Roman, 3M's Chairman and Chief Executive Officer; and Monish Patolawala, our Chief Financial Officer. Mike and Monish will make some formal comments, and then we'll open it up for your questions. 
Please note that today's earnings release and slide presentation accompanying this call are posted on our Investor Relations website at 3m.com under the heading Quarterly Earnings. 
Please turn to Slide 2. Before we begin, I would like to introduce the dates for our 2021 quarterly earnings conference calls, which will be held on April 27, July 27, and October 26. 
Please take a moment to read the forward-looking statement on Slide 3. During today's conference call, we'll make certain predictive statements that reflect our current views about 3M's future performance and financial results. These statements are based on certain assumptions and expectations of future events that are subject to risks and uncertainties. Item 1A of our most recent Form 10-K lists some of the most important risk factors that could cause actual results to differ from our predictions. 
Finally, throughout today's presentation, we'll be making references to certain non-GAAP financial measures. Reconciliations of the non-GAAP measures can be found in the attachments to today's press release. Please note, we have provided segment and total company adjusted EBITDA reconciliations for reference in today's press release attachments as part of our non-GAAP measures. 
Please turn to Slide 4, and I'll hand it off to Mike. Mike?"
289194,693511107,2181489,"3M Company, Q4 2020 Earnings Call, Jan 26, 2021",2021-01-26,"Earnings Calls","3M Company","Executives","Thank you, Bruce. Good morning, everyone, and thank you for joining us. The 3M team finished the year strong as we continue to execute well, innovate for our customers and fight the pandemic from every angle. In an uncertain economic environment, we deliv",395,"Thank you, Bruce. Good morning, everyone, and thank you for joining us. The 3M team finished the year strong as we continue to execute well, innovate for our customers and fight the pandemic from every angle. In an uncertain economic environment, we delivered organic growth in all business groups and geographic areas, along with margin expansion, a double-digit increase in earnings and strong cash flow during the fourth quarter. 
Throughout 2020, I am proud of how 3M stepped up to help meet the extraordinary challenges facing the world, which includes our comprehensive response to COVID-19. Last year, we also took actions to transform for the future, advance our core values and strengthen our balance sheet through robust cash generation. At the same time, we know that more work remains to deliver for our customers, shareholders and all stakeholders. 
Moving forward, we will build on our progress and continue to prioritize investments in growth, productivity and sustainability. 3M is well positioned as we head into 2021. And today, we are providing guidance for the year, where we expect a return to healthy growth. Overall, I'm confident in our ability to deliver a successful 2021, lead through the economic recovery and capitalize on opportunities from emerging trends that are favorable to 3M and our market-leading businesses. 
Please turn to Slide 5. Company-wide, total sales in the fourth quarter increased to $8.6 billion, with organic growth of 6% and earnings of $2.38 per share, up 22% year-on-year on an adjusted basis. Demand remains strong in end markets such as personal safety, home cleaning and semiconductors, and we saw sequential improvement in general industrial and automotive OEM. We also saw ongoing weakness in other end markets, including health care and oral care elective procedures, which declined sequentially as they continued to be impacted by COVID-19. 
Geographically, organic growth was led by the Americas, up 8%, with the United States up 9%. EMEA grew 6% and Asia Pacific grew 2%, with China up 14%. Our team delivered another quarter of good operational performance. We expanded our adjusted EBITDA margins to over 27% with all business groups above 26% and increased our adjusted cash flow to $2.1 billion. 
That wraps up my opening comments. I will come back to discuss our full year performance along with my perspective on 2021 after Monish takes you through the details of the quarter. Monish?"
289194,693511107,2181489,"3M Company, Q4 2020 Earnings Call, Jan 26, 2021",2021-01-26,"Earnings Calls","3M Company","Executives","Thank you, Mike. And I wish you all a very good morning. Please turn to Slide 6. Company-wide, fourth quarter sales were $8.6 billion, up 5.8% year-on-year. This result was better than we had anticipated. Our personal safety team continued to execute well",1631,"Thank you, Mike. And I wish you all a very good morning. Please turn to Slide 6. Company-wide, fourth quarter sales were $8.6 billion, up 5.8% year-on-year. This result was better than we had anticipated. Our personal safety team continued to execute well in expanding respirator production to support pandemic-related demand. We also saw continued end-market strength through year-end in automotive OEM, electronics and home improvement. 
Strong operating rigor and disciplined cost management drove robust adjusted operating income of $1.8 billion, up 20%, with adjusted operating margins of 21.5%, up 250 basis points year-on-year. 
On the right-hand side of this slide, you can see the components that impacted margins. Organic volume growth, along with our ongoing cost management and productivity efforts, were the biggest contributor to our margin improvement, adding 160 basis points. Included in this 160 basis point benefit were 2 items that I had called out during a conference in early December. 
First, we exited a product line within our closure, masking and packaging business and sold the related property in Q4. This resulted in a pretax gain of $54 million or 60 basis points margin benefit. Please note that this gain is included in Safety and Industrial's Q4 operating income. 
And second, we had increased our respirator mask reserve by $107 million in Q4, which resulted in a 90 basis point headwind to margins year-on-year. For the full year, we increased our respirator mask reserve by roughly $130 million, which is a little higher than the $100 million average over the last few years. This increase in our reserve is reflected in corporate and unallocated. 
As you may have noticed, adjusting for last year's significant litigation charge, our fourth quarter corporate and unallocated expense was up approximately $100 million year-on-year. This increase was primarily driven by our update to our respirator mask reserve, along with impact from ongoing legal costs as we continue to manage PFAS and other legal proceedings. 
Turning to selling prices and raw materials, which was an 80 basis point year-on-year benefit to margins. This benefit was driven by the combination of higher selling prices and lower raw material cost versus last year's fourth quarter. Note, approximately half of our fourth quarter selling price performance was benefited by lower year-on-year volume-related customer rebates and markets that were most impacted by the pandemic. 
Acquisition and divestitures contributed 10 basis points year-on-year. Foreign currency net of hedging impacts decreased margins by 10 basis points. And lastly, while the fourth quarter pretax restructuring charge of $137 million was similar to last year's charge, restructuring provided a 10 basis point benefit to margins year-on-year due to this year's higher sales. 
Let's now turn to Slide 7 for a closer look at earnings per share. Fourth quarter earnings were $2.38 per share, up 22% from last year on an adjusted basis. First, as discussed on the prior slide, organic growth and ongoing cost management and productivity efforts delivered $0.43 per share to earnings growth. This included a $0.09 benefit from the gain on sale of property and a $0.10 headwind from the increased respirator mask reserve. 
Acquisitions and divestitures reduced earnings by $0.02, and foreign exchange impacts added $0.02 to per-share earnings year-on-year. The strength of the 3M business model, strong cash flow and liquidity position gave us the opportunity in Q4 to retire $1 billion of debt early that was due to mature in 2021. As a result, we incurred higher net interest in the quarter which, combined with higher shares outstanding, reduced earnings by $0.03. 
Finally, a lower tax rate versus last year provided a $0.03 benefit to earnings per share. The lower tax rate was primarily a function of the mix of pretax income around the world. 
Please turn to Slide 8 for a discussion of our cash flow and balance sheet. We delivered another quarter of robust free cash flow with fourth quarter adjusted free cash flow of $2.1 billion, up 16% year-over-year, with conversion of 151%. Cash flows in the quarter were primarily driven by robust income and daily management of working capital. 
For the full year, we generated adjusted free cash flow of $6.7 billion, up 18%. Fourth quarter capital expenditures were $422 million and were $1.5 billion for the year. During the quarter, we returned $848 million to our shareholders via dividends and $3.4 billion for the year. Share repurchases remain suspended throughout the quarter given the continued global economic uncertainty. 
Our strong fourth quarter cash flow generation and disciplined capital allocation enabled us to continue to strengthen our capital structure. We ended the quarter with $5.1 billion in cash and marketable securities on hand and reduced net debt by $1.3 billion or 9% sequentially. 
For the year, we improved our net debt position by $4.1 billion or 23%. As a result, we exited the year with net debt-to-EBITDA of 1.5, down from 2.3 at the end of 2019. This significant improvement in our net debt position, along with our strong cash flow generation capability, provides us increased financial flexibility to invest in our business, pursue strategic opportunities and return cash to shareholders while maintaining a strong capital structure. 
Please turn to Slide 9, where I will summarize the business group performance for Q4. I will start with our Safety and Industrial business, which posted organic growth of 11.4% year-on-year in the fourth quarter. This result includes an approximate 10 percentage point benefit from pandemic-related respirator mask demand. Overall, general industrial manufacturing activity continued to improve during Q4. However, customers and channel partners continue to remain cautious given ongoing macroeconomic uncertainty. 
Personal safety posted double-digit organic growth year-on-year driven by continued demand for respirators. Industrial adhesives and tapes grew mid-single digits, while the electrical markets business was up low single digits. 
The strong growth in the residential housing market continue to drive good performance in our roofing granules business, which was up double digits organically versus Q4 of last year. The rest of the Safety and Industrial portfolio, namely automotive aftermarket, abrasives and closure and masking, declined year-on-year. Safety and Industrial's fourth quarter segment operating margins were 27.7%, up 690 basis points, driven by strong leverage on sales growth and continued productivity and spending discipline, along with the previously mentioned gain on sale of real estate. 
Moving to Transportation and Electronics. After a challenging last 2 years, fourth quarter organic sales growth turned positive, up 1.4% as compared to last year. Our electronics-related business was up 2% with continued strong growth in semiconductor, factory automation and data centers, which was partially offset by year-on-year softness in consumer electronics. 
Our auto OEM business was up 18% year-on-year compared to the 3% increase in global car and light truck builds. For the full year, our automotive business outperformed global builds by approximately 700 basis points. 
Advanced materials and transportation safety returned to growth year-on-year driven by improving end market trends in automotive and highway infrastructure. Commercial solutions continued to be down year-on-year due to negative pandemic-related impacts on advertising spend and demand for workplace cleaning and safety products and solutions. Transportation and Electronics' fourth quarter operating margins were 21.8%, up 100 basis points on positive sales growth and continued cost discipline. 
Turning to Health Care. Some parts of the world were challenged with rising COVID-19 cases throughout Q4. As a result, those health care providers experienced sequential declines in the elective procedure volumes, which negatively impacted parts of our business. At the same time, we continue to experience strong pandemic-related demand for respirators to protect frontline health care workers, which more than offset the headwinds from the decline in elective procedure volumes. As a result, our Health Care business delivered fourth quarter organic sales growth of 6.6% versus last year. 
The Medical Solutions business grew low double digits driven by continued strong respiratory demand. Excluding respirators, organic growth in this business was flat. Our oral care business organic sales were flat year-over-year as it dealt with rising COVID cases. 
The separation and purification business increased low double digits year-on-year. This business continues to experience solid demand for biopharma filtration solutions in support of the pharmaceutical industry's research and manufacturing efforts to develop vaccines and therapeutic treatments for COVID. 
Turning to health information systems, which declined mid-single digits organically, as hospitals continue to remain cautious relative to the information technology investments. And finally, food safety was up low single digits organically versus last year. Health Care's fourth quarter operating margins were 24.7%, up 340 basis points year-on-year, with adjusted EBITDA margins of 31.7%. Fourth quarter margins were driven by continued strong execution and cost management, which was partially offset by the higher year-on-year restructuring costs. 
Lastly, fourth quarter organic growth for our Consumer business was up 10% as retailers saw continued strong customer demand throughout the holiday season. Growth in this business continues to be driven by strong consumer demand for our category-leading brands, namely Filtrete, Scotch, ScotchBlue, Scotch-Brite, Command and Meguiar's. We also continue to see very strong growth in e-commerce channels as the pandemic has accelerated years' worth of changes in consumer shopping behavior. 
Organic sales growth within Consumer continued to be led by home improvement and home care businesses, each up double digits organically. Stationery and office declined low single digits as many business offices and schools remain partially or fully closed due to the ongoing impact of the pandemic. Consumer's operating margins were 23.5%, about similar to last year. As we have previously mentioned, we have been stepping up investments in advertising and merchandising and new product innovation to address changing consumer demand trends. Lastly, similar to Health Care, operating margins were impacted by higher year-on-year restructuring costs. 
That wraps up the review of fourth quarter results. Please turn to Slide 10, and I will hand it back over to Mike. Mike?"
