"companyid","keydevid","transcriptid","headline","mostimportantdateutc","keydeveventtypename","companyname","speakertypename","componenttextpreview","word_count","componenttext"
31860,711307950,2268093,"AMETEK, Inc., Q1 2021 Earnings Call, May 04, 2021",2021-05-04,"Earnings Calls","AMETEK, Inc.","Analysts","Dave, just to stick with the deals. I guess here first, Abaco, I guess we're getting to the point now where bolt-ons are starting to look a little bit less bolt-on and pretty large. Can you talk about maybe the complexion of the pipeline or maybe your own",107,"Dave, just to stick with the deals. I guess here first, Abaco, I guess we're getting to the point now where bolt-ons are starting to look a little bit less bolt-on and pretty large. Can you talk about maybe the complexion of the pipeline or maybe your own appetite to kind of be in that range, maybe more consistently going forward? 
I think you've said yourself that needle-moving deals for AMETEK sort of have to get bigger over time. Is that something that as you look out over kind of the range of properties that you think is possible, achievable kind of consistent with the strategy here?"
31860,711307950,2268093,"AMETEK, Inc., Q1 2021 Earnings Call, May 04, 2021",2021-05-04,"Earnings Calls","AMETEK, Inc.","Executives","Yes, good question. A few years ago, we let our investors know that we are expanding our deal pipeline to include slightly bigger businesses. And we included businesses that will be in the $200 million to $400 million range, and we deploy $1 billion-plus",206,"Yes, good question. A few years ago, we let our investors know that we are expanding our deal pipeline to include slightly bigger businesses. And we included businesses that will be in the $200 million to $400 million range, and we deploy $1 billion-plus capital on it, and Abaco is in that range. And we talked about doing a deal like that every so often and that doesn't necessarily mean that's going to become our core, but those businesses are still working in our pipeline. But there's still many businesses that are, I'll call it, medium sized that are the $100 million deal. Similar to NSI-MI and Magnetrol, probably the most businesses of that size. And then we also have some smaller deals that are really important strategically to augment our internal growth. 
So you're going to see a mix of deals of those sizes. I mean AMETEK is not going to buy a company our size or buy a company half our size, we don't -- we just don't think that he can create value like that. But the size of the company now, I think those companies in the $200 million to $400 million revenue makes sense, and you'll see those from us occasionally."
31860,711307950,2268093,"AMETEK, Inc., Q1 2021 Earnings Call, May 04, 2021",2021-05-04,"Earnings Calls","AMETEK, Inc.","Analysts","Got it. That's helpful. And then just tipping over to the core business. It seems like order intake picked up pretty nicely here. You talked about record backlog. I guess the perception out there or maybe the history of AMETEK has been slightly longer cyc",114,"Got it. That's helpful. And then just tipping over to the core business. It seems like order intake picked up pretty nicely here. You talked about record backlog. I guess the perception out there or maybe the history of AMETEK has been slightly longer cycle than maybe some of these book-and-turn only businesses and orders that tend to develop along with a recovery, but not necessarily day 1. It seems like you've built up a little bit of momentum here. Can you maybe talk about where is that backlog growth is stemming from? Or what out there fundamentally in the marketplace has maybe picked up a little quicker than you otherwise would have expected?"
31860,711307950,2268093,"AMETEK, Inc., Q1 2021 Earnings Call, May 04, 2021",2021-05-04,"Earnings Calls","AMETEK, Inc.","Executives","Right I'll first unpack the orders a bit. We had a 9% organic orders growth and it was broad-based in the company. And EIG organic orders was 10%, EMG organic orders was 8%. So it was good to see broad-based orders. When you think about our portfolio, bot",249,"Right I'll first unpack the orders a bit. We had a 9% organic orders growth and it was broad-based in the company. And EIG organic orders was 10%, EMG organic orders was 8%. So it was good to see broad-based orders. When you think about our portfolio, both EIG and EMG, we raised from mid-single digits to high single digits. That's another indication of broad-based growth. I think that the overall company will grow sales sequentially each quarter. 
And when you look at our 4 market segments, Process improved high single digits, Power and Industrial improved to high single digits, Automation and Engineering improved high single digits, but the Aerospace and Defense segment, we continue to expect low to mid-single digits. So Defense -- with Defense doing better than Commercial. So when you think about the entire business, it really is doing well. And I'd carve out the 2 long-cycle businesses, oil and gas we think will trend up in the second half of this year and the commercial aerospace business, which will not trend up until 2023, maybe 2022, 2023. 
But the key point is we have properly sized that business for the current level of activity and any small improvements along the way are going to be very profitable for us. So we look at it as really attractive. We're going to have the long-cycle businesses kicking down the road, and we're already seeing the mid-cycle pick up. So we're feeling pretty optimistic about the recovery."
31860,711307950,2268093,"AMETEK, Inc., Q1 2021 Earnings Call, May 04, 2021",2021-05-04,"Earnings Calls","AMETEK, Inc.","Operator","Next question comes from the line of Allison Poliniak of Wells Fargo.",12,"Next question comes from the line of Allison Poliniak of Wells Fargo."
31860,711307950,2268093,"AMETEK, Inc., Q1 2021 Earnings Call, May 04, 2021",2021-05-04,"Earnings Calls","AMETEK, Inc.","Analysts","Just sort of in line with that sort of the mid- and long-cycle businesses. Could you maybe talk about the core operating leverage that you expect to see this year based on some of the orders that are coming in for you? Any color there?",45,"Just sort of in line with that sort of the mid- and long-cycle businesses. Could you maybe talk about the core operating leverage that you expect to see this year based on some of the orders that are coming in for you? Any color there?"
31860,711307950,2268093,"AMETEK, Inc., Q1 2021 Earnings Call, May 04, 2021",2021-05-04,"Earnings Calls","AMETEK, Inc.","Executives","Yes, that's a good question. I mean we had excellent margin performance in the first quarter. Strong margin improvements in both EIG and EMG, a strong execution solid price inflation, excellent productivity. We're going to see, for the year, core incremen",189,"Yes, that's a good question. I mean we had excellent margin performance in the first quarter. Strong margin improvements in both EIG and EMG, a strong execution solid price inflation, excellent productivity. We're going to see, for the year, core incrementals of 35%, and that includes bringing all the temporary costs back into the business. And core operating margins will increase about 40 basis points. 
So we'll grow margins. A key point, though, is the acquisitions are margin dilutive. So our reported margins will be down a bit, and that's kind of what we do. We acquire businesses that are lower margin than AMETEK, and over the course of a couple of years, 3 years, we bring them up to the AMETEK level. And It's pretty hard to acquire businesses that are at the profitability level of AMETEK. We're at the 29%, 30% EBITDA, so -- and we have some room with all these businesses to improve profitability. So that's the way I think about the -- the core operating leverage on the business will be positive. And then the reported margins, what the acquisitions will be margin dilutive."
31860,711307950,2268093,"AMETEK, Inc., Q1 2021 Earnings Call, May 04, 2021",2021-05-04,"Earnings Calls","AMETEK, Inc.","Analysts","Got it. And then working capital, obviously, an impressive number at 14.2% of sales. Would we expect that to maybe slip a little bit with the increase? Or is that sort of a sustainable level as you think about it?",40,"Got it. And then working capital, obviously, an impressive number at 14.2% of sales. Would we expect that to maybe slip a little bit with the increase? Or is that sort of a sustainable level as you think about it?"
31860,711307950,2268093,"AMETEK, Inc., Q1 2021 Earnings Call, May 04, 2021",2021-05-04,"Earnings Calls","AMETEK, Inc.","Executives","Allison, I would expect that -- we'd expect that to probably come back. We'd be adding some costs back to the balance sheet, particularly as the sales grow, you're going to see some more receivables come on the balance sheet. And we're going to be focused",147,"Allison, I would expect that -- we'd expect that to probably come back. We'd be adding some costs back to the balance sheet, particularly as the sales grow, you're going to see some more receivables come on the balance sheet. And we're going to be focused on making sure that we've got all the right inventory levels in the business to support the growth and make sure we're good to go and can support our customers as we move forward. 
So I think we did really well in the first quarter. I think the -- while we did put receivables and inventories back up on the balance sheet, our teams did a great job getting advanced payments from customers and the like. So that was a good result, but I'd expect to see that trend up a bit over the course of the balance of the year."
31860,711307950,2268093,"AMETEK, Inc., Q1 2021 Earnings Call, May 04, 2021",2021-05-04,"Earnings Calls","AMETEK, Inc.","Operator","Next question comes from the line of Nigel Coe from Wolfe Research.",12,"Next question comes from the line of Nigel Coe from Wolfe Research."
31860,711307950,2268093,"AMETEK, Inc., Q1 2021 Earnings Call, May 04, 2021",2021-05-04,"Earnings Calls","AMETEK, Inc.","Analysts","So I want to go back to deal flow because it's obviously -- by the way, congratulations on all the deals. You source and buy a lot of private companies, family health companies, and I've got to think there's going to be an increased interest in selling bu",89,"So I want to go back to deal flow because it's obviously -- by the way, congratulations on all the deals. You source and buy a lot of private companies, family health companies, and I've got to think there's going to be an increased interest in selling businesses ahead of any cap gains tax rate changes and [ inherent ] tax changes, are you seeing that yet? I mean are you seeing more interest in maybe pulling the trigger on some disposals, with these changes on the horizon?"
31860,711307950,2268093,"AMETEK, Inc., Q1 2021 Earnings Call, May 04, 2021",2021-05-04,"Earnings Calls","AMETEK, Inc.","Executives","Yes, a little bit of that, Nigel. But what I see is a lot of private owners and there were some private owners in this suite of businesses that we bought. They got through the pandemic and they're looking at a world that's changed, and they're looking at",124,"Yes, a little bit of that, Nigel. But what I see is a lot of private owners and there were some private owners in this suite of businesses that we bought. They got through the pandemic and they're looking at a world that's changed, and they're looking at someone larger to provide some stability and some capital and some access to things that they didn't have access to. 
So I think it's more the uncertainty in the macro environment, the uncertainty driven by the pandemic, has certainly made private company owners more likely to consider the exit that they were maybe going to do a couple of years from now. That's what I think is happening, and we're seeing a little bit of that."
31860,711307950,2268093,"AMETEK, Inc., Q1 2021 Earnings Call, May 04, 2021",2021-05-04,"Earnings Calls","AMETEK, Inc.","Analysts","Okay. That makes sense. And then EMG margins, moving notably higher. Pre-pandemic, we're sort of in the high teens, maybe 20% range, and now we're moving into the mid-20s. Do you think that, that level is sustainable? I understand [indiscernible] always c",57,"Okay. That makes sense. And then EMG margins, moving notably higher. Pre-pandemic, we're sort of in the high teens, maybe 20% range, and now we're moving into the mid-20s. Do you think that, that level is sustainable? I understand [indiscernible] always came out. But do you think mid-20s is sort of the range for EMG from here?"
31860,711307950,2268093,"AMETEK, Inc., Q1 2021 Earnings Call, May 04, 2021",2021-05-04,"Earnings Calls","AMETEK, Inc.","Executives","They were a record margin this quarter at 24.7% and up 190 basis points. And the margins have been growing nicely for a period of time. And when you look at that part of the business and you dissect what happened, the 2 very profitable parts of that busin",103,"They were a record margin this quarter at 24.7% and up 190 basis points. And the margins have been growing nicely for a period of time. And when you look at that part of the business and you dissect what happened, the 2 very profitable parts of that business, the automation, our automation business and our defense businesses, both are firing on all cylinders, and that drove the margins up. So it's really a mix among businesses within the EMG Group that is driving the margins. And as long as those businesses stay strong, I would expect the margins to be good."
31860,711307950,2268093,"AMETEK, Inc., Q1 2021 Earnings Call, May 04, 2021",2021-05-04,"Earnings Calls","AMETEK, Inc.","Operator","Next question comes from the line of Scott Graham from Rosenblatt Securities.",12,"Next question comes from the line of Scott Graham from Rosenblatt Securities."
31860,711307950,2268093,"AMETEK, Inc., Q1 2021 Earnings Call, May 04, 2021",2021-05-04,"Earnings Calls","AMETEK, Inc.","Analysts","So the -- what I think were about $50 million of temporary cost-outs last year. Bill, you touched on this a little bit within SG&A., how do you see those layering in this year?",34,"So the -- what I think were about $50 million of temporary cost-outs last year. Bill, you touched on this a little bit within SG&A., how do you see those layering in this year?"
31860,711307950,2268093,"AMETEK, Inc., Q1 2021 Earnings Call, May 04, 2021",2021-05-04,"Earnings Calls","AMETEK, Inc.","Executives","Yes. I think there was 90 actually, that was the temporary cost from last year, and we got the benefit of $50 million into 2021 for the structural restructuring, Scott. But...",31,"Yes. I think there was 90 actually, that was the temporary cost from last year, and we got the benefit of $50 million into 2021 for the structural restructuring, Scott. But..."
31860,711307950,2268093,"AMETEK, Inc., Q1 2021 Earnings Call, May 04, 2021",2021-05-04,"Earnings Calls","AMETEK, Inc.","Analysts","Okay. Sorry.",2,"Okay. Sorry."
31860,711307950,2268093,"AMETEK, Inc., Q1 2021 Earnings Call, May 04, 2021",2021-05-04,"Earnings Calls","AMETEK, Inc.","Executives","Yes. But what I say is in the second half of the year, you're going to see those temporary costs come back in. And a little bit came in, in the first quarter, a little more in the second quarter. But in the second half of the year, you're going to have --",69,"Yes. But what I say is in the second half of the year, you're going to see those temporary costs come back in. And a little bit came in, in the first quarter, a little more in the second quarter. But in the second half of the year, you're going to have -- they're all back in. So that's how we've modeled the year and we look at it."
31860,711307950,2268093,"AMETEK, Inc., Q1 2021 Earnings Call, May 04, 2021",2021-05-04,"Earnings Calls","AMETEK, Inc.","Analysts","And I read your press release, I listened to your prepared remarks and really many people on supply chain. And it's kind of like all the rage this quarter on conference calls and nothing from you guys. So could you maybe give us sort of your view of what",110,"And I read your press release, I listened to your prepared remarks and really many people on supply chain. And it's kind of like all the rage this quarter on conference calls and nothing from you guys. So could you maybe give us sort of your view of what you're seeing, both internally and externally, things that could maybe not happening in the first quarter but maybe could back up into you not -- again, not internally about something externally that could back up into you? And in fact, does that as a concern, plus the add-backs of the costs, is that what's keeping the second half guidance in check?"
31860,711307950,2268093,"AMETEK, Inc., Q1 2021 Earnings Call, May 04, 2021",2021-05-04,"Earnings Calls","AMETEK, Inc.","Executives","That's -- you're right on, Scott. I mean we -- the supply chain, there are certainly challenges in materials and logistics right now. Specifically, the semiconductor shortages have our attention and our supply chain team are working this issue aggressivel",150,"That's -- you're right on, Scott. I mean we -- the supply chain, there are certainly challenges in materials and logistics right now. Specifically, the semiconductor shortages have our attention and our supply chain team are working this issue aggressively. Our guidance reflects all known risks. This is a serious issue and one that will likely be with us for some period of time. 
And we're managing this with our dedicated business unit supply chain personnel with an overlay of our company-wide global sourcing. And they're an effective team, and we've done an effective job on it so far. But it is a serious issue. Our guidance reflects the known risk, and we're confident we can deliver. But it really -- we just felt it was too early in the year to improve the second half earnings and sales guidance because of that. We think it's a nice balance."
31860,711307950,2268093,"AMETEK, Inc., Q1 2021 Earnings Call, May 04, 2021",2021-05-04,"Earnings Calls","AMETEK, Inc.","Analysts","Makes sense. My last question is a question you've heard me ask before. I know you kind of went through the  4 big segments on their organic, could you also throw in your outlooks for those segments?",37,"Makes sense. My last question is a question you've heard me ask before. I know you kind of went through the  4 big segments on their organic, could you also throw in your outlooks for those segments?"
31860,711307950,2268093,"AMETEK, Inc., Q1 2021 Earnings Call, May 04, 2021",2021-05-04,"Earnings Calls","AMETEK, Inc.","Executives","Yes, sure. In process, we talked about it. It was up mid-single digits in the quarter, and returned to positive organic growth earlier than we expected. A little extra color there, alteration precision technologies in our Materials Analysis divisions real",452,"Yes, sure. In process, we talked about it. It was up mid-single digits in the quarter, and returned to positive organic growth earlier than we expected. A little extra color there, alteration precision technologies in our Materials Analysis divisions really had good quarters, and they're seeing improving demand across a broad set of end markets. They're in the research, semiconductor and industrial markets. 
We're also seeing very strong growth in orders across our process businesses, organic quarters were up low double digits, so a little bit higher than AMETEK's overall. And for the full year, we now expect those organic sales for our Process businesses to be up high single digits versus the prior year. It was mid-single digits in the original guide for the year, and we raised it to high single digits. So Process orders look good. Process is doing very well in Asia. And certain divisions are starting to fire on all cylinders. 
In our Aerospace and Defense business, our overall sales for A&D were down approximately 10% in the first quarter. modestly ahead of our expectation. And really, there's a bifurcation going on there. The defense businesses remain robust with sales up low double digits on a percentage basis. Commercial aerospace are still feeling the effects of the pandemics. The year-on-year rates have declined or continuing to improve, but in the first quarter, Commercial Aerospace sales were down approximately 25%. So for all of '21, we -- like I said before, we haven't -- we continue to expect low to mid-single-digit organic sales growth from our Aerospace and Defense business. We did not change the outlook on that segment as we did the other 3. 
Power & Industrial, overall sales were up slightly from the prior year's first quarter. Very strong orders up mid-teens on orders. We now expect organic sales for our Power and Industrial businesses to be up high single digits, and we changed that from up mid-single digits in the first outlook for the year. And finally, our Automation & Engineered Solutions, up modestly versus the prior year, where organic sales were up mid-single digits. 
Overall sales were impacted by the divestiture of Reading Alloys in the first quarter of last year. Sales across our Automation businesses, as we mentioned in the prepared remarks remain strong and we're seeing solid demand conditions across their international markets in Asia and China, in particular. And for all of 2021, we now expect automation and Engineered Solutions businesses organic sales growth to be up high single digits with stronger growth in our Automation businesses than our Engineered Solutions business. And that's -- you end up with both EIG and EMG being up high single-digits rate for mid-single digits."
31860,711307950,2268093,"AMETEK, Inc., Q1 2021 Earnings Call, May 04, 2021",2021-05-04,"Earnings Calls","AMETEK, Inc.","Operator","Next question comes from the line of Andrew Obin of Bank of America.",13,"Next question comes from the line of Andrew Obin of Bank of America."
31860,711307950,2268093,"AMETEK, Inc., Q1 2021 Earnings Call, May 04, 2021",2021-05-04,"Earnings Calls","AMETEK, Inc.","Analysts","This is David Ridley-Lane on for Andrew Obin. Qualitatively, do you think there was any pull forward or precautionary orders there in the first quarter? And were those a bit of a tailwind for the 9% organic orders growth you had in the quarter?",45,"This is David Ridley-Lane on for Andrew Obin. Qualitatively, do you think there was any pull forward or precautionary orders there in the first quarter? And were those a bit of a tailwind for the 9% organic orders growth you had in the quarter?"
31860,711307950,2268093,"AMETEK, Inc., Q1 2021 Earnings Call, May 04, 2021",2021-05-04,"Earnings Calls","AMETEK, Inc.","Executives","Yes, good question. We have highly engineered products, so I don't think people are stocking them. But certainly, in the current macro environment, people want to get their orders placed. Customers want to get their orders placed to make sure that they ca",67,"Yes, good question. We have highly engineered products, so I don't think people are stocking them. But certainly, in the current macro environment, people want to get their orders placed. Customers want to get their orders placed to make sure that they can get the products that they need. So we're seeing confident customers concerned about the global supply chain and placing their orders earlier than expected."
31860,711307950,2268093,"AMETEK, Inc., Q1 2021 Earnings Call, May 04, 2021",2021-05-04,"Earnings Calls","AMETEK, Inc.","Analysts","And then the other question I have is on the trends by geography. I mean we've heard Europe has been relatively slower. Interested in where you saw the largest inflection in your organic trends?",34,"And then the other question I have is on the trends by geography. I mean we've heard Europe has been relatively slower. Interested in where you saw the largest inflection in your organic trends?"
31860,711307950,2268093,"AMETEK, Inc., Q1 2021 Earnings Call, May 04, 2021",2021-05-04,"Earnings Calls","AMETEK, Inc.","Executives","All of the geographies showed improvements. The U.S. was down mid-single digits, improvements in most areas, but the decline was driven by Commercial Aerospace and Oil and Gas. Really was the same picture in Europe, where we were down mid-single digits wi",74,"All of the geographies showed improvements. The U.S. was down mid-single digits, improvements in most areas, but the decline was driven by Commercial Aerospace and Oil and Gas. Really was the same picture in Europe, where we were down mid-single digits with good improvement, but weaknesses in Commercial, Aero and Oil and Gas. And Asia was the star for us, a broad-based strength up mid-20s led by our Automation business and our Process business."
31860,711307950,2268093,"AMETEK, Inc., Q1 2021 Earnings Call, May 04, 2021",2021-05-04,"Earnings Calls","AMETEK, Inc.","Operator","Next question comes from the line of Rob Wertheimer of Melius Research.",12,"Next question comes from the line of Rob Wertheimer of Melius Research."
