"companyid","keydevid","transcriptid","headline","mostimportantdateutc","keydeveventtypename","companyname","speakertypename","componenttextpreview","word_count","componenttext"
31860,1685251794,2421359,"AMETEK, Inc., Q3 2021 Earnings Call, Nov 02, 2021",2021-11-02,"Earnings Calls","AMETEK, Inc.","Executives","Thank you, Angie. Good morning, and thank you for joining us for AMETEK's Third Quarter 2021 Earnings Conference Call. With me today are Dave Zapico, Chairman and Chief Executive Officer; and Bill Burke, Executive Vice President and Chief Financial Office",205,"Thank you, Angie. Good morning, and thank you for joining us for AMETEK's Third Quarter 2021 Earnings Conference Call. With me today are Dave Zapico, Chairman and Chief Executive Officer; and Bill Burke, Executive Vice President and Chief Financial Officer. 
During the course of today's call, we will make forward-looking statements, which are subject to change based on various risk factors and uncertainties that may cause actual results to differ significantly from expectations. A detailed discussion of the risks and uncertainties that may affect our future results is contained in AMETEK's filings with the SEC. AMETEK disclaims any intention or obligation to update or revise any forward-looking statements. 
Any references made on this call to 2020 or 2021 results will be on an adjusted basis after-tax, acquisition-related intangible amortization and also excluding the gain from the sale of Reading Alloys in the first quarter of 2020 and the realignment charges taken in the first quarter of 2020. Reconciliations between GAAP and adjusted measures can be found in our press release and on the Investors section of our website. We'll begin today's call with prepared remarks by Dave and Bill, and then we'll open it up for questions. I'll now turn the meeting over to Dave."
31860,1685251794,2421359,"AMETEK, Inc., Q3 2021 Earnings Call, Nov 02, 2021",2021-11-02,"Earnings Calls","AMETEK, Inc.","Executives","Thank you, Kevin, and good morning, everyone. AMETEK had another outstanding quarter with better-than-expected sales growth, strong operating performance and earnings above our expectations. We established records before sales, EBITDA, operating income an",1398,"Thank you, Kevin, and good morning, everyone. AMETEK had another outstanding quarter with better-than-expected sales growth, strong operating performance and earnings above our expectations. We established records before sales, EBITDA, operating income and earnings per share in the quarter. Demand remains strong across our diverse set of end markets, leading to robust order growth and a record backlog. While the global supply chain and logistics networks remain challenging, our businesses are doing a tremendous job navigating these issues and delivering results, which exceeded our expectations. 
Given our results in the third quarter and outlook for the fourth quarter, we are again increasing our sales and earnings guidance for the full year. This strong overall performance reflects the exceptional work of all AMETEK colleagues as well as the strength, flexibility and sustainability of the AMETEK growth model. 
AMETEK's proven business model was central to our focus on creating a sustainable future for all stakeholders. We are very proud of the important steps we are taking to further sustainability across AMETEK. And last week, we published our latest corporate sustainability report to highlight our efforts in this area. This report provides information on our sustainability initiatives, the strong progress we have made and the commitments we are making to create a better future. I welcome you all to read our latest corporate sustainability report, which is located on our website. 
Now let me turn to our third quarter results. Third quarter sales were a record $1.44 billion, up 28% over the same period in 2020 and above our expectations. Organic sales growth was 17%. Acquisitions added 11 points and foreign currency was a modest benefit in the quarter. Overall, orders in the third quarter were $1.55 billion, an increase of 37% over the prior year period, while organic orders were up an impressive 31% in the quarter. 
We ended the quarter with a record backlog of $2.62 billion, which is up over $800 million from the start of the year. Third quarter operating income was a record $338 million, a 25% increase over the third quarter of 2020 and operating margins were 23.4%. Excluding the dilutive impact of acquisitions, core operating margins were 24.7%, up 70 basis points versus the third quarter of 2020. EBITDA in the third quarter was a record $415 million, up 25% over the prior year with EBITDA margins of 28.8%. This outstanding performance led to record earnings of $1.26 per diluted share, up 25% over the third quarter of 2020 and above our guidance range of $1.16 to $1.18. We continue to generate strong levels of cash flow with third quarter operating cash flow of $307 million and free cash flow conversion of 109% of net income. Overall, tremendous results in a challenging operating environment. 
Next, let me provide some additional details at the operating group level. First, the Electronic Instruments Group. Sales for EIG were a record $982 million, up 31% over last year's third quarter. Organic sales were up 15%, acquisitions added 16% and foreign currency was a modest headwind. While growth remains broad-based, growth was particularly strong across our Ultra Precision Technologies and our Power & Industrial businesses. EIG's third quarter operating income was a record $245 million, up 20% versus the same quarter last year and operating margins were 25%. Excluding acquisitions, EIG's core margins were excellent at 27.2%, in line with prior year margins. 
The Electromechanical Group also delivered outstanding sales growth and excellent operating performance. Third quarter sales increased 21% versus the prior year to $459 million. Organic sales were up 20% and currency added 1 point to growth. Growth remains strong across all of EMG with our automation businesses again delivering notably strong growth in the quarter. EMG's operating income in the quarter was a record $115 million, up a robust 36% compared to the prior year period. EMG's operating margins expanded an exceptional 270 basis points to a record 25%. 
Now switching to our acquisition strategy. AMETEK has had an excellent year with a record level of capital deployment, leading to the acquisition of 5 highly strategic businesses. AMETEK has deployed approximately $1.85 billion on acquisitions thus far this year, reflecting the strength of AMETEK's acquisition strategy and our ability to identify and acquire highly strategic companies. 
Our proven operating capabilities allow us to drive meaningful improvements across our acquired companies, resulting in outstanding returns on capital. Generating strong returns on capital deployed is critical to long-term sustainable growth, an important element of AMETEK's strategy. AMETEK's strong cash flow generation continues to support our capital deployment strategy. 
Our acquisition pipeline remains very active. Our M&A teams continue to work diligently, identifying attractive acquisition opportunities, and we expect to remain busy over the coming quarters. We also remain focused on investing back into our businesses to support the organic growth initiatives, including in support of their new product development efforts. In the third quarter, we invested over $75 million in RD&E, and for all of 2021, we now expect to invest approximately $300 million or approximately 5.5% of sales. 
Through these investments, our businesses developed unique and highly differentiated solutions to help solve their customers' most complex challenges. One such example is a new product introduction from AMETEK Gatan. Gatan is a leading provider of direct detection technology for electron microscopy, supporting high-end research and materials and life sciences applications. Gatan recently introduced the Stela Hybrid-Pixel Camera, the only fully integrated hybrid-pixel electron detector with the Gatan microscopy suite. 
This new product reinforces Gatan's leadership position providing the highest quality TEM defraction camera, allowing the user to perform 4D STEM analysis with rapid speed and high dynamic range. Gatan's new camera builds on a long history of disruptive and award-winning technology. In August, the Stela Camera was awarded the 2021 Microscopy Today Innovation Award and called one of the 10 game-changing products and methods. I would like to congratulate the team at Gatan for the recent launch of the Stela camera and for the support of important research applications. 
Now let me touch on the supply chain issues. The global supply chain remains challenging. We see extended lead times for a broad range of materials and components with logistics issues and labor availability adding to the complexity. While these difficulties exist, we exceeded our sales estimates for the quarter and are navigating the challenging environment well, given our agile operating approach. These supply chain issues are leading to higher inflation. However, given our differentiation, we were able to more than offset this inflation with higher pricing leading to a strong price inflation spread. While we expect these challenges will continue into 2022, we remain well-positioned to navigate the issues given the strength and flexibility of the AMETEK growth model. 
Moving to our updated outlook for the remainder of 2021. Given our strong performance in the third quarter and the continued strong orders momentum and record backlog, we have again raised our 2021 sales and earnings guidance. For the full year, we now expect overall sales to be up in the low 20% range versus our previous guide of up approximately 20%. Organic sales are now expected to be up low double digits on a percentage basis over 2020 as compared to our previous count of approximately 10%. Diluted earnings per share for 2021 are now expected to be in the range of $4.76 to $4.78, an increase of approximately 21% over 2020's comparable basis and above our prior guide of $4.62 to $4.68 per diluted share. For the fourth quarter, we anticipate that overall sales will be up in the low 20% range versus last year's fourth quarter. Fourth quarter earnings per diluted share are expected to be between $1.28 to $1.30, up 19% to 20% over last year's fourth quarter. 
In summary, AMETEK's third quarter results were excellent. Our teams continued to execute and our businesses are performing well. Our performance through a challenging environment shows the resilience and strength of the AMETEK growth model. The asset-light nature of our businesses, our leading positions in attractive niche markets and our world-class workforce will continue to drive long-term sustainable success. The proven nature of the AMETEK growth model continue to drive long-term success for all of AMETEK take orders. I will now turn it over to Bill Burke, who will cover some of the financial details of the quarter. Then we'll be glad to take your questions. Bill?"
31860,1685251794,2421359,"AMETEK, Inc., Q3 2021 Earnings Call, Nov 02, 2021",2021-11-02,"Earnings Calls","AMETEK, Inc.","Executives","Thank you, Dave. As Dave highlighted, AMETEK delivered excellent results in the third quarter with continued strong sales growth and orders growth and outstanding operating performance. Let me provide some additional financial highlights for the quarter.",470,"Thank you, Dave. As Dave highlighted, AMETEK delivered excellent results in the third quarter with continued strong sales growth and orders growth and outstanding operating performance. Let me provide some additional financial highlights for the quarter. Third quarter general and administrative expenses were $22.1 million, up $4.8 million from the prior year, largely due to higher compensation expense. As a percentage of total sales, G&A was 1.5% for the quarter, unchanged from the prior year. For 2021, general and administrative expenses are expected to be up approximately $18 million, driven by higher compensation costs or approximately 1.5% of sales, also unchanged from the prior year. 
Third quarter other income and expense was better by approximately $4 million versus last year's third quarter, driven by a $6 million or approximately $0.02 per share gain on the sale of a small product line in the quarter. This gain on the sale was more than offset by a higher effective tax rate in the quarter of 19.5%, up from 17.5% in the same quarter last year. For 2021, we now expect our effective tax rate to be between 19.5% and 20%. Actual quarterly tax rates can differ dramatically, either positively or negatively, from this full year estimated rate. 
Working capital in the quarter was 14.9% of sales, down 210 basis points from the 17% reported in the third quarter of 2020, reflecting the excellent work of our businesses in managing working capital. Capital expenditures in the third quarter were $26 million, and we continue to expect capital expenditures to be approximately $120 million for the full year. Depreciation and amortization expense in the third quarter was $75 million. For all of 2021, we expect depreciation and amortization to be approximately $295 million, including after-tax, acquisition-related intangible amortization of approximately $138 million or $0.60 per diluted share. We continue to generate strong levels of cash given our asset-light business model and working capital management efforts. In the third quarter, operating cash flow was $307 million and free cash flow was $281 million, with free cash flow conversion 109% of net income. 
Total debt at quarter end was $2.65 billion up less than $250 million from the end of 2020, despite having deployed approximately $1.85 billion on acquisitions thus far in 2021. Offsetting this debt was cash and cash equivalents of $359 million. And at quarter end, our gross debt-to-EBITDA ratio was 1.6x and our net debt-to-EBITDA ratio was 1.4x. We continue to have excellent financial capacity and flexibility with approximately $2.25 billion of cash in existing credit facilities to support our growth initiatives. 
To summarize, our businesses drove outstanding results in the third quarter and throughout the first 9 months of 2021. Our balance sheet and tremendous cash flow generation have positioned the company for significant growth in the coming quarters and years. Kevin?"
31860,1685251794,2421359,"AMETEK, Inc., Q3 2021 Earnings Call, Nov 02, 2021",2021-11-02,"Earnings Calls","AMETEK, Inc.","Executives","Thank you, Bill. Angie, we're now ready to open up for questions.",12,"Thank you, Bill. Angie, we're now ready to open up for questions."
31860,1685251794,2421359,"AMETEK, Inc., Q3 2021 Earnings Call, Nov 02, 2021",2021-11-02,"Earnings Calls","AMETEK, Inc.","Operator","[Operator Instructions] Your first question comes from the line of Matt Summerville with D.A. Davidson.",15,"[Operator Instructions] Your first question comes from the line of Matt Summerville with D.A. Davidson."
31860,1685251794,2421359,"AMETEK, Inc., Q3 2021 Earnings Call, Nov 02, 2021",2021-11-02,"Earnings Calls","AMETEK, Inc.","Analysts","A couple of questions. First, Dave, can you talk about where you were with realized pricing in the third quarter on a year-over-year basis? What the spread looked like? You mentioned it seems pretty favorable, and then what your thoughts are in terms of h",54,"A couple of questions. First, Dave, can you talk about where you were with realized pricing in the third quarter on a year-over-year basis? What the spread looked like? You mentioned it seems pretty favorable, and then what your thoughts are in terms of how much price you might need to take in '22."
31860,1685251794,2421359,"AMETEK, Inc., Q3 2021 Earnings Call, Nov 02, 2021",2021-11-02,"Earnings Calls","AMETEK, Inc.","Executives","Sure, Matt. In the third quarter, our pricing continued to more than offset inflation. As I said in the prepared remarks, pricing was about 3.5% of sales and inflation was about 2.5% of sales. So we've got a spread of about 100 basis points. And we expect",133,"Sure, Matt. In the third quarter, our pricing continued to more than offset inflation. As I said in the prepared remarks, pricing was about 3.5% of sales and inflation was about 2.5% of sales. So we've got a spread of about 100 basis points. And we expect in Q4 that will be similar to Q3 with slightly higher pricing and inflation, and the results speak to the highly differentiated nature of AMETEK's product portfolio and our leadership position in niche markets around the world. In terms of next year, we haven't done the detailed planning, but a key for me is that we're going to stay up ahead of inflation, and I expect that to be true next year. So we'll stay ahead of inflation with price. Does that answer your question, Matt?"
31860,1685251794,2421359,"AMETEK, Inc., Q3 2021 Earnings Call, Nov 02, 2021",2021-11-02,"Earnings Calls","AMETEK, Inc.","Analysts","Yes. And then just as a follow-up, if I just look over the last 2 years, EMG margins have really migrated into a completely different ZIP code versus where they were at. I know divesting with Reading is a component to that. You did some structural cost-ou",75,"Yes. And then just as a follow-up, if I just look over the last 2 years, EMG margins have really migrated into a completely different ZIP code versus where they were at. I know divesting with Reading is a component to that. You did some structural cost-outs during the COVID outbreak. Is there still leverage to drive margins higher in that business? How do we think about how we should think about that going forward?"
31860,1685251794,2421359,"AMETEK, Inc., Q3 2021 Earnings Call, Nov 02, 2021",2021-11-02,"Earnings Calls","AMETEK, Inc.","Executives","Yes. EMG has done a fantastic job in margin development, and you mentioned some of the key drivers. We divested Reading. But more fundamentally, I mean, we have an automation business that's firing on all cylinders, that's very profitable. We have a therm",93,"Yes. EMG has done a fantastic job in margin development, and you mentioned some of the key drivers. We divested Reading. But more fundamentally, I mean, we have an automation business that's firing on all cylinders, that's very profitable. We have a thermal management system as part of our defense industry, defense businesses. It's doing well and it's high margin. And then we have some part of our EMEA business that's accelerating. So it isn't a new ZIP code, but I expect it to stay there and there's still room for margin expansion."
31860,1685251794,2421359,"AMETEK, Inc., Q3 2021 Earnings Call, Nov 02, 2021",2021-11-02,"Earnings Calls","AMETEK, Inc.","Operator","Your next question comes from the line of Joshua Pokrzywinski with Morgan Stanley.",13,"Your next question comes from the line of Joshua Pokrzywinski with Morgan Stanley."
31860,1685251794,2421359,"AMETEK, Inc., Q3 2021 Earnings Call, Nov 02, 2021",2021-11-02,"Earnings Calls","AMETEK, Inc.","Analysts","This is actually Gustavo on for Josh. So looking at backlog, where it stands today, how much of that would you call, call it, excess backlog kind of based on supply chain issues? And how much should we expect that contribute to 2022 growth here?",45,"This is actually Gustavo on for Josh. So looking at backlog, where it stands today, how much of that would you call, call it, excess backlog kind of based on supply chain issues? And how much should we expect that contribute to 2022 growth here?"
31860,1685251794,2421359,"AMETEK, Inc., Q3 2021 Earnings Call, Nov 02, 2021",2021-11-02,"Earnings Calls","AMETEK, Inc.","Executives","Yes. We have a record backlog of $2.62 billion and I wouldn't categorize as excess. I mean I mentioned in our earlier call that customer behavior is to give you more visibility into future months and quarters because there's so many issues in the supply c",102,"Yes. We have a record backlog of $2.62 billion and I wouldn't categorize as excess. I mean I mentioned in our earlier call that customer behavior is to give you more visibility into future months and quarters because there's so many issues in the supply chain. So you have more visibility, but I would not consider it as excess. And I would not view us as not keeping up with demand. So really, you have a situation where there's strong underlying demand. It's resulting in a higher backlog. It's giving us further insight into 2022, and we feel real good about it."
31860,1685251794,2421359,"AMETEK, Inc., Q3 2021 Earnings Call, Nov 02, 2021",2021-11-02,"Earnings Calls","AMETEK, Inc.","Analysts","Got it. And then just a quick follow-up. So what are kind of the biggest inflation and supply chain issues that we should kind of watch for AMETEK as conditions potentially do start to improve? Is it on the material side, freight or labor? Just kind of wh",54,"Got it. And then just a quick follow-up. So what are kind of the biggest inflation and supply chain issues that we should kind of watch for AMETEK as conditions potentially do start to improve? Is it on the material side, freight or labor? Just kind of what should we keep our eyes on?"
31860,1685251794,2421359,"AMETEK, Inc., Q3 2021 Earnings Call, Nov 02, 2021",2021-11-02,"Earnings Calls","AMETEK, Inc.","Executives","Yes, that's a good question. And during the quarter, we continued to experience challenges with our supply chain, logistics, inflation, labor availability and it was one of the more dynamic environments I can recall. And these conditions were a bit worse",309,"Yes, that's a good question. And during the quarter, we continued to experience challenges with our supply chain, logistics, inflation, labor availability and it was one of the more dynamic environments I can recall. And these conditions were a bit worse in Q3 than Q2, and we expect those conditions to persist in the fourth quarter. And I would characterize our overall effort in response to these challenges as outstanding. We're clearly showing the agility necessary to navigate these supply chain disruptions. A key, from my view, is the distributed nature of our business model, where we have committed P&L managers running their businesses with their own supply chain teams, which allow them to react quickly to changing conditions. And at the same time, these dedicated business unit teams are working seamlessly with our overall corporate supply chain team that acts with a combined leverage in the authority of all of the AMETEK. 
And this overall approach has been effective for us. I mean you asked where we had some -- the biggest issues we had, as I mentioned last quarter, it's in semiconductor, chip available. It's an area that's particularly challenging because we use a lot of electronics in our businesses, obviously. And we're using our purchasing leverage, the relationships that we built up over decades, our engineering capability in terms of qualifying second sources, in terms of changing designs to solve problems. And we don't expect to anticipate improvements in the availability of semiconductors until sometime in late 2022. So it's a tough environment and -- but we're reacting well to it, and I was very pleased with our teams. And I point to one thing, it's a distributed business model, where we have very experienced P&L leaders, making sure that they're going to satisfy their customers and not letting the supply chain get in the way."
31860,1685251794,2421359,"AMETEK, Inc., Q3 2021 Earnings Call, Nov 02, 2021",2021-11-02,"Earnings Calls","AMETEK, Inc.","Operator","Your next question comes from the line of Allison Poliniak with Wells Fargo.",13,"Your next question comes from the line of Allison Poliniak with Wells Fargo."
31860,1685251794,2421359,"AMETEK, Inc., Q3 2021 Earnings Call, Nov 02, 2021",2021-11-02,"Earnings Calls","AMETEK, Inc.","Analysts","I just want to keep in line with this -- because, obviously, you guys are a bit unique in that you've certainly been managing this quite well. Is there a sense -- I mean, organic growth is very strong in our organic quarters are very strong. Is there any",90,"I just want to keep in line with this -- because, obviously, you guys are a bit unique in that you've certainly been managing this quite well. Is there a sense -- I mean, organic growth is very strong in our organic quarters are very strong. Is there any tempering of maybe what growth could have been because of some of these supply chain issues or really not impactful to you guys in terms of what that expected growth could be or the volume that you were anticipating this quarter?"
