"companyid","keydevid","transcriptid","headline","mostimportantdateutc","keydeveventtypename","companyname","speakertypename","componenttextpreview","word_count","componenttext"
31860,1673913496,2360379,"AMETEK, Inc., Q2 2021 Earnings Call, Aug 03, 2021",2021-08-03,"Earnings Calls","AMETEK, Inc.","Executives","Ken, but I want to be clear, the -- what I was talking about was the semiconductor chips that are supplied to AMETEK when I was talking about the supply chain tightness. But the semiconductor market is an important market for AMETEK. So we do participate",136,"Ken, but I want to be clear, the -- what I was talking about was the semiconductor chips that are supplied to AMETEK when I was talking about the supply chain tightness. But the semiconductor market is an important market for AMETEK. So we do participate in it from the viewpoint of sales. And it's about 6% of our business, so a little under $300 million. And we're in -- we're seeing some solid growth there because we participate both in the research market and the ramp in chip production. 
And application areas where we're seeing particular strength would be the EUV optics market. The semiconductor research market, our businesses of named CAMECA and Zygo are doing quite well there. And we expect our semiconductor sales to be up in the mid-teen 20% level this year."
31860,1673913496,2360379,"AMETEK, Inc., Q2 2021 Earnings Call, Aug 03, 2021",2021-08-03,"Earnings Calls","AMETEK, Inc.","Analysts","Understood. And then just touching back on the incremental R&D investments for new product development for the year. Can you give us some color on where your vitality index has trended through the quarter? And I'm just curious if you have any thoughts on",63,"Understood. And then just touching back on the incremental R&D investments for new product development for the year. Can you give us some color on where your vitality index has trended through the quarter? And I'm just curious if you have any thoughts on how you're seeing that -- how you see that vitality index change as these new investments start to monetize?"
31860,1673913496,2360379,"AMETEK, Inc., Q2 2021 Earnings Call, Aug 03, 2021",2021-08-03,"Earnings Calls","AMETEK, Inc.","Executives","Yes. Our vitality index in the quarter was a little better than 23%. So it was a good number. And we have to get our system put in place with some of these acquisitions that we've done. So there's tracking in the systems that we put in place aren't in all",162,"Yes. Our vitality index in the quarter was a little better than 23%. So it was a good number. And we have to get our system put in place with some of these acquisitions that we've done. So there's tracking in the systems that we put in place aren't in all the acquisitions yet. So we can't look at those businesses the same way we look at our current businesses. 
But in general, we have a strong vitality. We have a number of in the low 20s, we're happy. And we think there's good opportunities for our businesses, and we're funding them. And it's a big area for us is important for us is to get our product development teams working together, introducing new products because that's fundamental for both the AMETEK pricing story to be able to stay in front of inflation and also growing organic growth in the niche markets that we're leaders in. So it's really important to us."
31860,1673913496,2360379,"AMETEK, Inc., Q2 2021 Earnings Call, Aug 03, 2021",2021-08-03,"Earnings Calls","AMETEK, Inc.","Operator","And I'm showing no further questions at this time. And I would like to turn the conference back over to Kevin Coleman for any further remarks.",27,"And I'm showing no further questions at this time. And I would like to turn the conference back over to Kevin Coleman for any further remarks."
31860,1673913496,2360379,"AMETEK, Inc., Q2 2021 Earnings Call, Aug 03, 2021",2021-08-03,"Earnings Calls","AMETEK, Inc.","Executives","Thank you, Michelle, and thank you, everyone, for joining our call today. Have a wonderful day.",16,"Thank you, Michelle, and thank you, everyone, for joining our call today. Have a wonderful day."
31860,1673913496,2360379,"AMETEK, Inc., Q2 2021 Earnings Call, Aug 03, 2021",2021-08-03,"Earnings Calls","AMETEK, Inc.","Operator","This concludes today's conference call. Thank you for participating. You may now disconnect.",14,"This concludes today's conference call. Thank you for participating. You may now disconnect."
31860,1673913496,2360431,"AMETEK, Inc., Q2 2021 Earnings Call, Aug 03, 2021",2021-08-03,"Earnings Calls","AMETEK, Inc.","Operator","Good day, and thank you for standing by. Welcome to the Second Quarter 2021 AMETEK, Inc. Earnings Conference Call. [Operator Instructions] Please be advised that today's conference is being recorded. [Operator Instructions] I would like to hand the confer",54,"Good day, and thank you for standing by. Welcome to the Second Quarter 2021 AMETEK, Inc. Earnings Conference Call. [Operator Instructions] Please be advised that today's conference is being recorded. [Operator Instructions] I would like to hand the conference over to your speaker today, Kevin Coleman, Vice President of Investor Relations. Please go ahead."
31860,1673913496,2360431,"AMETEK, Inc., Q2 2021 Earnings Call, Aug 03, 2021",2021-08-03,"Earnings Calls","AMETEK, Inc.","Executives","Thank you, Michelle. Good morning, and thank you for joining us for AMETEK's Second Quarter 2021 Earnings Conference Call. With me today are Dave Zapico, Chairman and Chief Executive Officer; and Bill Burke, Executive Vice President and Chief Financial Of",206,"Thank you, Michelle. Good morning, and thank you for joining us for AMETEK's Second Quarter 2021 Earnings Conference Call. With me today are Dave Zapico, Chairman and Chief Executive Officer; and Bill Burke, Executive Vice President and Chief Financial Officer. 
During the course of today's call, we will make forward-looking statements, which are subject to change based on various risk factors and uncertainties that may cause actual results to differ significantly from expectations. A detailed discussion of the risks and uncertainties that may affect our future results is contained in AMETEK's filings with the SEC. AMETEK disclaims any intention or obligation to update or revise any forward-looking statements. 
Any references made on this call to 2020 or 2021 results will be on an adjusted basis excluding after tax, acquisition-related intangible amortization and also excluding the gain from the sale of Reading Alloys in the first quarter of 2020 and the realignment charge taken in the first quarter of 2020. Reconciliations between GAAP and adjusted measures can be found in our press release and on the Investors section of our website. 
We'll begin today's call with prepared remarks by Dave and Bill and then open it up for questions. I'll now turn the meeting over to Dave."
31860,1673913496,2360431,"AMETEK, Inc., Q2 2021 Earnings Call, Aug 03, 2021",2021-08-03,"Earnings Calls","AMETEK, Inc.","Executives","Thank you, Kevin, and good morning, everyone. AMETEK delivered outstanding results in the second quarter. Strong sales growth and outstanding operating performance led to a high quality of earnings that exceeded our expectations. We established record lev",1191,"Thank you, Kevin, and good morning, everyone. AMETEK delivered outstanding results in the second quarter. Strong sales growth and outstanding operating performance led to a high quality of earnings that exceeded our expectations. We established record levels of sales, orders, operating income and adjusted earnings per share in the quarter. This performance comes as we are still early in our economic recovery and reflects the outstanding efforts of our teams. 
We also ended the quarter with a record backlog driven by exceptionally strong and broad-based orders growth, providing strong visibility across our mid- and long-cycle business profile. The 5 acquisitions we completed earlier this year are integrating nicely and are well positioned to drive strong growth. Given our second quarter results and our outlook for the back half of 2021, we have increased our sales and earnings guidance for the year. 
Now let me turn to our second quarter results. Our businesses saw robust broad-based sales growth in the quarter. Overall sales were a record $1.39 billion, up 37% over the same period in 2020. Organic sales growth was 25%. Acquisitions added 10 points to growth, while foreign currency added 2 points. 
Overall orders in the quarter were a record $1.91 billion, a sharp increase of 92% over the prior year, while organic orders were an impressive 44% up in the quarter. We ended the quarter with a record backlog of $2.5 billion, which is up over $700 million from the start of the year. 
Our businesses also delivered exceptional operating performance in the quarter. While global supply chains remain tight, our businesses are doing a fantastic job managing through these challenges as is reflected in our results. 
Second quarter operating income was a record $317 million, a nearly 40% increase over the second quarter of 2020. And operating margins expanded 40 basis points to 22.8%. Excluding the dilutive impact of acquisitions, core margins -- core operating margins expanded an exceptional 160 basis points to 24%. 
EBITDA in the quarter was $387 million, up 34% over the prior year's second quarter with EBITDA margins of 27.9%. This operating performance led to earnings of $1.15 per diluted share, up 37% over the second quarter of 2020 and above our guidance range of $1.08 to $1.10. 
Our businesses also generated strong cash flows in the quarter, which position us well to continue investing in our businesses and on strategic acquisitions. In the second quarter, operating cash flow was $287 million, and free cash flow conversion was 114% in net income. 
Let me provide some additional details at the operating group level. Both our Electronic Instruments Group and Electromechanical Group delivered strong organic sales growth with excellent core margin expansion in the quarter. Sales for EIG were a record $934 million, up 44% over last year's second quarter. 
Organic sales were up 27%. Recent acquisitions added 16%, and foreign currency added nearly 2 points. EIG's second quarter operating income was $227 million, up 42% versus the same quarter last year, and operating margins were 24.3%. Excluding acquisitions, EIG's core margins were 26.3%, expanding an impressive 170 basis points over the comparable period. The Electromechanical Group also delivered strong sales growth and outstanding operating performance. EMG's second quarter sales increased 24% versus the prior year to $452 million. Organic sales growth was 21%, and currency added 3 points to the quarter. 
Growth was broad-based across our EMG businesses with particularly strong growth in our Advanced Motion Solutions business. EMG's operating income in the second quarter was a record $112 million, up 33% compared to the prior year period. And EMG's operating margins expanded an exceptional 170 basis points to a record 24.9%. 
Now switching to our acquisition strategy. As we noted during our previous call, we completed the acquisitions of Abaco and NSI-MI at the beginning of the second quarter. These acquisitions as well as the first quarter acquisitions of Magnetrol, Crank Software and EGS are performing very well. And the integration work for these businesses is progressing as expected. 
AMETEK's strong cash flow generation continues to bolster our capacity for capital deployment, including investment in strategic acquisitions. Our M&A teams continue to work diligently through a robust pipeline of attractive acquisition opportunities, and we expect to remain active over the balance of the year. 
Additionally, we're continuing to make key investments in support of our organic growth initiatives. We remain committed to investing in research, development and engineering of our advanced technology products and to continue to providing our customers with innovative solutions and maintaining our leading positions in niche markets and applications. 
In the second quarter, we invested $72 million in RD&E. And for the full year, we now expect to invest more than $300 million or approximately 5.5% of sales. 
For all of 2021, we now expect to invest approximately $100 million in incremental growth investments. In addition to RD&E, this total investment includes our front-end sales and marketing functions along with investments to help drive our digital transformation and allow our businesses to accelerate growth. 
As noted, operating performance in the second quarter was outstanding with strong core margin expansion despite having to absorb the return of temporary cost into our cost structure. While we are seeing higher levels of inflation due to the tightness of the global supply chain, we are capturing higher levels of price, given our differentiated solutions and allowing us to maintain a healthy price versus inflation spread. 
Additionally, we continue to see the benefits of our various operational excellence initiatives. For the full year, we now expect approximately $145 million of operational excellence savings. 
Now moving to our updated outlook for the remainder of 2021. Given our strong performance in the second quarter, along with our orders momentum and record backlog, we have again raised our 2021 sales and earnings guidance. 
For the full year, we now expect overall sales to be up approximately 20% and organic sales up approximately 10% over 2020. Diluted earnings per share for 2021 are now expected to be in the range of $4.62 to $4.68, an increase of 17% to 18% over 2020's comparable basis and above our prior guide of $4.48 to $4.56 per diluted share. 
For the third quarter, we anticipate that overall sales will be up in the mid-20% range versus the same period last year. Third quarter earnings per diluted share are now expected to be between $1.16 to $1.18, up 15% to 17% over last year's third quarter. 
In summary, AMETEK's second quarter results were superb, with excellent sales and orders growth and high-quality earnings growth exceeded expectations. Our strong operating performance through the first half of the year shows the strength and flexibility of the AMETEK Growth Model. 
Our differentiated technology solutions and market-leading positions across diverse niche applications have allowed us to navigate through difficult economic cycles and emerge as a stronger company each time. The proven sustainable nature of the AMETEK Growth Model continues to drive long-term success for all of AMETEK's stakeholders. 
I will now turn it over to Bill Burke, who will cover some of the financial details of the quarter, then we'll be glad to take your questions. Bill?"
31860,1673913496,2360431,"AMETEK, Inc., Q2 2021 Earnings Call, Aug 03, 2021",2021-08-03,"Earnings Calls","AMETEK, Inc.","Executives","Thank you, Dave. As Dave highlighted, AMETEK delivered outstanding results in the second quarter with strong sales and orders growth, excellent operating performance and a high quality of earnings. Let me provide some additional financial highlights for t",543,"Thank you, Dave. As Dave highlighted, AMETEK delivered outstanding results in the second quarter with strong sales and orders growth, excellent operating performance and a high quality of earnings. Let me provide some additional financial highlights for the quarter. 
Second quarter general and administrative expenses were $22.5 million, up $5.6 million from the prior year largely due to higher compensation expense. As a percentage of total sales, G&A was 1.6% for the quarter versus 1.7% in the same period last year. For 2021, general and administrative expenses are now expected to be approximately $15 million -- or expected to be up approximately $15 million on higher compensation costs. 
The effective tax rate in the second quarter was 20.6% compared to 19.5% in the same quarter last year. The higher rate was driven by the impact of a U.K. rate change, the associated remeasurement of our deferred tax liabilities. For 2021, we continue to expect our effective tax rate to be between 19% and 20%. And as we've stated in the past, actual quarterly tax rates can differ dramatically, either positively or negatively from this full year estimated rate. 
Our businesses continue to manage their working capital exceptionally well. For the quarter, working capital was 13.9% of sales, down an impressive 570 basis points from the 19.6% reported in the second quarter of 2020. 
Capital expenditures in the second quarter were $23 million, and we continue to expect capital expenditures to be approximately $120 million for the full year. 
Depreciation and amortization expense in the second quarter was $75 million. For all of 2021, we continue to expect depreciation and amortization to be approximately $300 million, including after-tax, acquisition-related intangible amortization of approximately $141 million or $0.61 per diluted share. 
As Dave highlighted, our businesses continue to generate strong levels of cash, given our asset-light business model and strong working capital management. In the second quarter, operating cash flow was $287 million, and free cash flow was $264 million with free cash flow conversion in the quarter a very strong 114% of net income. 
Total debt at quarter end was $2.96 billion. Offsetting this debt was cash and cash equivalents of $390 million. 
As Dave noted, we've been very active on the acquisition front. During the second quarter, we deployed approximately $1.58 billion on the acquisitions of Abaco Systems and NSI-MI. This was in addition to the acquisitions of EGS, Crank Software and Magnetrol, which were completed in the first quarter of the year. Combined, we have deployed approximately $1.85 billion on 5 strategic acquisitions thus far in 2021. 
At quarter end, our gross debt-to-EBITDA ratio and our net debt-to-EBITDA ratio were 1.9x and 1.6x, respectively. We remain well positioned to deploy additional capital and invest in our acquisition strategy, given our strong financial capacity and flexibility. At quarter end, we had approximately $2 billion of cash and existing credit facilities to support our growth initiatives. 
To summarize, our businesses delivered excellent results in the second quarter that outperformed our expectations. The performance of our businesses through the first half of the year, along with our strong balance sheet, tremendous cash flow generation and the dedication of our world-class workforce has positioned the company exceptionally well for meaningful growth in 2021 and beyond. Kevin?"
31860,1673913496,2360431,"AMETEK, Inc., Q2 2021 Earnings Call, Aug 03, 2021",2021-08-03,"Earnings Calls","AMETEK, Inc.","Executives","Thank you, Bill. Michelle, we're ready to take questions.",9,"Thank you, Bill. Michelle, we're ready to take questions."
31860,1673913496,2360431,"AMETEK, Inc., Q2 2021 Earnings Call, Aug 03, 2021",2021-08-03,"Earnings Calls","AMETEK, Inc.","Operator","[Operator Instructions] Our first question comes from the line of Matt Summerville with D.A. Davidson.",15,"[Operator Instructions] Our first question comes from the line of Matt Summerville with D.A. Davidson."
31860,1673913496,2360431,"AMETEK, Inc., Q2 2021 Earnings Call, Aug 03, 2021",2021-08-03,"Earnings Calls","AMETEK, Inc.","Analysts","A couple of questions. Dave, you mentioned price cost, but could you talk about what sort of spread you actually experienced in Q2 and what your realization was in terms of price year-on-year and whether you're contemplating any incremental pricing action",47,"A couple of questions. Dave, you mentioned price cost, but could you talk about what sort of spread you actually experienced in Q2 and what your realization was in terms of price year-on-year and whether you're contemplating any incremental pricing actions or surcharges in the back half?"
31860,1673913496,2360431,"AMETEK, Inc., Q2 2021 Earnings Call, Aug 03, 2021",2021-08-03,"Earnings Calls","AMETEK, Inc.","Executives","Great question, Matt. In the second quarter, we were very pleased that our pricing continues to offset inflation. We achieved about 3% of price across our entire portfolio, and total inflation was about 2 points. So we had about 100 basis point positive s",128,"Great question, Matt. In the second quarter, we were very pleased that our pricing continues to offset inflation. We achieved about 3% of price across our entire portfolio, and total inflation was about 2 points. So we had about 100 basis point positive spread, and we want to stay in front of it. We want to stay there. 
And with all the acquisitions that we did and all the cost from those acquisitions, it showed up. We had 170 basis points of core margin expansion. And that pricing really helped us deliver that. 
So we're ahead of the game now. We plan on staying there. There is increasing inflation, but with the 3% pricing and the 2% inflation, we were very pleased with our performance during the quarter."
31860,1673913496,2360431,"AMETEK, Inc., Q2 2021 Earnings Call, Aug 03, 2021",2021-08-03,"Earnings Calls","AMETEK, Inc.","Analysts","And then just as a follow-up, can you speak to the organic order cadence you experienced over the course of the quarter? And if you can give us a read on maybe what you saw in July?",38,"And then just as a follow-up, can you speak to the organic order cadence you experienced over the course of the quarter? And if you can give us a read on maybe what you saw in July?"
31860,1673913496,2360431,"AMETEK, Inc., Q2 2021 Earnings Call, Aug 03, 2021",2021-08-03,"Earnings Calls","AMETEK, Inc.","Executives","Yes, sure. I mean, as we said before, the organic orders were up substantially. During the quarter, they grew every month with June being the strongest month of the quarter. Sales also grew every month sequentially, and June was also the strongest month o",85,"Yes, sure. I mean, as we said before, the organic orders were up substantially. During the quarter, they grew every month with June being the strongest month of the quarter. Sales also grew every month sequentially, and June was also the strongest month of the quarter. And so a very strong trend during the quarter. And then with July, it was a very solid month and was supportive of our forecast and guide. So we feel real good about the orders trend in the business."
31860,1673913496,2360431,"AMETEK, Inc., Q2 2021 Earnings Call, Aug 03, 2021",2021-08-03,"Earnings Calls","AMETEK, Inc.","Operator","And our next question comes from the line of Josh Pokrzywinski with Morgan Stanley.",14,"And our next question comes from the line of Josh Pokrzywinski with Morgan Stanley."
31860,1673913496,2360431,"AMETEK, Inc., Q2 2021 Earnings Call, Aug 03, 2021",2021-08-03,"Earnings Calls","AMETEK, Inc.","Analysts","Dave, just on the inflation discussion. I guess the material side is only one piece of it. You have labor, you have logistics costs, there's kind of a cocktail of things in there. How should we think of 2Q as being kind of the high watermark inflation for",68,"Dave, just on the inflation discussion. I guess the material side is only one piece of it. You have labor, you have logistics costs, there's kind of a cocktail of things in there. How should we think of 2Q as being kind of the high watermark inflation for the year relative to the back half? Like when does that start to peak out or get a little easier?"
31860,1673913496,2360431,"AMETEK, Inc., Q2 2021 Earnings Call, Aug 03, 2021",2021-08-03,"Earnings Calls","AMETEK, Inc.","Executives","Yes. That -- the number that I gave you, the 2% is total inflation in our business. So that's not just material. That's total inflation. And in terms of peaking out, inflation is increasing. We're staying in front of it. I don't think we're ready to say",102,"Yes. That -- the number that I gave you, the 2% is total inflation in our business. So that's not just material. That's total inflation. 
And in terms of peaking out, inflation is increasing. We're staying in front of it. I don't think we're ready to say it's peaked yet. I think that there's an element of temporary cost spiking. But it's very difficult to bifurcate that between the underlying inflation and what's happening on a temporary basis. So the honest answer is we're not sure, but we're going to stay ahead of it. And that's the way we're managing the business."
31860,1673913496,2360431,"AMETEK, Inc., Q2 2021 Earnings Call, Aug 03, 2021",2021-08-03,"Earnings Calls","AMETEK, Inc.","Analysts","Got it. And then just in terms of kind of the end markets or customer behaviors that are standing out, this recovery seems unusual in a few different ways. But are you guys seeing kind of the classic more CapEx-facing applications or industries bounce bac",67,"Got it. And then just in terms of kind of the end markets or customer behaviors that are standing out, this recovery seems unusual in a few different ways. But are you guys seeing kind of the classic more CapEx-facing applications or industries bounce back? Or is it all just sort of in the mix together? Anything you could sort of comment on that would be helpful."
