"companyid","keydevid","transcriptid","headline","mostimportantdateutc","keydeveventtypename","companyname","speakertypename","componenttextpreview","word_count","componenttext"
114039,1673267538,2355459,"DexCom, Inc., Q2 2021 Earnings Call, Jul 29, 2021",2021-07-29,"Earnings Calls","DexCom, Inc.","Operator","And our next question comes from Margaret Kaczor.",8,"And our next question comes from Margaret Kaczor."
114039,1673267538,2355459,"DexCom, Inc., Q2 2021 Earnings Call, Jul 29, 2021",2021-07-29,"Earnings Calls","DexCom, Inc.","Analysts","I wanted to follow up a little bit on the real-time APIs and you guys got approval for. And it seems like to me like it could be one of the next evolutions for the business. So I was curious if you could talk to us how important it is today versus 3 years",85,"I wanted to follow up a little bit on the real-time APIs and you guys got approval for. And it seems like to me like it could be one of the next evolutions for the business. So I was curious if you could talk to us how important it is today versus 3 years from now, what it can facilitate both clinically and commercially? I guess, just to round it out, what's been the reaction from the potential partners to the API so far?"
114039,1673267538,2355459,"DexCom, Inc., Q2 2021 Earnings Call, Jul 29, 2021",2021-07-29,"Earnings Calls","DexCom, Inc.","Executives","Well, maybe I'll start with the reaction. The reaction has been incredibly positive. I think folks understand and desire to see the real-time information coming into their tools and being able to put that into the hands of the patients. The more real time",294,"Well, maybe I'll start with the reaction. The reaction has been incredibly positive. I think folks understand and desire to see the real-time information coming into their tools and being able to put that into the hands of the patients. The more real time that information is, the more reactive, the patient can be to that information and improve their outcomes over time. And I think we're incredibly bullish in the sense that we believe we have the capability and a platform to build these tools off of, and that's exactly where we want to be. We want to provide as much input to these tools as we possibly can and work with as many partners as possible.
I think from the very beginning, we've always had a bit of a different approach to the value of information, data and software, in particular. And what you're seeing play out right now is part of that vision that we've had there and the approval of the real-time API. We've invested heavily in the ability to produce this capability. We understand the importance of interoperability, the importance of putting information in the hands of the patients. That's who DexCom is. And you're going to continue to see us invest in that area and really use it as a differentiator.
In terms of how that evolves into the future and is there opportunity to create value in that monetization of the data stream or the real-time API. Those are all things we'll evaluate over time. That's not our strategy today. Today, it's all about improving outcomes for patients that's going to show up in the way of incremental sensor sales over time, and we're very happy with that approach. But it leaves us with some great flexibility."
114039,1673267538,2355459,"DexCom, Inc., Q2 2021 Earnings Call, Jul 29, 2021",2021-07-29,"Earnings Calls","DexCom, Inc.","Operator","And our next question comes from Travis Steed.",8,"And our next question comes from Travis Steed."
114039,1673267538,2355459,"DexCom, Inc., Q2 2021 Earnings Call, Jul 29, 2021",2021-07-29,"Earnings Calls","DexCom, Inc.","Analysts","Congratulations on a good quarter. I know you talked about the OUS launch of G7 here in the back half. And just curious if you could put some context on expectations for how we should think about that launch? And which countries if you're willing to share",80,"Congratulations on a good quarter. I know you talked about the OUS launch of G7 here in the back half. And just curious if you could put some context on expectations for how we should think about that launch? And which countries if you're willing to share that? And you've also got probably 40 million to 50 million G6 sensors that you're making a year. And just curious what you're going to do with the G6 capacity as G7 launches?"
114039,1673267538,2355459,"DexCom, Inc., Q2 2021 Earnings Call, Jul 29, 2021",2021-07-29,"Earnings Calls","DexCom, Inc.","Executives","That's a great question. I'll take that one. We're not going to give you color on the specific countries because we don't want to -- for competitive reasons, we don't want to release the playbook, but we are on track for that. And as we look going forward",303,"That's a great question. I'll take that one. We're not going to give you color on the specific countries because we don't want to -- for competitive reasons, we don't want to release the playbook, but we are on track for that. And as we look going forward, it is a very interesting question for us and one for us to debate how do we use our G6 capacity while we're bringing up G7 lines at the same time because the 2 don't intersect. We believe we'll have a market for G6 for quite some time. While we're going to do a global launch and go very quickly, there will be places where G7 isn't going to be available immediately. Our partners are going to take a while to catch up on the automated insulin delivery side. We're working with them now on G7, but we've got -- we've still got some G6 room to grow there. And there are some countries where we aren't yet or some geographies where we need to get started, where we can offer G6 in those areas while we sell G7 and others.
So we are planning this. It's one of our areas of great debate, and I think we'll manage as best we can. We won't be bashful about taking down G6 lines if G7 is ready to go and is the home run we think it's going to be. And we've got several -- in all fairness, Quentin and his operating relations team, along with our R&D guys have developed some absolutely spectacular manufacturing methods for G7 that can give us a tremendous amount of flexibility to expand their very, very quickly and very thoughtfully. So we'll monitor that very closely. That's a really good question and something we think about a lot here."
114039,1673267538,2355459,"DexCom, Inc., Q2 2021 Earnings Call, Jul 29, 2021",2021-07-29,"Earnings Calls","DexCom, Inc.","Operator","And our next question comes from Danielle Antalffy.",8,"And our next question comes from Danielle Antalffy."
114039,1673267538,2355459,"DexCom, Inc., Q2 2021 Earnings Call, Jul 29, 2021",2021-07-29,"Earnings Calls","DexCom, Inc.","Analysts","I'll echo everyone's congrats on a really strong quarter. I'm not sure who this question is for. But it's on the DTC initiative, you guys had a very successful Super Bowl ad campaign. Just curious if there's any way to quantify what you're seeing from a r",93,"I'll echo everyone's congrats on a really strong quarter. I'm not sure who this question is for. But it's on the DTC initiative, you guys had a very successful Super Bowl ad campaign. Just curious if there's any way to quantify what you're seeing from a return perspective yet? I mean this quarter, what seemed exceptionally strong to me. I'm wondering if we're seeing any benefit from that, not sure if you can even tell or if you can tell us. But if so, we'd love to hear even qualitative feedback there."
114039,1673267538,2355459,"DexCom, Inc., Q2 2021 Earnings Call, Jul 29, 2021",2021-07-29,"Earnings Calls","DexCom, Inc.","Executives","Sure. Yes, we'll take that question. And I think there's probably 2 data points that we can give you that will help you get your arms around the feedback we're seeing. First off, Q2 was a record quarter for new patient adds. So we're continuing to see rec",233,"Sure. Yes, we'll take that question. And I think there's probably 2 data points that we can give you that will help you get your arms around the feedback we're seeing. First off, Q2 was a record quarter for new patient adds. So we're continuing to see record new patient adds. No doubt in many ways driven by the work we're doing around DTC and sales force as well as samples. So I think you've got certainly a data point that's helpful.
The other piece is, over the past 18 months, we've doubled the active prescribers of our product. And no doubt, as we get out and get into the field and see endocrinologists, but also primary care physicians, the work we're doing around expanding that access has yielded really incredible benefits for the amount of prescribers that are out there that are: one, aware; and two, prescribing our product. I think those 2 things are just clear indications of the investments we're making in the awareness, in the DTC, in the sales force is paying off. And hopefully, that gives you some context, of course, looking at the quarter's revenue performance also helps as well. So those all data points, I think, really give you some color as to why we think it's still an incredible investment and why we think the returns still are some of the best in the business."
114039,1673267538,2355459,"DexCom, Inc., Q2 2021 Earnings Call, Jul 29, 2021",2021-07-29,"Earnings Calls","DexCom, Inc.","Operator","And our next question comes from Jayson Bedford.",8,"And our next question comes from Jayson Bedford."
114039,1673267538,2355459,"DexCom, Inc., Q2 2021 Earnings Call, Jul 29, 2021",2021-07-29,"Earnings Calls","DexCom, Inc.","Analysts","Just a quick one. I wanted to get back to the gross margin line of questioning. What weighs on gross margin in the second half of the year to get to the 67% for the year? Is it international pricing? Is the buildup of Malaysia? And just if you can comment",71,"Just a quick one. I wanted to get back to the gross margin line of questioning. What weighs on gross margin in the second half of the year to get to the 67% for the year? Is it international pricing? Is the buildup of Malaysia? And just if you can comment on -- it seems like a large portion of these costs may be transitory. Any color there would be helpful."
114039,1673267538,2355459,"DexCom, Inc., Q2 2021 Earnings Call, Jul 29, 2021",2021-07-29,"Earnings Calls","DexCom, Inc.","Executives","Sure. Yes. So there's 2 that are the biggest. The first one is some of the international pricing. You're correct. If some of that plays through, we'll have a little bit of pressure on margin. The other one is the launch of G7. When we launch G7, those lin",317,"Sure. Yes. So there's 2 that are the biggest. The first one is some of the international pricing. You're correct. If some of that plays through, we'll have a little bit of pressure on margin. The other one is the launch of G7. When we launch G7, those lines won't be at full capacity and they won't be at full yield. Just like when we launched G6 and we launched some of the automation around G6, it took a little bit of time to work through some of the kinks on these automated lines. And while we still expect incredible output right out the gate, that's going to cost us a little bit more. And so I think what you're seeing is some of the international access, but then when we launched G7 and those lines start to appreciate, the cost of producing those in that shorter period are going to be a little bit higher.
To your question is that transitory, all the work that the team is doing around the capability of manufacturing at high capacity as well as high yields, all of that will bounce back and play through. And if this quarter is any demonstration of how good they are, you can see the margins that you see this quarter have shown that this team does an incredible job of yielding out these lines over time. And we expect that to turn around with G7 into the future. But there will be some time as we launch G7 as we get those lines up and running, where there will be a little bit of weight just similar to what we had with G6 that we're going to have to navigate through. But again, I think we're still super bullish on the capability, and we're super proud of the team and really expecting that team to do an incredible job as we launch G7."
114039,1673267538,2355459,"DexCom, Inc., Q2 2021 Earnings Call, Jul 29, 2021",2021-07-29,"Earnings Calls","DexCom, Inc.","Operator","And our next question comes from Joanne Wuensch.",8,"And our next question comes from Joanne Wuensch."
114039,1673267538,2355459,"DexCom, Inc., Q2 2021 Earnings Call, Jul 29, 2021",2021-07-29,"Earnings Calls","DexCom, Inc.","Analysts","Nice quarter. Two questions. Was there any stocking in the quarter either in the U.S. or the OUS market? And then you gave a sort of a blended volume price number. Could you sort of parse that out for the U.S. and for the international sales dynamic?",47,"Nice quarter. Two questions. Was there any stocking in the quarter either in the U.S. or the OUS market? And then you gave a sort of a blended volume price number. Could you sort of parse that out for the U.S. and for the international sales dynamic?"
114039,1673267538,2355459,"DexCom, Inc., Q2 2021 Earnings Call, Jul 29, 2021",2021-07-29,"Earnings Calls","DexCom, Inc.","Executives","Yes. So there was no stocking in the quarter, nothing out of the normal. Everybody was at normal levels. In terms of your question on a blended number, I'm not sure what you're referring to. Certainly, we have a price dynamic of around the $250 million. W",136,"Yes. So there was no stocking in the quarter, nothing out of the normal. Everybody was at normal levels. In terms of your question on a blended number, I'm not sure what you're referring to. Certainly, we have a price dynamic of around the $250 million. When we say price, it's really more channel, but we want to make sure we're very clear. It's really that shift in channel as well as the international access. We also talked about unit volumes, and I'm not sure if you're referencing that, but our unit volumes on the quarter, the growth year-over-year were in the mid-40% range. And so certainly a strong unit volume growth quarter. So hopefully that answers your question. And if you have any others, certainly follow-up, we can happy to be -- happy to clarify."
114039,1673267538,2355459,"DexCom, Inc., Q2 2021 Earnings Call, Jul 29, 2021",2021-07-29,"Earnings Calls","DexCom, Inc.","Analysts","Actually, it's a unit volume number, that mid-40%, that's what I call a blended number. What is that number in the U.S. and international?",24,"Actually, it's a unit volume number, that mid-40%, that's what I call a blended number. What is that number in the U.S. and international?"
114039,1673267538,2355459,"DexCom, Inc., Q2 2021 Earnings Call, Jul 29, 2021",2021-07-29,"Earnings Calls","DexCom, Inc.","Executives","We don't break it out. That's our global number, but we can tell you that the growth on unit volume was strong in both the U.S. and outside the U.S.",31,"We don't break it out. That's our global number, but we can tell you that the growth on unit volume was strong in both the U.S. and outside the U.S."
114039,1673267538,2355459,"DexCom, Inc., Q2 2021 Earnings Call, Jul 29, 2021",2021-07-29,"Earnings Calls","DexCom, Inc.","Operator","And our next question comes from Steve Lichtman.",8,"And our next question comes from Steve Lichtman."
114039,1673267538,2355459,"DexCom, Inc., Q2 2021 Earnings Call, Jul 29, 2021",2021-07-29,"Earnings Calls","DexCom, Inc.","Analysts","Kevin, you talked about momentum in intensive type 2. Where do you think U.S. penetration into that market can go over the next 2 years? Are there any hurdles to drive penetration? Or are you feeling good now where awareness and payer coverage are to cont",50,"Kevin, you talked about momentum in intensive type 2. Where do you think U.S. penetration into that market can go over the next 2 years? Are there any hurdles to drive penetration? Or are you feeling good now where awareness and payer coverage are to continue to drive penetration there?"
114039,1673267538,2355459,"DexCom, Inc., Q2 2021 Earnings Call, Jul 29, 2021",2021-07-29,"Earnings Calls","DexCom, Inc.","Executives","We feel very good about coverage we have there. On the commercial side, it's up over 80% of the intensive type 2 patients now covered for commercial payers plus the Medicare coverage that we have that covers a number of these patients already. So access f",168,"We feel very good about coverage we have there. On the commercial side, it's up over 80% of the intensive type 2 patients now covered for commercial payers plus the Medicare coverage that we have that covers a number of these patients already. So access for these patients isn't going to be a problem. It's now all about awareness. We went and doubled the size of our sales force at the beginning of this year, so we get access to more primary care physicians who do see a lot of the insulin using type 2 patients. And we've seen great results from that team. We've had a huge increase in the number of prescribers of our product over the course of this year. So that is a big win. For us, it's about getting to him and explaining to him what technology is available. We think this market will be every bit as penetrated as type 1 at some point. We view it as a very strong opportunity."
114039,1673267538,2355459,"DexCom, Inc., Q2 2021 Earnings Call, Jul 29, 2021",2021-07-29,"Earnings Calls","DexCom, Inc.","Operator","Our next question comes from Anthony Petrone.",7,"Our next question comes from Anthony Petrone."
114039,1673267538,2355459,"DexCom, Inc., Q2 2021 Earnings Call, Jul 29, 2021",2021-07-29,"Earnings Calls","DexCom, Inc.","Analysts","Great. Congratulations. Great quarter. And hope everyone is doing well on the team. Maybe a quick one on Malaysia and G7. Is it safe to assume G7 will exclusively be manufactured out of there? And if so, what does that mean for the margin of that product?",79,"Great. Congratulations. Great quarter. And hope everyone is doing well on the team. Maybe a quick one on Malaysia and G7. Is it safe to assume G7 will exclusively be manufactured out of there? And if so, what does that mean for the margin of that product? And then maybe a quick update on the integrated device partnerships, Control-IQ and eventually Omnipod 5, just how you see those partnerships in those product cycles evolving over the next 24 months?"
114039,1673267538,2355459,"DexCom, Inc., Q2 2021 Earnings Call, Jul 29, 2021",2021-07-29,"Earnings Calls","DexCom, Inc.","Executives","Yes, I'll speak to the Malaysia question. Kevin will jump on the last part of that. With respect to Malaysia, it will not be exclusive -- G7 will not be exclusive to that location. We will start with G7 here in the States, both in San Diego and Mesa. As a",252,"Yes, I'll speak to the Malaysia question. Kevin will jump on the last part of that. With respect to Malaysia, it will not be exclusive -- G7 will not be exclusive to that location. We will start with G7 here in the States, both in San Diego and Mesa. As a matter of fact, lines are there as we speak, and we'll continue to ramp up there into the back part of this year and into next year as well. As Malaysia comes online and the buildings up out of the ground, and we validated the clean room and the capability there, we'll begin to build out the G7 capability there as well. So we'll have G7 in both locations over time, that's going to give us an opportunity to produce north of 200 million sensors altogether.
And when you think about the distribution of those sensors and where they're going, both in the U.S. and internationally speaking, I think it makes a lot of sense to continue to have a capability here in the States as well in Malaysia, particularly when you start to look at the logistical distribution costs associated with moving that product around in the volumes that we're talking. So it will exist in both locations. I do think over time, the lower cost profile will come out of that Malaysia business. That's a big part of the value proposition there, but that's going to let us serve a lot of those international markets very effectively and efficiently."
114039,1673267538,2355459,"DexCom, Inc., Q2 2021 Earnings Call, Jul 29, 2021",2021-07-29,"Earnings Calls","DexCom, Inc.","Executives","Yes. And with respect to the integrated systems, we're very excited for these opportunities. I actually made it out in the field last week. There is a whole bunch of pent-up demand for Omnipod 5. People are very ready for it. They've been ready for it for",202,"Yes. And with respect to the integrated systems, we're very excited for these opportunities. I actually made it out in the field last week. There is a whole bunch of pent-up demand for Omnipod 5. People are very ready for it. They've been ready for it for a long time, and we're looking forward to that day as well. On the Tandem side, we know they're working on new products and have new projects. I think the best thing I can talk about with Tandem is just a recent story. I got to know it on my computer, somebody wanted to give me a Facebook message, and it was a person who told me he spent 22 years on Medtronic systems and is now on Tandem Control-IQ with DexCom and he has never been healthier, never had a lower A1c, never had better -- he said my whole life has changed. He goes, this system is amazing. So we believe the integrated systems driven by DexCom sensors are game changers. People get accurate sensor information that can take these sophisticated algorithms and make proper decisions. We're very bullish and optimistic on the -- on both of these opportunities going forward. Very excited."
114039,1673267538,2355459,"DexCom, Inc., Q2 2021 Earnings Call, Jul 29, 2021",2021-07-29,"Earnings Calls","DexCom, Inc.","Operator","Our next question comes from Ravi Misra.",7,"Our next question comes from Ravi Misra."
114039,1673267538,2355459,"DexCom, Inc., Q2 2021 Earnings Call, Jul 29, 2021",2021-07-29,"Earnings Calls","DexCom, Inc.","Analysts","Just on the DexCom API. Can you talk a little bit about how you chose some of the partners that you're working with? I understand Livongo, of course, but with Garmin. And then just more on that. Just walk us through kind of how you envision this being sep",69,"Just on the DexCom API. Can you talk a little bit about how you chose some of the partners that you're working with? I understand Livongo, of course, but with Garmin. And then just more on that. Just walk us through kind of how you envision this being separate or integrated with CLARITY in the future? Just curious why this is for industry rather than kind of providers itself?"
114039,1673267538,2355459,"DexCom, Inc., Q2 2021 Earnings Call, Jul 29, 2021",2021-07-29,"Earnings Calls","DexCom, Inc.","Executives","Yes. This is Kevin. I'll handle the CLARITY piece. With the live API, the patient still has to run the DexCom app in the background. So the data will go straight to CLARITY, and it will be there as is. Now the better question is, will we ever have a CLARI",128,"Yes. This is Kevin. I'll handle the CLARITY piece. With the live API, the patient still has to run the DexCom app in the background. So the data will go straight to CLARITY, and it will be there as is. Now the better question is, will we ever have a CLARITY type system for those who don't have the same needs as intensive insulin users. And I think over time, you'll see us migrate our tools to that platform. Hence, you heard these guys talk about software investments over the last half of the year. And as we look at 2022, we see the same. We are quickly becoming a software company in addition to a sensor company It's very exciting there. Quentin, do you want to talk?"
114039,1673267538,2355459,"DexCom, Inc., Q2 2021 Earnings Call, Jul 29, 2021",2021-07-29,"Earnings Calls","DexCom, Inc.","Executives","Yes, in terms of the partners, I mean you think about the Teladoc Livongo's diabetes program, the UnitedHealth, the Welldoc and Garmin, these are partners that we've established relationships with in the past. There is a little bit of integration work tha",141,"Yes, in terms of the partners, I mean you think about the Teladoc Livongo's diabetes program, the UnitedHealth, the Welldoc and Garmin, these are partners that we've established relationships with in the past. There is a little bit of integration work that goes into providing the real-time API and the connection into their systems. These were the easy ones out of the gate that really sync up with and get the programs going with. But I think the important thing is we want to be a foundation that we can provide this sort of information into many programs out there and really improve the outcomes for the patients themselves. And I don't think we could be better positioned to be able to do that right now. So incredibly thrilled with where it's at and expect more partners to be lining up."
114039,1673267538,2355459,"DexCom, Inc., Q2 2021 Earnings Call, Jul 29, 2021",2021-07-29,"Earnings Calls","DexCom, Inc.","Operator","And our next question comes from Marie Thibault.",8,"And our next question comes from Marie Thibault."
