"companyid","keydevid","transcriptid","headline","mostimportantdateutc","keydeveventtypename","companyname","speakertypename","componenttextpreview","word_count","componenttext"
114039,700824647,2207032,"DexCom, Inc., Q4 2020 Earnings Call, Feb 11, 2021",2021-02-11,"Earnings Calls","DexCom, Inc.","Executives","Thank you. I did a bit of math while we were doing this call. This is my 40th call with Steve. And as he moves into a new role, I just need to acknowledge what a wonderful job he's done with our investors over the years. I think back at our calls in the e",548,"Thank you. I did a bit of math while we were doing this call. This is my 40th call with Steve. And as he moves into a new role, I just need to acknowledge what a wonderful job he's done with our investors over the years. I think back at our calls in the early years, where we'd sit around and go, okay, what is it we're going to say today and what is it we have to report. This company has changed so much over those 40 calls. A marvelous effort and some incredible work, and he'll still be here, but he's going to have some different investors to please, and we're excited about that. 
I do want to thank everybody for being on the call today. As you can tell, we remain extremely bullish about our opportunities going forward. One of our executives was having a conversation with me here one day and he said, the way he described DexCom is just as soon as we climb one mountain, we get to the top of it. And on the other side, there's a bigger one, and we start another climb. And I think as Quentin detailed our financial plans and what we have going on, what we see is a great big mountain and a great big climb. And we're preparing to do that. We think we can do it very effectively. We are very bullish about the future. Over the past several days, a lot of the talk has been around the Super Bowl commercial here. And I have gotten numerous pictures, videos, e-mails, text messages from our patients and their parents or their caregivers saying thank you for creating awareness. Kids in school are telling everybody, remember that commercial, I wear that. And I have that, and this is how I manage my diabetes. We have seen such a positive reception to this, and the positive energy has just been amazing. So kudos to our marketing team, to Nick Jonas and everybody for getting this done. Our hospital initiatives and the new initiatives we've talked about. As I said, there are investments, but now we're getting numerous physicians reaching out saying, you've got to get this everywhere. It needs to be all throughout the hospital. It needs to be worn by the patients when they go home. We can't have them coming back, and monitoring glucose can be very important. We'll continue to go after those efforts. Our new market efforts are very strong. 
And last, I'll go to the intensive type 2s as well. As I said, we created some awareness here. I recently had a conversation. I've had several conversations with people with type 2 diabetes absolutely struggling with what to do. What can I possibly do to take care of myself because they just don't know. And CGM tells them. It tells them what to do. It tells them about foods. It tells them about exercise. It tells them about stress and sleep and everything else. And we are really excited for this opportunity. You'll see us have a lot of good things come to pass in 2021 on all these fronts. But thanks, everybody, for continuing to listen. And great day, great year for DexCom and our team. Thanks, everybody."
114039,700824647,2207032,"DexCom, Inc., Q4 2020 Earnings Call, Feb 11, 2021",2021-02-11,"Earnings Calls","DexCom, Inc.","Operator","And thank you, ladies and gentlemen. This concludes today's conference. Thank you for participating. You may now disconnect.",18,"And thank you, ladies and gentlemen. This concludes today's conference. Thank you for participating. You may now disconnect."
114039,700824647,2246858,"DexCom, Inc., Q4 2020 Earnings Call, Feb 11, 2021",2021-02-11,"Earnings Calls","DexCom, Inc.","Operator","Welcome to the DexCom Fourth Quarter and Full Year 2020 Earnings Release Call. My name is Darryl, and I will be your operator for today's call. [Operator Instructions] Please note that this conference is being recorded. I will now turn the call over to Se",50,"Welcome to the DexCom Fourth Quarter and Full Year 2020 Earnings Release Call. My name is Darryl, and I will be your operator for today's call. [Operator Instructions] Please note that this conference is being recorded. I will now turn the call over to Sean Christensen. Sean, you may begin."
114039,700824647,2246858,"DexCom, Inc., Q4 2020 Earnings Call, Feb 11, 2021",2021-02-11,"Earnings Calls","DexCom, Inc.","Executives","Thank you, operator, and welcome to DexCom's Fourth Quarter and Full Year 2020 Earnings Call. Our agenda begins with Kevin Sayer, DexCom's Chairman, President and CEO, who will provide a summary of the quarter and full year 2020; followed by a financial r",371,"Thank you, operator, and welcome to DexCom's Fourth Quarter and Full Year 2020 Earnings Call. Our agenda begins with Kevin Sayer, DexCom's Chairman, President and CEO, who will provide a summary of the quarter and full year 2020; followed by a financial review and outlook from Quentin Blackford, our COO and CFO; and then a strategic update from Steve Pacelli, our Executive Vice President of Strategy and Corporate Development. Following our prepared remarks, we will open the call up for your questions. [Operator Instructions]  
Please note that there are also slides available related to our fourth quarter performance on the DexCom Investor Relations website on the Events and Presentations page. With that, let's review our safe harbor statement.  
Some of the statements we will make in today's call may constitute forward-looking statements. These statements reflect management's intentions, beliefs and expectations about future events, strategies, competition, products, operating plans and performance. All forward-looking statements included in this presentation are made as of the date hereof based on information currently available to DexCom, are subject to various risks and uncertainties, and actual results could differ materially from those anticipated in the forward-looking statements.  
The factors that could cause actual results to differ materially from those expressed or implied by any of these forward-looking statements are detailed in DexCom's annual report on Form 10-K and other filings with the Securities and Exchange Commission. Except as required by law, we assume no obligation to update any such forward-looking statements after the date of this presentation or to conform these forward-looking statements to actual results.  
Additionally during the call, we will discuss certain financial measures that have not been prepared in accordance with GAAP with respect to our non-GAAP and cash-based results. Unless otherwise noted, all references to financial metrics are presented on a non-GAAP basis. The presentation of this additional information should not be considered in isolation or as a substitute for results or superior to results prepared in accordance with GAAP.  
Please refer to the tables in our earnings release and the slides accompanying our fourth quarter and full year earnings presentation for a reconciliation of these measures to their most directly comparable GAAP financial measure. Now I will turn it over to Kevin."
114039,700824647,2246858,"DexCom, Inc., Q4 2020 Earnings Call, Feb 11, 2021",2021-02-11,"Earnings Calls","DexCom, Inc.","Executives","Thank you, Sean, and thank you, everyone, for joining us today. Let me start by summarizing some of the things that DexCom accomplished in 2020. Total revenue grew 31% over 2019, driven by a record number of new patient additions. This translates to more",890,"Thank you, Sean, and thank you, everyone, for joining us today. Let me start by summarizing some of the things that DexCom accomplished in 2020. Total revenue grew 31% over 2019, driven by a record number of new patient additions. This translates to more than $415 million in absolute dollar growth, another high-water mark for DexCom. We doubled G6 capacity in the first 6 months of the year. Our team has done a great job to meet the ambitious plans that we outlined nearly 2 years ago to scale G6 capacity, leaving the company in the best inventory position that we have been in since the launch of G6.  
The scale-up led to strong gross margin expansion in 2020, even as we increasingly shift our business to the pharmacy channel. We closed the full year 2020 with our highest gross margin since 2017. Our enhanced capacity puts us in position to aggressively pursue our growth initiatives. This includes the expansion of our sales force, which we announced in October and have nearly completed, as well as our efforts around product sampling and direct-to-consumer advertising in the U.S. and international markets.  
Many of you have seen our most recent effort to drive category awareness as we kicked off a new campaign around one of our DexCom warriors, Nick Jonas, including our ad during the Super Bowl. This bold effort should give you a sense for our belief about the market opportunity ahead of us. We've received great feedback from the campaign so far and look forward to joining forces with Nick and diabetes advocacy groups in the coming months to drive greater awareness of the benefits of CGM.  
At the height of the pandemic's first wave, we established a new effort in a matter of days to support hospitals needing to preserve personal protective equipment and utilize our remote monitoring technology. We've made significant progress in our work to bring DexCom CGM to people with type 2 diabetes, including both those on intensive insulin therapy and those who are not. We also announced several new initiatives in 2020 that we believe will position us to meet the kinds of patient growth that we expect over the next several years.  
Building on the success of our team in Manila, where we've strengthened our customer service metrics across the board, we announced a new global business services unit in Lithuania that will help serve our international operations. We also announced that we will be building our third manufacturing site and first international manufacturing site in Malaysia. This state-of-the-art facility will be key to scaling our G7 capacity and provide logistical advantages as we look to serve our growing international base.  
Speaking of G7, 2020 saw us initiate and complete the first G7 pivotal trial. We're very happy with these results and the feedback we've received from participants and clinicians involved in the trial has been outstanding. Our clinical work is continuing as we progress with the regulatory path in 2021 to support our goal to launch G7 in the second half of the year.  
In any given year, these are accomplishments that we would be proud of. But in 2020, our teams accomplished these goals during a global pandemic. I want to use this forum again to say how proud I am of the DexCom employees who have embraced our mission to empower people to take control of diabetes in a year of very unique challenges. It is a privilege to both lead and learn from such a talented team. And rest assured, our team is focused on the growth opportunity ahead of us as we're now well on our way in 2021.  
This is shaping up to be another exciting year for the company, featuring our continued momentum as we look to bring G6 to many potential customers yet to use CGM, the ongoing manufacturing scale-up and launch of G7 and investing in several other key initiatives related to the growth pillars that we outlined at our recent Investor Day. We believe there is still a huge growth opportunity ahead, and we are investing to ensure that the company is positioned to deliver CGM as a mass market technology for greater health outcomes.  
The pandemic has contributed to structural changes in the way health care is delivered, with DexCom CGM a valuable asset in the growing digital health and the remote monitoring health care ecosystems. Yet a majority of people with diabetes in the world continue to rely on fingerstick technology. It is because of these developing landscapes and our belief in what DexCom CGM offers that we are announcing the formation of DexCom Ventures today, which Steve Pacelli will lead.  
With this entrance into the venture capital space, we believe we will be able to accelerate development for innovative companies that share our commitment to empowering greater health outcomes for customers and their clinicians. This may include technologies with use cases that can be combined with our CGM system as well as independent technology platforms.  
To summarize, we are very proud of what we accomplished in 2020 and are moving forward with the same commitment to our users and the growth of DexCom well into the future. With that, I will turn it over to Quentin for a review of the fourth quarter financials and discussion of the 2021 outlook. Quentin?"
114039,700824647,2246858,"DexCom, Inc., Q4 2020 Earnings Call, Feb 11, 2021",2021-02-11,"Earnings Calls","DexCom, Inc.","Executives","Thank you, Kevin. As a reminder, unless otherwise noted, the financial metrics presented today will be discussed on a non-GAAP basis. Reconciliations to GAAP can be found in today's earnings release as well as on our IR website.  We reported worldwide r",1254,"Thank you, Kevin. As a reminder, unless otherwise noted, the financial metrics presented today will be discussed on a non-GAAP basis. Reconciliations to GAAP can be found in today's earnings release as well as on our IR website.  
We reported worldwide revenue of $568.9 million for the fourth quarter compared to $462.8 million for the fourth quarter of 2019, representing growth of 23%. Our team did a great job maintaining momentum with new patient additions in the fourth quarter and accelerating our shift of the business into the pharmacy channel.  
Even with the increasing COVID lockdowns as the quarter progressed, new patients for the fourth quarter were in line with our original expectations for the year, a new record and a great achievement for our team. U.S. revenue grew 20% over the fourth quarter of 2019, totaling $451 million. We were able to drive more volume into the pharmacy channel than we originally expected, closing the year approaching 50% of our total U.S. commercial volume. This means that we are making excellent progress to position the company for long-term growth in the U.S. and an efficient operating model for the company. And while there is channel mix causing lower revenue per patient in the pharmacy channel, the underlying strength of the business saw fourth quarter unit volumes grow significantly more than our revenue growth rate in the U.S.  
Our international business reached a new high-water mark of $117 million in the fourth quarter of 2020, growing 35% over the fourth quarter of 2019. This growth includes strong performance in both our direct and distributor markets. We began an international DTC campaign in several of our markets in the fourth quarter and will continue to drive awareness of the benefits of our technology, knowing that CGM market penetration internationally remains even less than in the U.S.  
Our fourth quarter gross profit was $399.1 million or 70.2% of revenue compared to 66.8% of revenue in the fourth quarter of 2019. The 70.2% of revenue represents our highest gross margin quarter in the past 5 years. This is another demonstration of the ability of our team to navigate our strategic shift to the pharmacy channel while delivering strong profitability across the organization.  
As Kevin noted, our successful scale-up of G6 has been a key driver of this margin expansion while also placing us in our strongest inventory position to date, allowing us to more aggressively target new users as we continue in 2021.  
Operating expenses were $294.7 million for Q4 2020 compared to $205.7 million in Q4 2019. The  year-over-year expense growth in the fourth quarter consists of several key areas of strategic investment, which includes roughly $15 million of nonrecurring spend related to enhancing our software development efforts and automation of our production capabilities. We also increased spending related to our DTC programs, product sampling and the expansion of our U.S. sales force. Even with significant investments throughout 2020 to prepare DexCom for future growth and efficiency, total operating expense growth for the year totaled 26%, well below our 31% revenue growth for the year.  
Operating income was $104.4 million or 18.4% of revenue in the fourth quarter of 2020 compared to $103.6 million or 22.4% of revenue in the same quarter of 2019. For the year, we delivered more than 500 basis points of operating margin expansion, with full year 2020 operating margin of 16.6%, exceeding our most recent guidance. Adjusted EBITDA was $159.2 million or 28% of revenue for the fourth quarter compared to $141.7 million or 30.6% of revenue for the fourth quarter of 2019. Our full year adjusted EBITDA margin of 26.3% also exceeded our most recent guidance and came in more than 300 basis points better than our original 2020 guidance.  
As our margin progress shows, the significant steps that we have taken over the past few years are having a great impact on our ability to translate revenue growth into profitability. We are confident that the trend will continue over the long term as we move towards the 5-year targets that we laid out for you at our recent Investor Day by simultaneously taking opportunities that arise to invest in the growth ahead of us.  
Net income for the fourth quarter was $90.4 million or $0.91 per share. We significantly increased operating cash flow in 2020 and remain in a strong cash position with greater than $2.7 billion of cash and cash equivalents on the balance sheet as we exit the year. This gives us the flexibility to pursue the strategic investments that we believe will allow us to maintain a leadership position in our field. These include some of the investments we discussed related to our fourth quarter activities.  
Turning to 2021 guidance. As we stated early last month, we anticipate full year revenues of $2.21 billion to $2.31 billion, representing growth of 15% to 20%. We expect new patient growth to continue to exceed our revenue growth rate again in 2021, with our team extending their efforts to drive U.S. commercial business into our preferred pharmacy channel. We've also contemplated potential benefits from our efforts to drive category awareness through our expanded sales force, DTC advertising, product sampling and integrated systems as well as general considerations around the competitive environment.  
Turning to margins. We have several considerations in 2021 as we position the business for efficient growth and long-term margin expansion, in line with what we outlined at our recent Investor Day. For 2021, we anticipate gross margins of approximately 65%, in line with our long-term expectations. This anticipates a slight shift from our 67% full year 2020 results, which we expect to be driven by the success of our pharmacy channel initiative as well as our 2021 investments in infrastructure related to our G7 scale up and OUS manufacturing facility in Malaysia.  
We expect operating margins of approximately 13%, reflecting our gross margin outlook as well as various investments we've contemplated in 2021. As you know, DexCom has advanced its profitability profile at a much faster pace than originally anticipated over the past few years while at the same time building the infrastructure to scale the business profitably.  
With the diabetes market still underpenetrated, we're going on the offense with these investments. We are continuing to invest in the growth of the business via DTC, sampling, new markets and the launch of new products that we mentioned at our Investor Day, including G7. We are also making a significant investment in the global sales force, including doubling the size of our U.S.-based commercial field team. We will also continue to work on advanced research and development, which is looking into future generations of products and sensing capability. We're making these investments to accelerate our ability to bring CGM to those in need. Additionally, we believe these investments will support the long-term profitability objectives that we set at Investor Day, while at the same time yielding significant returns for our shareholders.  
However, in the near term, we want to be prudent about incurring these upfront costs in our guidance and let the benefits play out. We expect that adjusted EBITDA margins will be approximately 23% for 2021.   
Finally, with the release of the valuation allowance on income taxes in 2020, in 2021 we will start to have a tax rate that is applicable to earnings. We expect that rate, absent any changes in tax law, to be in the low to mid-20% range. With that, I will now turn the call over to Steve for a strategic update."
