"companyid","keydevid","transcriptid","headline","mostimportantdateutc","keydeveventtypename","companyname","speakertypename","componenttextpreview","word_count","componenttext"
27862,701133970,2190536,"eBay Inc., Q4 2020 Earnings Call, Feb 03, 2021",2021-02-03,"Earnings Calls","eBay Inc.","Operator","This concludes today's conference call. You may now disconnect.",10,"This concludes today's conference call. You may now disconnect."
27862,710756072,2261707,"eBay Inc., Q1 2021 Earnings Call, Apr 28, 2021",2021-04-28,"Earnings Calls","eBay Inc.","Operator","Welcome to the eBay First Quarter 2021 Earnings Call. At this time, all participants are in listen-only mode. After the speaker's presentation, there will be a question and answer session. [Operator Instructions] Please be advised that today's conference",67,"Welcome to the eBay First Quarter 2021 Earnings Call. At this time, all participants are in listen-only mode. After the speaker's presentation, there will be a question and answer session. [Operator Instructions] Please be advised that today's conference is being recorded. [Operator Instructions] I would now like to hand the conference over to your speaker today, Joe Billante, VP of Investor Relations and Communications. Please go ahead."
27862,710756072,2261707,"eBay Inc., Q1 2021 Earnings Call, Apr 28, 2021",2021-04-28,"Earnings Calls","eBay Inc.","Executives","Good afternoon. Thank you for joining us, and welcome to eBay's earnings release conference call for the first quarter of 2021. Joining me today on the call are Jamie Iannone, our Chief Executive Officer; and Andy Cring, our interim Chief Financial Office",260,"Good afternoon. Thank you for joining us, and welcome to eBay's earnings release conference call for the first quarter of 2021. Joining me today on the call are Jamie Iannone, our Chief Executive Officer; and Andy Cring, our interim Chief Financial Officer. We're providing a slide presentation to accompany Andy's commentary during the call, which is available through the Investor Relations section of the eBay website at investors.ebayinc.com. Before we begin, I'd like to remind you that during the course of this conference call, we will discuss some non-GAAP measures related to our performance. You can find the reconciliation of these measures to the nearest comparable GAAP measures in the slide presentation accompanying this conference call. Additionally, all revenue and GMV growth rates mentioned in Jamie's and Andy's remarks represent FX-neutral, year-over-year comparisons unless they indicate otherwise. In this conference call, management will make forward-looking statements, including, without limitation, statements regarding our future performance and expected financial results. These forward-looking statements involve known and unknown risks and uncertainties, and our actual results may differ materially from our forecast for a variety of reasons. You can find more information about risks, uncertainties and other factors that could affect our operating results in our most recent periodic reports on Form 10-K and Form 10-Q in our earnings release from earlier today. You should not rely on any forward-looking statements. All information in this presentation is as of April 28, 2021, and we do not intend and undertake no duty to update this information. With that, let me turn it over to Jamie."
27862,710756072,2261707,"eBay Inc., Q1 2021 Earnings Call, Apr 28, 2021",2021-04-28,"Earnings Calls","eBay Inc.","Executives","Thanks, Joe, and good afternoon, everyone, and thank you for joining us. Today, we'll begin the call with key highlights from the first quarter. Then I will share some reflections from my first 12 months as CEO and provide an update on the status of our t",2149,"Thanks, Joe, and good afternoon, everyone, and thank you for joining us. Today, we'll begin the call with key highlights from the first quarter. Then I will share some reflections from my first 12 months as CEO and provide an update on the status of our tech-led reimagination. At the end of my remarks, I will turn the call over to Andy, who will discuss our financial performance and outlook in greater detail. The first quarter of 2021 was an excellent start to the year for sellers and buyers on eBay. Gross merchandise volume grew 24% ahead of expectations. Revenue grew 38%, outpacing volume primarily due to payments and advertising. This is the fastest our revenues have grown since 2005, and we lean further into technology and vertical marketing investments, but still delivered $1.09 in non-GAAP earnings per share above our expectation. Importantly, our customer metrics grew on both sides of our marketplace. Active sellers grew 8% to $20 million globally, more small businesses are joining the platform and more consumers are engaging in selling. C2C GMV growth outpaced B2C for the fourth quarter in a row. This is positive for the long term as consumer sellers bring unique inventory at compelling prices and spend more than twice as much as buyers who don't sell. Active buyers grew 7% to $187 million globally. We are retaining buyers acquired over the last year at similar rates as prepandemic level, and we're seeing higher customer satisfaction in several categories as well as increased spend per buyer. We have continued to make progress on our multiyear initiatives, payments and advertising, which contribute to a seamless customer experience, increase our platform monetization and deliver compelling financial results. managed payments ended Q1 with over 4 million sellers migrated. This includes millions of consumer sellers and hundreds of thousands of businesses globally. During the quarter, eBay managed payments representing over 52% of on-platform volume, up from 38% last quarter. In the U.S., we exited the quarter over 80% complete. By applying what we learned in previous markets, rollouts in France, Italy and Spain progressed at an even faster pace, and we're on track to launch Greater China this quarter in all remaining markets by the middle of the year. We continue to see higher seller satisfaction due to a simpler end-to-end experience that reduces cost and complexity. For many years before managed payments, sellers had to manage delays between purchase and payment across 2 platforms that tied up their inventory. As sellers migrate to managed payments, that pain point is resolved, saving time and money. And in Q1, we reduced unpaid items by approximately 80% on fixed-price transaction. We remain on track to complete the vast majority of the payments transition by the end of this year, which will deliver our stated financial goals of a leased and incremental $2 billion in revenue and $500 million in annualized operating income in 2022. In Q1, advertising growth outpaced volume, driven by Promoted Listings, which delivered close to $224 million of revenue, up 58%. More than 1.3 million sellers promoted close to 400 million listings during the quarter. Growth was driven by increased seller adoption and AI improvements that increase conversion. Inspired by the success of Promoted Listings over the past few years, we are investing aggressively in innovation. We reached $1 billion of advertising revenue in 2020, primarily through Promoted Listings, which leverages a reentry Due to a combination of mobility driven tailwinds and the execution of our multiyear monetization initiatives. And we are driving value through portfolio optimization and returning capital to shareholders. Despite these notable achievements, there's still a tremendous amount of potential to be realized. Now I'd like to take a step back to a year ago when I rejoined this remarkable company as CEO. I knew eBay as a pioneer in e-commerce, with a globally recognized brand, robust organic traffic and long-standing customer relationships. And I've always been inspired the purpose and special culture it creates.
Last July we set out a vision for a techland reimagination of eBay. First, we believe that we can drive growth in our core by significantly increasing customer satisfaction. Second, we saw the need to better serve our small businesses and consumer sellers to become their platform of choice. And third, we identify the opportunity to evolve our relationship with buyers to drive better long term retention. I am confident we can deliver on these 3 pillars, positioning us to more effectively compete and win in a huge and growing addressable market. 
Our results to date are very encouraging. Our underlying growth is accelerating, sellers and buyers are growing, and we are making progress in our pursuit to be the best global marketplace to buy and sell. Simply put, our strategy is working. Let me share some examples with you. In the U.S., we are growing our core. In Q1, sneakers valued above $100, who had a triple digit rate once again. Since launching authentication, we verified hundreds of thousands of sneakers, and we're seeing buyer satisfaction above 80 as a result. In addition we are expanding our engagement with GenZ and millennials through a wide range of social channels. Based on the tremendous success we've seen in the U.S., we are rapidly expanding identical capabilities to other major markets. We have set up local authentication centers, and are launching in the U.K., Australia and Canada this quarter. These centers will also unlock cross-border trade opportunities in sneakers and in other categories. In luxury watches we saw growth accelerate from 16% in Q4 to 38% in Q1 in the U.S. For authenticated items, we are seeing customer satisfaction that was close to 90%, and is changing customer behavior. Sellers are listing more items, and seeing a higher price realization. Buyers are visiting eBay more often and spending more. One of the key advantages of our platform is cross-category shopping. Our luxury watch buyers, like our sneakers enthusiasts, spend thousands of dollars on other categories across the platform. In addition, based on the value we are delivering in luxury watches, we recently raised fees in this category to create more investment capacity. For our certified refurbished experience, eBay sellers continue to see strong velocity, and we've expanded in the U.S. to over 150 brands. We've also rolled certified refurbished out to the U.K., Canada and Germany, with more than 100 top brands signed up already. Buyers love the low prices on like new products, as well as free shipping, extended warranties, and extended returns. Now I want to highlight the next core category where we see significant potential, trading cards, a key part of our collectibles business. EBay is a market leader in this category, with the widest selection across all price levels. We've seen explosive growth to start the year. In the U.S. GMV was over $1 billion in Q1, which represents more than half of 2020's record setting volume. Active buyers of trading cards doubled, and existing buyers purchased more items at higher prices than last year. To dramatically simplify selling, we've recently launched image based scanning for our top selling trading cards. In addition, we introduced a new, low cost track and shipping service, and aggressively market it to buyers on social and enthusiast forums. We plan to launch more innovation for trading cards throughout this year. Another area of focus for us is customization. Beginning next month, in the U.K. and Germany, we will offer a new capability, to all sellers to offer personalized goods in categories such as home, fashion and jewelry. This will allow buyers to find and enter specific customization requests to the seller. In the past, this process was manual, which limited GMV. But we believe this new experience can significantly improve customer satisfaction, bring more supply onto the platform and capture more growth. We plan to expand this capability to all major markets in the coming months. As I mentioned upfront, our playbook to grow the core is working. We have a series of innovations rolling out to more markets throughout the year. While we've only touched a small percentage of global volume so far, all of our largest eBay categories, collectibles, home and garden, fashion, electronics and parts and accessories have addressable opportunities that can benefit from this playbook. In addition to category-specific changes, we are rolling out site-wide improvements for all sellers. For consumer sellers and small businesses, we are focused on significantly reducing complexity, helping maximize value and driving sustainable growth. We believe these changes will increase seller satisfaction and grow the number of active sellers on the platform. Here are some examples of what we are doing. Image-based listing can remove up to 75% of the time it takes to list an item. We have activated this feature in trading cards, and we plan to expand to multiple categories and geographies throughout the year. Last quarter, we talked about how we have migrated almost all of our store subscribers to our new platform that increases traffic to their items by approximately 20%. This quarter, we empowered sellers with new CRM features, allowing them to directly issue coupons to acquire buyers. In addition, they can set coupon budgets, include QR codes on packing slips and drive repeat business to their eBay stores. Recently, we opened up Thera Peak product research free for all Seller Hub users in several markets, including price insights and listing quality reports. In addition, we launched sourcing insights that help sellers analyze trending categories, top products and signals what inventory is most likely to sell. To acquire more buyers, we are also adding new ad formats to our display and social marketing, including video, and we improved the inventory feeds that power them. Once we acquire these buyers, we are making changes to increase engagement and trust in their first 90 days and beyond. As an example, we are leveraging a mobile-first approach and revamping key communications buyers received. We are seeing increased engagement from Gen Z and millennial customers through social shopping such as eBay Sneaker Showdown, For our experienced buyers, we continue to optimize the end-to-end shopping experience. In Q1, we increased conversion by improving our search engine's understanding of longer complex queries, and we added functionality to help buyers identify free local pickup items in their community. We are excited that all 3 of our strategic pillars are producing volume, seller and buyer growth, but we have a long runway ahead of us. We will continue to drive our investment decisions, both organic and inorganic in pursuit of achieving this vision. While I'm pleased with our business results, I am more proud of the way our employees and our platform are fulfilling our purpose of providing economic opportunity for all. As part of our commitment to empowering small businesses everywhere, we announced an investment of $25 million into the Clear Vision Impact Fund, to help support small- and medium-sized, minority-owned businesses that support historically underserved communities. We continue to support the U.K.'s National Health Care Service efforts, and I'm happy to report that we're now up to 2 billion PPE items distributed utilizing eBay's technology. Additionally, we remain active in philanthropy during Q1. We raised over $35 million through eBay for charity. The company also contributed to Asian Americans Advanced Justice and supported employee giving during Black History Month and the Lunar New Year, and we quadrupled employee matching gift limits through the eBay Foundation. Finally, another area that inspires me is eBay's impact on the planet. Many companies make admirable investments into adjacent programs, but at eBay, sustainability is the core of our business. Since eBay was founded over 25 years ago, re-commerce, or the resale of preowned goods, has been an integral part of our platform and purpose. Our community connects and trades pre-owned items that hold meaning and usefulness and keeps these items out of landfills. A recent survey confirmed that re-commerce resonates with our customers. In the U.S., 87% of respondents say they have sold preowned goods in the last 12 months. And they aren't just selling, 81% of Gen V customers surveyed said that buying pre-owned items has become more common in the last year. In summary, we are making great progress on the tech library [ imagination ] of eBay. We delivered historically strong Q1 results, putting us in a stronger position today than we thought we'd be coming into the year. Looking forward, we are excited because our long-term strategy is working. By increasing customer satisfaction, we are accelerating our core business while attracting and retaining sellers and buyers. There is more work to do, but I couldn't be prouder of the eBay team. They are focused and driven and they work hard every day to innovate, keeping our customers at the forefront. With that, I'll turn the call over to Andy to provide more details on our financial performance. Andy?"
