"companyid","keydevid","transcriptid","headline","mostimportantdateutc","keydeveventtypename","companyname","speakertypename","componenttextpreview","word_count","componenttext"
27862,1673836192,2374081,"eBay Inc., Q2 2021 Earnings Call, Aug 11, 2021",2021-08-11,"Earnings Calls","eBay Inc.","Executives","Good afternoon. Thank you for joining us, and welcome to eBay's earnings release conference call for the second quarter of 2021. Joining me today on the call are Jamie Iannone, our Chief Executive Officer; and Steve Priest, our Chief Financial Officer. We",259,"Good afternoon. Thank you for joining us, and welcome to eBay's earnings release conference call for the second quarter of 2021. Joining me today on the call are Jamie Iannone, our Chief Executive Officer; and Steve Priest, our Chief Financial Officer. We're providing a slide presentation to accompany Steve's commentary during the call, which is available through the Investor Relations section of the eBay website at investors.ebayinc.com.
Before we begin, I'd like to remind you that during the course of this conference call, we will discuss some non-GAAP measures related to our performance. You can find the reconciliation of these measures to the nearest comparable GAAP measures in the slide presentation accompanying this conference call. Additionally, all revenue and GMV growth rates mentioned in Jamie's and Steve's remarks represent FX-neutral year-over-year comparisons unless they indicate otherwise.
In this conference call, management will make forward-looking statements, including, without limitation, statements regarding our future performance and expected financial results. These forward-looking statements involve known and unknown risks and uncertainties, and our actual results may differ materially from our forecast for a variety of reasons. You can find more information about risks, uncertainties and other factors that could affect our operating results in our most recent periodic reports on Form 10-K and Form 10-Q in our earnings release from earlier today. You should not rely on any forward-looking statements.
All information in this presentation is as of August 11, 2021, and we do not intend and undertake no duty to update this information. With that, let me turn it over to Jamie."
27862,1673836192,2374081,"eBay Inc., Q2 2021 Earnings Call, Aug 11, 2021",2021-08-11,"Earnings Calls","eBay Inc.","Executives","Thanks, Joe. Good afternoon, everyone, and thank you for joining us. Today, I'll begin the call with key highlights from the second quarter. Then I will share some updates on the progress towards our strategic vision. At the end of my remarks, I will turn",2213,"Thanks, Joe. Good afternoon, everyone, and thank you for joining us. Today, I'll begin the call with key highlights from the second quarter. Then I will share some updates on the progress towards our strategic vision. At the end of my remarks, I will turn the call over to Steve, our new CFO, who will discuss our financial performance and outlook in greater detail.
The second quarter of 2021 marks several important milestones in the ongoing transformation of eBay, and I want to thank our team for making it happen. We have accelerated our pace of innovation while executing several complex transactions. Their dedication and focus has created tremendous value for our customers and shareholders. Let me start with a few of our portfolio enhancements.
We completed the transition of eBay's Classifieds business to Adevinta. This deal was originally valued at approximately $9.2 billion, but a closing in June had appreciated to $13.3 billion. Shortly after closing, we announced the deal with Permira to sell approximately $135 million of our Adevinta shares for over $2.4 billion. This agreement fulfills regulatory commitments while returning value to eBay's shareholders. We also increased our share buyback plan for the year from $2 billion to $5 billion.
In June, we announced the sale of over 80% of our Korean business to Emart for approximately $3 billion bringing together 2 -- e-commerce and retail companies that can unlock significant potential in Korea. We anticipate the deal will close either later this year or in early 2022. These portfolio changes allow us to intensify our focus on the core eBay business moving forward.
When I spoke to you last July, I outlined a renewed vision and strategic plan for the company. We set out on a multiyear journey to become the best global marketplace for sellers and buyers through a tech-led reimagination. Our priorities were to grow the core, become the platform of choice for sellers and to cultivate lifelong trusted relationships with buyers by turning them into enthusiasts. To date, our progress is very encouraging. Our underlying growth is positive and the strategy is working.
Q2 results were strong and all key business metrics met or exceeded expectations. Revenue grew 11% driven by acceleration in the payments migration and advertising growth. We funded incremental investments in product development while delivering $0.99 of non-GAAP EPS, above the high end of our range. As expected, GMV declined 11% when compared to last year when results were heavily impacted by the initial pandemic lockdown. Importantly, compared to pre-pandemic levels 2 years ago, we are seeing positive underlying GMV growth.
Our customer metrics remain healthy on both sides of our marketplace. Active sellers grew 5% to 19 million globally as more small businesses and consumers continue to turn to eBay's global platform to reach millions of potential customers from around the world. This quarter, global active buyers totaled 159 million down 2% versus last year and up 3% versus 2019. We have been focused on building lifelong trusted relationships with enthusiast buyers. Changes in our marketing mix and product investments have been focused on attracting and retaining these enthusiasts, particularly Gen Z and millennials.
In parallel, we have discontinued legacy tactics that led to low-value, infrequent or one-and-done buyers. Our buyer base is starting to evolve based on this strategy. These high-value buyers are growing compared to a year ago, and their spend on eBay is growing even faster. This higher quality mix of buyers increases value for sellers, and will lead to improved health of our ecosystem over the long term.
Moving on from buyer trends, the payments and advertising initiatives continue to deliver a simpler product experience and meaningful benefits for sellers, buyers and shareholders. Managed payments is now live in every market globally and the transition is progressing faster than expected. During the second quarter, we processed 71% of on-platform volume through managed payments. We exited Q2 at a run rate over 80% and are on track to process over 90% this quarter.
Managing the payments experience ourselves enables us to eliminate a pain point that sellers occasionally face on eBay, unpaid items. Changes to checkout have been made to address this issue, and today, 99% of fixed-price transactions are paid upfront. We have also started to address this issue for best offers and auctions by asking buyers to provide a payment method in order to bid. This is a significant win for sellers as it frees up inventory and reduces their post-transaction costs.
Our advertising business continues to perform well. In Q2, ad revenue outpaced volume driven by Promoted Listings, which delivered almost $224 million, up 8%. More than 1.4 million sellers promoted over 430 million listings during the quarter. Growth was driven by higher adoption and technology improvements that increased conversion.
We see tremendous growth opportunities in advertising, both from our existing Promoted Listings offerings and from new product innovations. Following a number of successful trials in Q2, we are scaling several new products globally over the next few months. Previously, sellers can only promote fixed-price listings, but now they can increase visibility for a flat fee on auctions to increase conversion.
In June, we also introduced a cost-per-click ad product to sellers in our major markets. Initial results from the first 100,000 listings showed that sellers' return on ad spend was higher than industry benchmarks. We are placing more AI-powered recommendations for pricing and keyword bidding into the Seller Hub to help sellers drive particular buying.
Finally, we are beginning to syndicate ads off eBay platform to drive more buyers to listings. Importantly, sellers maintain control of pricing and visibility while benefiting from the scaled marketing capabilities of eBay. In addition to advertising and payments, we are driving a number of other site-wide initiatives. For consumer sellers, we are simplifying the selling process with a heavy focus on mobile. This includes easier label printing solutions in the app and faster listing through image or barcode scans. In trading cards where we first launched image-based listing, sellers are able to match scans over 80% of the time. The time it takes to create a listing has been dramatically reduced, and we plan to expand the capability to more product categories later this year.
For small business sellers, we continue to expand and optimize their eBay toolkit. To help drive repeat businesses from enthusiasts to eBay stores, we built a CRM tool that enables sellers to fund and distribute their own coupons. Since launching a few months ago, over 1 million buyers have purchased items through these targeted campaigns.
As you've heard me say in the past, we are focused on a number of categories where we are well positioned to serve both sellers and buyers. These categories are growing significantly faster than the overall business, and I'm delighted with the progress our team is making. Our innovation playbook has included increasing customer satisfaction, improving trust, growing supply and marketing to enthusiasts.
As we exited Q2, we have applied this playbook to approximately 10% of our volume across our top 3 markets. With our current plan and ongoing momentum, we expect to expand coverage to approximately 20% by the end of the year.
One of these categories is trading cards. In North America, we continue to see substantial growth with approximately $2 billion of GMV in the first half of the year, equal to all of 2020. Despite these strong results, we see additional untapped potential in the market that we plan to capture with further innovation. We recently launched price guide and collection tools aimed at trading card enthusiasts. These new features leverage unparalleled inventory and pricing data, allowing customers to view, manage and track the value of their collections in real time. As a leader in trading cards with 25 years of transactional data, no one is better positioned to estimate the value of every card ever sold.
In addition, the collection tool seamlessly tracks all eBay activity and off-line inventory in one place. This makes it easy for enthusiasts to assess opportunities, quickly trade and increase the value of their collections.
Sneakers and watches continue to outgrow our overall marketplace. Since launching 1 year ago, we have authenticated nearly 1 million items, enabling a game-changing level of trust. Both categories are seeing close to 90% customer satisfaction rates on authenticated transactions.
Our sneakers business saw strong double-digit growth despite tougher comps from a year ago. And based on the success, we have expanded sneaker authentication to the U.K., Canada and Australia.
Luxury watches are also sustaining double-digit growth. Improved buyer trust is leading to strong cross-category shopping behavior, similar to what we have seen in sneakers. In fact, luxury watch buyers spent $8,000 on more than 50 items in other categories, well above the average eBay buyer.
The next luxury category we are focused on is handbags. We plan to leverage a similar playbook from watches and sneakers to deliver higher NPS for buyers and sellers. We have started in the U.S. by authenticating handbags over $500 from major brands.
Refurbished electronics continues to be another area of growth across our largest markets. Our Certified Refurbished experience is strengthening relationships with best-in-class brands by opening new sales channels. We recently welcomed Samsung Galaxy to the program providing eBay buyers access to exclusive like-new products at exceptional prices.
Vehicles parts and accessories has historically been one of the strongest-performing categories on eBay and remain so today. Our platform offers a wide inventory selection supported by a robust catalog. The Fitment shopping experience matches car parts to vehicles to help buyers shop efficiently and confidently. In Q2, we expanded this capability by enabling a motorcycle parts finder in Germany and the U.K. We also expanded the my garage feature, which allows buyers to store their vehicle data leading to a more tailored shopping experience to Canada, Italy, France and Spain. We plan to launch more technology-driven innovations in this category later this year to further build on our success.
Taking a step back, eBay exists to create economic opportunity for all. That purpose guides our approach to our customers, our communities and our team at eBay. This year, our leadership team's individual goals focus on accelerating meaningful change in diversity, equity and inclusion throughout every level of our company.
We formed an ESG Council composed of senior leaders across the company whose role is to guide and ensure the success of sustainability initiatives. During the quarter, we published our fifth annual impact report and third annual diversity, equity and inclusion report detailing the progress we made in the past year as well as outlining our 2025 goals. The full list of activities is extensive but I would like to share a few highlights.
We made progress on our journey to be more diverse, equitable and inclusive. Our communities of inclusion have conducted 150 events with more than 10,000 attendees in the past year. We have also continued multiyear efforts to ensure gender pay equity, resulting in 100% pay parity in the U.S. and 99.7% globally.
Another priority is managing our environmental impact. Investing in clean energy is a focus for the company, and our goal is to source 100% renewable energy by 2025. We have already reached 74% of our goal through a combination of power purchase agreements and local programs.
Just last week, we announced that we are teaming up with McDonald's in an agreement with Lightsource BP to purchase power from Louisiana's largest solar project. The electricity produced will be greater than the power used at our largest data center.
Finally, I would like to call out the incredible generosity of our buyers and sellers. During Q2, customers contributed over $35 million to their favorite causes through eBay for Charity. This represented a 16% growth versus last year, and the platform is on track to hit the 2025 goal of raising $600 million. These are just a sample of the ongoing ESG-related activities, and I encourage you to check out more at ebayinc.com.
Q2 is another step forward in the multiyear transformation of eBay. The business delivered strong results, and it's clear that our strategy is working. Customers are delighted with the innovation in our focus categories, leading to volume growth despite tougher comps from a year ago. We are harnessing the power of next-gen technology to make eBay the seller platform of choice and to attract lifelong enthusiasts.
Our payments transition is nearly complete, delivering benefits to sellers, buyers and shareholders. Our advertising product portfolio is expanding, giving sellers more tools to grow their business. And we simplified our portfolio, enabling us to focus on the core while creating significant shareholder value.
Our team continues to be relentlessly focused on executing for our customers. I'm delighted to welcome 4 new exceptional leaders to our executive team this year. In addition, we have hired critical talent in areas such as technology, AI, analytics and category management. The teams in place are well positioned to propel this business forward.
With that, I'll turn the call over to Steve to provide more details on our financial performance. Before I do, I want to say how excited I am to have another world-class, customer-centric leader on our team to help us realize our vision. Steve, over to you."
