"companyid","keydevid","transcriptid","headline","mostimportantdateutc","keydeveventtypename","companyname","speakertypename","componenttextpreview","word_count","componenttext"
296181,1673317714,2362464,"Exelon Corporation, Q2 2021 Earnings Call, Aug 04, 2021",2021-08-04,"Earnings Calls","Exelon Corporation","Executives","Julien. So while we're certainly very grateful for the attention in washing to in Washington to the importance of continuing the operation of the existing fleet in order to achieve climate goals. What's going on is there are a number of policy tools that",274,"Julien. So while we're certainly very grateful for the attention in washing to in Washington to the importance of continuing the operation of the existing fleet in order to achieve climate goals. What's going on is there are a number of policy tools that are under discussion and I'll sort of take them in order, while there, as Chris mentioned, has been a production tax credit for nuclear introduced in both the House and Senate, discussions of a clean energy standard potentially being developed for the reconciliation bill. And you asked about CMC, I think what you mean is cobrand program that has been discussed potential inclusion in the infrastructure bill. So those are three very different kinds of policy solutions. The first 2 being far more comprehensive and ones that, as you mentioned, in Maryland, Pennsylvania and other states, in the existing nuclear team potentially seeing a significant amount of support. And as Chris said, providing a real benefit to the climate. The grad program a little bit more challenging and more limited given the limited amount of funding that will be available under that program at least as it's currently drafted. The real point though, is that all of these programs are [indiscernible] just sort of proposed programs. Nothing has yet been enacted as you know. And so while we're watching it very closely and again, very grateful for the growing amount of support for preserving fleet through federal legislation. The reality is that, as Chris said, we need to make decisions based on laws that have actually been enacted and nothing has yet come to fruition in D.C. as of yet."
296181,1673317714,2362464,"Exelon Corporation, Q2 2021 Earnings Call, Aug 04, 2021",2021-08-04,"Earnings Calls","Exelon Corporation","Analysts","No, I appreciate that very much. if I can give us the business or the attention to the other side of the business a bit more. As you think about opportunities describing from your peers on carbon-free attributes and specifically some of the new novel offt",86,"No, I appreciate that very much. if I can give us the business or the attention to the other side of the business a bit more. As you think about opportunities describing from your peers on carbon-free attributes and specifically some of the new novel offtakers like miners, can you speak to the willingness with some of your counterparties, especially considering the extent of your C&I relationships already to perhaps pay a premium and contract directly with some of your nuclear assets, if you don't mind?"
296181,1673317714,2362464,"Exelon Corporation, Q2 2021 Earnings Call, Aug 04, 2021",2021-08-04,"Earnings Calls","Exelon Corporation","Executives","I'll let Joe start and then Jim can jump in making sure we've got your question right here.",19,"I'll let Joe start and then Jim can jump in making sure we've got your question right here."
296181,1673317714,2362464,"Exelon Corporation, Q2 2021 Earnings Call, Aug 04, 2021",2021-08-04,"Earnings Calls","Exelon Corporation","Executives","Yes, Julien, if I understand your question, I think you're asking with some of the what some of these larger companies and customers are looking for, is there an opportunity with our carbon-free generation to marry to them?  And there is -- I'm sorry, g",46,"Yes, Julien, if I understand your question, I think you're asking with some of the what some of these larger companies and customers are looking for, is there an opportunity with our carbon-free generation to marry to them?  
And there is -- I'm sorry, go ahead."
296181,1673317714,2362464,"Exelon Corporation, Q2 2021 Earnings Call, Aug 04, 2021",2021-08-04,"Earnings Calls","Exelon Corporation","Analysts","Yes, exactly.",2,"Yes, exactly."
296181,1673317714,2362464,"Exelon Corporation, Q2 2021 Earnings Call, Aug 04, 2021",2021-08-04,"Earnings Calls","Exelon Corporation","Executives","Yes. So I think there is, and that's something that the Constellation team is looking at, and we've created some products already -- When you look at renewable offtakes that we back to third-party customers, large third-party commercial industrial custome",76,"Yes. So I think there is, and that's something that the Constellation team is looking at, and we've created some products already -- When you look at renewable offtakes that we back to third-party customers, large third-party commercial industrial customers, and we had some success in different areas doing that as well as some of the things you mentioned these large mining companies cryptocurrency type companies, and I'll let Jim fill in the blanks on there."
296181,1673317714,2362464,"Exelon Corporation, Q2 2021 Earnings Call, Aug 04, 2021",2021-08-04,"Earnings Calls","Exelon Corporation","Executives","Yes. Thanks, Joe. Julien. Yes, we definitely had a lot of demand from our customers for multiple areas of interest, right, in order for them to hit their sustainability targets. Are they interested in carbon-free energy, renewable energy both. And we've h",171,"Yes. Thanks, Joe. Julien. Yes, we definitely had a lot of demand from our customers for multiple areas of interest, right, in order for them to hit their sustainability targets. Are they interested in carbon-free energy, renewable energy both. And we've had some success in selling emission-free energy credits and other renewable type products to some of our larger C&I customers. They're also interested in just sustainability information and data around energy usage and how to be more efficient. So there's there's kind of this burgeoning suite of different products and services that we're working through with our team and with our customers that they're very interested in. And we certainly have also seen the demand for direct offtakes and large energy purchases for both data centers and mining as well as also people that are interested in the hydrogen business. So we have a pipeline of activity and different products and services that we're talking to our customers about. And we'll have more to come on that as that develops."
296181,1673317714,2362464,"Exelon Corporation, Q2 2021 Earnings Call, Aug 04, 2021",2021-08-04,"Earnings Calls","Exelon Corporation","Operator","The next question will be from Stephen Bird of Morgan Stanley.",11,"The next question will be from Stephen Bird of Morgan Stanley."
296181,1673317714,2362464,"Exelon Corporation, Q2 2021 Earnings Call, Aug 04, 2021",2021-08-04,"Earnings Calls","Exelon Corporation","Analysts","I wanted to just focus on the Texas assets for a little bit. There's been a lot of movement in terms of market design and a lot of those moves seen constructed, the 4 curves moved up a lot. I was just curious your latest thoughts in terms of how satisfied",90,"I wanted to just focus on the Texas assets for a little bit. There's been a lot of movement in terms of market design and a lot of those moves seen constructed, the 4 curves moved up a lot. I was just curious your latest thoughts in terms of how satisfied are you with the improvements in market design? I know I think it was a question in terms of whether those assets would be a fit unless there were improvements. What's your general take on the progress in Texas?"
296181,1673317714,2362464,"Exelon Corporation, Q2 2021 Earnings Call, Aug 04, 2021",2021-08-04,"Earnings Calls","Exelon Corporation","Executives","I'll let Kathleen start and then I'll finish on the actual plant themselves and what we're doing in what we see as a potential new market design.",28,"I'll let Kathleen start and then I'll finish on the actual plant themselves and what we're doing in what we see as a potential new market design."
296181,1673317714,2362464,"Exelon Corporation, Q2 2021 Earnings Call, Aug 04, 2021",2021-08-04,"Earnings Calls","Exelon Corporation","Executives","Stephen. So I think that the progress is a little bit slow. The ERCOT leadership and the [indiscernible] have really been focusing on how to react to what happened in February, and there's been, as you know, a lot of work associated with that. So the chan",159,"Stephen. So I think that the progress is a little bit slow. The ERCOT leadership and the [indiscernible] have really been focusing on how to react to what happened in February, and there's been, as you know, a lot of work associated with that. So the changes looking forward, I think are -- in some was helpful in that we have finally seen a proposal for how to address weatherization. But on the broader question of market design, there's a lot of discussion, but we do not yet at this point have some solid proposals that have been either filed or approved. So while there are a number of stakeholders working on ways to address changes to the ORDC curve or introducing new products into the market, in my view, there's not enough progress yet to evaluate whether we're going to see the kind of changes that will be necessary to prevent an event like [indiscernible] from happening again."
296181,1673317714,2362464,"Exelon Corporation, Q2 2021 Earnings Call, Aug 04, 2021",2021-08-04,"Earnings Calls","Exelon Corporation","Executives","So on the plant side, which should help inform what we need from the market side Brian Hanson, who's our Chief Operating Officer, who is on the phone for the Genco as a team -- technical team working through what the design basis temperature would be that",146,"So on the plant side, which should help inform what we need from the market side Brian Hanson, who's our Chief Operating Officer, who is on the phone for the Genco as a team -- technical team working through what the design basis temperature would be that we would have to install capital to be able to reach that. The plants in Texas were never designed for the weather that we saw and especially the duration of the weather that we saw. So if we go to something much lower in temperature as a design basis. We have to look at what adequately would preserve the piping trace is an insulation. Is it other type of barriers and what's the most economic way to get there? And Bryan, I don't know if you want to add anything, but that team is well underway at this point."
296181,1673317714,2362464,"Exelon Corporation, Q2 2021 Earnings Call, Aug 04, 2021",2021-08-04,"Earnings Calls","Exelon Corporation","Executives","Chris, I would just add, we've built the model that has some certain assumptions on temperature, wind speed, prolonged cgevity of the weather event that will calculate the engineering changes we need to make to the plant, in which case then we'll be able",82,"Chris, I would just add, we've built the model that has some certain assumptions on temperature, wind speed, prolonged cgevity of the weather event that will calculate the engineering changes we need to make to the plant, in which case then we'll be able to price that out. And then once the weatherization standards are published and accepted in [indiscernible] we can then tune that model to come up with our final outcomes and then establish the price points for those plants."
296181,1673317714,2362464,"Exelon Corporation, Q2 2021 Earnings Call, Aug 04, 2021",2021-08-04,"Earnings Calls","Exelon Corporation","Executives","And that will definitely have to feed into what ERCOT is doing on market design. Just as we saw in PJM some years back on the reliability standards that they were looking for. There was an expense to that. We all were willing or many of us were willing to",73,"And that will definitely have to feed into what ERCOT is doing on market design. Just as we saw in PJM some years back on the reliability standards that they were looking for. There was an expense to that. We all were willing or many of us were willing to invest that into that reliability, but we have to have some assurance that we're going to get a return on that invested capital."
296181,1673317714,2362464,"Exelon Corporation, Q2 2021 Earnings Call, Aug 04, 2021",2021-08-04,"Earnings Calls","Exelon Corporation","Analysts","All very helpful. And it's fair that we still have to wait and see how the rules developed to figure out sort of what your stance is with those assets. So that's all very fair. I wanted to shift over to the utility. You gave a very good thorough update on",116,"All very helpful. And it's fair that we still have to wait and see how the rules developed to figure out sort of what your stance is with those assets. So that's all very fair. I wanted to shift over to the utility. You gave a very good thorough update on the utility. I wanted to just step back, at a high level, utility is already an above-average grower, but I was just curious, are there -- what are the biggest categories of sort of upside potential in terms of growth of the utility business that you're most excited about really a multiyear period, not so much in the near term, but sort of longer term?"
296181,1673317714,2362464,"Exelon Corporation, Q2 2021 Earnings Call, Aug 04, 2021",2021-08-04,"Earnings Calls","Exelon Corporation","Executives","Let me turn it over to Calvin Butler.",8,"Let me turn it over to Calvin Butler."
296181,1673317714,2362464,"Exelon Corporation, Q2 2021 Earnings Call, Aug 04, 2021",2021-08-04,"Earnings Calls","Exelon Corporation","Executives","Thanks, Steve. I would sit back and say our opportunities is really in partnering with each of our jurisdictions to understand what their needs are and how we're really hardening the system and building resiliency throughout. As you sit back and look, I t",149,"Thanks, Steve. I would sit back and say our opportunities is really in partnering with each of our jurisdictions to understand what their needs are and how we're really hardening the system and building resiliency throughout. As you sit back and look, I think our efforts around our path to clean, as Chris talked about and Joe talked about earlier, is really understanding where they're taking us and electrifying our entire distribution system. Also in really setting up our gas distribution system for the future. And replacing that infrastructure is also a key ingredient in several of our jurisdictions. In addition to that, around the security of the overall system as well. So when we look at where we're going, electrifying our vehicle fleet, electrification of our system, the replacement of our gas system and also ensuring that it's secure are really our opportunities across each of our jurisdictions."
296181,1673317714,2362464,"Exelon Corporation, Q2 2021 Earnings Call, Aug 04, 2021",2021-08-04,"Earnings Calls","Exelon Corporation","Operator","The next question will be from Steve Fleishman at Wolfe Research.",11,"The next question will be from Steve Fleishman at Wolfe Research."
296181,1673317714,2362464,"Exelon Corporation, Q2 2021 Earnings Call, Aug 04, 2021",2021-08-04,"Earnings Calls","Exelon Corporation","Analysts","My questions are focused on Illinois. Just we have seen a decent move up in power prices recently. And particularly, I guess, in the near term, just any sense on -- is there any chance that, that could be enough to wait this out longer with the plants?",48,"My questions are focused on Illinois. Just we have seen a decent move up in power prices recently. And particularly, I guess, in the near term, just any sense on -- is there any chance that, that could be enough to wait this out longer with the plants?"
296181,1673317714,2362464,"Exelon Corporation, Q2 2021 Earnings Call, Aug 04, 2021",2021-08-04,"Earnings Calls","Exelon Corporation","Executives","I can give you the beginning, which is the end and then Joe can fill in the blanks No. It doesn't give us what we need. But Joe...",28,"I can give you the beginning, which is the end and then Joe can fill in the blanks No. It doesn't give us what we need. But Joe..."
296181,1673317714,2362464,"Exelon Corporation, Q2 2021 Earnings Call, Aug 04, 2021",2021-08-04,"Earnings Calls","Exelon Corporation","Executives","Thank you, Chris, and Steve. It really isn't that simple. In certain Steve, is very important. As you know, the plants face near-term financial challenges, and as Chris said in his script, after legislation closes the Franplant is the right economic decis",164,"Thank you, Chris, and Steve. It really isn't that simple. In certain Steve, is very important. As you know, the plants face near-term financial challenges, and as Chris said in his script, after legislation closes the Franplant is the right economic decision and obviously not an easy one. I would tell you, we've seen an uptick in energy prices many times before, never of the help. And when you look at it at the front end of the power curve is up more materially than the back end of the power curve [indiscernible] price. In addition, we've seen capacity prices decline. The stability and certainty provided by a contract better address -- clearly better address the financial challenges of these plants without being exposed to all this market volatility. In addition, the term of the contract helps with things like capital planning and the efficiency of that, obviously, our workforce personnel planning. And we just think it's a much more certain outcome and fees."
296181,1673317714,2362464,"Exelon Corporation, Q2 2021 Earnings Call, Aug 04, 2021",2021-08-04,"Earnings Calls","Exelon Corporation","Analysts","I mean is there any appreciation that to the flip side that the law as proposed at least would actually be below where current price levels are in the near term?",31,"I mean is there any appreciation that to the flip side that the law as proposed at least would actually be below where current price levels are in the near term?"
296181,1673317714,2362464,"Exelon Corporation, Q2 2021 Earnings Call, Aug 04, 2021",2021-08-04,"Earnings Calls","Exelon Corporation","Executives","It's something that we see today, but we've seen this stance before. Something happens in the market, the near term rises, it's flat or low on the back side as we drift into the above years. We come right back down. And so we really have to focus on the l",161,"It's something that we see today, but we've seen this stance before. Something happens in the market, the near term rises, it's flat or low on the back side as we drift into the above years. We come right back down. And so we really have to focus on the long-term viability and the economics versus the cyclical nature of the markets, the lows and all the variables. We're agreeing to and support a significant renewable build-out within the legislation. We know that, that will have a depressing factor on prices as low demand periods with excess generation will bring the prices down, and that will drop not only the forwards, but the back here. So it's -- there's consumer protection in the legislation that ensures we don't over earn, but the -- to bet on the come that these forwards are going to maintain and eventually lift the out years is a gamble that we're not willing to take."
296181,1673317714,2362464,"Exelon Corporation, Q2 2021 Earnings Call, Aug 04, 2021",2021-08-04,"Earnings Calls","Exelon Corporation","Analysts","I guess my other question just on the law is it doesn't seem like anyone, as you mentioned, is debating the nuclear provisions, but the issue, as I guess the governor said, is that that -- as he kind of commented on the labor unions that they're preventin",90,"I guess my other question just on the law is it doesn't seem like anyone, as you mentioned, is debating the nuclear provisions, but the issue, as I guess the governor said, is that that -- as he kind of commented on the labor unions that they're preventing potential job loss in 2045 over certain job loss in 2021. Just -- can you maybe -- do the union group not believe you're shutting the plants or -- are they just willing to take potential benefits in 2045 over 2021?"
296181,1673317714,2362464,"Exelon Corporation, Q2 2021 Earnings Call, Aug 04, 2021",2021-08-04,"Earnings Calls","Exelon Corporation","Executives","First of all, let me make it clear. We're not engaged and involved in that negotiation. And as far as the shutdown of the coal and the jobs issues that go along with that. We understand what the union is asking for. We understand what the governor is aski",172,"First of all, let me make it clear. We're not engaged and involved in that negotiation. And as far as the shutdown of the coal and the jobs issues that go along with that. We understand what the union is asking for. We understand what the governor is asking for, and it's put on the lap of the legislative body to figure out what's the right thing to meet the state goals, continue to have adequate employment certainty. And so it's a tough situation. But I can say that's not a fight that we're involved in. And we are very dependent on the support for our power plants to be maintained by our union partners, building trades in the IBW. They're very aware of the dire situation for the nuclear plants. So I don't think that their dedication to saving the jobs at these plants are in question. They have some other priorities and other constituents within their organizations that are dealing with issues. So I would just leave it at that."
296181,1673317714,2362464,"Exelon Corporation, Q2 2021 Earnings Call, Aug 04, 2021",2021-08-04,"Earnings Calls","Exelon Corporation","Executives","And the next question [indiscernible] JPMorgan.",6,"And the next question [indiscernible] JPMorgan."
296181,1673317714,2362464,"Exelon Corporation, Q2 2021 Earnings Call, Aug 04, 2021",2021-08-04,"Earnings Calls","Exelon Corporation","Analysts","Just wanted to turn to the storm offset for a second here, the $600 million-ish that you were targeting here from to offset. Just wondering if you could help update us as far as how that's progressing, where you see yourself versus what you're targeting,",54,"Just wanted to turn to the storm offset for a second here, the $600 million-ish that you were targeting here from to offset. Just wondering if you could help update us as far as how that's progressing, where you see yourself versus what you're targeting, how much is left to do at this point?"
296181,1673317714,2362464,"Exelon Corporation, Q2 2021 Earnings Call, Aug 04, 2021",2021-08-04,"Earnings Calls","Exelon Corporation","Executives","Yes. So we did achieve more in the second quarter than when we had done our planning originally what we would have expected to achieve. We expected most of the share [indiscernible] year. We've achieved somewhere between 20% and 25% of the offsets that we",141,"Yes. So we did achieve more in the second quarter than when we had done our planning originally what we would have expected to achieve. We expected most of the share [indiscernible] year. We've achieved somewhere between 20% and 25% of the offsets that we expected. And we said they would come in a number of areas, when you look at deferral of cost and onetime cost savings opportunities, whether it's things like contracting dollars, holding labor vacancies, reductions in travel and entertainment expense, deferring noncritical maintenance capital, those types of things. There were some revenue opportunities when you see the improvement in treasuries. We talked about our technology ventures investments. So we're ahead of what we expected to do at this point in the year, and we're continuing to work hard on delivering the balance of what we committed to."
296181,1673317714,2362464,"Exelon Corporation, Q2 2021 Earnings Call, Aug 04, 2021",2021-08-04,"Earnings Calls","Exelon Corporation","Analysts","Got it. That's very helpful there. And then turning towards the utility business as a whole here. Given the potential moving pieces at ComEd and then some positive outcomes, it seems like with Maryland and D.C. with the multiyear plans, better outlooks in",73,"Got it. That's very helpful there. And then turning towards the utility business as a whole here. Given the potential moving pieces at ComEd and then some positive outcomes, it seems like with Maryland and D.C. with the multiyear plans, better outlooks in those jurisdictions. How should we think about both the trajectory of utility earned ROEs? And how this might impact the 6% to 8% utility growth rate that you guys see?"
