"companyid","keydevid","transcriptid","headline","mostimportantdateutc","keydeveventtypename","companyname","speakertypename","componenttextpreview","word_count","componenttext"
296181,1684503709,2423002,"Exelon Corporation, Q3 2021 Earnings Call, Nov 03, 2021",2021-11-03,"Earnings Calls","Exelon Corporation","Executives","Chris, you captured it. It really goes around building the reliability and resiliency of our system. And I think as we lay out our multiyear plans and across our jurisdictions, it's understanding and really diving in, Stephen, in terms of what the custome",103,"Chris, you captured it. It really goes around building the reliability and resiliency of our system. And I think as we lay out our multiyear plans and across our jurisdictions, it's understanding and really diving in, Stephen, in terms of what the customers want in our jurisdictions. But the hardening and resiliency of our system is coming in the forefront in addition to fighting climate change. 
That's a big part of what we're doing and along with the security-related issues, as Chris has outlined. So those are opportunities in the areas but it's that partnership and really understanding what the jurisdictions are wanting."
296181,1684503709,2423002,"Exelon Corporation, Q3 2021 Earnings Call, Nov 03, 2021",2021-11-03,"Earnings Calls","Exelon Corporation","Executives","We can't run a system on the distribution side any longer at a [ 41 60 ] voltage level. We got to get up to [ 13 8 ] and that's going to take a significant investment to do that and that's to support the distributed generation. So there's a lot more work",57,"We can't run a system on the distribution side any longer at a [ 41 60 ] voltage level. We got to get up to [ 13 8 ] and that's going to take a significant investment to do that and that's to support the distributed generation. So there's a lot more work to be done."
296181,1684503709,2423002,"Exelon Corporation, Q3 2021 Earnings Call, Nov 03, 2021",2021-11-03,"Earnings Calls","Exelon Corporation","Operator","And our next question comes from Steve Fleishman from Wolfe Research.",11,"And our next question comes from Steve Fleishman from Wolfe Research."
296181,1684503709,2423002,"Exelon Corporation, Q3 2021 Earnings Call, Nov 03, 2021",2021-11-03,"Earnings Calls","Exelon Corporation","Analysts","So I guess 2 questions. First, on the Build Back Better infra bill. Just thoughts on the likelihood that, that passes. And if some reason it does not, how do you feel about opportunities to address nuclear PTCs and other bills if we somehow got there?",46,"So I guess 2 questions. First, on the Build Back Better infra bill. Just thoughts on the likelihood that, that passes. And if some reason it does not, how do you feel about opportunities to address nuclear PTCs and other bills if we somehow got there?"
296181,1684503709,2423002,"Exelon Corporation, Q3 2021 Earnings Call, Nov 03, 2021",2021-11-03,"Earnings Calls","Exelon Corporation","Executives","Well, Kathleen is earning her paycheck to ensure that it gets done so I'll let her answer the question.",19,"Well, Kathleen is earning her paycheck to ensure that it gets done so I'll let her answer the question."
296181,1684503709,2423002,"Exelon Corporation, Q3 2021 Earnings Call, Nov 03, 2021",2021-11-03,"Earnings Calls","Exelon Corporation","Analysts","Kathleen, make it 2 for 2.",6,"Kathleen, make it 2 for 2."
296181,1684503709,2423002,"Exelon Corporation, Q3 2021 Earnings Call, Nov 03, 2021",2021-11-03,"Earnings Calls","Exelon Corporation","Executives","Thanks, Steve. Yes, I think we're still feeling very confident about the Democrats' ability to get both infrastructure and Build Back Better across the finish line. There's, as you know, a strong proposal put out by the President that had support last wee",226,"Thanks, Steve. Yes, I think we're still feeling very confident about the Democrats' ability to get both infrastructure and Build Back Better across the finish line. There's, as you know, a strong proposal put out by the President that had support last week around a top line number that the group has apparently coalesced around. They have continued to work to flesh out the meat on the bone so that they can move this package quickly. And Senator Manchin has shared that he thinks that's doable, indeed even citing agreement with the Senate majority leader that it's possible this could get done by Thanksgiving. 
So I think there's broad consensus that action is needed, and in particular, on the clean energy tax package that there is sufficient support for the provisions that will get the country to a place where it can come close to meeting the 2030 carbon reduction goals. If for some reason, that does not occur, as you know, there's regularly action at the end of the year on a bipartisan basis to look at tax extenders. And we're, again, hopeful, given the amount of support that we've seen for support for the existing fleet that the nuclear provision could be considered as part of an end of the year bipartisan package if the Democrat BBB bill doesn't get across the finish line."
296181,1684503709,2423002,"Exelon Corporation, Q3 2021 Earnings Call, Nov 03, 2021",2021-11-03,"Earnings Calls","Exelon Corporation","Analysts","Okay. My other question related to that is just, I know there's a ton of detail of this, but just high level, how does the PTC interact with your existing state commitments for the different units or subsidies or laws and also your hedging and retail and",51,"Okay. My other question related to that is just, I know there's a ton of detail of this, but just high level, how does the PTC interact with your existing state commitments for the different units or subsidies or laws and also your hedging and retail and all that as well?"
296181,1684503709,2423002,"Exelon Corporation, Q3 2021 Earnings Call, Nov 03, 2021",2021-11-03,"Earnings Calls","Exelon Corporation","Executives","Do you want to start and then we'll...",9,"Do you want to start and then we'll..."
296181,1684503709,2423002,"Exelon Corporation, Q3 2021 Earnings Call, Nov 03, 2021",2021-11-03,"Earnings Calls","Exelon Corporation","Executives","Yes, I'll start off and pass it to Jim on the hedging question. But the short answer is that under the nuclear PTC, as drafted, revenues from a state program are not included at the state program would adjust to reflect the existence of the federal suppor",144,"Yes, I'll start off and pass it to Jim on the hedging question. But the short answer is that under the nuclear PTC, as drafted, revenues from a state program are not included at the state program would adjust to reflect the existence of the federal support. And almost all of our programs have some explicit reference to the fact that if there is subsequent federal support after the state program takes effect, that it will be reflected in the state calculation of the support under the program. 
So there clearly will need to be further proceedings to evaluate and have the state adjudicate how that federal support will be reflected. But assuming that the PTC passes, we would expect each of the states to take a look at that and for it to be reflected in the level of the state support. Jim?"
296181,1684503709,2423002,"Exelon Corporation, Q3 2021 Earnings Call, Nov 03, 2021",2021-11-03,"Earnings Calls","Exelon Corporation","Executives","Yes. And Steve, I think on the hedging, the best -- the details of implementation are going to really matter. But like for now, I think the right way to think about it is this effectively will serve as a hedge for a significant portion of our  generation,",205,"Yes. And Steve, I think on the hedging, the best -- the details of implementation are going to really matter. But like for now, I think the right way to think about it is this effectively will serve as a hedge for a significant portion of our  generation, right? If you take our nuclear fleet and we kind of reconcile what this -- what the PTC program will do and then kind of reflect what Kathleen just said about its impact on the state programs, the net result is you have a pretty highly hedged portfolio in the -- with the PTC. 
Now we'll get into the details about the exact settlement of it and exactly how it -- the implementation plan will be settled all the way through the prices in the -- all the way through to the spot market. The best way, I think, on the retail business for us is we'll be able to still win our customer business. We'll have a portfolio that's a little bit more hedged to begin with. We'll have purchases in the market to help us where we need to go, make additional purchase to help us serve the load portfolio that we'll continue to serve."
296181,1684503709,2423002,"Exelon Corporation, Q3 2021 Earnings Call, Nov 03, 2021",2021-11-03,"Earnings Calls","Exelon Corporation","Operator","And our next question comes from Julien Dumoulin-Smith from Bank of America.",13,"And our next question comes from Julien Dumoulin-Smith from Bank of America."
296181,1684503709,2423002,"Exelon Corporation, Q3 2021 Earnings Call, Nov 03, 2021",2021-11-03,"Earnings Calls","Exelon Corporation","Analysts","Congrats on the continued progress across all your various efforts here, so kudos going to Kathleen and team. But perhaps just to focus on one of the other topical issues of late. Uranium prices have been seeing a pretty sharp uptick of late. I suspect it",84,"Congrats on the continued progress across all your various efforts here, so kudos going to Kathleen and team. But perhaps just to focus on one of the other topical issues of late. Uranium prices have been seeing a pretty sharp uptick of late. I suspect it's not too [indiscernible] for you all, but I just want to make sure I understand how you all are thinking about that impacting sort of longer-term hedging and procurement activities and ultimately impact back to the core business."
296181,1684503709,2423002,"Exelon Corporation, Q3 2021 Earnings Call, Nov 03, 2021",2021-11-03,"Earnings Calls","Exelon Corporation","Executives","I think we're very well hedged through this period, and it's not like we haven't seen it before. But I'll let Bryan Hanson, our Head of the generating company, operations of the generating company answer that.",37,"I think we're very well hedged through this period, and it's not like we haven't seen it before. But I'll let Bryan Hanson, our Head of the generating company, operations of the generating company answer that."
296181,1684503709,2423002,"Exelon Corporation, Q3 2021 Earnings Call, Nov 03, 2021",2021-11-03,"Earnings Calls","Exelon Corporation","Executives","Yes. Thanks, Chris. We think today's market fundamentals are much improved from the last uranium bull market that we saw in 2008-2010 period. Demand is lower, primary mining supply has increased and utility inventories are higher. We at Exelon, we hedge w",156,"Yes. Thanks, Chris. We think today's market fundamentals are much improved from the last uranium bull market that we saw in 2008-2010 period. Demand is lower, primary mining supply has increased and utility inventories are higher. We at Exelon, we hedge with a diverse portfolio of fuel contracts that include varying pricing mechanisms or varying horizons with a diverse group of qualified and reliable suppliers. 
And we maintain a strategic inventory, both to ensure security of supply for our reactors and to provide flexibility and purchase timing in the event of a market disruption like we're seeing today. We even maintain or keep our uranium inventory in different material states such as yellow cake or uranium hexafluoride gas. So we think we're well hedged and well ready for this current bull market. We are looking in the forward part of the LRP for any opportunities, and they're all well within our expectations that we see today."
296181,1684503709,2423002,"Exelon Corporation, Q3 2021 Earnings Call, Nov 03, 2021",2021-11-03,"Earnings Calls","Exelon Corporation","Executives","That would be [ UFS 6 ]?",6,"That would be [ UFS 6 ]?"
296181,1684503709,2423002,"Exelon Corporation, Q3 2021 Earnings Call, Nov 03, 2021",2021-11-03,"Earnings Calls","Exelon Corporation","Executives","UFS 6. Very good, Chris.",5,"UFS 6. Very good, Chris."
296181,1684503709,2423002,"Exelon Corporation, Q3 2021 Earnings Call, Nov 03, 2021",2021-11-03,"Earnings Calls","Exelon Corporation","Analysts","There we go. Excellent. I appreciate it. And then just on the hydrogen side, I heard the comment about partnering with Nel here, scaling into commercial opportunities to the extent available in '22. Can you talk a little bit more about what that opportuni",103,"There we go. Excellent. I appreciate it. And then just on the hydrogen side, I heard the comment about partnering with Nel here, scaling into commercial opportunities to the extent available in '22. Can you talk a little bit more about what that opportunity means for you all? I mean, is this just about having a firm offtake or is this about having some portion of the economics over time? And I know it's early days, but I'm just curious to hear, at least as best you understand it, what that opportunity may be, especially considering the credits at hand here as well."
296181,1684503709,2423002,"Exelon Corporation, Q3 2021 Earnings Call, Nov 03, 2021",2021-11-03,"Earnings Calls","Exelon Corporation","Executives","Yes. I don't think we're ready to give a full business model on it right now. I think we've got a good partnership with the DOE. Exelon, like other utility companies, sees a great use for hydrogen if it's mixing it with natural gas to cut down the carbon",234,"Yes. I don't think we're ready to give a full business model on it right now. I think we've got a good partnership with the DOE. Exelon, like other utility companies, sees a great use for hydrogen if it's mixing it with natural gas to cut down the carbon loads or other ways, there's -- our strategy organization is still looking at the transportation methodology and they're doing some metallurgical research with other labs to make sure that we -- if we were replacing natural gas pipelines with hydrogen pipelines, that the embrittlement problem doesn't become severe. 
So what we need to do first is predict or perfect an efficient technology using our heat and steam to develop the hydrogen, and then from there, continue to work with other stakeholders on where we put the hydrogen. Does it go in a mixed form with natural gas at first? Does it become, what was thought about 10 years ago, the hydrogen economy? And I don't think we're there yet. I think there's a lot of work to be done before we get there. 
But just having the grants and working with the labs and the government to start using a nuclear plant for something more than electricity because you get all that waste heat and steam that can be redirected into the development of very efficient hydrogen and then continue to move on from there."
296181,1684503709,2423002,"Exelon Corporation, Q3 2021 Earnings Call, Nov 03, 2021",2021-11-03,"Earnings Calls","Exelon Corporation","Analysts","Got it. Sorry, just to clarify this, I imagine you wouldn't touch on the subject of capital allocation, given the rise in commodity prices here and still equity needs. Still too early, right?",33,"Got it. Sorry, just to clarify this, I imagine you wouldn't touch on the subject of capital allocation, given the rise in commodity prices here and still equity needs. Still too early, right?"
296181,1684503709,2423002,"Exelon Corporation, Q3 2021 Earnings Call, Nov 03, 2021",2021-11-03,"Earnings Calls","Exelon Corporation","Executives","Yes. Yes, too early.",4,"Yes. Yes, too early."
296181,1684503709,2423002,"Exelon Corporation, Q3 2021 Earnings Call, Nov 03, 2021",2021-11-03,"Earnings Calls","Exelon Corporation","Analysts","Fair enough, we will leave it there. Best of luck here.",11,"Fair enough, we will leave it there. Best of luck here."
296181,1684503709,2423002,"Exelon Corporation, Q3 2021 Earnings Call, Nov 03, 2021",2021-11-03,"Earnings Calls","Exelon Corporation","Operator","And our next question comes from Shar Pourreza from Guggenheim Partners.",11,"And our next question comes from Shar Pourreza from Guggenheim Partners."
296181,1684503709,2423002,"Exelon Corporation, Q3 2021 Earnings Call, Nov 03, 2021",2021-11-03,"Earnings Calls","Exelon Corporation","Analysts","Joe, can you just maybe further unpack, I guess, the level of details and additional disclosures around the retail business that you kind of plan to talk about at the Analyst Day now that it's obviously a lot more in focus? And in the interim, maybe just",55,"Joe, can you just maybe further unpack, I guess, the level of details and additional disclosures around the retail business that you kind of plan to talk about at the Analyst Day now that it's obviously a lot more in focus? And in the interim, maybe just further elaborate on how we should think about..."
296181,1684503709,2423002,"Exelon Corporation, Q3 2021 Earnings Call, Nov 03, 2021",2021-11-03,"Earnings Calls","Exelon Corporation","Executives","It's Joe Nigro.",4,"It's Joe Nigro."
296181,1684503709,2423002,"Exelon Corporation, Q3 2021 Earnings Call, Nov 03, 2021",2021-11-03,"Earnings Calls","Exelon Corporation","Analysts","Nigro, when I think about the [ prom ] year and year 2 hedge profile, just given kind of the lack of disclosures and significant moves in the curves. I mean, a peer didn't obviously take as much advantage as expected. So maybe just a better sense here wou",54,"Nigro, when I think about the [ prom ] year and year 2 hedge profile, just given kind of the lack of disclosures and significant moves in the curves. I mean, a peer didn't obviously take as much advantage as expected. So maybe just a better sense here would help even if it's directionally."
296181,1684503709,2423002,"Exelon Corporation, Q3 2021 Earnings Call, Nov 03, 2021",2021-11-03,"Earnings Calls","Exelon Corporation","Executives","Yes. Let me answer the first question, Shar, and then I'll turn over the hedge question to Jim McHugh. As I've said previously, as we get closer to actual separation date, we plan to have an Analyst Day for both companies where we'll update all of the fin",147,"Yes. Let me answer the first question, Shar, and then I'll turn over the hedge question to Jim McHugh. As I've said previously, as we get closer to actual separation date, we plan to have an Analyst Day for both companies where we'll update all of the financial variables so you have a complete picture of both companies, and you'll get insight into -- on the Exelon side, all the things that we normally provide, including earnings trajectories and rate base growth and so on. 
And on the Constellation side, we'll give you the details with the updated hedge disclosures and all the other associated information that allows you to do your modeling. But that's not going to happen obviously until we get much more certainty and much closer to the actual execution of separation itself. And with that, Jim, I'll let you answer the hedge question."
296181,1684503709,2423002,"Exelon Corporation, Q3 2021 Earnings Call, Nov 03, 2021",2021-11-03,"Earnings Calls","Exelon Corporation","Executives","Sure. I'll talk about hedging. The outer years where we have less hedge, we've always talked about our ratable hedge program. We're still following that, right? We're not deviating a large deal from what we've historically talked about. I think the change",251,"Sure. I'll talk about hedging. The outer years where we have less hedge, we've always talked about our ratable hedge program. We're still following that, right? We're not deviating a large deal from what we've historically talked about. I think the change for 2022 has to be in relation to what we saw develop over the course of this quarter with the legislation, right? We had assets that we had previously said we're going to retire, and then the legislation passed, and we unretired. 
And what that effectively meant for 2022 is that before the contract goes into effect, it created a position that added extra generation linked to our portfolio that we've been able to, since then, hedge. But beyond -- then beyond May or June when the contract starts, effectively, those megawatts are hedged through the CMC contract. So the 2022 is just a little bit in a different beginning of the year, end of year story because effectively, the contracts are providing the hedge in the long run. We hedged the length that got added back to the book, largely speaking, in the beginning of the year during this price action that we saw this quarter so that's been a generally good development. And then in the outer years, we would still -- other than the contracted assets, we would still be following along our ratable hedge program. So there's the further out in time you go, the more open position here is as we've always had historically."
296181,1684503709,2423002,"Exelon Corporation, Q3 2021 Earnings Call, Nov 03, 2021",2021-11-03,"Earnings Calls","Exelon Corporation","Analysts","Got it. That's actually a pretty interesting point. And then just lastly, I know you guys are still working through the details, but could we just touch on maybe just how you're thinking about the SpinCo capital allocation, just even briefly, right? I mea",83,"Got it. That's actually a pretty interesting point. And then just lastly, I know you guys are still working through the details, but could we just touch on maybe just how you're thinking about the SpinCo capital allocation, just even briefly, right? I mean, your IPP peers have been very specific. Is this something we should -- we could see from Constellation? Just maybe some high-level thoughts on how you and the Board are thinking about approaching growth versus returning capital to shareholders."
296181,1684503709,2423002,"Exelon Corporation, Q3 2021 Earnings Call, Nov 03, 2021",2021-11-03,"Earnings Calls","Exelon Corporation","Executives","We're going through that modeling right now. As Joe Dominguez takes over and he puts his financial team together, they will be evaluating the best use of capital and what the opportunities are. Having a good investment grade gives us a little bit more opp",99,"We're going through that modeling right now. As Joe Dominguez takes over and he puts his financial team together, they will be evaluating the best use of capital and what the opportunities are. Having a good investment grade gives us a little bit more opportunity, and maybe what would somebody would call our peers that we don't think that they are our peers because of the hedged portion of the nuclear plants. But they -- we'll continue to evaluate that in the best way to create shareholder value. And Joe Dominguez, do you want to add any more?"
296181,1684503709,2423002,"Exelon Corporation, Q3 2021 Earnings Call, Nov 03, 2021",2021-11-03,"Earnings Calls","Exelon Corporation","Executives","No, I don't think I really can at this point. We're looking at it pretty carefully. As Chris said, we think we have some unique opportunities in this business around colocation of assets, hydrogen and other things that will depend on how the legislation p",80,"No, I don't think I really can at this point. We're looking at it pretty carefully. As Chris said, we think we have some unique opportunities in this business around colocation of assets, hydrogen and other things that will depend on how the legislation plays out and we've covered that. I think we'll have a lot more to say on Analyst Day. But at this point, we're really just studying options, pretty excited about the opportunities in front of us."
296181,1684503709,2423002,"Exelon Corporation, Q3 2021 Earnings Call, Nov 03, 2021",2021-11-03,"Earnings Calls","Exelon Corporation","Executives","One thing I can say is I don't see him building a new nuclear plant anytime soon.",18,"One thing I can say is I don't see him building a new nuclear plant anytime soon."
296181,1684503709,2423002,"Exelon Corporation, Q3 2021 Earnings Call, Nov 03, 2021",2021-11-03,"Earnings Calls","Exelon Corporation","Executives","I'll take that to the bank.",7,"I'll take that to the bank."
296181,1684503709,2423002,"Exelon Corporation, Q3 2021 Earnings Call, Nov 03, 2021",2021-11-03,"Earnings Calls","Exelon Corporation","Operator","And our next question comes from Jeremy Tonet from JPMorgan.",10,"And our next question comes from Jeremy Tonet from JPMorgan."
296181,1684503709,2423002,"Exelon Corporation, Q3 2021 Earnings Call, Nov 03, 2021",2021-11-03,"Earnings Calls","Exelon Corporation","Analysts","It's actually Ryan on for Jeremy. Just had 1 on the regulated business, and I kind of think understanding it's still early days, but the changes in kind of the framework at kind of Illinois and ComEd and how you're kind of thinking at this stage about kin",85,"It's actually Ryan on for Jeremy. Just had 1 on the regulated business, and I kind of think understanding it's still early days, but the changes in kind of the framework at kind of Illinois and ComEd and how you're kind of thinking at this stage about kind of those 2 different options that the multiyear plan versus kind of the traditional rate making and how that might impact kind of growth kind of customer bill impacts as we kind of approach that date."
