"companyid","keydevid","transcriptid","headline","mostimportantdateutc","keydeveventtypename","companyname","speakertypename","componenttextpreview","word_count","componenttext"
296181,710662861,2270398,"Exelon Corporation, Q1 2021 Earnings Call, May 05, 2021",2021-05-05,"Earnings Calls","Exelon Corporation","Executives","Thanks, Dan, and good morning, everybody, and thanks for joining us. As you've seen from our earlier releases and notifications, we had mixed results in the first quarter. We performed well across our businesses outside of the challenges from 5 days in",1180,"Thanks, Dan, and good morning, everybody, and thanks for joining us. 
As you've seen from our earlier releases and notifications, we had mixed results in the first quarter. We performed well across our businesses outside of the challenges from 5 days in February due to the Texas weather event. 
Overall, our first quarter GAAP loss was $0.30 per share and our non-GAAP loss was $0.06 per share. Exelon Utilities performed well operationally and financially during the quarter, delivering $0.72 per share, which is $0.11 better than the first quarter last year. At ExGen, we lost $0.58 per share overall, with the February weather event costing $0.90 per share in the first quarter. The event was unprecedented. We continue to investigate the multiple complex factors that led to our plant outages. And we are working with ERCOT regulators and other stakeholders to ensure an event like this does not happen again. 
As you saw in our 8-K last week, we updated our full year losses at $150 million due to the updated load meter data in ERCOT default payments that differed from our original estimate. In addition, we reaffirmed our full year guidance of $2.60 to $3 per share. We continue to work on mitigating this approximately $1 billion loss, and expect to offset the loss by $410 million to $490 million after taxes through a combination of mostly onetime cost reductions and deferral of nonessential maintenance and revenue opportunities. Joe is going to go in much more detail on that in his presentation. 
Turning to the operations. 
Despite the extreme cold winters, and the winter storms, the pandemic conditions, our utilities had a strong operational performance, delivering reliability, affordable electricity and gas for our consumers. All the utilities achieved first quartile operating performance in outage duration and frequency. BGE, ComEd and PHI were in top decile in outage duration. Customer operations metrics remained strong across the utilities. PECO and BGE's customer satisfaction levels were top decile. ComEd was top quartile. And PHI just missed top quartile, but improved year-over-year. 
On the generation front, in the face of extreme temperatures, winter storms, our nuclear plants provided 37 terawatt hours of reliable, resilient and clean to the grid of the citizens of Illinois, Pennsylvania, New York and Maryland. The fleet capacity factor of 95.3% was what we reached for the quarter. 
The spring has been active -- switching to policy. The spring has been active on the policy front with momentum building at both federal and state levels for policies that recognize the value of existing nuclear and would put the country on a path to a net 0 future. Both ExGen and the Utilities are well positioned to benefit from these policies and the transition to a clean energy economy. 
On the federal level, the Biden administration has set out an ambitious goal to reduce greenhouse gas emissions by 50% to 52% by 2030. Nuclear provides more than half of the carbon-free emission electricity in the U.S., with Exelon plants providing 12% of all the carbon-free energy in the United States. The administration is clear that preserving the existing nuclear fleet is key in meeting the goals that they have set. 
The administration's infrastructure proposal, the American Jobs Plan, would enact policies to help reach the goal. It includes a clean electricity standard that would require 100% clean electricity by 2035, with existing nuclear qualifying as clean; incentives to build 500,000 EV charging stations by 2030; and for 20 gigawatts of high-voltage transmission lines to be built to support the renewable build-out. We're encouraged that the administration and members of Congress recognize the importance of preserving the nuclear fleet to meet the country's clean energy and climate goals. The timing and the outcome of the federal legislation is highly uncertain. And in any case, it will be too late to reverse the retirement decisions for Byron and Dresden. 
Our states are also advancing clean energy policies. In Illinois, 6 energy policy reform bills have been introduced that would drive the transition to clean energy and then address climate change. The legislative leaders are meeting to craft a package from the various bills that can be considered this session. We're encouraged by the expression of support that continued -- for the continued operation of the nuclear plants. 
However, the details really matter. A bill needs to pass before the end of the regular session, and it needs to provide support for continuing to invest in the Illinois fleet. Current market prices do not continue to meet -- do not allow us to continue to meet our payroll, paying our property taxes, and covering other significant costs and risks of operating these assets. Without adequate policy, as I've stated to you, that we will retire uneconomic plants beginning this fall. 
If you take a look at what happened in New Jersey last week, the Board concluded that the financial challenges faced by nuclear plants there justified a maximum ZEC of $10 per megawatt hour. The same voices that are arguing in Illinois that our plants are profitable were overruled in New Jersey's decision. The commission in New Jersey emphasized that maintaining the existing nuclear plants was critical to achieving the state's emission goals and -- significantly less costly than replacing nuclear with other 0 free carbon generation. This is true in Illinois. Keeping the nuclear plants running is better option for the customers than trying to replace them with all renewables in storage. At 12x the cost, higher cost than preserving the nuclear plants, it would cost the Illinois consumers over $80 billion more to achieve the same admissions. We've been advocating for policy changes in Illinois for more than 2 years because I feel that we have a duty to our customers to preserve every opportunity to correct flawed policies and keep these critical energy resources running. But we're almost out of time, and we'll prematurely retire these assets in the fall if the policy reforms are not passed in this session. 
Turning to clean energy policy in Pennsylvania. The Senate is moving forward on a bill that would set a state goal for transportation, electrification and authorized electric utilities to develop EV infrastructure and plans authorize a recovery for these investments. 
We support these federal and state policy efforts and stand ready to enable this important transition to a clean energy future. Joe will talk about what our utilities are doing currently on EVs. 
Moving on to the separation update. Our team is working to get the separation done. We filed our applications for regulatory approval at FERC, the NRC, New York Public Service Commission in February. The NRC has indicated that our application is complete, and they expect to rule by November 30. In New York, comments are due on May 24. And we requested that the commission rule no later than their December 16 meeting. We're on track to get the necessary approvals so that we can close in the first quarter of next year. 
With that, I'll turn it over to Joe to go into the financial details."
296181,710662861,2270398,"Exelon Corporation, Q1 2021 Earnings Call, May 05, 2021",2021-05-05,"Earnings Calls","Exelon Corporation","Executives","Thank you, Chris, and good morning, everyone. Today, I will cover our first quarter results, quarterly financial updates and our hedge disclosures. Turning first to Slide 9. As Chris mentioned, we recorded a loss of $0.06 per share on a non-GAAP bas",1333,"Thank you, Chris, and good morning, everyone. 
Today, I will cover our first quarter results, quarterly financial updates and our hedge disclosures. 
Turning first to Slide 9. 
As Chris mentioned, we recorded a loss of $0.06 per share on a non-GAAP basis for the first quarter, driven by the losses from the February weather event. 
Our utilities performed ahead of plan for the quarter, delivering a combined $0.72 per share this year, which was $0.11 per share higher than the first quarter of 2020. We This was primarily driven by strong operational performance as well as the impacts of distribution rate cases. 
ExGen reported a loss of $0.58 per share for the quarter. Excluding the 5-day weather event in February, ExGen would have earned $0.32 per share as we had anticipated. However, specific to the weather event, we incurred a loss in the first quarter of $0.90 per share. A portion of this loss is due to some penalties or charges associated with our natural gas business, that we ultimately expect to be reduced through waivers and/or recovered from customers later in this year. 
As we disclosed in our 8-K last week, we estimate our full year loss from the weather event to be approximately $900 million to $1.1 billion pretax or $670 million to $820 million after tax. We also continue to expect to offset between $550 million and $650 million pretax or $410 million and $490 million after tax for the full year 2021. These offsets will occur primarily at ExGen through a combination of enhanced revenue opportunities, deferral of selected nonessential maintenance and primarily onetime cost savings, and are mostly expected in the second half of this year. 
Holdco recorded a loss of $0.20 per share for the quarter, which was a larger loss than is typical in the first quarter and was driven by a tax adjustment required by GAAP to partially offset the tax benefit recorded at ExGen due to the Texas losses. This amount will reverse over the next 3 quarters, and ultimately will not have an impact on full year results. 
As Chris stated, we are reaffirming our guidance range of $2.60 a share to $3 per share, and you can see the details on Slide 16 in the appendix. 
Moving on to Slide 10. 
Looking at our utility returns on a consolidated basis, our trailing 12-month ROE as of the first quarter has improved to 8.9% from 8.7% last quarter. The 20 basis point increase was primarily due to higher earnings across the operating companies in the first quarter. As a reminder, the calculation is backward-looking. So you should continue to see some pressure on ROEs over the next couple of quarters as we work off the impacts of COVID-19, low interest rates at ComEd and the 2020 storms. We do expect to be in our targeted range of 9% to 10% by year-end. And looking into the future, we remain focused on delivering strong [ earned ] returns at the Utilities in supporting our growth targets. 
Turning to the next Slide 11. Since the last call, there were some important developments on the regulatory front. 
First, on March 30, PECO filed an electric distribution case with the Pennsylvania Public Utility Commission. PECO is seeking a revenue increase of $246 million for continued investments in electric distribution infrastructure, which will make the local energy grid stronger and more resilient, enhance service, and help the company deliver safe, reliable and clean energy for consumers. In addition, the filing proposes customer relief offerings for eligible residential and small business customers, and we expect an order in December of this year. 
Second, ComEd filed its annual distribution formula rate update with the Illinois Commerce Commission on April 16, seeking a $51 million increase to electric distribution base rates. This year's formula rate update file in [ March ] ComEd's first request for a distribution rate increase in 4 years. The filing will support investments to expand access to clean energy through private and community solar and support the growing demand for electric vehicles. Additionally, we continue to make investments and make the power grid more resilient to severe storms, such as those experienced in Northern Illinois last year. We expect to receive an order by early December. 
We also have several rate cases still in progress, including orders in multiyear plans for Pepco DC and Pepco Maryland, which are expected in the second quarter. We continue to have constructive regulatory relationships across our jurisdictions, and are working with our regulators, states and communities to support their clean energy and climate goals. More details on our rate cases can be found on Slides 20 through 28 of the appendix. 
Slide 12 provides one example of how Exelon Utilities are working with our regulators and states to make investments that will address the climate crisis and help our customers. 
Our utilities pay -- play a critical role advancing electric vehicles in our communities. This includes both the installation of publicly available charging stations and investment in the system to support this infrastructure. Exelon Utilities have been leaders in this rapidly growing space by expanding charging infrastructure, offering rebates and incentives and innovative rates, while electrifying public transportation to deliver convenient, affordable and equally accessible clean transportation options. 
Our clean electric transportation programs aim to support nearly 100,000 current electric vehicle drivers across our service territories, aligned with state climate goals, and improve overall air quality for all our customers and communities. To date, electric vehicle programs have been approved in Maryland, D.C., Delaware and New Jersey, with approval pending in Pennsylvania, as part of PECO's recent rate case filing. ComEd also has several ongoing educational and outreach initiatives. And several of the bills Chris spoke about would provide incentives for EV infrastructure. 
The transportation sector currently represents about 1/3 of total U.S. greenhouse gas emissions. Urban areas, like many of our service territories, are disproportionately affected by air pollution and the negative effects of climate change. One way we aim to help address this is by advocating for and helping to usher in cleaner, 0 emission transportation, particularly in underserved communities. Our programs are designed to reduce common barriers to electric vehicle adoption, including range anxiety, total cost of vehicle ownership and lack of education among consumers. Cleaner vehicles on the road help our cities and states meet their environmental goals, reduce their carbon footprint, bring cleaner air to communities, and create economic opportunity through job creation and reduced energy costs. Additionally, Exelon's utilities are leading by example in setting an aggressive goal to electrify our fleet, including both light and heavy-duty vehicles. We have committed to electrify 30% of our fleet by 2025 and 50% by 2030. Electrifying 50% of the fleet could avoid more than 65,000 metric tons of emissions cumulatively from 2020 to 2030. That's the equivalent to the carbon removed by 1 million trees planted and grown for 10 years. 
On Slide 13, we provide a gross margin update. 
For 2021, total gross margin is down $150 million versus the fourth quarter call, due to the increase in the estimated impact of the February weather event. The midpoint of our current estimate of the gross margin impact from this event is $950 million. This number is lower than the midpoint of our loss range of $1 billion because it does not include bad debt, which is captured in O&M. 
Excluding the impacts of the February weather event, gross margin is flat to last quarter. Open Gross Margin is up $300 million relative to our prior disclosure, primarily due to higher prices in NiHub and West Hub. Our mark-to-market of hedges were down $200 million due to our hedge position, offsetting the increase in Open Gross Margin partially offset by the execution of $100 million of power new business. We also executed $50 million in non-power new business during the quarter. 
Thank you. And I will now turn back the call to Chris for his closing remarks."
296181,710662861,2270398,"Exelon Corporation, Q1 2021 Earnings Call, May 05, 2021",2021-05-05,"Earnings Calls","Exelon Corporation","Executives","Thanks, Joe. Turning to Slide 14. I'll close on our priorities and commitments. We will deliver or exceed our financial commitments, delivering earnings within our guidance range and to maintain strong balance sheet. We will complete preparations to s",150,"Thanks, Joe. 
Turning to Slide 14. I'll close on our priorities and commitments. 
We will deliver or exceed our financial commitments, delivering earnings within our guidance range and to maintain strong balance sheet. We will complete preparations to separate the businesses, including the regulatory approvals. At Exelon Utilities, we will prudently and effectively deploy nearly $6.6 billion of capital to benefit our customers and help meet the needs of our states energy policy goals. We'll work with our regulators to ensure timely recovery on these investments. We'll continue to advocate for clean energy and climate policies with the new administration, Congress and our states to put our country on the path to meeting a carbon reduction goals. And we'll continue to partner with the support of our customers and our communities that we serve. 
So thank you all for joining us. And with that, we'll open it up for questions."
296181,710662861,2270398,"Exelon Corporation, Q1 2021 Earnings Call, May 05, 2021",2021-05-05,"Earnings Calls","Exelon Corporation","Operator","[Operator Instructions] And your first question comes from Stephen Byrd with Morgan Stanley.",13,"[Operator Instructions] And your first question comes from Stephen Byrd with Morgan Stanley."
296181,710662861,2270398,"Exelon Corporation, Q1 2021 Earnings Call, May 05, 2021",2021-05-05,"Earnings Calls","Exelon Corporation","Analysts","I wanted to just get your latest thoughts on ERCOT and market design. We've certainly seen a lot of activity. And you all gave some prepared remarks on that. But just curious, it strikes me it looks like it's a little less likely that the state may go in",81,"I wanted to just get your latest thoughts on ERCOT and market design. We've certainly seen a lot of activity. And you all gave some prepared remarks on that. But just curious, it strikes me it looks like it's a little less likely that the state may go in the direction of sort of fixed resiliency or capacity light payments. But just curious what you're sort of seeing and what direction you think we may take in terms of market design."
296181,710662861,2270398,"Exelon Corporation, Q1 2021 Earnings Call, May 05, 2021",2021-05-05,"Earnings Calls","Exelon Corporation","Executives","Yes. Let me have Kathleen cover that.",7,"Yes. Let me have Kathleen cover that."
296181,710662861,2270398,"Exelon Corporation, Q1 2021 Earnings Call, May 05, 2021",2021-05-05,"Earnings Calls","Exelon Corporation","Executives","Yes. I think there are a number of ideas under discussion in the legislature. And I guess I wouldn't say that it's less likely that the state will ultimately choose to go down the path of setting a reliability standard. That idea does have some support an",191,"Yes. I think there are a number of ideas under discussion in the legislature. And I guess I wouldn't say that it's less likely that the state will ultimately choose to go down the path of setting a reliability standard. That idea does have some support and is being discussed openly, as are other changes, for example, to the ORDC curve to sort of lengthen it and lower the cap. And then there are other ideas out there as well. So I think there's active discussion in both the House and the Senate over whether and when the legislature should act. There are some who think it should move forward and set some expectations and let the PCT work on a market design over the balance of the year, whereas others are thinking maybe they'll wait and do it later in the year. So it's a little bit early to tell how those conversations are going to land. But I think the concept of setting, as all the other markets do, a reliability standard and letting the market operator design a market-based way to get there is still under active discussion."
296181,710662861,2270398,"Exelon Corporation, Q1 2021 Earnings Call, May 05, 2021",2021-05-05,"Earnings Calls","Exelon Corporation","Analysts","That's really helpful. And then maybe going to PJM and FERC. And we've seen a lot of activity around the treatment of MOPR. And just curious there, as well your latest thinking on sort of where we may be headed and kind of broader implications, given it l",55,"That's really helpful. And then maybe going to PJM and FERC. And we've seen a lot of activity around the treatment of MOPR. And just curious there, as well your latest thinking on sort of where we may be headed and kind of broader implications, given it looks like we may see a reversal."
296181,710662861,2270398,"Exelon Corporation, Q1 2021 Earnings Call, May 05, 2021",2021-05-05,"Earnings Calls","Exelon Corporation","Executives","Yes. There are sort of 2 avenues where that's being discussed. First, at the RTOs themselves. And as you know, PJM has a stakeholder process to work through. How to reform MOPR, they have direction from their board that they should reform it. But the ques",151,"Yes. There are sort of 2 avenues where that's being discussed. First, at the RTOs themselves. And as you know, PJM has a stakeholder process to work through. How to reform MOPR, they have direction from their board that they should reform it. But the question is how, and they've laid out a proposal, and they'll be taking comments and working towards the FERC filing in the summer to express their view of how it should be reformed. And then, ultimately, of course, it will be up to FERC. You have 2 commissioners who are open that they think MOPR should be reformed. The other 3, less transparent in terms of how they would vote. So I think there's certainly going to be an effort on PJM's part to make a change. And then the question will be how the votes line up at the commission once that filing is made."
296181,710662861,2270398,"Exelon Corporation, Q1 2021 Earnings Call, May 05, 2021",2021-05-05,"Earnings Calls","Exelon Corporation","Operator","And your next question comes from Steve Fleishman with Wolfe Research.",11,"And your next question comes from Steve Fleishman with Wolfe Research."
296181,710662861,2270398,"Exelon Corporation, Q1 2021 Earnings Call, May 05, 2021",2021-05-05,"Earnings Calls","Exelon Corporation","Analysts","So a couple of questions, I guess, focused on the nuclear. So first, in Illinois, I know there's been several proposals. The most recent, I think, was from the governor, related also to the audit that he set up. Could you give your views on whether that p",58,"So a couple of questions, I guess, focused on the nuclear. So first, in Illinois, I know there's been several proposals. The most recent, I think, was from the governor, related also to the audit that he set up. Could you give your views on whether that proposal would be sufficient to keep the Dresden and Byron open?"
296181,710662861,2270398,"Exelon Corporation, Q1 2021 Earnings Call, May 05, 2021",2021-05-05,"Earnings Calls","Exelon Corporation","Executives","Yes. I mean all of you have written on the economics of the plant and the reality of what the bill is starting at. I think it's -- from what we've heard, it's open a negotiation. But just going from the Street analyst opinion and what we've seen, its star",61,"Yes. I mean all of you have written on the economics of the plant and the reality of what the bill is starting at. I think it's -- from what we've heard, it's open a negotiation. But just going from the Street analyst opinion and what we've seen, its starting point is not adequate to keep the plants continued operations going."
296181,710662861,2270398,"Exelon Corporation, Q1 2021 Earnings Call, May 05, 2021",2021-05-05,"Earnings Calls","Exelon Corporation","Analysts","Okay. And then just to be clear on Illinois, in the event that maybe they just can't get a build on this session, and they try to go to the veto session. Obviously, you're targeting to shut the plants before then. So can you just confirm clearly whether,",64,"Okay. And then just to be clear on Illinois, in the event that maybe they just can't get a build on this session, and they try to go to the veto session. Obviously, you're targeting to shut the plants before then. So can you just confirm clearly whether, if they just don't get something done this session, the plants will shut, Dresden and Byron?"
