"companyid","keydevid","transcriptid","headline","mostimportantdateutc","keydeveventtypename","companyname","speakertypename","componenttextpreview","word_count","componenttext"
30643,709730056,2263906,"Laboratory Corporation of America Holdings, Q1 2021 Earnings Call, Apr 29, 2021",2021-04-29,"Earnings Calls","Labcorp Holdings Inc.","Executives","Thank you, Adam. I'm going to start my comments with a review of our first quarter results, followed by a discussion of our performance in each segment and conclude with an update on our 2021 full year guidance.Revenue for the quarter was $4.2 billion,",1374,"Thank you, Adam. I'm going to start my comments with a review of our first quarter results, followed by a discussion of our performance in each segment and conclude with an update on our 2021 full year guidance.
Revenue for the quarter was $4.2 billion, an increase of 47.4% over last year due to organic revenue growth of 45%, acquisitions of 0.9% and favorable foreign currency translation of 140 basis points. The increase in organic revenue was driven by COVID testing of 32.9% and organic base business growth of 12.2%. Operating income for the quarter was $1.1 billion or 25.4% of revenue. During the quarter, we had $32 million of restructuring charges and special items, primarily due to COVID-related costs and acquisition integration charges. We also had $92 million of amortization, which was higher than last year due to the accelerated amortization of the Covance trade name related to our previously announced branding initiative.  
Adjusted operating income in the quarter was $1.2 billion or 28.4% of revenue compared to $366 million or 12.9% last year. The increase in adjusted operating income and margin was primarily due to COVID testing, organic base business growth, acquisitions and LaunchPad savings, partially offset by higher personnel costs. 
The tax rate for the quarter was 24.6%. The adjusted tax rate, excluding restructuring charges, special items and amortization, was 24.5% compared to 25.3% last year. The lower adjusted tax rate was primarily due to the geographic mix of earnings. We continue to expect our full year adjusted tax rate to be approximately 25%. 
Net earnings for the quarter were $770 million or $7.82 per diluted share. Adjusted EPS, which exclude amortization, restructuring charges and special items, were $8.79 in the quarter, up from $2.37 last year. 
Operating cash flow was $1.2 billion in the quarter compared to $204 million a year ago. The increase in operating cash flow was due to higher cash earnings and lower working capital requirements. Capital expenditures totaled $95 million or 2.3% of revenue compared to $107 million or 3.8% of revenue last year. As a result, free cash flow was $1.1 billion in the quarter compared to $97 million last year. 
During the quarter, we paid down $375 million of debt, invested $34 million in acquisitions and repurchased $69 million of stock. At quarter end, the company had $732 million remaining of its Board-authorized share repurchase program. 
Now I'll review our segment performance, beginning with Diagnostics. Revenue for the quarter was $2.8 billion, an increase of 62% compared to last year, driven by COVID testing of 54.5% and base business growth of 7.5%. The base business growth was primarily driven by organic growth of 6.3%, which includes the negative impact of weather of approximately 2%. Relative to the first quarter of 2019, the compounded annual growth rate for the base business revenue was 2.7% and was primarily due to organic growth. 
Total volume increased 27.3% over last year, primarily due to organic volume growth of 26.6%. The increase in organic volume was due to the contribution from COVID testing volumes of 27.9%, partially offset by a reduction in organic base business of 1.3%, which was negatively impacted by weather of approximately 2%. As a reminder, we do not include hospital lab management agreements in our volume, which would have added approximately 1.3% to organic base business volume growth. Price/mix increased 34.7% over last year, driven by COVID testing of 26.6% and a favorable mix in the organic base business of 7.5%, which was primarily due to higher test per accession. 
Diagnostics adjusted operating income for the quarter was $992 million or 36% of revenue compared to $254 million or 14.9% last year. The increase in adjusted operating income and margin was primarily due to COVID testing, organic base business demand and LaunchPad savings, partially offset by higher personnel costs. Diagnostics' 3-year LaunchPad initiative remains on track to deliver approximately $200 million of net savings by the end of 2021. 
Now I'll review the performance of Drug Development. Revenue for the quarter was $1.4 billion, an increase of 25.7% compared to last year due to organic growth of 21.9%, acquisitions of 1% and favorable foreign currency translation of 290 basis points. The increase in organic revenue was due to base business growth of 19.7% and a 2.2% contribution from COVID testing performed through its central lab business. Drug Development delivered broad-based revenue growth across all businesses, including COVID vaccine and therapeutic studies. And relative to the first quarter of 2019, the compounded annual growth rate for the base business revenue was 14.7% and was primarily driven by organic growth. 
Adjusted operating income for the segment was $234 million or 16.3% of revenue compared to $151 million or 13.2% last year. The increase in adjusted operating income and margins were primarily due to organic base business demand, COVID testing and LaunchPad savings, partially offset by higher personnel costs. The company continues to develop and execute new LaunchPad programs to support profitable growth in Drug Development. 
For the trailing 12 months, net orders and net book-to-bill remained strong at $7.6 billion and 1.47, respectively. Backlog at the end of the quarter was $14 billion, an increase of approximately $210 million from last quarter. We expect approximately $4.6 billion of this backlog to convert into revenue over the next 12 months. 
Now I'll discuss our 2021 full year guidance, which assumes foreign exchange rates effective as of March 31, 2021, for the full year. We are raising our full year guidance to reflect the company's strong first quarter performance and improved outlook for the remainder of the year for both our Diagnostics and Drug Development base businesses. 
We expect enterprise level revenue to grow 2% to 6.5% from our prior guidance of minus 1% to plus 4.5%. This includes the benefit from foreign currency translation of 70 basis points. This guidance range also includes the expectation that the base business will now grow 13.5% to 16%, up from prior guidance of 11% to 13.5%. The revenue guidance on the contribution from COVID testing is unchanged at down 35% to 50%. However, current estimates are less favorable than the midpoint of the range. 
We are raising our expectations for revenue in Diagnostics of flat to minus 5% from prior guidance of minus 0.5% to minus 7.5%. This guidance range includes the expectation that the base business will now grow 13.5% to 16%, given our first quarter performance and improved outlook. And we continue to expect COVID testing revenue again to decline 35% to 50%. 
We're also raising our growth expectations for revenue in Drug Development to 12% to 14% from prior guidance of 8% to 10.5%. Our current guidance includes the benefit from foreign currency translation of 140 basis points. This guidance range also includes the expectation that the base business will now grow 14% to 16%, reflecting strong first quarter broad-based performance and an improved outlook. 
Given the improved top line growth expectation of our base businesses, we're now raising our adjusted EPS guidance to $20 to $24, up from prior guidance of $19 to $23. Free cash flow is now expected to be between $1.8 billion and $2 billion, up from prior guidance of $1.7 billion to $1.9 billion. Our earnings guidance assumes we will use our free cash flow for acquisitions and share repurchases, which we expect to accelerate in the second quarter. We continue to expect the capital expenditures will be approximately 4% of revenue, driven by investments to support base business growth and productivity. 
For additional comparison purposes, we have also included in our supplemental deck on our Investor Relations website a view of our 2021 first quarter results and full year guidance compared to our 2019 results.
In summary, the company had another quarter of strong performance. We remain focused on performing a critical role in response to the global pandemic while also managing our base business. And as we progress through 2021, we expect to drive continued profitable growth in our base business as COVID testing volumes are expected to decline over the remainder of the year. We expect to continue to use our free cash flow generation for acquisitions that supplement our organic growth while also returning capital to shareholders. 
[Technical Difficulty]"
30643,709730056,2263906,"Laboratory Corporation of America Holdings, Q1 2021 Earnings Call, Apr 29, 2021",2021-04-29,"Earnings Calls","Labcorp Holdings Inc.","Operator","Okay. Are you there?",4,"Okay. Are you there?"
30643,709730056,2263906,"Laboratory Corporation of America Holdings, Q1 2021 Earnings Call, Apr 29, 2021",2021-04-29,"Earnings Calls","Labcorp Holdings Inc.","Executives","There we go, operator. We can hear you.",8,"There we go, operator. We can hear you."
30643,709730056,2263906,"Laboratory Corporation of America Holdings, Q1 2021 Earnings Call, Apr 29, 2021",2021-04-29,"Earnings Calls","Labcorp Holdings Inc.","Operator","Sorry about that. I don't know what happened. You could continue.",11,"Sorry about that. I don't know what happened. You could continue."
30643,709730056,2263906,"Laboratory Corporation of America Holdings, Q1 2021 Earnings Call, Apr 29, 2021",2021-04-29,"Earnings Calls","Labcorp Holdings Inc.","Executives","Okay. I think we've completed our formal remarks, and we're now ready to take questions.",15,"Okay. I think we've completed our formal remarks, and we're now ready to take questions."
30643,709730056,2263906,"Laboratory Corporation of America Holdings, Q1 2021 Earnings Call, Apr 29, 2021",2021-04-29,"Earnings Calls","Labcorp Holdings Inc.","Operator","[Operator Instructions] And your first question comes from Jack Meehan with Nephron Research.",13,"[Operator Instructions] And your first question comes from Jack Meehan with Nephron Research."
30643,709730056,2263906,"Laboratory Corporation of America Holdings, Q1 2021 Earnings Call, Apr 29, 2021",2021-04-29,"Earnings Calls","Labcorp Holdings Inc.","Analysts","I wanted to start with the Covance performance. So I was calculating new awards up 60% year-over-year, which would make Labcorp #1 so far in the quarter. So Adam, I was wondering, is that math right? Were there any chunky awards to call out? And can you m",61,"I wanted to start with the Covance performance. So I was calculating new awards up 60% year-over-year, which would make Labcorp #1 so far in the quarter. So Adam, I was wondering, is that math right? Were there any chunky awards to call out? And can you maybe talk about the relative performance of each of the businesses within Drug Development?"
30643,709730056,2263906,"Laboratory Corporation of America Holdings, Q1 2021 Earnings Call, Apr 29, 2021",2021-04-29,"Earnings Calls","Labcorp Holdings Inc.","Executives","Yes. Jack, no, your math is about right. And we're very pleased with the performance of all the businesses frankly, Diagnostics and each of the businesses in Drug Development. Central laboratory was particularly strong, but we saw good growth in early sta",126,"Yes. Jack, no, your math is about right. And we're very pleased with the performance of all the businesses frankly, Diagnostics and each of the businesses in Drug Development. Central laboratory was particularly strong, but we saw good growth in early stage as well in late stage. And as I mentioned on previous calls, we had recently won some larger pharmaceutical clients that are helping with our book-to-bill. So if you look at our book-to-bill, it reached a record of 1.47 for the trailing 12 months. And the total backlog, as we said, grew to $13.97 billion. And I'll just add to that, that only a very small percent of that backlog is related to COVID work. So it's really related to the other therapeutic areas."
30643,709730056,2263906,"Laboratory Corporation of America Holdings, Q1 2021 Earnings Call, Apr 29, 2021",2021-04-29,"Earnings Calls","Labcorp Holdings Inc.","Analysts","Great. And maybe building off that, Glenn, you mentioned in the prepared remarks how the stacked growth is somewhere in the mid-teens. As you think about how this backlog growth is going to convert over the next year or a few years, how do you think the n",85,"Great. And maybe building off that, Glenn, you mentioned in the prepared remarks how the stacked growth is somewhere in the mid-teens. As you think about how this backlog growth is going to convert over the next year or a few years, how do you think the near-term trend rate for Covance is looking? Are you going to have tough comps as we're looking out a year from now? Or do you think there's just a lot of work to burn through for some time?"
30643,709730056,2263906,"Laboratory Corporation of America Holdings, Q1 2021 Earnings Call, Apr 29, 2021",2021-04-29,"Earnings Calls","Labcorp Holdings Inc.","Executives","Yes. No, we have seen over the past several quarters a little bit of a decline in the conversion rate. We're now at around 33%. And it's, as you know, relative to the mix of business that we're doing, more oncology work that we're seeing, good growth in o",130,"Yes. No, we have seen over the past several quarters a little bit of a decline in the conversion rate. We're now at around 33%. And it's, as you know, relative to the mix of business that we're doing, more oncology work that we're seeing, good growth in our backlog, as Adam commented. So right now, we continue to have a lot of good momentum. Our orders continue to be very strong. We're building up a very strong backlog, again, at $14 billion, so nothing from our view long term would change. Obviously, in the first quarter especially, you'll see kind of a really strong growth rate in part because of the COVID-related vaccine and therapeutic studies that we have that at some point will obviously start to taper off."
30643,709730056,2263906,"Laboratory Corporation of America Holdings, Q1 2021 Earnings Call, Apr 29, 2021",2021-04-29,"Earnings Calls","Labcorp Holdings Inc.","Operator","Your next question comes from the line of Erin Wright with Credit Suisse.",13,"Your next question comes from the line of Erin Wright with Credit Suisse."
30643,709730056,2263906,"Laboratory Corporation of America Holdings, Q1 2021 Earnings Call, Apr 29, 2021",2021-04-29,"Earnings Calls","Labcorp Holdings Inc.","Analysts","Great. Another one on the Covance business here. There's obviously a ton of promotion in the CRO space right now. What are you seeing in terms of opportunities from some of the potential disruption there, whether it's win rates or employee recruitment? An",106,"Great. Another one on the Covance business here. There's obviously a ton of promotion in the CRO space right now. What are you seeing in terms of opportunities from some of the potential disruption there, whether it's win rates or employee recruitment? And on the flip side of that, does the ongoing strategic review change any of your own relationships with customers? I assume it doesn't, given the latest bookings trends that you just posted. But do you see also further consolidation across the CRO space from here? Or do you see the need to add scale to the Covance business, as always, a controversial topic?"
30643,709730056,2263906,"Laboratory Corporation of America Holdings, Q1 2021 Earnings Call, Apr 29, 2021",2021-04-29,"Earnings Calls","Labcorp Holdings Inc.","Executives","Yes. So first of all, Erin, thanks for the questions. Whenever you have large-scale integrations or mergers and consolidation, you see some interruption of business. So we're going to be prepared to take advantage of whatever is out there in terms of disr",403,"Yes. So first of all, Erin, thanks for the questions. Whenever you have large-scale integrations or mergers and consolidation, you see some interruption of business. So we're going to be prepared to take advantage of whatever is out there in terms of disruption and distractions of companies that are being acquired or that are going through the significant integrations. Integrations are just hard to do. 
We've said all along that we believe that there was going to be additional consolidation in the industry. So it's not a surprise to us. I mean, we're aware of the marketplace and all of the competitors. And obviously, we know what's happening. At the same time, we've always said you need a certain level of critical mass to be successful. And the good news is we have that critical mass. And as you said, Erin, you can see it in our numbers. You can see it in the strength of our book-to-bill. You can see it in the strength of our ability to continue to grow in the Covance business. So we know the industry. We know the other players very well, and that's a great thing about Labcorp. I mean, everybody comes and talks to us. At the same time, we feel like we're in a very strong position. 
With regard to your second question was -- as we go through a strategic review, we're focused on executing in the marketplace, and we're not going to lose focus. And we're not going to spend time -- in the vast majority of our organization, they're just meeting the needs of our clients and our customers every single day. It's going to be the Board, the management team that are working together to do this thorough review, and we're not going to distract the largest parts of our organization. We're going to keep them focused on delivering. Hopefully, you see that our execution in the marketplace has been really strong across Diagnostics and Drug Development. It's been strong with everything we're doing for COVID. It's been strong in our base business. I mean, our base business for the overall grew 15%, and the base business for Diagnostics was up 8%. Drug Development was up 24%. 
So you see strength there. That's because we're so focused on executing on the needs of our customers. And we're going to continue to do that while we also perform the strategic review."
30643,709730056,2263906,"Laboratory Corporation of America Holdings, Q1 2021 Earnings Call, Apr 29, 2021",2021-04-29,"Earnings Calls","Labcorp Holdings Inc.","Analysts","Okay. And switching over to the Diagnostics segment. I guess in your view, how has the competitive landscape changed as we emerge from the pandemic here with some emerging smaller labs and other entities stepping up investments and testing capabilities? D",60,"Okay. And switching over to the Diagnostics segment. I guess in your view, how has the competitive landscape changed as we emerge from the pandemic here with some emerging smaller labs and other entities stepping up investments and testing capabilities? Does this change any of your outlook from a consolidation standpoint at this point across the core clinical lab space?"
30643,709730056,2263906,"Laboratory Corporation of America Holdings, Q1 2021 Earnings Call, Apr 29, 2021",2021-04-29,"Earnings Calls","Labcorp Holdings Inc.","Executives","Yes. Erin, a couple of parts to answer. The first thing is that if you look at people that have built capabilities to do COVID testing, those are really doing molecular testing. Molecular testing is a very, very small part of the 530 million or so tests t",212,"Yes. Erin, a couple of parts to answer. The first thing is that if you look at people that have built capabilities to do COVID testing, those are really doing molecular testing. Molecular testing is a very, very small part of the 530 million or so tests that Labcorp does a year. So no matter how much capacity is out there for molecular testing, I don't think that there would be a significant impact to our business with new competition that can do some molecular tests. 
What I do believe is that some of those competitors are not going to be able to make it with just COVID testing, as we've seen the number of tests per day go down. And therefore, I believe there will continue to be consolidation in the industry. And frankly, that's something that we'll continue to look at. We've always said that acquiring local laboratories or hospital laboratories, even regional laboratories are a great way for us to use our capital. We know how to integrate those. They return their cost of capital very quickly, and they're accretive typically in the first year. So we'll look for opportunities for continued consolidation but not just in the smaller new competitors, but also in the hospitals and other laboratories."
30643,709730056,2263906,"Laboratory Corporation of America Holdings, Q1 2021 Earnings Call, Apr 29, 2021",2021-04-29,"Earnings Calls","Labcorp Holdings Inc.","Operator","Your next question comes from the line of Dan Leonard with Wells Fargo.",13,"Your next question comes from the line of Dan Leonard with Wells Fargo."
30643,709730056,2263906,"Laboratory Corporation of America Holdings, Q1 2021 Earnings Call, Apr 29, 2021",2021-04-29,"Earnings Calls","Labcorp Holdings Inc.","Analysts","Another question on the Drug Development business, big growth year-on-year in the new awards but off of a lower base. Could you comment on the book-to-bill ratio in the quarter and -- not your trailing 12, but specifically for the quarter? And if you felt",66,"Another question on the Drug Development business, big growth year-on-year in the new awards but off of a lower base. Could you comment on the book-to-bill ratio in the quarter and -- not your trailing 12, but specifically for the quarter? And if you felt like you were winning your pro rata share of bookings and anything to be aware of on the monthly trend front?"
30643,709730056,2263906,"Laboratory Corporation of America Holdings, Q1 2021 Earnings Call, Apr 29, 2021",2021-04-29,"Earnings Calls","Labcorp Holdings Inc.","Executives","Yes. Dan, it's Glenn. As you know, we do a book-to-bill on a trailing 12 number and, again, a record level of 1.47. So it's picked up nicely from the prior trailing 12 months. So obviously, it implies obviously a very good quarter. We tend not to give the",95,"Yes. Dan, it's Glenn. As you know, we do a book-to-bill on a trailing 12 number and, again, a record level of 1.47. So it's picked up nicely from the prior trailing 12 months. So obviously, it implies obviously a very good quarter. We tend not to give the quarterly numbers because we don't want it to be focused on the quarter. Obviously, this is done over the years. But it's fair to say that we feel we had a very good quarter, and it was enough to meaningfully bump up our trailing 12-month level."
30643,709730056,2263906,"Laboratory Corporation of America Holdings, Q1 2021 Earnings Call, Apr 29, 2021",2021-04-29,"Earnings Calls","Labcorp Holdings Inc.","Executives","And I would also say, Dan, is if you look at RFPs, they continue to be coming in strong. If you look at investment from pharma and biotech, it continues to be strong. And we continue to win at a minimum our share, maybe even a bit better.",48,"And I would also say, Dan, is if you look at RFPs, they continue to be coming in strong. If you look at investment from pharma and biotech, it continues to be strong. And we continue to win at a minimum our share, maybe even a bit better."
30643,709730056,2263906,"Laboratory Corporation of America Holdings, Q1 2021 Earnings Call, Apr 29, 2021",2021-04-29,"Earnings Calls","Labcorp Holdings Inc.","Analysts","And then my follow-up, can you elaborate a bit more on the drivers of the organic growth in your base business in Diagnostics? It seems like the health care system hasn't fully normalized yet doing 6% organic is better than industry. So maybe if there's m",56,"And then my follow-up, can you elaborate a bit more on the drivers of the organic growth in your base business in Diagnostics? It seems like the health care system hasn't fully normalized yet doing 6% organic is better than industry. So maybe if there's more granular detail you could offer on the drivers there."
