"companyid","keydevid","transcriptid","headline","mostimportantdateutc","keydeveventtypename","companyname","speakertypename","componenttextpreview","word_count","componenttext"
30643,700595964,2205624,"Laboratory Corporation of America Holdings, Q4 2020 Earnings Call, Feb 11, 2021",2021-02-11,"Earnings Calls","Labcorp Holdings Inc.","Executives","Yes. Don, I think that's an important point. And we have a great relationship with UnitedHealthcare. We have great relationships with the managed care organizations across the country. And I do believe that as things go back to kind of more of a normal sc",250,"Yes. Don, I think that's an important point. And we have a great relationship with UnitedHealthcare. We have great relationships with the managed care organizations across the country. And I do believe that as things go back to kind of more of a normal scenario, though I don't think it will ever be completely normal what we had in the past, I do think there will be opportunities for us to work with them closer. So for example, on the PLN, the preferred laboratory network, I would have thought we'd make more progress together. But with the distraction of COVID, it's been nearly impossible to do that. I'm hopeful that we'll be able to get back to that when things normalize a bit. 
Thank you. So the last thing I wanted to say is, first of all, thank you for joining us. And there's no doubt that we achieved strong performance in the fourth quarter and full year of 2020. But the beginning of the pandemic, we've been focused on what we can do to help as best we can. And I think our agility, our ability to move quickly combined with our science, innovation and technology is what has really differentiated us. And what we learned about agility and we've equity in the marketplace is here to stay. And I think that's going to continue to serve us well as we go into the future. So thanks for your time today. We look forward to talking to you soon."
30643,700595964,2205624,"Laboratory Corporation of America Holdings, Q4 2020 Earnings Call, Feb 11, 2021",2021-02-11,"Earnings Calls","Labcorp Holdings Inc.","Operator","Ladies and gentlemen, this concludes today's conference call. Thank you for participating, and you may now disconnect.",17,"Ladies and gentlemen, this concludes today's conference call. Thank you for participating, and you may now disconnect."
30643,700595964,2206039,"Laboratory Corporation of America Holdings, Q4 2020 Earnings Call, Feb 11, 2021",2021-02-11,"Earnings Calls","Labcorp Holdings Inc.","Operator","Ladies and gentlemen, thank you for standing by, and welcome to Labcorp Fourth Quarter 2020 Earnings Conference Call. [Operator Instructions] Please be advised that today's conference is being recorded. [Operator Instructions]It is now my pleasure to in",45,"Ladies and gentlemen, thank you for standing by, and welcome to Labcorp Fourth Quarter 2020 Earnings Conference Call. [Operator Instructions] Please be advised that today's conference is being recorded. [Operator Instructions]
It is now my pleasure to introduce Vice President of Investor Relations, Clarissa Willett."
30643,700595964,2206039,"Laboratory Corporation of America Holdings, Q4 2020 Earnings Call, Feb 11, 2021",2021-02-11,"Earnings Calls","Labcorp Holdings Inc.","Executives","Thank you, operator. Good morning and welcome to Labcorp's Fourth Quarter 2020 Conference Call. As detailed in today's press release, there will be a replay of this conference call available via telephone and Internet. With me today are Adam Schechter, Ch",266,"Thank you, operator. Good morning and welcome to Labcorp's Fourth Quarter 2020 Conference Call. As detailed in today's press release, there will be a replay of this conference call available via telephone and Internet. With me today are Adam Schechter, Chairman and Chief Executive Officer; and Glenn Eisenberg, Executive Vice President and Chief Financial Officer.
This morning, in the Investor Relations section of our website, we posted both our press release and an Investor Relations presentation with additional information on our business and operations, which include a reconciliation of the non-GAAP financial measures to the GAAP financial measures discussed during today's call.
Additionally, we are making forward-looking statements. These forward-looking statements include, but are not limited to: statements with respect to 2021 guidance and the related assumptions, including the projected impact of the COVID-19 pandemic on the company's businesses, operating results, cash flows and/or financial conditions; our responses to and the expected future impact of the COVID-19 pandemic on our business more generally as well as on general economic, business and market conditions. Each of the forward-looking statements is based upon current expectations and is subject to change based upon various factors, many of which are beyond our control, that could affect our financial results. Some of these factors are set forth in detail in our most recent annual report on Form 10-K and subsequent quarterly reports on Form 10-Q and in the company's other filings with the SEC. We have no obligation to provide any updates to these forward-looking statements even if our expectations change.
And now I'll turn the call over to Adam Schechter."
30643,700595964,2206039,"Laboratory Corporation of America Holdings, Q4 2020 Earnings Call, Feb 11, 2021",2021-02-11,"Earnings Calls","Labcorp Holdings Inc.","Executives","Thank you, Clarissa. Good morning, everyone. Thanks for joining us today. Before I cover 2020 results, I want to first thank Clarissa for her leadership in Investor Relations for the last several years. Clarissa has been promoted to lead our revenue cycle",1105,"Thank you, Clarissa. Good morning, everyone. Thanks for joining us today. Before I cover 2020 results, I want to first thank Clarissa for her leadership in Investor Relations for the last several years. Clarissa has been promoted to lead our revenue cycle management team, which is a very important role.
I also want to take this opportunity to welcome Chas Cook, who has been appointed to Vice President of Investor Relations and will continue to strengthen the foundation built upon by the IR team. Chas has been a strong leader in our finance organization since he joined Labcorp in 2018.
Moving now to 2020 results. 2020 will be remembered for many things, including the fight against COVID and the tragic loss that it brought. It also emphasizes the critical importance of frontline health care workers and scientists, amongst others.
Looking back on this past year, I cannot be more impressed or thankful to my colleagues across Labcorp. Together, our team developed 6 FDA EUA COVID tests, performed approximately 35 million COVID tests in 2020 and helped to bring multiple treatments and vaccines to market in record time. Our ability to adapt quickly to changing environment, our resilience and our strength of our more than 50-year history have been foundational in the fight against COVID and 2020 was transformational for Labcorp.
Let me begin with a brief update on our financial results, which Glenn will cover in more detail shortly. We reported full year 2020 revenue of $14 billion, adjusted EPS of $23.94 and free cash flow of $1.8 billion.
Our base businesses in both segments continued to improve as we closed the year. In Diagnostics, our base business performed well. However, volume remains below prior year. We also reported continued improvement in our Drug Development business, with strength across all 3 business lines, leading to a revenue increase in the total and the base business in the fourth quarter. Our Drug Development business ended the year with a trailing 12-month book-to-bill of 1.43 driven by strong demand across therapeutic areas.
Our performance was strong in the fourth quarter and full year of 2020. Our teams are agile. They move fast and it clearly demonstrated the strength of our science, technology and innovation. We quickly brought innovations to market while simultaneously advancing each pillar of our company's strategy. Here are just some of the highlights from the year.
I'll start with we were the first commercial lab to bring an FDA EUA COVID test to market. We became the first to offer an at-home PCR collection kit with or without a prescription through Pixel by Labcorp. And we were early to market with neutralizing antibody tests that are important in the development of COVID vaccines.
In addition, early in the pandemic, our scientists partnered with PacBio to genetically sequence COVID samples so that we can detect changes to the virus and use that information to develop future therapies. Recently, we announced our efforts to sequence COVID samples for the CDC as the agency continues its important work in the fight against COVID. We are seeing the importance of these efforts and believe sequencing will be critical going forward.
Also, in our Diagnostics business, we brought innovative platforms and tests to market that can improve the diagnosis of important health conditions such as lung cancer and liver disease. Looking at oncology, it continues to be a strategic focus for us. In 2020, we expanded our leadership position in oncology through the launch of a new noninvasive liquid biopsy test using next-generation sequencing for patients with non-small cell lung cancer.
We were also selected by a major pharmaceutical company as their partner for late-stage oncology trials. We collaborated with Tempus to accelerate clinical trial patient participation and as you read in our recent announcement, we have formed an oncology team made up of strong and talented leaders in the field. Additionally, we are continuing to integrate digital, data analytics and artificial intelligence in everything we do.
Our Drug Development business is changing how clinical trials are managed using digital technology. We completed acquisitions of GlobalCare and SnapIOT and are working with clients to use mobile and digital technology to accelerate trials and to make virtual and hybrid clinical trials a reality. Also, within our own lab operations, our engineers and scientists developed proprietary robotics capabilities that increased our COVID testing capacity.
As we look at several innovative partnerships to support our clients, patients and scientists, our partnerships with PacBio, Adaptive Biotechnologies, Microsoft and Ciox Health enabled scientists and researchers to better understand COVID. Our collaborations with Infirmary Health, Rush University System for Health, Walgreens and others expanded our services to patients and providers across the United States. We also extended an agreement with BML to further the development of companion diagnostics in Japan. And lastly, we remain committed to customer satisfaction and remain focused on increasing access to testing, improving time to results and improving delivery to provide our customers with the best-in-class testing and support for important clinical trials.
As noted, science, technology and innovation are behind these successes and are foundational to our future. Our updated brand represents the power of our combined businesses and highlights our commitment to science and innovation to improve the health and lives of people around the world.
I'll close with a few comments about 2021. As you can appreciate, there's still uncertainty heading into 2021, but we believe we have enough visibility to reinstate full year guidance targets, albeit with a wider range than we've historically provided. The fight against COVID is not over, and neither is our commitment to defeating it. We believe the lessons learned in this past year have enhanced the progression of our long-term strategic goals.
We will continue to seek and invest in high-growth opportunities and positively impact people's health around the world in areas such as cancer, NASH, Alzheimer's disease and autoimmune diseases, just to name a few. There remain many significant unmet needs in health care, and Labcorp will continue to play an important role in helping to solve them. I am confident in both our short-term and our long-term prospects and in our strategy. It will continue to provide a strong platform for growth as we move forward.
Before I turn it over to Glenn, I want to thank all of our employees around the world. We were honored to be recognized by Fortune magazine as one of the world's most admired companies for the efforts of our over 75,000 global employees that are working tirelessly every day to help people live better and live longer.
Glenn, I'll turn it to you."
30643,700595964,2206039,"Laboratory Corporation of America Holdings, Q4 2020 Earnings Call, Feb 11, 2021",2021-02-11,"Earnings Calls","Labcorp Holdings Inc.","Executives","Thank you, Adam. I'm going to start my comments with a review of our fourth quarter results, followed by a discussion of our performance in each segment and conclude with our 2021 guidance.Revenue for the quarter was $4.5 billion, an increase of 52% ove",1371,"Thank you, Adam. I'm going to start my comments with a review of our fourth quarter results, followed by a discussion of our performance in each segment and conclude with our 2021 guidance.
Revenue for the quarter was $4.5 billion, an increase of 52% over last year due to organic revenue growth of 50.1%, acquisitions of 0.9% and favorable foreign currency translation of 100 basis points. The increase in organic revenue was driven by COVID testing of 46.4% and organic Base Business growth of 3.7%, which includes the negative impact from PAMA of 0.6%.
Operating income for the quarter was $1.3 billion or 28.8% of revenue compared to $336 million or 11.4% last year. During the quarter, we had $46 million of restructuring charges and special items, primarily due to COVID-related costs and acquisition integration charges. We also had $91 million of amortization, which was higher than recent quarters. As part of our new branding initiative, we are transitioning out of the Covance trade name. As a result, we are accelerating the amortization of its trade name over the next year.
Adjusted operating income for the quarter was $1.4 billion or 31.8% of revenue compared to $422 million or 14.3% last year. The increase in adjusted operating income and margin was primarily due to COVID testing, organic Base Business growth, acquisitions and LaunchPad savings, partially offset by PAMA, higher personnel costs and investments to support the company's new branding initiative.
The tax rate for the quarter was 24.5% compared to 22.4% last year. The adjusted tax rate, excluding restructuring charges, special items and amortization, was 24.8% compared to 22.9% last year. The higher adjusted rate was primarily due to the geographic mix of earnings. For modeling purposes, we expect the company's adjusted tax rate for 2021 to be comparable to 2020 at approximately 25%. This does not include any potential increase in the federal tax rate in 2021.
Net earnings for the quarter were $938 million or $9.54 per diluted share. Adjusted EPS, which exclude amortization, restructuring charges and special items, were $10.56 in the quarter, up from $2.86 last year.
Operating cash flow was $775 million in the quarter compared to $570 million a year ago. The increase in operating cash flow was due to higher cash earnings, partially offset by higher working capital to support growth. The higher working capital was primarily due to the increase in accounts receivables and supplies related to COVID testing.
Capital expenditures totaled $99 million or 2.2% of revenue and included investments to increase COVID testing capacity. This compares to $128 million or 4.3% of revenue in the same period last year. As a result, free cash flow was $675 million in the quarter compared to $442 million last year. This brings our full year free cash flow to $1.8 billion, up from $1 billion in 2019.
During the quarter, we invested $59 million in acquisitions. At year-end, the company had $800 million of share repurchase authorization remaining. As previously communicated, the company will repurchase shares in 2021 as part of its capital allocation strategy.
Now I'll review our segment performance, beginning with Diagnostics. Revenue for the quarter was $3.2 billion, an increase of 79.5% compared to last year, primarily due to organic growth of 78.5%. The increase in organic revenue was driven by COVID testing of 78% and Base Business growth of 0.5%, which includes the negative impact from PAMA of 1%.
Total volume increased 33.9% over last year primarily due to organic volume growth of 33.3%. The increase in organic volume was due to the contribution from COVID testing volumes of 41%, partially offset by a decline in Base Business volumes of 7.7%. As a reminder, we do not include hospital lab management agreements in our volume, which would have added approximately 2% to our organic Base Business volume growth. In the fourth quarter, the company achieved both its highest COVID testing results as well as the highest year-over-year volume performance in the Base Business since the pandemic began in March of 2020. Price/mix increased 45.5% over last year primarily driven by COVID testing of 37% and favorable mix in the organic Base Business of 8.2%.
Diagnostics adjusted operating income for the quarter was $1.2 billion or 39.1% of revenue compared to $277 million or 15.8% last year. The increase in adjusted operating income and margin was primarily due to COVID testing and LaunchPad savings, partially offset by the negative impact from PAMA and higher personnel costs. Diagnostics' 3-year LaunchPad initiative remains on track to deliver approximately $200 million of net savings by the end of 2021.
Now I'll review the performance of Drug Development. Revenue for the quarter was $1.4 billion, an increase of 16.4% compared to last year, primarily due to organic growth of 13.1%. The increase in organic revenue was due to Base Business growth of 8.4% and a 4.7% contribution from COVID testing performed through its central lab business. Drug Development delivered broad-based revenue growth, including COVID vaccine and therapeutic studies.
Adjusted operating income for the segment was $248 million or 17.8% of revenue compared to $183 million or 15.2% last year. The increase in adjusted operating income and margins were primarily due to COVID testing, organic Base Business demand and LaunchPad savings, partially offset by higher personnel costs.
The company achieved its goal to deliver approximately $150 million of net savings from its 3-year Drug Development LaunchPad initiative. LaunchPad will continue to be the company's primary business process improvement initiative going forward.
For the trailing 12 months, net orders and net book-to-bill remained strong at $7 billion and 1.43, respectively. Backlog at the end of the quarter was $13.8 billion, an increase of approximately $1.3 billion from last quarter. We expect approximately $4.5 billion of this backlog to convert into revenue over the next 12 months.
Now I'll discuss our 2021 guidance, which assumes foreign exchange rates as of December 31, 2020, for the entire year. In addition, enterprise guidance includes the impact from currently anticipated capital allocation, with free cash flow targeted to acquisitions and share repurchases.
We expect a change in revenue for the enterprise of minus 1% to plus 4.5% compared to 2020 revenue of $14 billion and includes the benefit from foreign currency translation of 90 basis points. This guidance range also includes the expectation that the Base Business will grow 11% to 13.5% over 2020 revenue of $11.2 billion, while COVID testing revenue will decline 35% to 50%. 
We expect a decline in revenue for Diagnostics of minus 0.5% to minus 7.5% compared to 2020 revenue of $9.3 billion. This guidance range includes the expectation that the Base Business will grow 11% to 14% over 2020 revenue of $6.5 billion, while COVID testing revenue will decline 35% to 50%. We expect Drug Development revenue to grow 8% to 10.5% over 2020 revenue of $4.9 billion and includes the benefit from foreign currency translation of 220 basis points. This guidance range also includes the expectation that the Base Business will grow 9.5% to 12% over 2020 revenue of $4.8 billion despite the continuing negative impact from the pandemic.
Our adjusted EPS guidance is $19 to $23 compared to 2020 adjusted EPS of $23.94. The adjusted EPS guidance reflects the expected decline in COVID testing in 2021. Free cash flow is expected to be $1.7 billion to $1.9 billion compared to $1.75 billion last year. In 2021, we expect capital expenditures to be approximately 4% of revenue driven by investments to support Base Business growth and productivity.
In summary, the company achieved strong performance in the fourth quarter and full year 2020. Since the beginning of the pandemic, we have remained focused on ramping up COVID testing capacity while also managing our Base Business, including continuing to execute on our LaunchPad initiatives.
As we look forward to 2021, we expect to drive profitable growth in our Base Business, while COVID testing is expected to decline throughout the year. We also expect another strong year of free cash flow generation that we will use for acquisitions to supplement our organic growth while returning excess cash flow to shareholders through our share repurchase program.
This concludes our formal remarks. And operator, we will now take questions."
30643,700595964,2206039,"Laboratory Corporation of America Holdings, Q4 2020 Earnings Call, Feb 11, 2021",2021-02-11,"Earnings Calls","Labcorp Holdings Inc.","Operator","[Operator Instructions] Our first question comes from Jack Meehan with Nephron Research.",12,"[Operator Instructions] Our first question comes from Jack Meehan with Nephron Research."
30643,700595964,2206039,"Laboratory Corporation of America Holdings, Q4 2020 Earnings Call, Feb 11, 2021",2021-02-11,"Earnings Calls","Labcorp Holdings Inc.","Analysts","I was wondering if you could start and just provide a little additional color on the assumption in the guidance for 2021 COVID testing. By my math, it seems that -- it assumes the COVID sales are going to be essentially 0 in the second half of the year. I",89,"I was wondering if you could start and just provide a little additional color on the assumption in the guidance for 2021 COVID testing. By my math, it seems that -- it assumes the COVID sales are going to be essentially 0 in the second half of the year. I think that's a world we all want to live in, but I'm not sure if that's exactly how it's going to play out. So it would just be great to get a little bit more on your philosophy there."
30643,700595964,2206039,"Laboratory Corporation of America Holdings, Q4 2020 Earnings Call, Feb 11, 2021",2021-02-11,"Earnings Calls","Labcorp Holdings Inc.","Executives","Thanks for the question. The reason we had to give such a wide range, minus 35% to minus 50% for the testing is because, as you say, it's very difficult to have precision. And you could get to the minus 35% to minus 50% in several different ways. Right no",326,"Thanks for the question. The reason we had to give such a wide range, minus 35% to minus 50% for the testing is because, as you say, it's very difficult to have precision. And you could get to the minus 35% to minus 50% in several different ways. Right now, we've seen a decline in tests, if you look at the last several weeks versus the end of 2020. If that decline continued and then you saw it continue throughout the whole year, you could get there. If the amount of testing we're doing today, on average, was maintained for the 6 months of this year -- the first 6 months, well, then you could do 0 for the second half of the year and still be there. So there are multiple different ways to get there.
My assumption going in is that the price is going to remain at where it is right now. So right now, it's $100. We're still in the emergency situation. That's been extended through the year. You have to hit the CMS guidelines, which is basically for the previous month, you have to have more than 50% at a 2-day turnaround. And then they look at each sample for the current month. We're well within that range. I mean right now, we did 275,000 tests a day. We're not doing anywhere near that, and our turnaround time's about a day. So I expect that the price you should assume is still about what we've averaged until now. I think for this quarter, it was about $90 on average.
It then comes down to the volume. And I assume that the volume is going to continue to decline, albeit maybe at a lower rate than we saw from the end of last year into this year. And then for the second half of the year, they'll be significantly less than the first half of this year. That's our base case assumption."
30643,700595964,2206039,"Laboratory Corporation of America Holdings, Q4 2020 Earnings Call, Feb 11, 2021",2021-02-11,"Earnings Calls","Labcorp Holdings Inc.","Executives","And Jack, just to reinforce it, too, one of the reasons we did break out the level of COVID testing separate from our Base Business, just given that we put a wider range around something that we feel is more uncertain versus, frankly, having better visibi",54,"And Jack, just to reinforce it, too, one of the reasons we did break out the level of COVID testing separate from our Base Business, just given that we put a wider range around something that we feel is more uncertain versus, frankly, having better visibility on just the performance of our Base Business."
