"companyid","keydevid","transcriptid","headline","mostimportantdateutc","keydeveventtypename","companyname","speakertypename","componenttextpreview","word_count","componenttext"
31726,694554492,2184386,"Southwest Airlines Co., Q4 2020 Earnings Call, Jan 28, 2021",2021-01-28,"Earnings Calls","Southwest Airlines Co.","Operator","Good day, and welcome to the Southwest Airlines Fourth Quarter and Annual 2020 Conference Call. My name is Chad, and I will be moderating today's call. This call is being recorded, and a replay will be available on southwest.com in the Investor Relations",69,"Good day, and welcome to the Southwest Airlines Fourth Quarter and Annual 2020 Conference Call. My name is Chad, and I will be moderating today's call. This call is being recorded, and a replay will be available on southwest.com in the Investor Relations section. [Operator Instructions] 
At this time, I'd like to turn the call over to Mr. Ryan Martinez, Managing Director of Investor Relations. Please go ahead, sir."
31726,694554492,2184386,"Southwest Airlines Co., Q4 2020 Earnings Call, Jan 28, 2021",2021-01-28,"Earnings Calls","Southwest Airlines Co.","Executives","Thank you, Chad, and I appreciate everyone joining us for our call today. In just a moment, we will share our prepared remarks and then open it up for Q&A. First, you will hear a comprehensive update from our Chairman of the Board and CEO, Gary Kelly; Chi",176,"Thank you, Chad, and I appreciate everyone joining us for our call today. In just a moment, we will share our prepared remarks and then open it up for Q&A. First, you will hear a comprehensive update from our Chairman of the Board and CEO, Gary Kelly; Chief Operating Officer, Mike Van de Ven; our President, Tom Nealon, and Executive Vice President and CFO, Tammy Romo. 
A few reminders. We will make forward-looking statements today, which are based on our current expectations of future performance, and our actual results could differ substantially from these expectations. 
And we also had several special items in our fourth quarter results, which we excluded from our trends for non-GAAP purposes, and we will reference those non-GAAP results in our remarks. And we have more information in our press release this morning regarding forward-looking statements, non-GAAP reconciliations to GAAP results and other important risk factors. You can find our release and other helpful resources on our Investor Relations website. 
So let's get started, and I will turn it over to Gary."
31726,694554492,2184386,"Southwest Airlines Co., Q4 2020 Earnings Call, Jan 28, 2021",2021-01-28,"Earnings Calls","Southwest Airlines Co.","Executives","Thank you, Ryan, and good morning, everybody, and thanks for joining us for our fourth quarter 2020 call. We closed out the year as expected with no surprises. And even Southwest is not immune to COVID-19, and we recognized our first annual loss since 197",751,"Thank you, Ryan, and good morning, everybody, and thanks for joining us for our fourth quarter 2020 call. We closed out the year as expected with no surprises. And even Southwest is not immune to COVID-19, and we recognized our first annual loss since 1972. It was a big one and with non-GAAP losses coming in at $3.5 billion. But having said that, we were and remain very well prepared to weather this continuing storm and especially important is that we want to emerge on top in the airline industry. 
We have the strongest liquidity. We have $14.3 billion, including $13.3 billion in cash and equivalents, $12 billion in unencumbered assets, and that doesn't include our [indiscernible] program. We have the strongest balance sheet, and pre-pandemic debt to total capital was a company record low at 24%. We have investment-grade credit ratings, and we have cash well in excess of our outstanding debt. 
Third, we have the best business model. We have an unprecedented run of 47 years of profitability, and that was built on low cost and low fares and coupled with great service. And that, in turn, has resulted in unprecedented job security, especially unprecedented for an airline going on 50 years without a furlough, without a pay cut and the only major airline to avoid all of that during this pandemic. And I'm very, very proud of that. 
We have the best operation. And as evidenced by the Wall Street Journal's annual ranking of airline performances, it was released this week, with Southwest as #1. 
And finally, we have the best customer service, and I base that on numerous brand surveys and my expectation that once again, we will be at the top of the industry in terms of the United States DOT Customer Satisfaction Index of fewest customer complaints. 
Now no one can deny that, that is a powerhouse combination of attributes for any company. And it just reminded me, as I was recapping that, I was listening to Herb many years ago, he pointed out that most companies never achieve the best designation in a single category, much less 5. And I mentioned these things really not to brag, but just to put things in perspective. And that is to say that yes, these are bad times. Yes, we had our first loss since our startup year. But we have much to be grateful for, and we have every reason to be hopeful that this, too, shall pass. And when it does, we will be ready. 
And speaking of being ready, I mean a surge -- a resurgence in traffic and revenues. So we want to be ready for that. And we have to have that to achieve breakeven and then beyond that, prosperity. So there's a balancing act here, and we're balancing a desire to conserve cash and minimize our losses, which requires that we operate at a reduced schedule as compared to the need and the ability to achieve breakeven by generating more traffic, and we can only do that by offering more flights. So getting that balance is key And we're intensely focused on that. 
And I'll just add that we've got the talent, we've got the experience, and we have the tools that we need to execute and execute that well. Once we get past this January, February, winter doldrum, we'll see what happens, and we'll respond accordingly. 
So we've got excellent updates prepared this morning for you from Mike Van de Ven, our COO; Tom Nealon, our President; and Tammy Romo, our CFO. So I don't want to steal any of their thunder, except to say one more thing. I mentioned before that we have a lot to be grateful for. And we do, and especially at Southwest. And I mentioned gratitude last time in our third quarter call, but I think it's important to repeat it again. I am especially grateful for our people, their resolve, their resilience, their civility and their love. They've gotten us to this point. They will get us through this. They have performed superbly. And I know that everybody in this room with me could would join me and say how proud we are of them, and we all just want to thank them profusely. They are heroes. 
So some of these heroes are sitting here with me. And Mike, I want to congratulate you on a magnificent operational performance. So why don't you kick us off this morning, Mr. Mike Van de Ven, COO."
31726,694554492,2184386,"Southwest Airlines Co., Q4 2020 Earnings Call, Jan 28, 2021",2021-01-28,"Earnings Calls","Southwest Airlines Co.","Executives","Well, thanks, Gary, and I'd be happy to. As Gary was mentioning, in terms of our operations, the fourth quarter was exceptional. We built significant momentum throughout the quarter. The MAX was approved to return to service. We received much needed gover",966,"Well, thanks, Gary, and I'd be happy to. As Gary was mentioning, in terms of our operations, the fourth quarter was exceptional. We built significant momentum throughout the quarter. The MAX was approved to return to service. We received much needed government support, and that allowed us to pivot away from those time-consuming discussions about furloughs and concessions and jobs security. 
We were able to grow our city portfolio and the vaccine rollout began. And beneath all of those things, Southwest produced our overall best quarterly operational performance in our history. 
And as Gary mentioned, I too have just -- I'm very proud and very grateful to our people. There's tremendous activity associated with all those items I just mentioned. And in addition to those things, though, our people still go to work every day. and deal with day-to-day issues of a pandemic environment, and yet they never lose their focus on our customers, on our company or each other. And they are just a great team. So for the fourth quarter, our on-time performance of 93% was industry-leading and the best in our history. We finished the year at 86%, and that was the best since 2003. 
Our baggage handling was equally as impressive with just over 2 bags per 1,000 carried being damaged or mishandled . So if you flip that around, that's about a 99.8% accuracy rate. And again, the best in our history and in the top tier in the industry. 
That reliability, coupled with our hospitality, produced Net Promoter Scores in the mid-70s for the fourth quarter and for the year. So again, the best performance in our history. And we do expect to lead the industry once more with the lowest DOT customer complaint ratio when those are published. 
So the capital off, we finished 2020 with the best overall operational performance of any U.S. airline as measured by the Wall Street Journal's middle fleet scorecard. So as I said before, just a great team. 
Our fleet has been a particular focus as of late. We now have a combination of additional aircraft available to us from the MAX return to service as well as a lower demand environment from this pandemic. And that gives our tech ops department several options to optimize our maintenance costs by storing some of our older aircraft and replacing any necessary flying with our most efficient aircraft, MAX. The MAX is more reliable. It has a lower fuel burn. It's quieter. It's less expensive to maintain, and it's our most comfortable aircraft from a customer perspective. And it is a key component of our future. 
So we took delivery of 7 leased MAXes from Boeing in December. And if you combine that with the 34 MAXes we had in storage in Victorville, that brought our MAX fleet to 41 aircraft by year-end. We also identified 20 of our older 737-700 that had an expensive near-term maintenance profile, and we accelerated their retirement at the year-end, and that brought our fleet total down to 718 aircraft for use in the operation as we go into 2021. 
There are 60 NGs included in that year-end fleet count in a long-term storage program. And so the rest of the airplanes, they rotate through our operation and our short-term parking program or they're in heavy maintenance visits. And that approach gives us tremendous near-term flexibility to either slow down or accelerate flight activity as demand dictates. 
So March 11 is when the MAX returns to revenue flying. All of our pilots will have been trained. We will have over 200 validation or readiness flight tests completed. And we'll be starting out in a very small and focused manner for the first month with just 10 lines of flying. They'll be isolated to all MAX lines. We will not co-mingle the NG and the MAX fleet for that first month of service. After that, we'll have roughly 65 MAX aircraft available for service, and we expect to be in normal operational mode by mid-April. We'll end 2021 with 69 MAX aircraft. 
In closing with the fleet, we plan on running similar requirement analysis to optimize maintenance costs in 2021, just like we did in 2020. And we don't expect our fleet to grow in 2021 as compared to the 747 aircraft at year-end 2019. We do continue to evaluate our longer-term fleet needs, and we are in discussions with Boeing as to our order book beyond 2021. As we do start this new year, we do have our eye on a couple of other critical operational areas. First, we are initiating operations in 8 new locations by June 6. There's quite a bit of coordination and facility build-out, staffing equipment and security-related actions that go into opening up a new location. And Gary, I think 8 between now and early June, is another all-time Southwest record, and that is a very impressive team. 
Second, we are in a very reactive environment with respect to COVID restrictions. There are new international requirements with testing and attestation protocols. They're evolving domestic requirements, and there are various mask-related challenges that our teams are reacting to every day. 
So it does take a special team to be able to deliver record-breaking operating results, manage a complicated fleet environment, bringing the MAX back into service and optimizing retirements of older airplanes to open up 8 new locations in 4 months and just to adjust on the fly to constantly changing COVID requirements. 
And I think about our people, and they make all of that look so easy, and I do it every day. And as I said, they're just a special team, and I'm really proud to be a part of it. 
And I think with that, Tom, I'll turn it over to you."
