"companyid","keydevid","transcriptid","headline","mostimportantdateutc","keydeveventtypename","companyname","speakertypename","componenttextpreview","word_count","componenttext"
31726,694554724,2255701,"Southwest Airlines Co., Q1 2021 Earnings Call, Apr 22, 2021",2021-04-22,"Earnings Calls","Southwest Airlines Co.","Executives","Thank you, Keith, and I appreciate everyone joining today. In just a moment, we will share our prepared remarks and then open it up for Q&A. And on today's call, we have our Chairman of the Board and CEO, Gary Kelly; Chief Operating Officer, Mike Van de V",210,"Thank you, Keith, and I appreciate everyone joining today. In just a moment, we will share our prepared remarks and then open it up for Q&A. And on today's call, we have our Chairman of the Board and CEO, Gary Kelly; Chief Operating Officer, Mike Van de Ven; our President, Tom Nealon; and Executive Vice President and CFO, Tammy Romo. We also have other senior executives with us for Q&A, including Andrew Watterson, Executive Vice President and Chief Commercial Officer; and Bob Jordan, Executive Vice President of Corporate Services. 
So a few quick reminders, and then we'll jump in. We will make forward-looking statements today, and those are based on our current expectations of future performance, and our actual results could differ substantially from these expectations. We also had several special items in our fourth quarter -- or excuse me, in our first quarter results, which we excluded from our trends for non-GAAP purposes, and we will reference those non-GAAP results in our remarks as well. We have more information on both of these in our press release from this morning, so please make sure you check that out as well as our Investor Relations website. 
So with that, we'll get started, and I'll turn over the call to Gary."
31726,694554724,2255701,"Southwest Airlines Co., Q1 2021 Earnings Call, Apr 22, 2021",2021-04-22,"Earnings Calls","Southwest Airlines Co.","Executives","Thank you, Ryan, and good morning, everybody, and welcome to our first quarter 2021 call. The first quarter results are notable. First of all, because they're a lot better than what we thought they would be back in January. But even with that improvement,",751,"Thank you, Ryan, and good morning, everybody, and welcome to our first quarter 2021 call. The first quarter results are notable. First of all, because they're a lot better than what we thought they would be back in January. But even with that improvement, we still lost $1 billion and it was worse than our fourth quarter results due to the weaker seasonality of January and February travel. And clearly, that's not sustainable. But fortunately, we're here to report that we believe the worst is now finally behind us. We have a much better outlook and report for second quarter, and we'll give you all a full brief on the first quarter results and our second quarter outlook. 
But here are a few topside highlights before I pass the call over to Mike. Number one, thankfully, we received a second round of payroll support or PSP from the Federal Government and effectively covering the first quarter It was much needed. We're very grateful. We're the only airline who has avoided pay cuts, layoffs, furloughs and the like. And I'm very, very gratified that our 50-year record remains intact on that front. Not counting working capital changes in cash flow, our cash losses of $1.3 billion were more than offset by the PSP. 
Number two, beginning with a mid-March inflection point, we finally began to see bookings improve from the 9-month, down 65% flatline that we have been experiencing. So vaccines, vaccinations, case counts and spring break all converged in the right way. And sensing this, we boosted our capacity by 50% overnight or 1,000 daily departures in the middle of March. 
Number three, taking into account our voluntary separation program and attrition since June, our staffing currently is at 92% of our June 2019 levels. And in addition, we've had thousands of people on leave. And now that we're adding flights, we're smoothly recalling those that are needed on voluntary leaves and having avoided the mess associated with furloughs. And as a result, we plan to fly 96% of our June 2019 ASMs, albeit with a different route network. But the point being is that we're very well prepared to flex up our capacity. And even having said that, I think that we're very well aware that it will still be messy and we'll have to carefully manage. 
Number four, please understand that the path back to breakeven and beyond is dependent upon 2 things. Number one, we have to have sufficient flight and seat activity, and you need to read into that, that means more than what we've been doing prior to March. And number two, we've got to have more customers to fill those flights and obviously, read into that revenue. So we have too much fixed costs for us to be profitable below roughly 3 to 3 -- 3,300 -- 3,000 to 3,300 flights a day. At least now it's realistic for us to project breakeven cash flow scenarios, which are possible here in the second quarter. 
So in summary, I'm -- a lot of things here this morning. I'm relieved. I'm optimistic. I'm enthused. I'm grateful and I'm especially thankful to our tens of thousands of employees, who have fought their way through this pandemic and gotten us at least at this point. We've got a long way to go, but I'm very, very confident that we can all depend upon our Southwest warriors. They are very resilient. 
And then finally, I'm pleased with the performances. The operation has been superb. The new cities are meeting or exceeding our expectations. I'm glad to have all of them as permanent additions to our route network. The addition of global distribution system capabilities could not have been a more timely add to our capabilities as we're pushing aggressively into the huge managed travel business market. And we've got a great domestic network. We've got great service. And finally, they're going to have access to low fares. 
The cost and the spending performance has also been excellent, and we're making great progress towards restoring our historic productivity and efficiency. And then I'm absolutely delighted with the deal that we reached with Boeing last month that strategically secures our position as an all 737 operator, with all the attendant competitive benefits that, that enables. 
And with that, I'm going to turn it over to our COO, Mike Van de Ven, who I know will elaborate more on that, but among other things. Mike, great job, great performance. So take it away."
31726,694554724,2255701,"Southwest Airlines Co., Q1 2021 Earnings Call, Apr 22, 2021",2021-04-22,"Earnings Calls","Southwest Airlines Co.","Executives","Well, thanks a lot, Gary. And well, we really had an action packed start of the year, and I'm very proud of our people and how they just continue to rise to the occasion. They've opened up 4 new stations in the first quarter and 2 more in April; implement",1057,"Well, thanks a lot, Gary. And well, we really had an action packed start of the year, and I'm very proud of our people and how they just continue to rise to the occasion. They've opened up 4 new stations in the first quarter and 2 more in April; implemented a Federal MAX mandate; returned the MAX to service; secured a new long-term Boeing order book for both the MAX 7 and the MAX 8; and reached service agreements with GE and CFM International for the Leap-1B engines. And all of that while running an exceptional operation. 
So we ended the quarter with an on-time performance of 86.2%. And that was good for third in the industry, and that included a reduction of roughly 4.4 points due to weather. As you know, we've got large operations in Texas and the entire state froze for several days in mid-February, and that impacted our network; as well as a winter storm Xylia, which impacted Denver as we launched into our March-based schedule. So speaking of our March schedule, we returned the MAX to revenue service on March 11. Once we've completed all of the maintenance requirements of the pilot training and we had a [ Felton post set ] of 200-plus readiness flights on the airplane. The launch was limited to 10 lines of flying and the airplanes were separated from the rest of the fleet for the first month of service. On April 12, we increased the lines of flying to 55 lines. And the aircraft are now fully interchangeable across the network. 
We currently have 64 MAX aircraft in the fleet, and we have 32 of those aircraft currently out of service, awaiting FAA approval of repair in structures from Boeing. The repairs will ensure that a sufficient ground path exists for certain components of the electrical power systems. These aircraft were identified by Boeing as part of the specific production run and the impact of MAX lines of flying are being covered by spare aircraft in our next-generation fleet. We're not experiencing any significant operational impact and once we receive FAA approval, it will take 2 to 3 days per aircraft to make the repairs and then with all the aircraft work expected to be complete in roughly 3 weeks. 
So turning back to the first quarter performance, our bag handling continues to produce all-time best company results. We delivered 99.7% of all bags and claim without a mishandled claim. And as you know, we do that carrying more free bags than anyone in the industry. And we continue to lead all marketing carriers with the lowest customer complaint ratio to the DOT. 
Perhaps the highlight of the first quarter was securing a new long-term order book with Boeing for the MAX 7 and the MAX 8 as well as our agreement with GE and CFM International to maintain the Leap-1B engines. So we announced our order book on March 29, and there are just a couple of items that I'd like to highlight. First, we added 100 firm orders for the MAX 7, which will be the replacement aircraft for our 737-700s. We also converted 70 MAX 8 firm orders to MAX 7 firm orders, and that brings our firm order book for the MAX 7 and the MAX 8 to 200 and 149 aircraft, respectively. We also added 155 options for either MAX 7 or MAX 8 aircraft, and that brings our total number of options to 270 aircraft. And the interchangeability of the options of -- between aircraft types, that just gives us tremendous flexibility. So when you put all that together, we are maintaining a substantial operational and economic efficiency as a result of a single fleet type and the Leap-1B engine provides at least a 14% better fuel efficiency, quieter engines and has excellent dispatch reliability to support our on-time operation. 
We intend to retire a significant number of our roughly 460 737-700s over the next 10 to 15 years, and the MAX 7 is best-in-class aircraft for us in that 150-seat category. Just like the MAX 8 is the best-in-class for us in the 175-seat category, The acceleration of our fleet modernization, I think makes great economic sense. It will also reduce carbon emissions and noise levels, which, of course, is better for the environment. And it also provides a superb cabin experience for our customers and our employees. 
Looking forward into the second quarter, we have a couple of important capabilities that we're going to add to the operation. First, we're in the final stages of obtaining ETOPS certification for our MAX 8 fleet. So the MAX and its fuel burn advantages roll out is not only to reduce our operating cost to [ Hawaii ] but it's also going to allow us to fill all 175 seats in winter wind conditions. And that's something that we can't always accomplish with the next-gen fleet. And that was our plan all along, but of course, the efforts were delayed as a result of the MAX grounding. 
Second, we're going to begin a fleet transition to an all-new maintenance recordkeeping system beginning with our 737-700s later this month. And this system replaces our Wizard system, and that system is nearly 30 years old. This new system provides us a foundation for real-time maintenance recordkeeping, paperless records, improved planning, better analytics and automated controls to enhance regulatory compliance. Once we complete the transition of the -700 fleet, then the -800s and the MAX will follow later this year. 
So just in closing, I can certainly feel the operational momentum building, and I have to tell you, it feels good. We are in the process of bringing our entire fleet back into an operational status. We're coordinating our staffing to ensure that we're resourced to fly at whatever our desired levels are. And we're introducing new capabilities and navigating through an environment that continues to be impacted by COVID. And our people are just magnificent. I can't say enough about them. They do all of these things. They still run a great operation, and it's amongst the best we've ever delivered. And they're just the best team that I've ever been associated with and my deepest thanks to each and every one of them. 
And so with that, President Nealon, over to you."
