"companyid","keydevid","transcriptid","headline","mostimportantdateutc","keydeveventtypename","companyname","speakertypename","componenttextpreview","word_count","componenttext"
38043467,1684665802,2413381,"Visa Inc., Q4 2021 Earnings Call, Oct 26, 2021",2021-10-26,"Earnings Calls","Visa Inc.","Executives","Thank you, Al. Good afternoon, everyone. Fiscal year 2021 was certainly a year of 2 very different halves. In the first half, net revenues declined 4% and non-GAAP EPS was down 2% as we lapped a pre-COVID first half of 2020. In the second half, the recove",2344,"Thank you, Al. Good afternoon, everyone. Fiscal year 2021 was certainly a year of 2 very different halves. In the first half, net revenues declined 4% and non-GAAP EPS was down 2% as we lapped a pre-COVID first half of 2020. In the second half, the recovery was well underway and we were lapping some of the worst 2020 COVID impacts. As a result, net revenue grew 28%, and non-GAAP EPS was up 43%. 
Fiscal fourth quarter results were better than we expected, with net revenues up 29%, driven by strong U.S. domestic trends, robust value-added services growth and higher cross-border volumes from a faster-than-anticipated recovery in travel. Had we recognized service revenues on current quarter's payment volumes, net revenue growth would have been approximately 22%. GAAP EPS grew 70%, including equity investment gains and a onetime noncash tax expense last year. Non-GAAP EPS rose 44%, helped by a lower tax rate. Exchange rate shifts increased both net revenue and EPS growth by approximately 0.5 point. 
In constant dollars, global payments volume was up 17%, led by continued strength in debit as well as improving credit spending. Compared to the fourth quarter of 2019, global payments volume was 21% higher, a 0.8 percentage point acceleration from Q3, with debit slowing 1 point and credit improving by 3 points versus Q3. Excluding China, total payments volume growth was 18% or 26% higher than 2019 and a 1 point acceleration from the third quarter. Chinese domestic volumes continue to be impacted by dual-branded cost conversion, which have minimal revenue impact. U.S. payments volume was up 30% over 2019, consistent with the third quarter. 
Credit improved 3 points to 17% above '19, helped by consumer, small business and commercial spending. Debit slowed 4 points but remained very strong at 44% above 2019 without much benefit from economic impact payments. Card-present spend improved 3 points to 15% above 2019, its highest level yet in the pandemic, driven by higher fuel and restaurant spending. Card-not-present volume, excluding travel, slowed 6 points to 53% over 2019 as some food and drug spending shifted back to card-present and retail spend was not as strong without the benefit of stimulus payments. 
International constant dollar payments volume improved 3 points from Q3, up 15% over 2019 levels. A few regional highlights. Latin America was up 58% from 2019, accelerated 10 points from the third quarter with robust performance across the region, fueled by cash digitization and client wins. Our CEMEA region remained strong, up 48% from 2019 levels, consistent with Q3, also fueled by cash digitization and client wins. Europe was up 20% from 2019, improving 3 points from Q3 due mostly to strong performance across Continental Europe. Asia Pacific remains our weakest region, up 5% from 2019 and consistent with Q3 excluding China. Many countries instituted restrictions in the quarter, including Australia, New Zealand, Japan and Singapore, but all have started to recover in the past few weeks. India payments volume has fully recovered from the severe COVID outbreak in Q3. 
Global processed transactions were 24% over 2019, improving 4 points from the third quarter as transactions improved faster than volume. Tap-to-pay penetration increased in many markets and ticket sizes started to return to normal in the U.S. Visa Direct transactions grew 35%, down from the 50s in the previous 3 quarters. This quarter, we lapped a very strong Q4 of fiscal year '20 when Visa Direct hit 1 billion transactions for the first time. Stimulus payments have ended, and we are lapping the COVID-related spike in P2P, which is moderating U.S. growth rates. 
Meanwhile, the international business is ramping nicely as well as growth from use cases such as cross-border remittances, earned wage access and marketplace payouts. The cross-border volume recovery continued as more countries open their borders while e-commerce spending, excluding travel, remains strong. Constant dollar cross-border volume, excluding transactions within Europe, was at 86% of 2019 volumes, a 4-point improvement from Q3 driven by the continued recovery in travel that started in May. Cross-border card-not-present volume, excluding travel, continued to be very strong at 43% above 2019, declining 13 points from the third quarter but consistent with Q2. As a reminder, the boost we saw in Q3 was primarily from cryptocurrency purchases. 
Cross-border travel-related spending, excluding intra-Europe, versus 2019, improved 13 points from Q3 to Q4. It has risen from 40% of 2019 in April to 50% in June to 61% in September. In terms of where travel-related spending is improving, aside from Asia Pacific, outbound spend in each region is indexing at similar levels versus 2019, and each improved by between 10 to 20 points in Q4 versus Q3. The largest improvements were in Canada, the Middle East and across Europe. Europe inbound spend improved by 24 points versus 2019 as popular travel destinations such as France and Italy relaxed their border restrictions. As we have seen consistently during the pandemic, there is pent-up demand for travel as bookings accelerate when a border is opened. Latin America remains by far the strongest destination, well over 2019 levels. U.S. to Mexico travel remained robust, with spend more than 60% above 2019 levels in Q4. Asia Pacific remains mostly closed and did not meaningfully improve in the fourth quarter, remaining below 30% of 2019, both inbound and outbound. 
Moving now to a quick review of fourth quarter financial results. Service revenues grew 41%, consistent with 39% nominal growth in third quarter payments volume and helped by small pricing modifications. Data processing grew 20%, in line with 21% processed transactions growth with a small impact from unfavorable country mix. International transaction revenues were up 41%, 7 points lower than nominal cross-border volumes, excluding intra-Europe, due to lapping high currency volatility last year and unfavorable regional mix. Other revenues grew 36%, led by consulting and data services as well as travel benefits. In total, value-added services revenue grew 25%, led by security and identity as well as consulting and data services with some benefit from COVID-related lapping effects. Client incentives were 26.7% of gross revenues, in line with our expectations. The 90 basis point increase from Q3 was primarily driven by strong performance in the U.S. and Latin America and fewer adjustments for underperformance in certain geographies, partially offset by improving cross-border volumes. 
Operating expenses grew 15%, in line with our expectations. Marketing expenses grew 58% in the quarter as we stepped up spending and also lapped reductions in Q4 last year. Personnel and professional services spend also accelerated as we continue to invest in our growth initiatives. We recorded gains from our equity investments of $101 million. Excluding investment gains, non-GAAP nonoperating expense was $118 million. Our non-GAAP tax rate of 16.5% was lower than expected due to the resolution of a tax matter. GAAP EPS was $1.65. Non-GAAP EPS was $1.62, up 44% over last year. 
We bought 13.2 million shares of class A common stock at an average price of $231.33 for $3.1 billion this quarter. Including our quarterly dividend of $0.32 per share, we returned over $3.7 billion of capital to shareholders in the quarter. On October 22, Visa's Board of Directors authorized a 17% increase in the quarterly dividend to $0.375 per share. For the full year, net revenues increased 10%, and non-GAAP EPS of $5.91 was up 17%. We returned $11.5 billion in capital to shareholders by repurchasing 39.7 million shares of class A common stock at an average price of $219.34 for $8.7 billion and by paying dividends of $2.8 billion. 
Before we discuss the year ahead, let me share performance through the first 3 weeks of October. U.S. payments volume was up 32% above 2019, consistent with September, with debit at 44% and credit at 22% above 2019. Processed transactions were 26% above 2019. Cross-border volume, excluding transactions within Europe, on a constant dollar basis was 94% of 2019, which is up 8 points from Q4 and 2 points from September. Travel-related spending versus 2019 improved 4 points compared to September to 65% of 2019. Card-not-present non-travel was 49% above 2019, up 6 points from the fourth quarter and down 2 points from September. 
Looking ahead to fiscal year 2022. Our business has been on a recovery track for the past 3 to 4 quarters. However, we are not back to normal yet globally. There are many factors to consider as we project the trajectory of the recovery. Debit and e-commerce have outperformed and stayed resilient even as credit recovers and in-store shopping returns. The full impact of stimulus payments and support programs ending remains to be seen. Cross-border travel is recovering well but still well below pre-COVID levels with a pace of recovery dependent on cross-border -- on border openings. Asia has not reopened to the degree the rest of the world has. The timing of reopening in key countries across Asia, both domestically and for cross-border travel, is a key variable. Most importantly, COVID variants are still with us and vaccination rates remain low in large parts of the globe. 
With these factors as the backdrop, forecasting the trajectory of the return to normalcy remains difficult. Visibility 4 quarters out, while improved, is still not great. For the past few quarters, we have been providing you our best sense of the business one quarter at a time, and we will continue that practice in fiscal year '22. 
Assuming current trends are sustained through December, we would expect first quarter net revenue growth in the high teens. Client incentives as a percent of gross revenue are likely to be in the 26% to 27% range, in line with the fourth quarter of fiscal year '21. Sustained investment spending, combined with low comparables last year, leads to operating expenses continuing to grow in the mid-teens. Nonoperating expense is expected to be in the $120 million to $130 million range and tax rate in the 19% to 19.5% range. 
Looking 4 quarters out, projecting gross revenue growth poses the greatest challenge. It is significantly dependent on the pace of the cross-border travel recovery as well as the other factors I just mentioned. It is all a function of your assumptions for these variables. In order to be helpful, we will share the assumptions we are making for internal planning purposes. For domestic volumes and transactions, we are assuming no disruptions from COVID-related lockdowns. As such, we assume that the recovery trajectory underway in payments volume and processed transactions stays intact through fiscal year '22. 
For cross-border travel, we assume the recovery underway continues steadily through fiscal year '22 to reach 2019 levels in the summer of 2023. We assume the index to 2019 climbs from around 60 currently to around 80 by September 2022. We also assume the strong growth in cross-border e-commerce continues. We expect new flows and value-added services growth in the high teens. We expect client incentives as a percent of gross revenues to range between 26% to 27% for the year, consistent with the fourth quarter fiscal year '21 levels. Pre-COVID, this percentage increased by 50 to 100 basis points each year due to the impact of new deals and renewals. 
In fiscal year '22, we expect to benefit from revenue mix improvement as cross-border travel continues to recover, partially offset by the lapping of incentive reductions we had in fiscal year '21 due to the COVID impact. These assumptions result in high end of mid-teens net revenue growth for fiscal year '22, including over 0.5 point of exchange rate drag from the strengthening dollar. First quarter growth in the high teens will moderate through the year as we lap the recovery in fiscal year '21. As I said, these are our assumptions for internal planning purposes. We will continue to provide our outlook for the business one quarter at a time through fiscal year '22. 
In terms of the other elements of the P&L, we expect operating expenses to grow in the low teens in fiscal year '22 as we step up investments across all 3 lines of business to lay the foundation for sustained higher growth post COVID. We have already increased marketing investment. We will invest heavily in our technology platforms to continue to enhance functionality, flexibility, security and reliability. We will invest to sustain the high growth we have in our new flows and value-added services business, and we will continue to add resources in market to help our clients utilize all of our new capabilities. Expense growth will be higher in the first half and moderate in the second half as we lap the resumption of investment spending in fiscal year '21. Nonoperating expense is expected to be in the $120 million to $130 million range each quarter, and our tax rate for the year is also expected to stay in the 19% to 19.5% range. None of these assumptions include Tink or Currencycloud, which we expect to close in the first half of the fiscal year. They will not be material to fiscal year '22 revenue or non-GAAP EPS. 
Visa remains a network of choice for innovators and money movement. We enable the innovators and disruptors. We help them scale, and in turn, innovators drive our growth. We have continued to enhance the functionality and flexibility of our network to substantially expand the money movement use cases we serve, supporting the new generation of fintechs as well as driving growth in our new flows business. Our value-added services add differentiation and create more value for our clients than alternative networks can. Our network of network strategy substantially increases our nodes, which we believe can create more value for all network participants than any closed-loop or geographically limited network. As we said at our Investor Day, we have a 10x growth opportunity ahead of us, and we are well positioned to capture it. We ended fiscal year '21 with good momentum, a high-growth, resilient debit and e-commerce business, recovering credit and cross-border travel, and new flows and value-added services are newer growth engines driving further acceleration. 
With that, I'll hand it over to Mike for Q&A."
38043467,1684665802,2413381,"Visa Inc., Q4 2021 Earnings Call, Oct 26, 2021",2021-10-26,"Earnings Calls","Visa Inc.","Executives","Thank you, Vasant. We're ready to take questions, Michelle.",9,"Thank you, Vasant. We're ready to take questions, Michelle."
38043467,1684665802,2413381,"Visa Inc., Q4 2021 Earnings Call, Oct 26, 2021",2021-10-26,"Earnings Calls","Visa Inc.","Operator","[Operator Instructions] Lisa Ellis from MoffettNathanson.",6,"[Operator Instructions] Lisa Ellis from MoffettNathanson."
38043467,1684665802,2413381,"Visa Inc., Q4 2021 Earnings Call, Oct 26, 2021",2021-10-26,"Earnings Calls","Visa Inc.","Analysts","Al, I wanted to follow up on #2 on your list that was related to Visa's network of networks. You highlighted open banking as one area that you view as a positive for Visa because it enables new flows and value-added services. It's often perceived, so actu",77,"Al, I wanted to follow up on #2 on your list that was related to Visa's network of networks. You highlighted open banking as one area that you view as a positive for Visa because it enables new flows and value-added services. It's often perceived, so actually, that open banking is a negative for Visa because it can shift volume away from debit. Can you just elaborate on this point and how Visa benefits from open banking?"
38043467,1684665802,2413381,"Visa Inc., Q4 2021 Earnings Call, Oct 26, 2021",2021-10-26,"Earnings Calls","Visa Inc.","Executives","Well, thank you, Lisa. Look, I think -- first of all, open banking, as you know, is in its early stages. We believe by jumping into the middle of it that we can help the ecosystem determine what is the best routing for different transactions. There are ce",264,"Well, thank you, Lisa. Look, I think -- first of all, open banking, as you know, is in its early stages. We believe by jumping into the middle of it that we can help the ecosystem determine what is the best routing for different transactions. There are certainly are transactions that will lend themselves to A2A kind of approach, which we know is one of the things that people will think about as a threat. But there's an awful lot of transactions, many, many transactions, where people appreciate the protections that are provided by a network like Visa, dispute resolution, fraud, security and the like. When money is moved instantaneously, that's nice at one level. But if -- once it's moved, it's awfully hard to get it back. And it's much more about other elements than just speed. 
We also think by getting involved with Tink, where we're right at an -- where we have the opportunity to really learn as we go, and we think that there's an opportunity to potentially provide value-added services even on transactions that might route in -- over a different network. So I would say, Lisa, the bottom line is you could see some transactions that are incremental, that might move off VisaNet or off of our normal rails. But the way we look at it is by leaning in, we're going to learn more about it and we're going to be able to influence what's happening, and we'll also be able to make sure that we can provide other capabilities and value-added services to the various transactions."
38043467,1684665802,2413381,"Visa Inc., Q4 2021 Earnings Call, Oct 26, 2021",2021-10-26,"Earnings Calls","Visa Inc.","Operator","David Koning from Baird.",4,"David Koning from Baird."
38043467,1684665802,2413381,"Visa Inc., Q4 2021 Earnings Call, Oct 26, 2021",2021-10-26,"Earnings Calls","Visa Inc.","Analysts","One thing I noticed was the last 6 years, I looked at the fiscal years, and every year, U.S. volumes grew the same or faster than rest of the world volumes. Maybe discuss a little bit -- I know COVID, the last year, generated some of that. But as we look",93,"One thing I noticed was the last 6 years, I looked at the fiscal years, and every year, U.S. volumes grew the same or faster than rest of the world volumes. Maybe discuss a little bit -- I know COVID, the last year, generated some of that. But as we look over the next 5 or even 10 years, a, does that reverse? And, b, as part of the U.S. growth, just all the new fintech stuff that's happened in the U.S., just creating a lift that is allowing kind of that outpacing."
38043467,1684665802,2413381,"Visa Inc., Q4 2021 Earnings Call, Oct 26, 2021",2021-10-26,"Earnings Calls","Visa Inc.","Executives","Well, I think, David, it's a combination of things. It certainly is the explosion of some of the neobanks and fintechs, although you're seeing those really develop all the way around the world. I would also say though that our Visa Direct platform is much",270,"Well, I think, David, it's a combination of things. It certainly is the explosion of some of the neobanks and fintechs, although you're seeing those really develop all the way around the world. I would also say though that our Visa Direct platform is much more mature in the United States than it is in other markets. Vasant somewhat alluded to that point in his remarks. And that has certainly helped spark some of the growth as well. I also think that the U.S., prior to the pandemic at least, was more advanced in e-commerce capabilities and was much -- adjusted even more quickly than other markets might have as we saw a rapid move towards cash digitization as COVID set upon us in March of 2020. 
All that said, we are setting out to invest around the globe and we want our business to grow in all markets and territories in which we do work. We're more than happy to have the U.S. continue to grow. But I think as I look at the future of the business over the next 5 to 10 years, I expect still healthy growth in the United States, but I do expect our volumes to continue to grow in a nice way around the world. I mean you saw it this prior quarter. As good as the growth was in the U.S. in the quarter, both Latin America and CEMEA had very, very strong quarters. And international growth was really held back by Asia Pacific, which has really been hit very, very hard by lockdowns and restrictions as a result of the pandemic."
38043467,1684665802,2413381,"Visa Inc., Q4 2021 Earnings Call, Oct 26, 2021",2021-10-26,"Earnings Calls","Visa Inc.","Executives","And the one other thing I might add as we look ahead, I mean all the things Al said, the reason international is a little held back right now is because Asia, which is almost 20% of our payments volume, is only growing at the levels -- the low single-digi",142,"And the one other thing I might add as we look ahead, I mean all the things Al said, the reason international is a little held back right now is because Asia, which is almost 20% of our payments volume, is only growing at the levels -- the low single-digit levels because they're largely still not open. The one thing to think about as we look ahead, as we said earlier, as Al said in his comments, contactless payments are already 70% penetrated outside the U.S. So that's still a growth engine in the U.S. that is just beginning to take off. And given the size of the U.S., that will be a meaningful contributor to transactions growth. And we also know that tap-to-pay digitizes cash and allows us to capture a much larger share of transactions at the point of sale."
38043467,1684665802,2413381,"Visa Inc., Q4 2021 Earnings Call, Oct 26, 2021",2021-10-26,"Earnings Calls","Visa Inc.","Operator","James Faucette from Morgan Stanley.",5,"James Faucette from Morgan Stanley."
38043467,1684665802,2413381,"Visa Inc., Q4 2021 Earnings Call, Oct 26, 2021",2021-10-26,"Earnings Calls","Visa Inc.","Analysts","Al, I want to go back to one of the comments that you made as it relates to buy now pay later and the growth of that and how you see that as a growth avenue for Visa. Can you talk a little bit -- I think I conceptually get the idea of expanding acceptance",93,"Al, I want to go back to one of the comments that you made as it relates to buy now pay later and the growth of that and how you see that as a growth avenue for Visa. Can you talk a little bit -- I think I conceptually get the idea of expanding acceptance and the advantages that Visa can provide there. But can you provide a little bit more color on like how you think that evolves and what those transactions will look like in a way that will benefit Visa?"
38043467,1684665802,2413381,"Visa Inc., Q4 2021 Earnings Call, Oct 26, 2021",2021-10-26,"Earnings Calls","Visa Inc.","Executives","Well, I think in the short term, James, we're seeing many, many of these players use us and use our credentials, whether they're virtual cards or debit or credit cards, to actually pay off the various installments. And so we're getting -- instead of 1 tra",208,"Well, I think in the short term, James, we're seeing many, many of these players use us and use our credentials, whether they're virtual cards or debit or credit cards, to actually pay off the various installments. And so we're getting -- instead of 1 transaction, we're getting 4 transactions. And certainly, that's very good for us. 
The point I was making is that in many ways, BNPL is a closed-loop capability somewhat akin to what wallets were 3 years ago. And closed loops just end up hitting a wall. They don't end up -- they end up hitting a wall where it's hard to scale. It's hard to bring the level of -- and depth of choice that you can to your customers. And so what I think is going to happen is that BNPL players will become issuers who will issue Visa credentials that will have the -- their value proposition for installments embedded within the product itself so that they can, therefore, scale very, very quickly by immediately having access to the 100 million merchants that I referenced in my remarks. And so that's what I believe, based on history, is going to happen. And that's what I'm referring to when I say BNPL 2.0."
38043467,1684665802,2413381,"Visa Inc., Q4 2021 Earnings Call, Oct 26, 2021",2021-10-26,"Earnings Calls","Visa Inc.","Operator","Sanjay Sakhrani from KBW.",4,"Sanjay Sakhrani from KBW."
38043467,1684665802,2413381,"Visa Inc., Q4 2021 Earnings Call, Oct 26, 2021",2021-10-26,"Earnings Calls","Visa Inc.","Analysts","So the reopening of the U.S. border should be a pretty big catalyst for you guys. I'm just curious if you guys are seeing anything in terms of bookings that's giving you any perspectives on the trajectory that you outlined and maybe what's assumed inside",48,"So the reopening of the U.S. border should be a pretty big catalyst for you guys. I'm just curious if you guys are seeing anything in terms of bookings that's giving you any perspectives on the trajectory that you outlined and maybe what's assumed inside your expectations."
