"companyid","keydevid","transcriptid","headline","mostimportantdateutc","keydeveventtypename","companyname","speakertypename","componenttextpreview","word_count","componenttext"
38043467,1673196600,2352168,"Visa Inc., Q3 2021 Earnings Call, Jul 27, 2021",2021-07-27,"Earnings Calls","Visa Inc.","Executives","Thank you, Al. Good afternoon, everyone. Fiscal third quarter results exceeded our expectations with net revenues up 27% and driven by robust growth in both credit and debit in the U.S., higher cross-border volumes from a faster-than-anticipated recovery",2190,"Thank you, Al. Good afternoon, everyone. Fiscal third quarter results exceeded our expectations with net revenues up 27% and driven by robust growth in both credit and debit in the U.S., higher cross-border volumes from a faster-than-anticipated recovery in travel as well as a spike in cryptocurrency purchases and lower client incentives, largely due to deal timing. As we recognized service revenues on current quarter payments volume, net revenue growth would have been 39%. The reason for this large difference in growth is a result of the significant quarter-over-quarter change in growth rates of payments volumes both last year and this year. The third quarter last year experienced the steepest drop in payments volume and third quarter this year has been our strongest growth quarter since the pandemic started. When adjusted for the service fee recognition lag, net revenues for Q3 FY '20 are lower and net revenues for Q3 this year are higher. GAAP EPS grew 10%, primarily due to a nonrecurring noncash step-up in deferred tax liabilities as a result of the recently announced increase in U.K. tax rates starting in 2023. Non-GAAP EPS rose 41%, helped by lower-than-expected expense growth and a lower tax rate. Exchange rate shifts lifted net revenue growth by 1 point and EPS growth by 2 points. As we did last quarter, to help you better assess both the magnitude and the trajectory of the recovery, we have also provided key performance metrics relative to fiscal year '19. In constant dollars, global payments volume was up 34%, led by continued strength in debit as well as improved credit spending. Compared to the third quarter of 2019, Global Payments volume was 21% higher a 5-point acceleration from the second quarter with debit and credit improving by 5 points and 4 points, respectively. Excluding China, total payments volume growth was 38% or 25% higher than 2019 and a 5-point acceleration from the second quarter. Chinese domestic volumes continue to be impacted by dual-branded card conversion, which have minimal revenue impact. U.S. payments volume growth was 40% and up 30% over 2019, benefiting from economic impact payments in the first half of the quarter and then from the lifting of COVID-related restrictions across the country. Debit growth accelerated 4 points, up 48% from 2019, remaining strong throughout the quarter as the trend towards accelerated cash digitization and e-commerce was sustained even as the economy reopened. Credit growth improved 8 points up 14 points from 2019. The credit improvement was fueled by 2 interrelated factors: a significant acceleration in travel, entertainment and restaurant spending as well as the resurgence of affluent cardholder spending. Card-present spend accelerated by 9 points to 12% about 2019, even as [Indiscernible] as in volume, excluding travel, improved 4 points to 59% over '19. Online shopping habits acquired during the pandemic are persisting. As the U.S. reopened, travel and entertainment spending improved steadily through the quarter, both up about 25 points from the second quarter. Travel is approaching 2019 levels in July, while entertainment surpassed 2019 levels in May. Restaurant spending in the quarter was over 20% above 2019 levels. Growth across all other spend categories remain strong and stable. International constant dollar payments volume growth improved 4 points from the second quarter, up 13% over 2019 levels. 
A few regional highlights. Growth in our CEMEA region remained strong, up 48% from 2019 levels, consistent with Q2, fueled by cash utilization and client wins. Latin America was also up 48% from 2019, accelerating 8 points from the second quarter with robust performance across the region, fueled by market share gains. Brazil volumes are seemingly unaffected by the high level of COVID cases due to significant cash utilization and large increases in e-commerce adoption. We're also benefiting from our digital partnerships and client wins in Brazil. Europe was up 17% from 2019, improving 9 points from the second quarter, the largest sequential acceleration among our regions. Across Europe, restrictions were relaxed and in-store spending recovered while e-commerce spend remains strong. Asia Pacific remains our weakest region up 5% from 2019 and down 3 points from the second quarter, excluding China. Performance across the region varied based on the level of infections and COVID-related restrictions. There were intermittent restrictions during the quarter in Australia, Japan and Singapore. Much of Southeast Asia was significantly impacted by rising COVID infections and result in lockdowns. In India, a sharp slowdown in spending starting in mid-April and through May was followed by a quick rebound with July trending well above 2019 levels. Global profit transaction growth was 20% over 2019, improving 4 points from the second quarter as transactions increased with volume across every region, except the U.S., where transaction growth still lags payments volume growth due to higher ticket sizes. Visa Direct transaction growth remained robust in the mid-50s. The cross-border volume recovery continued as more countries open their borders Constant dollar cross-border volume, excluding transactions within Europe, was at 82% of 2019 volumes, a 7-point improvement from Q2, led by a steady increase in travel as well as a spike in cross-border cryptocurrency purchases from mid-April through the end of May. Cross-border Card-not-present volume, excluding travel, continued to be very strong, up 56% from 2019, improving 12 points from the second quarter. The crypto prudency purchases representing most of that acceleration. We have seen more active cards and more spend per card in cryptocurrency purchases. We saw the normal seasonal uptick in cross-border travel spending during March and April. However, cross-border travel in May and June was stronger than the typical seasonal trend as many bottles reopened or ease requirements.  Cross-border travel-related spend, excluding intra-Europe, was at 45% of 2019 levels, expanding 6 points in the second quarter, rising from 40% of 2019 in April to 50% in June. The state of the cross-border travel recovery varies significantly across regions, depending on bother openings, quarantines and other requirements as well as infection levels. Outbound travel from the U.S. and Latin America was back to around 60% of 2019 levels in the third quarter, but as Europe and EMEA were about halfway back. Inbound travel has recovered the most into Latin America and EMEA with Latin America above 2019 levels due to Mexico, but as the U.S. and Europe are only about 1/3 of 2019 levels. Asia Pacific cross-border travel, both in and out, has recovered the least still at around 1/4 of 2019 levels. We have seen immediate impacts when popular travel destinations open their bothers. Greece open borders in April and inbound card present spend rose nearly 30 points by the end of June relative to 2019 levels. France opened on June 9, and inbound card-present volume rose nearly 20 points by the end of June relative to 2019. Travel to Mexico has been strong for several quarters, while the third quarter accelerated further helped by travel from the U.S. and this vaccination progress. 
Since April, core cross-border spend in Mexico from the U.S. rose nearly 50 points to over 170% of 2019 levels. 
Moving now to a quick review of third quarter financial results. Service revenues grew 17%, led by 11% growth in the second quarter constant dollar payments volume, helped further by favorable exchange rates and mix as well as small pricing modifications. Data processing grew 32% due to very strong domestic processed transaction growth, particularly outside the U.S. The 7 percentage point difference between revenue and processed transaction growth reflected the mix shift away from higher-yielding cross-border transactions. In addition, while value-added services recorded in data processing revenues had strong and accelerating growth, this was lower than overall process transaction growth, which benefited from lapping effects. International transaction revenues were up 54%, 8 points lower than nominal cross-border volumes, excluding intra-Europe, due to lapping high currency volatility last year and a less favorable regional mix. Other revenues grew 31%, led by consulting and data services and helped by lapping COVID impacts last year. In total, value-added services revenue grew 28%. Of the 14-point acceleration from the second quarter, about 2/3 was due to COVID-related lapping effects. Client incentives were 25.8% of gross revenues, consistent with the second quarter but lower than our expectations due to both numerator and denominator effects.  A lower-than-expected numerator as some deals were delayed and are now expected for the fourth quarter, also higher incentives from U.S. outperformance were largely offset by lower incentives from underperformance in Asia Pacific.  A higher-than-expected denominator as we had stronger cross-border volumes and value-added services revenue, both of which don't have significant incentives associated with them. Non-GAAP operating expenses grew 12%, below our expectations, mostly due to timing of some initiatives being pushed into Q4, particularly marketing spend and professional fees. Marketing expenses did grow over 50% in the quarter as we lapped reductions in spending at the outset of COVID last year. G&A expenses decreased year-over-year due to favorable foreign currency fluctuations and lower indirect taxes. We recorded gains from our equity investments of $439 million Visa has minority investments in over 50 strategic partners. When there is a new financing round or an IPO, per the accounting rules, we mark our investments to market, which can result in gains or losses. Our investment portfolio has been performing very well. There were gains across several of our investments. The gain recorded this quarter was largely driven by 1 partner financing round and another partner's IPO. Excluding investment gains, non-GAAP nonoperating expense was $114 million in the fiscal third quarter. Our GAAP tax rate was 41.3% due to a $1 billion nonrecurring noncash tax charge pertaining to the remeasurement of deferred tax liabilities and the taxes related to investment gains. The non-GAAP tax rate was lower than expected at 17.9% due to the recognition of a tax benefit. GAAP EPS was $1.18, an non-GAAP EPS was $1.49, up 41% over last year. We bought 9.5 million shares of Class A common stock at an average price of $227.83 for $2.2 billion this quarter. Including our quarterly dividend of $0.32 per share, we returned approximately $2.9 billion of capital to shareholders in the quarter. 
Moving on to our outlook for the fourth quarter. I'll start with business trends through July 21. U.S. payments volume growth was 31%, above 2019, consistent with the third quarter, with debit up 46% and credit up 17% versus 2019. As we've said before, weekly numbers can have noise in them. For example, in the third week of July 2019, and a major online retailer had their annual sales event, which impacted performance indexed to 2019, particularly e-commerce spending using credit. International payments volume trends versus 2019 are moderately about a third quarter, but in line with June. Notable exceptions include improvements in India, Canada and Brazil, with modest slowdown in Australia and Japan. Process transaction growth continued to improve, up 23% versus 2019. The Cross-border volume, excluding transactions within Europe on a constant dollar basis were 81% of 2019, which is 1 point below the third quarter in June. 
Travel-related spending versus 2019 improved 3 points compared to June, offset by lower e-commerce growth, mostly due to cryptocurrency purchases falling back to pre-April levels. The recent announcement by the U.K. and Canada regarding border openings in August should be helpful in the fourth quarter, while Asia Pacific remained largely close to travelers. Assuming July trends continue, fourth quarter net revenue growth is expected to be in line with the third quarter. We expect the benefit from the service fee recognition lab and the cross-border travel recovery to be partially offset by cryptocurrency purchases falling back to pre-April levels as well as smaller year-over-year lapping benefits in transaction processing and value-added services revenues. We expect client incentives as a percent of gross revenue to increase 0.5 point to 1 point versus the third quarter due to delays from the third quarter and the typical increase we see in Q4 due to the end of fiscal year-end deal closing -- end of fiscal year deal closings. The third quarter was the first quarter of growth relative to fiscal year '19, we have had since the pandemic started. Based on current trends, we expect fourth quarter net revenue growth relative to fiscal year '19 to be in the same range as the third quarter. 
Q4 operating expenses are expected to grow in the mid-teens inclusive of some expenses planned for the third quarter, which were pushed into Q4. Nonoperating expense is expected to be around $125 million our tax rate expectations are in the 19% to 19.5% range. In summary, we had a stronger-than-expected third quarter as economies and bottles reopened. Even as card present recovered, e-commerce spend stayed strong. [Indiscernible] spending sustained high growth rates as cash digitization remains robust. The cross-border travel recovery is gaining momentum. Our new flows and value-added services businesses continue to grow at high rates as they have all through the pandemic. We are stepping up investments in key growth initiatives as we look ahead to several quarters of recovery and prepare to capture the exciting opportunities available to us in the post-COVID era. 
With that, I'll hand it over to Mike for questions and answers."
38043467,1673196600,2352168,"Visa Inc., Q3 2021 Earnings Call, Jul 27, 2021",2021-07-27,"Earnings Calls","Visa Inc.","Executives","We're now ready to take questions, Michelle.",8,"We're now ready to take questions, Michelle."
38043467,1673196600,2352168,"Visa Inc., Q3 2021 Earnings Call, Jul 27, 2021",2021-07-27,"Earnings Calls","Visa Inc.","Operator","[Operator Instructions] Our first question comes from Tien-Tsin Huang from JPMorgan.",11,"[Operator Instructions] Our first question comes from Tien-Tsin Huang from JPMorgan."
38043467,1673196600,2352168,"Visa Inc., Q3 2021 Earnings Call, Jul 27, 2021",2021-07-27,"Earnings Calls","Visa Inc.","Analysts","A lot I could ask, but let me ask on debit versus credit dynamics. I'm really focused on the U.S. here. I'm just curious, Alex, one of your views on relative growth between debit and credit change based on what you've reserved so far and the recovery and",80,"A lot I could ask, but let me ask on debit versus credit dynamics. I'm really focused on the U.S. here. I'm just curious, Alex, one of your views on relative growth between debit and credit change based on what you've reserved so far and the recovery and with all these fintech things invest in card growth and card engagement, I think you mentioned current and some others. So just curious what your thinking is there structural growth between [Indiscernible]"
38043467,1673196600,2352168,"Visa Inc., Q3 2021 Earnings Call, Jul 27, 2021",2021-07-27,"Earnings Calls","Visa Inc.","Executives","I think what we're seeing now is, as you've seen in the numbers, debit has had indexing close to 150 COVID levels, that reflects really a huge step-up in the digitization of cash. It's evident all over the world. You see that in SEMEA numbers. You see it",211,"I think what we're seeing now is, as you've seen in the numbers, debit has had indexing close to 150 COVID levels, that reflects really a huge step-up in the digitization of cash. It's evident all over the world. You see that in SEMEA numbers. You see it on Latin America numbers. So debit is the engine of cash digitization. So structurally, debit is benefiting from cash digitization picking up as well as the move to e-commerce. What you are seeing though is that credit is accelerating quite fast. And if you look at the numbers, the biggest quarter-over-quarter recovery has been quite significant in credit. Structurally, I think what we're seeing is the affluent customer come back to spending because economies have reopened and the plastic sector that would benefit from reopening like restaurants, travel and entertainment, are also picking up. There are so many things going on here that are, let's call it, recovery related or fundamental changes like cash digitization and e-commerce that it's too early to tell whether there is a significant structural change between the use of debit and credit. I think credit has got quite a few quarters to go of recovery, and the trend remains quite robust even as we look at July."
38043467,1673196600,2352168,"Visa Inc., Q3 2021 Earnings Call, Jul 27, 2021",2021-07-27,"Earnings Calls","Visa Inc.","Executives","The only thing I would add, Tien-Tsin, is that we saw a major separation through the pandemic -- part of the pandemic between credit and debit growth. And this quarter, the separation between them in the business was more like 6 points where we've seen qu",65,"The only thing I would add, Tien-Tsin, is that we saw a major separation through the pandemic -- part of the pandemic between credit and debit growth. And this quarter, the separation between them in the business was more like 6 points where we've seen quarters closer to 30 points. So that's further indication of credit starting to rebound for the reasons that Visa articulated."
38043467,1673196600,2352168,"Visa Inc., Q3 2021 Earnings Call, Jul 27, 2021",2021-07-27,"Earnings Calls","Visa Inc.","Operator","Our next question comes from Harshita Rawat from Bernstein.",9,"Our next question comes from Harshita Rawat from Bernstein."
38043467,1673196600,2352168,"Visa Inc., Q3 2021 Earnings Call, Jul 27, 2021",2021-07-27,"Earnings Calls","Visa Inc.","Analysts","Can you talk about open banking? And what it means for Visa in light of the accelerated activity there in ocean acquisition of Think? In what way Visa can participate in this global move towards open banking? And also, can you talk about the potential to",53,"Can you talk about open banking? And what it means for Visa in light of the accelerated activity there in ocean acquisition of Think? In what way Visa can participate in this global move towards open banking? And also, can you talk about the potential to take PINK capabilities beyond Grant other deals?"
38043467,1673196600,2352168,"Visa Inc., Q3 2021 Earnings Call, Jul 27, 2021",2021-07-27,"Earnings Calls","Visa Inc.","Executives","Well, I'll start and Vasant can jump in. The epicenter of open banking is Europe, which is what attracted us to PINK. It is an open banking platform that has a footprint in 18 markets that allows through a single API customers, which are primarily develop",188,"Well, I'll start and Vasant can jump in. The epicenter of open banking is Europe, which is what attracted us to PINK. It is an open banking platform that has a footprint in 18 markets that allows through a single API customers, which are primarily developers to access financial data and take us connectivity to about 3,400 banks in FIs and about 10,000 developers in Europe. And it's one of 400 players, I mean, versus other markets. 
There's an awful lot of players in the open banking space in Europe because of the fact that it is in ground -- it is ground zero. And we do think that the combination of our various capabilities and relationships, combined with Tink's technology and relationship is going to ideally accelerate the adoption of open banking in Europe. 
It's early days, but there is going to be an increased adoption of open banking. And we see making progress in Europe first even beyond the 18 markets that Tink is in, and there's no reason why we can't take the business to other parts of the world, particularly in Asia and CEMEA."
38043467,1673196600,2352168,"Visa Inc., Q3 2021 Earnings Call, Jul 27, 2021",2021-07-27,"Earnings Calls","Visa Inc.","Operator","Ramsey El-Assal from Barclays.",5,"Ramsey El-Assal from Barclays."
38043467,1673196600,2352168,"Visa Inc., Q3 2021 Earnings Call, Jul 27, 2021",2021-07-27,"Earnings Calls","Visa Inc.","Analysts","Could you update us on B2B Connect and talk a little bit how your go-to-market strategy there is evolving? How is it ramping? And just give us a general update on what's happening with B2B Connect.",37,"Could you update us on B2B Connect and talk a little bit how your go-to-market strategy there is evolving? How is it ramping? And just give us a general update on what's happening with B2B Connect."
38043467,1673196600,2352168,"Visa Inc., Q3 2021 Earnings Call, Jul 27, 2021",2021-07-27,"Earnings Calls","Visa Inc.","Executives","Well, I think as we've talked in the past, the most important thing with B2B Connect is to continue to grow out the infrastructure. And that requires both signing key partners. We had announced last quarter, I guess, the signing of Goldman Sachs transacti",224,"Well, I think as we've talked in the past, the most important thing with B2B Connect is to continue to grow out the infrastructure. And that requires both signing key partners. We had announced last quarter, I guess, the signing of Goldman Sachs transaction banking as a user of B2B Connect. And we're using bank integrators like ACI and Fiserv and bottom line to help us as well in terms of of driving more players in B2B Connect. 
At this point, that's our emphasis. Our emphasis is building out this -- the robustness of this network. So it has more endpoints and more clients. Again, we see this as a $10 billion opportunity, and we think that B2B Connect is -- has the capability to be a much better than Swift kind of alternative for driving payments without having to build -- cross-border payments without having to build out a corresponding banking network. 
So we've continued to sign players, and they've continued to do their infrastructure connections to us, and we've started to drive transactions. But at this point, when I have an update on B2B Connect, I'm much more interested in how we're doing in driving the robustness of the network versus being at a point where we're counting progress on the number of transactions that we're actually seeing flow over the network."
38043467,1673196600,2352168,"Visa Inc., Q3 2021 Earnings Call, Jul 27, 2021",2021-07-27,"Earnings Calls","Visa Inc.","Executives","Yes. One other thing I might add to that is you may have seen the announcement of payout -- Visa payout service. Essentially, we're integrating both Visa Direct and B2B Connect to offer a single point for our customers to come to us for all kinds of cross",146,"Yes. One other thing I might add to that is you may have seen the announcement of payout -- Visa payout service. Essentially, we're integrating both Visa Direct and B2B Connect to offer a single point for our customers to come to us for all kinds of cross-border payments, either business customers, B2B customers, whether they are low ticket, high volume, which we can handle through the Visa Direct capability and Earthport or if they're high-value, low-volume transactions, which we can handle through B2B Connect. 
So essentially, from a client standpoint, they don't -- they just interface with us. And whatever the needs are, we can meet in any form whether it's through account or card or to any part of the world. So it's important to note that it also sort of integrates well with our other capabilities to provide a single point of contact."
38043467,1673196600,2352168,"Visa Inc., Q3 2021 Earnings Call, Jul 27, 2021",2021-07-27,"Earnings Calls","Visa Inc.","Operator","Our next question comes from Lisa Ellis with MoffettNathanson.",9,"Our next question comes from Lisa Ellis with MoffettNathanson."
38043467,1673196600,2352168,"Visa Inc., Q3 2021 Earnings Call, Jul 27, 2021",2021-07-27,"Earnings Calls","Visa Inc.","Analysts","Wanted to dig in a little on value-added services and new flows, given the call out that value-added services grew 28%, I think you said in the quarter. Was peaking back at Investor Day, February 2020, which is, of course, a lifetime ago now. But at the t",142,"Wanted to dig in a little on value-added services and new flows, given the call out that value-added services grew 28%, I think you said in the quarter. Was peaking back at Investor Day, February 2020, which is, of course, a lifetime ago now. But at the time, you had kind of put this framework out that new flows and value-added services were around 23% of revenues growing in the high teens, and that was sort of momentum expected going forward. 
Can you just kind of broadly talk about now 18 months later through the pandemic how your outlook for new flows and value-added services has evolved? Do you now expect it to be faster and bigger given both the secular shifts during the pandemic as well as some of the acquisitions you've made? Maybe what's just changed in that outlook?"
