"companyid","keydevid","transcriptid","headline","mostimportantdateutc","keydeveventtypename","companyname","speakertypename","componenttextpreview","word_count","componenttext"
38043467,701220863,2205074,"Visa Inc., Q1 2021 Earnings Call, Jan 28, 2021",2021-01-28,"Earnings Calls","Visa Inc.","Executives","So Tien-Tsin, thank you. I guess a little bit of color for everybody. About 2/3 of our value-added services are in data processing, and they basically are transaction-based revenue streams. And that's CyberSource. That's our risk and identity products. Th",239,"So Tien-Tsin, thank you. I guess a little bit of color for everybody. About 2/3 of our value-added services are in data processing, and they basically are transaction-based revenue streams. And that's CyberSource. That's our risk and identity products. That's DPS. And all of those will tend to continue to produce very good volumes, and they'll move with transactions as transaction tools. About 1/3 of our value-added services are split between services revenue, which tends to be card benefits that are offered as a package. And then in other revenue, we have volumes that are not -- I'm sorry, we have services not tied to volumes, things like consultants, our consulting practice and travel-related card benefits that obviously have been down. So I think as travel would be -- to come back at some point, that obviously would help that volume.
So -- with that color we saw -- obviously, in a world where e-commerce and omni-commerce is becoming a big deal. Cyber volume was very, very good and grow revenue. We continue to have more and more customers engage with us on risk and identity services. And as I said earlier now, we're excited about the fact that we're going to take our debit processing system beyond the United States. And we've now got it -- starting to use it in Europe. I think that, that gives us a good platform for growth going forward as well."
38043467,701220863,2205074,"Visa Inc., Q1 2021 Earnings Call, Jan 28, 2021",2021-01-28,"Earnings Calls","Visa Inc.","Operator","Our next question comes from Don Fandetti from Wells.",9,"Our next question comes from Don Fandetti from Wells."
38043467,701220863,2205074,"Visa Inc., Q1 2021 Earnings Call, Jan 28, 2021",2021-01-28,"Earnings Calls","Visa Inc.","Analysts","Al and Vasant, in terms of the cross-border improvement, I thought that was actually pretty decent Q-over-Q improvement on the growth rate. Did the U.S. -- during lockdown, you said it remained strong, but did it improve? Was that a factor in the overall",46,"Al and Vasant, in terms of the cross-border improvement, I thought that was actually pretty decent Q-over-Q improvement on the growth rate. Did the U.S. -- during lockdown, you said it remained strong, but did it improve? Was that a factor in the overall improvement year-over-year?"
38043467,701220863,2205074,"Visa Inc., Q1 2021 Earnings Call, Jan 28, 2021",2021-01-28,"Earnings Calls","Visa Inc.","Executives","Don, it was really -- in Latin America, it was really U.S. to Mexico and U.S. to the Caribbean that drove the volume in North America. Beyond that, Dubai opened a bit. Now Dubai is having a little bit of resurgence and just went back into some restriction",151,"Don, it was really -- in Latin America, it was really U.S. to Mexico and U.S. to the Caribbean that drove the volume in North America. Beyond that, Dubai opened a bit. Now Dubai is having a little bit of resurgence and just went back into some restrictions earlier this week. But Dubai has been open, and there's been a decent amount of travel intra-Middle East. There's been a little bit of an opening amongst the countries in the former Soviet Union. And then there's been some improvement or some movement in inter-travel within South America. So those are kind of the spots where we've seen the improvements in cross-border. Most of the rest of the corridors around the world continued to be, as Vasant mentioned in his remarks, either closed or subject to, like, really tough restrictions that make it very difficult to -- for somebody to take on traveling."
38043467,701220863,2205074,"Visa Inc., Q1 2021 Earnings Call, Jan 28, 2021",2021-01-28,"Earnings Calls","Visa Inc.","Analysts","Then Al, as you look at these numbers, are you still feeling like the data points suggest there's a fair amount of pent-up demand when things do open up?",29,"Then Al, as you look at these numbers, are you still feeling like the data points suggest there's a fair amount of pent-up demand when things do open up?"
38043467,701220863,2205074,"Visa Inc., Q1 2021 Earnings Call, Jan 28, 2021",2021-01-28,"Earnings Calls","Visa Inc.","Executives","Well, I think Don, as it relates to consumer travel, which is the vast majority of our payment volume in the travel sector over the years, I do think we're going to see some openings, for sure. I think there's a lot of pent-up demand. I mean there's a lot",265,"Well, I think Don, as it relates to consumer travel, which is the vast majority of our payment volume in the travel sector over the years, I do think we're going to see some openings, for sure. I think there's a lot of pent-up demand. I mean there's a lot of people who haven't seen families, parents who haven't seen grandchildren, children who haven't seen parents, and are going to want to jump on planes. I also think a lot of people are stir-crazy and want to get out. And then you've got people who are true global citizens who are knocking things off their to-do lists in terms of places they want to go and places they want to see. So I think consumer travel at the right time, but we need to see these restrictions be mitigated or lessened in a pretty big way.
I think it's going to come back quite strongly. I think it's going to take more time to see business travel come back. And frankly, it might take years for business travel to return to what it is. I mean we've all gotten accustomed to talking on video conferences, et cetera. I think we all probably realized that there are trips that we took or authorized in the past that when we look back on it today in the light of talking on video, we say, ""Why did we send somebody to that meeting for a 1.5-hour presentation that they could have just as well done on video?"" So that's the way I think about it going forward, Don."
38043467,701220863,2205074,"Visa Inc., Q1 2021 Earnings Call, Jan 28, 2021",2021-01-28,"Earnings Calls","Visa Inc.","Operator","Our next question comes from Lisa Ellis with MoffettNathanson.",9,"Our next question comes from Lisa Ellis with MoffettNathanson."
38043467,701220863,2205074,"Visa Inc., Q1 2021 Earnings Call, Jan 28, 2021",2021-01-28,"Earnings Calls","Visa Inc.","Analysts","A follow-up question from me on Visa Direct, which you highlighted again grew almost 60% in the quarter. At your Investor Day last February, you had sized the B2C, G2C and P2P markets about 60 trillion in total payment volume. And I believe Visa Direct di",105,"A follow-up question from me on Visa Direct, which you highlighted again grew almost 60% in the quarter. At your Investor Day last February, you had sized the B2C, G2C and P2P markets about 60 trillion in total payment volume. And I believe Visa Direct did about 350 billion last year, so about 0.5% of that. Can you talk about over time, as you're seeing Visa Direct develop, how much of those markets do you think is potentially addressable by Visa Direct? And any hint of the monetization level that we should be thinking about, something similar to domestic debit or different from that?"
38043467,701220863,2205074,"Visa Inc., Q1 2021 Earnings Call, Jan 28, 2021",2021-01-28,"Earnings Calls","Visa Inc.","Executives","Well, Lisa, thank you for the question. We -- Visa Direct has the ability to grow on a number of vectors. The 2 that I think are the most obvious is in terms of -- or 3 I'd say: continued penetration of current use cases; new use cases that get developed;",337,"Well, Lisa, thank you for the question. We -- Visa Direct has the ability to grow on a number of vectors. The 2 that I think are the most obvious is in terms of -- or 3 I'd say: continued penetration of current use cases; new use cases that get developed; and then thirdly, geographic expansion. And this is a business that we're still building out. There's still lots to do in all 3 of those categories. And to an earlier question I think Don asked, we're going to continue to invest in that area. And look, there's markets where we haven't even really laid any trap for Visa Direct. There's use cases where we haven't laid any traps, and our plan is to continue to do that.
If we look at the very first Visa Direct use case which continues to grow substantially, P2P payments, there's still lots to do both in domestic P2P payments, but we think our key future growth area is in cross-border P2P and remittance, and we're beginning to take steps there to enable that. And I mentioned in my remarks the fact that we've got relationships with 4 of the 5 top global money transfer operators, and that's helping us quite a bit. I think Earned Wage Access really continues to be a real opportunity. And I touched a little bit on a few of those cases. But there's still lots of geographies and lots of organizations that we have the ability to penetrate to grow that.
And then you've got on the B2C use cases, things like food and grocery delivery and online gaming and insurance claim payouts. So all of those are, I would say, in the early innings of a baseball game in terms of our ability to continue to make progress and drive those. So I continue to believe that this platform of which we can generate dozens and dozens of use cases will, for quite some, time be really important to us from a growth perspective."
38043467,701220863,2205074,"Visa Inc., Q1 2021 Earnings Call, Jan 28, 2021",2021-01-28,"Earnings Calls","Visa Inc.","Operator","Next question comes from Chris Brendler with Seaport Global.",9,"Next question comes from Chris Brendler with Seaport Global."
38043467,701220863,2205074,"Visa Inc., Q1 2021 Earnings Call, Jan 28, 2021",2021-01-28,"Earnings Calls","Visa Inc.","Analysts","Al, good to talk to you. I'd love to hear your thoughts on the buy now, pay later phenomenon that seems to be gathering steam, and I know you have a solution there and how big you think that solution could become. And is there any competitive threat from",62,"Al, good to talk to you. I'd love to hear your thoughts on the buy now, pay later phenomenon that seems to be gathering steam, and I know you have a solution there and how big you think that solution could become. And is there any competitive threat from consumers choosing a different payment option in the checkout and when checking online?"
38043467,701220863,2205074,"Visa Inc., Q1 2021 Earnings Call, Jan 28, 2021",2021-01-28,"Earnings Calls","Visa Inc.","Executives","Well, Chris, this is a pretty interesting space, and I think we're in the early days in most markets. There's a number of different models. I think I've said before, I think Vasant said before, we're not in the business of picking winners and losers. We s",270,"Well, Chris, this is a pretty interesting space, and I think we're in the early days in most markets. There's a number of different models. I think I've said before, I think Vasant said before, we're not in the business of picking winners and losers. We see our job as enablement no matter what the model is. But in some cases, the player is the actual lender. In some cases, they're sourcing a lender. In some cases, the installments are very short term, weeks at a time. In some cases, they're long term. Some providers only do installments. Some allow multiple payment options: pay now, pay on delivery, pay off on various numbers of installments. And then obviously, this is where it's exciting for us, multiple ways to pay off installments: virtual cards, debit cards, ACH. And it's also a payment model today that's heavily funded by the merchant.
Our strategy, Chris, is to be broad, to play with multiple third-party providers and offer a Visa platform to enable issuers to offer pay now -- buy now, pay now -- pay later capability. And we seek to work with all these options. And obviously, what we want to do is get virtual cards for Visa in place as one option for repayment. We also want to put Visa cards on file as another option. And I would remind you that these installments do break -- at its core, these installments break a transaction or a purchase into 3 or 4 or 5 payment transactions, which is good for us, because it gives us more transactions on which to earn fees."
38043467,701220863,2205074,"Visa Inc., Q1 2021 Earnings Call, Jan 28, 2021",2021-01-28,"Earnings Calls","Visa Inc.","Analysts","That's great. One quick follow-up if I might is, in places like Sweden where it's become the dominant tender share, did it actually -- do you actually see an impact on volume or are enough people choosing your cards that this will actually impact the volu",62,"That's great. One quick follow-up if I might is, in places like Sweden where it's become the dominant tender share, did it actually -- do you actually see an impact on volume or are enough people choosing your cards that this will actually impact the volume given how much growth in buy now, pay later is taking place in that area?"
38043467,701220863,2205074,"Visa Inc., Q1 2021 Earnings Call, Jan 28, 2021",2021-01-28,"Earnings Calls","Visa Inc.","Executives","So there's only a -- there's a few countries, you mentioned Sweden, another one is Australia. There's not many, there's a few countries where this has really taken off. And I think it certainly had some impact on banks in those markets. But in many cases,",79,"So there's only a -- there's a few countries, you mentioned Sweden, another one is Australia. There's not many, there's a few countries where this has really taken off. And I think it certainly had some impact on banks in those markets. But in many cases, because of the kind of payoff capabilities I talked about, card on file, virtual cards, et cetera, a lot of that buy is coming back to us in the form of repayments."
38043467,701220863,2205074,"Visa Inc., Q1 2021 Earnings Call, Jan 28, 2021",2021-01-28,"Earnings Calls","Visa Inc.","Operator","next question comes from Darrin Peller with Wolfe.",8,"next question comes from Darrin Peller with Wolfe."
38043467,701220863,2205074,"Visa Inc., Q1 2021 Earnings Call, Jan 28, 2021",2021-01-28,"Earnings Calls","Visa Inc.","Analysts","Just one quick one for Vasant, and then Al, just a more structural one. So I'll just -- if I can just do them both at once. But Vasant, when we look at the incentive side, I know you guys said that it was timing related why it came in below the range this",204,"Just one quick one for Vasant, and then Al, just a more structural one. So I'll just -- if I can just do them both at once. But Vasant, when we look at the incentive side, I know you guys said that it was timing related why it came in below the range this quarter, but it will come in high -- I think you said higher than the range or potentially could be for the next quarter. When we think about when you first guided to the 25.5% to 26.5% range, it was embedding cross-border activity similar to the September quarter, which was -- ended up being better. So I guess I just want to know, you're assuming now some deterioration or more conservatism in cross-border before maybe it gets better later in the year.
And then I guess, Al, maybe I could just squeeze in. Structurally, again, things like debit are seeming to be somewhat sustainable. It's not all just people using more nondiscretionary. I'm curious what you would identify now, after having seen about a year of the pandemic almost, where are the top 2 or 3 items you think structurally are impacting your business longer-term and here to stay potentially?"
38043467,701220863,2205074,"Visa Inc., Q1 2021 Earnings Call, Jan 28, 2021",2021-01-28,"Earnings Calls","Visa Inc.","Executives","Just taking the incentive question, we try to give you our best sense sort of range. And at this point, the visibility is greatest in the first half since we're halfway through it, and we think we'll be right in the middle of the range. There are many var",179,"Just taking the incentive question, we try to give you our best sense sort of range. And at this point, the visibility is greatest in the first half since we're halfway through it, and we think we'll be right in the middle of the range. There are many variables here that go into it in a time like this when things are moving around quite a bit. Certainly, cross-border doing better helps. Renewals will have an impact. Sometimes they happen when we expect, sometimes they don't.
There's also the year-over-year improvements that our clients have. As you know, last year, many clients, because of the pandemic, didn't hit certain thresholds. This year, if things are recovering faster, there could be -- we think they'll all make their thresholds and more. That has a year-over-year impact and it varies by client. So there's a bunch of these things moving around at the same time. And the good news is we think we're right in the middle of the range, and we'll give you more as we go through the year."
38043467,701220863,2205074,"Visa Inc., Q1 2021 Earnings Call, Jan 28, 2021",2021-01-28,"Earnings Calls","Visa Inc.","Executives","Darrin, on your second question, first of all, there's many reasons why debit has been a star here. Not -- you've got the stimulus payments that are on prepaid cards, which count in -- we count prepaid in our debit business. As e-commerce has moved into m",374,"Darrin, on your second question, first of all, there's many reasons why debit has been a star here. Not -- you've got the stimulus payments that are on prepaid cards, which count in -- we count prepaid in our debit business. As e-commerce has moved into more everyday categories, people are using debit. People are more comfortable in tough situations, tough times, to use money they have versus borrow money that they don't have. But I think when I look ahead structurally, to answer your question, look, I think e-commerce adoption has probably accelerated 3 to 5 years in the last year. And I don't think that's going backward. I think that people who have gotten used to shopping on their phone or their tablet or their computer are going to continue to do that.
I think the other thing that I look at structurally that's really exciting is there's a great opportunity to continue to grow both sides of this 2-sided market of buyers and sellers. Wallet proliferation is continuing. And we're working really hard to get credentials in wallets, which just adds to the -- these wallets, in essence, of becoming issuers. And that helps generate more buyers. And the cost of acceptance is going down around the world as more and more players are getting into it, and that's going to grow the number of sellers on our network. And as that network grows, I think that's going to be a really positive thing for us.
Obviously, e-commerce comes with the issue of no cash, but I think that people are getting increasingly concerned about cash. And the combination of tap to pay in the physical world where the card doesn't need to leave your hands to go to anybody else in order to transact and the fact that e-commerce doesn't -- cash is not an option, those are -- all of those things, I think structurally, are very positive for us. The thing -- on the flip side also, I mentioned that while business travel is a small piece of our overall travel, that will be one of those things that will be a little bit slower to come back and maybe never back at the level it was pre-COVID-19."
38043467,701220863,2205074,"Visa Inc., Q1 2021 Earnings Call, Jan 28, 2021",2021-01-28,"Earnings Calls","Visa Inc.","Operator","Bryan Keane from Deutsche Bank.",5,"Bryan Keane from Deutsche Bank."
38043467,701220863,2205074,"Visa Inc., Q1 2021 Earnings Call, Jan 28, 2021",2021-01-28,"Earnings Calls","Visa Inc.","Analysts","Vasant, I wanted to ask about cross-border. As that comes back, especially likely in this second half of this calendar year, how do we think about the higher yields and profitability, how that will flow to the bottom line versus additional investments you",62,"Vasant, I wanted to ask about cross-border. As that comes back, especially likely in this second half of this calendar year, how do we think about the higher yields and profitability, how that will flow to the bottom line versus additional investments you talked about? What would necessarily be those investments? Would it offset completely the benefit we'll see from that cross-border?"
38043467,701220863,2205074,"Visa Inc., Q1 2021 Earnings Call, Jan 28, 2021",2021-01-28,"Earnings Calls","Visa Inc.","Executives","Well, I mean there's no question, cross-border coming back has a meaningful impact on our revenue line. You saw that already in the first quarter, our cross-border was better than we expected. And as a result, our revenues were also quite a bit better tha",211,"Well, I mean there's no question, cross-border coming back has a meaningful impact on our revenue line. You saw that already in the first quarter, our cross-border was better than we expected. And as a result, our revenues were also quite a bit better than we expected. We're saying that we will step up our investment in the second half and expect our expenses to grow double digits, but if the cross-border business comes back in a meaningful way, I mean that's clearly going to be much better growth on the top line than that double-digit increase in expenses that we're planning.
Also, you should remember that we start lapping the declines in our expenses from last year. Our expenses last year declined by 5% or so in the second half. So when we grow them double digits this year, this fiscal year in the second half, over a 2-year period, we're only growing them about 5%. So net-net, I mean cross-border coming back is going to have a very positive impact on our business, especially if it comes back faster than we might be expecting. In any case, the comparisons get better, so you will begin to see growth in the cross-border business just because of what happened last year."
38043467,701220863,2205074,"Visa Inc., Q1 2021 Earnings Call, Jan 28, 2021",2021-01-28,"Earnings Calls","Visa Inc.","Operator","Our next question comes from Harshita Rawat from Bernstein.",9,"Our next question comes from Harshita Rawat from Bernstein."
38043467,701220863,2205074,"Visa Inc., Q1 2021 Earnings Call, Jan 28, 2021",2021-01-28,"Earnings Calls","Visa Inc.","Analysts","I have a question on your volume metrics. If I compare your metrics relative to your closest peer, over the last 2 quarters, we have seen the reverse of your Europe and U.S. volume growth rate, has been faster than your peers. How should we think about th",71,"I have a question on your volume metrics. If I compare your metrics relative to your closest peer, over the last 2 quarters, we have seen the reverse of your Europe and U.S. volume growth rate, has been faster than your peers. How should we think about that? Is it some deal flow coming in, your partnerships with fintech, the Visa Direct in the numbers? Any color there would be helpful."
38043467,701220863,2205074,"Visa Inc., Q1 2021 Earnings Call, Jan 28, 2021",2021-01-28,"Earnings Calls","Visa Inc.","Executives","Well, it's always a variety of reasons depending on what your -- the component of the business you're looking at. I mean clearly, the mix of the business between debit and credit has an impact. You all know that debit has clearly outperformed as the prima",294,"Well, it's always a variety of reasons depending on what your -- the component of the business you're looking at. I mean clearly, the mix of the business between debit and credit has an impact. You all know that debit has clearly outperformed as the primary driver of cash conversion globally. And then in those parts of the world like the U.S. where debit has been a mechanism for distribution of stimulus payments, it's also benefited from that. So mix of business makes a big difference. We are not seeing any reason why that it will not continue to outperform. And credit is recovering, and that's a positive trend.
If you look at places around the world, I mean in Europe, the bulk of the slowdown from Q1 to Q2 was the growing of -- the fact that we had that benefit in the first quarter. We've had some small impact from restrictions. But unless restrictions are becoming more significant, this trend seems to be improving almost everywhere. You saw that in Latin America and CEMEA where we saw meaningful acceleration, and we're not seeing much impact on those trends from additional cases.
So overall the U.S., as I said in my comments, it's almost as if the pandemic didn't happen, right? We grew around 8% first quarter last year, we grew 8% again first quarter this year where, if you believe our growth rate is 8% or 9%, we're almost back on the growth rate. Internationally, we're getting there. And we think that, that trend is meaningfully improving, as you saw. Where we're lagging certainly, where the trend is still soft, is Asia where restrictions remain still significant. And in Europe, there's some increasing restrictions now, and we'll see how they play out."
38043467,701220863,2205074,"Visa Inc., Q1 2021 Earnings Call, Jan 28, 2021",2021-01-28,"Earnings Calls","Visa Inc.","Operator","Ashwin Shirvaikar from Citi.",4,"Ashwin Shirvaikar from Citi."
