"companyid","keydevid","transcriptid","headline","mostimportantdateutc","keydeveventtypename","companyname","speakertypename","componenttextpreview","word_count","componenttext"
277966,1673196848,2362627,"Healthpeak Properties, Inc., Q2 2021 Earnings Call, Aug 04, 2021",2021-08-04,"Earnings Calls","Healthpeak Properties, Inc.","Executives","Thank you, Tom. I'll begin with operating results, then provide an update on our development and investment activities. Starting with life science. 2020 saw record-setting biotech capital raising. 2021 is on pace to exceed those records. Capital inflows",898,"Thank you, Tom. I'll begin with operating results, then provide an update on our development and investment activities. 
Starting with life science. 2020 saw record-setting biotech capital raising. 2021 is on pace to exceed those records. Capital inflows are fueling scientific breakthroughs and leading to accelerating real estate fundamentals. Demand continues to exceed supply and vacancies are at all-time lows, driving market rent growth of 10% or more over the past year. During the quarter, we signed 233,000 feet of renewals at a 22% cash mark-to-market plus 121,000 feet of new leases. We've already exceeded our full year internal leasing budget and 3Q is off to a strong start. 
In July, we signed 90,000 feet of new leases, and we currently have a large pipeline under signed letters of intent, including 345,000 feet of renewals, 70,000 feet of new leasing and 415,000 feet on new developments. Same-store NOI growth for the quarter was 7.4% and bringing year-to-date growth to 7.9%. The results were driven by in-place escalators, leasing activity, mark-to-market on renewals and burn off of free rent from the prior year. 
As discussed on the last call, we do expect same-store growth to moderate in the second half of the year due to difficult comps and proactive early terminations that will benefit future years. 
Moving to medical office. Same-store NOI growth this quarter was 4.1%, driven by leasing activity, ad rents, strong collections and parking income. Hospital inpatient and outpatient volumes have returned to pre-COVID levels benefiting our unique on-campus portfolio. Leasing activity continues to outperform. We had more than 800,000 feet of commencements in the quarter, which is 200,000 feet ahead of plan. Retention is strong at 78% for the trailing 12 months, including 93% in June. Year-to-date, we've already completed 90% of our full year internal leasing budget. Note that total portfolio occupancy declined a bit last quarter. This was driven by recently completed development and redevelopment properties entering the portfolio that are still in lease-up, plus a few recent acquisitions, lease-up opportunity. This gives us more NOI to capture in the future. 
Finishing with CCRCs, where performance continues to recover. Occupancy was up 90 basis points from March to June. Entry fee cash receipts were $24 million, representing the highest level since 2019 and leading indicators are now in line with 2019 levels. With current occupancy at 80%, we have significant upside to capture, at least 500 basis points on the low end. Same-store cash NOI growth was negative 23% for the quarter, driven by the CARES Act payments received in 2Q '20. Absent these onetime payments, same-store growth was positive 23% this quarter. 
Turning to our development pipeline. We've executed guaranteed maximum price contracts on all of our active development projects, so we have very limited exposure to rising construction costs. Lease-up continues to exceed our underwriting on both rental rate and timing. In June, we signed a full building lease on our Callan Ridge densification project in San Diego. We expect to deliver the $140 million project in the first half of 2023, with a yield on cost in the low 9s based on the book value of our land. 
In July, we signed a binding term sheet for the entire 163,000 square foot rental gateway development also in San Diego. We expect to deliver the $117 million project in the first half of 2023, with a yield on cost in the mid-8s based on the book value of our land. Those yields are far above what's achievable at today's land prices. If we mark our land to market, the yield on cost in the core markets where we play is more in the 6% to 7% range at today's construction costs and rental rates. 
Moving to investments. In July, we closed the off-market acquisition of 3 MOBs that are leased to Atlantic Health. The asset share a campus proximate to the Morristown Medical Center, generally regarded as the #1 hospital in New Jersey. The stabilized cash cap rate is in the mid-5s. The acquisition also included a land parcel on the same campus that can accommodate up to 80,000 square feet of medical office development. Also in July, we acquired a $50 million medical building in Wichita that's 100% leased to HCA. The price represents a 6.1% initial cash cap rate. This was an off-market acquisition and expands our existing presence in the market. In June, we acquired a $16 million MOB located on the campus of HCA's Westside hospital in Fort Lauderdale. The initial cash cap rate is 5.5%. Again, this was an off-market acquisition and expand our existing presence on this campus. 
Looking forward, we have a strategic acquisition and development pipeline across our business segments. Against the backdrop of compressing cap rates, we remain focused on using our relationships to create opportunities not available to the broader market. We also continue to advance densification opportunities across all 3 of our business segments, which will be a source of growth for the next decade plus on land we already own. Finally, we're balancing acquisitions that are immediately accretive with value-creating development opportunities that naturally come with short-term earnings track. As a result, our acquisition pipeline is a mix of stabilized assets, lease-up properties and covered land plays. The blended initial yield will depend on the relative mix of opportunities that ultimately proceed. With that, I'll turn it to Pete."
277966,1673196848,2362627,"Healthpeak Properties, Inc., Q2 2021 Earnings Call, Aug 04, 2021",2021-08-04,"Earnings Calls","Healthpeak Properties, Inc.","Executives","Thanks, Scott. I'll start today with a review of our financial results, provide an update on our recent balance sheet activity and finish with a discussion of our 2021 guidance. Starting with our financial results. For the second quarter, we reported FFO",624,"Thanks, Scott. I'll start today with a review of our financial results, provide an update on our recent balance sheet activity and finish with a discussion of our 2021 guidance. Starting with our financial results. For the second quarter, we reported FFO as adjusted of $0.40 per share and blended same-store growth of 1.2%. Two notable same-store items. First, our 13 LCS operated CCRCs entered the quarterly same-store pool in the second quarter and accounted for 12% of the overall pool. Second, as Scott mentioned, our CCRCs were significantly impacted by the onetime CARES Act grant we received in the second quarter of 2020. 
Adjusting for CARES Act grants, pro forma blended second quarter same-store growth across the portfolio was 7.6%. Until the LCS operated CCRCs enter the full year same-store pool in 2022, we believe our quarterly same-store results are more reflective of how our overall portfolio is performing. Last item within financial results. On July 29, our Board declared a dividend of $0.30 per share, representing an AFFO payout ratio of approximately 86% for the second quarter. 
Turning to our balance sheet. Since our last earnings call, we continue to improve upon our fortress balance sheet. We completed the repayment of $550 million of bonds maturing in 2025. We issued $450 million of 5-year green bond at a rate of 1.35%. We completed the repayment of our $250 million term loan maturing in 2024, and we received $246 million of seller financing early repayments. As a result of our balance sheet activity, we ended the quarter with a net debt to adjusted EBITDA of 4.6x, providing us with dry powder for acquisitions. We have no significant debt maturities until February 2025, and we have ample open maturity slots in 2028, 2032 and beyond allowing us to fund near-term transactions with 5-year and 10-year debt. 
Turning to our guidance. We are increasing our guidance as follows: FFO's adjusted revised from $1.53 to $1.61 per share; two, $1.55 to $1.61 per share, an increase of $0.01 at the midpoint. Blended same-store NOI growth revised from 1.75% to 3.25%, two, 2.25% to 3.75%, an increase of 50 basis points at the midpoint. 
Let me spend a minute level setting all the major components of our revised guidance. Starting with FFO as adjusted. We have had a strong start to the year with $0.80 per share FFO as adjusted, inclusive of $0.01 of nonrecurring CARES Act grants. As a result, we have increased the midpoint of guidance by $0.03 per share compared to our original 2021 guidance. While we are trending towards the higher end of our revised guidance range, we feel it is prudent to maintain some conservatism given the uncertain market conditions. 
Turning to acquisitions. We have increased the low end of our acquisition guidance to $800 million, an increase of $100 million to account for our recent closed transaction. We will update our guidance further as transactions firm up and we get a better sense for timing and pricing. As a reminder, we intend to fund acquisitions with debt until we hit our target leverage of 5.5x. 
Turning to CCRC. We are reaffirming the $70 million to $90 million NOI range for the LCS CCRCs. While performance has been strong year-to-date, we have determined it is too early to adjust guidance given the uncertainty of the COVID Delta variant and increased labor costs. 
One last item on CARES Act grants. We have reduced our guidance for CARES Act grants from $9 million to $6 million, which represent all the grants we have received year-to-date. Any additional CARES Act funding we could potentially receive for the balance of the year would be upside to guidance. With that, operator, let's open the line for Q&A."
277966,1673196848,2362627,"Healthpeak Properties, Inc., Q2 2021 Earnings Call, Aug 04, 2021",2021-08-04,"Earnings Calls","Healthpeak Properties, Inc.","Operator","[Operator Instructions] And our first question today will come from Nick Yulico with Deutsche Bank.",15,"[Operator Instructions] And our first question today will come from Nick Yulico with Deutsche Bank."
277966,1673196848,2362627,"Healthpeak Properties, Inc., Q2 2021 Earnings Call, Aug 04, 2021",2021-08-04,"Earnings Calls","Healthpeak Properties, Inc.","Analysts","Just first question on life science. The re-leasing spreads improved this quarter. I know you also, I guess, raised guidance for that segment. Can you just talk a little bit about what drove that? Is it a mix issue? Are you just pushing rents a lot more?",71,"Just first question on life science. The re-leasing spreads improved this quarter. I know you also, I guess, raised guidance for that segment. Can you just talk a little bit about what drove that? Is it a mix issue? Are you just pushing rents a lot more? And maybe you can give us a feel for an expectation on how you think life science rents could grow over the next year."
277966,1673196848,2362627,"Healthpeak Properties, Inc., Q2 2021 Earnings Call, Aug 04, 2021",2021-08-04,"Earnings Calls","Healthpeak Properties, Inc.","Executives","Scott here. Yes, over the last couple of years, our mark-to-market on renewals has been plus or minus in the 10% to 20% range. It obviously varies from quarter-to-quarter depending upon which leases are renewing, just given that there is a spread across t",150,"Scott here. Yes, over the last couple of years, our mark-to-market on renewals has been plus or minus in the 10% to 20% range. It obviously varies from quarter-to-quarter depending upon which leases are renewing, just given that there is a spread across the portfolio, some are bigger than others. This quarter, we were at 22%. Year-to-date, we're in the high teens. And that's probably reflective of where the portfolio is overall. If we look across the 10-plus years that the current leases maturity is going to bounce around, but that's our best guess as to our mark-to-market across the whole portfolio. But with rents growing at 10-plus percent in all 3 core markets over the past year, obviously, that mark-to-market could continue to grow. We do see demand continuing to exceed supply, at least in the foreseeable future. So we would expect to have continued success on that metric."
277966,1673196848,2362627,"Healthpeak Properties, Inc., Q2 2021 Earnings Call, Aug 04, 2021",2021-08-04,"Earnings Calls","Healthpeak Properties, Inc.","Analysts","I guess just second question is on acquisitions. I mean, obviously, you guys have done a very good job of setting up the balance sheet to hit your guidance this year, you're getting acquisitions done. How should we think about the opportunity behind what'",97,"I guess just second question is on acquisitions. I mean, obviously, you guys have done a very good job of setting up the balance sheet to hit your guidance this year, you're getting acquisitions done. How should we think about the opportunity behind what's in your guidance meaning your comfort range on looking at portfolios, if any of those opportunities are coming up, how you would think about maybe as well raising equity above and beyond your near-term pipeline as a way to expand the portfolio even further into the segments that you're interested in right now?"
277966,1673196848,2362627,"Healthpeak Properties, Inc., Q2 2021 Earnings Call, Aug 04, 2021",2021-08-04,"Earnings Calls","Healthpeak Properties, Inc.","Executives","Yes. Nick, it's Tom. We've obviously seen a number of different acquisition opportunities through our relationships and scale and have driven off-market transactions. I think as I've expressed in the past, our goal has been to hit a lot of singles and dou",194,"Yes. Nick, it's Tom. We've obviously seen a number of different acquisition opportunities through our relationships and scale and have driven off-market transactions. I think as I've expressed in the past, our goal has been to hit a lot of singles and doubles and an occasional triple. We do continue to see quite a lot of activity in the business. We would expect to continue to grow as long as we're trading at a premium to NAV. We've got plus or minus $700 million to put out that would be funded exclusively with debt to get back to our 5.5x net debt to EBITDA. And I think the other part of your comment was a question, at least probably alluded to M&A opportunities that are out there. I guess I would describe that this way. I think you guys know we look at everything that transacts or could transact within our 3 core businesses, we're always aware of everything that is coming to market or could come to market. But just because we look at something doesn't mean that we'll actually pursue it. And our primary focus is on floor business and on development."
277966,1673196848,2362627,"Healthpeak Properties, Inc., Q2 2021 Earnings Call, Aug 04, 2021",2021-08-04,"Earnings Calls","Healthpeak Properties, Inc.","Operator","And our next question will come from Juan Sanabria with BMO Capital Markets.",13,"And our next question will come from Juan Sanabria with BMO Capital Markets."
277966,1673196848,2362627,"Healthpeak Properties, Inc., Q2 2021 Earnings Call, Aug 04, 2021",2021-08-04,"Earnings Calls","Healthpeak Properties, Inc.","Analysts","Just a question on the Life Science acquisition market. Obviously, very competitive. Cap rates are low, a tremendous amount of capital chasing that. Have you guys thought about looking at a fund strategy or a joint venture to where you could allocate capi",55,"Just a question on the Life Science acquisition market. Obviously, very competitive. Cap rates are low, a tremendous amount of capital chasing that. Have you guys thought about looking at a fund strategy or a joint venture to where you could allocate capital to the sector for stabilized kind of lower cap rate type assets?"
277966,1673196848,2362627,"Healthpeak Properties, Inc., Q2 2021 Earnings Call, Aug 04, 2021",2021-08-04,"Earnings Calls","Healthpeak Properties, Inc.","Executives","Juan, again, Tom, again. Yes, we've had these conversations, frankly, through the years. We're believers that you don't want too many JVs out there, it complicates the organization. And if an investment is a strong investment, we prefer typically to own i",281,"Juan, again, Tom, again. Yes, we've had these conversations, frankly, through the years. We're believers that you don't want too many JVs out there, it complicates the organization. And if an investment is a strong investment, we prefer typically to own it on balance sheet, or 100% on balance sheet. So the fund aspect to us doesn't light us up all that much. As to JVs, we felt differently in Boston, where we needed to build the business, get our foot in. There was a lot of expertise there with King Street Bulfinch that we tapped into. And we would consider continuing that in Boston. There's an element with JVs and life science within clusters where joint ventures really are disadvantageous because the objective is to allow biotechs to grow and easily move between our properties within clusters. And joint ventures, obviously create other interest from partners that can stand in the way of smooth transactions in that respect. So that's not something that we're looking to do a lot of on the life science side. 
On the MOB side, those are relationship-driven deals, and we typically prefer -- almost always prefer to own 100%. Of those deals, the time when it can occur where a joint venture might make sense is if we're doing a development deal with a player that has lots of contacts they're identifying the business. They use their relationships. We come in with the money. They get some kind of a promote on the back end, and we ultimately own the real estate, those are attractive to us as well. So that's how we think about JVs and funds are not something that we would consider."
277966,1673196848,2362627,"Healthpeak Properties, Inc., Q2 2021 Earnings Call, Aug 04, 2021",2021-08-04,"Earnings Calls","Healthpeak Properties, Inc.","Analysts","And then just a question on the MOB strategy. And with regards to the internalization of management there. I guess just how do you guys think about why not manage your own portfolio? I mean I get it that maybe the cost savings aren't that great, if you ca",117,"And then just a question on the MOB strategy. And with regards to the internalization of management there. I guess just how do you guys think about why not manage your own portfolio? I mean I get it that maybe the cost savings aren't that great, if you can just outsource it and you don't have to have the headcount. But at the end of the day, wouldn't you want to own the management and the relationship with those customers. And just curious if you've begun to think about that as you now exited seniors housing and you're essentially a pure-play office company split between 2 asset types. But just curious on your latest thinking on that."
277966,1673196848,2362627,"Healthpeak Properties, Inc., Q2 2021 Earnings Call, Aug 04, 2021",2021-08-04,"Earnings Calls","Healthpeak Properties, Inc.","Executives","Yes. One, I'm glad you ask it -- It's something that we've -- and I'm going to start and then turn it to Tom K who's -- Tom Klaritch, who's the real expert. It's something we've looked at a number of times and Tom Klaritch, in his many years has done it b",144,"Yes. One, I'm glad you ask it -- It's something that we've -- and I'm going to start and then turn it to Tom K who's -- Tom Klaritch, who's the real expert. It's something we've looked at a number of times and Tom Klaritch, in his many years has done it both ways, at least a couple of times. And we have -- in a fairly extensive study we did about 1 year, 1.5 years ago, we concluded that there really is not much profitability in it and then you end up managing masses of people within a system that causes a lot of distraction that just doesn't have a lot of profit. But Tom, you've done this for a long time. Maybe you could give a bit of color on how you've looked at it historically, along with the analysis you did."
277966,1673196848,2362627,"Healthpeak Properties, Inc., Q2 2021 Earnings Call, Aug 04, 2021",2021-08-04,"Earnings Calls","Healthpeak Properties, Inc.","Executives","Yes. Well, Juan, as you said, there's really not a lot of profit in it. So that's really not a big factor in how we look at it. We talked about the relationships. We really -- we manage our properties in 2 levels. You have the property management companie",253,"Yes. Well, Juan, as you said, there's really not a lot of profit in it. So that's really not a big factor in how we look at it. We talked about the relationships. We really -- we manage our properties in 2 levels. You have the property management companies on the ground that are dealing with things on a day-to-day basis. And then we have an asset management team and a leasing team that oversees the property managers and the leasing agents out in the field. Those guys are out meeting with hospitals, meeting with major tenants really weekly. They travel as much as 50% to 60% of the time, and they're maintaining the relationships at the hospital level. So we really don't lose that aspect of it. And then obviously, on the system side, we have our VPs, myself are dealing with the major systems. So I don't really see it as a real negative to relationships. We maintain those pretty well. And having that structure just allows us to move in and out of markets really easily. 
If you look at the the 2 larger acquisitions we did in the past couple of months, the Midwest portfolio and Harrison Street, we very easily moved into those markets, took over management and literally overnight, we're managing those properties without having to deal with all of the personnel issues that you would have to if you internalize it. So I've always just like the third-party approach, and we'll continue to manage that way."
277966,1673196848,2362627,"Healthpeak Properties, Inc., Q2 2021 Earnings Call, Aug 04, 2021",2021-08-04,"Earnings Calls","Healthpeak Properties, Inc.","Operator","Our next question will come from Michael Carroll with RBC Capital Markets.",12,"Our next question will come from Michael Carroll with RBC Capital Markets."
277966,1673196848,2362627,"Healthpeak Properties, Inc., Q2 2021 Earnings Call, Aug 04, 2021",2021-08-04,"Earnings Calls","Healthpeak Properties, Inc.","Analysts","Tom or Scott, I know the team has done a great job breaking ground on new life science development projects, but can you talk a little bit about what you could break out on ground next? Would you be willing to start another project in South San Francisco,",71,"Tom or Scott, I know the team has done a great job breaking ground on new life science development projects, but can you talk a little bit about what you could break out on ground next? Would you be willing to start another project in South San Francisco, maybe on the Vantage site? Or would you need to have some leasing on Nexus on Grand to be able to do that?"
277966,1673196848,2362627,"Healthpeak Properties, Inc., Q2 2021 Earnings Call, Aug 04, 2021",2021-08-04,"Earnings Calls","Healthpeak Properties, Inc.","Executives","Well, the bottom line is that we like to see some activity in Nexus on grand. Scott Bohn is working that real hard. We've had progress. And the simple answer is, as we anchor that asset. But yes, we would consider another development structure based on th",72,"Well, the bottom line is that we like to see some activity in Nexus on grand. Scott Bohn is working that real hard. We've had progress. And the simple answer is, as we anchor that asset. But yes, we would consider another development structure based on the demand and supply fundamentals that we're seeing. So I think you'll -- there'll be more to come on that. Brinker, anything you'd like to add?"
277966,1673196848,2362627,"Healthpeak Properties, Inc., Q2 2021 Earnings Call, Aug 04, 2021",2021-08-04,"Earnings Calls","Healthpeak Properties, Inc.","Executives","No, I'd just reiterate that the momentum is very strong at the remaining space at the shore as well as at Nexus. And keep in mind, Nexus doesn't open for another 18 months or more. So we're pretty pleased with the activity to date, and we are shovel-ready",85,"No, I'd just reiterate that the momentum is very strong at the remaining space at the shore as well as at Nexus. And keep in mind, Nexus doesn't open for another 18 months or more. So we're pretty pleased with the activity to date, and we are shovel-ready on 350,000 feet in the first phase of Vantage while we seek entitlements on the balance of that site, well, increased entitlements. So yes, we really like our market position there and look forward to building it."
277966,1673196848,2362627,"Healthpeak Properties, Inc., Q2 2021 Earnings Call, Aug 04, 2021",2021-08-04,"Earnings Calls","Healthpeak Properties, Inc.","Executives","We've also got Scott Bohn, Mike Dorris on the call with us. Scott Bohn, you're working this thing 24/7 for the last -- longer than a decade. What's your read on just generally demand supply, how you feel about where we're at in the status of this? I think",56,"We've also got Scott Bohn, Mike Dorris on the call with us. Scott Bohn, you're working this thing 24/7 for the last -- longer than a decade. What's your read on just generally demand supply, how you feel about where we're at in the status of this? I think people should hear from you directly."
