"companyid","keydevid","transcriptid","headline","mostimportantdateutc","keydeveventtypename","companyname","speakertypename","componenttextpreview","word_count","componenttext"
277617,1676142692,2381520,"Jack Henry & Associates, Inc., Q4 2021 Earnings Call, Aug 18, 2021",2021-08-18,"Earnings Calls","Jack Henry & Associates, Inc.","Executives","Well, it depends on which numbers you're looking at for 2017. If you're looking for the restated numbers after ASC 606, if you're looking at the previous numbers because ASC 606 did have an impact on our margins. But I would say that -- I'd answer it this",110,"Well, it depends on which numbers you're looking at for 2017. If you're looking for the restated numbers after ASC 606, if you're looking at the previous numbers because ASC 606 did have an impact on our margins. But I would say that -- I'd answer it this way. I'm pretty comfortable that after we get through FY '22, again, there's a lot of unknowns out there with COVID and other things. But I think starting in FY '23, we can kind of go back to our normal 50 to 100 basis points expansion in our operating margin as we get everything kind of put back in place this year."
277617,1676142692,2381520,"Jack Henry & Associates, Inc., Q4 2021 Earnings Call, Aug 18, 2021",2021-08-18,"Earnings Calls","Jack Henry & Associates, Inc.","Analysts","Okay. That's really helpful. And then maybe my last question. Just -- I guess, as you think about new sales and how they're expected to trend as the economy reopens, the pipeline is quite strong. Just curious if you expect that to accelerate as you get ba",53,"Okay. That's really helpful. And then maybe my last question. Just -- I guess, as you think about new sales and how they're expected to trend as the economy reopens, the pipeline is quite strong. Just curious if you expect that to accelerate as you get back to seeing your customers in person?"
277617,1676142692,2381520,"Jack Henry & Associates, Inc., Q4 2021 Earnings Call, Aug 18, 2021",2021-08-18,"Earnings Calls","Jack Henry & Associates, Inc.","Executives","Yes. I don't expect that you're going to see some great big pop in sales. I mean, as I said before, our quota is a very large number today. And so if you're growing at 3% to 5% a year-over-year on a very large sales number, that sets the company up pretty",139,"Yes. I don't expect that you're going to see some great big pop in sales. I mean, as I said before, our quota is a very large number today. And so if you're growing at 3% to 5% a year-over-year on a very large sales number, that sets the company up pretty well because we're such a high concentration of recurring revenue. So you assume that the recurring revenue is continuing to percolate and you're layering revenue in on top of it and you're growing a sales quota at 3% to 5% per year over the prior year performance. That's a pretty solid model. So I'm happy with that model. I don't expect that we're going to see some great big pop in sales in the coming year. I think the performance will continue to be solid and consistent."
277617,1676142692,2381520,"Jack Henry & Associates, Inc., Q4 2021 Earnings Call, Aug 18, 2021",2021-08-18,"Earnings Calls","Jack Henry & Associates, Inc.","Operator","Our next question comes from Dan Perlin with RBC Capital Markets.",11,"Our next question comes from Dan Perlin with RBC Capital Markets."
277617,1676142692,2381520,"Jack Henry & Associates, Inc., Q4 2021 Earnings Call, Aug 18, 2021",2021-08-18,"Earnings Calls","Jack Henry & Associates, Inc.","Analysts","It's actually Matt Roswell sitting in for Dan. Just a quick question. With the payment platform conversion done, are there any relying major solutions that need to be kind of replatformed onto the open architecture? And then with, theoretically, all the s",69,"It's actually Matt Roswell sitting in for Dan. Just a quick question. With the payment platform conversion done, are there any relying major solutions that need to be kind of replatformed onto the open architecture? And then with, theoretically, all the solutions on an open architecture, do that change the sort of accounting cadence between capitalization of software, timing or D&A or the income statement components of CapEx?"
277617,1676142692,2381520,"Jack Henry & Associates, Inc., Q4 2021 Earnings Call, Aug 18, 2021",2021-08-18,"Earnings Calls","Jack Henry & Associates, Inc.","Executives","So I'll take the first part of your question, and Kevin can address any of the hard financial questions, the CFO stuff. So first off, we have about 300 different solutions. And so they are all in some stage of either fully platformed on a complete open pl",271,"So I'll take the first part of your question, and Kevin can address any of the hard financial questions, the CFO stuff. So first off, we have about 300 different solutions. And so they are all in some stage of either fully platformed on a complete open platformed or they're in the process or some is done. And there are some that it isn't logical to take them to an open -- to a new architecture. We, for example, have a payroll solution that it's been around for a long time. It was a successful product. Nobody is buying payroll solutions from a provider like us anymore. We haven't sold a copy in 20 years. Why we put the effort into replatforming that product? 
So if you look at the broad suite of solutions that we offer, it isn't logical to try and move everything to a new platform. But for all those that are the real high demand solutions, they've either been put into a completely open environment or they're in process of offering that type of solution. And many have been important to public cloud offerings. So we're in both Azure and AWS today with some of our solutions. We have many in our private cloud. So it's just because of the broad suite of products that we have, it's just kind of naturally a variety of different platforms that we offer them on. But for the kind of the key solutions, they either are today supporting open connectivity, open infrastructure or we're well on our way to doing that. I'll let you take the hard part, Kevin."
277617,1676142692,2381520,"Jack Henry & Associates, Inc., Q4 2021 Earnings Call, Aug 18, 2021",2021-08-18,"Earnings Calls","Jack Henry & Associates, Inc.","Executives","Yes. So the other part, Dan, is if you look at us for basically the last 10-plus years, I actually have a chart that shows this, our total R&D spend for R&D expense on the P&L and cap software on the cash flow statement has been 14% of revenue. So our tot",283,"Yes. So the other part, Dan, is if you look at us for basically the last 10-plus years, I actually have a chart that shows this, our total R&D spend for R&D expense on the P&L and cap software on the cash flow statement has been 14% of revenue. So our total R&D spend has grown at almost the exact same pace as our top line revenue for the last 10 years. I don't see that changing. I think we're going to continue that. And I would tell you that the way -- we don't do really big bang productions.
I mean we do sprints and do try to get modules rolled out as quick as possible and do additional modules. So there's no -- not going to see any huge increase in amortization of software in any given year. It's just going to kind of slowly grow because at any given time, this is actually a chart I show the Board every quarter. At any given time, about 85% or 86% of our total cap software on the balance sheet is in production being amortized.
So -- and that hasn't changed for the last -- last few years either. So what that tells you is we're continuing to develop all that software. We continue to roll it out. But at the same time, in 5 years, some of the stuff in the amortization has done amortizing. So you got an offset there. So I don't think that we're going to do anything crazy in the foreseeable future. There's going to have much of an impact on either cash flow or the P&L, other than what you've seen in the last few years."
277617,1676142692,2381520,"Jack Henry & Associates, Inc., Q4 2021 Earnings Call, Aug 18, 2021",2021-08-18,"Earnings Calls","Jack Henry & Associates, Inc.","Operator","That concludes today's question-and-answer session. I'd like to turn the call back to Kevin Williams for closing remarks.",19,"That concludes today's question-and-answer session. I'd like to turn the call back to Kevin Williams for closing remarks."
277617,1676142692,2381520,"Jack Henry & Associates, Inc., Q4 2021 Earnings Call, Aug 18, 2021",2021-08-18,"Earnings Calls","Jack Henry & Associates, Inc.","Executives","Thank you, and thank you, all again for joining us. We continue to be very pleased with the overall results of our ongoing operations. I do want to thank all of our associates for the way they have handled these challenges by taking care of themselves and",104,"Thank you, and thank you, all again for joining us. We continue to be very pleased with the overall results of our ongoing operations. I do want to thank all of our associates for the way they have handled these challenges by taking care of themselves and our customers, and continuing to work hard to improve our company, to continue moving forward for the future. All of us at Jack Henry continue to focus on what is best for our customers and our shareholders. 
Thank you, again, for joining us. And Liz, would you please provide the replay number, so it's in the transcript?"
277617,1676142692,2381520,"Jack Henry & Associates, Inc., Q4 2021 Earnings Call, Aug 18, 2021",2021-08-18,"Earnings Calls","Jack Henry & Associates, Inc.","Operator","A replay of this call will be available until 11:59 p.m. Eastern Time, August 25, 2021. You can access the replay by dialing (800) 585-8367 or 404-537-3406, and entering conference 792-9519. Thank you, and have a great day.",39,"A replay of this call will be available until 11:59 p.m. Eastern Time, August 25, 2021. You can access the replay by dialing (800) 585-8367 or 404-537-3406, and entering conference 792-9519. Thank you, and have a great day."
277617,1686162851,2430819,"Jack Henry & Associates, Inc., Q1 2022 Earnings Call, Nov 09, 2021",2021-11-09,"Earnings Calls","Jack Henry & Associates, Inc.","Operator","Ladies and gentlemen, thank you for standing by. Welcome to the Jack Henry & Associates First Quarter FY 2022 Earnings Conference Call. [Operator Instructions] And please be advised that today's conference is being recorded. [Operator Instructions] I woul",59,"Ladies and gentlemen, thank you for standing by. Welcome to the Jack Henry & Associates First Quarter FY 2022 Earnings Conference Call. [Operator Instructions] And please be advised that today's conference is being recorded. [Operator Instructions] I would now like to hand the conference over to your first speaker today, Kevin Williams, CFO and Treasurer. You may begin, sir."
277617,1686162851,2430819,"Jack Henry & Associates, Inc., Q1 2022 Earnings Call, Nov 09, 2021",2021-11-09,"Earnings Calls","Jack Henry & Associates, Inc.","Executives","Thanks, Brian. Good morning. Thank you for joining us for the Jack & Associates First Quarter Fiscal 2022 Earnings Call. I am Kevin Williams, CFO and Treasurer; and on the call with me today is David Foss, Board Chair, President and CEO of Jack Henry. In",291,"Thanks, Brian. Good morning. Thank you for joining us for the Jack & Associates First Quarter Fiscal 2022 Earnings Call. I am Kevin Williams, CFO and Treasurer; and on the call with me today is David Foss, Board Chair, President and CEO of Jack Henry. In just a minute, I'll turn the call over to Dave to provide some of his thoughts about the state of our business, financial and sales performance for the quarter, comments regarding the industry in general and some other key initiatives that we have in place. Then after Dave concludes his comments, I will provide some additional thoughts and comments regarding the press release we put out yesterday after market close and also provide some comments regarding our updated guidance for our fiscal year 2022 provided in the release yesterday. And then we will open the lines up for Q&A. 
First, I need to remind you that this call includes certain forward-looking statements, including remarks or responses to questions concerning future expectations, events, objectives, strategies, trends or results. Like any statement about the future, these are subject to a number of factors that could cause actual results or events to differ materially from those which we anticipate due to a number of risks and uncertainties. The company undertakes no obligation to update or revise these statements. For a summary of these risk factors and additional information, please refer to yesterday's press release and the sections in our 10-K entitled Risk Factors and Forward-looking Statements. 
On this call, we will also discuss certain non-GAAP financial measures including non-GAAP revenue and non-GAAP operating income. The reconciliations for historical non-GAAP financial measures can be found in yesterday's press release. With that, I'll now turn the call over to Dave."
277617,1686162851,2430819,"Jack Henry & Associates, Inc., Q1 2022 Earnings Call, Nov 09, 2021",2021-11-09,"Earnings Calls","Jack Henry & Associates, Inc.","Executives","Thank you, Kevin. Good morning, everyone. We're pleased to report another strong quarter of revenue and operating income growth. As always, I'd like to begin today by thanking our associates for all the hard work and commitment that went into producing th",1451,"Thank you, Kevin. Good morning, everyone. We're pleased to report another strong quarter of revenue and operating income growth. As always, I'd like to begin today by thanking our associates for all the hard work and commitment that went into producing those results for our first fiscal quarter particularly in light of the challenges posed by the ongoing pandemic. We continue to operate with well over 90% of our employees working full-time remote and continue to evaluate options regarding an appropriate return to office target for all affected employees. 
With that, let's shift our focus to look at our performance for the quarter we completed in September. For the first quarter of fiscal 2022, total revenue increased 8% for the quarter and increased 9% on a non-GAAP basis. Deconversion fees were down more than $2 million over the prior year quarter. 
Turning to the segments. We had another solid quarter in the core segment of our business. Revenue increased by 8% for the quarter and increased by 9% on a non-GAAP basis. Our Payments segment again performed well and also posted an 8% increase in revenue this quarter and a 9% increase on a non-GAAP basis. We also had another strong quarter in our complementary solutions businesses, with a 9% increase in revenue this quarter and a 9% increase on a non-GAAP basis. 
Traditionally, our first quarter has been our lightest sales bookings quarter because our fourth quarter tends to be extremely strong, and the sales pipeline is depleted as a result. As you may recall, the June quarter was the strongest sales quarter in the history of the company, so we certainly expected this historical trend to hold true. What we experienced, however, was just the opposite. 
The performance of the sales organization was again very strong with a number of notable wins. In the quarter, we booked 6 competitive core takeaways and 10 deals to move existing in-house customers to our private cloud environment. Although our rate of 6 takeaways is light as compared to our normal run rate, it is clear to me that a number of deals fell into the month of October because we booked 6 more core takeaways in October alone. 
As we've discussed on prior calls, our convert merge backlog is a good indicator for us of what to expect with coming mergers and acquisitions within our base of customers. We can now see that M&A in the banking space will be very active this year because almost all of our conversion slots for acquired banks are full for the year. We are working to evaluate whether or not we need to add more conversion teams to keep up with the activity. You should expect to see a corresponding increase in deconversion revenue as some of our institutions are acquired by others in the space. Kevin will provide more detail on this line when he shares his comments. 
We continue to see good success with our new card processing solution, signing 6 new debit processing clients this quarter and 1 new credit client. We also continue to see great success signing clients to our Banno digital suite, with 35 new contracts in Q1. Speaking of our digital suite, we are continuing to implement new financial institution clients on the Banno platform at a similar pace to recent quarters. 
At the end of Q1, we surpassed 6 million registered users on the platform, and that number is growing at about 125,000 users per month. At the same time, our Banno platform continues to hold one of the highest consumer ratings in the App Store. The Banno Digital Suite is well down the path to becoming the industry-leading digital banking solution. 
The continued success we've seen with sales and adoption of our digital suite is consistent with the expectations coming out of the Bank Director Technology survey published in August. As they do every year, Bank Directors surveyed hundreds of their subscribers during June and July regarding a variety of technology prioritization and spending topics. More than 50% of the responses they received were from bank CEOs and/or Board members with almost 80% of the respondent banks greater than $500 million in assets. 
This year's survey showed an interesting shift as more than 70% of the responding banks had moved efficiency of operation to the top of their priority list, and improved customer experience and an improved digital experience followed closely behind. To further the point regarding an improved digital experience, this year, 54% of the respondents indicated that their customers prefer to interact with their bank using a digital channel rather than in branch or over the phone. 
The survey also indicated that the median increase in expected technology spending for the coming year was 10% as compared to the prior year. All of this bodes well for the future of our digital suite as well as the other solutions offered by Jack Henry, which helped facilitate an improved customer experience and an opportunity to enhance efficiency in the financial institution. 
As many of you know, we normally conduct our 2 largest client conferences in the fall each year. This year, we combined those conferences into one event and again hosted the sessions virtually. We had hoped to be in person this year, but because of the size of the event, we decided that wasn't prudent. As we saw last year, attendance was much larger than our in-person conferences because nobody had to incur any travel expense and they were able to readily drop into virtual sessions. 
We were pleased to be able to successfully interact in a virtual setting with many of our existing clients and prospects. Last week, we announced 2 pending retirements from our leadership team. Our long-time CFO and Treasurer, Kevin Williams; and our CTO, Ted Bilke, have both announced their intent to retire next summer. As we shared in the press release, we already have a search in process to find Kevin's replacement and we'll be considering both internal and external candidates. Kevin will be with us until we identify the right person and have them fully prepared to take the reins. 
Ted will transition out of his role in January when Ben Metz, our current Head of Digital Solutions, will become our Chief Digital and Technology Officer. Ted will stay for several months after that to help bend with the transition. Of course, we have many months before each of them actually retire. So I have lots of time to thank them for their many years of service to our associates, customers and shareholders. But I would be remiss if I didn't acknowledge how much I've enjoyed working with each of them and how much I appreciate the approach each of them has taken to executing these much deserved retirements. 
Next week, we will conduct our Annual Shareholder Meeting. We will be hosting this meeting in person in Monett, but will abide by strict COVID protocols to ensure a safe event for all attendees. We are excited to be able to meet with our shareholders in person again, but we are also very aware of the ongoing pandemic-related concerns that arise when you assemble a group of people. We will start an hour earlier than in past years, will require all attendees to be masked, and we won't be serving a lunch following the meeting. With these changes, I'm confident we will have a productive and safe meeting. 
In our ongoing attempt to communicate effectively regarding our ESG-related efforts, we recently published our ESG statement which provides a succinct and centralized overview of Jack Henry's ESG commitments and material environmental and social topics. Additionally, it points readers toward other related policies like our human rights policy. We've also published an environmental policy that highlights our commitment to sustainability and proper environmental management practices. Both documents can be found on our new corporate responsibility website via Investor Relations. We created this website to house our sustainability reports and provide a centralized location for Jack Henry's ESG information. 
Speaking of sustainability reports, our next sustainability report covering calendar year 2021 will be published in March. We have continued to make major advances across our environmental, social and governance initiatives and the Board has established a quarterly cadence to discuss ESG matters. As we move forward, I'm very optimistic regarding our levels of sales activity and customer responses to solutions we're delivering and the strategies we are executing. We will continue with our disciplined approach to running the company, and we expect that approach to continue to provide stability and solid performance for our employees, customers and shareholders. 
With that, I'll turn it over to Kevin for some detail on the numbers."
