"companyid","keydevid","transcriptid","headline","mostimportantdateutc","keydeveventtypename","companyname","speakertypename","componenttextpreview","word_count","componenttext"
277617,712097144,2268350,"Jack Henry & Associates, Inc., Q3 2021 Earnings Call, May 04, 2021",2021-05-04,"Earnings Calls","Jack Henry & Associates, Inc.","Executives","So again, in -- again, in core, is because of on-prem installations and convert-merge revenue not being where we thought they were going to be as we guided. And we just don't see those coming back in Q4 either.",39,"So again, in -- again, in core, is because of on-prem installations and convert-merge revenue not being where we thought they were going to be as we guided. And we just don't see those coming back in Q4 either."
277617,712097144,2268350,"Jack Henry & Associates, Inc., Q3 2021 Earnings Call, May 04, 2021",2021-05-04,"Earnings Calls","Jack Henry & Associates, Inc.","Analysts","Understood. And then I guess last one, sort of a broader question on the competitive environment. Several small point solution providers are sort of emerging. Many of them are going public. How do you see that trend having an impact on your growth rates i",51,"Understood. And then I guess last one, sort of a broader question on the competitive environment. Several small point solution providers are sort of emerging. Many of them are going public. How do you see that trend having an impact on your growth rates in the complementary segment, if at all?"
277617,712097144,2268350,"Jack Henry & Associates, Inc., Q3 2021 Earnings Call, May 04, 2021",2021-05-04,"Earnings Calls","Jack Henry & Associates, Inc.","Executives","Yes. It's something that we watch pretty closely. And you're right, and it's essentially what I was alluding to earlier when I was talking about the M&A environment. Those companies who maybe would have put themselves up for sale in the past, they would h",215,"Yes. It's something that we watch pretty closely. And you're right, and it's essentially what I was alluding to earlier when I was talking about the M&A environment. Those companies who maybe would have put themselves up for sale in the past, they would have been a potential acquisition target for Jack Henry. All of them, these days, are thinking going through an IPO. And so I think it's just a little bit different than the number that are trying to IPO and take advantage of the frothiness in the market right now. 
But none of them are doing anything that's particularly -- it's not a threat, and particularly threatening to Jack Henry, or new or different or anything like that. We are very well positioned to compete with the names that, I think, most of them that you would throw out at me, if you were to throw out names. I would tell you exactly how we're positioned and where we're positioned to compete with them, and we are not worried about our ability to compete with some of these folks. 
They're taking advantage of the times. And there's a lot of interest in fintech right now, and they're getting valuations that are exciting. And we'll see where they sit 5 years from now."
277617,712097144,2268350,"Jack Henry & Associates, Inc., Q3 2021 Earnings Call, May 04, 2021",2021-05-04,"Earnings Calls","Jack Henry & Associates, Inc.","Operator","And there are no further questions at this time.",9,"And there are no further questions at this time."
277617,712097144,2268350,"Jack Henry & Associates, Inc., Q3 2021 Earnings Call, May 04, 2021",2021-05-04,"Earnings Calls","Jack Henry & Associates, Inc.","Executives","Okay. Thanks, Brandy. As a reminder, as Dave mentioned, our virtual Analyst Day is scheduled next week, a week from today, actually, on Tuesday, May 11. It will be beginning at 1:00. If you have not registered, but you would like to, you can contact Vance",166,"Okay. Thanks, Brandy. As a reminder, as Dave mentioned, our virtual Analyst Day is scheduled next week, a week from today, actually, on Tuesday, May 11. It will be beginning at 1:00. If you have not registered, but you would like to, you can contact Vance Sherard, that's vsherard@jackhenry.com, and he can send you a registration link to sign up for the event. 
Now to wrap up the call. We are very pleased with the overall results from our ongoing operations, and I want to thank all of our associates for the way they have handled these challenges by taking care of themselves and our customers and continue to work hard to improve our company to continue moving forward for the future. All of us at Jack Henry continue to focus on what is best for our customers and our shareholders. 
With that, I want to thank you again for joining us today. And Brandy, would you please now provide the replay number for the call?"
277617,712097144,2268350,"Jack Henry & Associates, Inc., Q3 2021 Earnings Call, May 04, 2021",2021-05-04,"Earnings Calls","Jack Henry & Associates, Inc.","Operator","Yes. And at this time, this does conclude today's conference call. But if you would like to listen to the replay, you may do so by dialing 1 (800) 585-8367. Thank you, and have a great day.",37,"Yes. And at this time, this does conclude today's conference call. But if you would like to listen to the replay, you may do so by dialing 1 (800) 585-8367. Thank you, and have a great day."
277617,1676142692,2381419,"Jack Henry & Associates, Inc., Q4 2021 Earnings Call, Aug 18, 2021",2021-08-18,"Earnings Calls","Jack Henry & Associates, Inc.","Operator","Good day, and thank you for standing by. Welcome to the Jack Henry & Associates Fourth Quarter Fiscal Year 2021 Earnings Conference Call. [Operator Instructions] Please be advised that today's conference is being recorded. [Operator Instructions]I'd now",53,"Good day, and thank you for standing by. Welcome to the Jack Henry & Associates Fourth Quarter Fiscal Year 2021 Earnings Conference Call. [Operator Instructions] Please be advised that today's conference is being recorded. [Operator Instructions]
I'd now like to hand the conference over to your speaker today, Kevin Williams, Chief Financial Officer."
277617,1676142692,2381419,"Jack Henry & Associates, Inc., Q4 2021 Earnings Call, Aug 18, 2021",2021-08-18,"Earnings Calls","Jack Henry & Associates, Inc.","Executives","Thanks, Liz. Good morning, and thank you for joining us for the Jack Henry & Associates Fourth Quarter and Fiscal 2021 Year-End Earnings Call. I'm Kevin Williams, CFO and Treasurer. And on the call with me today is David Foss, our Board Chair, President a",292,"Thanks, Liz. Good morning, and thank you for joining us for the Jack Henry & Associates Fourth Quarter and Fiscal 2021 Year-End Earnings Call. I'm Kevin Williams, CFO and Treasurer. And on the call with me today is David Foss, our Board Chair, President and CEO.
In just a minute, I'll turn the call over to Dave to provide some of his thoughts about the state of our business, financial and sales performance for the quarter, some comments regarding the industry in general, and then some other key initiatives that we have in place. Then after Dave concludes his comments, I will provide some additional thoughts and comments regarding the earnings press release we put out yesterday after market close and provide comments regarding our guidance for our fiscal year 2022 provided in the release, and then we will open the lines up for Q&A. 
First, I need to remind you that this call includes certain forward-looking statements, including remarks or responses to questions concerning future expectations, events, objectives, strategies, trends or results. Like any statement about the future, these are subject to a number of factors that could cause actual results or events to differ materially from those which we anticipate due to a number of risks and uncertainties. The company undertakes no obligation to update or revise these statements. For a summary of these risk factors and additional information, please refer to yesterday's press release and the sections in our 10-K, entitled Risk Factors, and Forward-looking Statements. Also on this call, we will be discussing certain non-GAAP financial measures, including non-GAAP revenue and non-GAAP operating income. The reconciliations for historical non-GAAP financial measures can be found in yesterday's press release.
With that, I'll now turn the call over to Dave."
277617,1676142692,2381419,"Jack Henry & Associates, Inc., Q4 2021 Earnings Call, Aug 18, 2021",2021-08-18,"Earnings Calls","Jack Henry & Associates, Inc.","Executives","Thank you, Kevin, and good morning, everyone. Today, we are very pleased to share details with you of a quarter that produced record revenue and operating income as well as record sales bookings.As always, I'd like to begin today by thanking our associa",1491,"Thank you, Kevin, and good morning, everyone. Today, we are very pleased to share details with you of a quarter that produced record revenue and operating income as well as record sales bookings.
As always, I'd like to begin today by thanking our associates for all the hard work and commitment that went into producing those results for our fourth quarter and for the entire fiscal year, particularly in light of the challenges posed by conducting business while dealing with the ongoing effects of the pandemic.
For the fourth quarter of fiscal 2021, total revenue increased 10% for the quarter and increased 10% on a non-GAAP basis. Deconversion fees were essentially flat as compared to the prior year quarter. Turning to the segments. We had a solid quarter in the core segment of our business. Revenue increased by 4% for the quarter and increased by 6% on a non-GAAP basis. Our Payment segment performed extremely well, posting a 16% increase in revenue this quarter and a 17% increase on a non-GAAP basis. We also had a strong quarter in our complementary solutions businesses, with a 7% increase in revenue this quarter and a 7% increase on a non-GAAP basis.
As I highlighted in our press release, the fourth quarter was the strongest sales quarter in the history of the company. June was also the strongest sales month ever, and have propelled all 3 sales groups to exceed their quota for the quarter. While they were signing all those contracts in the fourth quarter, the sales team also did an outstanding job of refilling the pipeline with new opportunities to set us up for success going forward. I think this is a good sign of the health of our market, and bodes well for the start of the new sales year.
In the fourth fiscal quarter, we booked 13 competitive core takeaways and 14 deals to move existing on-premise customers to our private cloud environment. Several of our complementary offerings also saw a very strong demand in the quarter with, as you might guess, our digital suite leading the pack. We signed 87 new clients to our Banno digital platform in the quarter, 10 new treasury management clients and 22 new clients to our card processing solution. For the full year, we signed 41 competitive core takeaways, with 8 of them greater than $1 billion in assets. Additionally, we signed 35 contracts to move on-prem core clients to our private cloud, 219 new Banno Digital customers and 55 new clients for our card processing solution. Of course, we signed a variety of other contracts for many of our other solutions as well, but it's important to note that almost all of these contracts represent long-term recurring revenue commitments to Jack Henry for a wide variety of our solutions.
At our analyst conference in May, I shared with the attendees that we had just surpassed 5 million registered users on our Banno Digital Banking platform. As of the end of the fiscal year, we were at roughly 5.6 million registered users. As a point of reference, on July 1, 2020, we had about 3.2 million registered users. So in 1 year, we saw an increase of approximately 75% in our user count. This is significant because, as I have stressed in the past, most of the revenue for a business like this is tied to the number of users on the platform. We continue to onboard clients and their users at a pace of about 30 financial institutions added to the platform each month.
In addition to our ongoing success with Banno, we have delivered many new and innovative solutions during the fiscal year. A few examples include our Symitar team delivered an automated database migration to almost all of our Episys clients, which allowed them to move to the new database structure with no effort or client impact. Our lending team delivered the Jack Henry Loan Marketplace, which allows banks and credit unions to easily engage through a digital experience in the buying, selling and participation of loans.
Our digital team delivered the Banno Digital Toolkit, which provides a complete set of application programming interfaces, or APIs, to enable easy plug-ins to third-party solutions in our digital platform. Our payments team continued the expansion of functionality and adoption of the PayCenter platform and delivered the Zelle digital tool to enable clients not using our digital platform to connect to the PayCenter hub for Zelle transactions. And of course, the payments group completed the 3.5-year project to upgrade our card payments platform. Almost all of these new deliverables are built on entirely new technology stacks and are designed to make easier for our customers to leverage our open architecture tools and philosophy to deliver cutting-edge solutions to their account holders.
As you may know, we have a number of active projects at Jack Henry centered on the topic of corporate responsibility. We continue to advance our environmental stewardship commitment and recently announced that on Earth Day, our associates launched a new business innovation group called Bill Green. Our business innovation groups are company-sponsored associate-driven groups that provide a collaborative platform for people, ideas and thoughts to intersect and help address business challenges. Our associates decided that a business innovation group focused on our planet was appropriate and necessary for us to make meaningful progress on this initiative.
As the labor market continues to heat up, we are focused more than ever on attracting and retaining talented associates. To that end, we have recently implemented new technology to expand our remote recruiting efforts and broaden our pool of qualified and diverse talent. Our hope is that this approach will only serve to improve on the reputation as a great place to work that we currently enjoy in cities across the country. Our consistent placement on Best Places to Work list is a testament to the workplace culture we have at Jack Henry, and our employee engagement scores reflect that strong culture. I'm pleased to share that nearly 2/3 of our associates participated in our most recent engagement survey, and our average engagement score was 83%, well above the industry benchmark.
Like most employers, we have spent a good bit of time in the past few weeks wrestling with decisions around the right timing and approach to move employees back to work in our company facilities. We worked with our leadership teams earlier in the calendar year and determined that more than half of our workforce would continue to work remote indefinitely. We had targeted July 1 as our return to office date for those who would be earning in a full-time or hybrid basis. As the Delta variants surged, we reverted to our previous operating model with only essential employees in our offices every day. We have proven that we can operate effectively in a remote posture, and we will continue in that mode until we determine it is safe to make a change.
As I referenced on the last earnings call, our longtime Chairman, Jack Prim, has retired as of the end of June. Jack had been with our company for many years in various leadership roles and as a Board member and Chairman. As a result of Jack's retirement, we have announced 2 changes to the Board. Curtis Campbell has joined the Board effective July 1 to fill the seat left vacant by Jack's departure. Curtis is President of Software for Blucora in Dallas. He brings extensive experience in infrastructure and cloud computing as well as digital development and a keen focus on customer experience. I'm very excited to see what new perspectives Curtis brings to our Board discussions. 
Also effective July 1, I was elected to be the new Board Chair. I was humbled and honored by the confidence expressed by the other Board members, and I look forward to leading the Jack Henry Board to even greater success.
As I reflect back on fiscal 2021, I can confidently say it was a very good year for our company. Our employee engagement scores remained very high, and we've made great strides with our diversity and inclusion initiatives. Our levels of customer engagement and customer satisfaction scores are also very high. We have successfully completed several leadership and Board level retirements and replacements. Our sales teams are performing extremely well and have positioned us for another successful year of selling. And overall demand for Jack Henry technology solutions remains high in all segments of our business.
We have a commitment to doing the right thing for our constituents that we believe will continue to serve us well. We will continue with our disciplined approach to running the company, and expect that approach to help provide stability for our employees, customers and shareholders. As we begin the new fiscal year, I continue to be very optimistic about the future.
With that, I'll turn it over to Kevin for some detail on the numbers."
