"companyid","keydevid","transcriptid","headline","mostimportantdateutc","keydeveventtypename","companyname","speakertypename","componenttextpreview","word_count","componenttext"
277617,702444952,2201157,"Jack Henry & Associates, Inc., Q2 2021 Earnings Call, Feb 09, 2021",2021-02-09,"Earnings Calls","Jack Henry & Associates, Inc.","Operator","[Operator Instructions] Next question comes from the line of Ken Suchoski of Autonomous Research.",14,"[Operator Instructions] Next question comes from the line of Ken Suchoski of Autonomous Research."
277617,702444952,2201157,"Jack Henry & Associates, Inc., Q2 2021 Earnings Call, Feb 09, 2021",2021-02-09,"Earnings Calls","Jack Henry & Associates, Inc.","Analysts","I was just wondering if you could talk about how you expect your new sales to trend as the economy reopens. It looks like the sales pipeline is quite strong. And I was just curious if you expect that to accelerate as you get back into seeing these custome",59,"I was just wondering if you could talk about how you expect your new sales to trend as the economy reopens. It looks like the sales pipeline is quite strong. And I was just curious if you expect that to accelerate as you get back into seeing these customers in person. So any expectation there would be really helpful."
277617,702444952,2201157,"Jack Henry & Associates, Inc., Q2 2021 Earnings Call, Feb 09, 2021",2021-02-09,"Earnings Calls","Jack Henry & Associates, Inc.","Executives","Yes. It's a good question. As I highlighted in my opening comments, the quarter we just finished was the fifth largest sales booking quarter we've ever had in the history of the company. Well, that's pretty good. So saying that I expect it to accelerate s",193,"Yes. It's a good question. As I highlighted in my opening comments, the quarter we just finished was the fifth largest sales booking quarter we've ever had in the history of the company. Well, that's pretty good. So saying that I expect it to accelerate significantly, probably isn't a reasonable position to take. But what I do expect, as we just talked about in the last question is more on the core-signing side. I expect as we go forward that we'll start to see more on the core-signing side. 
The thing that will be interesting to watch is, can we sustain the pace that we've seen on the complementary side. Because if we can increase core bookings and sustain the complementary bookings, that's significant, that's meaningful. I'm not ready to say that, that's achievable, but that will certainly be our objective. And I think we have the opportunity to do that because we're getting all of this great recognition for some of this wonderful technology that we've been rolling out here, particularly in the area of digital. So we'll have to see how that goes as time goes forward, but that's my hope."
277617,702444952,2201157,"Jack Henry & Associates, Inc., Q2 2021 Earnings Call, Feb 09, 2021",2021-02-09,"Earnings Calls","Jack Henry & Associates, Inc.","Analysts","That's helpful. And I guess just a longer-term margin question. I mean it looks like your margins have declined versus where they were maybe 6, 7 years ago. I mean can you just talk about the main drivers of that? And is there an opportunity to get those",59,"That's helpful. And I guess just a longer-term margin question. I mean it looks like your margins have declined versus where they were maybe 6, 7 years ago. I mean can you just talk about the main drivers of that? And is there an opportunity to get those margins back to those levels or even above those levels?"
277617,702444952,2201157,"Jack Henry & Associates, Inc., Q2 2021 Earnings Call, Feb 09, 2021",2021-02-09,"Earnings Calls","Jack Henry & Associates, Inc.","Executives","Yes. So the big thing, I mean, if you're going to go back 6 or 7 years, and you really can't go back that far because you can really only go back to 2017 because when we restated for ASC 606, that was the farthest back we went. So you really can't look be",386,"Yes. So the big thing, I mean, if you're going to go back 6 or 7 years, and you really can't go back that far because you can really only go back to 2017 because when we restated for ASC 606, that was the farthest back we went. So you really can't look beyond that and get a true comparison of margins because ASC 606 definitely changed how we recognize revenue and had a significant impact on margins. 
But from '17 forward, the primary impact on our margins has been 2 things. One, the migration to the new card platform has increased our cost because we haven't been able to reduce any cost until we get through the migration, which, as Dave said in his opening comments, is going to be complete at the end of March. So we will start to see that cost savings. We'll see a nice rebound in margins in Q4 and then a full year of that cost reduction in FY '22. 
The other thing that's happened since '17 is we have literally sold no new core business. So there's been virtually no new core license revenue which is very high-margin business happening in the last 3 or 4 years. I mean on the bank side, I think, we have sold maybe 3 or 4 in-house deals since 2017. On the crediting side, not bearing any more than that. And most of those were smaller bank deals for our core director solution. So we -- so those are the 2 primary drivers as COGS at marts come down. 
Now what's going to happen is, like I said, you'll see margin improve in Q4. We'll continue to see it improve in the following year. We have gone through the transition of getting -- I mean, our license and hardware revenue is now very small percentage of our total revenue, so very little impact from that. So as we continue to migrate our -- in -- our on-prem customers to our private cloud and continue to sell additional card business and our card -- and our private cloud business continues to become a much larger percentage of our total revenue, that's a very high-margin business. Our margins will continue to grow and get back to the historical rates in FY '23 and beyond."
277617,702444952,2201157,"Jack Henry & Associates, Inc., Q2 2021 Earnings Call, Feb 09, 2021",2021-02-09,"Earnings Calls","Jack Henry & Associates, Inc.","Analysts","That makes a lot of sense. And if I could just squeeze one last one here. Just that divestiture, what was the revenue impact in the base here that you're assuming for the full year? I know you gave it for the 3 months and the 6 months, but just curious wh",57,"That makes a lot of sense. And if I could just squeeze one last one here. Just that divestiture, what was the revenue impact in the base here that you're assuming for the full year? I know you gave it for the 3 months and the 6 months, but just curious what the full year impact was."
277617,702444952,2201157,"Jack Henry & Associates, Inc., Q2 2021 Earnings Call, Feb 09, 2021",2021-02-09,"Earnings Calls","Jack Henry & Associates, Inc.","Executives","So the revenue for the core business, that's really what we sold was the core business of crews, which was 140 very small credit unions. That we divested October 1, and the quarterly revenue from that was right at $1.2 million, just like represented in th",77,"So the revenue for the core business, that's really what we sold was the core business of crews, which was 140 very small credit unions. That we divested October 1, and the quarterly revenue from that was right at $1.2 million, just like represented in the press release this quarter. So the total for this fiscal year on the GAAP to non-GAAP adjustment will be just under $3.7 million for the 3 quarters in this fiscal year."
277617,702444952,2201157,"Jack Henry & Associates, Inc., Q2 2021 Earnings Call, Feb 09, 2021",2021-02-09,"Earnings Calls","Jack Henry & Associates, Inc.","Operator","[Operator Instructions] There are no further questions at this time. I would like to turn the call back over to Kevin for closing remarks.",24,"[Operator Instructions] There are no further questions at this time. I would like to turn the call back over to Kevin for closing remarks."
277617,702444952,2201157,"Jack Henry & Associates, Inc., Q2 2021 Earnings Call, Feb 09, 2021",2021-02-09,"Earnings Calls","Jack Henry & Associates, Inc.","Executives","Thanks, Jay. First of all, I want to let everybody know that we are planning an Analyst Day this spring, the virtual event. And again, it will be held virtual. It's planned to be held on Tuesday, May 11, so please mark your calendars to save the date. We",205,"Thanks, Jay. First of all, I want to let everybody know that we are planning an Analyst Day this spring, the virtual event. And again, it will be held virtual. It's planned to be held on Tuesday, May 11, so please mark your calendars to save the date. We will be sending out an invitation with a schedule of events, timing and an online registration soon, and it will be sent to individuals. Please don't share it because we want to know who's actually attending this virtual event. But please be looking for this invite in your e-mail inbox in the near future.
Now to wrap up the call, we are very pleased with the overall results from our ongoing operations. I want to thank all of our associates for the way they have handled these challenges by taking care of themselves and our customers and continue to work hard to improve our company on so many fronts for the future. All of us at Jack Henry continue to focus on what is best for our customers and our shareholders. With that, I want to thank you again for joining us today. And Jay, if you would please provide the replay number, I'd appreciate it."
277617,702444952,2201157,"Jack Henry & Associates, Inc., Q2 2021 Earnings Call, Feb 09, 2021",2021-02-09,"Earnings Calls","Jack Henry & Associates, Inc.","Operator","Thank you. And ladies and gentlemen, this concludes today's conference call. Thank you for participating. You may now disconnect. For the replay, please dial (800) 585-8367. Thank you.",28,"Thank you. And ladies and gentlemen, this concludes today's conference call. Thank you for participating. You may now disconnect. 
For the replay, please dial (800) 585-8367. Thank you."
277617,712097144,2268126,"Jack Henry & Associates, Inc., Q3 2021 Earnings Call, May 04, 2021",2021-05-04,"Earnings Calls","Jack Henry & Associates, Inc.","Operator","Ladies and gentlemen, thank you for standing by, and welcome to the Jack Henry & Associates Third Quarter Fiscal Year 2021 Earnings Conference Call. [Operator Instructions] Please be advised that today's conference is being recorded. [Operator Instruction",57,"Ladies and gentlemen, thank you for standing by, and welcome to the Jack Henry & Associates Third Quarter Fiscal Year 2021 Earnings Conference Call. [Operator Instructions] Please be advised that today's conference is being recorded. [Operator Instructions] I would now like to hand the conference over to your speaker today, Kevin Williams. Thank you. Please go ahead."
277617,712097144,2268126,"Jack Henry & Associates, Inc., Q3 2021 Earnings Call, May 04, 2021",2021-05-04,"Earnings Calls","Jack Henry & Associates, Inc.","Executives","Thanks, Brandy. Good morning, and thank you all for joining us for the Jack Henry & Associates third quarter fiscal 2021 earnings call. I am Kevin Williams, CFO and Treasurer. And on the call with me today is David Foss, our President and CEO. In just a",297,"Thanks, Brandy. Good morning, and thank you all for joining us for the Jack Henry & Associates third quarter fiscal 2021 earnings call. I am Kevin Williams, CFO and Treasurer. And on the call with me today is David Foss, our President and CEO. 
In just a minute, I will turn the call over to Dave to provide some of his thoughts about the state of our business, our financial and sales performance for the quarter, some comments regarding the industry in general and how we're dealing with COVID-19 and some other key initiatives that we have in place. Then after Dave concludes his comments, I will provide some additional thoughts and comments regarding the press release we put out yesterday after market close and provide comments regarding our guidance for our fiscal year '21, which we also provided in the release yesterday, and then we will open the lines up for Q&A. 
First, I need to remind you that this call includes certain forward-looking statements including remarks or responses to questions concerning future expectations, events, objectives, strategies, trends or results. Like any statement about the future, these are subject to a number of factors that could cause actual results or events to differ materially from those which we anticipate due to a number of risks and uncertainties. The company undertakes no obligation to update or revise these statements. For a summary of these risk factors and additional information, please refer to yesterday's press release and the sections in our 10-K entitled risk factors and forward-looking statements. 
On this call, we will discuss certain non-GAAP financial measures, including non-GAAP revenue and non-GAAP operating income. For reconciliations for historical non-GAAP financial measures can be found in yesterday's press release. I will now turn the call over to Dave."
277617,712097144,2268126,"Jack Henry & Associates, Inc., Q3 2021 Earnings Call, May 04, 2021",2021-05-04,"Earnings Calls","Jack Henry & Associates, Inc.","Executives","Thank you, Kevin, and good morning, everyone. We're very pleased to report another quarter of revenue and operating income growth and an overall solid performance by our business. As always, I'd like to begin today by thanking our associates for all the h",1488,"Thank you, Kevin, and good morning, everyone. We're very pleased to report another quarter of revenue and operating income growth and an overall solid performance by our business. As always, I'd like to begin today by thanking our associates for all the hard work and commitment that went into producing those results for our third fiscal quarter. 
For Q3 of fiscal 2021, total revenue increased 1% for the quarter and increased 6% on a non-GAAP basis. Deconversion fees were down more than $18 million over the prior year quarter, which impacts revenue in the current quarter negatively. But as I've highlighted many times in the past, this is good news for our company if you take a long-term view. 
Turning to the segments. We again had a good quarter in the core segment of our business. Revenue decreased 4% for the quarter because of the reduction in deconversion fees, but increased by 3% on a non-GAAP basis. Our payments segment performed very well, posting a 7% increase in revenue this quarter and a 10% increase on a non-GAAP basis. We also had a strong quarter in our complementary Solutions businesses, with a 1% increase in revenue this quarter and a 5% increase on a non-GAAP basis. 
As I mentioned in the press release, our core sales teams had an extremely solid quarter and are now seeing core activity consistent with our pre pandemic run rate. During the quarter, we inked 15 competitive core takeaways which is greater than the 1 per week run rate we saw in 2019. 
In addition to our success signing Nucor clients, we signed 6 existing onprem core customers to move to our private cloud environment. As we continue to push into the larger regional bank space, I think it's significant to note that of the 15 new core deals in the quarter, 5 were with multibillion-dollar asset banks and credit unions. As a reminder, regarding the topic of new core wins, at Jack Henry, we only call out new core deals when a banker credit union moves their entire core processing relationship from a competitor system to a Jack Henry core solution. We do not announce them as a new core win if they move from 1 Jack Henry core to another or if they simply purchase a new module from us. Think of it as a new logo on the Jack Henry core customer list that wasn't there previously. 
In addition to the tremendous success we saw with our core business this quarter, we continued to sign new clients to our new digital offerings. During the third quarter, we signed 42 new clients to our Banno platform, and we continue to see increased interest in this offering as well as the rest of our digital suite. In our April 6 press release regarding digital momentum, we shared that we had more than 400 financial institutions and more than 4.3 million users live on the Banno platform. 
As of May 1, however, we have added several more financial institutions and we now have just over 5 million users live. We continue to enjoy the highest consumer rating in the App Store and we are regularly recognized as the fastest application in the industry. As I've said before, I expect our success in this area to grow as we continue to add new functionality and features to the platform. 
Regarding the ongoing migrations of our new card processing platform, as of the end of March, we have successfully completed the migration of all of our debit processing customers to the new platform in accordance with the plan we've been discussing for more than 3 years. Here are a few statistics regarding this remarkably successful project. 
We did our first migration on October 30, 2017, and completed the project on March 26, 2021. That's 1,243 days. During that time, we migrated 879 customers and added 151 new debit and credit customers to the platform. We currently support 1,030 banks and credit unions on the platform and we're adding new clients every month. 
You will start to see the larger positive impact of this completed project on our financials in the fourth fiscal quarter as we have emphasized throughout the process. I'm very proud of our team and thankful to our partners and clients for working with us to achieve such a successful outcome. 
As you probably heard, M&A has become a topic again among bankers, now that they're more confident about their operating models and the overall economy. Several of our clients have approached us recently to work with them as they prepare to complete acquisitions of smaller institutions. 
In fact, the CEOs of 2 regional banks currently processed by Jack Henry, were quoted in an American Banker article last week regarding their desire to pick up where they left off before the pandemic brought everything to a halt. We expect our activity and what we refer to as the convert merge area of our business to pick up again as we get into the summer months and new deals are announced. 
Speaking of American Banker, hopefully, you all saw their article last month announcing that once again, Jack Henry has been recognized by their team as a Best Place to Work in fintech. American banker only recognizes 50 companies each year. And as you can probably imagine, almost all of the companies on the fintech list generate less than $100 million in annual revenue pretty much in keeping with the type of company most people think of when they hear the word fintech. 
We are particularly proud of this recognition for a few reasons: first, the scores are based on surveys conducted with our employees by an independent agency; second, this is our fifth year in a row to receive this designation from American Banker; third, we are many times larger than almost any other company on the list; and fourth, none of our larger competitors have ever made this list. I think this recognition is indicative of the culture, entrepreneurial spirit and commitment to developing truly innovative solutions found within the teams at Jack Henry. 
As you have undoubtedly already noted from yesterday's press release, we purchased a significant number of shares in the quarter, with a lack of good quality acquisitions for us to pursue and with our stock at an attractive price, we worked with the Board to authorize an additional repurchase under the existing plan, which enabled us to buy 1,825,000 shares during the quarter. 
This significant share repurchase does not foreshadow a change in our strategy in this regard. We will continue to be opportunistic in our approach to purchasing our own shares as we have excess cash and the lack of acquisition targets that fit our strategy. 
Hopefully, you've all seen the press release we posted this morning, announcing the upcoming retirement of our longtime Chairman, Jack Prim. Of course, many of you know, Jack is the guy who sat in this chair before I became CEO at Jack Henry. As I said in today's press release, Jack has given many years to our company as a business leader, a Board member and a friend to us all. He has had a significant impact on the success of our company and on me personally. And for that, I want to sincerely thank him on behalf of all of us at Jack Henry. 
Recognizing that Jack has been considering a potential retirement for some time, we were prepared for his decision and expect our process to allow us to fill the vacancy close in time to Jack's retirement date. We hope to have more information to share regarding a new Board member and a new Chairman before the end of June. 
Slowly but surely, our customers are settling into a new mode of operation with the anticipation of most COVID restrictions being lifted in the coming months. We're still operating with well over 90% of our employees working full-time remote, but we are committed to our return to office date of July 1. We are finalizing plans for office usage and staffing that will employ a hybrid work-from-home, work-in-office strategy and we will continue to leverage remote sales and implementation tools where possible. We still have some work to do and some things to learn, but I'm very optimistic about our ability to be successful as the work environment shifts again post COVID. 
As we look toward the end of our fiscal year, our sales pipeline is very robust, and we continue to be optimistic about the strength of our technology solutions, our ability to deliver outstanding service to our customers, our ability to expand our customer relationships, the spending environment and our long-term prospects for success. I look forward to seeing and chatting with many of you at our virtual analyst conference next week. With that, I'll turn it over to Kevin for some detail on the numbers."
