"companyid","keydevid","transcriptid","headline","mostimportantdateutc","keydeveventtypename","companyname","speakertypename","componenttextpreview","word_count","componenttext"
318049,630748004,1791311,"Linde plc, Q2 2019 Earnings Call, Aug 05, 2019",2019-08-05,"Earnings Calls","Linde plc","Executives","Okay. Peter, so I -- with respect to, let's say, markets that were unaffected by the merger, and you brought up Australia. Clearly there are others. We found, if I go back in my Praxair days, that we had certain geographies that did a good job with price",343,"Okay. Peter, so I -- with respect to, let's say, markets that were unaffected by the merger, and you brought up Australia. Clearly there are others. We found, if I go back in my Praxair days, that we had certain geographies that did a good job with price management, and you can spend a day with them and see they really understood what was going on in the marketplace, what was going on with cost, what was going on with supply and demand and things that needed -- they needed to do to address that. 
And so the whole idea is to make sure that we bring that same rigor, that same discipline, that same competency, that same organizational approach to every corner of the globe. And we have had -- I've had those reviews with Australia. You mentioned Australia, and this is something they have been working on ever since the merger. I expect to see positive results, not only out of Australia but out of many other countries around the world as we continue to build that muscle. 
With respect to Brexit, the deindustrialization of the U.K. has been going on for a long time, so Brexit is not the point where that starts to happen. So clearly, that's an effect that we have been feeling for a long time in the U.K. What I think the team has done a great job of and will continue to do a great job of is building out resilient markets, more growth in resilient markets. And I'm thinking of health care, I'm thinking of food and beverage, I'm thinking of a myriad of applications that they have been bringing to the marketplace. So that very much has dampened the effect of the deindustrialization trend. And so I don't expect a big change coming out of Brexit. I certainly don't expect positive growth going forward as a result, but I certainly don't expect a big change. 
And Matt, do you want to answer the base -- or I can answer, and you can answer."
318049,630748004,1791311,"Linde plc, Q2 2019 Earnings Call, Aug 05, 2019",2019-08-05,"Earnings Calls","Linde plc","Executives","Yes, sure. Peter, just a couple of things, as you probably know, but just to make clear. Obviously, our base CapEx, as we defined it here, does include small growth. And that can also mean ECOVAR or VPSAs standard plants, as legacy Praxair called them. So",297,"Yes, sure. Peter, just a couple of things, as you probably know, but just to make clear. Obviously, our base CapEx, as we defined it here, does include small growth. And that can also mean ECOVAR or VPSAs standard plants, as legacy Praxair called them. So to have an apples-to-apples comparison may not be the same across the industry. 
But to your point when I look at legacy Praxair that had reported this now, we were on a $750 million to $800 million-type year run rate. So just thinking of that in simple terms, if you double that, that would be around $1.5 billion, $1.6 billion a year, if you felt the company size doubled. Right now, the run rate on Q2 is about $1.8 billion. Of the $200 million of CapEx synergies, a large portion of that would be dedicated to this area. This is an area that's getting a lot of focus. You saw sequentially, we had a little bit of a decline, but this is something we're going to keep working at. We tend not to look it as a percentage of sales. More really, it's a detailed bottoms-up how we look at that internally, what projects we need. 
But I can tell you reliability, as you know, is critical in this industry. That's not something we're going to compromise. But when we look at the other growth or small growth initiatives on things like cylinders, trailers, tanks, given the economic outlook we laid out, that's an area I would see probably less spending going forward. Those spend tend to correlate more to IP. So this is kind of how we'll look at it. But clearly, the CapEx synergies of $200 million, this base CapEx is going to be an area of intense focus."
318049,630748004,1791311,"Linde plc, Q2 2019 Earnings Call, Aug 05, 2019",2019-08-05,"Earnings Calls","Linde plc","Operator","And our next question comes from Jeff Zekauskas from JPMorgan.",10,"And our next question comes from Jeff Zekauskas from JPMorgan."
318049,630748004,1791311,"Linde plc, Q2 2019 Earnings Call, Aug 05, 2019",2019-08-05,"Earnings Calls","Linde plc","Analysts","In looking over your pricing in the various regions, if you compare your average prices to the numbers that came out of your competitor in Allentown, your price gains are smaller, particularly in Asia and Europe. What do you make of that?",42,"In looking over your pricing in the various regions, if you compare your average prices to the numbers that came out of your competitor in Allentown, your price gains are smaller, particularly in Asia and Europe. What do you make of that?"
318049,630748004,1791311,"Linde plc, Q2 2019 Earnings Call, Aug 05, 2019",2019-08-05,"Earnings Calls","Linde plc","Executives","Well, you have to understand we've been working on pricing for quite some time. So if you go back over a period of time, you would see our price gains have been there year-over-year. You also have to take into consideration that we have -- every competito",333,"Well, you have to understand we've been working on pricing for quite some time. So if you go back over a period of time, you would see our price gains have been there year-over-year. You also have to take into consideration that we have -- every competitor has a bit of a different mix. If I look at Europe, we're half packaged gases. So the ability to move through pricing very much is through I don't know how many -- probably a million transactions or so through those small welders. So that is the mix that we have there. 
If we look at Asia, obviously, our mix is a bit different than some of our competitors. We have Australia, which is a very large piece. Australia and China are the 2 largest countries that we have that represent Asia. If I look down beneath the covers, which I think is always important because you've got to keep in mind what we're reporting is an aggregated number. But I can look at China merchant price, and it's 5% year-over-year. So that number is very strong. Again, we've got some work to do across the board to bring everything up to an expectation that we would have. If I were to look at the Americas for example, 3% number, but U.S. merchant is 6%, South America is 5%, packaged is 3%. And then if I were to look at Europe, I'd say it's pretty much -- a pretty strong 2% kind of price increase number. 
But again, it's very much affected by what's going on in mix. And I'll give you another small example of that. If I look at our small business called refrigerants, that number is off quite a bit, and so -- year-over-year. So that all kind of fits into the calculation, but it's quite -- quite a bit's driven by mix. But we certainly have a focus on working on every aspect, every channel, every product, every market across the globe."
318049,630748004,1791311,"Linde plc, Q2 2019 Earnings Call, Aug 05, 2019",2019-08-05,"Earnings Calls","Linde plc","Executives","And Jeff, this is Matt. Just to add one thing to that to Steve's comments. As you can imagine year-over-year, calculating that on the pro forma bottom details, we do our best. But sequential, we tend to look at more intently, just given -- since the merge",79,"And Jeff, this is Matt. Just to add one thing to that to Steve's comments. As you can imagine year-over-year, calculating that on the pro forma bottom details, we do our best. But sequential, we tend to look at more intently, just given -- since the merger effective date, really Q1 and Q2. And I think on a sequential basis, you'll find numbers are more comparable. So I just tend to keep that in mind as we look forward."
318049,630748004,1791311,"Linde plc, Q2 2019 Earnings Call, Aug 05, 2019",2019-08-05,"Earnings Calls","Linde plc","Analysts","And then for my follow-up. Your adjusted interest expense was $35 million in the quarter, which I think is about 1% of your net debt. Is there something unusual in the $35 million number? And what's a more normal number, if there is one?",45,"And then for my follow-up. Your adjusted interest expense was $35 million in the quarter, which I think is about 1% of your net debt. Is there something unusual in the $35 million number? And what's a more normal number, if there is one?"
318049,630748004,1791311,"Linde plc, Q2 2019 Earnings Call, Aug 05, 2019",2019-08-05,"Earnings Calls","Linde plc","Executives","Yes, Jeff. This is Matt. So obviously, we have a lot of cash that's earning income that we are managing around the world, so you have interest income that's netting against that. So we are flush with a lot of cash. As we lever up and do more distributions",85,"Yes, Jeff. This is Matt. So obviously, we have a lot of cash that's earning income that we are managing around the world, so you have interest income that's netting against that. So we are flush with a lot of cash. As we lever up and do more distributions primarily through buybacks, you will start to see a shift. And you will see higher net interest but then you'll see lower share count, and that's part of the recapitalization I mentioned in the prepared comments."
318049,630748004,1791311,"Linde plc, Q2 2019 Earnings Call, Aug 05, 2019",2019-08-05,"Earnings Calls","Linde plc","Operator","And our next question comes from Steve Byrne from Bank of America.",12,"And our next question comes from Steve Byrne from Bank of America."
318049,630748004,1791311,"Linde plc, Q2 2019 Earnings Call, Aug 05, 2019",2019-08-05,"Earnings Calls","Linde plc","Analysts","Would really like to hear your view on what you've learned most from the integration of these 2 legacy companies with respect to what has surprised you. Anything that you would note that's more favorable than you expected or perhaps more unfavorable?",43,"Would really like to hear your view on what you've learned most from the integration of these 2 legacy companies with respect to what has surprised you. Anything that you would note that's more favorable than you expected or perhaps more unfavorable?"
318049,630748004,1791311,"Linde plc, Q2 2019 Earnings Call, Aug 05, 2019",2019-08-05,"Earnings Calls","Linde plc","Executives","Well, this is Steve. I would -- nothing really comes to mind that says this is less favorable than what we had hope for. I would say as we get into -- for example, Linde Engineering has very strong capabilities, very strong discipline, strong record of pr",239,"Well, this is Steve. I would -- nothing really comes to mind that says this is less favorable than what we had hope for. I would say as we get into -- for example, Linde Engineering has very strong capabilities, very strong discipline, strong record of project execution. Many people think that it's all large project-driven, but a good 40% or so is very small projects that they execute, day in and day out. So the capabilities, the strengths within that business certainly are obvious. 
As I look at application capabilities, it's a story of where I would say that we've been very strong in things like oxygen, combustion. Linde's been very strong in areas like clean fuels, health care. We both have worked on food and beverage. We both have worked on digitalization. The combined capability is very positive. I would say that certainly, some technologies like cylinder tracking is something that legacy Linde was very much out front with. Specialty gas capability, legacy Praxair had good capabilities, Linde has excellent capabilities. Together, we have a much stronger portfolio. You get into productivity tools, we each develop productivity tools. Praxair, obviously, was very proud of the productivity track record but Linde has excellent capabilities, too. You just put them all together. That's why I said at the beginning that all the employees, the 80-some-thousand employees within the company are very optimistic about the potential of the new company."
318049,630748004,1791311,"Linde plc, Q2 2019 Earnings Call, Aug 05, 2019",2019-08-05,"Earnings Calls","Linde plc","Analysts","And Steve, you mentioned engineering, 40% are small projects. How would you split that roughly $5 billion in backlog between gases and non-gases. Is that shifting one way or the other? And how do you view the value proposition of having both of those skil",46,"And Steve, you mentioned engineering, 40% are small projects. How would you split that roughly $5 billion in backlog between gases and non-gases. Is that shifting one way or the other? And how do you view the value proposition of having both of those skill sets?"
318049,630748004,1791311,"Linde plc, Q2 2019 Earnings Call, Aug 05, 2019",2019-08-05,"Earnings Calls","Linde plc","Executives","Well, if you look at the $5 billion of backlog, I would say that today in that backlog, natural gas processing plants, olefin plants would be probably half or so of that backlog, maybe a little bit more. And then the rest runs the gamut of ASUs and HyCO a",223,"Well, if you look at the $5 billion of backlog, I would say that today in that backlog, natural gas processing plants, olefin plants would be probably half or so of that backlog, maybe a little bit more. And then the rest runs the gamut of ASUs and HyCO and also some other small projects that would be part of that backlog number. I think having capabilities around the olefin crackers, there's certain examples that has led to pull-through of ASUs and other industrial gas products as a result of having that upfront project. 
Clearly, when you're talking about ethane crackers and natural gas plants, the level of -- the level at which you engage the customer is higher, because clearly, there is an interest at the highest levels of the organization with our customers in terms of talking to us about those kinds of projects, because they're very critical to their processes. 
So those are certainly positives that I can point to. I can also look at natural gas processing capability and point to where that is a good source of helium, which has been in short supply, continues to be in short supply. So having that upstream capability puts us in a very positive position with respect to capturing helium off of that process. So that's how I would address that."
318049,630748004,1791311,"Linde plc, Q2 2019 Earnings Call, Aug 05, 2019",2019-08-05,"Earnings Calls","Linde plc","Operator","And our next question comes from David Begleiter from Deutsche Bank.",11,"And our next question comes from David Begleiter from Deutsche Bank."
318049,630748004,1791311,"Linde plc, Q2 2019 Earnings Call, Aug 05, 2019",2019-08-05,"Earnings Calls","Linde plc","Analysts","Matt and Steve, just on the synergies, what are you targeting in the back half of the year now for -- on the cost synergies?",25,"Matt and Steve, just on the synergies, what are you targeting in the back half of the year now for -- on the cost synergies?"
318049,630748004,1791311,"Linde plc, Q2 2019 Earnings Call, Aug 05, 2019",2019-08-05,"Earnings Calls","Linde plc","Executives","Well, I said $225 million was the approximate synergy number. We had a good quarter in Q2, so we made a good dent on that number. Matt has said that we're approaching -- will be at the full run rate, so you're looking at a run rate in 2 for something like",81,"Well, I said $225 million was the approximate synergy number. We had a good quarter in Q2, so we made a good dent on that number. Matt has said that we're approaching -- will be at the full run rate, so you're looking at a run rate in 2 for something like $75 million kind of run rate, so Q3 will probably less than that, should be less than that, and I think that's the right way to think about it."
318049,630748004,1791311,"Linde plc, Q2 2019 Earnings Call, Aug 05, 2019",2019-08-05,"Earnings Calls","Linde plc","Analysts","Very good. And just on the buybacks, how should we think about the cadence of the buybacks in the back half of the year?",24,"Very good. And just on the buybacks, how should we think about the cadence of the buybacks in the back half of the year?"
318049,630748004,1791311,"Linde plc, Q2 2019 Earnings Call, Aug 05, 2019",2019-08-05,"Earnings Calls","Linde plc","Executives","David, yes, this is Matt. So as you can see, we are in the market every day as you probably see from some of the reports, and that's something we plan to continue to do, to be a participant every day. And when we find opportunities, we'll obviously take a",111,"David, yes, this is Matt. So as you can see, we are in the market every day as you probably see from some of the reports, and that's something we plan to continue to do, to be a participant every day. And when we find opportunities, we'll obviously take advantage of that. That means that the last few days have been a good example, where there may be macro events completely unrelated to us could be good opportunities to come in and repurchases the stock. But obviously, we have the authority, we have the cash. We're in every day and whether times to be opportunistic, we will continue to do that."
318049,630748004,1791311,"Linde plc, Q2 2019 Earnings Call, Aug 05, 2019",2019-08-05,"Earnings Calls","Linde plc","Operator","And our next question comes from Laurence Alexander from Jefferies.",10,"And our next question comes from Laurence Alexander from Jefferies."
318049,630748004,1791311,"Linde plc, Q2 2019 Earnings Call, Aug 05, 2019",2019-08-05,"Earnings Calls","Linde plc","Analysts","Just a couple of questions. One is with respect to the softer volume outlook that you flagged, how soft would volumes need to get for you to worry about the cadence of pricing slowing down? And secondly, on FX, we normally talk about currency with respe",93,"Just a couple of questions. One is with respect to the softer volume outlook that you flagged, how soft would volumes need to get for you to worry about the cadence of pricing slowing down? 
And secondly, on FX, we normally talk about currency with respect to the translation effects on the P&L. At what point does the backlog get fixed from a currency perspective? That is if you have a large project during 2022, at what point do we pin down the currency that will be used for translation effects going forward?"
318049,630748004,1791311,"Linde plc, Q2 2019 Earnings Call, Aug 05, 2019",2019-08-05,"Earnings Calls","Linde plc","Executives","Okay. So I'll just take the first question. I think this is going to be something that we have to look at geography by geography, product by product, market by market in terms of understanding negative volumes and the impact that it can have on pricing. I",146,"Okay. So I'll just take the first question. I think this is going to be something that we have to look at geography by geography, product by product, market by market in terms of understanding negative volumes and the impact that it can have on pricing. I think it's clear that if you had a substantial drop in volumes and that contributed to a high level of supply versus demand in the marketplace, that could put some downward pressure on pricing. So I think I'd have to look at that in term of where it's going to actually materialize with respect to what it would do. My view is we would still deliver some positive pricing even if it fell to a level like that. 
Then I'm going to let Matt answer the currency -- how we handle currency and projects we have in the future."
318049,630748004,1791311,"Linde plc, Q2 2019 Earnings Call, Aug 05, 2019",2019-08-05,"Earnings Calls","Linde plc","Executives","Yes, Laurence, so as you know, when we make these investments, they're 15- to 20-year horizons. So throughout that time frame, currencies go up and down. And to account for that, we always embed in our financial analyses a sovereign and currency risk in e",223,"Yes, Laurence, so as you know, when we make these investments, they're 15- to 20-year horizons. So throughout that time frame, currencies go up and down. And to account for that, we always embed in our financial analyses a sovereign and currency risk in every country we operate in. So we essentially mandate that the return can recover the known risks within those contracts. And obviously, if you can get upwards of 100% inflation coverage in your escalation, that has a natural balance on devaluations. Because usually, after a devaluation, inflation follows. So these are the mechanisms that we do to recover. Compound inflation on a local basis can often exceed the effects of the foreign currency translation over that same time period. So these are all mechanisms you do when contracting to ensure you get an appropriate return inflation coverage to mitigate against that. 
As far as the actual execution itself in procuring equipment, whether it's turbomachinery in Europe or coal boxes in China, et cetera, we may or may not use derivatives on that 1-year, 2-year invoicing exposure. That would be translational -- or transactional, I'm sorry, to your point. So that's more of a derivative decision. But long range, we feel we have very strong contractual and return requirements to offset that.
I think we have time for one more."
318049,630748004,1791311,"Linde plc, Q2 2019 Earnings Call, Aug 05, 2019",2019-08-05,"Earnings Calls","Linde plc","Operator","And our last question comes from P.J. Juvekar from Citi.",11,"And our last question comes from P.J. Juvekar from Citi."
318049,630748004,1791311,"Linde plc, Q2 2019 Earnings Call, Aug 05, 2019",2019-08-05,"Earnings Calls","Linde plc","Analysts","You mentioned that IP or Industrial Production is slowing down around the world. How quickly do you see that in your packaged volumes? And you also mentioned that hardgoods turned negative. Is that a historically harbinger of slower industrial activity?",40,"You mentioned that IP or Industrial Production is slowing down around the world. How quickly do you see that in your packaged volumes? And you also mentioned that hardgoods turned negative. Is that a historically harbinger of slower industrial activity?"
318049,630748004,1791311,"Linde plc, Q2 2019 Earnings Call, Aug 05, 2019",2019-08-05,"Earnings Calls","Linde plc","Executives","So I'll just take the last one. So when hardgoods turns negative, and in this case, you see less large equipment, large welding equipment being ordered and so forth, it just says that your customers are becoming more cautious about the outlook going forwa",261,"So I'll just take the last one. So when hardgoods turns negative, and in this case, you see less large equipment, large welding equipment being ordered and so forth, it just says that your customers are becoming more cautious about the outlook going forward. And typically, that would be the first sign. Then you start to see the consumables slow along with the gas volumes. So it's not like it fell 30%. So if you go back in 2009, that's what we saw in the United States. Hardgoods fell 30%. But it did fell to negative territory, which says that it's certainly not a positive indication with respect to growth rates going forward. Not falling off a cliff but it does signal a weakening trend. 
Again, I think about cylinder gases as very much tied to industrial production, and I made mention the fact that in Europe, half of our business is packaged gases, so that's very much tied to the manufacturing economy, and you can look at the trends with respect to the Eurozone, with respect to more negative trends on industrial production. 
And I anticipate the same thing as I look across Asia, that the trend for industrial production has been walking down. The PMI indicators for metals, chemicals has been walking down and, therefore, that just signifies to me that there's going to be some weakness ahead. Manufacturing certainly is weaker in China than it has been. And so therefore, that has a big effect on cylinder gases. But not just cylinder gases. Other products as well."
318049,630748004,1791311,"Linde plc, Q2 2019 Earnings Call, Aug 05, 2019",2019-08-05,"Earnings Calls","Linde plc","Analysts","Okay. And then your energy backlog is roughly half of your total backlog. With energy prices down from peak levels, what does that mean for your future backlog?",28,"Okay. And then your energy backlog is roughly half of your total backlog. With energy prices down from peak levels, what does that mean for your future backlog?"
