"companyid","keydevid","transcriptid","headline","mostimportantdateutc","keydeveventtypename","companyname","speakertypename","componenttextpreview","word_count","componenttext"
318049,639938793,1862243,"Linde plc, Q3 2019 Earnings Call, Nov 12, 2019",2019-11-12,"Earnings Calls","Linde plc","Executives","Well, I think we still have some opportunities to continue to work through. I think we've made some very good progress this year. I mean,first step is to be able to calculate what your pricing is and to be able to do a variance analysis. So you separate o",204,"Well, I think we still have some opportunities to continue to work through. I think we've made some very good progress this year. I mean,first step is to be able to calculate what your pricing is and to be able to do a variance analysis. So you separate out pricing. And then you have to -- and then start looking at the reports and then start to take appropriate actions. 
So I think a lot of those building blocks have been put in place. As I look around the world, clearly, we have very strong pricing in the Americas. I'm looking at areas that were up 6%, 7%, some areas are lower. I can look across Europe and see that package and merchant combined is up around 4% or so. So some progress has been by just the look at those pure product lines. 
And then I look at Asia, we have a situation currently today in China, where the year-over-year comparison is unfavorable because pricing was very high in the prior year period, and that's something that we're working on. But overall, I think we clearly have some opportunity to do more, and that would be my expectation rolling into 2020 as well."
318049,639938793,1862243,"Linde plc, Q3 2019 Earnings Call, Nov 12, 2019",2019-11-12,"Earnings Calls","Linde plc","Analysts","And you just mentioned China, and you said here that Chinese volumes are down. How much are they down? And what trend have you seen this year? The front -- is the trend improving or flat? Or what's going on there?",41,"And you just mentioned China, and you said here that Chinese volumes are down. How much are they down? And what trend have you seen this year? The front -- is the trend improving or flat? Or what's going on there?"
318049,639938793,1862243,"Linde plc, Q3 2019 Earnings Call, Nov 12, 2019",2019-11-12,"Earnings Calls","Linde plc","Executives","Well, I would say that if I look at Q3, it looks pretty flat to me. And if you want to kind of step back and look at what's going on in China, generally speaking, Matt talked about the trends Q3 to Q4. It just so happens, Golden Week was the first week of",217,"Well, I would say that if I look at Q3, it looks pretty flat to me. And if you want to kind of step back and look at what's going on in China, generally speaking, Matt talked about the trends Q3 to Q4. It just so happens, Golden Week was the first week of October. And no pun intended, the Golden Week was very weak. And again, that's the type of thing you expect when the overall economy is not very strong. .
IP and GDP have been trending down over time. Automotive has not returned anywhere near its levels. Steel, PMI index has been in the mid-40s. The only thing keeping that going is infrastructure spend. Chemicals are probably -- it's probably one of the more stable parts of the market that's got in the low 50s from a PMI standpoint. And we do look forward to a wave of relocations that we think will be coming as a result of environmental issues and cleanup, driven by Beijing. Electronics is probably a bright spot because the Chinese government is focusing so heavily on that. 
But clearly, China has been on a weakening trend. And again, we're not starting up large projects as we speak, that can move that number fairly significantly, that will come later on."
318049,639938793,1862243,"Linde plc, Q3 2019 Earnings Call, Nov 12, 2019",2019-11-12,"Earnings Calls","Linde plc","Operator","And this does conclude our Q&A portion, and I would like to turn the conference back over to Juan Pelaez for any closing remarks.",25,"And this does conclude our Q&A portion, and I would like to turn the conference back over to Juan Pelaez for any closing remarks."
318049,639938793,1862243,"Linde plc, Q3 2019 Earnings Call, Nov 12, 2019",2019-11-12,"Earnings Calls","Linde plc","Executives","Michelle, thank you. And thanks, everyone, for participating in today's call. If you have any further questions, please feel free to reach out to me directly. Have a great day.",30,"Michelle, thank you. And thanks, everyone, for participating in today's call. If you have any further questions, please feel free to reach out to me directly. Have a great day."
318049,639938793,1862243,"Linde plc, Q3 2019 Earnings Call, Nov 12, 2019",2019-11-12,"Earnings Calls","Linde plc","Operator","Ladies and gentlemen, this concludes today's conference call. Thank you for participating. You may now disconnect.",16,"Ladies and gentlemen, this concludes today's conference call. Thank you for participating. You may now disconnect."
318049,639938793,1862617,"Linde plc, Q3 2019 Earnings Call, Nov 12, 2019",2019-11-12,"Earnings Calls","Linde plc","Operator","Ladies and gentlemen, thank you for standing by, and welcome to the Third Quarter 2019 Linde Earnings Conference Call. [Operator Instructions] Please be advised that today's conference is being recorded. I would now like to hand the conference over to you",50,"Ladies and gentlemen, thank you for standing by, and welcome to the Third Quarter 2019 Linde Earnings Conference Call. [Operator Instructions] Please be advised that today's conference is being recorded. I would now like to hand the conference over to your host for today, Mr. Juan Pelaez. Please go ahead."
318049,639938793,1862617,"Linde plc, Q3 2019 Earnings Call, Nov 12, 2019",2019-11-12,"Earnings Calls","Linde plc","Executives","Thanks, Michelle. Good morning, everyone, and thank you for attending our third quarter earnings call and webcast. Once again, this is Juan Pelaez, Head of Investor Relations. And I am joined this morning by Steve Angel, Chief Executive Officer; and Matt",124,"Thanks, Michelle. Good morning, everyone, and thank you for attending our third quarter earnings call and webcast. Once again, this is Juan Pelaez, Head of Investor Relations. And I am joined this morning by Steve Angel, Chief Executive Officer; and Matt White, Chief Financial Officer. 
Today's presentation materials are available on our website at linde.com in the Investors section. Please look at forward-looking statement disclosure on Page 2 of the slides and note that it applies to all statements made during this teleconference. The reconciliations of the pro forma numbers are in the appendix of this presentation. Steve and Matt will now give us an update on Linde. We will then be available to answer questions. Let me turn the call over to Steve."
318049,639938793,1862617,"Linde plc, Q3 2019 Earnings Call, Nov 12, 2019",2019-11-12,"Earnings Calls","Linde plc","Executives","Thank you, Juan. The team delivered very strong results for the quarter. We saw operating profit and operating profit margins improve both sequentially and year-over-year in every segment. EPS improved substantially year-over-year and sequentially. Cash f",453,"Thank you, Juan. The team delivered very strong results for the quarter. We saw operating profit and operating profit margins improve both sequentially and year-over-year in every segment. EPS improved substantially year-over-year and sequentially. Cash flow came through nicely as we had expected. Project CapEx grew while base CapEx shrank, which reflects spend against our large project backlog and CapEx efficiencies. ROC percent, the single most important metric in a capital-intensive business, continue to improve. The sale of gas backlog remained strong at $5 billion, which gives us a nice foundation for future growth. 
We raised our guidance again, which reflects our positive momentum, the opportunities we see to continue to improve the quality of our business and the resiliency of our business model. And of course, this is against a backdrop of softening worldwide demand. 
A few comments on the segments. In the Americas, which represents nearly 40% of our total sales and nearly half of our overall operating profit, we saw good organic sales year-over-year, driven by price, but flat sales sequentially. Strength in food and beverage and health care is offsetting weakness in metals and manufacturing. 
Operating margins continued to improve as we drive efficiencies across the region. In Europe, we saw evidence of better execution as operating margins reached 20.5% despite a weaker macro. The weakness we saw in the quarter continued through September and October. 
In APAC, operating margins are climbing nicely, up 450 basis points year-over-year and 70 basis points sequentially as the team continues to do an excellent job delivering on merger efficiencies. Volumes are impacted by a slowing China, Australia and turnarounds in Southeast Asia. 
In Linde Engineering, we saw record margins, driven by excellent execution, cost absorption and timing as we're able to close out key projects during the quarter. Though backlogs remained strong, I don't see this level of operating margin as sustainable. This is a business that should trend closer to low double-digit percents through the cycle. 
The global other segment reflects ongoing merger efficiencies, as you would expect. Our focus, successful integration, improve the quality of each and every business, optimize our portfolio around core sale of gas regions and businesses, and then drive network density, facilitate growth synergies and drive operational excellence in everything we do. 
Final comment before I turn it over to Matt. We have a resilient business model, which generates strong cash flow through the economic cycle. In periods of expansion, we invest for growth. And when the macro weakens, we return that cash to shareholders. You add to that the value created by our merger and you can see why we are an investment for all seasons and why I wouldn't trade places with anyone. Matt?"
318049,639938793,1862617,"Linde plc, Q3 2019 Earnings Call, Nov 12, 2019",2019-11-12,"Earnings Calls","Linde plc","Executives","Thanks, Steve, and good morning, everyone. Third quarter adjusted pro forma results are shown on Slide 3. Consistent with prior quarters, these figures have been adjusted to best demonstrate underlying trends and performance of the combined business. Yo",1119,"Thanks, Steve, and good morning, everyone. Third quarter adjusted pro forma results are shown on Slide 3. 
Consistent with prior quarters, these figures have been adjusted to best demonstrate underlying trends and performance of the combined business. You'll find the required reconciliations to U.S. GAAP in the appendix. 
Sales of $7 billion are 1% higher than prior year but 3% below the second quarter of this year. Foreign currency translation continues to be a headwind as the U.S. dollar strengthened across the board. Excluding FX and cost pass-through, underlying sales increased 4% from 2018, but decreased 1% sequentially. Versus prior year, prices rose 2%, and the 2% volume increase was split between organic growth and project contribution. While the more resilient end markets of food, beverage and health care continue to grow, we are seeing declining to negative growth rates across most industrial markets, especially metals and manufacturing. 
The slowing industrial activity is primarily driven by North America, China and Australia, which is consistent with our expectations. Versus the second quarter of this year, price increased 1% from broad-based actions, but volume declined 2% from engineering project timing and some seasonality and weaker industrial activity in EMEA. 
Despite the softening economic conditions, operating profit grew 16% versus prior year and 5% sequentially, or 19% and 6% when excluding currency translation. The combination of price attainment and cost efficiencies across all segments enabling operating margins to expand 270 basis points versus 2018 and 140 basis points versus Q2. 
The company reached 19.8% operating margin this quarter as employees around the world continue to coordinate efforts to improve productivity and operational excellence. 
Net income increased 24% from prior year or 27% when excluding FX translation. The reason for greater profit leverage is due to lower net interest expense from a combination of excess cash flow and FX impact. 
As stated before, we are recapitalizing the balance sheet to better align with our target single A credit rating, but this will take a little more time as we refine our cash forecasting. Until then, we are actively deploying excess cash and managing the capital structure to deliver value to the shareholders. 
EPS of $1.94 was 26% higher than prior year and 6% higher sequentially. Excluding FX, those figures improved to 29% and 7%, respectively. This result is somewhat higher than anticipated since favorable impact from cost management actions more than offset worse-than-expected FX rates. 
In addition to delivering strong profit leverage this quarter, a large majority of earnings pulled through to cash as operating cash flow increased 86% sequentially to $1.9 billion. While we would normally expect some seasonal improvement, most of this sequential increase is driven by better working capital management along with higher EBITDA and less merger-related outflows. 
CapEx increased 11% from Q2. But you can see that was driven by project CapEx, which represents customer projects under construction and secured by long-term contracts that lead to incremental growth. The sale of gas backlog associated with project CapEx remains strong at $4.7 billion and will be executed over the next 3 years, although that spend pattern will be somewhat lumpy. 
Base CapEx, which represents all other capital spend not associated with our project backlog, such as small growth, cost reduction and maintenance, declined 7% sequentially as we continue to find more opportunities for cash synergies. Rolling this all together results in a return on capital of 11.2% or a 60 basis point sequential increase. This improvement is driven by higher after-tax profit over a capital base that declined due to prudent cash management across the organization. 
We firmly believe that return on capital is one of the most important metrics for this industry in light of the capital intensity and long-term contractual structure. Given this cash and capital trends felt it may be helpful to provide a little more detail, which you can find on Slide 4. 
The left side shows operating cash flow trends by quarter. The first 2 quarters were each around $1 billion, but subsequently increased to almost $1.9 billion in the third quarter. As I mentioned earlier, the key drivers include declining merger-related outflows, higher earnings and better working capital performance. 
In addition, the first half tends to be seasonally lower from timing of cash incentives and taxes. The year-to-date figure of $3.9 billion includes $0.7 billion of onetime merger-related outflows. This $0.7 billion primarily relates to taxes and fees, which supported $11 billion of divestiture proceeds, in addition to legal and adviser payments. These merger outflows will be significantly lower in 2020. 
The pie chart in the lower right represents how the year-to-date operating cash flow has been allocated. 
Overall, it's a balanced approach, with roughly half invested in the business and half returned to shareholders in the form of dividends and stock repurchases. Of the half invested in the business, it's evenly split between investments in secured growth and base CapEx. 
Secured growth represents accretive acquisitions and project CapEx for the backlog. Base CapEx is important to support nonbacklog growth, achieve cost reduction targets and maintain high levels of plant safety, reliability and efficiency. 
Overall, the priority is to invest in high-quality projects, growth projects that meet our investment criteria while continuously generating excess free cash flow to distribute back to shareholders. Please turn to Slide 5 for an update on full year guidance. 
We are raising full year EPS guidance to $7.25 to $7.30, which represents an increase of 17% to 18% from prior year or 21% to 22% when excluding 4% currency headwind. The guidance is above last quarter due to favorable Q3 results and continued confidence and opportunities to improve the cost structure. However, this range also implies that Q4 EPS will be below the $1.94 from Q3. Part of the sequential decline relates to the timing of project completions for the engineering business. 
Engineering is a long-cycle business with projects that take several years. So the quarter-to-quarter results can vary, but we fully expect to maintain high levels of execution. 
Another driver of the anticipated Q3 to Q4 decline relates to projections of a weaker macro. Lower manufacturing levels and longer customer outages continue to point to decreasing industrial activity. 
In summary, despite the macroeconomic headwinds, we continue to improve the quality of the business and grow earnings double-digit percent over last year. This is only possible from the collective efforts of all 80,000 employees executing as one team. And while geopolitical forces will likely result in more uncertainty 2020 and beyond, we maintain a high degree of confidence in our ability to leverage opportunities that not only overcome these challenges, but will also create substantial value for our owners. 
I'd now like to turn the call over to Q&A."
318049,639938793,1862617,"Linde plc, Q3 2019 Earnings Call, Nov 12, 2019",2019-11-12,"Earnings Calls","Linde plc","Operator","[Operator Instructions] Our first question comes from the line of Mike Sison with Wells Fargo.",15,"[Operator Instructions] Our first question comes from the line of Mike Sison with Wells Fargo."
318049,639938793,1862617,"Linde plc, Q3 2019 Earnings Call, Nov 12, 2019",2019-11-12,"Earnings Calls","Linde plc","Analysts","Steve, when you think about the macro environment being weak as it is and your earnings growth pretty strong, how do you frame up the leverage potential if demand gets better, particularly longer term? Given you're doing 17% to 18% growth, how much better",54,"Steve, when you think about the macro environment being weak as it is and your earnings growth pretty strong, how do you frame up the leverage potential if demand gets better, particularly longer term? Given you're doing 17% to 18% growth, how much better can your earnings growth get with a better economic environment?"
318049,639938793,1862617,"Linde plc, Q3 2019 Earnings Call, Nov 12, 2019",2019-11-12,"Earnings Calls","Linde plc","Executives","Well, I think, clearly, there's leverage if -- to the EPS if volumes improve above what we're looking at. Going forward into next year, we certainly have a backlog that we've talked about in the past that will be additive to our EPS. We have pricing expec",123,"Well, I think, clearly, there's leverage if -- to the EPS if volumes improve above what we're looking at. Going forward into next year, we certainly have a backlog that we've talked about in the past that will be additive to our EPS. We have pricing expectations as well. We have ongoing cost efficiencies. We have the impact of share buybacks, et cetera. So anything that happens on the volume line would be additive to that. 
But I think we have to be realistic based on the trends we're seeing, which are not particularly positive around the world. So that's why we frame -- or why I frame my view of going forward because I'm looking at trends that just aren't that positive."
318049,639938793,1862617,"Linde plc, Q3 2019 Earnings Call, Nov 12, 2019",2019-11-12,"Earnings Calls","Linde plc","Analysts","Got it. And then just curious on your engineering backlog of $5 billion. How does that over time translate to earnings growth in a given year or given a couple of years?",32,"Got it. And then just curious on your engineering backlog of $5 billion. How does that over time translate to earnings growth in a given year or given a couple of years?"
318049,639938793,1862617,"Linde plc, Q3 2019 Earnings Call, Nov 12, 2019",2019-11-12,"Earnings Calls","Linde plc","Executives","Well, it is -- it's third-party sales. And so if you kind of assume a certain level of sales that we're seeing now on a quarterly basis and if you assume operating margins again are something closer to what I said in my opening comments, which are kind of",126,"Well, it is -- it's third-party sales. And so if you kind of assume a certain level of sales that we're seeing now on a quarterly basis and if you assume operating margins again are something closer to what I said in my opening comments, which are kind of low double digits, call it, like 11%, 12%, maybe 13% kind of range through the cycle, that's what we should be able to expect. And the strong backlog just gives us confidence that going forward into the next year, we're going to have that to work against and certainly into part of the following year. 
It will come a point where we're going to need to add new projects to sustain that level of profitability going forward."
318049,639938793,1862617,"Linde plc, Q3 2019 Earnings Call, Nov 12, 2019",2019-11-12,"Earnings Calls","Linde plc","Executives","And I think, Mike, this is Matt. One thing to add, just as a reminder, I mean, this is primarily a negative working capital business. It's highly accretive. It's not capital intensive like the remainder of the industrial gas business. So it is highly comp",51,"And I think, Mike, this is Matt. One thing to add, just as a reminder, I mean, this is primarily a negative working capital business. It's highly accretive. It's not capital intensive like the remainder of the industrial gas business. So it is highly complementary from a financial perspective in addition."
318049,639938793,1862617,"Linde plc, Q3 2019 Earnings Call, Nov 12, 2019",2019-11-12,"Earnings Calls","Linde plc","Operator","And our next question comes from the line of Markus Mayer with Baader-Helvea.",14,"And our next question comes from the line of Markus Mayer with Baader-Helvea."
318049,639938793,1862617,"Linde plc, Q3 2019 Earnings Call, Nov 12, 2019",2019-11-12,"Earnings Calls","Linde plc","Analysts","Markus Mayer, Baader-Helvea. Three questions from my side. First one is on the guidance. Maybe you can help us understand what -- when you look at the guidance raised, what was triggered by the share buyback effect? What was the negative effect from ForEx",65,"Markus Mayer, Baader-Helvea. Three questions from my side. First one is on the guidance. Maybe you can help us understand what -- when you look at the guidance raised, what was triggered by the share buyback effect? What was the negative effect from ForEx? And what effects came from the different organic growth assumption or the different efficiency effects? That would be my first question."
318049,639938793,1862617,"Linde plc, Q3 2019 Earnings Call, Nov 12, 2019",2019-11-12,"Earnings Calls","Linde plc","Executives","Okay. Markus, this is Matt. I can handle that. I think from a share buyback perspective, I'd say little to no effect. That's not really having any effect. In fact, I would say we were probably a little bit behind on our program in the last quarter. So tha",238,"Okay. Markus, this is Matt. I can handle that. I think from a share buyback perspective, I'd say little to no effect. That's not really having any effect. In fact, I would say we were probably a little bit behind on our program in the last quarter. So that's really not having much of an effect. 
But the offset to that will be slightly better interest. So I would think about interest and buyback really is kind of offsetting each other. As I have favorable interest, I'll be behind in a buyback program. But as I work towards a single A, then I'll probably have a lower share count. 
FX definitely had a negative effect. When we looked and gave guidance a quarter ago, I would say the FX got worse by 1% to almost 2% than what we had anticipated. We'll have to see what it means going forward. But that is something that got a little worse as the dollar strengthened pretty much across the board. 
As far as the growth, I think the easier way to probably think about it is sequentially, as we mentioned, thinking about Q3 to Q4. At this stage, this guidance implies probably about 1% kind of erosion on base volumes. We'll have to see if that occurs or not. Obviously, anything better than that should be upside. But right now, that's our assumption and we'll see what ultimately comes out."
318049,639938793,1862617,"Linde plc, Q3 2019 Earnings Call, Nov 12, 2019",2019-11-12,"Earnings Calls","Linde plc","Analysts","Okay, understood. The second question would be what was the helium effect on your price increases in this quarter?",19,"Okay, understood. The second question would be what was the helium effect on your price increases in this quarter?"
318049,639938793,1862617,"Linde plc, Q3 2019 Earnings Call, Nov 12, 2019",2019-11-12,"Earnings Calls","Linde plc","Executives","The helium, if you look at year-over-year, it was probably about 1/4 of the price effect, the 2%, maybe slightly higher, but something around that vicinity, and sequentially, no effect.",30,"The helium, if you look at year-over-year, it was probably about 1/4 of the price effect, the 2%, maybe slightly higher, but something around that vicinity, and sequentially, no effect."
