"companyid","keydevid","transcriptid","headline","mostimportantdateutc","keydeveventtypename","companyname","speakertypename","componenttextpreview","word_count","componenttext"
318049,611381002,1732456,"Linde plc, Q1 2019 Earnings Call, May 10, 2019",2019-05-10,"Earnings Calls","Linde plc","Executives","I don't really -- we talked about this before. We have supplied air separation units in China for coal gasification operations along the coast. That's been part of our density strategy. We take merchant liquids off of those projects and they're customers",138,"I don't really -- we talked about this before. We have supplied air separation units in China for coal gasification operations along the coast. That's been part of our density strategy. We take merchant liquids off of those projects and they're customers that we feel very comfortable with going forward. So that has been the bulk of what we have done, it has not been in what they referred to as the coal triangle in China. That just was never part of our strategy. We've also supplied air separation units for PECO gasification for CNOOC, and they were taking hydrogen and integrating it back into the refineries. So those are the kind of projects that we have done in China, and I expect we'll see more of those going forward in the future.  But, that's my answer."
318049,611381002,1732456,"Linde plc, Q1 2019 Earnings Call, May 10, 2019",2019-05-10,"Earnings Calls","Linde plc","Operator","And our next question comes from the line of Kevin McCarthy with Vertical Research Partners.",15,"And our next question comes from the line of Kevin McCarthy with Vertical Research Partners."
318049,611381002,1732456,"Linde plc, Q1 2019 Earnings Call, May 10, 2019",2019-05-10,"Earnings Calls","Linde plc","Analysts","I found the adjusted pro forma disclosures in Pages 11 to 13 of your release to be very helpful. I was wondering if you intend to provide those results each quarter as we go or if there's a way to understand how 2Q versus 4Q '18 would have trended in the",116,"I found the adjusted pro forma disclosures in Pages 11 to 13 of your release to be very helpful. I was wondering if you intend to provide those results each quarter as we go or if there's a way to understand how 2Q versus 4Q '18 would have trended in the future SEC filing, number one?  
And then two, Praxair in the past provided specific quarterly guidance. You have elected not to do that today but, Matt, I think you indicated you're expecting moderate improvement. Just curious as to why the change?  Is it function of many moving parts in the merger or indicative of how you intend to communicate as a combined company going forward?"
318049,611381002,1732456,"Linde plc, Q1 2019 Earnings Call, May 10, 2019",2019-05-10,"Earnings Calls","Linde plc","Executives","Kevin, yes, this is Matt. I'll respond to those. I think first, to your first question, yes, absolutely, we intend to continue to include these. They're necessary. We need to have the ability to explain the walks from the GAAP to the pro forma and then to",277,"Kevin, yes, this is Matt. I'll respond to those. I think first, to your first question, yes, absolutely, we intend to continue to include these. They're necessary. We need to have the ability to explain the walks from the GAAP to the pro forma and then to the adjusted. So we will continue to add those. 
I think on the quarterly guidance, that's something we're evaluating and we are looking toward that. As you can imagine, we really have 1 month in the quarter together. We're just closing the second month. So things like the monthly rhythm, we're getting better and better. Forecasting is a big part of that, and we want to improve the forecasting to a more monthly type of rhythm. As we get better at that and we get more confidence on what I'll call short-term outlooks, those are things that we'll incorporate at the top of the house and then make decisions how we communicate those. So I think you'd hopefully just be patient each quarter.  We expect to get better. I mean obviously, we have more information here than we had in March 1. Sequentials will be an area we'll add next quarter. We'll start doing sequentials within '19. And so that is something that will become another element of this. So with each step, I expect to get better and better, more transparency. Obviously, we've be added the new segments. But as you can imagine, the first few quarters, we just got to get the system down of the combined company, get the rhythm to a point that we're more comfortable to continue to disclose these more and more information externally."
318049,611381002,1732456,"Linde plc, Q1 2019 Earnings Call, May 10, 2019",2019-05-10,"Earnings Calls","Linde plc","Operator","And our next question comes from the line of Jim Sheehan with SunTrust.",13,"And our next question comes from the line of Jim Sheehan with SunTrust."
318049,611381002,1732456,"Linde plc, Q1 2019 Earnings Call, May 10, 2019",2019-05-10,"Earnings Calls","Linde plc","Analysts","How does your EPS guidance translate into an adjusted EBITDA outlook for the year? And specifically, what do you expect for D&A in 2019?",24,"How does your EPS guidance translate into an adjusted EBITDA outlook for the year? And specifically, what do you expect for D&A in 2019?"
318049,611381002,1732456,"Linde plc, Q1 2019 Earnings Call, May 10, 2019",2019-05-10,"Earnings Calls","Linde plc","Executives","James, this is Matt. So we're not giving an EBITDA outlook. So I think as you saw, if you look below the EBIT line, starting there, I mean we feel pretty good about our level of interest right now. We still have a lot of moving capital around the world wi",163,"James, this is Matt. So we're not giving an EBITDA outlook. So I think as you saw, if you look below the EBIT line, starting there, I mean we feel pretty good about our level of interest right now. We still have a lot of moving capital around the world with the proceeds with some of the things like the squeeze-out, but we'll see, but we're not giving an EBITDA outlook. I think as far as the adjusted DA, I don't expect a lot of changes in that number other than normal assets coming on and assess coming off. So if we look at CapEx, maybe $3 billion to $3.5 billion, in that zone. As projects come on stream, obviously you'll see CapEx start to step up and we always have assets coming off. So I would expect a normal depreciation kind of on an adjusted basis that you would expect but we're not, at this point, we're not giving an EBITDA outlook."
318049,611381002,1732456,"Linde plc, Q1 2019 Earnings Call, May 10, 2019",2019-05-10,"Earnings Calls","Linde plc","Analysts","And under the new segmentation, how should we think about how the cost savings are distributed between these segments?",19,"And under the new segmentation, how should we think about how the cost savings are distributed between these segments?"
318049,611381002,1732456,"Linde plc, Q1 2019 Earnings Call, May 10, 2019",2019-05-10,"Earnings Calls","Linde plc","Executives","Well, I mean it's -- this is Steve. We have -- I'll go back to what I said our last call. When you look at the $900 million of cost synergies, we said about 1/3 of that is from organizational decentralization and corporate functions and 2/3 of that would",210,"Well, I mean it's -- this is Steve. We have -- I'll go back to what I said our last call. When you look at the $900 million of cost synergies, we said about 1/3 of that is from organizational decentralization and corporate functions and 2/3 of that would be from the regions, both from the standpoint of overlap and in terms of operational efficiencies, procurement, productivity, et cetera. And so we have those numbers broken down both by corporate and by regions, by functions. And each segment, each geography, including Linde Engineering, understands what their target is and they all, again, have developed or are developing very detailed cost and restructuring initiatives to address that. But all the regions are participating. Clearly, there's a lot of overlap in Asia, as I mentioned earlier. But we also have overlap in the Americas. South America is a great example. We have the U.S. remainco that we have to integrate in the U.S. We have some operations in Mexico we have to integrate. And in Europe where there's less integration, clearly, from -- on the continent, we do have integration in the Mideast and Russia that we're working on and that we have other initiatives around costs that we're working as well."
318049,611381002,1732456,"Linde plc, Q1 2019 Earnings Call, May 10, 2019",2019-05-10,"Earnings Calls","Linde plc","Operator","And our next question comes from the line of Neil Tyler with Redburn.",13,"And our next question comes from the line of Neil Tyler with Redburn."
318049,611381002,1732456,"Linde plc, Q1 2019 Earnings Call, May 10, 2019",2019-05-10,"Earnings Calls","Linde plc","Analysts","I'd like to go back to the comments you made on pricing and to link that with the margin development in the Americas region year-on-year, please. You mentioned that price was able to cover inflation globally. Was that also the case in every region? And th",100,"I'd like to go back to the comments you made on pricing and to link that with the margin development in the Americas region year-on-year, please. You mentioned that price was able to cover inflation globally. Was that also the case in every region? And the second part of the pricing question is really to follow up on the comments you made about specialty gases or helium in particular and whether that was a meaningful contributor to the overall 2% in any particular region or more broadly when we think about looking at the pricing numbers that you've disclosed?"
318049,611381002,1732456,"Linde plc, Q1 2019 Earnings Call, May 10, 2019",2019-05-10,"Earnings Calls","Linde plc","Executives","Well, let me -- obviously, I'll just start with the last comment. And I can't say exactly with respect to specialty gas because I haven't seen that number. But clearly helium prices are higher. Helium, I mentioned earlier, is a very tight supply around th",359,"Well, let me -- obviously, I'll just start with the last comment. And I can't say exactly with respect to specialty gas because I haven't seen that number. But clearly helium prices are higher. Helium, I mentioned earlier, is a very tight supply around the world so it is a piece of the 2%. I can't tell you exactly how many basis points, but price increases in the helium are higher, certainly higher than 2% and need to be just based on the cost inflation as a result of the shortage of helium and the fact that all sourcing contracts have moved up in terms of cost around the world. But we want to make sure -- you're asking me, did we cover inflation in every parts of the world, and the answer is no. I mean there are going to be parts of the world, certain product, markets that our pricing, just like helium, is higher than 2%. There are some areas that it's lower and we need to work on that. So generally speaking, you want to, at a minimum as the company make sure that you're covering your cost of inflation and that's a target that we have always had. There's certainly not a limitation of what the price realization could be. And in terms of driving up operating margins or let's just say variable margins, you really have 2 ways to do that. It's increasing pricing and it's driving productivity, and we work both of those levers quite hard. But it's going to be something that it's going to take some time as we -- obviously, it's something we spent a lot of time on in Praxair, have for many, many years. And it's going to take a little bit more time to get everyone accustomed to what we are trying to do, the initiatives that we're rolling out. I think cylinder gas business is something that can be addressed sooner because these are short-term contracts, then you have merchant liquid where we have various abilities to address cost pressures and also as those contracts renew and then of course, on-site is a longer-term situation."
318049,611381002,1732456,"Linde plc, Q1 2019 Earnings Call, May 10, 2019",2019-05-10,"Earnings Calls","Linde plc","Executives","And, Neil, this Matt. Just to add 2 things to Steve. I think one, just in the Americas, remember Steve had mentioned this, that we did have a bunch of stranded costs from divestco in the first quarter, so those obviously are something we have the ability",156,"And, Neil, this Matt. Just to add 2 things to Steve. I think one, just in the Americas, remember Steve had mentioned this, that we did have a bunch of stranded costs from divestco in the first quarter, so those obviously are something we have the ability and time now we're addressing in the second quarter, so that will have an effect on the margin, but that's something that we're working on. Secondly, on helium. The helium pricing will appear really across all segments because in the other we have the bulk helium or the wholesale helium. So it sells intercompany and then also sells to large global distributors from that other category. So any intercompany transfer pricing increases would show up in other and then end market price increases would show up in the segment. So the way our segments are laid out, helium price increases would be across kind of multiple segments, including Other."
318049,611381002,1732456,"Linde plc, Q1 2019 Earnings Call, May 10, 2019",2019-05-10,"Earnings Calls","Linde plc","Operator","And our last question comes from the line of P.J. Juvekar with Citi.",14,"And our last question comes from the line of P.J. Juvekar with Citi."
318049,611381002,1732456,"Linde plc, Q1 2019 Earnings Call, May 10, 2019",2019-05-10,"Earnings Calls","Linde plc","Analysts","This is Scott Goldstein on for P.J. I just wanted to ask on -- amid some of the on-site projects coming online and like Exxon in possibly 2023, is there any way that you can help us think about the future earnings contribution from these projects going fo",49,"This is Scott Goldstein on for P.J. I just wanted to ask on -- amid some of the on-site projects coming online and like Exxon in possibly 2023, is there any way that you can help us think about the future earnings contribution from these projects going forward?"
318049,611381002,1732456,"Linde plc, Q1 2019 Earnings Call, May 10, 2019",2019-05-10,"Earnings Calls","Linde plc","Executives","Well, this year, as I've stated before, based on the timing of the projects, lot of it's at the end of the year. In terms of sales and EPS contributions, kind of like 1% in 2019. 2020, as I look at the numbers in 2021 looks to be more like certainly 2% on",139,"Well, this year, as I've stated before, based on the timing of the projects, lot of it's at the end of the year. In terms of sales and EPS contributions, kind of like 1% in 2019. 2020, as I look at the numbers in 2021 looks to be more like certainly 2% on the sales, maybe 2% to 3% from an EPS contribution standpoint in '20 and '21. And I don't have 2022 in front of me, but I would expect at least a 2% and a 2% kind of relationship as well. And then as you go forward to 2023, obviously, a project like Singapore puts a big dent in those numbers. So I would expect that to be very solid when we -- when that project starts in terms of the overall contribution in sales and EPS."
318049,611381002,1732456,"Linde plc, Q1 2019 Earnings Call, May 10, 2019",2019-05-10,"Earnings Calls","Linde plc","Operator","Thank you. And that does conclude today's question-and-answer session. I would now like to turn the call back over to Mr. Juan Pelaez for any further remarks.",27,"Thank you. And that does conclude today's question-and-answer session. I would now like to turn the call back over to Mr. Juan Pelaez for any further remarks."
318049,611381002,1732456,"Linde plc, Q1 2019 Earnings Call, May 10, 2019",2019-05-10,"Earnings Calls","Linde plc","Executives","Chris, thank you again. And thank you, everyone, for participating in today's call. If you have any further questions, feel free to reach out to me directly. Thanks.",28,"Chris, thank you again. And thank you, everyone, for participating in today's call. If you have any further questions, feel free to reach out to me directly. Thanks."
318049,611381002,1732456,"Linde plc, Q1 2019 Earnings Call, May 10, 2019",2019-05-10,"Earnings Calls","Linde plc","Operator","Ladies and gentlemen, thank you for participating in today's conference. This does conclude today's program. You may all disconnect. Everyone, have a great day.",24,"Ladies and gentlemen, thank you for participating in today's conference. This does conclude today's program. You may all disconnect. Everyone, have a great day."
318049,611381002,1740833,"Linde plc, Q1 2019 Earnings Call, May 10, 2019",2019-05-10,"Earnings Calls","Linde plc","Operator","Good day, ladies and gentlemen, and welcome to the Q1 2019 Linde Earnings Conference Call. [Operator Instructions] As a reminder, this call will be recorded. I would now like to introduce your host for today's conference, Juan Pelaez. Please go ahead.",41,"Good day, ladies and gentlemen, and welcome to the Q1 2019 Linde Earnings Conference Call. [Operator Instructions] As a reminder, this call will be recorded. I would now like to introduce your host for today's conference, Juan Pelaez. Please go ahead."
318049,611381002,1740833,"Linde plc, Q1 2019 Earnings Call, May 10, 2019",2019-05-10,"Earnings Calls","Linde plc","Executives","Thanks, Chris. Good morning, everyone, and thank you for attending our first quarter earnings call and webcast. This is Juan Pelaez, Head of Investor Relations, and I am joined this morning by Steve Angel, Chief Executive Officer; and Matt White, Chief Fi",129,"Thanks, Chris. Good morning, everyone, and thank you for attending our first quarter earnings call and webcast. This is Juan Pelaez, Head of Investor Relations, and I am joined this morning by Steve Angel, Chief Executive Officer; and Matt White, Chief Financial Officer.
Today's presentation materials are available on our website at linde.com in the Investors section.
Please read the forward-looking statement disclosure on Page 2 of the slides and note that it applies to all statements made during this teleconference. The reconciliations of the adjusted pro forma numbers are in the appendix of this presentation.
Steve and Matt will now review Linde's first quarter results and provide a full year outlook. We will then be available to answer questions. Let me now turn the call over to Steve."
318049,611381002,1740833,"Linde plc, Q1 2019 Earnings Call, May 10, 2019",2019-05-10,"Earnings Calls","Linde plc","Executives","Thanks, Juan. Just a few comments before I turn it over to Matt. Our hold separate order was lifted on March 1, so the first quarter contains only 1 month of combined operations. Good start to the year, 12% EPS growth, some positive leverage from sales an",452,"Thanks, Juan. Just a few comments before I turn it over to Matt. Our hold separate order was lifted on March 1, so the first quarter contains only 1 month of combined operations. Good start to the year, 12% EPS growth, some positive leverage from sales and operating profit as a result pricing and cost synergies. We paid $477 million in dividends and purchased $700 million of stock net of issuances in addition to the $600 million purchased in December of last year.
The backlog remains healthy at $3.5 billion. This excludes a project that many of you have heard about, which is a project with ExxonMobil in Singapore that's value to us will be about $1.4 billion of capital investment.
Jurong Island in Singapore is ExxonMobil's largest manufacturing complex and is anchored by a 600,000-barrel per day refinery. They are investing $5 billion in their largest downstream project, which goes by the acronym of CRISP. We are building 4 gasifiers to tie into 2 existing gasifiers that Linde operates today. We will be taking pitch from ExxonMobil and returning hydrogen, oxo gas and nitrogen to ExxonMobil as well as hydrogen and carbon monoxide to multiple customers via by our pipeline system. You can see our project is very much integrated into ExxonMobil's new project. This project will be executed by Linde Engineering. We see a solid return anchored by a base facility fee structure, and we expect contract signing to be in the next 30 to 60 days.
Regarding key milestones. We completed the squeeze-out of our minority Linde AG shareholders on April 8. We announced the divestiture of our South Korea assets on April 30, which represents about 75% of the expected value from our required divestitures in Asia.
All our employees are excited about the merger. We see a strong pool for application technologies as we begin to appreciate each other's capabilities, a strong pool for plant capabilities and best practices in every aspect of our business. We are currently working through a very detailed cost -- or very detailed cost and restructuring initiatives. We held our first zero-based budget review for all corporate functions a few weeks ago, and I have to say that I'm pleased with the progress we're making.
Key priorities going forward: A successful integration, obviously; price management, to make sure that we're covering cost inflation all around the world; delivering on our cost, CapEx and growth synergies; and building a high-performance culture in every sense of the word.
Regarding guidance, I'll let Matt elaborate further, but we may be a bit conservative at this point. Just keep in mind, we're only 1 month into this merger. And now I'll turn it over to Matt."
