"companyid","keydevid","transcriptid","headline","mostimportantdateutc","keydeveventtypename","companyname","speakertypename","componenttextpreview","word_count","componenttext"
300753,639074841,1836850,"Rollins, Inc., Q3 2019 Earnings Call, Oct 23, 2019",2019-10-23,"Earnings Calls","Rollins, Inc.","Analysts","Just the first one on kind of the growth trends you're seeing, can you give a little more color, I guess, on the organic trends, maybe help us. If we pull out some of the seasonality across second quarter, third quarter, what kind of organic trends are yo",61,"Just the first one on kind of the growth trends you're seeing, can you give a little more color, I guess, on the organic trends, maybe help us. If we pull out some of the seasonality across second quarter, third quarter, what kind of organic trends are you seeing? Is this pace changed recently to improving? That'll be very helpful."
300753,639074841,1836850,"Rollins, Inc., Q3 2019 Earnings Call, Oct 23, 2019",2019-10-23,"Earnings Calls","Rollins, Inc.","Executives","I think it will be extremely difficult to break it out exactly. We've talked about pent-up demand. Gary talked regularly about looking at a full year as far as revenue growth because there is going to be fluctuation. It's going to occur between the differ",221,"I think it will be extremely difficult to break it out exactly. We've talked about pent-up demand. Gary talked regularly about looking at a full year as far as revenue growth because there is going to be fluctuation. It's going to occur between the different quarters of course this year was tremendously different than anything that we've seen on previous years, and I think Gary probably would say the same thing in his time period. It was completely different. But there was significant pent-up demand, but I would also say that we had great market condition initiatives and our operations executed extremely well to be able to have a high retention rate from a customer perspective, which I think will help us from an organic revenue perspective as we're moving forward in time. So I think the combination of those things helped with the record that we saw this quarter, and I think they're going to help us from move forward. The technology that we put in place with claims and John talked about our routing and scheduling, it's making a better job for our technician and it's making it a better customer experience from a customer's perspective and all those things are incrementally improving that customer retention piece, which ultimately, will help us as we're continuing to grow our revenues."
300753,639074841,1836850,"Rollins, Inc., Q3 2019 Earnings Call, Oct 23, 2019",2019-10-23,"Earnings Calls","Rollins, Inc.","Analysts","Okay. And then my follow-up question, just on the margins. Just looking at the EBITDA margin, it looks like EBITDA margins, ex the pension, we're still down around 20 basis points. Can you give a little bit of color on kind of pretty strong revenue growth",69,"Okay. And then my follow-up question, just on the margins. Just looking at the EBITDA margin, it looks like EBITDA margins, ex the pension, we're still down around 20 basis points. Can you give a little bit of color on kind of pretty strong revenue growth but some of that operating leverage seems to been lost somewhere? And then how to think about operating leverage going forward from here?"
300753,639074841,1836850,"Rollins, Inc., Q3 2019 Earnings Call, Oct 23, 2019",2019-10-23,"Earnings Calls","Rollins, Inc.","Executives","I talked about that a little bit in my comments. It's the only thing we called out in the adjusted was the pension adjustment. However, we do know that we had some onetime events having to deal with the clerk integrations, such as our D&A or interest, pro",152,"I talked about that a little bit in my comments. It's the only thing we called out in the adjusted was the pension adjustment. However, we do know that we had some onetime events having to deal with the clerk integrations, such as our D&A or interest, professional expenses as well as our 401(k) increases. All of those contributed probably to a difference of a percentage point as far as the overall margin was concerned. So I think if you go through -- and if you wanted to look at it from this perspective, you go through and kind of strip those things out, I think you'll see a nice improvement year-over-year for the quarter. And we believe that as those areas subside and we lap those areas, we're going to continue to seek that margin moving and a positive direction as we have for many [indiscernible] quarters, many years before this."
300753,639074841,1836850,"Rollins, Inc., Q3 2019 Earnings Call, Oct 23, 2019",2019-10-23,"Earnings Calls","Rollins, Inc.","Operator","[Operator Instructions] At this time I'm showing no questions in the queue. I would like to turn it back over to management for closing remarks.",25,"[Operator Instructions] At this time I'm showing no questions in the queue. I would like to turn it back over to management for closing remarks."
300753,639074841,1836850,"Rollins, Inc., Q3 2019 Earnings Call, Oct 23, 2019",2019-10-23,"Earnings Calls","Rollins, Inc.","Executives","Well, Thank you all for joining us. We appreciate your interest. I hope you sense that we're optimistic about our company's opportunities going forward. We have a lot of investments that we think will start to pay off in a greater form. It's kind of hard",128,"Well, Thank you all for joining us. We appreciate your interest. I hope you sense that we're optimistic about our company's opportunities going forward. We have a lot of investments that we think will start to pay off in a greater form. It's kind of hard to put it all together and come up with a team relation of these investments and where they take us, but we see movement while all the -- positive movement with all of them. And we've got some tremendous companies and brands and we're very proud of what we've done and we're very part of the transition that these companies have gone through and have experienced. So we look forward to giving you our update with our fourth quarter call. Thanks again."
300753,639074841,1836850,"Rollins, Inc., Q3 2019 Earnings Call, Oct 23, 2019",2019-10-23,"Earnings Calls","Rollins, Inc.","Operator","Thank you, ladies and gentlemen. This concludes today's teleconference. You may now disconnect.",13,"Thank you, ladies and gentlemen. This concludes today's teleconference. You may now disconnect."
300753,639074841,1837026,"Rollins, Inc., Q3 2019 Earnings Call, Oct 23, 2019",2019-10-23,"Earnings Calls","Rollins, Inc.","Operator","Good day, and welcome to the Rollins, Inc Third Quarter 2019 Earnings Conference Call. Today's conference is being recorded. [Operator Instructions] I would now like to introduce your host for today's call, Marilynn Meek. Ms. Meek, please go ahead.",39,"Good day, and welcome to the Rollins, Inc Third Quarter 2019 Earnings Conference Call. Today's conference is being recorded. [Operator Instructions] I would now like to introduce your host for today's call, Marilynn Meek. Ms. Meek, please go ahead."
300753,639074841,1837026,"Rollins, Inc., Q3 2019 Earnings Call, Oct 23, 2019",2019-10-23,"Earnings Calls","Rollins, Inc.","Attendees","Thank you. By now, you should have all received a copy of the press release. However, if anyone is missing a copy and would like to receive one, please contact our office at (212) 827-3746, and we will send you a release and make sure you are on the compa",163,"Thank you. By now, you should have all received a copy of the press release. However, if anyone is missing a copy and would like to receive one, please contact our office at (212) 827-3746, and we will send you a release and make sure you are on the company's distribution list. There will be a replay of the call, which will begin 1 hour after the call and run for 1 week. The replay can be accessed by dialing 1 (888) 203-1112, with the passcode 295-0556. 
Additionally, the call is being webcast at www.viavid.com, and a replay will be available for 90 days. On the line with me today and presenting are Gary Rollins, Rollins' Vice Chairman and Chief Executive Officer; John Wilson, Rollins' President and Chief Operating Officer; and Eddie Northen, Senior Vice President, Chief Financial Officer and Treasurer. 
Management will make some opening remarks, and then we'll open up the line for your questions. Gary, would you like to begin?"
300753,639074841,1837026,"Rollins, Inc., Q3 2019 Earnings Call, Oct 23, 2019",2019-10-23,"Earnings Calls","Rollins, Inc.","Executives","Yes, Marilynn. Thank you, and good morning. We appreciate all of you joining us for our third quarter 2019 conference call. Eddie will read our forward-looking statement and disclaimer, and then we'll begin.",33,"Yes, Marilynn. Thank you, and good morning. We appreciate all of you joining us for our third quarter 2019 conference call. Eddie will read our forward-looking statement and disclaimer, and then we'll begin."
300753,639074841,1837026,"Rollins, Inc., Q3 2019 Earnings Call, Oct 23, 2019",2019-10-23,"Earnings Calls","Rollins, Inc.","Executives","Our earnings release discusses our business outlook and contains certain forward-looking statements. These particular forward-looking statements and all other statements that have been made on this call, excluding historical facts, are subject to a number",92,"Our earnings release discusses our business outlook and contains certain forward-looking statements. These particular forward-looking statements and all other statements that have been made on this call, excluding historical facts, are subject to a number of risks and uncertainties, and actual risks may differ materially from any statement we make today. 
Please refer to today's press release and our SEC filings, including the Risk Factors section of our Form 10-K for the year ended December 31, 2018, for more information and the Risk Factors that could cause actual results to differ."
300753,639074841,1837026,"Rollins, Inc., Q3 2019 Earnings Call, Oct 23, 2019",2019-10-23,"Earnings Calls","Rollins, Inc.","Executives","Thank you, Eddie. Well, first and foremost, we're pleased with our third quarter execution and results across all of our business service lines. The warm weather finally appeared thankfully, although, later than normal. As a result, we experienced a stron",444,"Thank you, Eddie. Well, first and foremost, we're pleased with our third quarter execution and results across all of our business service lines. The warm weather finally appeared thankfully, although, later than normal. As a result, we experienced a strong delayed demand for our pest control services. Following a less than satisfactory second quarter, we work diligently to ensure that we rightsized our headcount and reduced expenses that weren't essential for the quarter. 
We're proud that our team responded effectively. It's also noteworthy that many of our investments and programs continue to generate improved levels of employee retention. 
This is an important step to improving 
[Audio Gap] 
completed the transition of our fully funded U.S. pension plan to an insurance company. This will provide our company with several accomplishments. We will be eliminating the annual pension contribution, insurance fees, administrative cost, pension management and other related cost of the plan. There will be ongoing cash savings. Our employees, since freezing of the plan in 2006, have enjoyed significant enhancements to their benefits, most recently to their 401(k) plan. Eddie will provide more detail on the pension discontinuation in his remarks. 
Record revenues for the quarter rose 14.1% to $556.5 million compared to revenues of $487.7 million in the third quarter of last year. Diluted net income of $44.1 million or $0.13 per share was impacted by the noncash pension settlement cost that compares to $66.6 million or $0.20 in 2018. 
Revenues for the first 9 months rose 9.6% to $1.5 billion compared to $1.377 billion for the same period last year. Net income was approximately $152.6 million or $0.47 per diluted share compared to $180.7 million with earnings per diluted share of $0.56 for the first 9 months of last year. 
Eddie will review the non-GAAP results shortly as they're very meaningful. We experienced strong growth in all of our business lines in the quarter, with residential up 17.6%, commercial pest control rose 9.2% and termite and ancillary services grew 15.4%. We believe our third quarter results reflect both the resiliency of our company and our team's ability to respond to operational challenges. 
Before turning the call over to John, just a quick update on Clark. John and I -- visit began with the team in California this quarter, and the more time we spent with Clark and their employees, the more excited we are about having them as a member to our family of brands. We're making great strides with our integration as they are now live on our fleet system, fully transitioned into our 401(k) program and improving their telecom systems. Now I'd like to turn the call over to John. John?"
300753,639074841,1837026,"Rollins, Inc., Q3 2019 Earnings Call, Oct 23, 2019",2019-10-23,"Earnings Calls","Rollins, Inc.","Executives","Thank you, Gary. With the warmer weather experienced during the third quarter, mosquitoes, among other pests, were much more active. Even as the population is becoming more aware of the health threats of mosquitoes, there is still much to be done in this",641,"Thank you, Gary. With the warmer weather experienced during the third quarter, mosquitoes, among other pests, were much more active. Even as the population is becoming more aware of the health threats of mosquitoes, there is still much to be done in this area. Eastern Equine Encephalitis, West Nile, Zika and other diseases caused by mosquito bites are becoming a greater health threat. We continue to work with various agencies and organizations in an effort to educate the public about these mosquito risks. In order to meet this public threat, we have worked persistently over the years to add mosquito services in all branch locations. This year, we have grown that service line by more than 30%, and this has helped greatly to propel us to our 6.4% overall organic growth rate for the quarter. 
Additionally, we know that coupling these and other service offerings together for our customers clearly lengthens our relationship with that customer, increasing the revenue received. 
Now I'd like to share with you some exciting news regarding one of our brands. Northwest Exterminating, last week at the National Pest Management Association meetings, Northwest received the National Pest Management Association Gives Award. The NPMA Gives Award recognizes member companies that have demonstrated leadership through dedication and contribution to their community. 
Rollins has increasingly encouraged our brands to give back to their communities and Northwest has certainly led the way in this effort. We are proud of this recognition and want to congratulate our team at Northwest. In 2006, Northwest introduced their Green Pest Control program, which is a rather unique service offering, targeting common household pests, ants, spiders, roaches, mice, centipedes, millipedes and more, using only high-quality nontoxic products derived from botanicals, such as flowers, plants and natural elements from the earth, as well as an IPM or integrated pest management approach, utilizing exclusion techniques to keep pests out in the first place.  
Overtime, this program has expanded to include a Green Elite offering as well as other Green services, such as termite, mosquito and lawn care. Northwest Green programs are continuing to grow with an increasing desire among homeowners for nonchemical treatment in pest control. Overall, these programs are greatly contributing to Northwest's impressive growth rate as this brand has produced the highest growth of any Rollins' brands during the quarter. 
Gary previously noted our strong employer retention, and I'm pleased to be able to say that we have continued our improvement in that important metric through the third quarter of this year. We talk about retention a lot in our businesses as we can't stress enough that for a service provider, the importance to ensuring our employees remain happy and motivated in their jobs is paramount. 
A happy employee translates to a happy customer. 
We have largely focused our field team efforts in 3 ways to gain this improvement. First, we conduct exit surveys to focus on why people leave as well as concerted employee engagement assessment efforts to ensure our teams feels they have a voice in making things [indiscernible] and last is the effort to improve the onboarding and orientation experience our people undergo. We know if we can just get them past the first year or so, the likelihood to stay goes up exponentially. Our team members are the face of our brands, and we will continue to invest in training programs, technology and provide opportunities for advancement to ensure they remain with us. Finally, for me, just a quick update on routing and scheduling. For the third quarter, we again, had improvements in driving and route efficiency as we clock 571,000 less miles driven. This improved efficiency comes on the heels of a 1.4 million mile reduction in Q3 last year, and we have now had 19 consecutive months of milage reductions. Now let me turn the call look over to Eddie."
