"companyid","keydevid","transcriptid","headline","mostimportantdateutc","keydeveventtypename","companyname","speakertypename","componenttextpreview","word_count","componenttext"
300753,626751588,1777272,"Rollins, Inc., Q2 2019 Earnings Call, Jul 24, 2019",2019-07-24,"Earnings Calls","Rollins, Inc.","Executives","So we're not real sure just yet. We do -- there's obviously if you take away the second generation the genocides the opportunity for the road of populations to grow pretty dramatically as they are. And so that create opportunity. that's -- it's unfortunat",74,"So we're not real sure just yet. We do -- there's obviously if you take away the second generation the genocides the opportunity for the road of populations to grow pretty dramatically as they are. And so that create opportunity. that's -- it's unfortunate and were as an industry wrestling with that as we speak pride I think there can be opportunity there just may not be good for the residents of California."
300753,626751588,1777272,"Rollins, Inc., Q2 2019 Earnings Call, Jul 24, 2019",2019-07-24,"Earnings Calls","Rollins, Inc.","Executives","I think you can stand how much the pressure of the public is going to put on these regulators because [indiscernible] are pretty onerous, and just how appearance of nothing else. So it's going to be interested to see. Because I think this is the first leg",110,"I think you can stand how much the pressure of the public is going to put on these regulators because [indiscernible] are pretty onerous, and just how appearance of nothing else. So it's going to be interested to see. Because I think this is the first legitimate should add that you have between the environmentalist think they did the right thing but apparently they're all indications this is just really backfiring on them. I mean this is unintended consequences and we certainly have more royalties and we had I mean if there are ponds the population but it's going to be really interesting to see how this thing shapes are."
300753,626751588,1777272,"Rollins, Inc., Q2 2019 Earnings Call, Jul 24, 2019",2019-07-24,"Earnings Calls","Rollins, Inc.","Executives","Jamie, one thing to they haven't taking these products away from you to use to processing plants so they're still going to be out there and for their over that while you can buy them off the shelf in a grocery store in California you can order them on the",94,"Jamie, one thing to they haven't taking these products away from you to use to processing plants so they're still going to be out there and for their over that while you can buy them off the shelf in a grocery store in California you can order them on the Internet. And depending on the number that you look at, we may be take care of 20%, 25% of the population. And the rest is unwarranted, and they're going to various Internet sources and buying those same products and they'll still be using them."
300753,626751588,1777272,"Rollins, Inc., Q2 2019 Earnings Call, Jul 24, 2019",2019-07-24,"Earnings Calls","Rollins, Inc.","Analysts","And probably using them less responsibly than you'd be using them.",12,"And probably using them less responsibly than you'd be using them."
300753,626751588,1777272,"Rollins, Inc., Q2 2019 Earnings Call, Jul 24, 2019",2019-07-24,"Earnings Calls","Rollins, Inc.","Executives","Exactly, right and that's been our big issue with the regulation so.",12,"Exactly, right and that's been our big issue with the regulation so."
300753,626751588,1777272,"Rollins, Inc., Q2 2019 Earnings Call, Jul 24, 2019",2019-07-24,"Earnings Calls","Rollins, Inc.","Executives","Michael, one other clarification for you having to do with imprecision kind of similar to back to the question that Tim had having to do with depreciation, and I misstated. So the amortization for the quarter was about $2.2 million but we only had 2 month",90,"Michael, one other clarification for you having to do with imprecision kind of similar to back to the question that Tim had having to do with depreciation, and I misstated. So the amortization for the quarter was about $2.2 million but we only had 2 months of Clark as part of that. So the amortization, as we move forward per month year-over-year, will be slightly higher than that. So just because -- so obviously, we'll have were 3 months to be in there but I just want to clarify that."
300753,626751588,1777272,"Rollins, Inc., Q2 2019 Earnings Call, Jul 24, 2019",2019-07-24,"Earnings Calls","Rollins, Inc.","Operator","And there appears there are no further questions at this time. I'd like to turn the conference over to management for any additional or closing remarks.",26,"And there appears there are no further questions at this time. I'd like to turn the conference over to management for any additional or closing remarks."
300753,626751588,1777272,"Rollins, Inc., Q2 2019 Earnings Call, Jul 24, 2019",2019-07-24,"Earnings Calls","Rollins, Inc.","Executives","Well, thank you for joining us today. We appreciate your interest in our company, and we look forward to updating you on our progress in these numerous new programs and initiatives that we're taking and also the fact that the season this quartercertainly",58,"Well, thank you for joining us today. We appreciate your interest in our company, and we look forward to updating you on our progress in these numerous new programs and initiatives that we're taking and also the fact that the season this quartercertainly setting strong. We would hope that that would continue to throughout the quarter. Thank you."
300753,626751588,1777272,"Rollins, Inc., Q2 2019 Earnings Call, Jul 24, 2019",2019-07-24,"Earnings Calls","Rollins, Inc.","Operator","And once again that does conclude today's conference. And we thank you all for the participation. You may now disconnect.",21,"And once again that does conclude today's conference. And we thank you all for the participation. You may now disconnect."
300753,626751588,1777645,"Rollins, Inc., Q2 2019 Earnings Call, Jul 24, 2019",2019-07-24,"Earnings Calls","Rollins, Inc.","Operator","Good day and welcome to the Rollins, Inc. second Quarter 2019 Earnings Conference Call. Today's conference is being recorded. [Operator Instructions] I would now like introduce your host for today's call, Marilynn Meek. Ms. Meek, you may begin.",38,"Good day and welcome to the Rollins, Inc. second Quarter 2019 Earnings Conference Call. Today's conference is being recorded. [Operator Instructions] I would now like introduce your host for today's call, Marilynn Meek. Ms. Meek, you may begin."
300753,626751588,1777645,"Rollins, Inc., Q2 2019 Earnings Call, Jul 24, 2019",2019-07-24,"Earnings Calls","Rollins, Inc.","Attendees","Thank you. By now, you should have all received a copy of the press release. However, if anyone is missing a copy and would like to receive one, please contact our office at (212) 827-3746, and we will send you a release and make sure you are on the compa",162,"Thank you. By now, you should have all received a copy of the press release. However, if anyone is missing a copy and would like to receive one, please contact our office at (212) 827-3746, and we will send you a release and make sure you are on the company's distribution list. There will be a replay of the call, which will begin 1 hour after the call and run for 1 week. The replay can be accessed by dialing 1 (888) 203-1112, with the passcode 9599376. 
Additionally, the call is being webcast at www.viavid.com, and a replay will be available for 90 days. On the line with me today and presenting are Gary Rollins, Rollins' Vice Chairman and Chief Executive Officer; John Wilson, Rollins' President and Chief Operating Officer; and Eddie Northen, Senior Vice President, Chief Financial Officer and Treasurer. Management will make some opening remarks, and then we'll open the line for your questions. Gary, would you like to begin?"
300753,626751588,1777645,"Rollins, Inc., Q2 2019 Earnings Call, Jul 24, 2019",2019-07-24,"Earnings Calls","Rollins, Inc.","Executives","Yes, Marilynn. Thank you and good morning. We appreciate all of you joining us for our second quarter 2019 conference call. Eddie will read our forward-looking statement and disclaimer and then, we'll begin.",33,"Yes, Marilynn. Thank you and good morning. We appreciate all of you joining us for our second quarter 2019 conference call. Eddie will read our forward-looking statement and disclaimer and then, we'll begin."
300753,626751588,1777645,"Rollins, Inc., Q2 2019 Earnings Call, Jul 24, 2019",2019-07-24,"Earnings Calls","Rollins, Inc.","Executives","Our earnings release discusses our business outlook and contains certain forward-looking statements. These particular forward-looking statements and all other statements that have been made on the call, excluding historical facts, are subject to a number",92,"Our earnings release discusses our business outlook and contains certain forward-looking statements. These particular forward-looking statements and all other statements that have been made on the call, excluding historical facts, are subject to a number of risks and uncertainties, and actual risks may differ materially from any statement we make today. 
Please refer to today's press release and our SEC filings, including the Risk Factors section of our Form 10-K for the year ended December 31, 2018, for more information and the risk factors that could cause actual results to differ."
300753,626751588,1777645,"Rollins, Inc., Q2 2019 Earnings Call, Jul 24, 2019",2019-07-24,"Earnings Calls","Rollins, Inc.","Executives","Thank you, Eddie. As you would expect, we're disappointed with our performance for the quarter. We, like most other pest control companies, have both strong and weaker growth periods with some seasonal timing uncertainty. Unfortunately, our situation is n",710,"Thank you, Eddie. As you would expect, we're disappointed with our performance for the quarter. We, like most other pest control companies, have both strong and weaker growth periods with some seasonal timing uncertainty. Unfortunately, our situation is not like retail where everyone knows when the Christmas comes. Historically, we had handled these weaker periods by adjusting our cost, or headcount after the season to the more appropriate level. 
This year was unique because of the fact that the season was very late. Thankfully, July looks strong, so we have a makeup opportunity. The second quarter revenues rose 9.1% to $524.2 million compared to revenues of $480.5 million in the second quarter of last year. 
Net income declined 3.3% to $63.4 million or $0.20 per diluted share compared to $65 million or $0.20 per diluted share for the same period last year. 
When adjusted for the onetime Clark acquisition expense and foreign currency exchange, it would be $0.21 per share. Eddie will provide greater detail on this and other financial results in a few minutes. 
Revenues for the first 6 months rose 7.2% to $953.2 million compared to $889.2 million for the same period last year. Net income decreased 5.6% to approximately $107.7 million or $0.33 per diluted share compared to $114.1 million with earnings per diluted share of $0.35 for the first 6 months of last year. 
We have a number of initiatives that will enhance Rollins' future growth and margin improvement. I'd like to talk more specifically about these business improvements and how they will impact Rollins. As we approach becoming a multibillion-dollar company, the timing is right to make strategic investments that will prepare us for the future. Some of these business investments and innovations are: if you recall, we improved our 401(k) and broadened stock grants at 2018 year-end. We estimate that there's an additional expense of $6 million for 2019 but we believe that there is not a better use of our resources. As a people business, our ability to recruit and retain excellent employees is paramount. 
This investment has helped generate a strong improvement in employee retention for our first 2 quarters. 
Next, we've increased and expanded our investment in customer routing and scheduling. This technology directly benefits our employees and customers. We now guide our technician to the customer's address with a service day that's planned from start to finish. The technicians have better organized days and our customers receive better communication and appointment reliability. 
A most recent technical innovation in this area is the adoption of Glympse, a software that enables us to communicate with the customer via text or e-mail as to their upcoming service date and time of service. Our customers now even have the ability to see where the technician is when en route to their account. As a result of these tools, we have created a better relationship with our customers and a better job for our technicians. 
The customer is better served and has the capability to change their service date and time as their circumstances dictate. This investment has also contributed to our employees and customers' retention improvements and reduction of miles driven. 
As you recall from our earlier calls that we are transitioning our pension to an insurance provider. When complete, this will create a significant administrative expense saving. Eddie will discuss this in more details about this initiative in a few minutes. 
As I mentioned, we've made and are making these improvements and innovations to better prepare for the company's future and to help mitigate some of the challenges we experience due to the seasonality of our business. Expanding our recurring revenue accomplishes this. As you would expect there's been a significant amount of expenditures and effort that are associated with these initiatives that have and will have a positive effect on the company. 
I would add that our company's track record has shown that we don't have a spend-yourself-rich culture at Rollins and we expect a favorable return on our new and improved programs. With the Clark acquisition complete, we will continue to evaluate other acquisition prospects as adding great companies and brands will remain one of our primary objectives. 
John will now update you on the Clark acquisition and our other plans."
300753,626751588,1777645,"Rollins, Inc., Q2 2019 Earnings Call, Jul 24, 2019",2019-07-24,"Earnings Calls","Rollins, Inc.","Executives","Thank you, Gary. We believe our track record with our acquired companies speaks to the success. We've had an integrating and growing acquisitions made over the past 19 years, all of which have contributed in many ways to our profitable growth. Historicall",554,"Thank you, Gary. We believe our track record with our acquired companies speaks to the success. We've had an integrating and growing acquisitions made over the past 19 years, all of which have contributed in many ways to our profitable growth. Historically, the larger acquisitions require a bit longer to integrate, as you might expect, and that will apply to Clark as well. 
Once fully incorporated though, the long-term benefits of these acquisitions provide excellent top and bottom line growth expansion of our company and the ability to provide customers with additional pest-control-related services. These acquired companies benefit from our internet of experience, greater purchasing power and transportable technology. Clark is on track with our business plan and we expect them to be a highly successful addition to our family of brands. 
Gary and I are heading out there next week where we will meet with their team and check in on their progress. We are excited about Clark as the majority of their branch branches are in northern California and their addition dramatically strengthens our company's presence in this area. 
As you may recall, we ended 2018 with the best employee retention we've experienced in our recent history, and the first 2 quarters of 2019 continued on that trajectory. 
Further, as you would expect, employee retention directly correlates with customer retention. Improving and enhancing the benefit package for our team members obviously helps retain our people. However, investments in technology and process helps greatly here too as we have slightly -- I'm sorry, as we have simply improved team member job satisfaction with these various tools. A service technician's relationship with their customers is extremely important to ensuring customer loyalty and expanding our customer base. As Gary has shared, our customer routing and scheduling capabilities are a large contributor to improvement in this area as it enables technicians to expand their service time. This enables them to better fulfill their customers' needs and in some cases add, additional customers to their route. For our field personnel, this technology provides additional benefits in the form of reducing the amount of time spent behind the wheel. 
For the second quarter, we again had nice improvements in driving efficiency as measured by miles per stop. Average miles driven per stop in our Orkin fleet were down 4% year-over-year, and we have had 17 consecutive months of miles per stop reductions. 
One last item related to technology. We gained full implementation of our human resource information system during the first half of the year. And this system, when fully utilized, solves a number of pain points for our field employees. We expect to see continued benefits through 2019 and beyond from these various technology initiatives mentioned. 
On another note, this time of year, we get a lot of questions about how our mosquito business is doing. Although, a relatively small part of our overall business at this point, this service line continues to grow and is in part, driven by increased concern and public awareness around disease-borne issues, including Zika, West Nile and other diseases. Year-over-year, our mosquito service has grown over 35% and we expect continued growth in the future as we gain greater cross-sell penetration of our large pest control customer base. Now let me turn the call over to Eddie to discuss our financials."
