"companyid","keydevid","transcriptid","headline","mostimportantdateutc","keydeveventtypename","companyname","speakertypename","componenttextpreview","word_count","componenttext"
300753,608730176,1703582,"Rollins, Inc., Q1 2019 Earnings Call, Apr 24, 2019",2019-04-24,"Earnings Calls","Rollins, Inc.","Executives","Yes. So we do want just 1 follow-up but we will have the term loan tied to LIBOR and then the credit line will be slightly higher than that. But once we finish and close, we give you some more details on that.",43,"Yes. So we do want just 1 follow-up but we will have the term loan tied to LIBOR and then the credit line will be slightly higher than that. But once we finish and close, we give you some more details on that."
300753,608730176,1703582,"Rollins, Inc., Q1 2019 Earnings Call, Apr 24, 2019",2019-04-24,"Earnings Calls","Rollins, Inc.","Analysts","LIBOR plus what?",3,"LIBOR plus what?"
300753,608730176,1703582,"Rollins, Inc., Q1 2019 Earnings Call, Apr 24, 2019",2019-04-24,"Earnings Calls","Rollins, Inc.","Executives","What? We'll give you more when we close.",8,"What? We'll give you more when we close."
300753,608730176,1703582,"Rollins, Inc., Q1 2019 Earnings Call, Apr 24, 2019",2019-04-24,"Earnings Calls","Rollins, Inc.","Operator","We'll take our next question from Tim Mulrooney with William Blair.",12,"We'll take our next question from Tim Mulrooney with William Blair."
300753,608730176,1703582,"Rollins, Inc., Q1 2019 Earnings Call, Apr 24, 2019",2019-04-24,"Earnings Calls","Rollins, Inc.","Analysts","Yes, so Sean and Mike, each asked the question, I'm just going to try one more time. How much did weather impact your top line results in the first quarter?",30,"Yes, so Sean and Mike, each asked the question, I'm just going to try one more time. How much did weather impact your top line results in the first quarter?"
300753,608730176,1703582,"Rollins, Inc., Q1 2019 Earnings Call, Apr 24, 2019",2019-04-24,"Earnings Calls","Rollins, Inc.","Executives","While we don't like to say the word weather and Gary kind of opened with that, so it's the reality. As good as we are at being involved with that and as far as the different quarters are concerned, mother nature still does it's thing. And in this case,",216,"While we don't like to say the word weather and Gary kind of opened with that, so it's the reality. As good as we are at being involved with that and as far as the different quarters are concerned, mother nature still does it's thing. 
And in this case, it's by far the coldest that we've seen in several years. We staffed as appropriate for a relative normal year. And in like an example that I give. Pasadena snowing, Las Vegas is snowing. There was more rain in Los Angeles than in Southern California that there was in Seattle during the first quarter. So it's just a anomalies that just occurred that we're not accustomed to. When it rains every day in Southern California, we can't do termite work. We can do a lot of pest work that we can't do in those types of situations. And then when it's snowing in places or polar vortex cold in Chicago was minus 20, we're not digging trenches for treatment when it's minus 20 degrees. So we don't have a number that's going to quantify that. It's just very different than what we seen in the past several years. Gary does [indiscernible] longer than any of us, So I don't think more color on it. I'm not."
300753,608730176,1703582,"Rollins, Inc., Q1 2019 Earnings Call, Apr 24, 2019",2019-04-24,"Earnings Calls","Rollins, Inc.","Executives","[indiscernible] I mean it's painful when it's the first quarter. The good news is is if you had stumbled this is the one to do it on because of the size of the quarter. But I'd like to add one thing, we spent a lot of time developing our bonus plans for o",159,"[indiscernible] I mean it's painful when it's the first quarter. The good news is is if you had stumbled this is the one to do it on because of the size of the quarter. But I'd like to add one thing, we spent a lot of time developing our bonus plans for our managers and leaders. And our plans are settled quarterly and but they also have an annual, so our people get back in the game. I mean you can have a bad quarter but still pull it out, and that's been very helpful. So we don't have anybody depressed or suicidal. It's just a matter of bad situation, and it's very difficult to determine the impact of not being get to the customers and not having in the leaps, which is important part of our business. I mean I would really imagine that even a mathematical genius would have a hard time trying to figure that out."
300753,608730176,1703582,"Rollins, Inc., Q1 2019 Earnings Call, Apr 24, 2019",2019-04-24,"Earnings Calls","Rollins, Inc.","Analysts","Yes. That makes sense. Just my other one, Eddie, you said April was off to a good start right?",19,"Yes. That makes sense. Just my other one, Eddie, you said April was off to a good start right?"
300753,608730176,1703582,"Rollins, Inc., Q1 2019 Earnings Call, Apr 24, 2019",2019-04-24,"Earnings Calls","Rollins, Inc.","Executives","That's correct.",3,"That's correct."
300753,608730176,1703582,"Rollins, Inc., Q1 2019 Earnings Call, Apr 24, 2019",2019-04-24,"Earnings Calls","Rollins, Inc.","Analysts","So if I'm from looking at the second quarter, which I know is a critical period for you guys, could weather potentially be a tailwind this year? Am I remembering correctly that last year had a delayed spring pest season?",41,"So if I'm from looking at the second quarter, which I know is a critical period for you guys, could weather potentially be a tailwind this year? Am I remembering correctly that last year had a delayed spring pest season?"
300753,608730176,1703582,"Rollins, Inc., Q1 2019 Earnings Call, Apr 24, 2019",2019-04-24,"Earnings Calls","Rollins, Inc.","Executives","Well the -- I'll ask John to weigh in on this as well. But the thing that I would add is whenever there is extreme moisture, one that dries up, it creates a significant demand on the passenger side. And warmer weather are good for us as long as long as th",102,"Well the -- I'll ask John to weigh in on this as well. But the thing that I would add is whenever there is extreme moisture, one that dries up, it creates a significant demand on the passenger side. And warmer weather are good for us as long as long as the [indiscernible] dries up enough for pest to proliferate. So I would say that we would have opportunities, especially in those areas that have significant rain or other moisture whether it's snow in the first quarter, we'll see the benefits of that trailing, I would say, this quarter and the following."
300753,608730176,1703582,"Rollins, Inc., Q1 2019 Earnings Call, Apr 24, 2019",2019-04-24,"Earnings Calls","Rollins, Inc.","Executives","Yes. I think all of those things, Tim, I mean we're seeing pent-up demand. We had $1 million day in our call center, which handles residential pest sales for us on Monday. So we hadn't had one of those in this early in April since 2017. So funny pent-up d",70,"Yes. I think all of those things, Tim, I mean we're seeing pent-up demand. We had $1 million day in our call center, which handles residential pest sales for us on Monday. So we hadn't had one of those in this early in April since 2017. So funny pent-up demand, our teams are well prepared to handle that. I think it'll be a much better quarter for us, no doubt."
300753,608730176,1703582,"Rollins, Inc., Q1 2019 Earnings Call, Apr 24, 2019",2019-04-24,"Earnings Calls","Rollins, Inc.","Executives","The encouraging part to me, which John talked about during his part of the call. The employee retention significant improvement, which is help those with our customer retention is significant improvement. So now we go into this pent-up demand time period",85,"The encouraging part to me, which John talked about during his part of the call. The employee retention significant improvement, which is help those with our customer retention is significant improvement. So now we go into this pent-up demand time period with higher employee retention, well-trained technician, and we're to be ready to rock 'n' roll with the demand that is there. So that's the encouraging part to me is how well prepared we are for was about to happen or what's happening right now."
300753,608730176,1703582,"Rollins, Inc., Q1 2019 Earnings Call, Apr 24, 2019",2019-04-24,"Earnings Calls","Rollins, Inc.","Operator","We will take our next question from Chris McGinnis with Sidoti & Company.",12,"We will take our next question from Chris McGinnis with Sidoti & Company."
300753,608730176,1703582,"Rollins, Inc., Q1 2019 Earnings Call, Apr 24, 2019",2019-04-24,"Earnings Calls","Rollins, Inc.","Analysts","Just maybe to follow-up on that. Does that pent-up demand put stress at all on the system. Can you maybe just highlight that how better position you might be given the kind of the weaker trends in Q1?",39,"Just maybe to follow-up on that. Does that pent-up demand put stress at all on the system. Can you maybe just highlight that how better position you might be given the kind of the weaker trends in Q1?"
300753,608730176,1703582,"Rollins, Inc., Q1 2019 Earnings Call, Apr 24, 2019",2019-04-24,"Earnings Calls","Rollins, Inc.","Executives","While, from me, you don't have a situation where we're to have to hire additional new people and have then trained as this demand continues to increase. With the employee retention, again that John talked about and that we've had, we have the productivity",134,"While, from me, you don't have a situation where we're to have to hire additional new people and have then trained as this demand continues to increase. With the employee retention, again that John talked about and that we've had, we have the productivity and the efficiency already in the network that will enable us to be able to, I believe -- I strongly believe to be able to digest it easily. So it's not that the demand is increasing, and we're having to add new stuff and having to train them and get them up to speed. These people already on the payroll, they're already trained, they are ready to go. And I think we'll be more efficient than what we -- maybe would be if were still adding people during this time."
300753,608730176,1703582,"Rollins, Inc., Q1 2019 Earnings Call, Apr 24, 2019",2019-04-24,"Earnings Calls","Rollins, Inc.","Executives","I'd like to add one thing, Eddie, which is also important about the retention. Although, you do save on the search and the training, you also save as far as management time. And I think that's an important consideration because it takes a certain amount o",72,"I'd like to add one thing, Eddie, which is also important about the retention. Although, you do save on the search and the training, you also save as far as management time. And I think that's an important consideration because it takes a certain amount of management time to go through that sourcing and training and energy in training. So they'll have more time to really work on our businesses forward."
300753,608730176,1703582,"Rollins, Inc., Q1 2019 Earnings Call, Apr 24, 2019",2019-04-24,"Earnings Calls","Rollins, Inc.","Analysts","And then just a lot of acquisitions in 2018. Can you maybe just talk about how those businesses are trending versus maybe as you just want to call it out legacy business as well in the quarter?",37,"And then just a lot of acquisitions in 2018. Can you maybe just talk about how those businesses are trending versus maybe as you just want to call it out legacy business as well in the quarter?"
300753,608730176,1703582,"Rollins, Inc., Q1 2019 Earnings Call, Apr 24, 2019",2019-04-24,"Earnings Calls","Rollins, Inc.","Executives","Yes, from an acquisition perspective, once a year we have our summit to come together to go through all the acquisitions we've had for the previous years. So we track those on a monthly basis to make sure that we are seeing the benefits that we should see",187,"Yes, from an acquisition perspective, once a year we have our summit to come together to go through all the acquisitions we've had for the previous years. So we track those on a monthly basis to make sure that we are seeing the benefits that we should see. At this point in time, we're very happy. And if you look outside of just the Orkin U.S. operation, you look at our Specialty Brands and our international operations for Q1, they performed very well for us, and we don't -- we're not breaking anything, we're not going to give any specifics of anything. But they perform very well for us. And in some cases those were newer acquisitions, the OPC 1 newer acquisition, Northwest, newer acquisition. We've increased our footprint in the U.K., Singapore last year, newer acquisition that have all performed very well for us. And I think seeing those has helped the overall distribution of what we have as far as revenue and profitability. So I think overall, we're in a good spot, and I think in a great spot as far as for the future."
300753,608730176,1703582,"Rollins, Inc., Q1 2019 Earnings Call, Apr 24, 2019",2019-04-24,"Earnings Calls","Rollins, Inc.","Operator","[Operator Instructions] We'll take our next question from Jamie Clement with Buckingham Asset Management.",14,"[Operator Instructions] We'll take our next question from Jamie Clement with Buckingham Asset Management."
300753,608730176,1703582,"Rollins, Inc., Q1 2019 Earnings Call, Apr 24, 2019",2019-04-24,"Earnings Calls","Rollins, Inc.","Analysts","Can you hear me?",4,"Can you hear me?"
300753,608730176,1703582,"Rollins, Inc., Q1 2019 Earnings Call, Apr 24, 2019",2019-04-24,"Earnings Calls","Rollins, Inc.","Executives","Yes.",1,"Yes."
300753,608730176,1703582,"Rollins, Inc., Q1 2019 Earnings Call, Apr 24, 2019",2019-04-24,"Earnings Calls","Rollins, Inc.","Analysts","I want to ask you, I saw -- I don't know how long it's been on TV but I saw one of the Orkin commercials featuring like the baby nursery. I kind of thought that was a little bit different in terms of town than some of your other ad campaigns and years pas",89,"I want to ask you, I saw -- I don't know how long it's been on TV but I saw one of the Orkin commercials featuring like the baby nursery. I kind of thought that was a little bit different in terms of town than some of your other ad campaigns and years past, which were a little bit more outrageous whether it's a guy wearing a bug costume and holding a pizza box and that kind of think. Any intense behind, sort of, the change in vibe there?"
300753,608730176,1703582,"Rollins, Inc., Q1 2019 Earnings Call, Apr 24, 2019",2019-04-24,"Earnings Calls","Rollins, Inc.","Executives","Well, I think we were trying to, and I'll let John help out would this but I think the intent was pull in all of the different support that we give to our customers. And I think if you look at the many different types of ads that are out there, we talk ab",202,"Well, I think we were trying to, and I'll let John help out would this but I think the intent was pull in all of the different support that we give to our customers. And I think if you look at the many different types of ads that are out there, we talk about lots of different scenarios where our customers need our help and our support. And for me, the most favorite one is the female technician that is part of the family. And they show her in the house, they show her help them with the kids somewhere and they show her making breakfast and stuff. They just consider her to be a part of their family, an extension of their family. And I think that's more of what we're trying to get to is how supportive we are with people's lifestyle. And by creating a safe customary environment and by creating an environment on the outside of our home that are customary and mosquito free enable people to live their lives in different way. And having Orkin be a part of that I think that's really what a part of what it was that we were trying to create."
300753,608730176,1703582,"Rollins, Inc., Q1 2019 Earnings Call, Apr 24, 2019",2019-04-24,"Earnings Calls","Rollins, Inc.","Executives","Yes, Jamie I would add. So the messaging is all about -- pest control is an ongoing necessity as opposed to an emergency type of situation. To your point about the [indiscernible] bug holding the pizza box, that so that your dad but it was really about th",266,"Yes, Jamie I would add. So the messaging is all about -- pest control is an ongoing necessity as opposed to an emergency type of situation. To your point about the [indiscernible] bug holding the pizza box, that so that your dad but it was really about the messaging was about only calling us when you had any, right. Where is now the messaging is about in order to maintain a healthy and happy lifestyle, pest control is kind of a necessity as opposed to that only call when you have a need. So that's kind of the messaging and then the other piece of the new advertising is its tension getting. I mean I was in a hotel in Chicago and I had the television on, the news channel at -- and use channel and all of a sudden the television kind of went silent and after a few seconds I looked up then it was one of our ads and then it was the one with all of the adults on the back deck having a party. And they we're talking and muffle tone, which by large there wasn't much sound coming from the commercial. And they told me to look up to see what was going on and about time I looked up the ad was ending and New York showed up. And so went a lot of quarter we're trying to get great people's attention with that move. And it's -- I think it will pay off for us it's proven successful early on. We've got some really good reviews on it."
300753,608730176,1703582,"Rollins, Inc., Q1 2019 Earnings Call, Apr 24, 2019",2019-04-24,"Earnings Calls","Rollins, Inc.","Executives","I think my we do a lot of testing. And so there'll be several creative initiatives that we're stopped our discontinued and we select what we feel is going to be the best and you're watching television or the commercial, cable wherever you can just see a s",82,"I think my we do a lot of testing. And so there'll be several creative initiatives that we're stopped our discontinued and we select what we feel is going to be the best and you're watching television or the commercial, cable wherever you can just see a similar situation with major advertising. there just looking to grab the audience and deliver their message but if you can grab them, it doesn't matter what you message. So were hopeful and time will tell."
300753,608730176,1703582,"Rollins, Inc., Q1 2019 Earnings Call, Apr 24, 2019",2019-04-24,"Earnings Calls","Rollins, Inc.","Analysts","I appreciate that. Eddie, real quick your comments around the ranges growth and intangible amortization. We're you giving back to the fact that you're only talking about 8 months of 2019? Or were you meaning on like an annualized basis?",40,"I appreciate that. Eddie, real quick your comments around the ranges growth and intangible amortization. We're you giving back to the fact that you're only talking about 8 months of 2019? Or were you meaning on like an annualized basis?"
300753,608730176,1703582,"Rollins, Inc., Q1 2019 Earnings Call, Apr 24, 2019",2019-04-24,"Earnings Calls","Rollins, Inc.","Executives","So that would be the impact -- once we made the acquisition that will be the impact that will be a range of the impacts on a quarterly basis.",29,"So that would be the impact -- once we made the acquisition that will be the impact that will be a range of the impacts on a quarterly basis."
300753,608730176,1703582,"Rollins, Inc., Q1 2019 Earnings Call, Apr 24, 2019",2019-04-24,"Earnings Calls","Rollins, Inc.","Analysts","Okay, so like a year-over-year basis?",6,"Okay, so like a year-over-year basis?"
300753,608730176,1703582,"Rollins, Inc., Q1 2019 Earnings Call, Apr 24, 2019",2019-04-24,"Earnings Calls","Rollins, Inc.","Executives","Correct.",1,"Correct."
300753,608730176,1703582,"Rollins, Inc., Q1 2019 Earnings Call, Apr 24, 2019",2019-04-24,"Earnings Calls","Rollins, Inc.","Operator","Our next question will come from Michael Hoffman with Stifel.",10,"Our next question will come from Michael Hoffman with Stifel."
300753,608730176,1703582,"Rollins, Inc., Q1 2019 Earnings Call, Apr 24, 2019",2019-04-24,"Earnings Calls","Rollins, Inc.","Analysts","You gave a bunch of data, which the phone was breaking up unfortunately so I didn't know whether it was -- you gave a big growth rates I think you gave us the totals the [ 49 46 48  ] the next group was that organic the [ 45 25 and 43,  ] CENTCOM?",54,"You gave a bunch of data, which the phone was breaking up unfortunately so I didn't know whether it was -- you gave a big growth rates I think you gave us the totals the [ 49 46 48  ] the next group was that organic the [ 45 25 and 43,  ] CENTCOM?"
300753,608730176,1703582,"Rollins, Inc., Q1 2019 Earnings Call, Apr 24, 2019",2019-04-24,"Earnings Calls","Rollins, Inc.","Executives","That is correct.",3,"That is correct."
300753,608730176,1703582,"Rollins, Inc., Q1 2019 Earnings Call, Apr 24, 2019",2019-04-24,"Earnings Calls","Rollins, Inc.","Analysts","I current the phones were breaking unfortunately so inside the [ 45  ] and all those numbers, because of the weather and the disruptions especially all of that routine business and add on services plus prices versus new customer ads?",39,"I current the phones were breaking unfortunately so inside the [ 45  ] and all those numbers, because of the weather and the disruptions especially all of that routine business and add on services plus prices versus new customer ads?"
300753,608730176,1703582,"Rollins, Inc., Q1 2019 Earnings Call, Apr 24, 2019",2019-04-24,"Earnings Calls","Rollins, Inc.","Executives","While we'll have new customer and in certain parts of the country. I think the majority will come from the categories that you mentioned. But there are there certain parts of the countries that we're less impacted by the weather than others. I mean if you",92,"While we'll have new customer and in certain parts of the country. I think the majority will come from the categories that you mentioned. But there are there certain parts of the countries that we're less impacted by the weather than others. I mean if you look at the Midwest there were probably the most impacted then I would probably say California were kind of follow that. But there were other areas in the country that were less impacted and we would have new customer growth that would come from there."
300753,608730176,1703582,"Rollins, Inc., Q1 2019 Earnings Call, Apr 24, 2019",2019-04-24,"Earnings Calls","Rollins, Inc.","Analysts","And that's why you're saying that retention across all 3 businesses improved year-over-year because in each of those segments because you're probably getting the number, the organic growth number you  you had to improve the quality of the retention too ri",48,"And that's why you're saying that retention across all 3 businesses improved year-over-year because in each of those segments because you're probably getting the number, the organic growth number you  you had to improve the quality of the retention too right? Given the disruption in new leads."
300753,608730176,1703582,"Rollins, Inc., Q1 2019 Earnings Call, Apr 24, 2019",2019-04-24,"Earnings Calls","Rollins, Inc.","Executives","That's correct that's exactly right, yes, so -- so again we believe the tie between the impairment and the employee retention again that John talked about, is always a great correlation for us on customer retention, and we're seeing that now a couple of q",55,"That's correct that's exactly right, yes, so -- so again we believe the tie between the impairment and the employee retention again that John talked about, is always a great correlation for us on customer retention, and we're seeing that now a couple of quarters in a row where we're seeing pretty healthy improvement."
300753,608730176,1703582,"Rollins, Inc., Q1 2019 Earnings Call, Apr 24, 2019",2019-04-24,"Earnings Calls","Rollins, Inc.","Operator","I will now turn the call back over to our speaker.",11,"I will now turn the call back over to our speaker."
300753,608730176,1703582,"Rollins, Inc., Q1 2019 Earnings Call, Apr 24, 2019",2019-04-24,"Earnings Calls","Rollins, Inc.","Executives","Okay, thank you for joining us today. We appreciate your interest in our company, and look forward to updating you on our progress in the second quarter call. Thanks again.",30,"Okay, thank you for joining us today. We appreciate your interest in our company, and look forward to updating you on our progress in the second quarter call. Thanks again."
300753,608730176,1703582,"Rollins, Inc., Q1 2019 Earnings Call, Apr 24, 2019",2019-04-24,"Earnings Calls","Rollins, Inc.","Operator","Ladies and gentleman, thank you for joining today's conference call. The call has now concluded. Please disconnect your lines and have a great day.",24,"Ladies and gentleman, thank you for joining today's conference call. The call has now concluded. Please disconnect your lines and have a great day."
300753,608730176,1703747,"Rollins, Inc., Q1 2019 Earnings Call, Apr 24, 2019",2019-04-24,"Earnings Calls","Rollins, Inc.","Operator","Good day, and welcome to the Rollins, Inc. First Quarter 2019 Earnings Conference Call. Today's conference is being recorded. [Operator Instructions] I would now like to introduce your host for today's call, Marilynn Meek. Ms. Meek, you may begin.",39,"Good day, and welcome to the Rollins, Inc. First Quarter 2019 Earnings Conference Call. Today's conference is being recorded. 
[Operator Instructions] 
I would now like to introduce your host for today's call, Marilynn Meek. Ms. Meek, you may begin."
