"companyid","keydevid","transcriptid","headline","mostimportantdateutc","keydeveventtypename","companyname","speakertypename","componenttextpreview","word_count","componenttext"
300753,597020790,1638891,"Rollins, Inc., Q4 2018 Earnings Call, Jan 23, 2019",2019-01-23,"Earnings Calls","Rollins, Inc.","Operator","Good day, and welcome to the Rollins Inc. Fourth Quarter 2018 Earnings Conference Call. Today's conference is being recorded. [Operator Instructions] I would now like to introduce your host for today's call, Marilyn Meek. Ms. Meek, you may now begin.",40,"Good day, and welcome to the Rollins Inc. Fourth Quarter 2018 Earnings Conference Call. Today's conference is being recorded. [Operator Instructions] I would now like to introduce your host for today's call, Marilyn Meek. Ms. Meek, you may now begin."
300753,597020790,1638891,"Rollins, Inc., Q4 2018 Earnings Call, Jan 23, 2019",2019-01-23,"Earnings Calls","Rollins, Inc.","Executives","Thank you. By now, you should have all received a copy of the press release. However, if anyone is missing a copy and would like to receive one, please contact our office at (212) 827-3746, and we will send you a release and make sure you are on the compa",160,"Thank you. By now, you should have all received a copy of the press release. However, if anyone is missing a copy and would like to receive one, please contact our office at (212) 827-3746, and we will send you a release and make sure you are on the company's distribution list.
There will be a replay of the call, which will begin 1 hour after the call and run for 1-week. The replay can be accessed by dialing 1 (888) 203-1112, with the passcode 793-9620. Additionally, the call is being webcast at www.viavid.com, and a replay will be available for 90 days.
On the line with me today and presenting are Gary Rollins, Vice Chairman and Chief Executive Officer; John Wilson, Rollins' President and Chief Operating Officer; and Eddie northern, Senior Vice President, Chief Financial Officer and Treasurer. Management will make some opening remarks, and then we'll open the line for your questions.
Gary, would you like to begin?"
300753,597020790,1638891,"Rollins, Inc., Q4 2018 Earnings Call, Jan 23, 2019",2019-01-23,"Earnings Calls","Rollins, Inc.","Executives","Yes, Marilyn. Thank you, and good morning. We appreciate all of you joining us for our fourth quarter and year-end 2019 conference call. Eddie will read our forward-looking statements and disclaimer, and then we'll begin.Our conference call discusses ou",159,"Yes, Marilyn. Thank you, and good morning. We appreciate all of you joining us for our fourth quarter and year-end 2019 conference call. Eddie will read our forward-looking statements and disclaimer, and then we'll begin.
Our conference call discusses our business outlook and contains certain forward-looking statements. These particular forward-looking statements and all other statements that have been made on this call excluding historical facts are subject to a number of risks and uncertainties, and actual risks may differ materially from any statement we make today. This conference call also includes certain non-GAAP financial measures or performance. These non-GAAP measures should be used as a supplement and not a substitute for net income, loss, computed in accordance with GAAP. 
Please refer to today's press release and our SEC filings, including the Risk Factors section of our Form 10-K for the year ended December 31, 2017, for more information and the risk factors that could cause actual results to differ."
300753,597020790,1638891,"Rollins, Inc., Q4 2018 Earnings Call, Jan 23, 2019",2019-01-23,"Earnings Calls","Rollins, Inc.","Executives","Thank you, Eddie. We're pleased to report our 51st consecutive quarter of improved revenue and earnings. Revenues for the quarter grew 7.2% to $444.6 million compared to $414.7 million for the fourth quarter last year. Net income increased 51.1% to $51 mi",464,"Thank you, Eddie. We're pleased to report our 51st consecutive quarter of improved revenue and earnings. Revenues for the quarter grew 7.2% to $444.6 million compared to $414.7 million for the fourth quarter last year. Net income increased 51.1% to $51 million or $0.16 per diluted share compared to $33.7 million or $0.10 per diluted share for the same quarter of 2017.
Revenues for the full year rose 8.8% to $1.822 billion compared to $1.674 billion for the same period last year. Net income increased 29.3% to approximately $231.7 million, with earnings per diluted share of $0.71 compared to net income of $179.1 million or $0.55 per diluted share for the full year 2017.
We experienced good growth in all of our service lines for the quarter, with residential up 7.8%, Commercial Pest Control rose 5.9% and termite and ancillary rose 8.2%. 2018 was a good year for Rollins, as we continue to build our global presence through acquisitions both domestically and overseas. 
In the U.K., we expanded our footprint with the acquisition of 3 prime companies: Guardian Pest Control, Ames group and Kestrel pest control. We also achieved an important milestone for the company when we acquired Aardwolf Pestkare. This is Rollins first company owned operation in Singapore.
In the U.S., we acquired OPC pest control, a premier pest control company in Kentucky, and we also made a small tuck-in acquisitions. And the year-end we had added a total of 38 companies to our roster. We also continue to expand the Orkin brand internationally with the addition of franchises of South America, Europe and Middle East, Latin America and other locations. The Orkin brand is now represented in 57 countries throughout 86 international franchises.
As we enter 2019, strategic acquisition will remain a focus of our growth strategy. We're extremely pleased to have announced earlier this month our agreement to Clark Pest Control. Headquartered in Lodi California, Clark Pest operations in over 20 locations in California and Nevada. Founded by Charlie Clark in 1950, the company is going to be the eighth largest pest control provider in the U.S. Clark recorded revenues of $130 million in 2017. The company is also growing at a faster rate than we are as well as a faster rate than the overall pest control industry.
First adjusted with the company over 20 years ago when I was fortunate enough to meet Charlie Clark, an icon in our industry. We have admired the company throughout all this time. The Clark acquisition will be the largest in our company's history. John will provide more details in this acquisition. But I wanted to express our enthusiasm in acquiring this prime company and personally welcome their team to the Rollins family.
I'd now like to turn the call over to John."
300753,597020790,1638891,"Rollins, Inc., Q4 2018 Earnings Call, Jan 23, 2019",2019-01-23,"Earnings Calls","Rollins, Inc.","Executives","Thank you, Gary. As Gary noted, we are very pleased to have Clark Pest Control join our family. The Clark team is a natural fit for Rollins, sharing the same values that we did get more on that later.They service customers through more than 20 branch lo",616,"Thank you, Gary. As Gary noted, we are very pleased to have Clark Pest Control join our family. The Clark team is a natural fit for Rollins, sharing the same values that we did get more on that later.
They service customers through more than 20 branch location in Noth and Southern California and Nevada. Clark Pest Control is stronger in the upper central Valley in northern California areas than Orkin and our other brands. It was very interesting to learn during our due diligence process, how closely linked Clark and our business brands Orkin are in their history. As you may know, Orkin was founded by auto Orkin in 1901, but didn't expand to the West Coast prior to the Mormons purchased in 1964. Meanwhile, Charlie Clark found Clark Pest Control in California in 1950 and Patton got some of the foundational principles of quality customer service, delivered by well-trained people just as Auto Orkin did. Both companies have certainly retained those principles of quality service delivered by well-trained team members today. Clark has long been recognized as a premier pest control company in residential, commercial and termite services in the markets it serves. Their strong culture of customer service has been aided by very high employee retention rates and has resulted in a loyal and expanding customer base.
We are aware that owners have a choice when they look to sell their business, and there are 4 very important factors that come into play. What is best for their family, their employees and their customers as well as receiving value for the company. We take each of those into account and customize our acquisition plan to fit those factors. What was apparent in our discussions with Clark from the beginning is how deeply they care about what would happen to their employees and customers are following the sale.
They, like us to recognize how important that people are to their success and also, like us, are dedicated to continually improving both the employee and the customer experience. 
Over time, we have distinguished ourselves with our acquisitions where our key management and employees remain on after work. And it is 1 reason why Rollins has gained a reputation of being the industry's acquirer of choice.
Sellers know that they can trust us to live up our words once we closed on our pressures. We even invite potential targets to reach out to the brands we have acquired as well as ones we have lost out on to see if they're happy or not. In addition to Clark Pest Control, expanding our presence in California and Nevada, we believe, the company provide significant opportunities for Rollins and Clark to learn from each other, which we had repeatedly expressed as one of our primary objectives with our acquisitions.
Potential opportunities we have encountered previously include: materials and supplies purchasing, better vehicle leasing arrangements, training, employee benefits and lower technology and communication expenses to name a few. Rollins will fund the acquisition using the combination of cash and debt. Eddie, will go into further financial details related to this acquisition in a few minutes. Clark Pest Control under the leadership of long-term Clark team member Robert Baker all joined our specialty brands group will lead by Jerry Gahlhoff. Brands in this group include HomeTeam, Western, Waltham, Northwest Exterminating and OPC services.
Jerry and I've had the privilege of visiting every Clark operation to meet with their employees and appropriately welcome them to Rollins. We wanted them to know that they are valued and how much we look forward to working with them to further advance their great brand.
I will now turn the call back over to Eddie."
300753,597020790,1638891,"Rollins, Inc., Q4 2018 Earnings Call, Jan 23, 2019",2019-01-23,"Earnings Calls","Rollins, Inc.","Executives","Thank you, John. Before I get into our quarterly and year-end numbers, I want to reiterate the positive impact of our enhanced-employee benefits. Of our people are so pleased with the investments that we made in 2018. And looking back, this was absolutely",1466,"Thank you, John. Before I get into our quarterly and year-end numbers, I want to reiterate the positive impact of our enhanced-employee benefits. Of our people are so pleased with the investments that we made in 2018. And looking back, this was absolutely the right decision and have been reinforced by the positive results that they have produced for the year. As you may recall, in April, we increased our 401(k) match and provided stock [ grants ] 12 employees which added about $10 million to our expense for the year. But this recognition of their impact on our business is rippling through our results.
Of a recent leadership meeting in Atlanta was the first that we have had -- first that we've held since rolling this announcement out last April. The comments of many of the over 100 participants were overwhelmingly positive and appreciative.
I want to share a few of the positive changes that we have seen. All employees want to work for an employer of choice. Our employee retention rate had the best year-over-year improvement in the fourth quarter in 2018 since 2016. As you know, during that same time period, the unemployment rate has fallen from 4.7% down to 3.9% in December of 2018.
Investing in our people is one of the components that has helped us in this area. We've also often talked about how important our technicians are in their relationship with our customers. Our improved employee retention has translated directly to higher customer attention in Q4 and for all of 2018. Our organic growth rate, again to historic highs as a result of a better technician and customer retention.
Enhancing our employee benefits will continue to drive improvements in employee and customer retention for years to come.
For the quarter, all of our service lines showed significant growth, and keys to the quarter included a record organic growth rates, piloting testing of the BOSS rollout in Canada. And as I just mentioned, improvements in our employee retention rate high to our enhanced employee benefits.
Looking at the numbers, the fourth quarter revenues of $444.6 million with an increase of 7.2% over the prior year's fourth quarter revenues of $414.7 million. Income before income taxes increased 4.3% to $71.5 million from $68.5 million in 2017. Expense and depreciation increased during the quarter as we continue to rollout and began testing BOSS in Canada. Net income rose 51.1% to $51 million and EPS increased 60% to $0.16 per diluted share compared to $0.10 per diluted share in the fourth quarter of 2017. EBITDA was $87.8 million, up 5.1% over Q4 of 2017. As we move forward, we will speak more to EBITDA as we continue to make sizable acquisitions that will impact our depreciation and amortization.
For the 12 months that ended December 31, we produced record revenues of $1.8 billion to $2 billion, which was an increase of 8.8% over the same time period last year. Income before income taxes increased 5.5% to $310.7 million and net income rose 29.3% to $231.7 million compared to 2017. EPS increased 29.1% to $0.71 per share compared to $0.55 per share in 2017. EBITDA was $377.3 million in 2018 compared to $350.8 million in 2017, up 7.5%.
Our financial health enables us to do the -- I'm sorry, enables us to continue to be nimble and improve our business. Companies that did not anticipate change and take advantage of market opportunities and seek ways to make it easier for your customers to do business with you do not drive, and in some cases, do not survive. The past 50 years have shown that Rollins has successfully managed for the long-term and the impending acquisition of Clark Pest Control is a great example of that.
John Jason, good color on the Clark impending purchase. Based on his time working on this acquisition and spending a lot of time visiting their employees. But lets shift our attention to what we know about the financial impact of the impending acquisition of Clark Pest Control. We anticipate closing sometime in Q1 of 2019, subject to obtaining regulatory clearance.
For all of you that have passed what we be willing to leverage our balance sheet, this is your deal. While we plan to use cash for a portion of the purchase, we will be taking on debt in the form of a term loan tied to LIBOR to supplement the rest. This deal makes taking on debt worthwhile for us and again, is investing in our future for decades to come.
The company is very profitable, but with the goodwill amortization, Clark will not add to EPS in year 1 but will be generating significant additional cash flow. Once we close on the deal, we will share more related to the anticipated impact of this acquisition on our total Rollins results moving forward.
Let's take a look through the Rollins revenue by service line for the fourth quarter. As discussed earlier, our total revenue increased 7.2% and included 1.6% from several acquisitions and the remaining 5.6% was from pricing and organic growth. In total, residential pest control, which made up 42% of our revenue, was up 7.8%. Commercial pest control, which made up 39% of our revenue, was up 5.9%. And termite and ancillary services, which made up approximately 18% of our revenue, was up 8.2%.
Both residential and termite, benefited from our OPC acquisition. Again, total revenue West acquisition was up 5.6% and from that, residential was up 6.8%. Commercial increased 3.2% and termite improved by a 7.5%.
Back to my earlier point on employing customer retention for the full year, total organic revenue grew 5.3% and is the fastest organic growth rate in over 5 years. When you take a look at the quarter, taking out the impact of the foreign companies and currency, total, we grew 7.1%.; residential grew 8%.; commercial pest control was up 5%; and termite improved 8.5%.
In total, gross margin for the quarter was 50.2%, up slightly from 50% prior year's quarter. The quarter benefited from improved efficiency and route against scheduling even as we have lapped effort that began 18 months ago. Average miles driven per vehicle in our Orkin fleet were down an additional 2.6% year-over-year. Fleet expenses increased to $3 million or 13.6% for the quarter, driven by moderated but still higher price per gallon cost and increased leased vehicle expense. Personnel related costs were up due to the 401(k) plan company match and the onetime employee's stock brands.
Depreciation and amortization expense for the fourth quarter increased $1.7 million to $16.6 million, an increase of 11.3%. Depreciation increased $790,000 due to acquisitions, equipment purchases and continued BOSS rollout. While amortization of intangible assets increased $900,000 due to amortization of customer contracts included in several acquisitions.
Sales, general and administrative expense for the fourth quarter increased $12.1 million or 9.8% to $135.8 million or 30.5% of revenues, up [ 0.7 ] of a percentage point from $123.7 million or 29.8% of revenues for the fourth quarter 2017. The increase in the percent of revenue is primarily driven due to higher sale salaries [ up ] $3.1 million due to higher sales commission, which is tied to a record organic growth rates.
$3 million additional expense in administrative salaries attributable to amortization of restricted stock brands and expense associated with acquisitions. Personnel-related increase of $1.9 million from the enhanced 401(k) benefits. In Q4, we saw an increase in the 401(k) match as more employees benefited from these enhancements.
The full year SG&A number increased 9.4% and came in at 30.2% of revenue compared to 30.1% of revenue in 2017. As for our cash position for the period ended December 31, 2018, we spent $76.7 million on acquisitions compared to $130.2 million, the same period last year, which included Northwest Exterminating. As we continued to find good quality pest control companies  and continue to buy back Critter Control franchises. We paid $152.7 million in dividends, which included a special dividend for the seventh consecutive year, which was an increase of 25.2%. We have $27.1 million of capital expenditures, which was up 9.7% from 2017, primarily from planned IT upgrades such as our BOSS Canada rollout and the Northwest acquisition.
We ended the period with $115.5 million in cash of which $53.6 million is held by our foreign subsidiary. Yesterday, the Board of Directors declared a regular cash dividend of $0.105 per share that will be paid on March 11, 2019, to stockholders of record at the close of business February the 11th, 2019.
The cash dividend is a 12.5% increase over the prior year. This marks the 17th consecutive year the board has increased our dividend by a minimum of 12%.
Gary, I'll turn the call back over to you."
300753,597020790,1638891,"Rollins, Inc., Q4 2018 Earnings Call, Jan 23, 2019",2019-01-23,"Earnings Calls","Rollins, Inc.","Executives","Thank you, Eddie. We're happy to take your questions at this time.",12,"Thank you, Eddie. We're happy to take your questions at this time."
300753,597020790,1638891,"Rollins, Inc., Q4 2018 Earnings Call, Jan 23, 2019",2019-01-23,"Earnings Calls","Rollins, Inc.","Operator","[Operator Instructions] We'll take our first question from Daniel from the mirror.",12,"[Operator Instructions] We'll take our first question from Daniel from the mirror."
300753,597020790,1638891,"Rollins, Inc., Q4 2018 Earnings Call, Jan 23, 2019",2019-01-23,"Earnings Calls","Rollins, Inc.","Analysts","I have 2 questions. One question and then a follow up. So it looks like organic growth was actually really, really strong and impressive. And definitely ahead of what we were modeling. Can you maybe give us a little sense about how -- what -- how the weat",99,"I have 2 questions. One question and then a follow up. So it looks like organic growth was actually really, really strong and impressive. And definitely ahead of what we were modeling. Can you maybe give us a little sense about how -- what -- how the weather impacted, and I know it was a little colder in the first -- at least in the first 2 months, it was colder in key areas like Florida. Is the execution getting better? Is this share gains? What is driving the strength and organic growth? And then I have a follow-up."
300753,597020790,1638891,"Rollins, Inc., Q4 2018 Earnings Call, Jan 23, 2019",2019-01-23,"Earnings Calls","Rollins, Inc.","Executives","So Dan I would point back to my opening comments. We see our employee retention improve. We know there is a direct correlation with the retention of our customers, we saw our customer retention improve. And while there was, to your point, there were other",100,"So Dan I would point back to my opening comments. We see our employee retention improve. We know there is a direct correlation with the retention of our customers, we saw our customer retention improve. And while there was, to your point, there were other issues and pockets of the country. I think, we saw a better retention of our existing customers as well as additional better sales in some different areas, which caused part of our increase in our sales commission. I think in those key items that really helped us continue to move that in the right direction."
300753,597020790,1638891,"Rollins, Inc., Q4 2018 Earnings Call, Jan 23, 2019",2019-01-23,"Earnings Calls","Rollins, Inc.","Analysts","Got it. That make sense. And then my follow-up is.",10,"Got it. That make sense. And then my follow-up is."
300753,597020790,1638891,"Rollins, Inc., Q4 2018 Earnings Call, Jan 23, 2019",2019-01-23,"Earnings Calls","Rollins, Inc.","Operator","We will now take our next question from Jamie Clemens from Buckingham Asset Management.",14,"We will now take our next question from Jamie Clemens from Buckingham Asset Management."
300753,597020790,1638891,"Rollins, Inc., Q4 2018 Earnings Call, Jan 23, 2019",2019-01-23,"Earnings Calls","Rollins, Inc.","Analysts","John, I think  it was John or maybe it was Eddie. But I think you have mentioned that Clark historically has outrun the industry, and I think you might have given outgrown you all. Is that a function of the geography, is it there in California or Nevada o",58,"John, I think  it was John or maybe it was Eddie. But I think you have mentioned that Clark historically has outrun the industry, and I think you might have given outgrown you all. Is that a function of the geography, is it there in California or Nevada or is there some extra special about their special sauce?"
300753,597020790,1638891,"Rollins, Inc., Q4 2018 Earnings Call, Jan 23, 2019",2019-01-23,"Earnings Calls","Rollins, Inc.","Executives","They've been there since 1950. So I think it's probably fair to say they have been the premier provider in that greater area for a lot of years. And I think they figured it out from a customer experience and employee perspective, and one of the reasons wh",77,"They've been there since 1950. So I think it's probably fair to say they have been the premier provider in that greater area for a lot of years. And I think they figured it out from a customer experience and employee perspective, and one of the reasons why there are a great cultural fit for us. but I know John's been a lot of time out there. I know John probably has something add to that?"
300753,597020790,1638891,"Rollins, Inc., Q4 2018 Earnings Call, Jan 23, 2019",2019-01-23,"Earnings Calls","Rollins, Inc.","Executives","Yes, Jimmy, I would say that comparable to our operations out there, our growth has been very similar. That any of the last 10 years or so has brought us -- been led really well. And so our growth out there has been fairly similar. It's other areas where",110,"Yes, Jimmy, I would say that comparable to our operations out there, our growth has been very similar. That any of the last 10 years or so has brought us -- been led really well. And so our growth out there has been fairly similar. It's other areas where the -- maybe the pest control markets little more mature that have growth lag. But no, there's no doubt there. Special company, with a special group of people that really -- they really care about the family that has led them so well for so many years. And their bran live and all and we're intent on helping them do that."
300753,597020790,1638891,"Rollins, Inc., Q4 2018 Earnings Call, Jan 23, 2019",2019-01-23,"Earnings Calls","Rollins, Inc.","Analysts","And Eddie, you wanted [indiscernible] to talk about amortization and interest expense [indiscernible] next quarter?",15,"And Eddie, you wanted [indiscernible] to talk about amortization and interest expense [indiscernible] next quarter?"
