"companyid","keydevid","transcriptid","headline","mostimportantdateutc","keydeveventtypename","companyname","speakertypename","componenttextpreview","word_count","componenttext"
24321,113253212,112078,"Adobe Systems Inc., Q1 2011 Earnings Call, Mar 22, 2011",2011-03-22,"Earnings Calls","Adobe Inc.","Operator","Good day, everyone and welcome to the Fiscal Year '11 Earnings Call. As a reminder, today's call is recorded. At this time I'd like to turn the call over to like Mike Saviage, Vice President of Investor Relations. Please go ahead, sir.",42,"Good day, everyone and welcome to the Fiscal Year '11 Earnings Call. As a reminder, today's call is recorded. At this time I'd like to turn the call over to like Mike Saviage, Vice President of Investor Relations. Please go ahead, sir."
24321,113253212,112078,"Adobe Systems Inc., Q1 2011 Earnings Call, Mar 22, 2011",2011-03-22,"Earnings Calls","Adobe Inc.","Executives","Good afternoon, and thank you for joining us today. Joining us on the call is President and CEO, Shantanu Narayen; as well as Mark Garrett, Executive Vice President and CFO. In the call today, we will discuss Adobe's first quarter fiscal year 2011 and res",177,"Good afternoon, and thank you for joining us today. Joining us on the call is President and CEO, Shantanu Narayen; as well as Mark Garrett, Executive Vice President and CFO. In the call today, we will discuss Adobe's first quarter fiscal year 2011 and results. By now you should receive a copy of our earnings press release, which is across the wire approximately one hour ago. If you need a copy of our press release you can go to www.adobe.com under the company and investor link to get a copy. Before we get started, I want to emphasize the discussed in this call revenue and operating targets and our forward-looking product lines as of today March 22, 2011, and contains forward-looking statements
[Audio Gap]
And the replay of the call will be made available on Adobe's Investor Relations website for approximately 45 days and is with Adobe Systems. The audio and archive will not be recorded or otherwise reproduced or distributed without prior written permission from Adobe Systems. I will now turn the call over to Shantanu"
24321,113253212,112078,"Adobe Systems Inc., Q1 2011 Earnings Call, Mar 22, 2011",2011-03-22,"Earnings Calls","Adobe Inc.","Executives","Thanks, Mike, and good afternoon. I am pleased to report we delivered record revenue of $1,028,000,000 in Q1 with non-GAAP earnings per share of $0.58. This represents our sixth consecutive quarter of sequential revenue growth. Adobe's vision for transfor",110,"Thanks, Mike, and good afternoon. I am pleased to report we delivered record revenue of $1,028,000,000 in Q1 with non-GAAP earnings per share of $0.58. This represents our sixth consecutive quarter of sequential revenue growth. Adobe's vision for transforming our world is creating measurement delivered the total experiences is resonating with our customers, and our solutions are enabling us to target large addressable markets that are fueling our growth. 
At first, I'd like to turn the call over to Mark, who will discuss our performance in the quarter and provide our essential targets for Q2. Following that, I will discuss some business highlights and then we'll take your questions. Mark?"
24321,113253212,112078,"Adobe Systems Inc., Q1 2011 Earnings Call, Mar 22, 2011",2011-03-22,"Earnings Calls","Adobe Inc.","Executives","Thanks, Shantanu. For the first quarter of fiscal 2011, Adobe achieved record revenue of $1,028,000,000. This compares to $858.7 million reported in Q1 fiscal 2010 and $1,008,000,000 reported last quarter. Year-over-year, this represents 20% revenue growt",1361,"Thanks, Shantanu. For the first quarter of fiscal 2011, Adobe achieved record revenue of $1,028,000,000. This compares to $858.7 million reported in Q1 fiscal 2010 and $1,008,000,000 reported last quarter. Year-over-year, this represents 20% revenue growth. As a reminder, in Q1 fiscal 2010, we had an extra week of revenue due to our 52-53 week financial calendar. This extra week benefited our revenue in the year ago quarter by approximately $35 million and normalizing for the extra week results in high year-over-year growth rates across our business. 
We entered the first quarter with 5% of reported Q4 revenue in shippable backlog, and we exited the first quarter with no shippable backlog. Q1 GAAP operating expenses were $617.7 million compared to $592.5 million reported in Q1 fiscal 2010 and $613.8 million last quarter. 
Non-GAAP operating expenses in Q1 were $539.5 million compared to $498.7 million reported for Q1 fiscal 2010 and $535 million last quarter. GAAP operating income in Q1 fiscal 2011 was $302.3 million or 29.4% of revenue. This compares to GAAP operating income of $176.8 million or 20.6% of revenue in Q1 fiscal 2010 and $286.9 million or 28.5% of revenue last quarter. 
Non-GAAP operating income in Q1 fiscal 2011 was $400.1 million or 38.9% of revenue. This compares to non-GAAP operating income of $289.3 million or 33.7% of revenue in Q1 fiscal 2010 and $384 million or 38.1% of revenue last quarter. Adobe's effective GAAP tax rate in Q1 was 18% and the non-GAAP tax rate was 22%. 
Our GAAP tax rate was higher than targeted due to a one-time charge related to our acquisition of in Q1. Q1 GAAP net income was a $234.6 million compared to $127.2 million reported in Q1 fiscal 2010 and $268.9 million last quarter. Non-GAAP net income in Q1 was $298.1 million compared to $211.7 million reported in Q1 fiscal 2010 and $285.7 million last quarter. 
GAAP diluted earnings per share for Q1 fiscal 2011 were $0.46 based on 511.3 million weighted average shares. This compares with GAAP diluted earnings per share of $0.24 reported in Q1 fiscal 2010 based on 532.6 million weighted average shares and GAAP diluted earnings per share of $0.53 reported last quarter based on 511.9 million weighted average shares. 
Non-GAAP diluted earnings per share for Q1 fiscal 2011 were $0.58. This compares with non-GAAP diluted earnings per share of $0.40 in Q1 fiscal 2010 and $0.56 reported last quarter. 
I will now discuss Adobe's results in Q1 by business segment. As we explained in December, we have modified our reporting segments for fiscal 2011. Our Investor Relations website contains our Investor Data Sheet, which has updated fiscal 2009 and fiscal 2010 segment results to reflect the changes. Based on our prior business segment classification, Q1 results either achieved or exceeded the segment guidance we provided in December. Using our new FY 2011 business segments, results were as follows: Creative and Interactive Solutions segment revenue in Q1 was $424.8 million, compared to $332.6 million in Q1 fiscal 2010 and $404.8 million last quarter. The strength and adoption of our CS products that we experienced in Q4 continued in Q1. 
Digital Media Solutions Q1 revenue was $151.7 million compared to $130.6 million in Q1 fiscal 2010 and $165.9 million last quarter. Photoshop and our video products performed well with the sequential decline attributed to the normal seasonality of our hobbyist products. 
Digital Enterprise Solutions revenue was $286.6 million in Q1 compared to $244.8 million in Q1 fiscal 2010 and $273.3 million last quarter. Within Digital Enterprise Solutions, Knowledge Worker revenue was $181.8 million compared to $165.9 million in Q1 fiscal 2010 and $169.9 million last quarter. Knowledge Worker 10% year-over-year growth was due to Enterprise adoption of the new Acrobat 10 release as well as increases in unit pricing. 
Enterprise segment revenue was $104.8 million compared to $78.9 million in Q1 fiscal 2010 and $103.4 million last quarter. The value proposition of our customer experience management offering is resonating with customers, driving strong year-over-year growth particularly now that our solution includes the Day content management products. 
Omniture segment revenue in Q1 was $110.9 million compared to $96 million reported in Q1 of fiscal 2010 and $109 million last quarter. Omniture transactions increased to $1.38 trillion in Q1 compared to $1.32 trillion in Q4 and were up 12% on a year-over-year basis. Omniture revenue diversification continued with site catalyst at 52% of Q1 Omniture product revenue. Enterprise renewal rates remained at 95% in the quarter. 
Finally, Print and Publishing segment revenue was $53.7 million compared to $54.7 million in Q1 fiscal 2010 and $55 million last quarter. 
Turning to our geographic segments in Q1 results on a percent of revenue basis were as follows: The Americas, 49%; Europe, 31%; Asia, 20%. Revenue in Q1 was driven by strong performance with our Creative, Acrobat and Omniture solutions, as well as a rebound in the education market and seasonal strength in Japan. 
In Enterprise, we saw some large deals pushed out, adding to what was already a strong Enterprise pipeline in Q2. From a year-over-year currency perspective, FX reduced revenue by $5.9 million. We had no hedge gains in Q1 FY11 and no hedge gains in Q1 FY10, thus the net year-over-year currency impact reduced Q1 revenue by $5.9 million. 
From a quarter-over-quarter perspective, FX reduced revenue by $1.7 million. We have no hedge gains in Q1 FY11 versus $0.7 million of hedge gains in Q4 FY10. Thus the net sequential decreased revenue considering hedging gains was $2.4 million. Employees at the end of Q1 totaled 9,503 versus 9,117 at the end of last quarter. The increase was primarily on sales and marketing as well as in R&D and lower cost geographies. 
Our trade DSO was 47 days, which compares to 40 days in the year ago quarter and 50 days last quarter. Our global channel inventory position at the end of the quarter was within company policy. 
During the quarter, cash flow from operations was $332 million. Our ending cash and short-term investment position was $2.6 billion compared to $2.5 billion at the end of Q4. In Q1, we repurchased approximately 2.5 million shares at a total cost of $83.4 million. 
Entering Q2, $41.6 million remains outstanding and open prepayments for stock repurchases. $875 billion of stock repurchase authority remains against the $1.6 billion stock repurchase authorization announced in July of last year. Deferred revenue in the quarter increased by $14 million in the quarter to a total of $443 million. 
This concludes my discussion of our financial results. I would now like to comment on our financial targets for the second quarter of fiscal 2011. 
Our hearts go out to everyone in Japan. Although Adobe has a very diversified business, Japan is our second largest country from a revenue perspective and March is typically our biggest revenue month of the year there due to fiscal year end spending. Given the uncertain business environment in Japan, we are being prudent and have reduced our revenue expectation for our second quarter by $50 million or roughly 1/3 of our original Q2 revenue expectation for Japan. With this reduction, we are targeting a Q2 revenue range of $970 million to $1,020,000,000. 
By business segment, we expect Omniture and Enterprise to grow sequentially and we expect all the other business segments to decline sequentially due to the impact from Japan. Geographically, we expect Asia to decline sequentially, whereas the Americas and EMEA are expected to be flat to slightly up. 
For margins, we are targeting a Q2 GAAP operating margin range of 24.5% to 27.5% and a non-GAAP operating margin range of 34% to 36%. We are targeting our Q2 share count to be 510 million to 512 million shares. We are targeting nonoperating expense to be between $16 million and $20 million on both our GAAP and non-GAAP basis. 
For our Q2 effective GAAP and non-GAAP tax rates, we are targeting 22%. These targets lead to a GAAP earnings per share range of $0.33 to $0.40 per share, and a non-GAAP earnings per share range of $0.47 to $0.54. 
This concludes my section. I'd now like to turn the call back over to Shantanu."
24321,113253212,112078,"Adobe Systems Inc., Q1 2011 Earnings Call, Mar 22, 2011",2011-03-22,"Earnings Calls","Adobe Inc.","Executives","Thanks, mark. As evidenced by our Q1 results, our strategy is working. Adobe is leading the revolution in how digital experiences are created, managed, distributed, measured and monetized in this multiscreen world. We continue to deliver innovative soluti",1002,"Thanks, mark. As evidenced by our Q1 results, our strategy is working. Adobe is leading the revolution in how digital experiences are created, managed, distributed, measured and monetized in this multiscreen world. We continue to deliver innovative solutions to a broader set of customers, which is helping to successfully transform Adobe into a more diversified software company with large opportunities for new growth. 
As we have previously shared with you, we are focused on three significant growth opportunities: content offering, customer experience management and online marketing optimization, and I'll spend a few minutes covering the highlights from each area today. 
In content offering, we achieved strong year-over-year growth with our Creative products and CS5 continued to perform well. In Q1, we announced general availability of the Adobe Digital Publishing Suite, a comprehensive solution to create, distribute, monetize and analyze digital content including magazines, newspapers and corporate publications. Early demand for the Digital Publishing Suite has been strong across the world with over 150 titles already made available through app stores including National Geographic, Consumer Reports, Reader's Digest and Vogue. 
In addition, corporate publications from Credit Suisse, Mercedes-Benz and Volvo showed that used cases for this solution extend beyond newspapers and magazines, and we expect future publications to include catalogs and other traditional print content that will be migrated for consumption and use on tablets. 
The Digital Publishing Suite publishes to Android tablets included Motorola Zoom and Samsung Galaxy tab, as well as IOS devices. And in the future, to the Playbook when it is made available. We will continue to expand our content authoring offerings by providing a mid-cycle release to CS5. The release will enhance our Digital Publishing capabilities, help customers address the multi-screen challenges they face and includes new innovative features in areas like HTML and Flash authoring, application creation and video authoring and production. 
One of the pillars of our content authoring strategy is to continue to invest in HTML as a key part of our tools portfolio, and we made a Flash to HTML converter available last month. We anticipate this tool can be used by Flash designers and developers to extend their work in Flash to platforms that do not yet support the Flash Player. 
We continue to see strong momentum for our Flash and AIR technologies. Strategy analytics, forecast more than 132 million smart phones or 36% of all smart phones will support Flash player in 2011. More than 84 million smart phones and tablets support AIR, including IOS devices, and we expect that to grow to more than 200 million by the end of 2011. In 2010, we also drove 100% year-over-year growth in video streaming via Flash. 
Last Friday, we made Flash Player 10.2 available for download on the Android Market. This is a new release for Android devices as well as the beta release for new targets running. Flash Player 10.2 brings improved performance and a full Web browsing experience including video games and other interactive content. 
In customer experience management, awareness of our solution is growing as organizations are focusing on how to improve interactions with their customers in an increasingly digital world. We are well-positioned to lead this emerging category with new solutions, integrating our LiveCycle, Connect and Day products. The Day acquisition, which closed in Q4, has gone smoothly with the new version of the Day CQ 5 solution, integrating Omniture analytics capabilities already released earlier this month. 
This comprehensive Web content management, rich media delivery and social collaboration capabilities helped us close multiproduct agreements with customers such as Diamler, Nielsen and General Motors, more importantly, we enter Q4 with a strong Enterprise pipeline. 
Our Acrobat business performed well in Q1. Adoption of the new Acrobat 10 product was strong during the quarter, driven by strong Enterprise licensing adoption. In online marketing, momentum continues to be strong in our Omniture business. We add our Adobe Omniture Summit two years ago with the sellout crowd of 2,600 marketers. At the Summit, we announced a new next-generation platform for the Adobe Online Marketing Suite designed to handle increased loads of data from social, mobile and video. 
We also launched Adobe Social Analytics, a single application that can aggregate also social network and online community activity to determine the impact on sentiment, brand perception and business metrics. We are on pace to measure 5 trillion transactions this year for our customers with mobile being the fastest-growing segment of our Analytics business. 
Our acquisition of, a leading data management platform company, closed in January and has already begun enhancing our Omniture offerings with audience optimization capabilities to help advertisers and publishers to maximize their online ad investment. Those capabilities along with the Web content management capabilities acquired from Day Software has served as a compelling value proposition to online marketers and publishers. 
While our progress in each of the growth areas, content offering, customer experience management and online marketing optimization, is exciting individually, the real power is where we see these areas converging to serve our customers' entire workflow. For example, T-Mobile delivers outstanding customer service and saves millions annually by using Creative Suite, the Flash Platform, LiveCycle and Omniture to transform customer experience in stores and online. Likewise, MTV Networks uses Creative Suite and Flash to deliver its online content and Omniture to enhance customer viewing experiences and increase website revenues worldwide. 
An end-to-end value proposition is Adobe's unique differentiation. 
I would like to close by saying how concerned we are about the tragedy in Japan. We are grateful that all our employees in Japan are safe and hope that the situation improves soon. Given the uncertain business environment in Japan, we chose to be prudent with our Q2 financial targets. 
Adobe's vision of changing the world through digital experiences is more relevant than ever before. Moving forward, we will continue to focus on our three large growth opportunities: content offering, customer experience management and online marketing optimization.  Thank you for joining us today. 
Now I'll turn the call back over to Mike."
24321,113253212,112078,"Adobe Systems Inc., Q1 2011 Earnings Call, Mar 22, 2011",2011-03-22,"Earnings Calls","Adobe Inc.","Executives","Thanks, Shantanu. Regard to today's earnings report, we have posted several documents on our Investor Relations website today including a copy of the script containing our prepared remarks for today's call. To access these documents and the other investor",220,"Thanks, Shantanu. Regard to today's earnings report, we have posted several documents on our Investor Relations website today including a copy of the script containing our prepared remarks for today's call. To access these documents and the other investor related information, go to www.adobe.com/ADBE. We also encourage you to sign up for Easy Access to updated documents and communications via RSS feeds that you can subscribe to on the website. 
For those who wish to listen to a playback of today's conference call, a web-based Adobe Connect archive of the call will be available from the IR Page at adobe.com later today. Alternatively, you can listen to a phone replay by calling (888)203-1112. Use conference ID number 890-0095. Again, (888)203-1112 and conference ID number 890-0095. International callers should dial (719)457-0820. The phone playback service will be available beginning at 4:00 p.m. Pacific time today and ending at 4:00 p.m. Pacific time on Friday, March 25, 2011. 
We will now be happy to take your questions. In addition to questions that come in from those participating on the live phone call, we've also enabled the question pod in the Connect Session. So those on the Connect Session, feel free to send in your questions and we'll to try to take a few. Operator, we'll take the first question from the phones."
24321,113253212,112078,"Adobe Systems Inc., Q1 2011 Earnings Call, Mar 22, 2011",2011-03-22,"Earnings Calls","Adobe Inc.","Operator","[Operator Instructions] Our first question from the phone will come from Walter Pritchard from Citi.",15,"[Operator Instructions] Our first question from the phone will come from Walter Pritchard from Citi."
24321,113253212,112078,"Adobe Systems Inc., Q1 2011 Earnings Call, Mar 22, 2011",2011-03-22,"Earnings Calls","Adobe Inc.","Analysts","I'm wondering if you could just talk about the year and I think you talked before about 10% gross for the year recognizing that you're making some to our Japan, just wondering how that impacts what your outlook is for 2011?",42,"I'm wondering if you could just talk about the year and I think you talked before about 10% gross for the year recognizing that you're making some to our Japan, just wondering how that impacts what your outlook is for 2011?"
24321,113253212,112078,"Adobe Systems Inc., Q1 2011 Earnings Call, Mar 22, 2011",2011-03-22,"Earnings Calls","Adobe Inc.","Executives","Yes, Hi, Walter. It's Mark. So actually, let me start with maybe a little bit of color on the rest of this year and then I'll address your 10% question specifically. If you remember back in December, we said, if you look through the rest of the year that",350,"Yes, Hi, Walter. It's Mark. So actually, let me start with maybe a little bit of color on the rest of this year and then I'll address your 10% question specifically. If you remember back in December, we said, if you look through the rest of the year that we would have a slight revenue increase in the second quarter that we would see a normal seasonal decline in the third quarter, and then we'd see seasonal strength in the sequential growth in the fourth quarter. And that OpEx will grow during the year, so as a result, margins would be slightly down in Q2, down again in Q3 and up in Q4. That's what we originally said back in December. That was of course, prior to the Japan tragedy and prior to what happened in Japan, we were on track to deliver against that guidance. There's kind of two scenarios now that I would paint for you. One is if Japan's Q2 is really impacted by the 50 million and then begins to recover, most likely, Q3 would now be up sequentially, and then seasonal strength would bring sequential growth again in the fourth quarter, margins would grow sequentially in Q3 and again in Q4. That's one scenario. The second would be if the impact of the situation in Japan is in Q2 much less than the $50 million, then our original quarter color is more likely to pan out. We continue to believe in our growth opportunities. We are taking prudent expense actions but nothing drastic on the operating expense side. But until we see Japan improve, we do plan to keep operating expense relatively flat from Q2 to Q3. There will probably be a seasonal uptick to OpEx in the fourth quarter primarily in sales and marketing. So if you look at all of that as it relates to your question over the 10%. Back in December, we did anticipate 10% revenue growth. But honestly, until we learn more about the true impact of Japan, it's just not prudent to comment on longer term targets right now."
24321,113253212,112078,"Adobe Systems Inc., Q1 2011 Earnings Call, Mar 22, 2011",2011-03-22,"Earnings Calls","Adobe Inc.","Analysts","And then just a follow-up on the backlog number, I know the number doesn't move around quite a bit from quarter-to-quarter. Could you just comment, Mark on the decline you saw here from November and into February and I there has been quarters where you've",63,"And then just a follow-up on the backlog number, I know the number doesn't move around quite a bit from quarter-to-quarter. Could you just comment, Mark on the decline you saw here from November and into February and I there has been quarters where you've seen actually an increase there. I'm just wondering sort of what the driver was on that quarter-to-quarter?"
