"companyid","keydevid","transcriptid","headline","mostimportantdateutc","keydeveventtypename","companyname","speakertypename","componenttextpreview","word_count","componenttext"
100231,134534185,144119,"AT&T, Inc., Q2 2011 Earnings Call, Jul 21, 2011",2011-07-21,"Earnings Calls","AT&T Inc.","Executives","Chris, this is Wayne. I'll go first. With respect to the changes at the Department of Justice, look, I had a lot of respect for Christine Varney, and I would have loved to see her stay there until we finished this transaction. She obviously had an opportu",243,"Chris, this is Wayne. I'll go first. With respect to the changes at the Department of Justice, look, I had a lot of respect for Christine Varney, and I would have loved to see her stay there until we finished this transaction. She obviously had an opportunity she took advantage of, and we wish her the very best there. Having said that, she's left behind an extraordinarily talented staff, a staff that we've been working with on a day-to-day basis on this transaction. And they're going to continue to work hard and push through. And I think that's why even Christine said that she did not view that her leaving would change the timing of the transaction, and I believe that to be accurate. With respect to Senator Kohl, we have a great deal of respect for Senator Kohl and his staff. I've met with him and his staff a number of times. And we often have very candid discussions, and this is one where we simply disagree on, on the outcome here. But most importantly, we have to recognize that while Senator Kohl's opinion deserves a great deal of respect, he's not a final decision-maker. And there are certainly examples where Senator Kohl has opposed transactions that were approved, and we believe that'll be the case here as well. So the short answer is, Chris, I don't think that either one will have a material impact on the timing or the outcome."
100231,134534185,144119,"AT&T, Inc., Q2 2011 Earnings Call, Jul 21, 2011",2011-07-21,"Earnings Calls","AT&T Inc.","Analysts","Wayne, if I could follow up, and this may be more Jim's area, but any sense for how fast you might see new appointments at the FCC for those vacancies, or soon-to-be vacancies?",33,"Wayne, if I could follow up, and this may be more Jim's area, but any sense for how fast you might see new appointments at the FCC for those vacancies, or soon-to-be vacancies?"
100231,134534185,144119,"AT&T, Inc., Q2 2011 Earnings Call, Jul 21, 2011",2011-07-21,"Earnings Calls","AT&T Inc.","Executives","The only thing I could say is the understanding we have is the administration's working hard to get those slots filled. And I'm sure they're going to continue to do that, and we hope that they do.",38,"The only thing I could say is the understanding we have is the administration's working hard to get those slots filled. And I'm sure they're going to continue to do that, and we hope that they do."
100231,134534185,144119,"AT&T, Inc., Q2 2011 Earnings Call, Jul 21, 2011",2011-07-21,"Earnings Calls","AT&T Inc.","Executives","Chris, with regard to your questions on CapEx, I think the answer is yes. It's on all of the items you mentioned, but I'd give you this focus. It's really a focus on the Wireless CapEx spend, and it's across in the categories you talked about. But it's re",84,"Chris, with regard to your questions on CapEx, I think the answer is yes. It's on all of the items you mentioned, but I'd give you this focus. It's really a focus on the Wireless CapEx spend, and it's across in the categories you talked about. But it's really focused on providing a better experience to the customer and handling the volume increase we've seen because of customer growth and quite frankly, more customer usage. So the short answer to your question was yes."
100231,134534185,144119,"AT&T, Inc., Q2 2011 Earnings Call, Jul 21, 2011",2011-07-21,"Earnings Calls","AT&T Inc.","Operator","We'll go next to the line of Brett Feldman at Deutsche Bank.",13,"We'll go next to the line of Brett Feldman at Deutsche Bank."
100231,134534185,144119,"AT&T, Inc., Q2 2011 Earnings Call, Jul 21, 2011",2011-07-21,"Earnings Calls","AT&T Inc.","Analysts","I'm actually going to kind of follow up on one of the questions Phil was asking about the data devices. I mean, if you isolate the announcements here around tablets, what's interesting is what a small percentage of overall tablet sales are being sold with",149,"I'm actually going to kind of follow up on one of the questions Phil was asking about the data devices. I mean, if you isolate the announcements here around tablets, what's interesting is what a small percentage of overall tablet sales are being sold with cellular capabilities. And it just seems like you've got this huge opportunity to penetrate this rapidly growing product category, and you haven't quite clicked on it yet. I'm just wondering is it as simple as getting the LTE and putting more speed into the device? Or are you considering something maybe broader here in terms of how customers would pay for those things? For example, would you move to more of a subsidy model to get the price point down? Do you think that the service pricing could be tweaked a bit? I'm just wondering where you think your best opportunity here is."
100231,134534185,144119,"AT&T, Inc., Q2 2011 Earnings Call, Jul 21, 2011",2011-07-21,"Earnings Calls","AT&T Inc.","Executives","Well, I think we're looking at it from a number of different perspectives. I think one thing we need to realize is the ability to have these float on the WiFi networks and utilize the capacity on the wire networks is important to the customers and importa",190,"Well, I think we're looking at it from a number of different perspectives. I think one thing we need to realize is the ability to have these float on the WiFi networks and utilize the capacity on the wire networks is important to the customers and important to us. Secondly, I would tell you that I think one of the ones -- opportunities we're most excited about is incorporating this, connecting it with our enterprise customers and working with the CIOs on all the different aspects of security and availability and so forth. And we're working -- we'll work hard to do that. That's an opportunity we're real excited about. But I will tell you, in this quarter, we did make progress. So I don't want that to be lost. I think it is important. I understand your commentary on, comments on long term, much greater opportunities. I don't disagree with all those at all. But we are making progress, and we are looking at how we -- and working very, very actively on a number of different approaches with regard to that. LTE will certainly help. That's for sure."
100231,134534185,144119,"AT&T, Inc., Q2 2011 Earnings Call, Jul 21, 2011",2011-07-21,"Earnings Calls","AT&T Inc.","Operator","And that will come from the line of Jonathan Chaplin of Credit Suisse.",13,"And that will come from the line of Jonathan Chaplin of Credit Suisse."
100231,134534185,144119,"AT&T, Inc., Q2 2011 Earnings Call, Jul 21, 2011",2011-07-21,"Earnings Calls","AT&T Inc.","Analysts","Two quick follow-up questions. So the first on, I think, CapEx. I'm wondering if you can give us some context for how much of the increase in spending is sort of front-loading capacity buildouts to take advantage of depreciation, that beneficial tax regim",144,"Two quick follow-up questions. So the first on, I think, CapEx. I'm wondering if you can give us some context for how much of the increase in spending is sort of front-loading capacity buildouts to take advantage of depreciation, that beneficial tax regime, versus just dealing with the massive amounts of data growth that you're seeing on the network right now. What I'm really trying to get a context for is what happens to Wireless CapEx in 2012 and beyond. And then quickly on ARPU, as you sort of take that, the penetration of smartphones from 50% to 70%, can you maintain that ratio of smartphone ARPU to non-smartphone ARPU? Or does the sort of the next slug of smartphone ARPU have to come in at a lower base so that we continue to see sort of overall postpaid ARPU continue to decelerate?"
100231,134534185,144119,"AT&T, Inc., Q2 2011 Earnings Call, Jul 21, 2011",2011-07-21,"Earnings Calls","AT&T Inc.","Executives","Quite frankly, on the CapEx issue, it's both. It's both prudent, taking advantage of the financial rules that are out there today with regard to taxes and with regard to our strong balance sheet, our ability to do it and also demand. I'm not trying to --",282,"Quite frankly, on the CapEx issue, it's both. It's both prudent, taking advantage of the financial rules that are out there today with regard to taxes and with regard to our strong balance sheet, our ability to do it and also demand. I'm not trying to -- we are not changing in any way, shape or form, guidance on a long-term basis with regard to our CapEx. I'm not even commenting on that. I'm not suggesting that you change that. What I am suggesting is that we're prudently taking the opportunity, because of the incentives that are there today, to move forward to give our customers better service, and we feel good about that. And we feel really -- quite frankly, it's -- we feel good about having the demand. The customers are demanding the subs. That's a good thing. With regard to the ARPU issue, remember, much of the increase in the -- or the increase in its penetration is from existing customers. So generally speaking, when they go from a non-smartphone to a smartphone, their ARPUs, whether they're above the average or below the average, are going up. And so they're going to that, maybe only incrementally, but they are going up. And so they're going to be positive towards that postpaid ARPU average growth because they're coming out of the quick messaging devices or whatever and moving up the chain. What is going to be challenging to us is more of the tablets and the other devices that are going on the postpaid that may have lower ARPUs than are average today. But we are still optimistic about the revenue situation in total and quite frankly, the postpaid situation."
100231,134534185,144119,"AT&T, Inc., Q2 2011 Earnings Call, Jul 21, 2011",2011-07-21,"Earnings Calls","AT&T Inc.","Analysts","What would CapEx be if you -- if there weren't sort of bonus depreciation rules in place this year?",19,"What would CapEx be if you -- if there weren't sort of bonus depreciation rules in place this year?"
100231,134534185,144119,"AT&T, Inc., Q2 2011 Earnings Call, Jul 21, 2011",2011-07-21,"Earnings Calls","AT&T Inc.","Executives","Jonathan, I can tell you that we had guidance out there at the mid-$19 billion range, and now we're moving it to around the $20 billion range. I'll leave it to you to make your judgments on whether you want to tie that to bonus depreciation. But I will te",317,"Jonathan, I can tell you that we had guidance out there at the mid-$19 billion range, and now we're moving it to around the $20 billion range. I'll leave it to you to make your judgments on whether you want to tie that to bonus depreciation. But I will tell you it was certainly taken into account. And I've got to tell you, my Wireless business unit has done well and added more subscribers than even I thought, and I have a very high opinion of them. So we're responding to that. 
I think we're going to wrap it up here. I want to take a moment just again to tell you thank you very much for taking part in the call. 
And let me close by highlighting a few key points. First, we delivered another strong Wireless quarter in a very competitive environment, led by our mobile broadband strategy. We had record mobile broadband sales, smartphones and data-only devices. We had solid revenue growth and our 10th consecutive quarter of postpaid ARPU growth. And as you heard from Wayne, we are comfortable with the progress of the T-Mobile merger transaction, and we remain confident of its approval. 
Second, we continue to see encouraging signs in our Wireline business as we transform it from voice to next-generation IP data business. Revenue trends continue to improve, and U-verse is leading continued consumer year-over-year growth. Strategic business services are driving improvements in business trends. 
And third, we had solid financial results and strong cash flows, which allow us to continue to invest in our growth platforms and to return significant value to our shareholders. This gives us good momentum going into the back half of the year and makes us optimistic about our future. 
Once again, my sincere thanks for being on the call today. And as always, thank you for your interest in AT&T. Have a good day."
100231,134534185,144119,"AT&T, Inc., Q2 2011 Earnings Call, Jul 21, 2011",2011-07-21,"Earnings Calls","AT&T Inc.","Executives","Thanks, everybody. Thanks, Keeley.",4,"Thanks, everybody. Thanks, Keeley."
100231,134534185,144119,"AT&T, Inc., Q2 2011 Earnings Call, Jul 21, 2011",2011-07-21,"Earnings Calls","AT&T Inc.","Operator","Thank you. And ladies and gentlemen, that does conclude your conference for today. Thank you for your participation and for using AT&T Executive TeleConference. You may now disconnect.",28,"Thank you. And ladies and gentlemen, that does conclude your conference for today. Thank you for your participation and for using AT&T Executive TeleConference. You may now disconnect."
100231,140693378,174507,"AT&T, Inc., Q3 2011 Earnings Call, Oct 20, 2011",2011-10-20,"Earnings Calls","AT&T Inc.","Operator","Ladies and gentlemen, thank you for standing by, and welcome to the AT&T Third Quarter 2011 Earnings Release. [Operator Instructions] As a reminder, today's call is being recorded. With that being said, we'll turn the conference over to Brooks McCorcle, S",49,"Ladies and gentlemen, thank you for standing by, and welcome to the AT&T Third Quarter 2011 Earnings Release. [Operator Instructions] As a reminder, today's call is being recorded. With that being said, we'll turn the conference over to Brooks McCorcle, Senior Vice President, Investor Relations, Finance. Please go ahead."
100231,140693378,174507,"AT&T, Inc., Q3 2011 Earnings Call, Oct 20, 2011",2011-10-20,"Earnings Calls","AT&T Inc.","Executives","Thank you, John. Good morning, everyone and welcome to our third quarter conference call. It's really great to have you with us this morning. As John mentioned, this is Brooks McCorcle, head of Investor Relations for AT&T, and joining me on the call today",338,"Thank you, John. Good morning, everyone and welcome to our third quarter conference call. It's really great to have you with us this morning. As John mentioned, this is Brooks McCorcle, head of Investor Relations for AT&T, and joining me on the call today are John Stephens, AT&T's Chief Financial Officer; and Ralph de la Vega, AT&T's President and CEO for Mobility and Consumer Markets. John will cover our consolidated and Wireline results and Ralph will give us an update on our wireless business. Then, we will follow with Qs&As. Let me remind you that our release, investor briefing, supplementary information and the presentation slides that accompany this call are all available on the Investor Relations page of the AT&T website. And as a reminder, that's www.att.com/investor.relations. 
I also need to reference our safe harbor statement, which is on Slide 3, and that says that this presentation and the comments that we'll make this morning may contain forward-looking statements. And as you know, they're subject to risks and details can be found in our SEC filings and on AT&T's website. Before I turn the call over to John, let me quickly call your attention to Slide 4, which provides the financial summary. Earnings per share for the quarter were $0.61, a 13% increase over last year's earnings per share, excluding onetime gains and up 3.5% year-to-date. This includes pressure from Storm and T-Mobile transaction-related expenses in the third quarter. Our consolidated revenue was stable and consolidated operating margin was up 260 basis points year-over-year and stable sequentially, thanks to our best wireless service margins in 6 quarters and continued strength in Wireline business. Cash flow was superb. Cash from operating activities for the quarter totaled $10.4 billion and free cash flow was $5.1 billion, which brings us to $12.4 billion through the year. That's even with the increased investment in capital expenditures that we told you about last quarter. With that quick overview, I will now turn the call over to AT&T's Chief Financial Officer, John Stephens. John?"
100231,140693378,174507,"AT&T, Inc., Q3 2011 Earnings Call, Oct 20, 2011",2011-10-20,"Earnings Calls","AT&T Inc.","Executives","Thanks, Brooks and good morning to everyone on the call. Before I cover results, let me provide a quick comment on our planned T-Mobile merger. The SEC review is continuing and on the DOJ front, we're hopeful that we can reach a solution. We have a trial",508,"Thanks, Brooks and good morning to everyone on the call. Before I cover results, let me provide a quick comment on our planned T-Mobile merger. The SEC review is continuing and on the DOJ front, we're hopeful that we can reach a solution. We have a trial date in less than 4 months. The benefits of the combination are both significant and unchanged and our expectation continues to be that we will reach a successful conclusion. 
Now, let me turn to results and comment on the quarter overall, the highlights are on Slide 5. We are very pleased with what we've accomplished in the third quarter and year-to-date and we continue to see impressive strength in all our growth engines. Mobile broadband leads the way. Ralph will give you more details in a moment but we had a great quarter. Sales were strong across the board, with gains in every subscriber category. Smartphone sales were robust, even in a quarter where you might expect sales to slow. Branded computing devices were also strong and we turned in impressive service margin results with our best performance in 6 quarters. There also was good news for our Wireline business, where for the first time in 3 years, we posted sequential growth in total and business revenues. IP data continues to be the driver for business and in Wireline consumer, where we continue to see positive results. The thing I'm most encouraged by is that in addition to solid earnings, we delivered excellent free cash flow. In fact, we had our strongest free cash flow in 2 years. That comes even with making significant CapEx investments. So you're seeing solid execution in every area of the business, which puts us in a great position heading into the fourth quarter. 
With that as background, let's take a look at detailed results, starting with consolidated revenues on Slide 6. Third quarter consolidated revenues were stable sequentially and year-over-year, but when you look at our results year-to-date, we've seen revenues increase. Our growth drivers continue to be strong. Excellent mobile broadband growth, solid U-verse gains and improved business trends. This was partially offset in the third quarter by declines in voice and directory. We also had an iPhone launch last year, which provided a lift to 2010 third quarter equipment revenues. Of course, we didn't see this in third quarter revenues this year. So when you factor out equipment revenue, consolidated service revenues actually grew 0.4% versus a year ago. Our overall revenue mix has continued its transformation. Year-to-date, 75% of our revenues come from wireless and Wireline data and managed services. That's up from 72% a year ago and 66% just 2 years ago. Revenues from these areas were up 7% year-to-date, so they're growing at a very good clip. We expect this mix shift to continue and it's one of the reasons we have such a positive view of our business. With that, let me turn it over to Ralph de la Vega, who will provide an update on wireless results. Ralph?"
