"companyid","keydevid","transcriptid","headline","mostimportantdateutc","keydeveventtypename","companyname","speakertypename","componenttextpreview","word_count","componenttext"
100231,128696791,116062,"AT&T, Inc., Q1 2011 Earnings Call, Apr 20, 2011",2011-04-20,"Earnings Calls","AT&T Inc.","Executives","Thank you, John. Let me recap the quarter on Slide 16. First, we're off to a good start for the year, with solid revenue growth in both wireless and consumer wireline and stability in our business markets. Second, we had another very strong wireless quart",225,"Thank you, John. Let me recap the quarter on Slide 16. First, we're off to a good start for the year, with solid revenue growth in both wireless and consumer wireline and stability in our business markets. Second, we had another very strong wireless quarter, a performance that was particularly satisfying when you consider the challenges we faced. We told you last quarter that we expected positive contract subscriber growth for the year, even with the introduction of another carrier for the iPhone. And we delivered on that outlook in the very first quarter. When you add in record first quarter net adds, strong sales of branded computing subscribers and higher postpaid ARPU, you can understand our confidence in the mobile broadband strategy and mobile broadband opportunity. We're also very pleased with the continued transformation of our Wireline business. In fact, fast-growing data and video services now exceed voice revenues in Wireline, thanks to U-verse and continued strong growth in strategic business services. And our financial strength and cash flow remain strong, allowing us to return value to shareholders as we continue to invest in our business.
So we're off to a good start to the year, with solid first quarter operating results and a positive long-term outlook for the business. Brooks that concludes our prepared remarks. I think we're ready to take some questions."
100231,128696791,116062,"AT&T, Inc., Q1 2011 Earnings Call, Apr 20, 2011",2011-04-20,"Earnings Calls","AT&T Inc.","Operator","[Operator Instructions]  We'll go to the line of Simon Flannery with Morgan Stanley.",13,"[Operator Instructions]  We'll go to the line of Simon Flannery with Morgan Stanley."
100231,128696791,116062,"AT&T, Inc., Q1 2011 Earnings Call, Apr 20, 2011",2011-04-20,"Earnings Calls","AT&T Inc.","Analysts","First, Rick, wishing you all the best on your retirement. You'll be missed. Thanks for your help. Ralph, could you update us on the LTE rollout? What are sort of the key steps you're going through right now? Where you stand? And then, what's the updated t",75,"First, Rick, wishing you all the best on your retirement. You'll be missed. Thanks for your help. Ralph, could you update us on the LTE rollout? What are sort of the key steps you're going through right now? Where you stand? And then, what's the updated timing on POP coverage on that? And any updates you have on sort of network performance in some of the major markets that are currently? That would be great."
100231,128696791,116062,"AT&T, Inc., Q1 2011 Earnings Call, Apr 20, 2011",2011-04-20,"Earnings Calls","AT&T Inc.","Executives","Sure, Simon. Our LTE rollout is on track and continues to move at the same pace prior to the announcement of the T-Mobile transaction. We're planning to commercially launch our service mid-year, and we plan to cover 70 million to 75 million POPs by the en",120,"Sure, Simon. Our LTE rollout is on track and continues to move at the same pace prior to the announcement of the T-Mobile transaction. We're planning to commercially launch our service mid-year, and we plan to cover 70 million to 75 million POPs by the end of the year. Our network team is working around the clock doing the necessary modifications and building the network. We've got handsets and devices ready to go, so we're really excited. What I'm really excited about is we had a very good first quarter, and that we have not yet turned up our LTE capabilities. So I expect that future quarters, when we have that capability in hand, will even give us better momentum."
100231,128696791,116062,"AT&T, Inc., Q1 2011 Earnings Call, Apr 20, 2011",2011-04-20,"Earnings Calls","AT&T Inc.","Analysts","And then on the network performance today?",7,"And then on the network performance today?"
100231,128696791,116062,"AT&T, Inc., Q1 2011 Earnings Call, Apr 20, 2011",2011-04-20,"Earnings Calls","AT&T Inc.","Executives","The network performance today, Simon, is getting better. You know, we've got the nation's fastest network, and it keeps getting faster. We saw an increase in national broadband speeds over the last six months. We've had solid improvement in voice metrics",89,"The network performance today, Simon, is getting better. You know, we've got the nation's fastest network, and it keeps getting faster. We saw an increase in national broadband speeds over the last six months. We've had solid improvement in voice metrics thus far this year, and we improved both voice retainability and voice accessibility. The only concern we have with network is the long-term capacity constraints that we face with Spectrum. And as you know, that's one of the things that will hopefully be relieved with the T-Mobile transaction."
100231,128696791,116062,"AT&T, Inc., Q1 2011 Earnings Call, Apr 20, 2011",2011-04-20,"Earnings Calls","AT&T Inc.","Operator","Our next question is from John Hodulik with UBS.",9,"Our next question is from John Hodulik with UBS."
100231,128696791,116062,"AT&T, Inc., Q1 2011 Earnings Call, Apr 20, 2011",2011-04-20,"Earnings Calls","AT&T Inc.","Analysts","Just a couple of questions on wireless. Actually, Rick, in the past, you guys have said you thought the churn levels would be elevated in the first half and start to head down in the second half given the  expiration of the exclusivity. Is this the kind o",149,"Just a couple of questions on wireless. Actually, Rick, in the past, you guys have said you thought the churn levels would be elevated in the first half and start to head down in the second half given the  expiration of the exclusivity. Is this the kind of increase in churn? Churn was -- the increase is, certainly, much less than we thought. Is the kind of level that you think we should expect to see going forward here, maybe in the second quarter? Or do you think that the expiration of some of the contracts that you guys signed two years ago accelerates that a bit? And then, secondly, on wireless, the prepaid numbers, you have a net add to 85,000, a bit less than we thought. Verizon is testing some new prepaid plans. Is that an area where you think you might need to get more aggressive?"
100231,128696791,116062,"AT&T, Inc., Q1 2011 Earnings Call, Apr 20, 2011",2011-04-20,"Earnings Calls","AT&T Inc.","Executives","John, I'll give you a perspective on churn and the impact there in the contract customers, and then I'll let Ralph address the prepaid wireless question. In terms of churn, frankly, we expected a slight uptick in churn when another carrier launched the iP",470,"John, I'll give you a perspective on churn and the impact there in the contract customers, and then I'll let Ralph address the prepaid wireless question. In terms of churn, frankly, we expected a slight uptick in churn when another carrier launched the iPhone. Our expectations, I think we're generally less more modest in terms of churn increase than external expectations. We believed in our broadband strategy, our wireless strategy. We felt we were prepared for changes in exclusivity. And, actually, the results came in better than we expected. And as you heard from Ralph, there's very, very modest change in overall churn and in postpaid churn levels. And I think, one of the most surprising areas perhaps is the fact that iPhone churn basically stayed flat. It did not increase. And I think, as you know, as you think about what drove that and what caused those results, frankly, I think it had less to do with customers being under contract. Of course, we always work hard with our upgrade policy to keep customers under contract, and we do believe that it helps overall churn levels. But the fact is that, it was well known for months and quarters in advance that another carrier would launch the iPhone. And yet, we continued to see customers upgrade their devices, enter into new contracts in the third and fourth quarters last year and in record numbers. And that continued into the first quarter this year when the phone was available on another carrier. And the reality is, even if customers were under contract, they have the ability to break that contract, pay a termination charge and most likely, take that device that they had and sell it and recover most, if not all, of that contract termination. So I don't think having customers under contract had that large of an impact. What I do believe has an impact is what Ralph touched on earlier, and that is the device. And you have to remember the iPhone is a device that carries a lot of data usage and a lot of data traffic. For heavy data users, being on our network, having a faster data experience, having simultaneous voice and data, having the ability for high-end users who do any amount of international travel to be able to use that device, not just in the U.S. but around the world, all of those things were important to the iPhone customer base. And so I think that speaks as much as anything to what we saw in the first quarter and to churn levels. And as we go forward, based on what we've seen, certainly, to date, we're not expecting significant changes in those churn rates or in the iPhone churn rates as we go forward in the balance of this year. Ralph?"
100231,128696791,116062,"AT&T, Inc., Q1 2011 Earnings Call, Apr 20, 2011",2011-04-20,"Earnings Calls","AT&T Inc.","Executives","Yes, let me add a couple of thoughts, John, on that same subject and then I'll talk a little bit about our prepaid. One of the interesting things in the quarter to add to what Rick has said is that our momentum for sales actually increased throughout the",262,"Yes, let me add a couple of thoughts, John, on that same subject and then I'll talk a little bit about our prepaid. One of the interesting things in the quarter to add to what Rick has said is that our momentum for sales actually increased throughout the quarter. What we saw happen early in January, when the iPhone was announced to go to another carrier, is customers took notice, waited to see what was going to happen and once they compared, and they understood that on our network the iPhone works faster, that it has simultaneous voice and data, and it works in over 220 countries, I think they made their choice, and we saw that increase in the February and March timeframe. So we're very pleased with the momentum. I think the customers understand the trade-offs, and they're making their choices. And I'm very, very pleased that our marketing message got through, and that we maintain and actually grew momentum throughout the quarter. In terms of prepaid, we continue to look at a number of things in prepaid. You probably saw that we just announced our first smartphone on prepaid with LG. It's a low-end smartphone on the prepaid market. We think that there is the same level of interest in that market for data in a prepaid product. So we've launched it, and we think we have high hopes that, that will stimulate prepaid demand. But we continue to look at all or other kinds of aspects of the prepaid business to grow it, but to grow it profitably."
100231,128696791,116062,"AT&T, Inc., Q1 2011 Earnings Call, Apr 20, 2011",2011-04-20,"Earnings Calls","AT&T Inc.","Operator","Our next question is from Michael Rollins with Citi Investment Research.",11,"Our next question is from Michael Rollins with Citi Investment Research."
100231,128696791,116062,"AT&T, Inc., Q1 2011 Earnings Call, Apr 20, 2011",2011-04-20,"Earnings Calls","AT&T Inc.","Analysts","I wanted to just follow up on two things. First, on the business revenue side. Can you talk a little bit about how we should look at the stabilization in Enterprise and small business revenue, maybe what drove that in the quarter? And is this the turning",105,"I wanted to just follow up on two things. First, on the business revenue side. Can you talk a little bit about how we should look at the stabilization in Enterprise and small business revenue, maybe what drove that in the quarter? And is this the turning point where maybe in the next few quarters, we could start to see some sequential growth take shape? And on the other side of the Global business segment, wholesale looked like it took a step down in the quarter. If could you talk a little bit more about what happened on that part of the Global business revenue?"
100231,128696791,116062,"AT&T, Inc., Q1 2011 Earnings Call, Apr 20, 2011",2011-04-20,"Earnings Calls","AT&T Inc.","Executives","Thanks, Mike. This is John. A couple of things with regard to the Enterprise space revenues. After taking into account the sale of our Japanese local asset business, we did see the stabilization and the trend. I think for us, it's the movement towards the",265,"Thanks, Mike. This is John. A couple of things with regard to the Enterprise space revenues. After taking into account the sale of our Japanese local asset business, we did see the stabilization and the trend. I think for us, it's the movement towards the IP and the strategic services which is helping us trend that. We have not planned for an economic turnaround, but, as that occurs, we will see those trends improve throughout this year and into next year. And I guess our viewpoint would be that we would hope for positive revenue in that area in 2012. On a longer-term basis, we believe it to be a GDP or GDP-plus type business. On the small business side, the opportunities there are really in the data side in our IP DSLAM strategy, where we've got about 50% of our central office covered with the IP DSLAM capabilities, which is allowing us to provide some really competitive products in the data area. When you combine that with our unique position to provide mobile services, we believe we are seeing some traction in the small business area. But that has been tempered by the fact that business formations in that space are just really challenged right now. That's an economic matter that, I think, any participant in the market is dealing with. Lastly, on the wholesale side, we just continue to see challenges on all aspects of that business as our customers continue to trim their networks and look for efficiency. And that's an area that we'll continue to focus on as we go forward."
100231,128696791,116062,"AT&T, Inc., Q1 2011 Earnings Call, Apr 20, 2011",2011-04-20,"Earnings Calls","AT&T Inc.","Executives","Mike, this is Rick. I think just a couple of points I'd add, on the wholesale side and the wholesale numbers you're looking at, I think as we kind of disclose the breakdown of our business segments, we include, we group wholesale along with federal and go",267,"Mike, this is Rick. I think just a couple of points I'd add, on the wholesale side and the wholesale numbers you're looking at, I think as we kind of disclose the breakdown of our business segments, we include, we group wholesale along with federal and government, education and medical segments of the business. And so if you just look at our pure wholesale portion of the business, we've seen some improvement there. And, in fact, we've seen some nice results driven to a large degree by providing Ethernet transport to cell sites for other carriers, but we are seeing some weakness in the government areas of the business. On the federal side, federal revenues are still growing year-over-year. But the growth rate in this quarter declined, and I think, at least to some degree, that has to do with budget issues in Washington that are causing different agencies to tighten their belts a little bit. And that, of course, in the state area, the budget pressures there are having an impact. But wholesale by itself is moving along pretty well. When you put it all together, our expectation as we go forward in this year, will be to see improvement in the revenue trends on a year-over-year basis, and we expect to see that as we move into the second, third and fourth quarters. I think the extent of that improvement and, certainly, the point in time when we get back to positive revenue growth in business is heavily dependent on the strength of the economy as we go forward in the balance of this year."
100231,128696791,116062,"AT&T, Inc., Q1 2011 Earnings Call, Apr 20, 2011",2011-04-20,"Earnings Calls","AT&T Inc.","Operator","Our next question is from David Barden with Bank of America Merrill Lynch.",13,"Our next question is from David Barden with Bank of America Merrill Lynch."
100231,128696791,116062,"AT&T, Inc., Q1 2011 Earnings Call, Apr 20, 2011",2011-04-20,"Earnings Calls","AT&T Inc.","Analysts","Just questions. Number one, if we could return to the Wireline margin question, obviously, you guys highlighted a couple of qualitative issues. Can we talk a little bit more about quantification in the quarter of maybe some of the seasonal step ups in the",164,"Just questions. Number one, if we could return to the Wireline margin question, obviously, you guys highlighted a couple of qualitative issues. Can we talk a little bit more about quantification in the quarter of maybe some of the seasonal step ups in the storm costs and how we should think about that margin, maybe lifting back up in the coming quarters? I mean, this was the first time in, I think, maybe 10 quarters that we actually saw the total value expenses go up rather than down. And then I guess the second question maybe, Ralph, just on the ARPU side, could you talk a little bit about at this stage of the game, what's driving ARPU? Is it getting the feature phone subs into that $15 price tier? Was it really about selling these $50 iPhones and upselling guys who are already in the integrated device tier up to the smartphone level? What's really with the mechanics behind where ARPU's going today?"
100231,128696791,116062,"AT&T, Inc., Q1 2011 Earnings Call, Apr 20, 2011",2011-04-20,"Earnings Calls","AT&T Inc.","Executives","Greg, this is John Stephens. On the first issue you had with the margins, quantifying the first quarter storm-related cost over time, maintenance repairs and some of the payroll tax issues, it's about 100 basis points or about $150 million. And so, we wou",130,"Greg, this is John Stephens. On the first issue you had with the margins, quantifying the first quarter storm-related cost over time, maintenance repairs and some of the payroll tax issues, it's about 100 basis points or about $150 million. And so, we would expect that's included in this first quarter, and we would expect things to improve and grow margins going forward. Couple of other things that you were seeing that we're dealing with is with growth in our U-verse business, while very positive and a good story and good overall growth, brings with it some lower margins from our legacy products. I think you're familiar with that. But we do expect to see continued improvement in margins throughout the year. I'll hand the other question over to Ralph."
100231,128696791,116062,"AT&T, Inc., Q1 2011 Earnings Call, Apr 20, 2011",2011-04-20,"Earnings Calls","AT&T Inc.","Executives","David, the thing that is driving ARPU is our fundamental strategy to continue to move customers into smartphones with higher revenue data plans. So what we did this quarter, which worked extremely well, was to offer customers lower our price options to ge",120,"David, the thing that is driving ARPU is our fundamental strategy to continue to move customers into smartphones with higher revenue data plans. So what we did this quarter, which worked extremely well, was to offer customers lower our price options to get into a smartphone, not just from the point of view of the price plans but also the device pricing. The iPhone 3GS at $49 is selling very well. We also have the HTC Inspire and the Motorola Atrix, two brand-new Android devices that are selling very, very well. So what you see, are people that are stepping up from quick-messaging devices and feature phones and stepping up to the higher data plans, and that's what's driving ARPU."
100231,128696791,116062,"AT&T, Inc., Q1 2011 Earnings Call, Apr 20, 2011",2011-04-20,"Earnings Calls","AT&T Inc.","Analysts","And if I could just quick follow up, Ralph. I know you guys shared smartphone penetration of the base this quarter. Can you share the integrated device penetration this quarter, which I think is something you guys have been sharing for the last couple of",46,"And if I could just quick follow up, Ralph. I know you guys shared smartphone penetration of the base this quarter. Can you share the integrated device penetration this quarter, which I think is something you guys have been sharing for the last couple of years?"
100231,128696791,116062,"AT&T, Inc., Q1 2011 Earnings Call, Apr 20, 2011",2011-04-20,"Earnings Calls","AT&T Inc.","Executives","I think that the integrated device penetration stayed approximately about the same level as we did last quarter. So we increased smartphones to integrated devices that are approximately the same level as they did last quarter, and we grew the overall smar",53,"I think that the integrated device penetration stayed approximately about the same level as we did last quarter. So we increased smartphones to integrated devices that are approximately the same level as they did last quarter, and we grew the overall smartphone base at the same time. So that's very positive for us."
100231,128696791,116062,"AT&T, Inc., Q1 2011 Earnings Call, Apr 20, 2011",2011-04-20,"Earnings Calls","AT&T Inc.","Operator","Our next question is from Craig Moffetwith Sanford Bernstein.",9,"Our next question is from Craig Moffetwith Sanford Bernstein."
100231,128696791,116062,"AT&T, Inc., Q1 2011 Earnings Call, Apr 20, 2011",2011-04-20,"Earnings Calls","AT&T Inc.","Executives","Greg, in terms of consumer versus Enterprise, we've had very good success on the Enterprise side, both in CRUs and IRUs. Our customers in the Enterprise side, of course, are just following this wave of growth that we're seeing with smartphones and, specif",180,"Greg, in terms of consumer versus Enterprise, we've had very good success on the Enterprise side, both in CRUs and IRUs. Our customers in the Enterprise side, of course, are just following this wave of growth that we're seeing with smartphones and, specifically, tablets. So we're very pleased with their results, and they complement the growth that we have seen in the consumer markets. So all that other metrics that we've talked about, overall, are doing as well or maybe a little bit better on the Enterprise side. So we're very, very happy with the Enterprise results. In terms of the porting ratios, porting ratios since the beginning of the year and through the iPhone released to another competitor have actually gone up after our customers made their choices and started re-upping the contracts and signing up in what turns out to be a record quarter for smartphone sales. So we're very pleased with the performance of our Enterprise business, and we're also very pleased with the uptick in the porting ratios that we have seen subsequent to the launch."
100231,128696791,116062,"AT&T, Inc., Q1 2011 Earnings Call, Apr 20, 2011",2011-04-20,"Earnings Calls","AT&T Inc.","Executives","No, we do not provide that data publicly, Craig.",9,"No, we do not provide that data publicly, Craig."
100231,128696791,116062,"AT&T, Inc., Q1 2011 Earnings Call, Apr 20, 2011",2011-04-20,"Earnings Calls","AT&T Inc.","Operator","Our next question is from Mike McCormack with Nomura Securities.",10,"Our next question is from Mike McCormack with Nomura Securities."
100231,128696791,116062,"AT&T, Inc., Q1 2011 Earnings Call, Apr 20, 2011",2011-04-20,"Earnings Calls","AT&T Inc.","Analysts","Rick, I'll test your math knowledge one more time before you step down. Just thinking about wireless margins, and we strip out the impact of Alltel and Centennial, it looks like cash costs were up about $1 billion year-over-year and, obviously, you have y",99,"Rick, I'll test your math knowledge one more time before you step down. Just thinking about wireless margins, and we strip out the impact of Alltel and Centennial, it looks like cash costs were up about $1 billion year-over-year and, obviously, you have your 2 million additional smartphones, including iPhones. But could you just helps us understand maybe the differences in SAT between an iPhone and a regular smartphone? And then just maybe secondarily, the impact of Verizon getting the iPhone with their marketing or advertising, is that sort of a one-time expense that you expect to go away?"
100231,128696791,116062,"AT&T, Inc., Q1 2011 Earnings Call, Apr 20, 2011",2011-04-20,"Earnings Calls","AT&T Inc.","Executives","I'm sorry, Mike. What was the last part of your question?",12,"I'm sorry, Mike. What was the last part of your question?"
100231,128696791,116062,"AT&T, Inc., Q1 2011 Earnings Call, Apr 20, 2011",2011-04-20,"Earnings Calls","AT&T Inc.","Analysts","When we think about that $1 billion cost increase year-over-year, how much of that is just incremental SAT related to smartphones and iPhones versus spending in advertising and marketing because of the Verizon iPhone coming online?",36,"When we think about that $1 billion cost increase year-over-year, how much of that is just incremental SAT related to smartphones and iPhones versus spending in advertising and marketing because of the Verizon iPhone coming online?"
