"companyid","keydevid","transcriptid","headline","mostimportantdateutc","keydeveventtypename","companyname","speakertypename","componenttextpreview","word_count","componenttext"
279513,183283589,296583,"CenterPoint Energy, Inc., Q1 2012 Earnings Call, May 03, 2012",2012-05-03,"Earnings Calls","CenterPoint Energy, Inc.","Executives","Thank you, Tracy. Low gas prices were the story in the midstream business, but our pipeline performed as expected and our Field Services unit continues to grow. Let me begin with our Pipelines business. Operating income was $60 million, a decline of $16 m",1226,"Thank you, Tracy. Low gas prices were the story in the midstream business, but our pipeline performed as expected and our Field Services unit continues to grow. Let me begin with our Pipelines business. Operating income was $60 million, a decline of $16 million from the first quarter of 2011. Total revenues of $13 million were due primarily to the expiration of a backhaul agreement on our Carthage to Perryville pipeline in midyear 2011. The warm winter also affected loads across our system with lower than normal and considerably lower than the first quarter of last year. Low gas prices and significantly compressed basis spreads adversely affected our office and sales. The combined effect of these two factors produced about a $3 million decline compared to the same quarter last year. We don't expect that having to change much until we see return of occasional basis spreads and gas price volatility on our market areas. 
On a positive note, we saw improved results in our ancillary services, which increased by about $3 million over the first quarter 2011. As you may know, ancillary services include natural gas processing and treating, as well as balancing services like parking loans or PALs. Processing margins continue to be strong due to an increase in volumes of high BTU content gas coming into our pipelines from liquids-rich plays in East Texas and Northwest Louisiana. PALs also provided improved results in the first quarter. 
As you may recall, we restructured and extended our agreements with our natural gas distribution facilities in 2010. Due to the seasonal structure in these agreements, results for the first quarter of 2012 led to increase of about $4 million compared to the same quarter last year. These agreements became effective in March 2011. And so for the balance of this year, we expect comparable results to last year. 
Our operations and maintenance expenses increased by about $7 million compared to the first quarter of 2011. However, last year's result included a favorable settlement of an insurance claim that reduced our operations and maintenance fixed messages by about $4 million. Equity earnings from our investment in the Southeast Supply Header, a joint venture with Spectra, was $6 million in 2012, a $2 million increase from the first quarter of the prior year. A restructuring and extended contract within an anchor shipper near the end of 2011 will result in an improvement especially this 2012 operating results. 
Now I'll turn to the Field Services first quarter results. Operating income from our Field Services business increased by $11 million to $47 million compared to the first quarter of 2011. Despite low natural gas prices, our revenues and margins remained strong, clearly highlighting the value of our fee-based contracting strategy, which emphasizes volume commitments and guarantee returns on our capital deployed. Total gathering volumes for the quarter increased by nearly 30% or 237 billion cubic feet in 2012 across our entire gathering network. More than 70% of those volumes came from the Haynesville, Fayetteville and Woodford shale plays. Average shale throughput across our system grew 2.6 billion cubic feet per day for the quarter compared to 2 billion cubic feet per day during the first quarter of 2011. Volumes from our Haynesville Shale gathering system in North Louisiana averaged over 1.1 billion cubic feet per day in the first quarter of 2012. These volumes reflect throughput from shale and Encana production, as well as third-party shippers on the systems and is slightly down from the fourth quarter. But the higher margins from the increasing gathering throughput was partially offset by significant decline in natural gas prices, which reduced our margins for sales of retained natural gas by approximately $6 million compared to the first quarter of last year. 
Our average realized price per gas was nearly $1.25 lower than the first quarter 2011 and nearly $0.50 lower than last quarter. These low gas prices, if sustained, will adversely impact our full-year results. 
Operation and maintenance expenses declined primarily as a result of ongoing efforts to reduce rental expenses for compression and treating facilities. However, new assets put into place to replace these rentals, combined with new facilities built handoff Haynesville shale growth resulted in increases and depreciation and taxes other than income. Late last year, Waskom, our processing joint venture, placed a 30 million -- 35 million cubic feet per day claim expansion into service that included greater liquids offloading capabilities, and new reloading facility, which provides either access to premium liquids markets for Waskom customers. Equity earnings from our 50% share of Waskom were $3 million, an increase of $1 million over the first quarter of 2011. 
Now I'd like to take a few minutes to discuss what the midstream businesses are focused on this year. As I mentioned earlier, we're seeing a significant activity in the liquids-rich natural gas areas. Both the pipelines and self services were actively pursuing several opportunities in and around our footprint including the Cana/Woodford in Western Oklahoma, the Mississippi line in Northern Oklahoma and Southern Kansas, and the Cotton Valley play in East Texas. 
We have a presence near this place, as well as access to end-use markets and to the Perryville hub, which we believe makes us an attractive option to the producers developing these areas. Our pipelines are also well positioned to capture opportunities from power generation customers. There are 22 gas-fired power plants currently attached to our system, of which, more than half are under contract for firm services in excess of 800 million cubic feet per day. We're in active discussions to increase contracted levels as gas power generation becomes more of a base load rather than a peaking load for the electric power markets. 
We recently filed to amend our Centerpoint Energy gas transmission tariff with the Federal Energy Regulatory Commission through our customers that choose the Perryville hub as a delivery and receipt point rather than specific points within the hub. Currently we filed the application with the Intercontinental Exchange, or ICE, to make the Perryville hub a trading point for ICE transactions. We believe our customers will find it beneficial to be able to use ICE to settle their physical transactions. These actions, along with the fact that we have significant interconnectivity with other pipelines and storage assets with them, we'll provide our customers with added flexibility. 
In addition, we continue to develop great strategies for two interstate pipelines. More specifically, in order to address the increased costs on our pipeline today, we have initiated a settlement process with customers for a new tariff structure on our Mississippi river transmission pipeline. This proposed rate structure will not only update our cost of service, but provides a tracking mechanism for recovering costs associated with environmental and safety regulations. 
Much like our Pipeline group, our Field Services group is pursuing liquid-rich opportunities within the reach of our gathering and processing footprint. We are also finding that the current low gas price environment is presenting new opportunities to acquire producer-owned gathering systems, as well as to partner with producers as they conduct their initial development in new shale plays. We recognize that we're currently operating in a challenging natural gas environment. However, we're pleased with the overall performance for our midstream business. 
With that, I'll turn the call over to Joe McGoldrick, President of our Competitive Energy Services business."
279513,183283589,296583,"CenterPoint Energy, Inc., Q1 2012 Earnings Call, May 03, 2012",2012-05-03,"Earnings Calls","CenterPoint Energy, Inc.","Executives","Thank you, Greg. Our Energy Services business an active quarter in which we positioned the business for the future. After adjusting for the timing-related variances of mark-to-market accounting and the write-down of the inventory to lower of cost for mark",407,"Thank you, Greg. Our Energy Services business an active quarter in which we positioned the business for the future. After adjusting for the timing-related variances of mark-to-market accounting and the write-down of the inventory to lower of cost for market, operating income declined by $6 million from the same quarter of last year. Two major contributors to the decline were the mild weather and the low gas prices as discussed by the other business Presidents. The mild weather caused lower usage by our commercial customers and the low gas price, low volatility market environment had the effect of compressing unit margins. 
Although the financial results were down, it was not unexpected, and there were several positive developments during the quarter. First, margins from seasonal storage spreads have improved and we should realize better fourth quarter results. For example, margins that averaged $0.50 to $0.60 per MMBTU last year are averaging $0.70 to $0.80 this year with some recent deals exceeding $1. Next, the strategic repositioning we implemented last year is gaining traction. That strategy involved a greater focus in growing our retail business and a corresponding reduction of fixed cost by rightsizing our pipeline transportation capacity used to serve retail customers. As an indicator of our progress, our retail commercial business grew in both customer additions and throughput in the first quarter despite the challenging environment. We added over 2,500 customers since the first quarter of last year, a 21% increase. 1,400 of the new customers came from an acquisition we made late last year and 1,100 from our existing markets. Also, through our fixed cost reduction strategy, we have either not renewed or negotiated early releases of uneconomic capacity. These actions will reduce our fixed costs and improve our margins as the year progresses. In 2012 alone, we will see approximately $15 million of fixed cost savings. 
Going forward, we expect that this strategic realignment will yield better and more stable results consistent with CenterPoint's investment thesis. Moreover, we continue to see viable investment opportunities at CES' intrastate pipeline through customer interconnects as the growth appears to be very robust in the petrochemical and other energy-intensive industries in the Gulf Coast. 
In conclusion, we are pleased with our progress. We believe the business has turned the corner to once again become a contributor to CenterPoint Energy's earnings growth. 
And with that, I will now turn the call over to Gary Whitlock, Executive Vice President and CFO."
279513,183283589,296583,"CenterPoint Energy, Inc., Q1 2012 Earnings Call, May 03, 2012",2012-05-03,"Earnings Calls","CenterPoint Energy, Inc.","Executives","Thank you, Joe, and good morning to everyone. Today, I would like to discuss a few items with you. First, I'd like to provide you with an update on the use of cash we received from the sale of the transition bonds in January. As I mentioned last quarter,",432,"Thank you, Joe, and good morning to everyone. Today, I would like to discuss a few items with you. First, I'd like to provide you with an update on the use of cash we received from the sale of the transition bonds in January. As I mentioned last quarter, in addition to paying off our outstanding commercial paper borrowings of approximately $200 million, we reacquired tax exempt debt as a parent company with a principal amount of $375 million, and a weighted average interest rate of 5.4%. In addition to these actions on April 1, we retired approximately $46 million of maturing tax exempt debt in Houston Electric with a coupon of 3.625%. In total, we have paid down debt by more than $600 million, which will result in a reduction in interest expense in 2012 of approximately $19 million or $0.03 per diluted share. Our objective for the remaining $1-plus billion in cash is to have our businesses invest the money in accretive, long-term projects and we are working diligently to do so. 
We continue to receive questions about our financing strategy for our midstream business, especially whether or not we intend to form an MLP. As we have previously said, the key variable for us is ensuring that we have visible long-term growth opportunities that merit the formation and use of an MLP. 
Now let me discuss our 2012 earnings guidance. This morning in our earnings release, we reaffirmed our estimate for earnings in the range of $1.08 to $1.20 per diluted share. As previously discussed, we have developed our earnings guidance range by using a number of variables such as commodity prices, volume throughput, weather, regulatory proceedings and our effective tax rate. Clearly, the extremely mild winter weather and low natural gas prices have been negatives to earnings in the first quarter. On the other hand, the earnings performance of Houston Electric and a lower effective tax rate have been positive. We have taken into account the benefit of the debt reductions I mentioned earlier. However, we have not assumed any additional uses of our cash in developing these earnings range. As the year progresses, we will keep you updated on our earnings expectations. 
And finally, I would like to remind you of the 0.2025 per share quarterly dividend declared by our Board of Directors on April 26. We believe our dividend actions continue to demonstrate a strong commitment to our shareholders and the confidence of the Board of Directors in our ability to deliver sustainable earnings and cash flow. I will now turn the call back to Marianne."
279513,183283589,296583,"CenterPoint Energy, Inc., Q1 2012 Earnings Call, May 03, 2012",2012-05-03,"Earnings Calls","CenterPoint Energy, Inc.","Executives","Thank you, Gary. And with that, we will now open the call to questions. [Operator Instructions] Beverly, would you please give the instructions on how to ask the questions?",29,"Thank you, Gary. And with that, we will now open the call to questions. [Operator Instructions] Beverly, would you please give the instructions on how to ask the questions?"
279513,183283589,296583,"CenterPoint Energy, Inc., Q1 2012 Earnings Call, May 03, 2012",2012-05-03,"Earnings Calls","CenterPoint Energy, Inc.","Operator","[Operator Instructions] Our first question comes from the line of Carl Kirst with CenterPoint Energy.",15,"[Operator Instructions] Our first question comes from the line of Carl Kirst with CenterPoint Energy."
279513,183283589,296583,"CenterPoint Energy, Inc., Q1 2012 Earnings Call, May 03, 2012",2012-05-03,"Earnings Calls","CenterPoint Energy, Inc.","Analysts","Good job. I'll expect the check in the mail. Sorry, a couple of quick questions on Field Services, if I could. And last call, we were targeting the Mississippi line just because of the lack of infrastructure that was sort of early days. I didn't know as t",78,"Good job. I'll expect the check in the mail. Sorry, a couple of quick questions on Field Services, if I could. And last call, we were targeting the Mississippi line just because of the lack of infrastructure that was sort of early days. I didn't know as that area kind of continues to crop up on several competitor's radar screen. How you are currently seeing progress in that area, if there's any further color you can add there?"
279513,183283589,296583,"CenterPoint Energy, Inc., Q1 2012 Earnings Call, May 03, 2012",2012-05-03,"Earnings Calls","CenterPoint Energy, Inc.","Executives","Carl, this is Greg. We've announced there a project in that area called White Eagle a couple months ago and to garner some traction. We continue to discuss with several producers about that project. What we're finding is some of the larger producers that",87,"Carl, this is Greg. We've announced there a project in that area called White Eagle a couple months ago and to garner some traction. We continue to discuss with several producers about that project. What we're finding is some of the larger producers that have more than acreage have to defer their RFP processes to midyear to end of the year. And so we're kind of still in sync with what's going on, on the timing there. But we are very actively pursuing that Mississippi line area."
279513,183283589,296583,"CenterPoint Energy, Inc., Q1 2012 Earnings Call, May 03, 2012",2012-05-03,"Earnings Calls","CenterPoint Energy, Inc.","Analysts","Okay. No, I appreciate that. And then just a follow-up on Field Services. Can I just want to make sure I understand if there are any nuances to be aware of? Sequentially, as we look from fourth quarter of '11 to first quarter, the volume seem to be very m",100,"Okay. No, I appreciate that. And then just a follow-up on Field Services. Can I just want to make sure I understand if there are any nuances to be aware of? Sequentially, as we look from fourth quarter of '11 to first quarter, the volume seem to be very much intact. The EBIT is obviously down. One of the easy things is the retained fuel will lower gas prices. That didn't seem to me that, that would be the whole of it. And I just want to make sure there isn't anything else there going on to be aware of?"
279513,183283589,296583,"CenterPoint Energy, Inc., Q1 2012 Earnings Call, May 03, 2012",2012-05-03,"Earnings Calls","CenterPoint Energy, Inc.","Executives","Well, I think on a -- for the top line, definitely fuel, the $0.50 difference from fourth quarter to first quarter on the same amount of retained gas is going to drive several million dollars there in and of itself. The other is, those expenses are great.",96,"Well, I think on a -- for the top line, definitely fuel, the $0.50 difference from fourth quarter to first quarter on the same amount of retained gas is going to drive several million dollars there in and of itself. The other is, those expenses are great. We had volumes and projects at the very end of last year, so we'll have a little bit higher expenses. And then, I mean at EBIT level, I mean not EBITDA, but we are, we kick in depreciation at the beginning of the year as well on those assets."
279513,183283589,296583,"CenterPoint Energy, Inc., Q1 2012 Earnings Call, May 03, 2012",2012-05-03,"Earnings Calls","CenterPoint Energy, Inc.","Analysts","Okay. Okay. And then just actually one other question if I could. Are you guys okay with breaking out on CES sort of the retail and wholesale components going forward or for the first quarter I should say?",38,"Okay. Okay. And then just actually one other question if I could. Are you guys okay with breaking out on CES sort of the retail and wholesale components going forward or for the first quarter I should say?"
279513,183283589,296583,"CenterPoint Energy, Inc., Q1 2012 Earnings Call, May 03, 2012",2012-05-03,"Earnings Calls","CenterPoint Energy, Inc.","Executives","Carl, this is David. We really don't look at that business now as retail versus wholesale. We have some wholesale asset, these transportation assets and storage assets, but they're really designed to serve our retail customer base. So we really look at th",80,"Carl, this is David. We really don't look at that business now as retail versus wholesale. We have some wholesale asset, these transportation assets and storage assets, but they're really designed to serve our retail customer base. So we really look at this as a pure retail business that we do optimize around those assets and have made money in the past, but we don't really ow think about that as a separate division or line of business within CES."
279513,183283589,296583,"CenterPoint Energy, Inc., Q1 2012 Earnings Call, May 03, 2012",2012-05-03,"Earnings Calls","CenterPoint Energy, Inc.","Operator","Your next question is coming from Ali Agha with SunTrust.",10,"Your next question is coming from Ali Agha with SunTrust."
279513,183283589,296583,"CenterPoint Energy, Inc., Q1 2012 Earnings Call, May 03, 2012",2012-05-03,"Earnings Calls","CenterPoint Energy, Inc.","Analysts","David, in the past you had mentioned to us, as you were thinking about the use of cash that you would look for opportunities, be disciplined. But as summer rolled around and you had not seen opportunities, you'd reassess what the plans were going to be. S",134,"David, in the past you had mentioned to us, as you were thinking about the use of cash that you would look for opportunities, be disciplined. But as summer rolled around and you had not seen opportunities, you'd reassess what the plans were going to be. So I just wanted to get a little more insight on that thinking? And the debt pay down, I see that, but the kind of returns, 5% of there about -- I'm assuming you are expecting a higher return from the remaining $1.1 billion or so of cash? So we are getting close to the middle of the year. Can you just tell us what is the opportunity out there if it's not these services? Is it more regular than the utility? What should we be looking for?"
279513,183283589,296583,"CenterPoint Energy, Inc., Q1 2012 Earnings Call, May 03, 2012",2012-05-03,"Earnings Calls","CenterPoint Energy, Inc.","Executives","Ali, we are and we did talk about midyear this year. We gave you an update around the opportunities we see, and we still plan to do that on our next call. But we're pursuing a number of opportunities particularly in the midstream area right now. We're see",167,"Ali, we are and we did talk about midyear this year. We gave you an update around the opportunities we see, and we still plan to do that on our next call. But we're pursuing a number of opportunities particularly in the midstream area right now. We're seeing a lot of things pop up, whether it's opportunities to buy some existing assets from producers or whether it's to respond to RFPs that were -- to put in new infrastructure. But I would expect by the next call, we're going to have insight around our opportunities there and whether or not we're going to think we're going to be successful. As Greg mentioned, we don't control the timing of a lot of these things. I think the producer, if they pull an RFP and push it off until the fourth quarter, we can't control that. But I think we will have more insight the next time we talk and we intended to give you more color on that."
279513,183283589,296583,"CenterPoint Energy, Inc., Q1 2012 Earnings Call, May 03, 2012",2012-05-03,"Earnings Calls","CenterPoint Energy, Inc.","Analysts","And one follow-up. Excluding that use of that cash, if you just look at your existing portfolio, both the regulated, nonregulated and the opportunities and the growth embedded in there, what kind of EPS growth rate do you believe this portfolio can genera",53,"And one follow-up. Excluding that use of that cash, if you just look at your existing portfolio, both the regulated, nonregulated and the opportunities and the growth embedded in there, what kind of EPS growth rate do you believe this portfolio can generate for you off this 2012 base you've given us?"
279513,183283589,296583,"CenterPoint Energy, Inc., Q1 2012 Earnings Call, May 03, 2012",2012-05-03,"Earnings Calls","CenterPoint Energy, Inc.","Executives","Our internal target is we want to grow EPS by 4% to 6% annually. It can be a little lumpy in there. But we think this -- we have the kind of opportunities to do that. You heard both Scott and Tracy talk about rate-based growth at the electric side, it's 4",101,"Our internal target is we want to grow EPS by 4% to 6% annually. It can be a little lumpy in there. But we think this -- we have the kind of opportunities to do that. You heard both Scott and Tracy talk about rate-based growth at the electric side, it's 4%. On the gas distribution side, it's 6%. So in and of itself, I think from the pure regulated businesses, we're going to have some good growth there. But the -- we'll need to have some growth in the midstream business to achieve the upper end of that growth range."
279513,183283589,296583,"CenterPoint Energy, Inc., Q1 2012 Earnings Call, May 03, 2012",2012-05-03,"Earnings Calls","CenterPoint Energy, Inc.","Analysts","And just to be clear, not factoring in anything from that extra $1 billion in cash or is that also incorporated in there?",23,"And just to be clear, not factoring in anything from that extra $1 billion in cash or is that also incorporated in there?"
