"companyid","keydevid","transcriptid","headline","mostimportantdateutc","keydeveventtypename","companyname","speakertypename","componenttextpreview","word_count","componenttext"
296957,548809534,1400988,"Pinnacle West Capital Corporation, Q4 2017 Earnings Call, Feb 23, 2018",2018-02-23,"Earnings Calls","Pinnacle West Capital Corporation","Operator","Greetings, and welcome to the Pinnacle West Capital Corporation Fourth Quarter and Full-Year Earnings Conference Call. [Operator Instructions] As a reminder, this conference is being recorded. It is now my pleasure to introduce your host, Stefanie Layton,",47,"Greetings, and welcome to the Pinnacle West Capital Corporation Fourth Quarter and Full-Year Earnings Conference Call. [Operator Instructions] As a reminder, this conference is being recorded. It is now my pleasure to introduce your host, Stefanie Layton, Director Investor Relations. Thank you, Miss Leighton, you may begin."
296957,548809534,1400988,"Pinnacle West Capital Corporation, Q4 2017 Earnings Call, Feb 23, 2018",2018-02-23,"Earnings Calls","Pinnacle West Capital Corporation","Executives","Thank you, Doug. I would like to thank everyone for participating in this conference call and webcast to review our fourth quarter and full-year 2017 earnings, recent developments and operating performance. Our speakers today will be our Chairman and CEO,",235,"Thank you, Doug. I would like to thank everyone for participating in this conference call and webcast to review our fourth quarter and full-year 2017 earnings, recent developments and operating performance. Our speakers today will be our Chairman and CEO, Don Brandt; and our CFO, Jim Hatfield; jeff Guldner, APS's Executive Vice President of Public Policy; and Mark Schiavoni, APS's Chief Operating Officer, are also here with us. First, I need to cover a few details with you. The slides that we will be using are available on our Investor Relations website, along with our earnings release and related information. Note that the slides contain reconciliations of certain non-GAAP financial information. Today's comments on our slides contain forward-looking statements based on current expectations and the company assumes no obligation to update these statements. Because actual results may differ materially from expectations, we caution you not to place undue reliance on these statements. Our 2017 Form 10-K was filed this morning. Please refer to that document for forward-looking statements, cautionary language as well as the Risk Factors and MD&A sections, which will identify risks and uncertainties that could cause actual results to differ materially from those contained in our disclosures. A replay of this call will be available shortly on our website for the next 30 days. It will also be available by telephone through March 2nd. I would now turn the call over to Don."
296957,548809534,1400988,"Pinnacle West Capital Corporation, Q4 2017 Earnings Call, Feb 23, 2018",2018-02-23,"Earnings Calls","Pinnacle West Capital Corporation","Executives","Thanks, Stephanie, and thank you all for joining us today. 2017 was a strong year for our company financially, operationally and in the areas of safety and public policy. After increasing the dividend in October for the 6th straight year, we completed 2",796,"Thanks, Stephanie, and thank you all for joining us today. 2017 was a strong year for our company financially, operationally and in the areas of safety and public policy. 
After increasing the dividend in October for the 6th straight year, we completed 2017 with earnings exceeding expectations. Jim will discuss the financial results. My comments will focus on our 2017 highlights in the year ahead. Our fleet continued to perform well in 2017. Palo Verde generating station completed another outstanding year of carbon-free electricity production, generating 32.3 million-megawatt hours of energy. It's also notable that the team of Palo Verde has completed each of the scheduled 2017 spring and fall refuelings and maintenance outages in 30 days. This is the first time in plant's history when both outages were completed and 30 days. Our generation fleet continues to evolve by integrating additional clean energy and by focusing on meeting our peak demand. The 2017 request for proposal for heating capacity resources concluded with a power purchase agreement for 65 megawatts of solar with 50 megawatts of battery storage. This will be one of our largest battery storage systems in the country. Although, APS has recognized that it's the national leader in the solar energy with more than a gigawatt of solar power on our system, this next step toward battery storage will ensure that sun helps power Arizona homes into the early evening when our customer demand for electricity peaks. The facility is expected to begin serving customers in 2021. 
Our investments are focused both on additional clean energy resources and the technology necessary to support these resources. 
Our 2017 operations benefited from the robust technology investments, that were further strengthening our electric system, increased efficiency of our operations and improved our customers' experience. Among the most significant improvements were the implementation of a new advanced distribution management system, or ADMS, and customer information system. ADMS has increased our ability to control the grid remotely, while the customer information system has increased our ability to respond to customers. 
Our continued investment in system improvements has resulted in other tangible customer benefits. In 2017, we achieved top quartile distribution reliability metrics and had the best summer reliability in 5 years, despite the hot and demanding whether. APS also remains top best for safety performance as compared to our pure electric utilities. The transmission and distribution organization had its safest year ever. The safety of our men and women is our top priority. It's indicative not only of our commitment to our people but it also reflects our commitment to operational excellence. 
We'll continue to strive for 0, a truly injury-free workplace. Turning to the regulatory fund. 
A positive and collaborative outcome of our rate review was a milestone accomplishment in 2017. The Arizona Corporations Commission's decision clearly demonstrates Arizona's interest in capitalizing on the changing dynamics of the electric utility industry and meeting the evolving needs of our customers. We will continue this progress in 2018 as our customers transition to the new rates. Although the rate review is complete, there are a number of public policy items to be decided in 2018. A step increase request for the SCR environmental control project at Four Corners will be filed in April. And the commission's expected to vote on the 2018 demand-side management plan, and yesterday, the commission approved a $119 million of bill induction for customers based on federal corporate tax reductions. The savings from the tax reductions will be passed directly to customers through the tax expense adjustor mechanism, a new adjustor mechanism that was included in our 2017 rate review. 
We intend to file a subsequent application with the commission later this year and pass through additional savings from the federal tax reform to our customers. 
In addition, discussions continue on ways to economically integrate more clean energy resources statewide without jeopardizing reliability or magnifying the over generation challenges in the middle of the day. 
For 2018, our strategic priority is centered around consumer engagement, flexible resources, employees and innovation. Specifically, we plan to deliver consumer-driven programs and services, develop new initiatives that leverage our core capabilities, adopt sustainable programs that support our people and integrate new technologies to enhance performance reliability and the overall experience of our customers. These priorities align with our mission of safely and efficiently delivering energy to meet the changing needs of our customers. In summary, we achieved another year of outstanding performance as we focus on delivering on our commitments for the customers who depend on us, the communities we serve, our dedicated employees and the shareholders who trust us with their investment. 
For 2018, we have clear priorities and alignment amongst the senior leadership that execute selectively on these priorities. I'll now turn the call over to Jim."
296957,548809534,1400988,"Pinnacle West Capital Corporation, Q4 2017 Earnings Call, Feb 23, 2018",2018-02-23,"Earnings Calls","Pinnacle West Capital Corporation","Executives","Thank you, Don. And thank you, again, everyone, for joining us today. This morning, we reported our financial results for the fourth quarter and full year 2017. As you can see on Slide 3, the materials. We had a solid year. Before I review the details o",1370,"Thank you, Don. And thank you, again, everyone, for joining us today. This morning, we reported our financial results for the fourth quarter and full year 2017. 
As you can see on Slide 3, the materials. We had a solid year. Before I review the details of our 2017 results, let me briefly touch on some of the key factors from the quarter. 
For the fourth quarter of 2017, we were at $0.19 per share compared to $0.47 per share for the fourth quarter of 2016. Slide 4 outlines the variances which drove the decrease in our quarterly earnings. Looking at adjusted gross margin, the rate increase, higher sales-related revenue and transmission revenue were all positive contributions. 
As we anticipated, higher adjusted operations and maintenance expense in the fourth quarter of 2017 compared to the 2016, decreased earnings, largely due to the higher planned outage costs related to the SCR installation that Four Corners advised. Not turning your attention to Slide 5, I'll review some highlights of our full year results. We delivered strong results in 2017 that exceeded our guidance range of $4.15 to $4.30, earning $4.35 per share compared to $3.95 per share in 2016. 
Actual results were higher than projected due, in part, to effective cost management and higher revenues. 
Gross margin was a key driver in 2017 with the key core components. The rate increase that went into effect on August 19, 2017, contributed $0.30. Note, however, that there were related increases in operating expenses that partially offset the benefit of gross margin. 
Higher sales-related revenue added $0.13 to gross margin in 2017, driven by customer growth and higher average affected prices. 
Transmission and LFCR revenues also continued to add incremental growth to our gross margin, and combined, contributed $0.31 per share. 
Looking next at operating expenses. Operations and maintenance expense was up slightly in 2017 compared to 2016, and decreased earnings by $0.03 per share, primarily due to higher employee benefit and information technology costs, partially offset by lower Palo Verde operating cost and lower powerful generating costs. Higher depreciation and amortization expenses was the largest offset for 2017 earnings compared to 2016. The increase was primarily related to plant additions and includes a $61 million annual increase in D&A rates approved in 2016 great review order. Other taxes were higher in 2017 relative to 2016, reflecting higher property value and the impacts related to the amortization of a property tax referral as part of the 2017 rate review order. Lastly, higher interest expense, net of AFUDC, reduced earnings in 2016 compared to 2016. This included higher interest charges due to higher allowances, partially offset by higher construction work in progress balances contributed to AFUDC. As you know, Arizona's continues to be an integral part of our investment pieces. I'll cover some of the trends we are seeing in our overall economy. The Metro Phoenix area continues to show job growth among above the national average, assuming the upper panel on Slide 6. Through December, employment in Metro Phoenix increased 4% compared to 1.3% for the entire U.S. This above average job growth is broad-based and driven largely by tourism, healthcare, manufacturing, finance and construction. The Metro Phoenix unemployment rate of 3.7% also reflects the strength of the job market. Arizona's political and community leaders continue supporting economic development. 
Recently, Nicola Motor Company announced it would move its headquarters and build a new $1 billion manufacturing plant West of Phoenix. This moment is expected to bring 2,000 jobs in the Metro area with construction set to begin this year. This is one example of the ongoing business expansion and related job growth in the Phoenix market. Metro Phoenix also had growth in the red venture on real estate market. As you can see on the lower panel on Slide 6, housing construction is expected to continue the upward post-recession trend, for new single-family homes in 2017 were the highest level since 2007. The activity in the market is providing meaningful support to home prices, which have returned to the levels last seen in early 2008. We believe that solid job growth and low mortgage rates should allow the Metro Phoenix housing market and the economy, more generally, to continue to expand at this pace over the next couple of years. 
Reflecting this day improvement in economic conditions, APS's retail customer base grew 1.8% in 2017, which is also the highest growth rate since 2007. We expect that this growth rate will continue to gradually accelerate and respond to the economic growth trends I just discussed. Before my long-term fundamental supporting future population job growth and the economic development in Arizona appear to be in place. Switching topics to our financing activities. On November 30, Pinnacle West issued $300 million of 3-year 2.25% senior unsecured notes. The net proceeds were used to repay Pinnacle West $125 million term loans, and for general corporate purposes. In 2018, we expect to issue up to $600 million of long-term debt at APS. Overall, liquidity remains strong. At the end of the fourth quarter, Pinnacle West had $95 million short-term debt outstanding, and APS had no short-term borrowings outstanding. 
A quick note on pension. The funded staff from our pension remains healthy at 95% as of year-end 2017. This is largely due to the continued success of our liability-driven investment strategy. 
Turning to our earning trends and financial outlook. As shown on Slide 7, we expect Pinnacle West consolidated earnings for 2018 will now be in the range of $4.35 per share to $4.55 per share, up $0.10 from $4.25 to $4.45 per share. This increase in guidance is supported by our coordination of our cost management and variable cost trends, coupled with accelerated solid gross margin forecasts. Our earnings outlook also incorporates financial impacts from tax reform, including the tax expense adjuster mechanism, which was approved in last year's rate review in the lower effective tax rate. 
This rate increase or adjustor mechanism in sales growth remain important gross margins, which we expect, will be partially offset by higher fossil-planned outage costs and higher other operating expense related to more plant and service, including higher D&A and property taxes. 
As a reminder, we have higher fossil plant outage costs in the first half of 2018, including the 9 and 5 day SGR installation of Four Corners for planned outages at our gas plants such as Red Hawk. As updated -- an updated list of the key factors and assumptions underlying our revived 2018 outlook is concluded in the appendix to our slides. Also included in today's materials, you will see that we have extended our capital expenditures and rate-based forecast due to 2020. We increase our capitalize miniatures forecasts from 2019 to $1.15 billion and we anticipate APS's spend to be around $1.2 billion in 2020. With this capital spending level, we expect our databases to continue to grow at an average annual rate of 6% to 7%, although individual years may vary. 
Before closing, I'll take a few minutes to walk to the impacts of tax reform. With the various effects or mix, our balance, we view the impacts of the Tax Cut and Jobs Act as favorable. Most notably, the preservation of interest and property tax deductions from a regulated utility. The reform will also release some questions. The corporate tax rate reduction to 21%, beginning at 2018, results in $1.1 billion of excess deferred tax and regulatory liability of $1.5 billion, after the required revenue grows up for APS. Other than new tax provision, the majority of these excess deferred taxes are subject to IRS normalization provisions. During 2018, we will be working with our federal state regulators to determine the period over which to return this excess deferred tax to customers. We go back dispatching materials earnings impact from the tax reform package, especially given the minimal parent level debt. From a rate base perspective, our preliminary estimates share incremental rate base increasing approximately $150 million per year in 2018 and 2019, as a result of both the lower tax rate and the legislative changes related to tax depreciation. This concludes our prepared remarks. I'll now turn the callback over to the operator for questions."
296957,548809534,1400988,"Pinnacle West Capital Corporation, Q4 2017 Earnings Call, Feb 23, 2018",2018-02-23,"Earnings Calls","Pinnacle West Capital Corporation","Operator","[Operator Instructions] Your first question comes from the line of Gregory Gordon with Evercore.",14,"[Operator Instructions] Your first question comes from the line of Gregory Gordon with Evercore."
296957,548809534,1400988,"Pinnacle West Capital Corporation, Q4 2017 Earnings Call, Feb 23, 2018",2018-02-23,"Earnings Calls","Pinnacle West Capital Corporation","Analysts","So looking at the drivers for the financial outlook for 2018, it appears that the only meaningful change in the near term is that AFUDC is higher by -- and that explains the, all thing equal, the move up in the range. Is that correct, and if so, can you j",60,"So looking at the drivers for the financial outlook for 2018, it appears that the only meaningful change in the near term is that AFUDC is higher by -- and that explains the, all thing equal, the move up in the range. Is that correct, and if so, can you just give us in our brief explanation as to why?"
296957,548809534,1400988,"Pinnacle West Capital Corporation, Q4 2017 Earnings Call, Feb 23, 2018",2018-02-23,"Earnings Calls","Pinnacle West Capital Corporation","Executives","Yes, so that's one driver and it's really driven by the fact that we expect more construction work in progress in 2018 over 2017. But I think what's also the vast is in electric gross margin where the big driver estimate was due to tax reform, but also, w",94,"Yes, so that's one driver and it's really driven by the fact that we expect more construction work in progress in 2018 over 2017. But I think what's also the vast is in electric gross margin where the big driver estimate was due to tax reform, but also, we show higher retail revenue in there as well. We finished the year at 1.9% customer growth, 1.8% for the year. So we're seeing continued improvement in that economy. And although we did not change the O&M range, we expect to have lower O&M in 2018."
296957,548809534,1400988,"Pinnacle West Capital Corporation, Q4 2017 Earnings Call, Feb 23, 2018",2018-02-23,"Earnings Calls","Pinnacle West Capital Corporation","Analysts","Okay, so within the ranges for electric gross margin and O&M, even though you didn't change them, all things equal, so you're better inside those ranges than you were before?",30,"Okay, so within the ranges for electric gross margin and O&M, even though you didn't change them, all things equal, so you're better inside those ranges than you were before?"
296957,548809534,1400988,"Pinnacle West Capital Corporation, Q4 2017 Earnings Call, Feb 23, 2018",2018-02-23,"Earnings Calls","Pinnacle West Capital Corporation","Executives","That's right, we see continuation of effective cost controls.",10,"That's right, we see continuation of effective cost controls."
296957,548809534,1400988,"Pinnacle West Capital Corporation, Q4 2017 Earnings Call, Feb 23, 2018",2018-02-23,"Earnings Calls","Pinnacle West Capital Corporation","Analysts","And that gross margin improvement, that's due to the changes in the rate design that are allowing you to -- you have historically given us sort of spread between what you would expect to be gross revenue or gross customer growth and sort of net revenue gr",53,"And that gross margin improvement, that's due to the changes in the rate design that are allowing you to -- you have historically given us sort of spread between what you would expect to be gross revenue or gross customer growth and sort of net revenue growth, [indiscernible] you've some improvement in that?"
296957,548809534,1400988,"Pinnacle West Capital Corporation, Q4 2017 Earnings Call, Feb 23, 2018",2018-02-23,"Earnings Calls","Pinnacle West Capital Corporation","Executives","I think it's due to higher sales. We expect 1.5 -- 1% to 1.5% in 2018 and we are seeing higher realized prices in the last half of '17.",30,"I think it's due to higher sales. We expect 1.5 -- 1% to 1.5% in 2018 and we are seeing higher realized prices in the last half of '17."
296957,548809534,1400988,"Pinnacle West Capital Corporation, Q4 2017 Earnings Call, Feb 23, 2018",2018-02-23,"Earnings Calls","Pinnacle West Capital Corporation","Analysts","Okay, and then there's been some debate amongst investors on how to think about, structurally, how your earnings power grows through time, especially when it gets [indiscernible] 2020, now given us rate-based number, which help. But I just -- to be clear,",121,"Okay, and then there's been some debate amongst investors on how to think about, structurally, how your earnings power grows through time, especially when it gets [indiscernible] 2020, now given us rate-based number, which help. But I just -- to be clear, when you give your guidance, we should assume that you're still targeting a return on parent of 9.5% or better? And is that to be consistent through 2020, and we shouldn't be obsessing about the equity layer in the utility business, rate base number, the notional equity value, but more model -- models here beat your capital structure and model to whether or not we believe that, given these drivers, you can earn 95% or better on parent equity?"
296957,548809534,1400988,"Pinnacle West Capital Corporation, Q4 2017 Earnings Call, Feb 23, 2018",2018-02-23,"Earnings Calls","Pinnacle West Capital Corporation","Executives","Correct, nothing's changed in our investment pieces.",7,"Correct, nothing's changed in our investment pieces."
296957,548809534,1400988,"Pinnacle West Capital Corporation, Q4 2017 Earnings Call, Feb 23, 2018",2018-02-23,"Earnings Calls","Pinnacle West Capital Corporation","Operator","Our next question comes from the line of Julien Dumoulin-Smith with Bank of America.",15,"Our next question comes from the line of Julien Dumoulin-Smith with Bank of America."
296957,548809534,1400988,"Pinnacle West Capital Corporation, Q4 2017 Earnings Call, Feb 23, 2018",2018-02-23,"Earnings Calls","Pinnacle West Capital Corporation","Analysts","So a couple of quick questions. First, on the CapEx update, obviously constructive here. Can you elaborate a little bit on what the precise pieces are. I know good modernization is something that's earned its amount of attention. How fully baked are the n",92,"So a couple of quick questions. First, on the CapEx update, obviously constructive here. Can you elaborate a little bit on what the precise pieces are. I know good modernization is something that's earned its amount of attention. How fully baked are the numbers that you're presenting here relative to the potential in the medium-term here? As well as any potential incremental soul opportunity that may have emerged out of the RFP, et cetera, just whether in the future whether you acquire them or otherwise, just want to be clear about that?"
296957,548809534,1400988,"Pinnacle West Capital Corporation, Q4 2017 Earnings Call, Feb 23, 2018",2018-02-23,"Earnings Calls","Pinnacle West Capital Corporation","Executives","So the big driver is really on the distribution side and that's really driven by modernization of the grid, reliability and then really growth. We have 21 substations, new substations planned over the next 3 years. So that's as a sign of the -- comparing",57,"So the big driver is really on the distribution side and that's really driven by modernization of the grid, reliability and then really growth. We have 21 substations, new substations planned over the next 3 years. So that's as a sign of the -- comparing for future growth as well. So those are the big drivers."
296957,548809534,1400988,"Pinnacle West Capital Corporation, Q4 2017 Earnings Call, Feb 23, 2018",2018-02-23,"Earnings Calls","Pinnacle West Capital Corporation","Analysts","Got it, but it's relatively fully reflected in the numbers as?",11,"Got it, but it's relatively fully reflected in the numbers as?"
