"companyid","keydevid","transcriptid","headline","mostimportantdateutc","keydeveventtypename","companyname","speakertypename","componenttextpreview","word_count","componenttext"
296957,557928058,1445556,"Pinnacle West Capital Corporation, Q1 2018 Earnings Call, May 02, 2018",2018-05-02,"Earnings Calls","Pinnacle West Capital Corporation","Executives","So Paul, November is a political talk -- [indiscernible] year away, so a lot can happen between now, and then. The most critical aspect on this ballot initiative is big if whether qualifies for the ballot or not. And hence, we'll take it 1 step at that ti",83,"So Paul, November is a political talk -- [indiscernible] year away, so a lot can happen between now, and then. The most critical aspect on this ballot initiative is big if whether qualifies for the ballot or not. And hence, we'll take it 1 step at that time going forward. So we're actively opposing it, and pretty much universally across the business community. People understand the implications that are all negative for Arizona, for our customers and basically all that residents of Arizona."
296957,557928058,1445556,"Pinnacle West Capital Corporation, Q1 2018 Earnings Call, May 02, 2018",2018-05-02,"Earnings Calls","Pinnacle West Capital Corporation","Analysts","Okay. Fair enough. And just we've seen some M&A activity out there, and I'm sure you guys have been watching this as well. Just any thoughts about what you're seeing there in terms of what some of these companies are going for? And -- I don't know, some c",105,"Okay. Fair enough. And just we've seen some M&A activity out there, and I'm sure you guys have been watching this as well. Just any thoughts about what you're seeing there in terms of what some of these companies are going for? And -- I don't know, some cases deployed and just to review your own balance sheet? How attractive you guys might be? I don't know, any thoughts that we might have? Or any thoughts you guys have -- excuse me, in terms of how -- what you're seeing out there? Any sort of -- any insights you might have with respect to that?"
296957,557928058,1445556,"Pinnacle West Capital Corporation, Q1 2018 Earnings Call, May 02, 2018",2018-05-02,"Earnings Calls","Pinnacle West Capital Corporation","Executives","Well, just as you do, we stay abreast on what's going on out there. And every transaction is unique to that -- those companies involved in that particular transactions. And I'll just leave it at that.",36,"Well, just as you do, we stay abreast on what's going on out there. And every transaction is unique to that -- those companies involved in that particular transactions. And I'll just leave it at that."
296957,557928058,1445556,"Pinnacle West Capital Corporation, Q1 2018 Earnings Call, May 02, 2018",2018-05-02,"Earnings Calls","Pinnacle West Capital Corporation","Operator","We have reached the end of the question-and-answer session. And I now like to turn the floor back over to management for closing comments.",25,"We have reached the end of the question-and-answer session. And I now like to turn the floor back over to management for closing comments."
296957,557928058,1445556,"Pinnacle West Capital Corporation, Q1 2018 Earnings Call, May 02, 2018",2018-05-02,"Earnings Calls","Pinnacle West Capital Corporation","Executives","Thank you for joining us today. This concludes our call.",10,"Thank you for joining us today. This concludes our call."
296957,557928058,1445556,"Pinnacle West Capital Corporation, Q1 2018 Earnings Call, May 02, 2018",2018-05-02,"Earnings Calls","Pinnacle West Capital Corporation","Operator","Ladies and gentlemen, this does conclude today's teleconference. You may now disconnect your lines at this time. Thank you for your participation, and have a wonderful day.",27,"Ladies and gentlemen, this does conclude today's teleconference. You may now disconnect your lines at this time. Thank you for your participation, and have a wonderful day."
296957,557928058,1445722,"Pinnacle West Capital Corporation, Q1 2018 Earnings Call, May 02, 2018",2018-05-02,"Earnings Calls","Pinnacle West Capital Corporation","Operator","Greetings, and welcome to the Pinnacle West Capital Corporation 2018 First Quarter Earnings Conference Call. [Operator Instructions] As a reminder, this conference is being recorded. It is now my pleasure to introduce your host, Stefanie Layton, Director",45,"Greetings, and welcome to the Pinnacle West Capital Corporation 2018 First Quarter Earnings Conference Call. [Operator Instructions] As a reminder, this conference is being recorded. It is now my pleasure to introduce your host, Stefanie Layton, Director of Investor Relations. Thank you. You may begin."
296957,557928058,1445722,"Pinnacle West Capital Corporation, Q1 2018 Earnings Call, May 02, 2018",2018-05-02,"Earnings Calls","Pinnacle West Capital Corporation","Executives","Thank you, Christine. I would like to thank everyone for participating in this conference call and webcast to review our first quarter earnings, recent developments and operating performance. Our speakers today will be our Chairman and CEO, Don Brandt; ou",234,"Thank you, Christine. I would like to thank everyone for participating in this conference call and webcast to review our first quarter earnings, recent developments and operating performance. Our speakers today will be our Chairman and CEO, Don Brandt; our CFO, Jim Hatfield. Jeff Guldner, APS' Executive Vice President of Public Policy; and Daniel Fletcher, APS' Executive Vice President of Operations are also here with us. First, I need to cover some details with you. The slides that we will be using are available on our Investor Relations website, along with our earnings release and related information. Note that the slides contain reconciliations of certain non-GAAP financial information. Today's comments and our slides contain forward-looking statements based on our current expectations, and the company assumes no obligation to update these statements. Because actual results may differ materially from expectations, we caution you not to place undue reliance on these statements. Our first quarter 2018 Form 10-Q was filed this morning. Please refer to that document for forward-looking statements, cautionary language as well as the risk factors and MD&A sections, which identify risks and uncertainties that could cause actual results to differ materially from those contained in our disclosures. A replay of this call will be available shortly on our website for the next 30 days. It will also be available by telephone through May 9. I will now turn the call over to Don."
296957,557928058,1445722,"Pinnacle West Capital Corporation, Q1 2018 Earnings Call, May 02, 2018",2018-05-02,"Earnings Calls","Pinnacle West Capital Corporation","Executives","Thanks, Stefanie, and thank you all for joining us today. In the first quarter of 2018, we executed on our priorities and remain well positioned for a solid year. Before Jim discusses the details of our first quarter results, I'll provide a few updates on",954,"Thanks, Stefanie, and thank you all for joining us today. In the first quarter of 2018, we executed on our priorities and remain well positioned for a solid year. Before Jim discusses the details of our first quarter results, I'll provide a few updates on our recent regulatory and operational developments. The installation of selective catalytic reduction, or SCR, emission control equipment at the Four Corners Power Plant was completed on April 24, on time and under budget. This project provides substantial environmental benefits, including a 90% reduction in nitrogen oxide emissions at the plant. On April 27, we filed for a $67.5 million step increase to recover our investment in these improvements. The step increase is an effective tool that eliminates the need to file a full rate review immediately after the conclusion of our last rate review, and provides rate gradualism for our customers. The commission previously approved the use of a step increase for the SCR installation. We've calculated that the step increase request would result in approximately a 2% customer bill increase, which will likely be offset by a reduction in customer bills from other adjustor mechanism decreases. We've requested the commission approve the rate increase effective January 1, 2019. 
Turning to our operations. Palo Verde generating station had another successful quarter, operating at full capacity. A planned refueling outage for Palo Verde Unit 3 began on April 7, and is proceeding very well. Additionally, construction activity is on track for our Ocotillo Modernization Project. The units in Ocotillo are expected to come online in the fall of 2018 and the spring of 2019 to meet our 2019 summer capacity needs. 
Technology continues to play an important role in the efficiency of our operations. In 2012, APS became one of the first utilities in the nation to receive approval from the Federal Aviation Administration to fly drones in shared aerospace. Since then, the use of drones for inspecting lines, building substations, monitoring solar fields, [ bedding ] new power lines, inspecting storm damage and accessing hard-to-reach areas has produced significant savings for our customers. 
Looking to the future. Our resource plan is designed to achieve a cleaner, sustainable energy mix that is anchored by Palo Verde, the largest carbon-free electric resource in the United States. In fact, we've already reached a significant milestone in this effort. At the end of 2017, over 50% of our energy mix was carbon-free. Our next integrated resource plan filings scheduled for April 2020 will continue to support the goal of achieving a cleaner, sustainable energy mix, and we'll incorporate updates as the commission's discussion around a possible energy modernization plan progresses. 
We recently announced our plan to issue multiple resource RFPs this year. On April 26, we issued an RFP for 400 to 800 megawatts of peaking capacity, with an in-service date of 2021. The peak period is between June and September and from 3 p.m. to 9 p.m. We also plan to seek competitive proposals that utilize Arizona forest bioenergy solutions and that provide battery retrofit opportunities for APS on solar facilities. These RFPs are part of a comprehensive effort to meet our resource needs, beginning in the early 2020s. More specific information about these solicitations will be released in the coming weeks. 
As you may be aware, an out-of-state group primarily funded by California billionaire, Tom Steyer, has filed a ballot initiative that would require some Arizona utilities to obtain 50% of their energy from renewable sources by 2030. The sponsors must gather approximately 226,000 ballot signatures by July 5 to place the proposal on a November 2018 ballot. This initiative is overly prescriptive and irresponsible. Pinnacle West is actively opposing this ballot proposal. The initiative seeks to impair Arizona's oversight and regulation of utilities, which has provided Arizona residents with some of the safest, cleanest and most reliable and affordable energy in the country over 100 years. And with enshrining in the state constitution, a regulatory mandate which is bad for customers, potentially doubling the average customers' electricity bill by 2030. At least 13 Chambers of Commerce, including the greater Phoenix Chamber of Commerce and the Arizona Chamber of Commerce, in addition to numerous other local organizations, have voiced opposition to the ballot initiative. The sponsor's campaign contains inaccurate information about clean energy, its economic impacts to the state and the cost to customers. We believe it's important for customers to have accurate information to make an informed decision, if this proposal is on the November ballot. As a company that's dedicated to not only providing safe, reliable and affordable electricity but also to maintaining and improving the communities we serve, we will continue to actively oppose this proposal. 
Lastly, I would like to share with you that crews from Arizona Public Service who were part of a nationwide mutual assistance effort, coordinated by the Edison Electric Institute, to assist Puerto Rico with power restoration following Hurricane Maria. We sent 83 line workers and support staff as well as 42 vehicles to Puerto Rico in mid-January. When our crews returned on March 31, restoration on the island had reached 95%. Crew members who took this special assignment are proud to have helped. Throughout their deployment, they did more than just restore power. On their own time and their days off, they immersed themselves in the community, helping to clean up storm damage, rebuilding homes and providing household essentials to families in need. One of our crew members even bought a bicycle for a child so that he can ride with other neighborhood children. I'm extremely proud of how each and every one of these individuals represented our company in the state of Arizona. I'll now turn the call over to Jim."
296957,557928058,1445722,"Pinnacle West Capital Corporation, Q1 2018 Earnings Call, May 02, 2018",2018-05-02,"Earnings Calls","Pinnacle West Capital Corporation","Executives","Thank you, Don, and thank you, again, everyone, for joining us today. This morning, we reported our financial results for the first quarter of 2018, which were in line with our expectations as shown on Slide 3 of the materials. For the first quarter of 20",1004,"Thank you, Don, and thank you, again, everyone, for joining us today. This morning, we reported our financial results for the first quarter of 2018, which were in line with our expectations as shown on Slide 3 of the materials. For the first quarter of 2018, we earned $0.03 per share compared to $0.21 per share in the first quarter of 2017. Slide 3 also outlines the variances that drove the change in our quarterly ongoing earnings per share. I'll highlight a few of the key drivers. Adjusted gross margin was up $0.13 per share compared with the prior year first quarter period, supported by the rate increase, higher transmission revenues and higher sales-related revenues. These positive factors were partially offset by the effect of a federal tax rate change and unfavorable weather. 
Specific to tax reform, the financial impact decreased gross margin by $0.20 per share in the first quarter of 2018, including a reduction in customer rates passed through our tax expense adjustor mechanism, or TEAM. And as [ may ] reduction is always the maintenance income tax changes in our wholesale transmission rates. You will notice there is not an offsetting effective tax rate driver initiative for the quarter. To refund the customers through the TEAM is based on a per kilowatt hour sales credit and will generally follow our seasonal kilowatt hour sales pattern. The impact of the lower federal income tax rate is based on pretax earnings and more closely aligned with our core pretax earnings pattern. As a result, there will be a timing difference throughout the year. 
Looking out to operating expenses. Higher adjusted operations and maintenance expense decreased earnings by $0.18 per share, primarily due to higher planned outage cost related to the SCR installation at Four Corners Unit 4. Depreciation and amortization expenses were higher in the first quarter of 2018 compared to the first quarter of 2017, reducing earnings by $0.09 per share. The increase was primarily related to the higher D&A rates approved in a 2017 rate review order and planned additions. Also, on Slide 3, you will see a new quarterly driver related to pension and other postretirement benefits, nonservice credits. We adopted the new [ pitch in ] accounting standard in January, resulting in the presentation of nonservice credit component and other income. In addition, we are no longer capitalizing a portion of the nonservice credits. 
In 2018, the change in capitalization, combined with the increased returns, increased pretax income by approximately $7 million in the first quarter. As a reminder, in the 2017 rate review order, we were granted accounting deferral related to Four Corners SCR's installation and the Ocotillo Modernization Project. The drivers I discussed account for the deferral associated with the Four Corners SCRs as there was no net impact on our first quarter 2018 results. 
Turning now to the Arizona economy as it continues to be an integral part of our business story. Arizona Metro Phoenix continues to be an attractive place to live and do business. Arizona's population surpassed 7 million in 2017 and Maricopa County has been ranked as the fastest-growing county in the nation for the past 2 years. The Metro Phoenix area continues to show job growth above the national average. This February, employment in Metro Phoenix increased 2.8% compared to 1.5% for the entire U.S. The Metro Phoenix unemployment rate of 4.4% also reflects the strength of the job market. This solid job growth continues to have a positive effect on Metro Phoenix area's commercial and residential real estate markets. 
As seen in the upper panel of Slide 4, vacancy rates in the commercial markets continue to fall, and are at levels last seen in 2008 or earlier. As a result of the increasing activity and lower vacancy rates, about 6 million square feet of new industrial space was under construction at the end of Q1. Additionally, about 4 million square feet of new office and retail space was under construction at the end of the quarter as well. We expect a continuation of business expansion and related job growth in the Phoenix market, which will, in turn, support continued commercial development. Metro Phoenix has also had growth in the residential real estate market. As you can see in the lower panel of Slide 4, housing construction is expected to continue the upward post-recession trend. In 2018, housing permits are expected to increase by about 4,000 compared to 2017, driven by single-family permits. To reduce -- reflecting the steady improvement in economic conditions, APS has retail customer base grew 1.7% in the first quarter of 2018. We expect that this growth rate will continue to gradually accelerate in response to the economic growth trends I just discussed. 
In closing, I will review our earnings guidance and financial outlook. We continue to expect Pinnacle West consolidated earnings for 2018 will be in the range of $4.35 to $4.55 per share. The rate increase, our adjustment mechanism and sales growth will remain important gross margin drivers, which we expect will be partly offset by higher fossil plant outage cost and higher other operating expenses related to more plant in-service, including higher D&A and property tax. As a reminder, we have higher fossil plant outage cost in the first half of 2018. A complete list of key factors and assumptions underlying our guidance is included in the appendix to our slides, which had been revised to reflect the changes to guidance related to the adoption of the new pension and other postretirement benefit accounting standards I discussed earlier. 
We continue to expect to issue up to $600 million of long-term debt at APS this year, and overall liquidity remains very strong. Our rate base growth outlook remains at 6% to 7% on average through 2020. The company also continues to expect to achieve an annual consolidated earnings return on average common equity of more than 9.5% through 2019. This concludes our prepared remarks. I'll now turn the call back over to the operator for questions."
296957,557928058,1445722,"Pinnacle West Capital Corporation, Q1 2018 Earnings Call, May 02, 2018",2018-05-02,"Earnings Calls","Pinnacle West Capital Corporation","Operator","[Operator Instructions] Our first question comes from the line of Julien Dumoulin-Smith with Bank of America.",16,"[Operator Instructions] Our first question comes from the line of Julien Dumoulin-Smith with Bank of America."
296957,557928058,1445722,"Pinnacle West Capital Corporation, Q1 2018 Earnings Call, May 02, 2018",2018-05-02,"Earnings Calls","Pinnacle West Capital Corporation","Analysts","So I just wanted to understand a little bit more about the O&M situation. As you roll forward into '19 and '20, because I know that you've talked about before some of the other outages and upgrades that are going on, can you just elaborate a little bit an",77,"So I just wanted to understand a little bit more about the O&M situation. As you roll forward into '19 and '20, because I know that you've talked about before some of the other outages and upgrades that are going on, can you just elaborate a little bit and perhaps give us a little bit of a preview on how you're thinking about the cadence of the O&M normalizing off this higher figure, if you will?"
296957,557928058,1445722,"Pinnacle West Capital Corporation, Q1 2018 Earnings Call, May 02, 2018",2018-05-02,"Earnings Calls","Pinnacle West Capital Corporation","Executives","Go for it.",3,"Go for it."
296957,557928058,1445722,"Pinnacle West Capital Corporation, Q1 2018 Earnings Call, May 02, 2018",2018-05-02,"Earnings Calls","Pinnacle West Capital Corporation","Executives","So we'll be done with major work in Four Corners. And we've gone through really 2 to 3 years here where we've had increased outages preparing for the SCRs as well as the combined cycle. As we get beyond 2018, we will expect, with Navajo closing for one th",85,"So we'll be done with major work in Four Corners. And we've gone through really 2 to 3 years here where we've had increased outages preparing for the SCRs as well as the combined cycle. As we get beyond 2018, we will expect, with Navajo closing for one thing next year, and just more normal run rate on the coal units, you're going to see that more normalized outage O&M be in that $40 million, $45 million range, which we had prior to 2016."
296957,557928058,1445722,"Pinnacle West Capital Corporation, Q1 2018 Earnings Call, May 02, 2018",2018-05-02,"Earnings Calls","Pinnacle West Capital Corporation","Analysts","Got it. Right. So the normalized level being more of the '13 to '15 range rather than the '16, '17, '18, as you said?",24,"Got it. Right. So the normalized level being more of the '13 to '15 range rather than the '16, '17, '18, as you said?"
296957,557928058,1445722,"Pinnacle West Capital Corporation, Q1 2018 Earnings Call, May 02, 2018",2018-05-02,"Earnings Calls","Pinnacle West Capital Corporation","Executives","Yes, correct.",2,"Yes, correct."
296957,557928058,1445722,"Pinnacle West Capital Corporation, Q1 2018 Earnings Call, May 02, 2018",2018-05-02,"Earnings Calls","Pinnacle West Capital Corporation","Analysts","Got it. And actually, you brought up another dynamic in your last remark. Can you comment a little bit on the dynamic to keep Navajo open? There were some recent media indications that there was some potential hope there but can you elaborate on that? And",81,"Got it. And actually, you brought up another dynamic in your last remark. Can you comment a little bit on the dynamic to keep Navajo open? There were some recent media indications that there was some potential hope there but can you elaborate on that? And obviously, it seems like a small detail to you but is there any interest in maintaining any megawatts on a contractor basis or otherwise? And/or would you receive proceeds if this were actually to happen?"
296957,557928058,1445722,"Pinnacle West Capital Corporation, Q1 2018 Earnings Call, May 02, 2018",2018-05-02,"Earnings Calls","Pinnacle West Capital Corporation","Executives","Julien, it's Jeff. So the Navajo situation is obviously being led by SRPs instead of operator of the power plant. And so there's been a lot of activity over the last year on that but I don't think the current situation has changed. I think there's an effo",78,"Julien, it's Jeff. So the Navajo situation is obviously being led by SRPs instead of operator of the power plant. And so there's been a lot of activity over the last year on that but I don't think the current situation has changed. I think there's an effort going to see if they could continue to operate that plant after the other owners have left but we're just watching that continue to develop. It's really an SRP stance."
296957,557928058,1445722,"Pinnacle West Capital Corporation, Q1 2018 Earnings Call, May 02, 2018",2018-05-02,"Earnings Calls","Pinnacle West Capital Corporation","Operator","Our next question comes from the line of Michael Lapides with Goldman Sachs.",13,"Our next question comes from the line of Michael Lapides with Goldman Sachs."
296957,557928058,1445722,"Pinnacle West Capital Corporation, Q1 2018 Earnings Call, May 02, 2018",2018-05-02,"Earnings Calls","Pinnacle West Capital Corporation","Analysts","Guys, just curious. Don, some of the comments about the ballot initiatives, and I don't really want to go into the ballot initiative. I want to go into the economics of renewables, which is, do you see the addition of incremental renewables to your system",98,"Guys, just curious. Don, some of the comments about the ballot initiatives, and I don't really want to go into the ballot initiative. I want to go into the economics of renewables, which is, do you see the addition of incremental renewables to your system using the costs that are -- that folks either bid into PPAs as raising or lowering the all-in cost to customers right now? And then if you could think about where you think this is going over the next few years, kind of give your view on how you think that plays out."
